B000VOPGL8,Estee Lauder Beautiful Love EDP For Women  Pink  75ml,http://www.amazon.in/Fragrances/b/ref=sd_allcat_beauty_fragrance/276-6718833-1247838?ie=UTF8&node=1374298031,None,Fragranc,Women,Estee Lauder,http://ecx.images-amazon.com/images/I/41DTL1cTe6L._AA160_.jpg,None,self Colour,Beauty & Health,http://www.amazon.in/Estee-Lauder-Beautiful-Love-Women/dp/B000VOPGL8/ref=sr_1_2/278-3247231-0869634?s=beauty&ie=UTF8&qid=1395126798&sr=1-2,[<a href="/gp/help/seller/at-a-glance.html/278-3247231-0869634?ie=UTF8&amp;seller=A2NFQIUV2YGOLG">Fragume</a>],Amazon.in: Buy Estee Lauder Beautiful Love EDP For Women  Pink  75ml Online at Best Price in India | Amazon Beauty Store,Buy Estee Lauder Beautiful Love EDP For Women  Pink  75ml at lowest price in India on Amazon.in. Check out Estee Lauder Beautiful Love EDP For Women  Pink  75ml reviews  ratings  features  specifications and browse more Beauty products online at best prices on Amazon.in.,None,<div class="bucket" id="productDescription"> <h2>Product Description</h2> <div class="content"> <h3 class="productDescriptionSource"></h3> <div class="productDescriptionWrapper">        Absolutely captivating  with opulent flowers  rich spices  precious woods.              <div class="emptyClear"> </div> </div> </div> </div>,None,18:03:2014,None
B0084YC85E,Estee Lauder Pleasures Eau De Parfum for Women  100ml,http://www.amazon.in/Fragrances/b/ref=sd_allcat_beauty_fragrance/276-6718833-1247838?ie=UTF8&node=1374298031,Rs. 3 600.00,Fragranc,Women,Estee Lauder,http://ecx.images-amazon.com/images/I/41DTL1cTe6L._AA160_.jpg,Rs. 3 600.00,self Colour,Beauty & Health,http://www.amazon.in/Estee-Lauder-Pleasures-Parfum-Women/dp/B0084YC85E/ref=sr_1_3/278-3247231-0869634?s=beauty&ie=UTF8&qid=1395126798&sr=1-3,[<a class="buyAction" href="/gp/offer-listing/B0084YC85E/ref=dp_olp_0/278-3247231-0869634?ie=UTF8&amp;condition=all">these sellers</a>],Amazon.in: Buy Estee Lauder Pleasures Eau De Parfum for Women  100ml Online at Best Price in India | Amazon Beauty Store,Buy Estee Lauder Pleasures Eau De Parfum for Women  100ml at lowest price in India on Amazon.in. Check out Estee Lauder Pleasures Eau De Parfum for Women  100ml reviews  ratings  features  specifications and browse more Beauty products online at best prices on Amazon.in.,None,<div class="bucket" id="productDescription"> <h2>Product Description</h2> <div class="content"> <h3 class="productDescriptionSource"></h3> <div class="productDescriptionWrapper">        It features notes of Lilies and Violets  Roses and Peonies  with other exotic blossoms and fragrant woods. When applying any fragrance please consider that there are several factors which can affect the natural smell of your skin and in turn  the way a scent smells on you. For instance  your mood  stress level  age  body chemistry  diet  and current medications may all alter the scents you wear. Similarly  factor such as dry or oily skin can even affect the amount of time a fragrance will last after being applied.              <div class="emptyClear"> </div> </div> </div> </div>,None,18:03:2014,None
B000P250E4,Beautiful By Estee Lauder For Women. Eau De Parfum Spray 3.4 Oz.,http://www.amazon.in/Fragrances/b/ref=sd_allcat_beauty_fragrance/276-6718833-1247838?ie=UTF8&node=1374298031,Rs. 3 850.00,Fragranc,Women,Estee Lauder,http://ecx.images-amazon.com/images/I/41DTL1cTe6L._AA160_.jpg,Rs. 3 850.00,self Colour,Beauty & Health,http://www.amazon.in/Beautiful-Estee-Lauder-Women-Parfum/dp/B000P250E4/ref=sr_1_5/278-3247231-0869634?s=beauty&ie=UTF8&qid=1395126798&sr=1-5,[<a class="buyAction" href="/gp/offer-listing/B000P250E4/ref=dp_olp_0/278-3247231-0869634?ie=UTF8&amp;condition=all">these sellers</a>],Amazon.in: Buy Beautiful By Estee Lauder For Women. Eau De Parfum Spray 3.4 Oz. Online at Best Price in India | Amazon Beauty Store,Buy Beautiful By Estee Lauder For Women. Eau De Parfum Spray 3.4 Oz. at lowest price in India on Amazon.in. Check out Beautiful By Estee Lauder For Women. Eau De Parfum Spray 3.4 Oz. reviews  ratings  features  specifications and browse more Beauty products online at best prices on Amazon.in.,None,<div class="bucket" id="productDescription"> <h2>Product Description</h2> <div class="content"> <h3 class="productDescriptionSource"></h3> <div class="productDescriptionWrapper">        Its scent possesses a blend of blooming fresh cut flowers  rose  jasmine  and carnation accompanied by fruity notes of fresh citrus  melons  peaches and plum entice everybody with beautiful.              <div class="emptyClear"> </div> </div> </div> </div>,None,18:03:2014,None
B000C1Z5A2,Estee Lauder Intuition Eau De Parfum Spray for Women  100ml,http://www.amazon.in/Fragrances/b/ref=sd_allcat_beauty_fragrance/276-6718833-1247838?ie=UTF8&node=1374298031,None,Fragranc,Women,Estee Lauder,http://ecx.images-amazon.com/images/I/41DTL1cTe6L._AA160_.jpg,None,self Colour,Beauty & Health,http://www.amazon.in/Estee-Lauder-Intuition-Parfum-Spray/dp/B000C1Z5A2/ref=sr_1_14/278-3247231-0869634?s=beauty&ie=UTF8&qid=1395126798&sr=1-14,[<a href="/gp/help/seller/at-a-glance.html/278-3247231-0869634?ie=UTF8&amp;seller=A2NFQIUV2YGOLG">Fragume</a>],Amazon.in: Buy Estee Lauder Intuition Eau De Parfum Spray for Women  100ml Online at Best Price in India | Amazon Beauty Store,Buy Estee Lauder Intuition Eau De Parfum Spray for Women  100ml at lowest price in India on Amazon.in. Check out Estee Lauder Intuition Eau De Parfum Spray for Women  100ml reviews  ratings  features  specifications and browse more Beauty products online at best prices on Amazon.in.,None,<div class="bucket" id="productDescription"> <h2>Product Description</h2> <div class="content"> <h3 class="productDescriptionSource"></h3> <div class="productDescriptionWrapper">        Introduced in 2000. Fragrance notes: citrus and florals with lower notes of sweet woods and vanilla. Recommended use: daytime. When applying any fragrance please consider that there are several factors which can affect the natural smell of your skin and in turn  the way a scent smells on you. For instance  your mood  stress level  age  body chemistry  diet and current medications may all alter the scents you wear. Similarly  factor such as dry or oily skin can even affect the amount of time a fragrance will last after being applied.              <div class="emptyClear"> </div> </div> </div> </div>,None,18:03:2014,None
B001QXBWYS,Estee Lauder Pleasure EDT for Women  100ml,http://www.amazon.in/Fragrances/b/ref=sd_allcat_beauty_fragrance/276-6718833-1247838?ie=UTF8&node=1374298031,None,Fragranc,Women,Estee Lauder,http://ecx.images-amazon.com/images/I/41DTL1cTe6L._AA160_.jpg,None,self Colour,Beauty & Health,http://www.amazon.in/Estee-Lauder-Pleasure-Women-100ml/dp/B001QXBWYS/ref=sr_1_15/278-3247231-0869634?s=beauty&ie=UTF8&qid=1395126798&sr=1-15,[<a href="/gp/help/seller/at-a-glance.html/278-3247231-0869634?ie=UTF8&amp;seller=A22G8HZGXYSWPZ">Taha &amp; Bros.</a>],Amazon.in: Buy Estee Lauder Pleasure EDT for Women  100ml Online at Best Price in India | Amazon Beauty Store,Buy Estee Lauder Pleasure EDT for Women  100ml at lowest price in India on Amazon.in. Check out Estee Lauder Pleasure EDT for Women  100ml reviews  ratings  features  specifications and browse more Beauty products online at best prices on Amazon.in.,None,<div class="bucket" id="productDescription"> <h2>Product Description</h2> <div class="content"> <h3 class="productDescriptionSource"></h3> <div class="productDescriptionWrapper">        Pleasures Estee Lauder for women. Pleasures is a rich bouquet of fresh flowers after the rain  which is designed to suit "every woman in every season and at every moment". It is a delightful sheer floral created from delicate lilies and peonies  elegant jasmine and exotic Karo-Karounde blossoms  all tingling with the rare essence of exotic Baie Rose.              <div class="emptyClear"> </div> </div> </div> </div>,None,18:03:2014,None
B001GQ7NPM,ESTEE LAUDER PLEASURE FOR MEN 100ML,http://www.amazon.in/Fragrances/b/ref=sd_allcat_beauty_fragrance/276-6718833-1247838?ie=UTF8&node=1374298031,None,Fragranc,Women,Estee Lauder,http://ecx.images-amazon.com/images/I/41DTL1cTe6L._AA160_.jpg,None,self Colour,Beauty & Health,http://www.amazon.in/ESTEE-LAUDER-PLEASURE-FOR-100ML/dp/B001GQ7NPM/ref=sr_1_16/278-3247231-0869634?s=beauty&ie=UTF8&qid=1395126798&sr=1-16,[<a href="/gp/help/seller/at-a-glance.html/278-3247231-0869634?ie=UTF8&amp;seller=A22G8HZGXYSWPZ">Taha &amp; Bros.</a>],Amazon.in: Buy ESTEE LAUDER PLEASURE FOR MEN 100ML Online at Best Price in India | Amazon Beauty Store,Buy ESTEE LAUDER PLEASURE FOR MEN 100ML at lowest price in India on Amazon.in. Check out ESTEE LAUDER PLEASURE FOR MEN 100ML reviews  ratings  features  specifications and browse more Beauty products online at best prices on Amazon.in.,None,<div class="bucket" id="productDescription"> <h2>Product Description</h2> <div class="content"> <h3 class="productDescriptionSource"></h3> <div class="productDescriptionWrapper">        Pleasures For Men Estée Lauder for men. Pleasures For Men by Estée Lauder is a Aromatic Spicy fragrance for men. The nose behind this fragrance is Pierre Wargnye. Top notes are nectarine  green notes and grapefruit; middle notes are coriander  ginger  lavender  pepper  rose and geranium; base notes are sandalwood  benzoin and oakmoss.              <div class="emptyClear"> </div> </div> </div> </div>,None,18:03:2014,None
B000P22TA2,ESTEE LAUDER BEAUTIFUL FOR WOMEN 75ML,http://www.amazon.in/Fragrances/b/ref=sd_allcat_beauty_fragrance/276-6718833-1247838?ie=UTF8&node=1374298031,None,Fragranc,Women,Estee Lauder,http://ecx.images-amazon.com/images/I/41DTL1cTe6L._AA160_.jpg,None,self Colour,Beauty & Health,http://www.amazon.in/ESTEE-LAUDER-BEAUTIFUL-WOMEN-75ML/dp/B000P22TA2/ref=sr_1_11/278-3247231-0869634?s=beauty&ie=UTF8&qid=1395126798&sr=1-11,[<a href="/gp/help/seller/at-a-glance.html/278-3247231-0869634?ie=UTF8&amp;seller=A22G8HZGXYSWPZ">Taha &amp; Bros.</a>],Amazon.in: Buy ESTEE LAUDER BEAUTIFUL FOR WOMEN 75ML Online at Best Price in India | Amazon Beauty Store,Buy ESTEE LAUDER BEAUTIFUL FOR WOMEN 75ML at lowest price in India on Amazon.in. Check out ESTEE LAUDER BEAUTIFUL FOR WOMEN 75ML reviews  ratings  features  specifications and browse more Beauty products online at best prices on Amazon.in.,None,<div class="bucket" id="productDescription"> <h2>Product Description</h2> <div class="content"> <h3 class="productDescriptionSource"></h3> <div class="productDescriptionWrapper">        Beautiful Estée Lauder for women.Beautiful is a floral fragrance that was launched 1985. This is a romantic light bouquet of a thousand flowers  combined with fresh citrusy notes in the top and warm woodsy notes in the base. The top notes include rose  mandarina  lily  tuberose and marygold. The intensive floral heart is sweet  consists of orange flower  jasmine and ylang-ylang. The base notes are warm and elegant  include sandalwood and vetiver.              <div class="emptyClear"> </div> </div> </div> </div>,None,18:03:2014,None
B00BA07LUG,Estee Lauder Wood Mystique for Men And Women  100ml,http://www.amazon.in/Fragrances/b/ref=sd_allcat_beauty_fragrance/276-6718833-1247838?ie=UTF8&node=1374298031,Rs. 11 965.00,Fragranc,Women,Estee Lauder,http://ecx.images-amazon.com/images/I/41DTL1cTe6L._AA160_.jpg,Rs. 11 965.00,self Colour,Beauty & Health,http://www.amazon.in/Estee-Lauder-Mystique-Women-100ml/dp/B00BA07LUG/ref=sr_1_26/278-3247231-0869634?s=beauty&ie=UTF8&qid=1395126803&sr=1-26,[<a class="buyAction" href="/gp/offer-listing/B00BA07LUG/ref=dp_olp_0/278-3247231-0869634?ie=UTF8&amp;condition=all">these sellers</a>],Amazon.in: Buy Estee Lauder Wood Mystique for Men And Women  100ml Online at Best Price in India | Amazon Beauty Store,Buy Estee Lauder Wood Mystique for Men And Women  100ml at lowest price in India on Amazon.in. Check out Estee Lauder Wood Mystique for Men And Women  100ml reviews  ratings  features  specifications and browse more Beauty products online at best prices on Amazon.in.,None,<div class="bucket" id="productDescription"> <h2>Product Description</h2> <div class="content"> <h3 class="productDescriptionSource"></h3> <div class="productDescriptionWrapper">        Enter a world of incomparable opulence and richness. A magnificent blend of precious agar wood  an ultra-smooth  exclusive cedarwood accord as well as a fusion of natural rose extracts warmed by essence of patchouli. Elegant  mysterious  lavish.              <div class="emptyClear"> </div> </div> </div> </div>,None,18:03:2014,None
B001337LKA,Pleasures Summer Fun By Estee Lauder For Women 75 ml,http://www.amazon.in/Fragrances/b/ref=sd_allcat_beauty_fragrance/276-6718833-1247838?ie=UTF8&node=1374298031,None,Fragranc,Women,Estee Lauder,http://ecx.images-amazon.com/images/I/41DTL1cTe6L._AA160_.jpg,None,self Colour,Beauty & Health,http://www.amazon.in/Pleasures-Summer-Estee-Lauder-Women/dp/B001337LKA/ref=sr_1_39/278-3247231-0869634?s=beauty&ie=UTF8&qid=1395126803&sr=1-39,[<a href="/gp/help/seller/at-a-glance.html/278-3247231-0869634?ie=UTF8&amp;seller=A2O8H5ZZSCKU2K">Perfume Crush</a>],Amazon.in: Buy Pleasures Summer Fun By Estee Lauder For Women 75 ml Online at Best Price in India | Amazon Beauty Store,Buy Pleasures Summer Fun By Estee Lauder For Women 75 ml at lowest price in India on Amazon.in. Check out Pleasures Summer Fun By Estee Lauder For Women 75 ml reviews  ratings  features  specifications and browse more Beauty products online at best prices on Amazon.in.,None,<div class="bucket" id="productDescription"> <h2>Product Description</h2> <div class="content"> <h3 class="productDescriptionSource"></h3> <div class="productDescriptionWrapper">        Pleasures Summer Fun by Estée Lauder is a Floral fragrance for women.Pleasures Summer Fun was launched in 2008. The fragrance features peony  baie rose  lily  violet  jasmine and karo karounde.              <div class="emptyClear"> </div> </div> </div> </div>,None,18:03:2014,None
