B00EKSM8KI,Alto Vida Return To Rustic Unisex Wrap Bracelet,http://www.amazon.in/Bangles-Bracelets/b/ref=sd_allcat_fj_bangles/276-6718833-1247838?ie=UTF8&node=2152549031,Rs. 385.00,Bangles & Bracelet,Bangles & Bracelet,Alto Vida,http://ecx.images-amazon.com/images/I/41cf%2BgJpRUL._SL190_CR0 0 190 246_.jpg,Rs. 385.00,self Colour,Watches & Fashion Jewellery,http://www.amazon.in/Alto-Vida-Return-Rustic-Bracelet/dp/B00EKSM8KI/ref=sr_1_40/275-0905959-1711169?s=jewelry&ie=UTF8&qid=1395127304&sr=1-40,[<a class="buyAction" href="/gp/offer-listing/B00EKSM8KI/ref=dp_olp_0/275-0905959-1711169?ie=UTF8&amp;condition=all">these sellers</a>],Amazon.in: Buy Alto Vida Return To Rustic Unisex Wrap Bracelet at Low Prices in India | Fashion Jewellery Store,Buy Alto Vida Return To Rustic Unisex Wrap Bracelet at low prices in India at Amazon.in. Check out Alto Vida Return To Rustic Unisex Wrap Bracelet reviews  ratings  features  specifications and browse more Fashion Jewellery products online at best prices on Amazon.in.,None,<div class="bucket" id="productDescription"> <h2>Product Description</h2> <div class="content"> <h3 class="productDescriptionSource"></h3> <div class="productDescriptionWrapper">        Return to your roots by going natural in this beautiful piece made in earth colors and rustic finishing. Feel the touch of wood on your biday and feel the positive vibrations from nature through it. A hand carved bamboo hook sets off this band hand woven with soft cotton strings.              <div class="emptyClear"> </div> </div> </div> </div>,<div align="left" class="bucket" id="techSpecSoftlinesWrap"><h2>Product Specifications </h2> <div class="content"> <div id="techSpecSoftlines"> <table cellspacing="0"> <tr> <th colspan="2">Jewellery Information</th> </tr> <tr> <td class="td1">Brand</td> <td class="td2">                                             Alto Vida                                         </td> </tr> <tr> <td class="td1">Material</td> <td class="td2">                                             bamboo                                         </td> </tr> <tr> <td class="td1">Model Number</td> <td class="td2">                                             57-1                                         </td> </tr> </table> </div> </div> </div>,18:03:2014,None
B00EKSN0CS,Alto Vida Ojo Mojo Unisex Wrap Bracelet,http://www.amazon.in/Bangles-Bracelets/b/ref=sd_allcat_fj_bangles/276-6718833-1247838?ie=UTF8&node=2152549031,Rs. 400.00,Bangles & Bracelet,Bangles & Bracelet,Alto Vida,http://ecx.images-amazon.com/images/I/41cf%2BgJpRUL._SL190_CR0 0 190 246_.jpg,Rs. 400.00,self Colour,Watches & Fashion Jewellery,http://www.amazon.in/Alto-Vida-Mojo-Unisex-Bracelet/dp/B00EKSN0CS/ref=sr_1_39/275-0905959-1711169?s=jewelry&ie=UTF8&qid=1395127304&sr=1-39,[<a class="buyAction" href="/gp/offer-listing/B00EKSN0CS/ref=dp_olp_0/275-0905959-1711169?ie=UTF8&amp;condition=all">these sellers</a>],Amazon.in: Buy Alto Vida Ojo Mojo Unisex Wrap Bracelet at Low Prices in India | Fashion Jewellery Store,Buy Alto Vida Ojo Mojo Unisex Wrap Bracelet at low prices in India at Amazon.in. Check out Alto Vida Ojo Mojo Unisex Wrap Bracelet reviews  ratings  features  specifications and browse more Fashion Jewellery products online at best prices on Amazon.in.,None,<div class="bucket" id="productDescription"> <h2>Product Description</h2> <div class="content"> <h3 class="productDescriptionSource"></h3> <div class="productDescriptionWrapper">        It's Looking at you.. Its lookin at people and things around you &amp; its also looking at what you do..! It's the Ojo Mojo Bracelet on your wrist ! Very Interesting looking with one eye looking out for danger and beauty..! A definite attention grabber. This bracelet is has a evil eye bead &amp; a hand carved bamboo socket clasp and woven with soft cotton cords.              <div class="emptyClear"> </div> </div> </div> </div>,<div align="left" class="bucket" id="techSpecSoftlinesWrap"><h2>Product Specifications </h2> <div class="content"> <div id="techSpecSoftlines"> <table cellspacing="0"> <tr> <th colspan="2">Jewellery Information</th> </tr> <tr> <td class="td1">Brand</td> <td class="td2">                                             Alto Vida                                         </td> </tr> <tr> <td class="td1">Material</td> <td class="td2">                                             bamboo                                         </td> </tr> <tr> <td class="td1">Model Number</td> <td class="td2">                                             61-1                                         </td> </tr> </table> </div> </div> </div>,18:03:2014,None
B00EKSLDM2,Alto Vida Mystery Klass Red and Black Unisex Wrap Bracelet,http://www.amazon.in/Bangles-Bracelets/b/ref=sd_allcat_fj_bangles/276-6718833-1247838?ie=UTF8&node=2152549031,Rs. 440.00,Bangles & Bracelet,Bangles & Bracelet,Alto Vida,http://ecx.images-amazon.com/images/I/41cf%2BgJpRUL._SL190_CR0 0 190 246_.jpg,Rs. 440.00,self Colour,Watches & Fashion Jewellery,http://www.amazon.in/Alto-Vida-Mystery-Unisex-Bracelet/dp/B00EKSLDM2/ref=sr_1_38/275-0905959-1711169?s=jewelry&ie=UTF8&qid=1395127304&sr=1-38,[<a class="buyAction" href="/gp/offer-listing/B00EKSLDM2/ref=dp_olp_0/275-0905959-1711169?ie=UTF8&amp;condition=all">these sellers</a>],Amazon.in: Buy Alto Vida Mystery Klass Red and Black Unisex Wrap Bracelet at Low Prices in India | Fashion Jewellery Store,Buy Alto Vida Mystery Klass Red and Black Unisex Wrap Bracelet at low prices in India at Amazon.in. Check out Alto Vida Mystery Klass Red and Black Unisex Wrap Bracelet reviews  ratings  features  specifications and browse more Fashion Jewellery products online at best prices on Amazon.in.,None,<div class="bucket" id="productDescription"> <h2>Product Description</h2> <div class="content"> <h3 class="productDescriptionSource"></h3> <div class="productDescriptionWrapper">        A perfect blend of rugged and elegant  this piece is comfortable and easy to wear with any other accessroies or outfits - lending an instant tinge of color  class and mystery..! Completely hand woven with accuracy and finesse using soft cotton &amp; silk cords and embellished with a haematite bead clasp.              <div class="emptyClear"> </div> </div> </div> </div>,<div align="left" class="bucket" id="techSpecSoftlinesWrap"><h2>Product Specifications </h2> <div class="content"> <div id="techSpecSoftlines"> <table cellspacing="0"> <tr> <th colspan="2">Jewellery Information</th> </tr> <tr> <td class="td1">Brand</td> <td class="td2">                                             Alto Vida                                         </td> </tr> <tr> <td class="td1">Material</td> <td class="td2">                                             Non-Precious Metal                                         </td> </tr> <tr> <td class="td1">Model Number</td> <td class="td2">                                             50-1                                         </td> </tr> </table> </div> </div> </div>,18:03:2014,None
B00EMBBU8E,Alto Vida Street Basix Series Brown Wrap Unisex Wrap Bracelet,http://www.amazon.in/Bangles-Bracelets/b/ref=sd_allcat_fj_bangles/276-6718833-1247838?ie=UTF8&node=2152549031,Rs. 190.00,Bangles & Bracelet,Bangles & Bracelet,Alto Vida,http://ecx.images-amazon.com/images/I/41cf%2BgJpRUL._SL190_CR0 0 190 246_.jpg,Rs. 190.00,self Colour,Watches & Fashion Jewellery,http://www.amazon.in/Alto-Vida-Street-Series-Bracelet/dp/B00EMBBU8E/ref=sr_1_42/275-0905959-1711169?s=jewelry&ie=UTF8&qid=1395127304&sr=1-42,[<a class="buyAction" href="/gp/offer-listing/B00EMBBU8E/ref=dp_olp_0/275-0905959-1711169?ie=UTF8&amp;condition=all">these sellers</a>],Amazon.in: Buy Alto Vida Street Basix Series Brown Wrap Unisex Wrap Bracelet at Low Prices in India | Fashion Jewellery Store,Buy Alto Vida Street Basix Series Brown Wrap Unisex Wrap Bracelet at low prices in India at Amazon.in. Check out Alto Vida Street Basix Series Brown Wrap Unisex Wrap Bracelet reviews  ratings  features  specifications and browse more Fashion Jewellery products online at best prices on Amazon.in.,None,<div class="bucket" id="productDescription"> <h2>Product Description</h2> <div class="content"> <h3 class="productDescriptionSource"></h3> <div class="productDescriptionWrapper">        You know that one pair of jeans that match with everything you have in that colour ? Well.. The basics bracelet is just that. Its that essential item you definitely need to have in your accessory box. Simple  Stylish and Easy Going..! Get your Basics right..!              <div class="emptyClear"> </div> </div> </div> </div>,<div align="left" class="bucket" id="techSpecSoftlinesWrap"><h2>Product Specifications </h2> <div class="content"> <div id="techSpecSoftlines"> <table cellspacing="0"> <tr> <th colspan="2">Jewellery Information</th> </tr> <tr> <td class="td1">Brand</td> <td class="td2">                                             Alto Vida                                         </td> </tr> <tr> <td class="td1">Material</td> <td class="td2">                                             Fabric                                         </td> </tr> <tr> <td class="td1">Model Number</td> <td class="td2">                                             79-1                                         </td> </tr> </table> </div> </div> </div>,18:03:2014,None
B00EMBBXYU,Alto Vida Street Basix Series Blue Wrap Unisex Wrap Bracelet,http://www.amazon.in/Bangles-Bracelets/b/ref=sd_allcat_fj_bangles/276-6718833-1247838?ie=UTF8&node=2152549031,Rs. 190.00,Bangles & Bracelet,Bangles & Bracelet,Alto Vida,http://ecx.images-amazon.com/images/I/41cf%2BgJpRUL._SL190_CR0 0 190 246_.jpg,Rs. 190.00,self Colour,Watches & Fashion Jewellery,http://www.amazon.in/Alto-Vida-Street-Series-Bracelet/dp/B00EMBBXYU/ref=sr_1_41/275-0905959-1711169?s=jewelry&ie=UTF8&qid=1395127304&sr=1-41,[<a class="buyAction" href="/gp/offer-listing/B00EMBBXYU/ref=dp_olp_0/275-0905959-1711169?ie=UTF8&amp;condition=all">these sellers</a>],Amazon.in: Buy Alto Vida Street Basix Series Blue Wrap Unisex Wrap Bracelet at Low Prices in India | Fashion Jewellery Store,Buy Alto Vida Street Basix Series Blue Wrap Unisex Wrap Bracelet at low prices in India at Amazon.in. Check out Alto Vida Street Basix Series Blue Wrap Unisex Wrap Bracelet reviews  ratings  features  specifications and browse more Fashion Jewellery products online at best prices on Amazon.in.,None,<div class="bucket" id="productDescription"> <h2>Product Description</h2> <div class="content"> <h3 class="productDescriptionSource"></h3> <div class="productDescriptionWrapper">        You know that one pair of jeans that match with everything you have in that colour ? Well.. The basics bracelet is just that. Its that essential item you definitely need to have in your accessory box. Simple  Stylish and Easy Going..! Get your Basics right..!              <div class="emptyClear"> </div> </div> </div> </div>,<div align="left" class="bucket" id="techSpecSoftlinesWrap"><h2>Product Specifications </h2> <div class="content"> <div id="techSpecSoftlines"> <table cellspacing="0"> <tr> <th colspan="2">Jewellery Information</th> </tr> <tr> <td class="td1">Brand</td> <td class="td2">                                             Alto Vida                                         </td> </tr> <tr> <td class="td1">Material</td> <td class="td2">                                             Fabric                                         </td> </tr> <tr> <td class="td1">Model Number</td> <td class="td2">                                             80-1                                         </td> </tr> </table> </div> </div> </div>,18:03:2014,None
B00EKSL8QI,Alto Vida Mystery Klass Blue and Red Unisex Wrap Bracelet,http://www.amazon.in/Bangles-Bracelets/b/ref=sd_allcat_fj_bangles/276-6718833-1247838?ie=UTF8&node=2152549031,Rs. 440.00,Bangles & Bracelet,Bangles & Bracelet,Alto Vida,http://ecx.images-amazon.com/images/I/41cf%2BgJpRUL._SL190_CR0 0 190 246_.jpg,Rs. 440.00,self Colour,Watches & Fashion Jewellery,http://www.amazon.in/Alto-Vida-Mystery-Unisex-Bracelet/dp/B00EKSL8QI/ref=sr_1_37/275-0905959-1711169?s=jewelry&ie=UTF8&qid=1395127304&sr=1-37,[<a class="buyAction" href="/gp/offer-listing/B00EKSL8QI/ref=dp_olp_0/275-0905959-1711169?ie=UTF8&amp;condition=all">these sellers</a>],Amazon.in: Buy Alto Vida Mystery Klass Blue and Red Unisex Wrap Bracelet at Low Prices in India | Fashion Jewellery Store,Buy Alto Vida Mystery Klass Blue and Red Unisex Wrap Bracelet at low prices in India at Amazon.in. Check out Alto Vida Mystery Klass Blue and Red Unisex Wrap Bracelet reviews  ratings  features  specifications and browse more Fashion Jewellery products online at best prices on Amazon.in.,None,<div class="bucket" id="productDescription"> <h2>Product Description</h2> <div class="content"> <h3 class="productDescriptionSource"></h3> <div class="productDescriptionWrapper">        A perfect blend of rugged and elegant  this piece is comfortable and easy to wear with any other accessroies or outfits - lending an instant tinge of color  class and mystery..! Completely hand woven with accuracy and finesse using soft cotton &amp; silk cords and embellished with a haematite bead clasp.              <div class="emptyClear"> </div> </div> </div> </div>,<div align="left" class="bucket" id="techSpecSoftlinesWrap"><h2>Product Specifications </h2> <div class="content"> <div id="techSpecSoftlines"> <table cellspacing="0"> <tr> <th colspan="2">Jewellery Information</th> </tr> <tr> <td class="td1">Brand</td> <td class="td2">                                             Alto Vida                                         </td> </tr> <tr> <td class="td1">Material</td> <td class="td2">                                             Non-Precious Metal                                         </td> </tr> <tr> <td class="td1">Model Number</td> <td class="td2">                                             49-1                                         </td> </tr> </table> </div> </div> </div>,18:03:2014,None
B00EKSKIVO,Alto Vida Touch Of Class All Black Unisex Strand Bracelet,http://www.amazon.in/Bangles-Bracelets/b/ref=sd_allcat_fj_bangles/276-6718833-1247838?ie=UTF8&node=2152549031,Rs. 440.00,Bangles & Bracelet,Bangles & Bracelet,Alto Vida,http://ecx.images-amazon.com/images/I/41cf%2BgJpRUL._SL190_CR0 0 190 246_.jpg,Rs. 440.00,self Colour,Watches & Fashion Jewellery,http://www.amazon.in/Alto-Vida-Unisex-Strand-Bracelet/dp/B00EKSKIVO/ref=sr_1_45/275-0905959-1711169?s=jewelry&ie=UTF8&qid=1395127304&sr=1-45,[<a class="buyAction" href="/gp/offer-listing/B00EKSKIVO/ref=dp_olp_0/275-0905959-1711169?ie=UTF8&amp;condition=all">these sellers</a>],Amazon.in: Buy Alto Vida Touch Of Class All Black Unisex Strand Bracelet at Low Prices in India | Fashion Jewellery Store,Buy Alto Vida Touch Of Class All Black Unisex Strand Bracelet at low prices in India at Amazon.in. Check out Alto Vida Touch Of Class All Black Unisex Strand Bracelet reviews  ratings  features  specifications and browse more Fashion Jewellery products online at best prices on Amazon.in.,None,<div class="bucket" id="productDescription"> <h2>Product Description</h2> <div class="content"> <h3 class="productDescriptionSource"></h3> <div class="productDescriptionWrapper">        Everything the name suggests... Put it on and feel an instant rise in your style quotient. Dark  Classy  Stylish with justt the right amount of bling for the people who like to keep it understated yet out there..! Totally handmade with super silky nylon cords and haematite beads. Elegantly classy and professionally styled.              <div class="emptyClear"> </div> </div> </div> </div>,<div align="left" class="bucket" id="techSpecSoftlinesWrap"><h2>Product Specifications </h2> <div class="content"> <div id="techSpecSoftlines"> <table cellspacing="0"> <tr> <th colspan="2">Jewellery Information</th> </tr> <tr> <td class="td1">Brand</td> <td class="td2">                                             Alto Vida                                         </td> </tr> <tr> <td class="td1">Material</td> <td class="td2">                                             Non-Precious Metal                                         </td> </tr> <tr> <td class="td1">Model Number</td> <td class="td2">                                             44-1                                         </td> </tr> </table> </div> </div> </div>,18:03:2014,None
B00EMBCAK6,Alto Vida Street Basix Series Light Brown Wrap Unisex Wrap Bracelet,http://www.amazon.in/Bangles-Bracelets/b/ref=sd_allcat_fj_bangles/276-6718833-1247838?ie=UTF8&node=2152549031,Rs. 190.00,Bangles & Bracelet,Bangles & Bracelet,Alto Vida,http://ecx.images-amazon.com/images/I/41cf%2BgJpRUL._SL190_CR0 0 190 246_.jpg,Rs. 190.00,self Colour,Watches & Fashion Jewellery,http://www.amazon.in/Alto-Vida-Street-Series-Bracelet/dp/B00EMBCAK6/ref=sr_1_43/275-0905959-1711169?s=jewelry&ie=UTF8&qid=1395127304&sr=1-43,[<a class="buyAction" href="/gp/offer-listing/B00EMBCAK6/ref=dp_olp_0/275-0905959-1711169?ie=UTF8&amp;condition=all">these sellers</a>],Amazon.in: Buy Alto Vida Street Basix Series Light Brown Wrap Unisex Wrap Bracelet at Low Prices in India | Fashion Jewellery Store,Buy Alto Vida Street Basix Series Light Brown Wrap Unisex Wrap Bracelet at low prices in India at Amazon.in. Check out Alto Vida Street Basix Series Light Brown Wrap Unisex Wrap Bracelet reviews  ratings  features  specifications and browse more Fashion Jewellery products online at best prices on Amazon.in.,None,<div class="bucket" id="productDescription"> <h2>Product Description</h2> <div class="content"> <h3 class="productDescriptionSource"></h3> <div class="productDescriptionWrapper">        You know that one pair of jeans that match with everything you have in that colour ? Well.. The basics bracelet is just that. Its that essential item you definitely need to have in your accessory box. Simple  Stylish and Easy Going..! Get your Basics right..!              <div class="emptyClear"> </div> </div> </div> </div>,<div align="left" class="bucket" id="techSpecSoftlinesWrap"><h2>Product Specifications </h2> <div class="content"> <div id="techSpecSoftlines"> <table cellspacing="0"> <tr> <th colspan="2">Jewellery Information</th> </tr> <tr> <td class="td1">Brand</td> <td class="td2">                                             Alto Vida                                         </td> </tr> <tr> <td class="td1">Material</td> <td class="td2">                                             Fabric                                         </td> </tr> <tr> <td class="td1">Model Number</td> <td class="td2">                                             83-1                                         </td> </tr> </table> </div> </div> </div>,18:03:2014,None
B00EKSLI0Y,Alto Vida Dark Mystery Red Unisex Wrap Bracelet,http://www.amazon.in/Bangles-Bracelets/b/ref=sd_allcat_fj_bangles/276-6718833-1247838?ie=UTF8&node=2152549031,Rs. 440.00,Bangles & Bracelet,Bangles & Bracelet,Alto Vida,http://ecx.images-amazon.com/images/I/41cf%2BgJpRUL._SL190_CR0 0 190 246_.jpg,Rs. 440.00,self Colour,Watches & Fashion Jewellery,http://www.amazon.in/Alto-Vida-Mystery-Unisex-Bracelet/dp/B00EKSLI0Y/ref=sr_1_16/275-0905959-1711169?s=jewelry&ie=UTF8&qid=1395127304&sr=1-16,[<a class="buyAction" href="/gp/offer-listing/B00EKSLI0Y/ref=dp_olp_0/275-0905959-1711169?ie=UTF8&amp;condition=all">these sellers</a>],Amazon.in: Buy Alto Vida Dark Mystery Red Unisex Wrap Bracelet at Low Prices in India | Fashion Jewellery Store,Buy Alto Vida Dark Mystery Red Unisex Wrap Bracelet at low prices in India at Amazon.in. Check out Alto Vida Dark Mystery Red Unisex Wrap Bracelet reviews  ratings  features  specifications and browse more Fashion Jewellery products online at best prices on Amazon.in.,None,<div class="bucket" id="productDescription"> <h2>Product Description</h2> <div class="content"> <h3 class="productDescriptionSource"></h3> <div class="productDescriptionWrapper">        Along the lines of our 'Mystery Hook' &amp; 'Mystery Klass' series of amazing bracelets comes our "Dark Mystery" bracelet. This ones for all the peeps out there wanting to show their dark mysterious side. This bracelet is completely hand made using soft black cotton &amp; silk cords and a smart haematite bead clasp.              <div class="emptyClear"> </div> </div> </div> </div>,<div align="left" class="bucket" id="techSpecSoftlinesWrap"><h2>Product Specifications </h2> <div class="content"> <div id="techSpecSoftlines"> <table cellspacing="0"> <tr> <th colspan="2">Jewellery Information</th> </tr> <tr> <td class="td1">Brand</td> <td class="td2">                                             Alto Vida                                         </td> </tr> <tr> <td class="td1">Material</td> <td class="td2">                                             Non-Precious Metal                                         </td> </tr> <tr> <td class="td1">Model Number</td> <td class="td2">                                             51-1                                         </td> </tr> </table> </div> </div> </div>,18:03:2014,None
B00EKSKSV4,Alto Vida Touch Of Class Brown and Red Unisex Strand Bracelet,http://www.amazon.in/Bangles-Bracelets/b/ref=sd_allcat_fj_bangles/276-6718833-1247838?ie=UTF8&node=2152549031,Rs. 440.00,Bangles & Bracelet,Bangles & Bracelet,Alto Vida,http://ecx.images-amazon.com/images/I/41cf%2BgJpRUL._SL190_CR0 0 190 246_.jpg,Rs. 440.00,self Colour,Watches & Fashion Jewellery,http://www.amazon.in/Alto-Vida-Unisex-Strand-Bracelet/dp/B00EKSKSV4/ref=sr_1_47/275-0905959-1711169?s=jewelry&ie=UTF8&qid=1395127304&sr=1-47,[<a class="buyAction" href="/gp/offer-listing/B00EKSKSV4/ref=dp_olp_0/275-0905959-1711169?ie=UTF8&amp;condition=all">these sellers</a>],Amazon.in: Buy Alto Vida Touch Of Class Brown and Red Unisex Strand Bracelet at Low Prices in India | Fashion Jewellery Store,Buy Alto Vida Touch Of Class Brown and Red Unisex Strand Bracelet at low prices in India at Amazon.in. Check out Alto Vida Touch Of Class Brown and Red Unisex Strand Bracelet reviews  ratings  features  specifications and browse more Fashion Jewellery products online at best prices on Amazon.in.,None,<div class="bucket" id="productDescription"> <h2>Product Description</h2> <div class="content"> <h3 class="productDescriptionSource"></h3> <div class="productDescriptionWrapper">        Everything the name suggests... Put it on and feel an instant rise in your style quotient. Dark  Classy  Stylish with justt the right amount of bling for the people who like to keep it understated yet out there..! Totally handmade with super silky nylon cords and haematite beads. Elegantly classy and professionally styled.              <div class="emptyClear"> </div> </div> </div> </div>,<div align="left" class="bucket" id="techSpecSoftlinesWrap"><h2>Product Specifications </h2> <div class="content"> <div id="techSpecSoftlines"> <table cellspacing="0"> <tr> <th colspan="2">Jewellery Information</th> </tr> <tr> <td class="td1">Brand</td> <td class="td2">                                             Alto Vida                                         </td> </tr> <tr> <td class="td1">Material</td> <td class="td2">                                             Non-Precious Metal                                         </td> </tr> <tr> <td class="td1">Model Number</td> <td class="td2">                                             46-1                                         </td> </tr> </table> </div> </div> </div>,18:03:2014,None
B00EMBC3JE,Alto Vida Street Basix Series Red Wrap Unisex Wrap Bracelet,http://www.amazon.in/Bangles-Bracelets/b/ref=sd_allcat_fj_bangles/276-6718833-1247838?ie=UTF8&node=2152549031,Rs. 190.00,Bangles & Bracelet,Bangles & Bracelet,Alto Vida,http://ecx.images-amazon.com/images/I/41cf%2BgJpRUL._SL190_CR0 0 190 246_.jpg,Rs. 190.00,self Colour,Watches & Fashion Jewellery,http://www.amazon.in/Alto-Vida-Street-Series-Bracelet/dp/B00EMBC3JE/ref=sr_1_44/275-0905959-1711169?s=jewelry&ie=UTF8&qid=1395127304&sr=1-44,[<a class="buyAction" href="/gp/offer-listing/B00EMBC3JE/ref=dp_olp_0/275-0905959-1711169?ie=UTF8&amp;condition=all">these sellers</a>],Amazon.in: Buy Alto Vida Street Basix Series Red Wrap Unisex Wrap Bracelet at Low Prices in India | Fashion Jewellery Store,Buy Alto Vida Street Basix Series Red Wrap Unisex Wrap Bracelet at low prices in India at Amazon.in. Check out Alto Vida Street Basix Series Red Wrap Unisex Wrap Bracelet reviews  ratings  features  specifications and browse more Fashion Jewellery products online at best prices on Amazon.in.,None,<div class="bucket" id="productDescription"> <h2>Product Description</h2> <div class="content"> <h3 class="productDescriptionSource"></h3> <div class="productDescriptionWrapper">        You know that one pair of jeans that match with everything you have in that colour ? Well.. The basics bracelet is just that. Its that essential item you definitely need to have in your accessory box. Simple  Stylish and Easy Going..! Get your Basics right..!              <div class="emptyClear"> </div> </div> </div> </div>,<div align="left" class="bucket" id="techSpecSoftlinesWrap"><h2>Product Specifications </h2> <div class="content"> <div id="techSpecSoftlines"> <table cellspacing="0"> <tr> <th colspan="2">Jewellery Information</th> </tr> <tr> <td class="td1">Brand</td> <td class="td2">                                             Alto Vida                                         </td> </tr> <tr> <td class="td1">Material</td> <td class="td2">                                             Fabric                                         </td> </tr> <tr> <td class="td1">Model Number</td> <td class="td2">                                             81-1                                         </td> </tr> </table> </div> </div> </div>,18:03:2014,None
