B00EKSLRM8,Alto Vida Explorer Series Blue and Red Unisex Wrap Bracelet,http://www.amazon.in/Bangles-Bracelets/b/ref=sd_allcat_fj_bangles/276-6718833-1247838?ie=UTF8&node=2152549031,Rs. 585.00,Bangles & Bracelet,Bangles & Bracelet,Alto Vida,http://ecx.images-amazon.com/images/I/41cf%2BgJpRUL._SL190_CR0 0 190 246_.jpg,Rs. 585.00,self Colour,Watches & Fashion Jewellery,http://www.amazon.in/Alto-Vida-Explorer-Series-Bracelet/dp/B00EKSLRM8/ref=sr_1_20/275-0905959-1711169?s=jewelry&ie=UTF8&qid=1395127304&sr=1-20,[<a class="buyAction" href="/gp/offer-listing/B00EKSLRM8/ref=dp_olp_0/275-0905959-1711169?ie=UTF8&amp;condition=all">these sellers</a>],Amazon.in: Buy Alto Vida Explorer Series Blue and Red Unisex Wrap Bracelet at Low Prices in India | Fashion Jewellery Store,Buy Alto Vida Explorer Series Blue and Red Unisex Wrap Bracelet at low prices in India at Amazon.in. Check out Alto Vida Explorer Series Blue and Red Unisex Wrap Bracelet reviews  ratings  features  specifications and browse more Fashion Jewellery products online at best prices on Amazon.in.,None,<div class="bucket" id="productDescription"> <h2>Product Description</h2> <div class="content"> <h3 class="productDescriptionSource"></h3> <div class="productDescriptionWrapper">        For all the explorers and urban adventurers who have set out to find their own destiny rather than waiting.. For all the people set out to discover something and reach somewhere  for everyoe who believes that the most difficult thing to find is your own soul... Our Explorer bracelet comes in a variety of shades and colours to suit your journey... Made painstakingly with cotton cords and a patented bamboo-magnet arrow clasp  this bracelet is built to last longer than your search continues.              <div class="emptyClear"> </div> </div> </div> </div>,<div align="left" class="bucket" id="techSpecSoftlinesWrap"><h2>Product Specifications </h2> <div class="content"> <div id="techSpecSoftlines"> <table cellspacing="0"> <tr> <th colspan="2">Jewellery Information</th> </tr> <tr> <td class="td1">Brand</td> <td class="td2">                                             Alto Vida                                         </td> </tr> <tr> <td class="td1">Material</td> <td class="td2">                                             bamboo                                         </td> </tr> <tr> <td class="td1">Model Number</td> <td class="td2">                                             53-1                                         </td> </tr> </table> </div> </div> </div>,18:03:2014,None
B00EKSJIT2,Alto Vida Golden Orb Red Bead Stretch Unisex Bracelet,http://www.amazon.in/Bangles-Bracelets/b/ref=sd_allcat_fj_bangles/276-6718833-1247838?ie=UTF8&node=2152549031,Rs. 149.00,Bangles & Bracelet,Bangles & Bracelet,Alto Vida,http://ecx.images-amazon.com/images/I/41cf%2BgJpRUL._SL190_CR0 0 190 246_.jpg,Rs. 149.00,self Colour,Watches & Fashion Jewellery,http://www.amazon.in/Alto-Vida-Golden-Stretch-Bracelet/dp/B00EKSJIT2/ref=sr_1_22/275-0905959-1711169?s=jewelry&ie=UTF8&qid=1395127304&sr=1-22,[<a class="buyAction" href="/gp/offer-listing/B00EKSJIT2/ref=dp_olp_0/275-0905959-1711169?ie=UTF8&amp;condition=all">these sellers</a>],Amazon.in: Buy Alto Vida Golden Orb Red Bead Stretch Unisex Bracelet at Low Prices in India | Fashion Jewellery Store,Buy Alto Vida Golden Orb Red Bead Stretch Unisex Bracelet at low prices in India at Amazon.in. Check out Alto Vida Golden Orb Red Bead Stretch Unisex Bracelet reviews  ratings  features  specifications and browse more Fashion Jewellery products online at best prices on Amazon.in.,None,<div class="bucket" id="productDescription"> <h2>Product Description</h2> <div class="content"> <h3 class="productDescriptionSource"></h3> <div class="productDescriptionWrapper">        A single Golden Orb bead surrounded with red glass beads makes this a striking and attention grabbing bracelet. Best worn stacked with other colours or paired with other pieces. Totally hand made from glass beads this stretch bracelet lends immediate sprucing up to any outfit.              <div class="emptyClear"> </div> </div> </div> </div>,<div align="left" class="bucket" id="techSpecSoftlinesWrap"><h2>Product Specifications </h2> <div class="content"> <div id="techSpecSoftlines"> <table cellspacing="0"> <tr> <th colspan="2">Jewellery Information</th> </tr> <tr> <td class="td1">Brand</td> <td class="td2">                                             Alto Vida                                         </td> </tr> <tr> <td class="td1">Material</td> <td class="td2">                                             glass                                         </td> </tr> <tr> <td class="td1">Model Number</td> <td class="td2">                                             37-1                                         </td> </tr> </table> </div> </div> </div>,18:03:2014,None
B00EKSMP7Y,Alto Vida Grapple Series Green Multi Strand Unisex Bracelet,http://www.amazon.in/Bangles-Bracelets/b/ref=sd_allcat_fj_bangles/276-6718833-1247838?ie=UTF8&node=2152549031,Rs. 250.00,Bangles & Bracelet,Bangles & Bracelet,Alto Vida,http://ecx.images-amazon.com/images/I/41cf%2BgJpRUL._SL190_CR0 0 190 246_.jpg,Rs. 250.00,self Colour,Watches & Fashion Jewellery,http://www.amazon.in/Alto-Vida-Grapple-Series-Bracelet/dp/B00EKSMP7Y/ref=sr_1_25/275-0905959-1711169?s=jewelry&ie=UTF8&qid=1395127304&sr=1-25,[<a class="buyAction" href="/gp/offer-listing/B00EKSMP7Y/ref=dp_olp_0/275-0905959-1711169?ie=UTF8&amp;condition=all">these sellers</a>],Amazon.in: Buy Alto Vida Grapple Series Green Multi Strand Unisex Bracelet at Low Prices in India | Fashion Jewellery Store,Buy Alto Vida Grapple Series Green Multi Strand Unisex Bracelet at low prices in India at Amazon.in. Check out Alto Vida Grapple Series Green Multi Strand Unisex Bracelet reviews  ratings  features  specifications and browse more Fashion Jewellery products online at best prices on Amazon.in.,None,<div class="bucket" id="productDescription"> <h2>Product Description</h2> <div class="content"> <h3 class="productDescriptionSource"></h3> <div class="productDescriptionWrapper">        Simple  Rugged  Rustic and Cool..! The Grapple Bracelet is perfect for remixing with almost any other set of bracelets. Stack it up with our Explorer Bracelets or the Golden Orb Bracelets to add an interesting detail to the piece. Hand crafted with jute cotton cords and a hand carved bamboo hook clasp makes it 98% eco friendly and earth loving.              <div class="emptyClear"> </div> </div> </div> </div>,<div align="left" class="bucket" id="techSpecSoftlinesWrap"><h2>Product Specifications </h2> <div class="content"> <div id="techSpecSoftlines"> <table cellspacing="0"> <tr> <th colspan="2">Jewellery Information</th> </tr> <tr> <td class="td1">Brand</td> <td class="td2">                                             Alto Vida                                         </td> </tr> <tr> <td class="td1">Material</td> <td class="td2">                                             bamboo                                         </td> </tr> <tr> <td class="td1">Model Number</td> <td class="td2">                                             59-1                                         </td> </tr> </table> </div> </div> </div>,18:03:2014,None
B00EKSM4HK,Alto Vida Hunter Series Brown Unisex Wrap Bracelet,http://www.amazon.in/Bangles-Bracelets/b/ref=sd_allcat_fj_bangles/276-6718833-1247838?ie=UTF8&node=2152549031,Rs. 440.00,Bangles & Bracelet,Bangles & Bracelet,Alto Vida,http://ecx.images-amazon.com/images/I/41cf%2BgJpRUL._SL190_CR0 0 190 246_.jpg,Rs. 440.00,self Colour,Watches & Fashion Jewellery,http://www.amazon.in/Alto-Vida-Hunter-Series-Bracelet/dp/B00EKSM4HK/ref=sr_1_27/275-0905959-1711169?s=jewelry&ie=UTF8&qid=1395127304&sr=1-27,[<a class="buyAction" href="/gp/offer-listing/B00EKSM4HK/ref=dp_olp_0/275-0905959-1711169?ie=UTF8&amp;condition=all">these sellers</a>],Amazon.in: Buy Alto Vida Hunter Series Brown Unisex Wrap Bracelet at Low Prices in India | Fashion Jewellery Store,Buy Alto Vida Hunter Series Brown Unisex Wrap Bracelet at low prices in India at Amazon.in. Check out Alto Vida Hunter Series Brown Unisex Wrap Bracelet reviews  ratings  features  specifications and browse more Fashion Jewellery products online at best prices on Amazon.in.,None,<div class="bucket" id="productDescription"> <h2>Product Description</h2> <div class="content"> <h3 class="productDescriptionSource"></h3> <div class="productDescriptionWrapper">        The perfect companion for the urban hunters..! Out on the prowl and scoping their kills and targets... every day in the concrete jungle ! Carefully handwoven in perfect urban camouflage colours with soft cotton cords  comfortable  stylish and edgy.              <div class="emptyClear"> </div> </div> </div> </div>,<div align="left" class="bucket" id="techSpecSoftlinesWrap"><h2>Product Specifications </h2> <div class="content"> <div id="techSpecSoftlines"> <table cellspacing="0"> <tr> <th colspan="2">Jewellery Information</th> </tr> <tr> <td class="td1">Brand</td> <td class="td2">                                             Alto Vida                                         </td> </tr> <tr> <td class="td1">Material</td> <td class="td2">                                             Non-Precious Metal                                         </td> </tr> <tr> <td class="td1">Model Number</td> <td class="td2">                                             56-1                                         </td> </tr> </table> </div> </div> </div>,18:03:2014,None
B00EKSKEGS,Alto Vida Keep Going Series Purple Unisex Bracelet,http://www.amazon.in/Bangles-Bracelets/b/ref=sd_allcat_fj_bangles/276-6718833-1247838?ie=UTF8&node=2152549031,Rs. 200.00,Bangles & Bracelet,Bangles & Bracelet,Alto Vida,http://ecx.images-amazon.com/images/I/41cf%2BgJpRUL._SL190_CR0 0 190 246_.jpg,Rs. 200.00,self Colour,Watches & Fashion Jewellery,http://www.amazon.in/Alto-Vida-Series-Purple-Bracelet/dp/B00EKSKEGS/ref=sr_1_30/275-0905959-1711169?s=jewelry&ie=UTF8&qid=1395127304&sr=1-30,[<a class="buyAction" href="/gp/offer-listing/B00EKSKEGS/ref=dp_olp_0/275-0905959-1711169?ie=UTF8&amp;condition=all">these sellers</a>],Amazon.in: Buy Alto Vida Keep Going Series Purple Unisex Bracelet at Low Prices in India | Fashion Jewellery Store,Buy Alto Vida Keep Going Series Purple Unisex Bracelet at low prices in India at Amazon.in. Check out Alto Vida Keep Going Series Purple Unisex Bracelet reviews  ratings  features  specifications and browse more Fashion Jewellery products online at best prices on Amazon.in.,None,<div class="bucket" id="productDescription"> <h2>Product Description</h2> <div class="content"> <h3 class="productDescriptionSource"></h3> <div class="productDescriptionWrapper">        This inspiring bracelet is dedicated to all the people out there fighting their own battles and treading their own paths...! As Sir Winston Churchill has said... If you're going through hell... Keep Going !              <div class="emptyClear"> </div> </div> </div> </div>,<div align="left" class="bucket" id="techSpecSoftlinesWrap"><h2>Product Specifications </h2> <div class="content"> <div id="techSpecSoftlines"> <table cellspacing="0"> <tr> <th colspan="2">Jewellery Information</th> </tr> <tr> <td class="td1">Brand</td> <td class="td2">                                             Alto Vida                                         </td> </tr> <tr> <td class="td1">Material</td> <td class="td2">                                             bamboo                                         </td> </tr> <tr> <td class="td1">Model Number</td> <td class="td2">                                             71-1                                         </td> </tr> </table> </div> </div> </div>,18:03:2014,None
B00EKSJSYW,Alto Vida Mystery Hook Blue Unisex Wrap Bracelet,http://www.amazon.in/Bangles-Bracelets/b/ref=sd_allcat_fj_bangles/276-6718833-1247838?ie=UTF8&node=2152549031,Rs. 385.00,Bangles & Bracelet,Bangles & Bracelet,Alto Vida,http://ecx.images-amazon.com/images/I/41cf%2BgJpRUL._SL190_CR0 0 190 246_.jpg,Rs. 385.00,self Colour,Watches & Fashion Jewellery,http://www.amazon.in/Alto-Vida-Mystery-Unisex-Bracelet/dp/B00EKSJSYW/ref=sr_1_32/275-0905959-1711169?s=jewelry&ie=UTF8&qid=1395127304&sr=1-32,[<a class="buyAction" href="/gp/offer-listing/B00EKSJSYW/ref=dp_olp_0/275-0905959-1711169?ie=UTF8&amp;condition=all">these sellers</a>],Amazon.in: Buy Alto Vida Mystery Hook Blue Unisex Wrap Bracelet at Low Prices in India | Fashion Jewellery Store,Buy Alto Vida Mystery Hook Blue Unisex Wrap Bracelet at low prices in India at Amazon.in. Check out Alto Vida Mystery Hook Blue Unisex Wrap Bracelet reviews  ratings  features  specifications and browse more Fashion Jewellery products online at best prices on Amazon.in.,None,<div class="bucket" id="productDescription"> <h2>Product Description</h2> <div class="content"> <h3 class="productDescriptionSource"></h3> <div class="productDescriptionWrapper">        Stylish  Rugged and very mysterious.. The "Mystery Hook" Bracelet is a delight to wear and speaks volumes about your "swag". Comfortable  Intriguing and Strong... A Collectors piece. Carefully handmade with cotton cords and a hand carved bamboo hook  makes each piece one-of-a-kind.              <div class="emptyClear"> </div> </div> </div> </div>,<div align="left" class="bucket" id="techSpecSoftlinesWrap"><h2>Product Specifications </h2> <div class="content"> <div id="techSpecSoftlines"> <table cellspacing="0"> <tr> <th colspan="2">Jewellery Information</th> </tr> <tr> <td class="td1">Brand</td> <td class="td2">                                             Alto Vida                                         </td> </tr> <tr> <td class="td1">Material</td> <td class="td2">                                             bamboo                                         </td> </tr> <tr> <td class="td1">Model Number</td> <td class="td2">                                             40-1                                         </td> </tr> </table> </div> </div> </div>,18:03:2014,None
B00EKSK5GM,Alto Vida Keep Going Series Brown Unisex Bracelet,http://www.amazon.in/Bangles-Bracelets/b/ref=sd_allcat_fj_bangles/276-6718833-1247838?ie=UTF8&node=2152549031,Rs. 200.00,Bangles & Bracelet,Bangles & Bracelet,Alto Vida,http://ecx.images-amazon.com/images/I/41cf%2BgJpRUL._SL190_CR0 0 190 246_.jpg,Rs. 200.00,self Colour,Watches & Fashion Jewellery,http://www.amazon.in/Alto-Vida-Series-Unisex-Bracelet/dp/B00EKSK5GM/ref=sr_1_28/275-0905959-1711169?s=jewelry&ie=UTF8&qid=1395127304&sr=1-28,[<a class="buyAction" href="/gp/offer-listing/B00EKSK5GM/ref=dp_olp_0/275-0905959-1711169?ie=UTF8&amp;condition=all">these sellers</a>],Amazon.in: Buy Alto Vida Keep Going Series Brown Unisex Bracelet at Low Prices in India | Fashion Jewellery Store,Buy Alto Vida Keep Going Series Brown Unisex Bracelet at low prices in India at Amazon.in. Check out Alto Vida Keep Going Series Brown Unisex Bracelet reviews  ratings  features  specifications and browse more Fashion Jewellery products online at best prices on Amazon.in.,None,<div class="bucket" id="productDescription"> <h2>Product Description</h2> <div class="content"> <h3 class="productDescriptionSource"></h3> <div class="productDescriptionWrapper">        This inspiring bracelet is dedicated to all the people out there fighting their own battles and treading their own paths...! As Sir Winston Churchill has said... If you're going through hell... Keep Going !              <div class="emptyClear"> </div> </div> </div> </div>,<div align="left" class="bucket" id="techSpecSoftlinesWrap"><h2>Product Specifications </h2> <div class="content"> <div id="techSpecSoftlines"> <table cellspacing="0"> <tr> <th colspan="2">Jewellery Information</th> </tr> <tr> <td class="td1">Brand</td> <td class="td2">                                             Alto Vida                                         </td> </tr> <tr> <td class="td1">Material</td> <td class="td2">                                             bamboo                                         </td> </tr> <tr> <td class="td1">Model Number</td> <td class="td2">                                             69-1                                         </td> </tr> </table> </div> </div> </div>,18:03:2014,None
B00EKSK38C,Alto Vida Mystery Hook Brown Unisex Wrap Bracelet,http://www.amazon.in/Bangles-Bracelets/b/ref=sd_allcat_fj_bangles/276-6718833-1247838?ie=UTF8&node=2152549031,Rs. 385.00,Bangles & Bracelet,Bangles & Bracelet,Alto Vida,http://ecx.images-amazon.com/images/I/41cf%2BgJpRUL._SL190_CR0 0 190 246_.jpg,Rs. 385.00,self Colour,Watches & Fashion Jewellery,http://www.amazon.in/Alto-Vida-Mystery-Unisex-Bracelet/dp/B00EKSK38C/ref=sr_1_33/275-0905959-1711169?s=jewelry&ie=UTF8&qid=1395127304&sr=1-33,[<a class="buyAction" href="/gp/offer-listing/B00EKSK38C/ref=dp_olp_0/275-0905959-1711169?ie=UTF8&amp;condition=all">these sellers</a>],Amazon.in: Buy Alto Vida Mystery Hook Brown Unisex Wrap Bracelet at Low Prices in India | Fashion Jewellery Store,Buy Alto Vida Mystery Hook Brown Unisex Wrap Bracelet at low prices in India at Amazon.in. Check out Alto Vida Mystery Hook Brown Unisex Wrap Bracelet reviews  ratings  features  specifications and browse more Fashion Jewellery products online at best prices on Amazon.in.,None,<div class="bucket" id="productDescription"> <h2>Product Description</h2> <div class="content"> <h3 class="productDescriptionSource"></h3> <div class="productDescriptionWrapper">        Stylish  Rugged and very mysterious.. The "Mystery Hook" Bracelet is a delight to wear and speaks volumes about your "swag". Comfortable  Intriguing and Strong... A Collectors piece. Carefully handmade with cotton cords and a hand carved bamboo hook  makes each piece one-of-a-kind.              <div class="emptyClear"> </div> </div> </div> </div>,<div align="left" class="bucket" id="techSpecSoftlinesWrap"><h2>Product Specifications </h2> <div class="content"> <div id="techSpecSoftlines"> <table cellspacing="0"> <tr> <th colspan="2">Jewellery Information</th> </tr> <tr> <td class="td1">Brand</td> <td class="td2">                                             Alto Vida                                         </td> </tr> <tr> <td class="td1">Material</td> <td class="td2">                                             bamboo                                         </td> </tr> <tr> <td class="td1">Model Number</td> <td class="td2">                                             42-1                                         </td> </tr> </table> </div> </div> </div>,18:03:2014,None
B00EKSJXV0,Alto Vida Mystery Hook Red Unisex Wrap Bracelet,http://www.amazon.in/Bangles-Bracelets/b/ref=sd_allcat_fj_bangles/276-6718833-1247838?ie=UTF8&node=2152549031,Rs. 385.00,Bangles & Bracelet,Bangles & Bracelet,Alto Vida,http://ecx.images-amazon.com/images/I/41cf%2BgJpRUL._SL190_CR0 0 190 246_.jpg,Rs. 385.00,self Colour,Watches & Fashion Jewellery,http://www.amazon.in/Alto-Vida-Mystery-Unisex-Bracelet/dp/B00EKSJXV0/ref=sr_1_35/275-0905959-1711169?s=jewelry&ie=UTF8&qid=1395127304&sr=1-35,[<a class="buyAction" href="/gp/offer-listing/B00EKSJXV0/ref=dp_olp_0/275-0905959-1711169?ie=UTF8&amp;condition=all">these sellers</a>],Amazon.in: Buy Alto Vida Mystery Hook Red Unisex Wrap Bracelet at Low Prices in India | Fashion Jewellery Store,Buy Alto Vida Mystery Hook Red Unisex Wrap Bracelet at low prices in India at Amazon.in. Check out Alto Vida Mystery Hook Red Unisex Wrap Bracelet reviews  ratings  features  specifications and browse more Fashion Jewellery products online at best prices on Amazon.in.,None,<div class="bucket" id="productDescription"> <h2>Product Description</h2> <div class="content"> <h3 class="productDescriptionSource"></h3> <div class="productDescriptionWrapper">        Stylish  Rugged and very mysterious.. The "Mystery Hook" Bracelet is a delight to wear and speaks volumes about your "swag". Comfortable  Intriguing and Strong... A Collectors piece. Carefully handmade with cotton cords and a hand carved bamboo hook  makes each piece one-of-a-kind.              <div class="emptyClear"> </div> </div> </div> </div>,<div align="left" class="bucket" id="techSpecSoftlinesWrap"><h2>Product Specifications </h2> <div class="content"> <div id="techSpecSoftlines"> <table cellspacing="0"> <tr> <th colspan="2">Jewellery Information</th> </tr> <tr> <td class="td1">Brand</td> <td class="td2">                                             Alto Vida                                         </td> </tr> <tr> <td class="td1">Material</td> <td class="td2">                                             bamboo                                         </td> </tr> <tr> <td class="td1">Model Number</td> <td class="td2">                                             41-1                                         </td> </tr> </table> </div> </div> </div>,18:03:2014,None
B00EKSKAOY,Alto Vida Mystery Hook Green Unisex Wrap Bracelet,http://www.amazon.in/Bangles-Bracelets/b/ref=sd_allcat_fj_bangles/276-6718833-1247838?ie=UTF8&node=2152549031,Rs. 385.00,Bangles & Bracelet,Bangles & Bracelet,Alto Vida,http://ecx.images-amazon.com/images/I/41cf%2BgJpRUL._SL190_CR0 0 190 246_.jpg,Rs. 385.00,self Colour,Watches & Fashion Jewellery,http://www.amazon.in/Alto-Vida-Mystery-Unisex-Bracelet/dp/B00EKSKAOY/ref=sr_1_34/275-0905959-1711169?s=jewelry&ie=UTF8&qid=1395127304&sr=1-34,[<a class="buyAction" href="/gp/offer-listing/B00EKSKAOY/ref=dp_olp_0/275-0905959-1711169?ie=UTF8&amp;condition=all">these sellers</a>],Amazon.in: Buy Alto Vida Mystery Hook Green Unisex Wrap Bracelet at Low Prices in India | Fashion Jewellery Store,Buy Alto Vida Mystery Hook Green Unisex Wrap Bracelet at low prices in India at Amazon.in. Check out Alto Vida Mystery Hook Green Unisex Wrap Bracelet reviews  ratings  features  specifications and browse more Fashion Jewellery products online at best prices on Amazon.in.,None,<div class="bucket" id="productDescription"> <h2>Product Description</h2> <div class="content"> <h3 class="productDescriptionSource"></h3> <div class="productDescriptionWrapper">        Stylish  Rugged and very mysterious.. The "Mystery Hook" Bracelet is a delight to wear and speaks volumes about your "swag". Comfortable  Intriguing and Strong... A Collectors piece. Carefully handmade with cotton cords and a hand carved bamboo hook  makes each piece one-of-a-kind.              <div class="emptyClear"> </div> </div> </div> </div>,<div align="left" class="bucket" id="techSpecSoftlinesWrap"><h2>Product Specifications </h2> <div class="content"> <div id="techSpecSoftlines"> <table cellspacing="0"> <tr> <th colspan="2">Jewellery Information</th> </tr> <tr> <td class="td1">Brand</td> <td class="td2">                                             Alto Vida                                         </td> </tr> <tr> <td class="td1">Material</td> <td class="td2">                                             bamboo                                         </td> </tr> <tr> <td class="td1">Model Number</td> <td class="td2">                                             43-1                                         </td> </tr> </table> </div> </div> </div>,18:03:2014,None
B00EKSL2LO,Alto Vida Mystery Klass Blue and Black Unisex Wrap Bracelet,http://www.amazon.in/Bangles-Bracelets/b/ref=sd_allcat_fj_bangles/276-6718833-1247838?ie=UTF8&node=2152549031,Rs. 440.00,Bangles & Bracelet,Bangles & Bracelet,Alto Vida,http://ecx.images-amazon.com/images/I/41cf%2BgJpRUL._SL190_CR0 0 190 246_.jpg,Rs. 440.00,self Colour,Watches & Fashion Jewellery,http://www.amazon.in/Alto-Vida-Mystery-Unisex-Bracelet/dp/B00EKSL2LO/ref=sr_1_36/275-0905959-1711169?s=jewelry&ie=UTF8&qid=1395127304&sr=1-36,[<a class="buyAction" href="/gp/offer-listing/B00EKSL2LO/ref=dp_olp_0/275-0905959-1711169?ie=UTF8&amp;condition=all">these sellers</a>],Amazon.in: Buy Alto Vida Mystery Klass Blue and Black Unisex Wrap Bracelet at Low Prices in India | Fashion Jewellery Store,Buy Alto Vida Mystery Klass Blue and Black Unisex Wrap Bracelet at low prices in India at Amazon.in. Check out Alto Vida Mystery Klass Blue and Black Unisex Wrap Bracelet reviews  ratings  features  specifications and browse more Fashion Jewellery products online at best prices on Amazon.in.,None,<div class="bucket" id="productDescription"> <h2>Product Description</h2> <div class="content"> <h3 class="productDescriptionSource"></h3> <div class="productDescriptionWrapper">        A perfect blend of rugged and elegant  this piece is comfortable and easy to wear with any other accessroies or outfits - lending an instant tinge of color  class and mystery..! Completely hand woven with accuracy and finesse using soft cotton &amp; silk cords and embellished with a haematite bead clasp.              <div class="emptyClear"> </div> </div> </div> </div>,<div align="left" class="bucket" id="techSpecSoftlinesWrap"><h2>Product Specifications </h2> <div class="content"> <div id="techSpecSoftlines"> <table cellspacing="0"> <tr> <th colspan="2">Jewellery Information</th> </tr> <tr> <td class="td1">Brand</td> <td class="td2">                                             Alto Vida                                         </td> </tr> <tr> <td class="td1">Material</td> <td class="td2">                                             Non-Precious Metal                                         </td> </tr> <tr> <td class="td1">Model Number</td> <td class="td2">                                             48-1                                         </td> </tr> </table> </div> </div> </div>,18:03:2014,None
