B00EKSKOHW,Alto Vida Soul Loops Series Weed Green Unisex Wrap Bracelet,http://www.amazon.in/Bangles-Bracelets/b/ref=sd_allcat_fj_bangles/276-6718833-1247838?ie=UTF8&node=2152549031,Rs. 150.00,Bangles & Bracelet,Bangles & Bracelet,Alto Vida,http://ecx.images-amazon.com/images/I/41cf%2BgJpRUL._SL190_CR0 0 190 246_.jpg,Rs. 150.00,self Colour,Watches & Fashion Jewellery,http://www.amazon.in/Alto-Vida-Series-Unisex-Bracelet/dp/B00EKSKOHW/ref=sr_1_3/275-0905959-1711169?s=jewelry&ie=UTF8&qid=1395127304&sr=1-3,[<a class="buyAction" href="/gp/offer-listing/B00EKSKOHW/ref=dp_olp_0/275-0905959-1711169?ie=UTF8&amp;condition=all">these sellers</a>],Amazon.in: Buy Alto Vida Soul Loops Series Weed Green Unisex Wrap Bracelet at Low Prices in India | Fashion Jewellery Store,Buy Alto Vida Soul Loops Series Weed Green Unisex Wrap Bracelet at low prices in India at Amazon.in. Check out Alto Vida Soul Loops Series Weed Green Unisex Wrap Bracelet reviews  ratings  features  specifications and browse more Fashion Jewellery products online at best prices on Amazon.in.,None,<div class="bucket" id="productDescription"> <h2>Product Description</h2> <div class="content"> <h3 class="productDescriptionSource"></h3> <div class="productDescriptionWrapper">        The Soul Loops Bracelet is the most versatile and easy to wear bracelet. It's humble loop design gives it the name. It be combined with a lot of other bracelets to match any look from street to couture.              <div class="emptyClear"> </div> </div> </div> </div>,<div align="left" class="bucket" id="techSpecSoftlinesWrap"><h2>Product Specifications </h2> <div class="content"> <div id="techSpecSoftlines"> <table cellspacing="0"> <tr> <th colspan="2">Jewellery Information</th> </tr> <tr> <td class="td1">Brand</td> <td class="td2">                                             Alto Vida                                         </td> </tr> <tr> <td class="td1">Material</td> <td class="td2">                                             bamboo                                         </td> </tr> <tr> <td class="td1">Model Number</td> <td class="td2">                                             73-1                                         </td> </tr> </table> </div> </div> </div>,18:03:2014,None
B00EKSN64K,Alto Vida Buho Eye Black Bead Unisex Bracelet,http://www.amazon.in/Bangles-Bracelets/b/ref=sd_allcat_fj_bangles/276-6718833-1247838?ie=UTF8&node=2152549031,Rs. 180.00,Bangles & Bracelet,Bangles & Bracelet,Alto Vida,http://ecx.images-amazon.com/images/I/41cf%2BgJpRUL._SL190_CR0 0 190 246_.jpg,Rs. 180.00,self Colour,Watches & Fashion Jewellery,http://www.amazon.in/Alto-Vida-Black-Unisex-Bracelet/dp/B00EKSN64K/ref=sr_1_8/275-0905959-1711169?s=jewelry&ie=UTF8&qid=1395127304&sr=1-8,[<a class="buyAction" href="/gp/offer-listing/B00EKSN64K/ref=dp_olp_0/275-0905959-1711169?ie=UTF8&amp;condition=all">these sellers</a>],Amazon.in: Buy Alto Vida Buho Eye Black Bead Unisex Bracelet at Low Prices in India | Fashion Jewellery Store,Buy Alto Vida Buho Eye Black Bead Unisex Bracelet at low prices in India at Amazon.in. Check out Alto Vida Buho Eye Black Bead Unisex Bracelet reviews  ratings  features  specifications and browse more Fashion Jewellery products online at best prices on Amazon.in.,None,<div class="bucket" id="productDescription"> <h2>Product Description</h2> <div class="content"> <h3 class="productDescriptionSource"></h3> <div class="productDescriptionWrapper">        When you take a look at this bracelet  It looks very much like our Golden Orb Bracelet  only difference is when you take a closer look at the central golden bead.. Its different... its deep  mysterious and holods secrets like an Owl's Eye..! Very interesting..! Handstrung with jet black glass beads  a golden metal wire bead and a sterling silver clasp.              <div class="emptyClear"> </div> </div> </div> </div>,<div align="left" class="bucket" id="techSpecSoftlinesWrap"><h2>Product Specifications </h2> <div class="content"> <div id="techSpecSoftlines"> <table cellspacing="0"> <tr> <th colspan="2">Jewellery Information</th> </tr> <tr> <td class="td1">Brand</td> <td class="td2">                                             Alto Vida                                         </td> </tr> <tr> <td class="td1">Material</td> <td class="td2">                                             Non-Precious Metal                                         </td> </tr> <tr> <td class="td1">Model Number</td> <td class="td2">                                             62-1                                         </td> </tr> </table> </div> </div> </div>,18:03:2014,None
B00EKSLP34,Alto Vida Ocean Twirl Blue Unisex Wrap Bracelet,http://www.amazon.in/Bangles-Bracelets/b/ref=sd_allcat_fj_bangles/276-6718833-1247838?ie=UTF8&node=2152549031,Rs. 250.00,Bangles & Bracelet,Bangles & Bracelet,Alto Vida,http://ecx.images-amazon.com/images/I/41cf%2BgJpRUL._SL190_CR0 0 190 246_.jpg,Rs. 250.00,self Colour,Watches & Fashion Jewellery,http://www.amazon.in/Alto-Vida-Ocean-Unisex-Bracelet/dp/B00EKSLP34/ref=sr_1_2/275-0905959-1711169?s=jewelry&ie=UTF8&qid=1395127304&sr=1-2,[<a class="buyAction" href="/gp/offer-listing/B00EKSLP34/ref=dp_olp_0/275-0905959-1711169?ie=UTF8&amp;condition=all">these sellers</a>],Amazon.in: Buy Alto Vida Ocean Twirl Blue Unisex Wrap Bracelet at Low Prices in India | Fashion Jewellery Store,Buy Alto Vida Ocean Twirl Blue Unisex Wrap Bracelet at low prices in India at Amazon.in. Check out Alto Vida Ocean Twirl Blue Unisex Wrap Bracelet reviews  ratings  features  specifications and browse more Fashion Jewellery products online at best prices on Amazon.in.,None,<div class="bucket" id="productDescription"> <h2>Product Description</h2> <div class="content"> <h3 class="productDescriptionSource"></h3> <div class="productDescriptionWrapper">        POP ! Goes the blue colour on this bracelet. Inspired by the blue and white hues of the ocean... This is a must have for people who like the colour blue !              <div class="emptyClear"> </div> </div> </div> </div>,<div align="left" class="bucket" id="techSpecSoftlinesWrap"><h2>Product Specifications </h2> <div class="content"> <div id="techSpecSoftlines"> <table cellspacing="0"> <tr> <th colspan="2">Jewellery Information</th> </tr> <tr> <td class="td1">Brand</td> <td class="td2">                                             Alto Vida                                         </td> </tr> <tr> <td class="td1">Material</td> <td class="td2">                                             bamboo                                         </td> </tr> <tr> <td class="td1">Model Number</td> <td class="td2">                                             78-1                                         </td> </tr> </table> </div> </div> </div>,18:03:2014,None
B00EKSJK9K,Alto Vida Golden Orb Brown Bead Stretch Unisex Bracelet,http://www.amazon.in/Bangles-Bracelets/b/ref=sd_allcat_fj_bangles/276-6718833-1247838?ie=UTF8&node=2152549031,Rs. 149.00,Bangles & Bracelet,Bangles & Bracelet,Alto Vida,http://ecx.images-amazon.com/images/I/41cf%2BgJpRUL._SL190_CR0 0 190 246_.jpg,Rs. 149.00,self Colour,Watches & Fashion Jewellery,http://www.amazon.in/Alto-Vida-Golden-Stretch-Bracelet/dp/B00EKSJK9K/ref=sr_1_6/275-0905959-1711169?s=jewelry&ie=UTF8&qid=1395127304&sr=1-6,[<a class="buyAction" href="/gp/offer-listing/B00EKSJK9K/ref=dp_olp_0/275-0905959-1711169?ie=UTF8&amp;condition=all">these sellers</a>],Amazon.in: Buy Alto Vida Golden Orb Brown Bead Stretch Unisex Bracelet at Low Prices in India | Fashion Jewellery Store,Buy Alto Vida Golden Orb Brown Bead Stretch Unisex Bracelet at low prices in India at Amazon.in. Check out Alto Vida Golden Orb Brown Bead Stretch Unisex Bracelet reviews  ratings  features  specifications and browse more Fashion Jewellery products online at best prices on Amazon.in.,None,<div class="bucket" id="productDescription"> <h2>Product Description</h2> <div class="content"> <h3 class="productDescriptionSource"></h3> <div class="productDescriptionWrapper">        A single Golden Orb bead surrounded with brown glass beads makes this a striking and attention grabbing bracelet. Best worn stacked with other colours or paired with other pieces. Totally hand made from glass beads this stretch bracelet lends immediate sprucing up to any outfit.              <div class="emptyClear"> </div> </div> </div> </div>,<div align="left" class="bucket" id="techSpecSoftlinesWrap"><h2>Product Specifications </h2> <div class="content"> <div id="techSpecSoftlines"> <table cellspacing="0"> <tr> <th colspan="2">Jewellery Information</th> </tr> <tr> <td class="td1">Brand</td> <td class="td2">                                             Alto Vida                                         </td> </tr> <tr> <td class="td1">Material</td> <td class="td2">                                             glass                                         </td> </tr> <tr> <td class="td1">Model Number</td> <td class="td2">                                             38-1                                         </td> </tr> </table> </div> </div> </div>,18:03:2014,None
B00EMRIP04,Alto Vida Double Wrap Series Brown Unisex Bracelet,http://www.amazon.in/Bangles-Bracelets/b/ref=sd_allcat_fj_bangles/276-6718833-1247838?ie=UTF8&node=2152549031,Rs. 300.00,Bangles & Bracelet,Bangles & Bracelet,Alto Vida,http://ecx.images-amazon.com/images/I/41cf%2BgJpRUL._SL190_CR0 0 190 246_.jpg,Rs. 300.00,self Colour,Watches & Fashion Jewellery,http://www.amazon.in/Alto-Vida-Double-Series-Bracelet/dp/B00EMRIP04/ref=sr_1_4/275-0905959-1711169?s=jewelry&ie=UTF8&qid=1395127304&sr=1-4,[<a class="buyAction" href="/gp/offer-listing/B00EMRIP04/ref=dp_olp_0/275-0905959-1711169?ie=UTF8&amp;condition=all">these sellers</a>],Amazon.in: Buy Alto Vida Double Wrap Series Brown Unisex Bracelet at Low Prices in India | Fashion Jewellery Store,Buy Alto Vida Double Wrap Series Brown Unisex Bracelet at low prices in India at Amazon.in. Check out Alto Vida Double Wrap Series Brown Unisex Bracelet reviews  ratings  features  specifications and browse more Fashion Jewellery products online at best prices on Amazon.in.,None,<div class="bucket" id="productDescription"> <h2>Product Description</h2> <div class="content"> <h3 class="productDescriptionSource"></h3> <div class="productDescriptionWrapper">        A long double wrapping bracelet with a easy button clasp is another style essential from Alto Vida. It's simplistic style allows it to be worn on by itself or paired with any combination of wristwear.              <div class="emptyClear"> </div> </div> </div> </div>,<div align="left" class="bucket" id="techSpecSoftlinesWrap"><h2>Product Specifications </h2> <div class="content"> <div id="techSpecSoftlines"> <table cellspacing="0"> <tr> <th colspan="2">Jewellery Information</th> </tr> <tr> <td class="td1">Brand</td> <td class="td2">                                             Alto Vida                                         </td> </tr> <tr> <td class="td1">Material</td> <td class="td2">                                             Fabric                                         </td> </tr> <tr> <td class="td1">Model Number</td> <td class="td2">                                             86-1                                         </td> </tr> </table> </div> </div> </div>,18:03:2014,None
B00EKSKXJG,Alto Vida Touch Of Class Black and Red Unisex Strand Bracelet,http://www.amazon.in/Bangles-Bracelets/b/ref=sd_allcat_fj_bangles/276-6718833-1247838?ie=UTF8&node=2152549031,Rs. 440.00,Bangles & Bracelet,Bangles & Bracelet,Alto Vida,http://ecx.images-amazon.com/images/I/41cf%2BgJpRUL._SL190_CR0 0 190 246_.jpg,Rs. 440.00,self Colour,Watches & Fashion Jewellery,http://www.amazon.in/Alto-Vida-Unisex-Strand-Bracelet/dp/B00EKSKXJG/ref=sr_1_5/275-0905959-1711169?s=jewelry&ie=UTF8&qid=1395127304&sr=1-5,[<a class="buyAction" href="/gp/offer-listing/B00EKSKXJG/ref=dp_olp_0/275-0905959-1711169?ie=UTF8&amp;condition=all">these sellers</a>],Amazon.in: Buy Alto Vida Touch Of Class Black and Red Unisex Strand Bracelet at Low Prices in India | Fashion Jewellery Store,Buy Alto Vida Touch Of Class Black and Red Unisex Strand Bracelet at low prices in India at Amazon.in. Check out Alto Vida Touch Of Class Black and Red Unisex Strand Bracelet reviews  ratings  features  specifications and browse more Fashion Jewellery products online at best prices on Amazon.in.,None,<div class="bucket" id="productDescription"> <h2>Product Description</h2> <div class="content"> <h3 class="productDescriptionSource"></h3> <div class="productDescriptionWrapper">        Everything the name suggests... Put it on and feel an instant rise in your style quotient. Dark  Classy  Stylish with justt the right amount of bling for the people who like to keep it understated yet out there..! Totally handmade with super silky nylon cords and haematite beads. Elegantly classy and professionally styled.              <div class="emptyClear"> </div> </div> </div> </div>,<div align="left" class="bucket" id="techSpecSoftlinesWrap"><h2>Product Specifications </h2> <div class="content"> <div id="techSpecSoftlines"> <table cellspacing="0"> <tr> <th colspan="2">Jewellery Information</th> </tr> <tr> <td class="td1">Brand</td> <td class="td2">                                             Alto Vida                                         </td> </tr> <tr> <td class="td1">Material</td> <td class="td2">                                             Non-Precious Metal                                         </td> </tr> <tr> <td class="td1">Model Number</td> <td class="td2">                                             47-1                                         </td> </tr> </table> </div> </div> </div>,18:03:2014,None
B00EKSJFKE,Alto Vida Golden Orb Black Bead Stretch Unisex Bracelet,http://www.amazon.in/Bangles-Bracelets/b/ref=sd_allcat_fj_bangles/276-6718833-1247838?ie=UTF8&node=2152549031,Rs. 149.00,Bangles & Bracelet,Bangles & Bracelet,Alto Vida,http://ecx.images-amazon.com/images/I/41cf%2BgJpRUL._SL190_CR0 0 190 246_.jpg,Rs. 149.00,self Colour,Watches & Fashion Jewellery,http://www.amazon.in/Alto-Vida-Golden-Stretch-Bracelet/dp/B00EKSJFKE/ref=sr_1_1/275-0905959-1711169?s=jewelry&ie=UTF8&qid=1395127304&sr=1-1,[<a class="buyAction" href="/gp/offer-listing/B00EKSJFKE/ref=dp_olp_0/275-0905959-1711169?ie=UTF8&amp;condition=all">these sellers</a>],Amazon.in: Buy Alto Vida Golden Orb Black Bead Stretch Unisex Bracelet at Low Prices in India | Fashion Jewellery Store,Buy Alto Vida Golden Orb Black Bead Stretch Unisex Bracelet at low prices in India at Amazon.in. Check out Alto Vida Golden Orb Black Bead Stretch Unisex Bracelet reviews  ratings  features  specifications and browse more Fashion Jewellery products online at best prices on Amazon.in.,None,<div class="bucket" id="productDescription"> <h2>Product Description</h2> <div class="content"> <h3 class="productDescriptionSource"></h3> <div class="productDescriptionWrapper">        A single Golden Orb bead surrounded with black glass beads makes this a striking and attention grabbing bracelet. Best worn stacked with other colours or paired with other pieces. Totally hand made from glass beads this stretch bracelet lends immediate sprucing up to any outfit.              <div class="emptyClear"> </div> </div> </div> </div>,<div align="left" class="bucket" id="techSpecSoftlinesWrap"><h2>Product Specifications </h2> <div class="content"> <div id="techSpecSoftlines"> <table cellspacing="0"> <tr> <th colspan="2">Jewellery Information</th> </tr> <tr> <td class="td1">Brand</td> <td class="td2">                                             Alto Vida                                         </td> </tr> <tr> <td class="td1">Material</td> <td class="td2">                                             glass                                         </td> </tr> <tr> <td class="td1">Model Number</td> <td class="td2">                                             36-1                                         </td> </tr> </table> </div> </div> </div>,18:03:2014,None
B00EKSKTYU,Alto Vida Caramba Series Neo Hombres Unisex Wrap Bracelet,http://www.amazon.in/Bangles-Bracelets/b/ref=sd_allcat_fj_bangles/276-6718833-1247838?ie=UTF8&node=2152549031,Rs. 600.00,Bangles & Bracelet,Bangles & Bracelet,Alto Vida,http://ecx.images-amazon.com/images/I/41cf%2BgJpRUL._SL190_CR0 0 190 246_.jpg,Rs. 600.00,self Colour,Watches & Fashion Jewellery,http://www.amazon.in/Alto-Vida-Caramba-Hombres-Bracelet/dp/B00EKSKTYU/ref=sr_1_10/275-0905959-1711169?s=jewelry&ie=UTF8&qid=1395127304&sr=1-10,[<a class="buyAction" href="/gp/offer-listing/B00EKSKTYU/ref=dp_olp_0/275-0905959-1711169?ie=UTF8&amp;condition=all">these sellers</a>],Amazon.in: Buy Alto Vida Caramba Series Neo Hombres Unisex Wrap Bracelet at Low Prices in India | Fashion Jewellery Store,Buy Alto Vida Caramba Series Neo Hombres Unisex Wrap Bracelet at low prices in India at Amazon.in. Check out Alto Vida Caramba Series Neo Hombres Unisex Wrap Bracelet reviews  ratings  features  specifications and browse more Fashion Jewellery products online at best prices on Amazon.in.,None,<div class="bucket" id="productDescription"> <h2>Product Description</h2> <div class="content"> <h3 class="productDescriptionSource"></h3> <div class="productDescriptionWrapper">        21st century pop culture inspired colours and an intriguing clasp system makes this bracelet beautiful to look at and an even greater delight to wear. Put it on and watch people go "Aye Caramba !!"              <div class="emptyClear"> </div> </div> </div> </div>,<div align="left" class="bucket" id="techSpecSoftlinesWrap"><h2>Product Specifications </h2> <div class="content"> <div id="techSpecSoftlines"> <table cellspacing="0"> <tr> <th colspan="2">Jewellery Information</th> </tr> <tr> <td class="td1">Brand</td> <td class="td2">                                             Alto Vida                                         </td> </tr> <tr> <td class="td1">Material</td> <td class="td2">                                             bamboo                                         </td> </tr> <tr> <td class="td1">Model Number</td> <td class="td2">                                             74-1                                         </td> </tr> </table> </div> </div> </div>,18:03:2014,None
B00EMBC80I,Alto Vida Street Basix Series Black Wrap Unisex Wrap Bracelet,http://www.amazon.in/Bangles-Bracelets/b/ref=sd_allcat_fj_bangles/276-6718833-1247838?ie=UTF8&node=2152549031,Rs. 190.00,Bangles & Bracelet,Bangles & Bracelet,Alto Vida,http://ecx.images-amazon.com/images/I/41cf%2BgJpRUL._SL190_CR0 0 190 246_.jpg,Rs. 190.00,self Colour,Watches & Fashion Jewellery,http://www.amazon.in/Alto-Vida-Street-Series-Bracelet/dp/B00EMBC80I/ref=sr_1_7/275-0905959-1711169?s=jewelry&ie=UTF8&qid=1395127304&sr=1-7,[<a class="buyAction" href="/gp/offer-listing/B00EMBC80I/ref=dp_olp_0/275-0905959-1711169?ie=UTF8&amp;condition=all">these sellers</a>],Amazon.in: Buy Alto Vida Street Basix Series Black Wrap Unisex Wrap Bracelet at Low Prices in India | Fashion Jewellery Store,Buy Alto Vida Street Basix Series Black Wrap Unisex Wrap Bracelet at low prices in India at Amazon.in. Check out Alto Vida Street Basix Series Black Wrap Unisex Wrap Bracelet reviews  ratings  features  specifications and browse more Fashion Jewellery products online at best prices on Amazon.in.,None,<div class="bucket" id="productDescription"> <h2>Product Description</h2> <div class="content"> <h3 class="productDescriptionSource"></h3> <div class="productDescriptionWrapper">        You know that one pair of jeans that match with everything you have in that colour ? Well.. The basics bracelet is just that. Its that essential item you definitely need to have in your accessory box. Simple  Stylish and Easy Going..! Get your Basics right..!              <div class="emptyClear"> </div> </div> </div> </div>,<div align="left" class="bucket" id="techSpecSoftlinesWrap"><h2>Product Specifications </h2> <div class="content"> <div id="techSpecSoftlines"> <table cellspacing="0"> <tr> <th colspan="2">Jewellery Information</th> </tr> <tr> <td class="td1">Brand</td> <td class="td2">                                             Alto Vida                                         </td> </tr> <tr> <td class="td1">Material</td> <td class="td2">                                             Fabric                                         </td> </tr> <tr> <td class="td1">Model Number</td> <td class="td2">                                             82-1                                         </td> </tr> </table> </div> </div> </div>,18:03:2014,None
B00EKSKYW2,Alto Vida Caramba Series Neo Chicas Unisex Wrap Bracelet,http://www.amazon.in/Bangles-Bracelets/b/ref=sd_allcat_fj_bangles/276-6718833-1247838?ie=UTF8&node=2152549031,Rs. 600.00,Bangles & Bracelet,Bangles & Bracelet,Alto Vida,http://ecx.images-amazon.com/images/I/41cf%2BgJpRUL._SL190_CR0 0 190 246_.jpg,Rs. 600.00,self Colour,Watches & Fashion Jewellery,http://www.amazon.in/Alto-Vida-Caramba-Series-Bracelet/dp/B00EKSKYW2/ref=sr_1_9/275-0905959-1711169?s=jewelry&ie=UTF8&qid=1395127304&sr=1-9,[<a class="buyAction" href="/gp/offer-listing/B00EKSKYW2/ref=dp_olp_0/275-0905959-1711169?ie=UTF8&amp;condition=all">these sellers</a>],Amazon.in: Buy Alto Vida Caramba Series Neo Chicas Unisex Wrap Bracelet at Low Prices in India | Fashion Jewellery Store,Buy Alto Vida Caramba Series Neo Chicas Unisex Wrap Bracelet at low prices in India at Amazon.in. Check out Alto Vida Caramba Series Neo Chicas Unisex Wrap Bracelet reviews  ratings  features  specifications and browse more Fashion Jewellery products online at best prices on Amazon.in.,None,<div class="bucket" id="productDescription"> <h2>Product Description</h2> <div class="content"> <h3 class="productDescriptionSource"></h3> <div class="productDescriptionWrapper">        21st century pop culture inspired colours and an intriguing clasp system makes this bracelet beautiful to look at and an even greater delight to wear. Put it on and watch people go "Aye Caramba !!"              <div class="emptyClear"> </div> </div> </div> </div>,<div align="left" class="bucket" id="techSpecSoftlinesWrap"><h2>Product Specifications </h2> <div class="content"> <div id="techSpecSoftlines"> <table cellspacing="0"> <tr> <th colspan="2">Jewellery Information</th> </tr> <tr> <td class="td1">Brand</td> <td class="td2">                                             Alto Vida                                         </td> </tr> <tr> <td class="td1">Material</td> <td class="td2">                                             bamboo                                         </td> </tr> <tr> <td class="td1">Model Number</td> <td class="td2">                                             75-1                                         </td> </tr> </table> </div> </div> </div>,18:03:2014,None
B00EKSLJGC,Alto Vida Caramba Series Noir Chicas Unisex Wrap Bracelet,http://www.amazon.in/Bangles-Bracelets/b/ref=sd_allcat_fj_bangles/276-6718833-1247838?ie=UTF8&node=2152549031,Rs. 600.00,Bangles & Bracelet,Bangles & Bracelet,Alto Vida,http://ecx.images-amazon.com/images/I/41cf%2BgJpRUL._SL190_CR0 0 190 246_.jpg,Rs. 600.00,self Colour,Watches & Fashion Jewellery,http://www.amazon.in/Alto-Vida-Caramba-Series-Bracelet/dp/B00EKSLJGC/ref=sr_1_11/275-0905959-1711169?s=jewelry&ie=UTF8&qid=1395127304&sr=1-11,[<a class="buyAction" href="/gp/offer-listing/B00EKSLJGC/ref=dp_olp_0/275-0905959-1711169?ie=UTF8&amp;condition=all">these sellers</a>],Amazon.in: Buy Alto Vida Caramba Series Noir Chicas Unisex Wrap Bracelet at Low Prices in India | Fashion Jewellery Store,Buy Alto Vida Caramba Series Noir Chicas Unisex Wrap Bracelet at low prices in India at Amazon.in. Check out Alto Vida Caramba Series Noir Chicas Unisex Wrap Bracelet reviews  ratings  features  specifications and browse more Fashion Jewellery products online at best prices on Amazon.in.,None,<div class="bucket" id="productDescription"> <h2>Product Description</h2> <div class="content"> <h3 class="productDescriptionSource"></h3> <div class="productDescriptionWrapper">        21st century street culture inspired colours and an intriguing clasp system makes this bracelet beautiful to look at and an even greater delight to wear. Put it on and watch people go "Aye Caramba !!"              <div class="emptyClear"> </div> </div> </div> </div>,<div align="left" class="bucket" id="techSpecSoftlinesWrap"><h2>Product Specifications </h2> <div class="content"> <div id="techSpecSoftlines"> <table cellspacing="0"> <tr> <th colspan="2">Jewellery Information</th> </tr> <tr> <td class="td1">Brand</td> <td class="td2">                                             Alto Vida                                         </td> </tr> <tr> <td class="td1">Material</td> <td class="td2">                                             bamboo                                         </td> </tr> <tr> <td class="td1">Model Number</td> <td class="td2">                                             77-1                                         </td> </tr> </table> </div> </div> </div>,18:03:2014,None
