B00EKSLN5Y,Alto Vida Dark Mystery Brown Unisex Wrap Bracelet,http://www.amazon.in/Bangles-Bracelets/b/ref=sd_allcat_fj_bangles/276-6718833-1247838?ie=UTF8&node=2152549031,Rs. 440.00,Bangles & Bracelet,Bangles & Bracelet,Alto Vida,http://ecx.images-amazon.com/images/I/41cf%2BgJpRUL._SL190_CR0 0 190 246_.jpg,Rs. 440.00,self Colour,Watches & Fashion Jewellery,http://www.amazon.in/Alto-Vida-Mystery-Unisex-Bracelet/dp/B00EKSLN5Y/ref=sr_1_15/275-0905959-1711169?s=jewelry&ie=UTF8&qid=1395127304&sr=1-15,[<a class="buyAction" href="/gp/offer-listing/B00EKSLN5Y/ref=dp_olp_0/275-0905959-1711169?ie=UTF8&amp;condition=all">these sellers</a>],Amazon.in: Buy Alto Vida Dark Mystery Brown Unisex Wrap Bracelet at Low Prices in India | Fashion Jewellery Store,Buy Alto Vida Dark Mystery Brown Unisex Wrap Bracelet at low prices in India at Amazon.in. Check out Alto Vida Dark Mystery Brown Unisex Wrap Bracelet reviews  ratings  features  specifications and browse more Fashion Jewellery products online at best prices on Amazon.in.,None,<div class="bucket" id="productDescription"> <h2>Product Description</h2> <div class="content"> <h3 class="productDescriptionSource"></h3> <div class="productDescriptionWrapper">        Along the lines of our 'Mystery Hook' &amp; 'Mystery Klass' series of amazing bracelets comes our "Dark Mystery" bracelet. This ones for all the peeps out there wanting to show their dark mysterious side. This bracelet is completely hand made using soft black cotton &amp; silk cords and a smart haematite bead clasp.              <div class="emptyClear"> </div> </div> </div> </div>,<div align="left" class="bucket" id="techSpecSoftlinesWrap"><h2>Product Specifications </h2> <div class="content"> <div id="techSpecSoftlines"> <table cellspacing="0"> <tr> <th colspan="2">Jewellery Information</th> </tr> <tr> <td class="td1">Brand</td> <td class="td2">                                             Alto Vida                                         </td> </tr> <tr> <td class="td1">Material</td> <td class="td2">                                             Non-Precious Metal                                         </td> </tr> <tr> <td class="td1">Model Number</td> <td class="td2">                                             52-1                                         </td> </tr> </table> </div> </div> </div>,18:03:2014,None
B00EKSLEE4,Alto Vida Caramba Series Noir Hombres Unisex Wrap Bracelet,http://www.amazon.in/Bangles-Bracelets/b/ref=sd_allcat_fj_bangles/276-6718833-1247838?ie=UTF8&node=2152549031,Rs. 600.00,Bangles & Bracelet,Bangles & Bracelet,Alto Vida,http://ecx.images-amazon.com/images/I/41cf%2BgJpRUL._SL190_CR0 0 190 246_.jpg,Rs. 600.00,self Colour,Watches & Fashion Jewellery,http://www.amazon.in/Alto-Vida-Caramba-Hombres-Bracelet/dp/B00EKSLEE4/ref=sr_1_12/275-0905959-1711169?s=jewelry&ie=UTF8&qid=1395127304&sr=1-12,[<a class="buyAction" href="/gp/offer-listing/B00EKSLEE4/ref=dp_olp_0/275-0905959-1711169?ie=UTF8&amp;condition=all">these sellers</a>],Amazon.in: Buy Alto Vida Caramba Series Noir Hombres Unisex Wrap Bracelet at Low Prices in India | Fashion Jewellery Store,Buy Alto Vida Caramba Series Noir Hombres Unisex Wrap Bracelet at low prices in India at Amazon.in. Check out Alto Vida Caramba Series Noir Hombres Unisex Wrap Bracelet reviews  ratings  features  specifications and browse more Fashion Jewellery products online at best prices on Amazon.in.,None,<div class="bucket" id="productDescription"> <h2>Product Description</h2> <div class="content"> <h3 class="productDescriptionSource"></h3> <div class="productDescriptionWrapper">        21st century street culture inspired colours and an intriguing clasp system makes this bracelet beautiful to look at and an even greater delight to wear. Put it on and watch people go "Aye Caramba !!"              <div class="emptyClear"> </div> </div> </div> </div>,<div align="left" class="bucket" id="techSpecSoftlinesWrap"><h2>Product Specifications </h2> <div class="content"> <div id="techSpecSoftlines"> <table cellspacing="0"> <tr> <th colspan="2">Jewellery Information</th> </tr> <tr> <td class="td1">Brand</td> <td class="td2">                                             Alto Vida                                         </td> </tr> <tr> <td class="td1">Material</td> <td class="td2">                                             bamboo                                         </td> </tr> <tr> <td class="td1">Model Number</td> <td class="td2">                                             76-1                                         </td> </tr> </table> </div> </div> </div>,18:03:2014,None
B00EMBCSG2,Alto Vida Double Wrap Series Red Unisex Bracelet,http://www.amazon.in/Bangles-Bracelets/b/ref=sd_allcat_fj_bangles/276-6718833-1247838?ie=UTF8&node=2152549031,Rs. 300.00,Bangles & Bracelet,Bangles & Bracelet,Alto Vida,http://ecx.images-amazon.com/images/I/41cf%2BgJpRUL._SL190_CR0 0 190 246_.jpg,Rs. 300.00,self Colour,Watches & Fashion Jewellery,http://www.amazon.in/Alto-Vida-Double-Series-Bracelet/dp/B00EMBCSG2/ref=sr_1_17/275-0905959-1711169?s=jewelry&ie=UTF8&qid=1395127304&sr=1-17,[<a class="buyAction" href="/gp/offer-listing/B00EMBCSG2/ref=dp_olp_0/275-0905959-1711169?ie=UTF8&amp;condition=all">these sellers</a>],Amazon.in: Buy Alto Vida Double Wrap Series Red Unisex Bracelet at Low Prices in India | Fashion Jewellery Store,Buy Alto Vida Double Wrap Series Red Unisex Bracelet at low prices in India at Amazon.in. Check out Alto Vida Double Wrap Series Red Unisex Bracelet reviews  ratings  features  specifications and browse more Fashion Jewellery products online at best prices on Amazon.in.,None,<div class="bucket" id="productDescription"> <h2>Product Description</h2> <div class="content"> <h3 class="productDescriptionSource"></h3> <div class="productDescriptionWrapper">        A long double wrapping bracelet with a easy button clasp is another style essential from Alto Vida. It's simplistic style allows it to be worn on by itself or paired with any combination of wristwear.              <div class="emptyClear"> </div> </div> </div> </div>,<div align="left" class="bucket" id="techSpecSoftlinesWrap"><h2>Product Specifications </h2> <div class="content"> <div id="techSpecSoftlines"> <table cellspacing="0"> <tr> <th colspan="2">Jewellery Information</th> </tr> <tr> <td class="td1">Brand</td> <td class="td2">                                             Alto Vida                                         </td> </tr> <tr> <td class="td1">Material</td> <td class="td2">                                             Fabric                                         </td> </tr> <tr> <td class="td1">Model Number</td> <td class="td2">                                             87-1                                         </td> </tr> </table> </div> </div> </div>,18:03:2014,None
B00EKSJHTS,Alto Vida Crystal Soul Series Brown Unisex Wrap Bracelet,http://www.amazon.in/Bangles-Bracelets/b/ref=sd_allcat_fj_bangles/276-6718833-1247838?ie=UTF8&node=2152549031,Rs. 500.00,Bangles & Bracelet,Bangles & Bracelet,Alto Vida,http://ecx.images-amazon.com/images/I/41cf%2BgJpRUL._SL190_CR0 0 190 246_.jpg,Rs. 500.00,self Colour,Watches & Fashion Jewellery,http://www.amazon.in/Alto-Vida-Crystal-Series-Bracelet/dp/B00EKSJHTS/ref=sr_1_14/275-0905959-1711169?s=jewelry&ie=UTF8&qid=1395127304&sr=1-14,[<a class="buyAction" href="/gp/offer-listing/B00EKSJHTS/ref=dp_olp_0/275-0905959-1711169?ie=UTF8&amp;condition=all">these sellers</a>],Amazon.in: Buy Alto Vida Crystal Soul Series Brown Unisex Wrap Bracelet at Low Prices in India | Fashion Jewellery Store,Buy Alto Vida Crystal Soul Series Brown Unisex Wrap Bracelet at low prices in India at Amazon.in. Check out Alto Vida Crystal Soul Series Brown Unisex Wrap Bracelet reviews  ratings  features  specifications and browse more Fashion Jewellery products online at best prices on Amazon.in.,None,<div class="bucket" id="productDescription"> <h2>Product Description</h2> <div class="content"> <h3 class="productDescriptionSource"></h3> <div class="productDescriptionWrapper">        The first in our signature series of Bamboo &amp; Crystal range of bracelets; The Crystal Soul Bracelet will never fail to fascinate you every time you wear it or put it on. A definite wrist candy that defines the new cool. It features a unique hand crafted Bamboo-crystal button sling type clasp. This is one piece you cannot afford to miss.              <div class="emptyClear"> </div> </div> </div> </div>,<div align="left" class="bucket" id="techSpecSoftlinesWrap"><h2>Product Specifications </h2> <div class="content"> <div id="techSpecSoftlines"> <table cellspacing="0"> <tr> <th colspan="2">Jewellery Information</th> </tr> <tr> <td class="td1">Brand</td> <td class="td2">                                             Alto Vida                                         </td> </tr> <tr> <td class="td1">Material</td> <td class="td2">                                             bamboo                                         </td> </tr> <tr> <td class="td1">Model Number</td> <td class="td2">                                             64-1                                         </td> </tr> </table> </div> </div> </div>,18:03:2014,None
B00EKSN9TM,Alto Vida Crystal Soul Series Blue Unisex Wrap Bracelet,http://www.amazon.in/Bangles-Bracelets/b/ref=sd_allcat_fj_bangles/276-6718833-1247838?ie=UTF8&node=2152549031,Rs. 500.00,Bangles & Bracelet,Bangles & Bracelet,Alto Vida,http://ecx.images-amazon.com/images/I/41cf%2BgJpRUL._SL190_CR0 0 190 246_.jpg,Rs. 500.00,self Colour,Watches & Fashion Jewellery,http://www.amazon.in/Alto-Vida-Crystal-Series-Bracelet/dp/B00EKSN9TM/ref=sr_1_13/275-0905959-1711169?s=jewelry&ie=UTF8&qid=1395127304&sr=1-13,[<a class="buyAction" href="/gp/offer-listing/B00EKSN9TM/ref=dp_olp_0/275-0905959-1711169?ie=UTF8&amp;condition=all">these sellers</a>],Amazon.in: Buy Alto Vida Crystal Soul Series Blue Unisex Wrap Bracelet at Low Prices in India | Fashion Jewellery Store,Buy Alto Vida Crystal Soul Series Blue Unisex Wrap Bracelet at low prices in India at Amazon.in. Check out Alto Vida Crystal Soul Series Blue Unisex Wrap Bracelet reviews  ratings  features  specifications and browse more Fashion Jewellery products online at best prices on Amazon.in.,None,<div class="bucket" id="productDescription"> <h2>Product Description</h2> <div class="content"> <h3 class="productDescriptionSource"></h3> <div class="productDescriptionWrapper">        The first in our signature series of Bamboo &amp; Crystal range of bracelets; The Crystal Soul Bracelet will never fail to fascinate you every time you wear it or put it on. A definite wrist candy that defines the new cool. It features a unique hand crafted Bamboo-crystal button sling type clasp. This is one piece you cannot afford to miss.              <div class="emptyClear"> </div> </div> </div> </div>,<div align="left" class="bucket" id="techSpecSoftlinesWrap"><h2>Product Specifications </h2> <div class="content"> <div id="techSpecSoftlines"> <table cellspacing="0"> <tr> <th colspan="2">Jewellery Information</th> </tr> <tr> <td class="td1">Brand</td> <td class="td2">                                             Alto Vida                                         </td> </tr> <tr> <td class="td1">Material</td> <td class="td2">                                             bamboo                                         </td> </tr> <tr> <td class="td1">Model Number</td> <td class="td2">                                             63-1                                         </td> </tr> </table> </div> </div> </div>,18:03:2014,None
B00EKSJN56,Alto Vida Golden Orb Blue Bead Stretch Unisex Bracelet,http://www.amazon.in/Bangles-Bracelets/b/ref=sd_allcat_fj_bangles/276-6718833-1247838?ie=UTF8&node=2152549031,Rs. 149.00,Bangles & Bracelet,Bangles & Bracelet,Alto Vida,http://ecx.images-amazon.com/images/I/41cf%2BgJpRUL._SL190_CR0 0 190 246_.jpg,Rs. 149.00,self Colour,Watches & Fashion Jewellery,http://www.amazon.in/Alto-Vida-Golden-Stretch-Bracelet/dp/B00EKSJN56/ref=sr_1_21/275-0905959-1711169?s=jewelry&ie=UTF8&qid=1395127304&sr=1-21,[<a class="buyAction" href="/gp/offer-listing/B00EKSJN56/ref=dp_olp_0/275-0905959-1711169?ie=UTF8&amp;condition=all">these sellers</a>],Amazon.in: Buy Alto Vida Golden Orb Blue Bead Stretch Unisex Bracelet at Low Prices in India | Fashion Jewellery Store,Buy Alto Vida Golden Orb Blue Bead Stretch Unisex Bracelet at low prices in India at Amazon.in. Check out Alto Vida Golden Orb Blue Bead Stretch Unisex Bracelet reviews  ratings  features  specifications and browse more Fashion Jewellery products online at best prices on Amazon.in.,None,<div class="bucket" id="productDescription"> <h2>Product Description</h2> <div class="content"> <h3 class="productDescriptionSource"></h3> <div class="productDescriptionWrapper">        A single Golden Orb bead surrounded with blue glass beads makes this a striking and attention grabbing bracelet. Best worn stacked with other colours or paired with other pieces. Totally hand made from glass beads this stretch bracelet lends immediate sprucing up to any outfit.              <div class="emptyClear"> </div> </div> </div> </div>,<div align="left" class="bucket" id="techSpecSoftlinesWrap"><h2>Product Specifications </h2> <div class="content"> <div id="techSpecSoftlines"> <table cellspacing="0"> <tr> <th colspan="2">Jewellery Information</th> </tr> <tr> <td class="td1">Brand</td> <td class="td2">                                             Alto Vida                                         </td> </tr> <tr> <td class="td1">Material</td> <td class="td2">                                             glass                                         </td> </tr> <tr> <td class="td1">Model Number</td> <td class="td2">                                             39-1                                         </td> </tr> </table> </div> </div> </div>,18:03:2014,None
B00EKSLZHK,Alto Vida Explorer Series Black and Red Unisex Wrap Bracelet,http://www.amazon.in/Bangles-Bracelets/b/ref=sd_allcat_fj_bangles/276-6718833-1247838?ie=UTF8&node=2152549031,Rs. 585.00,Bangles & Bracelet,Bangles & Bracelet,Alto Vida,http://ecx.images-amazon.com/images/I/41cf%2BgJpRUL._SL190_CR0 0 190 246_.jpg,Rs. 585.00,self Colour,Watches & Fashion Jewellery,http://www.amazon.in/Alto-Vida-Explorer-Series-Bracelet/dp/B00EKSLZHK/ref=sr_1_18/275-0905959-1711169?s=jewelry&ie=UTF8&qid=1395127304&sr=1-18,[<a class="buyAction" href="/gp/offer-listing/B00EKSLZHK/ref=dp_olp_0/275-0905959-1711169?ie=UTF8&amp;condition=all">these sellers</a>],Amazon.in: Buy Alto Vida Explorer Series Black and Red Unisex Wrap Bracelet at Low Prices in India | Fashion Jewellery Store,Buy Alto Vida Explorer Series Black and Red Unisex Wrap Bracelet at low prices in India at Amazon.in. Check out Alto Vida Explorer Series Black and Red Unisex Wrap Bracelet reviews  ratings  features  specifications and browse more Fashion Jewellery products online at best prices on Amazon.in.,None,<div class="bucket" id="productDescription"> <h2>Product Description</h2> <div class="content"> <h3 class="productDescriptionSource"></h3> <div class="productDescriptionWrapper">        For all the explorers and urban adventurers who have set out to find their own destiny rather than waiting.. For all the people set out to discover something and reach somewhere  for everyoe who believes that the most difficult thing to find is your own soul... Our Explorer bracelet comes in a variety of shades and colours to suit your journey... Made painstakingly with cotton cords and a patented bamboo-magnet arrow clasp  this bracelet is built to last longer than your search continues.              <div class="emptyClear"> </div> </div> </div> </div>,<div align="left" class="bucket" id="techSpecSoftlinesWrap"><h2>Product Specifications </h2> <div class="content"> <div id="techSpecSoftlines"> <table cellspacing="0"> <tr> <th colspan="2">Jewellery Information</th> </tr> <tr> <td class="td1">Brand</td> <td class="td2">                                             Alto Vida                                         </td> </tr> <tr> <td class="td1">Material</td> <td class="td2">                                             bamboo                                         </td> </tr> <tr> <td class="td1">Model Number</td> <td class="td2">                                             55-1                                         </td> </tr> </table> </div> </div> </div>,18:03:2014,None
B00EKSJPRC,Alto Vida Golden Orb Yellow Bead Stretch Unisex Bracelet,http://www.amazon.in/Bangles-Bracelets/b/ref=sd_allcat_fj_bangles/276-6718833-1247838?ie=UTF8&node=2152549031,Rs. 149.00,Bangles & Bracelet,Bangles & Bracelet,Alto Vida,http://ecx.images-amazon.com/images/I/41cf%2BgJpRUL._SL190_CR0 0 190 246_.jpg,Rs. 149.00,self Colour,Watches & Fashion Jewellery,http://www.amazon.in/Alto-Vida-Golden-Stretch-Bracelet/dp/B00EKSJPRC/ref=sr_1_23/275-0905959-1711169?s=jewelry&ie=UTF8&qid=1395127304&sr=1-23,[<a class="buyAction" href="/gp/offer-listing/B00EKSJPRC/ref=dp_olp_0/275-0905959-1711169?ie=UTF8&amp;condition=all">these sellers</a>],Amazon.in: Buy Alto Vida Golden Orb Yellow Bead Stretch Unisex Bracelet at Low Prices in India | Fashion Jewellery Store,Buy Alto Vida Golden Orb Yellow Bead Stretch Unisex Bracelet at low prices in India at Amazon.in. Check out Alto Vida Golden Orb Yellow Bead Stretch Unisex Bracelet reviews  ratings  features  specifications and browse more Fashion Jewellery products online at best prices on Amazon.in.,None,<div class="bucket" id="productDescription"> <h2>Product Description</h2> <div class="content"> <h3 class="productDescriptionSource"></h3> <div class="productDescriptionWrapper">        A single Golden Orb bead surrounded with yellow glass beads makes this a striking and attention grabbing bracelet. Best worn stacked with other colours or paired with other pieces. Totally hand made from glass beads this stretch bracelet lends immediate sprucing up to any outfit.              <div class="emptyClear"> </div> </div> </div> </div>,<div align="left" class="bucket" id="techSpecSoftlinesWrap"><h2>Product Specifications </h2> <div class="content"> <div id="techSpecSoftlines"> <table cellspacing="0"> <tr> <th colspan="2">Jewellery Information</th> </tr> <tr> <td class="td1">Brand</td> <td class="td2">                                             Alto Vida                                         </td> </tr> <tr> <td class="td1">Material</td> <td class="td2">                                             glass                                         </td> </tr> <tr> <td class="td1">Model Number</td> <td class="td2">                                             65-1                                         </td> </tr> </table> </div> </div> </div>,18:03:2014,None
B00EKSMD2Q,Alto Vida Grapple Series Brown Multi Strand Unisex Bracelet,http://www.amazon.in/Bangles-Bracelets/b/ref=sd_allcat_fj_bangles/276-6718833-1247838?ie=UTF8&node=2152549031,Rs. 250.00,Bangles & Bracelet,Bangles & Bracelet,Alto Vida,http://ecx.images-amazon.com/images/I/41cf%2BgJpRUL._SL190_CR0 0 190 246_.jpg,Rs. 250.00,self Colour,Watches & Fashion Jewellery,http://www.amazon.in/Alto-Vida-Grapple-Series-Bracelet/dp/B00EKSMD2Q/ref=sr_1_24/275-0905959-1711169?s=jewelry&ie=UTF8&qid=1395127304&sr=1-24,[<a class="buyAction" href="/gp/offer-listing/B00EKSMD2Q/ref=dp_olp_0/275-0905959-1711169?ie=UTF8&amp;condition=all">these sellers</a>],Amazon.in: Buy Alto Vida Grapple Series Brown Multi Strand Unisex Bracelet at Low Prices in India | Fashion Jewellery Store,Buy Alto Vida Grapple Series Brown Multi Strand Unisex Bracelet at low prices in India at Amazon.in. Check out Alto Vida Grapple Series Brown Multi Strand Unisex Bracelet reviews  ratings  features  specifications and browse more Fashion Jewellery products online at best prices on Amazon.in.,None,<div class="bucket" id="productDescription"> <h2>Product Description</h2> <div class="content"> <h3 class="productDescriptionSource"></h3> <div class="productDescriptionWrapper">        Simple  Rugged  Rustic and Cool..! The Grapple Bracelet is perfect for remixing with almost any other set of bracelets. Stack it up with our Explorer Bracelets or the Golden Orb Bracelets to add an interesting detail to the piece. Hand crafted with jute cotton cords and a hand carved bamboo hook clasp makes it 98% eco friendly and earth loving.              <div class="emptyClear"> </div> </div> </div> </div>,<div align="left" class="bucket" id="techSpecSoftlinesWrap"><h2>Product Specifications </h2> <div class="content"> <div id="techSpecSoftlines"> <table cellspacing="0"> <tr> <th colspan="2">Jewellery Information</th> </tr> <tr> <td class="td1">Brand</td> <td class="td2">                                             Alto Vida                                         </td> </tr> <tr> <td class="td1">Material</td> <td class="td2">                                             bamboo                                         </td> </tr> <tr> <td class="td1">Model Number</td> <td class="td2">                                             58-1                                         </td> </tr> </table> </div> </div> </div>,18:03:2014,None
B00EKSMUUQ,Alto Vida Grapple Series Red Multi Strand Unisex Bracelet,http://www.amazon.in/Bangles-Bracelets/b/ref=sd_allcat_fj_bangles/276-6718833-1247838?ie=UTF8&node=2152549031,Rs. 250.00,Bangles & Bracelet,Bangles & Bracelet,Alto Vida,http://ecx.images-amazon.com/images/I/41cf%2BgJpRUL._SL190_CR0 0 190 246_.jpg,Rs. 250.00,self Colour,Watches & Fashion Jewellery,http://www.amazon.in/Alto-Vida-Grapple-Series-Bracelet/dp/B00EKSMUUQ/ref=sr_1_26/275-0905959-1711169?s=jewelry&ie=UTF8&qid=1395127304&sr=1-26,[<a class="buyAction" href="/gp/offer-listing/B00EKSMUUQ/ref=dp_olp_0/275-0905959-1711169?ie=UTF8&amp;condition=all">these sellers</a>],Amazon.in: Buy Alto Vida Grapple Series Red Multi Strand Unisex Bracelet at Low Prices in India | Fashion Jewellery Store,Buy Alto Vida Grapple Series Red Multi Strand Unisex Bracelet at low prices in India at Amazon.in. Check out Alto Vida Grapple Series Red Multi Strand Unisex Bracelet reviews  ratings  features  specifications and browse more Fashion Jewellery products online at best prices on Amazon.in.,None,<div class="bucket" id="productDescription"> <h2>Product Description</h2> <div class="content"> <h3 class="productDescriptionSource"></h3> <div class="productDescriptionWrapper">        Simple  Rugged  Rustic and Cool..! The Grapple Bracelet is perfect for remixing with almost any other set of bracelets. Stack it up with our Explorer Bracelets or the Golden Orb Bracelets to add an interesting detail to the piece. Hand crafted with jute cotton cords and a hand carved bamboo hook clasp makes it 98% eco friendly and earth loving.              <div class="emptyClear"> </div> </div> </div> </div>,<div align="left" class="bucket" id="techSpecSoftlinesWrap"><h2>Product Specifications </h2> <div class="content"> <div id="techSpecSoftlines"> <table cellspacing="0"> <tr> <th colspan="2">Jewellery Information</th> </tr> <tr> <td class="td1">Brand</td> <td class="td2">                                             Alto Vida                                         </td> </tr> <tr> <td class="td1">Material</td> <td class="td2">                                             bamboo                                         </td> </tr> <tr> <td class="td1">Model Number</td> <td class="td2">                                             60-1                                         </td> </tr> </table> </div> </div> </div>,18:03:2014,None
