B00DRE10QO,Nike Trendy EDT for Women  Pink  75ml,http://www.amazon.in/Fragrances/b/ref=sd_allcat_beauty_fragrance/276-6718833-1247838?ie=UTF8&node=1374298031,Rs. 648.00,Fragranc,Nike,Nina Ricci,http://ecx.images-amazon.com/images/I/31l1aSi2PEL._AA160_.jpg,Rs. 648.00,self Colour,Beauty & Health,http://www.amazon.in/Nike-Trendy-Women-Pink-75ml/dp/B00DRE10QO/ref=sr_1_5/275-1805524-5845351?s=beauty&ie=UTF8&qid=1395126866&sr=1-5,[<a class="buyAction" href="/gp/offer-listing/B00DRE10QO/ref=dp_olp_0/275-1805524-5845351?ie=UTF8&amp;condition=all">these sellers</a>],Amazon.in: Buy Nike Trendy EDT for Women  Pink  75ml Online at Best Price in India | Amazon Beauty Store,Buy Nike Trendy EDT for Women  Pink  75ml at lowest price in India on Amazon.in. Check out Nike Trendy EDT for Women  Pink  75ml reviews  ratings  features  specifications and browse more Beauty products online at best prices on Amazon.in.,None,None,None,18:03:2014,None
B000JK4JLW,Nina Ricci Premier Jour Eau De Parfum Spray for Women 100 ml 3.3 Fluid Ounce,http://www.amazon.in/Fragrances/b/ref=sd_allcat_beauty_fragrance/276-6718833-1247838?ie=UTF8&node=1374298031,None,Fragranc,Nike,Nina Ricci,http://ecx.images-amazon.com/images/I/31l1aSi2PEL._AA160_.jpg,None,self Colour,Beauty & Health,http://www.amazon.in/Nina-Ricci-Premier-Parfum-Spray/dp/B000JK4JLW/ref=sr_1_8/275-1805524-5845351?s=beauty&ie=UTF8&qid=1395126866&sr=1-8,[<a href="/gp/help/seller/at-a-glance.html/275-1805524-5845351?ie=UTF8&amp;seller=A2NFQIUV2YGOLG">Fragume</a>],Amazon.in: Buy Nina Ricci Premier Jour Eau De Parfum Spray for Women 100 ml 3.3 Fluid Ounce Online at Best Price in India | Amazon Beauty Store,Buy Nina Ricci Premier Jour Eau De Parfum Spray for Women 100 ml 3.3 Fluid Ounce at lowest price in India on Amazon.in. Check out Nina Ricci Premier Jour Eau De Parfum Spray for Women 100 ml 3.3 Fluid Ounce reviews  ratings  features  specifications and browse more Beauty products online at best prices on Amazon.in.,None,<div class="bucket" id="productDescription"> <h2>Product Description</h2> <div class="content"> <h3 class="productDescriptionSource"></h3> <div class="productDescriptionWrapper">        "Premier Jour Perfume Eau De Parfum Spray 3.3 Oz 100 Ml for Women by Nina Ricci."              <div class="emptyClear"> </div> </div> </div> </div>,None,18:03:2014,None
B000MQ6MUY,Nina Ricci Nina EDT for Women  80ml,http://www.amazon.in/Fragrances/b/ref=sd_allcat_beauty_fragrance/276-6718833-1247838?ie=UTF8&node=1374298031,None,Fragranc,Nike,Nina Ricci,http://ecx.images-amazon.com/images/I/31l1aSi2PEL._AA160_.jpg,None,self Colour,Beauty & Health,http://www.amazon.in/Nina-Ricci-EDT-Women-80ml/dp/B000MQ6MUY/ref=sr_1_2/275-1805524-5845351?s=beauty&ie=UTF8&qid=1395126866&sr=1-2,[<a href="/gp/help/seller/at-a-glance.html/275-1805524-5845351?ie=UTF8&amp;seller=A2NFQIUV2YGOLG">Fragume</a>],Amazon.in: Buy Nina Ricci Nina EDT for Women  80ml Online at Best Price in India | Amazon Beauty Store,Buy Nina Ricci Nina EDT for Women  80ml at lowest price in India on Amazon.in. Check out Nina Ricci Nina EDT for Women  80ml reviews  ratings  features  specifications and browse more Beauty products online at best prices on Amazon.in.,None,<div class="bucket" id="productDescription"> <h2>Product Description</h2> <div class="content"> <h3 class="productDescriptionSource"></h3> <div class="productDescriptionWrapper">        Nina Ricci is a famous fashion house founded in Paris and is especially known for bringing a feminine  refined and romantic feel to its collections. Offering clothing  accessories and perfumes which are the epitome of elegance  this brand is renowned world over as it relates to fashionable folk of different ages. Start your day with the fruity fragrance of Nina Ricci Nina Eau De Toilette for women. An ideal choice for daily use  the perfume is suited for young women  thanks to its contemporary appeal. The perfume comes in a fairytale designed bottle that is as attractive as the scent. The top notes of this perfume include lime and lemon  giving it a spontaneous and energetic feel. Complementing the citrus scent are middle notes of vanilla  praline and candied apple that gives it caramel sweet hint reminding you of younger days at a carnival. With base notes of balmy musk  white cedar and apple tree that give the fragrance a soft  sensual aroma making it a perfect choice for everyday wear.              <div class="emptyClear"> </div> </div> </div> </div>,None,18:03:2014,None
B00DRE3TUO,Nike Fission EDT for Men  Green  100ml,http://www.amazon.in/Fragrances/b/ref=sd_allcat_beauty_fragrance/276-6718833-1247838?ie=UTF8&node=1374298031,None,Fragranc,Nike,Nina Ricci,http://ecx.images-amazon.com/images/I/31l1aSi2PEL._AA160_.jpg,None,self Colour,Beauty & Health,http://www.amazon.in/Nike-Fission-EDT-Green-100ml/dp/B00DRE3TUO/ref=sr_1_1/275-1805524-5845351?s=beauty&ie=UTF8&qid=1395126866&sr=1-1,[<a href="/gp/help/seller/at-a-glance.html/275-1805524-5845351?ie=UTF8&amp;seller=A2NFQIUV2YGOLG">Fragume</a>],Amazon.in: Buy Nike Fission EDT for Men  Green  100ml Online at Best Price in India | Amazon Beauty Store,Buy Nike Fission EDT for Men  Green  100ml at lowest price in India on Amazon.in. Check out Nike Fission EDT for Men  Green  100ml reviews  ratings  features  specifications and browse more Beauty products online at best prices on Amazon.in.,None,<div class="bucket" id="productDescription"> <h2>Product Description</h2> <div class="content"> <h3 class="productDescriptionSource"></h3> <div class="productDescriptionWrapper">        Nike Fission for men is a perfume that brings a tinge of freshness in your routine. It is a spicy  fruity and floral scent with top notes of bergamot  cardamom  grapefruit  and pepper. Strong  yet refreshing  the perfume has nutmeg  elemi  and bamboo leaves at its heart. The base notes comprise of musk  vetiver and the essential woody accords to emphasise on power and confidence.              <div class="emptyClear"> </div> </div> </div> </div>,None,18:03:2014,None
B00DRE48PE,Nike Up Or Down Perf Edt for Women  Blue  75ml,http://www.amazon.in/Fragrances/b/ref=sd_allcat_beauty_fragrance/276-6718833-1247838?ie=UTF8&node=1374298031,Rs. 689.00,Fragranc,Nike,Nina Ricci,http://ecx.images-amazon.com/images/I/31l1aSi2PEL._AA160_.jpg,Rs. 689.00,self Colour,Beauty & Health,http://www.amazon.in/Nike-Down-Perf-Women-Blue/dp/B00DRE48PE/ref=sr_1_4/275-1805524-5845351?s=beauty&ie=UTF8&qid=1395126866&sr=1-4,[<a class="buyAction" href="/gp/offer-listing/B00DRE48PE/ref=dp_olp_0/275-1805524-5845351?ie=UTF8&amp;condition=all">these sellers</a>],Amazon.in: Buy Nike Up Or Down Perf Edt for Women  Blue  75ml Online at Best Price in India | Amazon Beauty Store,Buy Nike Up Or Down Perf Edt for Women  Blue  75ml at lowest price in India on Amazon.in. Check out Nike Up Or Down Perf Edt for Women  Blue  75ml reviews  ratings  features  specifications and browse more Beauty products online at best prices on Amazon.in.,None,<div class="bucket" id="productDescription"> <h2>Product Description</h2> <div class="content"> <h3 class="productDescriptionSource"></h3> <div class="productDescriptionWrapper">        Nike up or down for women is an Eau de Toilette natural spray that offers long lasting protection and leaves you feeling refreshed for a long time.              <div class="emptyClear"> </div> </div> </div> </div>,None,18:03:2014,None
B002PJUN56,Nina Ricci Ricci EDP for Women  80ml,http://www.amazon.in/Fragrances/b/ref=sd_allcat_beauty_fragrance/276-6718833-1247838?ie=UTF8&node=1374298031,None,Fragranc,Nike,Nina Ricci,http://ecx.images-amazon.com/images/I/31l1aSi2PEL._AA160_.jpg,None,self Colour,Beauty & Health,http://www.amazon.in/Nina-Ricci-EDP-Women-80ml/dp/B002PJUN56/ref=sr_1_3/275-1805524-5845351?s=beauty&ie=UTF8&qid=1395126866&sr=1-3,[<a href="/gp/help/seller/at-a-glance.html/276-9498040-8931602?ie=UTF8&amp;seller=A2NFQIUV2YGOLG">Fragume</a>],Amazon.in: Buy Nina Ricci Ricci EDP for Women  80ml Online at Best Price in India | Amazon Beauty Store,Buy Nina Ricci Ricci EDP for Women  80ml at lowest price in India on Amazon.in. Check out Nina Ricci Ricci EDP for Women  80ml reviews  ratings  features  specifications and browse more Beauty products online at best prices on Amazon.in.,None,<div class="bucket" id="productDescription"> <h2>Product Description</h2> <div class="content"> <h3 class="productDescriptionSource"></h3> <div class="productDescriptionWrapper">        Design House: Nina Ricci  Year Introduced: 2009  Recommended Use: Casual  Recommended Use: Casual              <div class="emptyClear"> </div> </div> </div> </div>,None,18:03:2014,None
B00DRE3UIA,Nike Fission EDT for Women  White  100ml,http://www.amazon.in/Fragrances/b/ref=sd_allcat_beauty_fragrance/276-6718833-1247838?ie=UTF8&node=1374298031,None,Fragranc,Nike,Nina Ricci,http://ecx.images-amazon.com/images/I/31l1aSi2PEL._AA160_.jpg,None,self Colour,Beauty & Health,http://www.amazon.in/Nike-Fission-Women-White-100ml/dp/B00DRE3UIA/ref=sr_1_9/275-1805524-5845351?s=beauty&ie=UTF8&qid=1395126866&sr=1-9,[<a href="/gp/help/seller/at-a-glance.html/275-1805524-5845351?ie=UTF8&amp;seller=A2NFQIUV2YGOLG">Fragume</a>],Amazon.in: Buy Nike Fission EDT for Women  White  100ml Online at Best Price in India | Amazon Beauty Store,Buy Nike Fission EDT for Women  White  100ml at lowest price in India on Amazon.in. Check out Nike Fission EDT for Women  White  100ml reviews  ratings  features  specifications and browse more Beauty products online at best prices on Amazon.in.,None,<div class="bucket" id="productDescription"> <h2>Product Description</h2> <div class="content"> <h3 class="productDescriptionSource"></h3> <div class="productDescriptionWrapper">        A gently refreshing fragrance which provides long lasting protection with unique active formula.              <div class="emptyClear"> </div> </div> </div> </div>,None,18:03:2014,None
B0084YCW5K,Nina Ricci L'Elixir EDT for Women  80ml,http://www.amazon.in/Fragrances/b/ref=sd_allcat_beauty_fragrance/276-6718833-1247838?ie=UTF8&node=1374298031,None,Fragranc,Nike,Nina Ricci,http://ecx.images-amazon.com/images/I/31l1aSi2PEL._AA160_.jpg,None,self Colour,Beauty & Health,http://www.amazon.in/Nina-Ricci-LElixir-Women-80ml/dp/B0084YCW5K/ref=sr_1_14/275-1805524-5845351?s=beauty&ie=UTF8&qid=1395126866&sr=1-14,[<a href="/gp/help/seller/at-a-glance.html/275-1805524-5845351?ie=UTF8&amp;seller=A2NFQIUV2YGOLG">Fragume</a>],Amazon.in: Buy Nina Ricci L'Elixir EDT for Women  80ml Online at Best Price in India | Amazon Beauty Store,Buy Nina Ricci L'Elixir EDT for Women  80ml at lowest price in India on Amazon.in. Check out Nina Ricci L'Elixir EDT for Women  80ml reviews  ratings  features  specifications and browse more Beauty products online at best prices on Amazon.in.,None,<div class="bucket" id="productDescription"> <h2>Product Description</h2> <div class="content"> <h3 class="productDescriptionSource"></h3> <div class="productDescriptionWrapper">        Romantic and subtle  fresh fruity and aquatic  Nina L'Eau opens with refreshing notes of apple  grapefruit  mandarin and neroli. The heart includes watery accords along with gardenia and cherry. The base is sensual musky.              <div class="emptyClear"> </div> </div> </div> </div>,None,18:03:2014,None
B00DRE0ZUG,Nike Original EDT for Women  Pink  75ml,http://www.amazon.in/Fragrances/b/ref=sd_allcat_beauty_fragrance/276-6718833-1247838?ie=UTF8&node=1374298031,None,Fragranc,Nike,Nina Ricci,http://ecx.images-amazon.com/images/I/31l1aSi2PEL._AA160_.jpg,None,self Colour,Beauty & Health,http://www.amazon.in/Nike-Original-Women-Pink-75ml/dp/B00DRE0ZUG/ref=sr_1_6/275-1805524-5845351?s=beauty&ie=UTF8&qid=1395126866&sr=1-6,[<a href="/gp/help/seller/at-a-glance.html/275-1805524-5845351?ie=UTF8&amp;seller=A2NFQIUV2YGOLG">Fragume</a>],Amazon.in: Buy Nike Original EDT for Women  Pink  75ml Online at Best Price in India | Amazon Beauty Store,Buy Nike Original EDT for Women  Pink  75ml at lowest price in India on Amazon.in. Check out Nike Original EDT for Women  Pink  75ml reviews  ratings  features  specifications and browse more Beauty products online at best prices on Amazon.in.,None,None,None,18:03:2014,None
B00DRE3YPE,Nike N150 Storm EDT Deo Spray for Men  Green 200ml,http://www.amazon.in/Fragrances/b/ref=sd_allcat_beauty_fragrance/276-6718833-1247838?ie=UTF8&node=1374298031,None,Fragranc,Nike,Nina Ricci,http://ecx.images-amazon.com/images/I/31l1aSi2PEL._AA160_.jpg,None,self Colour,Beauty & Health,http://www.amazon.in/Nike-Storm-Spray-Green-200ml/dp/B00DRE3YPE/ref=sr_1_12/275-1805524-5845351?s=beauty&ie=UTF8&qid=1395126866&sr=1-12,[<a href="/gp/help/seller/at-a-glance.html/275-1805524-5845351?ie=UTF8&amp;seller=A3S589APE53IEY">Nykaa</a>],Amazon.in: Buy Nike N150 Storm EDT Deo Spray for Men  Green 200ml Online at Best Price in India | Amazon Beauty Store,Buy Nike N150 Storm EDT Deo Spray for Men  Green 200ml at lowest price in India on Amazon.in. Check out Nike N150 Storm EDT Deo Spray for Men  Green 200ml reviews  ratings  features  specifications and browse more Beauty products online at best prices on Amazon.in.,None,<div class="bucket" id="productDescription"> <h2>Product Description</h2> <div class="content"> <h3 class="productDescriptionSource"></h3> <div class="productDescriptionWrapper">        A gently refreshing fragrance which provides long lasting protection with unique active formula.              <div class="emptyClear"> </div> </div> </div> </div>,None,18:03:2014,None
B00DRE3XXW,Nike N150 Cool Wind EDT Deo Spray  for Men  Yellow  200ml,http://www.amazon.in/Fragrances/b/ref=sd_allcat_beauty_fragrance/276-6718833-1247838?ie=UTF8&node=1374298031,None,Fragranc,Nike,Nina Ricci,http://ecx.images-amazon.com/images/I/31l1aSi2PEL._AA160_.jpg,None,self Colour,Beauty & Health,http://www.amazon.in/Nike-N150-Spray-Yellow-200ml/dp/B00DRE3XXW/ref=sr_1_16/275-1805524-5845351?s=beauty&ie=UTF8&qid=1395126866&sr=1-16,[<a href="/gp/help/seller/at-a-glance.html/275-1805524-5845351?ie=UTF8&amp;seller=A3S589APE53IEY">Nykaa</a>],Amazon.in: Buy Nike N150 Cool Wind EDT Deo Spray for Men  Yellow  200ml Online at Best Price in India | Amazon Beauty Store,Buy Nike N150 Cool Wind EDT Deo Spray for Men  Yellow  200ml at lowest price in India on Amazon.in. Check out Nike N150 Cool Wind EDT Deo Spray for Men  Yellow  200ml reviews  ratings  features  specifications and browse more Beauty products online at best prices on Amazon.in.,None,<div class="bucket" id="productDescription"> <h2>Product Description</h2> <div class="content"> <h3 class="productDescriptionSource"></h3> <div class="productDescriptionWrapper">        A gently refreshing fragrance which provides long lasting protection with unique active formula.              <div class="emptyClear"> </div> </div> </div> </div>,None,18:03:2014,None
B00DNZCIKE,Nike N150 Wave EDT N/S for Men  Blue  150ml,http://www.amazon.in/Fragrances/b/ref=sd_allcat_beauty_fragrance/276-6718833-1247838?ie=UTF8&node=1374298031,Rs. 825.00,Fragranc,Nike,Nina Ricci,http://ecx.images-amazon.com/images/I/31l1aSi2PEL._AA160_.jpg,Rs. 825.00,self Colour,Beauty & Health,http://www.amazon.in/Nike-N150-Wave-Blue-150ml/dp/B00DNZCIKE/ref=sr_1_18/275-1805524-5845351?s=beauty&ie=UTF8&qid=1395126866&sr=1-18,[<a class="buyAction" href="/gp/offer-listing/B00DNZCIKE/ref=dp_olp_0/275-1805524-5845351?ie=UTF8&amp;condition=all">these sellers</a>],Amazon.in: Buy Nike N150 Wave EDT N/S for Men  Blue  150ml Online at Best Price in India | Amazon Beauty Store,Buy Nike N150 Wave EDT N/S for Men  Blue  150ml at lowest price in India on Amazon.in. Check out Nike N150 Wave EDT N/S for Men  Blue  150ml reviews  ratings  features  specifications and browse more Beauty products online at best prices on Amazon.in.,None,<div class="bucket" id="productDescription"> <h2>Product Description</h2> <div class="content"> <h3 class="productDescriptionSource"></h3> <div class="productDescriptionWrapper">        A gently refreshing fragrance which provides long lasting protection with unique active formula.              <div class="emptyClear"> </div> </div> </div> </div>,None,18:03:2014,None
B00AC2OKRK,Nina Ricci Primer Jour for Women  100ml,http://www.amazon.in/Fragrances/b/ref=sd_allcat_beauty_fragrance/276-6718833-1247838?ie=UTF8&node=1374298031,None,Fragranc,Nike,Nina Ricci,http://ecx.images-amazon.com/images/I/31l1aSi2PEL._AA160_.jpg,None,self Colour,Beauty & Health,http://www.amazon.in/Nina-Ricci-Primer-Women-100ml/dp/B00AC2OKRK/ref=sr_1_13/275-1805524-5845351?s=beauty&ie=UTF8&qid=1395126866&sr=1-13,[<a href="/gp/help/seller/at-a-glance.html/275-1805524-5845351?ie=UTF8&amp;seller=A2NFQIUV2YGOLG">Fragume</a>],Amazon.in: Buy Nina Ricci Primer Jour for Women  100ml Online at Best Price in India | Amazon Beauty Store,Buy Nina Ricci Primer Jour for Women  100ml at lowest price in India on Amazon.in. Check out Nina Ricci Primer Jour for Women  100ml reviews  ratings  features  specifications and browse more Beauty products online at best prices on Amazon.in.,None,<div class="bucket" id="productDescription"> <h2>Product Description</h2> <div class="content"> <h3 class="productDescriptionSource"></h3> <div class="productDescriptionWrapper">        Premier jour Nina Ricci for women.Premier Jour is the first day of the new ear for Nina Ricci  and it announces the restitution of the original codes of this brand. The Premier Jour fragrance merges with the form of a woman  without any particular accentuation of itself. Its sensual scent is aimed at body rather than thoughts. Optimistic mandarin and joyous sweet pea in alliance with gardenia give an intimate nuance to sweet note of the composition.              <div class="emptyClear"> </div> </div> </div> </div>,None,18:03:2014,None
B000C1Z9EE,L'Air Du Temps By Nina Ricci For Women. Eau De Toilette Spray 3.3 Oz.,http://www.amazon.in/Fragrances/b/ref=sd_allcat_beauty_fragrance/276-6718833-1247838?ie=UTF8&node=1374298031,None,Fragranc,Nike,Nina Ricci,http://ecx.images-amazon.com/images/I/31l1aSi2PEL._AA160_.jpg,None,self Colour,Beauty & Health,http://www.amazon.in/Temps-Nina-Ricci-Women-Toilette/dp/B000C1Z9EE/ref=sr_1_19/275-1805524-5845351?s=beauty&ie=UTF8&qid=1395126866&sr=1-19,[<a href="/gp/help/seller/at-a-glance.html/275-1805524-5845351?ie=UTF8&amp;seller=A2NFQIUV2YGOLG">Fragume</a>],Amazon.in: Buy L'Air Du Temps By Nina Ricci For Women. Eau De Toilette Spray 3.3 Oz. Online at Best Price in India | Amazon Beauty Store,Buy L'Air Du Temps By Nina Ricci For Women. Eau De Toilette Spray 3.3 Oz. at lowest price in India on Amazon.in. Check out L'Air Du Temps By Nina Ricci For Women. Eau De Toilette Spray 3.3 Oz. reviews  ratings  features  specifications and browse more Beauty products online at best prices on Amazon.in.,None,<div class="bucket" id="productDescription"> <h2>Product Description</h2> <div class="content"> <h3 class="productDescriptionSource"></h3> <div class="productDescriptionWrapper">        Introduced in 1948. Fragrance notes: a rich floral of gardenia and jasmine with tones of sandalwood and iris a romantic aroma. Recommended use: evening.When nbsp applying nbsp any fragrance please consider that there are several factors which can affect the natural smell of your skin and in turn the way a scent smells on you. nbsp For instance your mood stress level age body chemistry nbsp diet and current medications may all alter the scents you wear. nbsp nbsp Similarly factor such as dry or oily nbsp skin can even affect the amount of time a fragrance will last after being applied              <div class="emptyClear"> </div> </div> </div> </div>,None,18:03:2014,None
B003HLFMDY,L'air du temps by Nina Ricci 3.30-Ounce,http://www.amazon.in/Fragrances/b/ref=sd_allcat_beauty_fragrance/276-6718833-1247838?ie=UTF8&node=1374298031,None,Fragranc,Nike,Nina Ricci,http://ecx.images-amazon.com/images/I/31l1aSi2PEL._AA160_.jpg,None,self Colour,Beauty & Health,http://www.amazon.in/Lair-temps-Nina-Ricci-3-30-Ounce/dp/B003HLFMDY/ref=sr_1_23/275-1805524-5845351?s=beauty&ie=UTF8&qid=1395126866&sr=1-23,[<a href="/gp/help/seller/at-a-glance.html/275-1805524-5845351?ie=UTF8&amp;seller=A2NFQIUV2YGOLG">Fragume</a>],Amazon.in: Buy L'air du temps by Nina Ricci 3.30-Ounce Online at Best Price in India | Amazon Beauty Store,Buy L'air du temps by Nina Ricci 3.30-Ounce at lowest price in India on Amazon.in. Check out L'air du temps by Nina Ricci 3.30-Ounce reviews  ratings  features  specifications and browse more Beauty products online at best prices on Amazon.in.,None,<div class="bucket" id="productDescription"> <h2>Product Description</h2> <div class="content"> <h3 class="productDescriptionSource"></h3> <div class="productDescriptionWrapper">        "L air du Temps was launched by the design house of Nina Ricci. This product is a fragrance item that comes in retail packaging. It is recommended for casual wear.When nbsp applying nbsp any fragrance please consider that there are several factors which can affect the natural smell of your skin and in turn the way a scent smells on you. nbsp For instance your mood stress level age body chemistry nbsp diet and current medications may all alter the scents you wear. nbsp nbsp Similarly factor such as dry or oily nbsp skin can even affect the amount of time a fragrance will last after being applied"              <div class="emptyClear"> </div> </div> </div> </div>,None,18:03:2014,None
B00DRE3ZBM,Nike N150 On Fire EDT Deo Spray for Men  Orange  200ml,http://www.amazon.in/Fragrances/b/ref=sd_allcat_beauty_fragrance/276-6718833-1247838?ie=UTF8&node=1374298031,None,Fragranc,Nike,Nina Ricci,http://ecx.images-amazon.com/images/I/31l1aSi2PEL._AA160_.jpg,None,self Colour,Beauty & Health,http://www.amazon.in/Nike-N150-Spray-Orange-200ml/dp/B00DRE3ZBM/ref=sr_1_15/275-1805524-5845351?s=beauty&ie=UTF8&qid=1395126866&sr=1-15,[<a href="/gp/help/seller/at-a-glance.html/275-1805524-5845351?ie=UTF8&amp;seller=A3S589APE53IEY">Nykaa</a>],Amazon.in: Buy Nike N150 On Fire EDT Deo Spray for Men  Orange  200ml Online at Best Price in India | Amazon Beauty Store,Buy Nike N150 On Fire EDT Deo Spray for Men  Orange  200ml at lowest price in India on Amazon.in. Check out Nike N150 On Fire EDT Deo Spray for Men  Orange  200ml reviews  ratings  features  specifications and browse more Beauty products online at best prices on Amazon.in.,None,<div class="bucket" id="productDescription"> <h2>Product Description</h2> <div class="content"> <h3 class="productDescriptionSource"></h3> <div class="productDescriptionWrapper">        A gently refreshing fragrance which provides long lasting protection with unique active formula.              <div class="emptyClear"> </div> </div> </div> </div>,None,18:03:2014,None
B00DRE0Z9W,Nike Casual EDT for Men  Green  75ml,http://www.amazon.in/Fragrances/b/ref=sd_allcat_beauty_fragrance/276-6718833-1247838?ie=UTF8&node=1374298031,None,Fragranc,Nike,Nina Ricci,http://ecx.images-amazon.com/images/I/31l1aSi2PEL._AA160_.jpg,None,self Colour,Beauty & Health,http://www.amazon.in/Nike-Casual-EDT-Green-75ml/dp/B00DRE0Z9W/ref=sr_1_33/275-1805524-5845351?s=beauty&ie=UTF8&qid=1395126873&sr=1-33,[<a href="/gp/help/seller/at-a-glance.html/275-1805524-5845351?ie=UTF8&amp;seller=A2NFQIUV2YGOLG">Fragume</a>],Amazon.in: Buy Nike Casual EDT for Men  Green  75ml Online at Best Price in India | Amazon Beauty Store,Buy Nike Casual EDT for Men  Green  75ml at lowest price in India on Amazon.in. Check out Nike Casual EDT for Men  Green  75ml reviews  ratings  features  specifications and browse more Beauty products online at best prices on Amazon.in.,None,None,None,18:03:2014,None
B00DRE18YS,Nike Extreme EDT for Women  Red  75ml,http://www.amazon.in/Fragrances/b/ref=sd_allcat_beauty_fragrance/276-6718833-1247838?ie=UTF8&node=1374298031,None,Fragranc,Nike,Nina Ricci,http://ecx.images-amazon.com/images/I/31l1aSi2PEL._AA160_.jpg,None,self Colour,Beauty & Health,http://www.amazon.in/Nike-Extreme-EDT-Women-75ml/dp/B00DRE18YS/ref=sr_1_36/275-1805524-5845351?s=beauty&ie=UTF8&qid=1395126873&sr=1-36,[<a href="/gp/help/seller/at-a-glance.html/275-1805524-5845351?ie=UTF8&amp;seller=A2NFQIUV2YGOLG">Fragume</a>],Amazon.in: Buy Nike Extreme EDT for Women  Red  75ml Online at Best Price in India | Amazon Beauty Store,Buy Nike Extreme EDT for Women  Red  75ml at lowest price in India on Amazon.in. Check out Nike Extreme EDT for Women  Red  75ml reviews  ratings  features  specifications and browse more Beauty products online at best prices on Amazon.in.,None,<div class="bucket" id="productDescription"> <h2>Product Description</h2> <div class="content"> <h3 class="productDescriptionSource"></h3> <div class="productDescriptionWrapper">        Size: 75ml              <div class="emptyClear"> </div> </div> </div> </div>,None,18:03:2014,None
