B00DRE3VRU,Nike N150 Cool Wind EDT N/S for Men  Yellow  150ml,http://www.amazon.in/Fragrances/b/ref=sd_allcat_beauty_fragrance/276-6718833-1247838?ie=UTF8&node=1374298031,Rs. 825.00,Fragranc,Nike,Nina Ricci,http://ecx.images-amazon.com/images/I/31l1aSi2PEL._AA160_.jpg,Rs. 825.00,self Colour,Beauty & Health,http://www.amazon.in/Nike-N150-Cool-Yellow-150ml/dp/B00DRE3VRU/ref=sr_1_37/275-1805524-5845351?s=beauty&ie=UTF8&qid=1395126873&sr=1-37,[<a class="buyAction" href="/gp/offer-listing/B00DRE3VRU/ref=dp_olp_0/275-1805524-5845351?ie=UTF8&amp;condition=all">these sellers</a>],Amazon.in: Buy Nike N150 Cool Wind EDT N/S for Men  Yellow  150ml Online at Best Price in India | Amazon Beauty Store,Buy Nike N150 Cool Wind EDT N/S for Men  Yellow  150ml at lowest price in India on Amazon.in. Check out Nike N150 Cool Wind EDT N/S for Men  Yellow  150ml reviews  ratings  features  specifications and browse more Beauty products online at best prices on Amazon.in.,None,<div class="bucket" id="productDescription"> <h2>Product Description</h2> <div class="content"> <h3 class="productDescriptionSource"></h3> <div class="productDescriptionWrapper">        A gently refreshing fragrance which provides long lasting protection with unique active formula.              <div class="emptyClear"> </div> </div> </div> </div>,None,18:03:2014,None
B00DRE1HSA,Nike N150 Fruit Fever EDT N/S for Women  Yellow  150ml,http://www.amazon.in/Fragrances/b/ref=sd_allcat_beauty_fragrance/276-6718833-1247838?ie=UTF8&node=1374298031,None,Fragranc,Nike,Nina Ricci,http://ecx.images-amazon.com/images/I/31l1aSi2PEL._AA160_.jpg,None,self Colour,Beauty & Health,http://www.amazon.in/Nike-Fruit-Fever-Women-Yellow/dp/B00DRE1HSA/ref=sr_1_38/275-1805524-5845351?s=beauty&ie=UTF8&qid=1395126873&sr=1-38,[<a href="/gp/help/seller/at-a-glance.html/275-1805524-5845351?ie=UTF8&amp;seller=A2NFQIUV2YGOLG">Fragume</a>],Amazon.in: Buy Nike N150 Fruit Fever EDT N/S for Women  Yellow  150ml Online at Best Price in India | Amazon Beauty Store,Buy Nike N150 Fruit Fever EDT N/S for Women  Yellow  150ml at lowest price in India on Amazon.in. Check out Nike N150 Fruit Fever EDT N/S for Women  Yellow  150ml reviews  ratings  features  specifications and browse more Beauty products online at best prices on Amazon.in.,None,<div class="bucket" id="productDescription"> <h2>Product Description</h2> <div class="content"> <h3 class="productDescriptionSource"></h3> <div class="productDescriptionWrapper">        Nike fragrances greets you with fresh fragrances that are long lasting and smell divine.              <div class="emptyClear"> </div> </div> </div> </div>,None,18:03:2014,None
B00DRE16UO,Nike N150 Hidden Desire EDT N/S for Women  Green  150ml,http://www.amazon.in/Fragrances/b/ref=sd_allcat_beauty_fragrance/276-6718833-1247838?ie=UTF8&node=1374298031,None,Fragranc,Nike,Nina Ricci,http://ecx.images-amazon.com/images/I/31l1aSi2PEL._AA160_.jpg,None,self Colour,Beauty & Health,http://www.amazon.in/Nike-Hidden-Desire-Women-Green/dp/B00DRE16UO/ref=sr_1_39/275-1805524-5845351?s=beauty&ie=UTF8&qid=1395126873&sr=1-39,[<a href="/gp/help/seller/at-a-glance.html/275-1805524-5845351?ie=UTF8&amp;seller=A2NFQIUV2YGOLG">Fragume</a>],Amazon.in: Buy Nike N150 Hidden Desire EDT N/S for Women  Green  150ml Online at Best Price in India | Amazon Beauty Store,Buy Nike N150 Hidden Desire EDT N/S for Women  Green  150ml at lowest price in India on Amazon.in. Check out Nike N150 Hidden Desire EDT N/S for Women  Green  150ml reviews  ratings  features  specifications and browse more Beauty products online at best prices on Amazon.in.,None,None,None,18:03:2014,None
B00DRE1EC4,Nike N150 Magnetic EDT N/S for Men  Blue  150ml,http://www.amazon.in/Fragrances/b/ref=sd_allcat_beauty_fragrance/276-6718833-1247838?ie=UTF8&node=1374298031,Rs. 750.00,Fragranc,Nike,Nina Ricci,http://ecx.images-amazon.com/images/I/31l1aSi2PEL._AA160_.jpg,Rs. 750.00,self Colour,Beauty & Health,http://www.amazon.in/Nike-N150-Magnetic-Blue-150ml/dp/B00DRE1EC4/ref=sr_1_41/275-1805524-5845351?s=beauty&ie=UTF8&qid=1395126873&sr=1-41,[<a class="buyAction" href="/gp/offer-listing/B00DRE1EC4/ref=dp_olp_0/275-1805524-5845351?ie=UTF8&amp;condition=all">these sellers</a>],Amazon.in: Buy Nike N150 Magnetic EDT N/S for Men  Blue  150ml Online at Best Price in India | Amazon Beauty Store,Buy Nike N150 Magnetic EDT N/S for Men  Blue  150ml at lowest price in India on Amazon.in. Check out Nike N150 Magnetic EDT N/S for Men  Blue  150ml reviews  ratings  features  specifications and browse more Beauty products online at best prices on Amazon.in.,None,None,None,18:03:2014,None
B00DRE17J4,Nike N150 Magic Passion EDT N/S for Women  Blue  150ml,http://www.amazon.in/Fragrances/b/ref=sd_allcat_beauty_fragrance/276-6718833-1247838?ie=UTF8&node=1374298031,Rs. 999.00,Fragranc,Nike,Nina Ricci,http://ecx.images-amazon.com/images/I/31l1aSi2PEL._AA160_.jpg,Rs. 999.00,self Colour,Beauty & Health,http://www.amazon.in/Nike-Magic-Passion-Women-150ml/dp/B00DRE17J4/ref=sr_1_40/275-1805524-5845351?s=beauty&ie=UTF8&qid=1395126873&sr=1-40,[<a class="buyAction" href="/gp/offer-listing/B00DRE17J4/ref=dp_olp_0/275-1805524-5845351?ie=UTF8&amp;condition=all">these sellers</a>],Amazon.in: Buy Nike N150 Magic Passion EDT N/S for Women  Blue  150ml Online at Best Price in India | Amazon Beauty Store,Buy Nike N150 Magic Passion EDT N/S for Women  Blue  150ml at lowest price in India on Amazon.in. Check out Nike N150 Magic Passion EDT N/S for Women  Blue  150ml reviews  ratings  features  specifications and browse more Beauty products online at best prices on Amazon.in.,None,None,None,18:03:2014,None
B00DRE1FJQ,Nike N150 Out Of Control EDT N/S for Men  Green  150ml,http://www.amazon.in/Fragrances/b/ref=sd_allcat_beauty_fragrance/276-6718833-1247838?ie=UTF8&node=1374298031,Rs. 750.00,Fragranc,Nike,Nina Ricci,http://ecx.images-amazon.com/images/I/31l1aSi2PEL._AA160_.jpg,Rs. 750.00,self Colour,Beauty & Health,http://www.amazon.in/Nike-N150-Control-Green-150ml/dp/B00DRE1FJQ/ref=sr_1_44/275-1805524-5845351?s=beauty&ie=UTF8&qid=1395126873&sr=1-44,[<a class="buyAction" href="/gp/offer-listing/B00DRE1FJQ/ref=dp_olp_0/275-1805524-5845351?ie=UTF8&amp;condition=all">these sellers</a>],Amazon.in: Buy Nike N150 Out Of Control EDT N/S for Men  Green  150ml Online at Best Price in India | Amazon Beauty Store,Buy Nike N150 Out Of Control EDT N/S for Men  Green  150ml at lowest price in India on Amazon.in. Check out Nike N150 Out Of Control EDT N/S for Men  Green  150ml reviews  ratings  features  specifications and browse more Beauty products online at best prices on Amazon.in.,None,None,None,18:03:2014,None
B00DRE3WU6,Nike N150 On Fire EDT N/S for Men  Orange  150ml,http://www.amazon.in/Fragrances/b/ref=sd_allcat_beauty_fragrance/276-6718833-1247838?ie=UTF8&node=1374298031,Rs. 750.00,Fragranc,Nike,Nina Ricci,http://ecx.images-amazon.com/images/I/31l1aSi2PEL._AA160_.jpg,Rs. 750.00,self Colour,Beauty & Health,http://www.amazon.in/Nike-N150-Fire-Orange-150ml/dp/B00DRE3WU6/ref=sr_1_43/275-1805524-5845351?s=beauty&ie=UTF8&qid=1395126873&sr=1-43,[<a class="buyAction" href="/gp/offer-listing/B00DRE3WU6/ref=dp_olp_0/275-1805524-5845351?ie=UTF8&amp;condition=all">these sellers</a>],Amazon.in: Buy Nike N150 On Fire EDT N/S for Men  Orange  150ml Online at Best Price in India | Amazon Beauty Store,Buy Nike N150 On Fire EDT N/S for Men  Orange  150ml at lowest price in India on Amazon.in. Check out Nike N150 On Fire EDT N/S for Men  Orange  150ml reviews  ratings  features  specifications and browse more Beauty products online at best prices on Amazon.in.,None,<div class="bucket" id="productDescription"> <h2>Product Description</h2> <div class="content"> <h3 class="productDescriptionSource"></h3> <div class="productDescriptionWrapper">        A gently refreshing fragrance which provides long lasting protection with unique active formula.              <div class="emptyClear"> </div> </div> </div> </div>,None,18:03:2014,None
B00DRE4H9Q,Nike N150 Paradise EDT for Women  Pink  150ml,http://www.amazon.in/Fragrances/b/ref=sd_allcat_beauty_fragrance/276-6718833-1247838?ie=UTF8&node=1374298031,Rs. 825.00,Fragranc,Nike,Nina Ricci,http://ecx.images-amazon.com/images/I/31l1aSi2PEL._AA160_.jpg,Rs. 825.00,self Colour,Beauty & Health,http://www.amazon.in/Nike-N150-Paradise-Women-150ml/dp/B00DRE4H9Q/ref=sr_1_45/275-1805524-5845351?s=beauty&ie=UTF8&qid=1395126873&sr=1-45,[<a class="buyAction" href="/gp/offer-listing/B00DRE4H9Q/ref=dp_olp_0/275-1805524-5845351?ie=UTF8&amp;condition=all">these sellers</a>],Amazon.in: Buy Nike N150 Paradise EDT for Women  Pink  150ml Online at Best Price in India | Amazon Beauty Store,Buy Nike N150 Paradise EDT for Women  Pink  150ml at lowest price in India on Amazon.in. Check out Nike N150 Paradise EDT for Women  Pink  150ml reviews  ratings  features  specifications and browse more Beauty products online at best prices on Amazon.in.,None,<div class="bucket" id="productDescription"> <h2>Product Description</h2> <div class="content"> <h3 class="productDescriptionSource"></h3> <div class="productDescriptionWrapper">        A gently refreshing fragrance which provides long lasting protection with unique active formula.              <div class="emptyClear"> </div> </div> </div> </div>,None,18:03:2014,None
B00DRE1G7M,Nike N150 Party Zone EDT N/S for Men  Red  150ml,http://www.amazon.in/Fragrances/b/ref=sd_allcat_beauty_fragrance/276-6718833-1247838?ie=UTF8&node=1374298031,Rs. 750.00,Fragranc,Nike,Nina Ricci,http://ecx.images-amazon.com/images/I/31l1aSi2PEL._AA160_.jpg,Rs. 750.00,self Colour,Beauty & Health,http://www.amazon.in/Nike-N150-Party-Zone-150ml/dp/B00DRE1G7M/ref=sr_1_46/275-1805524-5845351?s=beauty&ie=UTF8&qid=1395126873&sr=1-46,[<a class="buyAction" href="/gp/offer-listing/B00DRE1G7M/ref=dp_olp_0/275-1805524-5845351?ie=UTF8&amp;condition=all">these sellers</a>],Amazon.in: Buy Nike N150 Party Zone EDT N/S for Men  Red  150ml Online at Best Price in India | Amazon Beauty Store,Buy Nike N150 Party Zone EDT N/S for Men  Red  150ml at lowest price in India on Amazon.in. Check out Nike N150 Party Zone EDT N/S for Men  Red  150ml reviews  ratings  features  specifications and browse more Beauty products online at best prices on Amazon.in.,None,None,None,18:03:2014,None
B00FR97YE4,Nike N150 Scarlet Kiss EDT Deo Spray for Women  Red  200ml,http://www.amazon.in/Fragrances/b/ref=sd_allcat_beauty_fragrance/276-6718833-1247838?ie=UTF8&node=1374298031,Rs. 340.00,Fragranc,Nike,Nina Ricci,http://ecx.images-amazon.com/images/I/31l1aSi2PEL._AA160_.jpg,Rs. 340.00,self Colour,Beauty & Health,http://www.amazon.in/Nike-Scarlet-Spray-Women-200ml/dp/B00FR97YE4/ref=sr_1_47/275-1805524-5845351?s=beauty&ie=UTF8&qid=1395126873&sr=1-47,[<a class="buyAction" href="/gp/offer-listing/B00FR97YE4/ref=dp_olp_0/275-1805524-5845351?ie=UTF8&amp;condition=all">these sellers</a>],Amazon.in: Buy Nike N150 Scarlet Kiss EDT Deo Spray for Women  Red  200ml Online at Best Price in India | Amazon Beauty Store,Buy Nike N150 Scarlet Kiss EDT Deo Spray for Women  Red  200ml at lowest price in India on Amazon.in. Check out Nike N150 Scarlet Kiss EDT Deo Spray for Women  Red  200ml reviews  ratings  features  specifications and browse more Beauty products online at best prices on Amazon.in.,None,<div class="bucket" id="productDescription"> <h2>Product Description</h2> <div class="content"> <h3 class="productDescriptionSource"></h3> <div class="productDescriptionWrapper">        For the top notes an heady alchemy of citrus  bergamot and mandarin  combined with a touch that softens the delicate violet floral note. The heart opens up an attractive bouquet dominated by jasmine Sambac  the gardenia  iris elegance and transparency of rosebuds. The bottom notes contain the soul of the fragrance  a sublime vanilla notes  intense and sweetly feminine  surrounded by the warmth of the wood of cedar  sandalwood and soft balsamic notes.              <div class="emptyClear"> </div> </div> </div> </div>,None,18:03:2014,None
B00DRE1IAC,Nike N150 Scarlet Kiss Edt N/S for Women  Red  150ml,http://www.amazon.in/Fragrances/b/ref=sd_allcat_beauty_fragrance/276-6718833-1247838?ie=UTF8&node=1374298031,None,Fragranc,Nike,Nina Ricci,http://ecx.images-amazon.com/images/I/31l1aSi2PEL._AA160_.jpg,None,self Colour,Beauty & Health,http://www.amazon.in/Nike-N150-Scarlet-Women-150ml/dp/B00DRE1IAC/ref=sr_1_48/275-1805524-5845351?s=beauty&ie=UTF8&qid=1395126873&sr=1-48,[<a href="/gp/help/seller/at-a-glance.html/275-1805524-5845351?ie=UTF8&amp;seller=A2NFQIUV2YGOLG">Fragume</a>],Amazon.in: Buy Nike N150 Scarlet Kiss Edt N/S for Women  Red  150ml Online at Best Price in India | Amazon Beauty Store,Buy Nike N150 Scarlet Kiss Edt N/S for Women  Red  150ml at lowest price in India on Amazon.in. Check out Nike N150 Scarlet Kiss Edt N/S for Women  Red  150ml reviews  ratings  features  specifications and browse more Beauty products online at best prices on Amazon.in.,None,<div class="bucket" id="productDescription"> <h2>Product Description</h2> <div class="content"> <h3 class="productDescriptionSource"></h3> <div class="productDescriptionWrapper">        Nike fragrances greets you with fresh fragrances that are long lasting and smell divine.              <div class="emptyClear"> </div> </div> </div> </div>,None,18:03:2014,None
B00DRE4I3G,Nike N150 Sensual Touch EDT for Women  Purple  150ml,http://www.amazon.in/Fragrances/b/ref=sd_allcat_beauty_fragrance/276-6718833-1247838?ie=UTF8&node=1374298031,Rs. 825.00,Fragranc,Nike,Nina Ricci,http://ecx.images-amazon.com/images/I/31l1aSi2PEL._AA160_.jpg,Rs. 825.00,self Colour,Beauty & Health,http://www.amazon.in/Nike-Sensual-Touch-Women-Purple/dp/B00DRE4I3G/ref=sr_1_49/275-1805524-5845351?s=beauty&ie=UTF8&qid=1395126888&sr=1-49,[<a class="buyAction" href="/gp/offer-listing/B00DRE4I3G/ref=dp_olp_0/275-1805524-5845351?ie=UTF8&amp;condition=all">these sellers</a>],Amazon.in: Buy Nike N150 Sensual Touch EDT for Women  Purple  150ml Online at Best Price in India | Amazon Beauty Store,Buy Nike N150 Sensual Touch EDT for Women  Purple  150ml at lowest price in India on Amazon.in. Check out Nike N150 Sensual Touch EDT for Women  Purple  150ml reviews  ratings  features  specifications and browse more Beauty products online at best prices on Amazon.in.,None,<div class="bucket" id="productDescription"> <h2>Product Description</h2> <div class="content"> <h3 class="productDescriptionSource"></h3> <div class="productDescriptionWrapper">        A gently refreshing fragrance which provides long lasting protection with unique active formula.              <div class="emptyClear"> </div> </div> </div> </div>,None,18:03:2014,None
B0083H24Y2,Nike N150 Spicy Love EDT for Women  Green  150ml,http://www.amazon.in/Fragrances/b/ref=sd_allcat_beauty_fragrance/276-6718833-1247838?ie=UTF8&node=1374298031,Rs. 999.00,Fragranc,Nike,Nina Ricci,http://ecx.images-amazon.com/images/I/31l1aSi2PEL._AA160_.jpg,Rs. 999.00,self Colour,Beauty & Health,http://www.amazon.in/Nike-Spicy-Women-Green-150ml/dp/B0083H24Y2/ref=sr_1_50/275-1805524-5845351?s=beauty&ie=UTF8&qid=1395126888&sr=1-50,[<a class="buyAction" href="/gp/offer-listing/B0083H24Y2/ref=dp_olp_0/275-1805524-5845351?ie=UTF8&amp;condition=all">these sellers</a>],Amazon.in: Buy Nike N150 Spicy Love EDT for Women  Green  150ml Online at Best Price in India | Amazon Beauty Store,Buy Nike N150 Spicy Love EDT for Women  Green  150ml at lowest price in India on Amazon.in. Check out Nike N150 Spicy Love EDT for Women  Green  150ml reviews  ratings  features  specifications and browse more Beauty products online at best prices on Amazon.in.,None,None,None,18:03:2014,None
B00DRE3WCO,Nike N150 Storm EDT N/S for Men  Green  150ml,http://www.amazon.in/Fragrances/b/ref=sd_allcat_beauty_fragrance/276-6718833-1247838?ie=UTF8&node=1374298031,Rs. 750.00,Fragranc,Nike,Nina Ricci,http://ecx.images-amazon.com/images/I/31l1aSi2PEL._AA160_.jpg,Rs. 750.00,self Colour,Beauty & Health,http://www.amazon.in/Nike-N150-Storm-Green-150ml/dp/B00DRE3WCO/ref=sr_1_51/275-1805524-5845351?s=beauty&ie=UTF8&qid=1395126888&sr=1-51,[<a class="buyAction" href="/gp/offer-listing/B00DRE3WCO/ref=dp_olp_0/275-1805524-5845351?ie=UTF8&amp;condition=all">these sellers</a>],Amazon.in: Buy Nike N150 Storm EDT N/S for Men  Green  150ml Online at Best Price in India | Amazon Beauty Store,Buy Nike N150 Storm EDT N/S for Men  Green  150ml at lowest price in India on Amazon.in. Check out Nike N150 Storm EDT N/S for Men  Green  150ml reviews  ratings  features  specifications and browse more Beauty products online at best prices on Amazon.in.,None,<div class="bucket" id="productDescription"> <h2>Product Description</h2> <div class="content"> <h3 class="productDescriptionSource"></h3> <div class="productDescriptionWrapper">        A gently refreshing fragrance which provides long lasting protection with unique active formula.              <div class="emptyClear"> </div> </div> </div> </div>,None,18:03:2014,None
B00DRE1IS4,Nike N150 Woman Sweet Emotion EDT N/S for Women  Orange  150ml,http://www.amazon.in/Fragrances/b/ref=sd_allcat_beauty_fragrance/276-6718833-1247838?ie=UTF8&node=1374298031,Rs. 999.00,Fragranc,Nike,Nina Ricci,http://ecx.images-amazon.com/images/I/31l1aSi2PEL._AA160_.jpg,Rs. 999.00,self Colour,Beauty & Health,http://www.amazon.in/Nike-Woman-Sweet-Emotion-Orange/dp/B00DRE1IS4/ref=sr_1_53/275-1805524-5845351?s=beauty&ie=UTF8&qid=1395126888&sr=1-53,[<a class="buyAction" href="/gp/offer-listing/B00DRE1IS4/ref=dp_olp_0/275-1805524-5845351?ie=UTF8&amp;condition=all">these sellers</a>],Amazon.in: Buy Nike N150 Woman Sweet Emotion EDT N/S for Women  Orange  150ml Online at Best Price in India | Amazon Beauty Store,Buy Nike N150 Woman Sweet Emotion EDT N/S for Women  Orange  150ml at lowest price in India on Amazon.in. Check out Nike N150 Woman Sweet Emotion EDT N/S for Women  Orange  150ml reviews  ratings  features  specifications and browse more Beauty products online at best prices on Amazon.in.,None,<div class="bucket" id="productDescription"> <h2>Product Description</h2> <div class="content"> <h3 class="productDescriptionSource"></h3> <div class="productDescriptionWrapper">        Nike fragrances greets you with fresh fragrances that are long lasting and smell divine. Add this to your perfume collection and put yourself in Nike Fragrances's expert care.              <div class="emptyClear"> </div> </div> </div> </div>,None,18:03:2014,None
B00DRE1BZO,Nike N5Th Element Woman EDT Deo Spray for Women  Red  200ml,http://www.amazon.in/Fragrances/b/ref=sd_allcat_beauty_fragrance/276-6718833-1247838?ie=UTF8&node=1374298031,Rs. 769.00,Fragranc,Nike,Nina Ricci,http://ecx.images-amazon.com/images/I/31l1aSi2PEL._AA160_.jpg,Rs. 769.00,self Colour,Beauty & Health,http://www.amazon.in/Nike-Element-Woman-Spray-Women/dp/B00DRE1BZO/ref=sr_1_54/275-1805524-5845351?s=beauty&ie=UTF8&qid=1395126888&sr=1-54,[<a class="buyAction" href="/gp/offer-listing/B00DRE1BZO/ref=dp_olp_0/275-1805524-5845351?ie=UTF8&amp;condition=all">these sellers</a>],Amazon.in: Buy Nike N5Th Element Woman EDT Deo Spray for Women  Red  200ml Online at Best Price in India | Amazon Beauty Store,Buy Nike N5Th Element Woman EDT Deo Spray for Women  Red  200ml at lowest price in India on Amazon.in. Check out Nike N5Th Element Woman EDT Deo Spray for Women  Red  200ml reviews  ratings  features  specifications and browse more Beauty products online at best prices on Amazon.in.,None,None,None,18:03:2014,None
B00DRE108M,Nike Pure EDT for Women  Blue  75ml,http://www.amazon.in/Fragrances/b/ref=sd_allcat_beauty_fragrance/276-6718833-1247838?ie=UTF8&node=1374298031,None,Fragranc,Nike,Nina Ricci,http://ecx.images-amazon.com/images/I/31l1aSi2PEL._AA160_.jpg,None,self Colour,Beauty & Health,http://www.amazon.in/Nike-Pure-Women-Blue-75ml/dp/B00DRE108M/ref=sr_1_55/275-1805524-5845351?s=beauty&ie=UTF8&qid=1395126888&sr=1-55,[<a href="/gp/help/seller/at-a-glance.html/275-1805524-5845351?ie=UTF8&amp;seller=A2NFQIUV2YGOLG">Fragume</a>],Amazon.in: Buy Nike Pure EDT for Women  Blue  75ml Online at Best Price in India | Amazon Beauty Store,Buy Nike Pure EDT for Women  Blue  75ml at lowest price in India on Amazon.in. Check out Nike Pure EDT for Women  Blue  75ml reviews  ratings  features  specifications and browse more Beauty products online at best prices on Amazon.in.,None,None,None,18:03:2014,None
B00733TD7I,NINA,http://www.amazon.in/Fragrances/b/ref=sd_allcat_beauty_fragrance/276-6718833-1247838?ie=UTF8&node=1374298031,Rs. 2 545.00,Fragranc,Nike,Nina Ricci,http://ecx.images-amazon.com/images/I/31l1aSi2PEL._AA160_.jpg,Rs. 2 545.00,self Colour,Beauty & Health,http://www.amazon.in/Nina-Ricci-NINA/dp/B00733TD7I/ref=sr_1_59/275-1805524-5845351?s=beauty&ie=UTF8&qid=1395126888&sr=1-59,[<a class="buyAction" href="/gp/offer-listing/B00733TD7I/ref=dp_olp_0/275-1805524-5845351?ie=UTF8&amp;condition=all">these sellers</a>],Amazon.in: Buy NINA Online at Best Price in India | Amazon Beauty Store,Buy NINA at lowest price in India on Amazon.in. Check out NINA reviews  ratings  features  specifications and browse more Beauty products online at best prices on Amazon.in.,None,<div class="bucket" id="productDescription"> <h2>Product Description</h2> <div class="content"> <h3 class="productDescriptionSource"></h3> <div class="productDescriptionWrapper">        Nina Ricci Nina for woman was launched in 1987. The aroma is Citrusy &amp; sweet. It is recommended for Office &amp; casual wear.              <div class="emptyClear"> </div> </div> </div> </div>,None,18:03:2014,None
B00783K4E4,Nina Fantasy By Nina Ricci Edt Spray 50.27 ml (limited Edition),http://www.amazon.in/Fragrances/b/ref=sd_allcat_beauty_fragrance/276-6718833-1247838?ie=UTF8&node=1374298031,None,Fragranc,Nike,Nina Ricci,http://ecx.images-amazon.com/images/I/31l1aSi2PEL._AA160_.jpg,None,self Colour,Beauty & Health,http://www.amazon.in/Nina-Fantasy-Ricci-limited-Edition/dp/B00783K4E4/ref=sr_1_62/275-1805524-5845351?s=beauty&ie=UTF8&qid=1395126888&sr=1-62,[<a href="/gp/help/seller/at-a-glance.html/275-1805524-5845351?ie=UTF8&amp;seller=A29ZFTNVZHDXBZ">Route2Fashion</a>],Amazon.in: Buy Nina Fantasy By Nina Ricci Edt Spray 50.27 ml (limited Edition) Online at Best Price in India | Amazon Beauty Store,Buy Nina Fantasy By Nina Ricci Edt Spray 50.27 ml (limited Edition) at lowest price in India on Amazon.in. Check out Nina Fantasy By Nina Ricci Edt Spray 50.27 ml (limited Edition) reviews  ratings  features  specifications and browse more Beauty products online at best prices on Amazon.in.,None,<div class="bucket" id="productDescription"> <h2>Product Description</h2> <div class="content"> <h3 class="productDescriptionSource"></h3> <div class="productDescriptionWrapper">        Design House: Nina Ricci  Year Introduced: 2012  Recommended Use: Romantic  Recommended Use: Romantic              <div class="emptyClear"> </div> </div> </div> </div>,None,18:03:2014,None
B00GXXOC5C,Nina LElixir Eau De Parfum Spray 80ml/2.7oz,http://www.amazon.in/Fragrances/b/ref=sd_allcat_beauty_fragrance/276-6718833-1247838?ie=UTF8&node=1374298031,Rs. 3 300.00,Fragranc,Nike,Nina Ricci,http://ecx.images-amazon.com/images/I/31l1aSi2PEL._AA160_.jpg,Rs. 3 300.00,self Colour,Beauty & Health,http://www.amazon.in/Nina-LElixir-Parfum-Spray-2-7oz/dp/B00GXXOC5C/ref=sr_1_69/275-1805524-5845351?s=beauty&ie=UTF8&qid=1395126888&sr=1-69,[<a class="buyAction" href="/gp/offer-listing/B00GXXOC5C/ref=dp_olp_0/275-1805524-5845351?ie=UTF8&amp;condition=all">these sellers</a>],Amazon.in: Buy Nina LElixir Eau De Parfum Spray 80ml/2.7oz Online at Best Price in India | Amazon Beauty Store,Buy Nina LElixir Eau De Parfum Spray 80ml/2.7oz at lowest price in India on Amazon.in. Check out Nina LElixir Eau De Parfum Spray 80ml/2.7oz reviews  ratings  features  specifications and browse more Beauty products online at best prices on Amazon.in.,None,None,None,18:03:2014,None
B0047AFCUW,Nina L'elixir by Nina Ricci Eau De Parfum Spray  79.85ml,http://www.amazon.in/Fragrances/b/ref=sd_allcat_beauty_fragrance/276-6718833-1247838?ie=UTF8&node=1374298031,None,Fragranc,Nike,Nina Ricci,http://ecx.images-amazon.com/images/I/31l1aSi2PEL._AA160_.jpg,None,self Colour,Beauty & Health,http://www.amazon.in/Nina-Lelixir-Ricci-Parfum-79-85ml/dp/B0047AFCUW/ref=sr_1_67/275-1805524-5845351?s=beauty&ie=UTF8&qid=1395126888&sr=1-67,[<a href="/gp/help/seller/at-a-glance.html/275-1805524-5845351?ie=UTF8&amp;seller=A29ZFTNVZHDXBZ">Route2Fashion</a>],Amazon.in: Buy Nina L'elixir by Nina Ricci Eau De Parfum Spray  79.85ml Online at Best Price in India | Amazon Beauty Store,Buy Nina L'elixir by Nina Ricci Eau De Parfum Spray  79.85ml at lowest price in India on Amazon.in. Check out Nina L'elixir by Nina Ricci Eau De Parfum Spray  79.85ml reviews  ratings  features  specifications and browse more Beauty products online at best prices on Amazon.in.,None,<div class="bucket" id="productDescription"> <h2>Product Description</h2> <div class="content"> <h3 class="productDescriptionSource"></h3> <div class="productDescriptionWrapper">        Design House: Nina Ricci  Year Introduced: 2010  Recommended Use: Daytime  Recommended Use: Daytime              <div class="emptyClear"> </div> </div> </div> </div>,None,18:03:2014,None
