B000V24634,Nina Ricci Eau de Parfum Spray Premier Jour 3.3 Fluid Ounce,http://www.amazon.in/Fragrances/b/ref=sd_allcat_beauty_fragrance/276-6718833-1247838?ie=UTF8&node=1374298031,None,Fragranc,Nike,Nina Ricci,http://ecx.images-amazon.com/images/I/31l1aSi2PEL._AA160_.jpg,None,self Colour,Beauty & Health,http://www.amazon.in/Nina-Ricci-Parfum-Spray-Premier/dp/B000V24634/ref=sr_1_70/275-1805524-5845351?s=beauty&ie=UTF8&qid=1395126888&sr=1-70,[<a href="/gp/help/seller/at-a-glance.html/275-1805524-5845351?ie=UTF8&amp;seller=A2NFQIUV2YGOLG">Fragume</a>],Amazon.in: Buy Nina Ricci Eau de Parfum Spray Premier Jour 3.3 Fluid Ounce Online at Best Price in India | Amazon Beauty Store,Buy Nina Ricci Eau de Parfum Spray Premier Jour 3.3 Fluid Ounce at lowest price in India on Amazon.in. Check out Nina Ricci Eau de Parfum Spray Premier Jour 3.3 Fluid Ounce reviews  ratings  features  specifications and browse more Beauty products online at best prices on Amazon.in.,None,<div class="bucket" id="productDescription"> <h2>Product Description</h2> <div class="content"> <h3 class="productDescriptionSource"></h3> <div class="productDescriptionWrapper">        "Premier Jour by Nina Ricci Eau De Parfum Spray 3.3 oz for Women"              <div class="emptyClear"> </div> </div> </div> </div>,None,18:03:2014,None
B001366M9I,Nina Ricci L'Air Du Temps Eau De Toilette Spray Refill for Women  100ml,http://www.amazon.in/Fragrances/b/ref=sd_allcat_beauty_fragrance/276-6718833-1247838?ie=UTF8&node=1374298031,None,Fragranc,Nike,Nina Ricci,http://ecx.images-amazon.com/images/I/31l1aSi2PEL._AA160_.jpg,None,self Colour,Beauty & Health,http://www.amazon.in/Nina-Ricci-Temps-Toilette-Refill/dp/B001366M9I/ref=sr_1_71/275-1805524-5845351?s=beauty&ie=UTF8&qid=1395126888&sr=1-71,[<a href="/gp/help/seller/at-a-glance.html/275-1805524-5845351?ie=UTF8&amp;seller=A2NFQIUV2YGOLG">Fragume</a>],Amazon.in: Buy Nina Ricci L'Air Du Temps Eau De Toilette Spray Refill for Women  100ml Online at Best Price in India | Amazon Beauty Store,Buy Nina Ricci L'Air Du Temps Eau De Toilette Spray Refill for Women  100ml at lowest price in India on Amazon.in. Check out Nina Ricci L'Air Du Temps Eau De Toilette Spray Refill for Women  100ml reviews  ratings  features  specifications and browse more Beauty products online at best prices on Amazon.in.,None,<div class="bucket" id="productDescription"> <h2>Product Description</h2> <div class="content"> <h3 class="productDescriptionSource"></h3> <div class="productDescriptionWrapper">        When applying any fragrance please consider that there are several factors which can affect the natural smell of your skin and  in turn  the way a scent smells on you. For instance  your mood  stress level  age  body chemistry  diet and current medications may all alter the scents you wear. Similarly  factor such as dry or oily skin can even affect the amount of time a fragrance will last after being applied.              <div class="emptyClear"> </div> </div> </div> </div>,None,18:03:2014,None
B00DRE1H6M,Nike N150 Free Soul EDT N/S for Women  Blue  150ml,http://www.amazon.in/Fragrances/b/ref=sd_allcat_beauty_fragrance/276-6718833-1247838?ie=UTF8&node=1374298031,Rs. 900.00,Fragranc,Nike,Nina Ricci,http://ecx.images-amazon.com/images/I/31l1aSi2PEL._AA160_.jpg,Rs. 900.00,self Colour,Beauty & Health,http://www.amazon.in/Nike-N150-Free-Women-150ml/dp/B00DRE1H6M/ref=sr_1_17/275-1805524-5845351?s=beauty&ie=UTF8&qid=1395126866&sr=1-17,[<a class="buyAction" href="/gp/offer-listing/B00DRE1H6M/ref=dp_olp_0/275-1805524-5845351?ie=UTF8&amp;condition=all">these sellers</a>],Amazon.in: Buy Nike N150 Free Soul EDT N/S for Women  Blue  150ml Online at Best Price in India | Amazon Beauty Store,Buy Nike N150 Free Soul EDT N/S for Women  Blue  150ml at lowest price in India on Amazon.in. Check out Nike N150 Free Soul EDT N/S for Women  Blue  150ml reviews  ratings  features  specifications and browse more Beauty products online at best prices on Amazon.in.,None,<div class="bucket" id="productDescription"> <h2>Product Description</h2> <div class="content"> <h3 class="productDescriptionSource"></h3> <div class="productDescriptionWrapper">        Nike fragrances greets you with fresh fragrances that are long lasting and smell divine.              <div class="emptyClear"> </div> </div> </div> </div>,None,18:03:2014,None
B000C21CVC,Nina Ricci Nina L" Air Du Temps Women Edt 50 ml.,http://www.amazon.in/Fragrances/b/ref=sd_allcat_beauty_fragrance/276-6718833-1247838?ie=UTF8&node=1374298031,None,Fragranc,Nike,Nina Ricci,http://ecx.images-amazon.com/images/I/31l1aSi2PEL._AA160_.jpg,None,self Colour,Beauty & Health,http://www.amazon.in/Nina-Ricci-Air-Temps-Women/dp/B000C21CVC/ref=sr_1_77/275-1805524-5845351?s=beauty&ie=UTF8&qid=1395126894&sr=1-77,[<a href="/gp/help/seller/at-a-glance.html/275-1805524-5845351?ie=UTF8&amp;seller=A2NFQIUV2YGOLG">Fragume</a>],Amazon.in: Buy Nina Ricci Nina L" Air Du Temps Women Edt 50 ml. Online at Best Price in India | Amazon Beauty Store,Buy Nina Ricci Nina L" Air Du Temps Women Edt 50 ml. at lowest price in India on Amazon.in. Check out Nina Ricci Nina L" Air Du Temps Women Edt 50 ml. reviews  ratings  features  specifications and browse more Beauty products online at best prices on Amazon.in.,None,<div class="bucket" id="productDescription"> <h2>Product Description</h2> <div class="content"> <h3 class="productDescriptionSource"></h3> <div class="productDescriptionWrapper">        Design House: Nina Ricci  Year Introduced: 1948  Recommended Use: Evening  Recommended Use: Evening              <div class="emptyClear"> </div> </div> </div> </div>,None,18:03:2014,None
B0084Z9GHQ,Nina Ricci Nina Women 80ML EDT,http://www.amazon.in/Fragrances/b/ref=sd_allcat_beauty_fragrance/276-6718833-1247838?ie=UTF8&node=1374298031,None,Fragranc,Nike,Nina Ricci,http://ecx.images-amazon.com/images/I/31l1aSi2PEL._AA160_.jpg,None,self Colour,Beauty & Health,http://www.amazon.in/Nina-Ricci-Women-80ML-EDT/dp/B0084Z9GHQ/ref=sr_1_79/275-1805524-5845351?s=beauty&ie=UTF8&qid=1395126894&sr=1-79,[<a href="/gp/help/seller/at-a-glance.html/275-1805524-5845351?ie=UTF8&amp;seller=A2NFQIUV2YGOLG">Fragume</a>],Amazon.in: Buy Nina Ricci Nina Women 80ML EDT Online at Best Price in India | Amazon Beauty Store,Buy Nina Ricci Nina Women 80ML EDT at lowest price in India on Amazon.in. Check out Nina Ricci Nina Women 80ML EDT reviews  ratings  features  specifications and browse more Beauty products online at best prices on Amazon.in.,None,None,None,18:03:2014,None
B0084YCWYQ,Nina Ricci Ricci Ricci Women 80ML EDP,http://www.amazon.in/Fragrances/b/ref=sd_allcat_beauty_fragrance/276-6718833-1247838?ie=UTF8&node=1374298031,None,Fragranc,Nike,Nina Ricci,http://ecx.images-amazon.com/images/I/31l1aSi2PEL._AA160_.jpg,None,self Colour,Beauty & Health,http://www.amazon.in/Nina-Ricci-Women-80ML-EDP/dp/B0084YCWYQ/ref=sr_1_82/275-1805524-5845351?s=beauty&ie=UTF8&qid=1395126894&sr=1-82,[<a href="/gp/help/seller/at-a-glance.html/275-1805524-5845351?ie=UTF8&amp;seller=A2NFQIUV2YGOLG">Fragume</a>],Amazon.in: Buy Nina Ricci Ricci Ricci Women 80ML EDP Online at Best Price in India | Amazon Beauty Store,Buy Nina Ricci Ricci Ricci Women 80ML EDP at lowest price in India on Amazon.in. Check out Nina Ricci Ricci Ricci Women 80ML EDP reviews  ratings  features  specifications and browse more Beauty products online at best prices on Amazon.in.,None,None,None,18:03:2014,None
B000JEWHWQ,Nina Ricci Ricci Ricci Women Edp 50 ml.,http://www.amazon.in/Fragrances/b/ref=sd_allcat_beauty_fragrance/276-6718833-1247838?ie=UTF8&node=1374298031,None,Fragranc,Nike,Nina Ricci,http://ecx.images-amazon.com/images/I/31l1aSi2PEL._AA160_.jpg,None,self Colour,Beauty & Health,http://www.amazon.in/Nina-Ricci-Women-Edp-ml/dp/B000JEWHWQ/ref=sr_1_83/275-1805524-5845351?s=beauty&ie=UTF8&qid=1395126894&sr=1-83,[<a href="/gp/help/seller/at-a-glance.html/275-1805524-5845351?ie=UTF8&amp;seller=A2NFQIUV2YGOLG">Fragume</a>],Amazon.in: Buy Nina Ricci Ricci Ricci Women Edp 50 ml. Online at Best Price in India | Amazon Beauty Store,Buy Nina Ricci Ricci Ricci Women Edp 50 ml. at lowest price in India on Amazon.in. Check out Nina Ricci Ricci Ricci Women Edp 50 ml. reviews  ratings  features  specifications and browse more Beauty products online at best prices on Amazon.in.,None,<div class="bucket" id="productDescription"> <h2>Product Description</h2> <div class="content"> <h3 class="productDescriptionSource"></h3> <div class="productDescriptionWrapper">        Design House: Nina Ricci  Year Introduced: 2009  Recommended Use: Casual  Recommended Use: Casual              <div class="emptyClear"> </div> </div> </div> </div>,None,18:03:2014,None
B00DUMIC3W,Nina L'elixir Gift Set Nina L'elixir By Nina Ricci,http://www.amazon.in/Fragrances/b/ref=sd_allcat_beauty_fragrance/276-6718833-1247838?ie=UTF8&node=1374298031,Rs. 3 166.00,Fragranc,Nike,Nina Ricci,http://ecx.images-amazon.com/images/I/31l1aSi2PEL._AA160_.jpg,Rs. 3 166.00,self Colour,Beauty & Health,http://www.amazon.in/Nina-Lelixir-Gift-Set-Ricci/dp/B00DUMIC3W/ref=sr_1_89/275-1805524-5845351?s=beauty&ie=UTF8&qid=1395126894&sr=1-89,[<a class="buyAction" href="/gp/offer-listing/B00DUMIC3W/ref=dp_olp_0/275-1805524-5845351?ie=UTF8&amp;condition=all">these sellers</a>],Nina L'elixir Gift Set Nina L'elixir By Nina Ricci: Amazon.in: Beauty,Nina L'elixir Gift Set Nina L'elixir By Nina Ricci: Amazon.in: Beauty,None,<div class="bucket" id="productDescription"> <h2>Product Description</h2> <div class="content"> <h3 class="productDescriptionSource"></h3> <div class="productDescriptionWrapper">        Design House: Nina Ricci  Year Introduced: 2010  Recommended Use: Daytime  Recommended Use: Daytime              <div class="emptyClear"> </div> </div> </div> </div>,None,18:03:2014,None
B00DRE485E,Nike Up Or Down Perf EDT for Men  Orange  75ml,http://www.amazon.in/Fragrances/b/ref=sd_allcat_beauty_fragrance/276-6718833-1247838?ie=UTF8&node=1374298031,Rs. 699.00,Fragranc,Nike,Nina Ricci,http://ecx.images-amazon.com/images/I/31l1aSi2PEL._AA160_.jpg,Rs. 699.00,self Colour,Beauty & Health,http://www.amazon.in/Nike-Down-Perf-Orange-75ml/dp/B00DRE485E/ref=sr_1_56/275-1805524-5845351?s=beauty&ie=UTF8&qid=1395126888&sr=1-56,[<a class="buyAction" href="/gp/offer-listing/B00DRE485E/ref=dp_olp_0/275-1805524-5845351?ie=UTF8&amp;condition=all">these sellers</a>],Amazon.in: Buy Nike Up Or Down Perf EDT for Men  Orange  75ml Online at Best Price in India | Amazon Beauty Store,Buy Nike Up Or Down Perf EDT for Men  Orange  75ml at lowest price in India on Amazon.in. Check out Nike Up Or Down Perf EDT for Men  Orange  75ml reviews  ratings  features  specifications and browse more Beauty products online at best prices on Amazon.in.,None,<div class="bucket" id="productDescription"> <h2>Product Description</h2> <div class="content"> <h3 class="productDescriptionSource"></h3> <div class="productDescriptionWrapper">        Nike Up or Down is an Eau de Toilette Deodorant for men that offers long-lasting protection from body odors.              <div class="emptyClear"> </div> </div> </div> </div>,None,18:03:2014,None
B000P20S2S,Nina Ricci Premier Jour Eau De Parfum Spray  50.2 ml,http://www.amazon.in/Fragrances/b/ref=sd_allcat_beauty_fragrance/276-6718833-1247838?ie=UTF8&node=1374298031,None,Fragranc,Nike,Nina Ricci,http://ecx.images-amazon.com/images/I/31l1aSi2PEL._AA160_.jpg,None,self Colour,Beauty & Health,http://www.amazon.in/Nina-Ricci-Premier-Parfum-Spray/dp/B000P20S2S/ref=sr_1_81/275-1805524-5845351?s=beauty&ie=UTF8&qid=1395126894&sr=1-81,[<a href="/gp/help/seller/at-a-glance.html/275-1805524-5845351?ie=UTF8&amp;seller=A3ES9F57NVVRIK">MyLuckyScent</a>],Amazon.in: Buy Nina Ricci Premier Jour Eau De Parfum Spray  50.2 ml Online at Best Price in India | Amazon Beauty Store,Buy Nina Ricci Premier Jour Eau De Parfum Spray  50.2 ml at lowest price in India on Amazon.in. Check out Nina Ricci Premier Jour Eau De Parfum Spray  50.2 ml reviews  ratings  features  specifications and browse more Beauty products online at best prices on Amazon.in.,None,<div class="bucket" id="productDescription"> <h2>Product Description</h2> <div class="content"> <h3 class="productDescriptionSource"></h3> <div class="productDescriptionWrapper">        Design House: Nina Ricci  Year Introduced: 2001  Recommended Use: Daytime  Recommended Use: Daytime              <div class="emptyClear"> </div> </div> </div> </div>,None,18:03:2014,None
