B00FJSVXP4,Oriflame Pure Nature Organic Tea Tree and Rosemary Purifying Corrective Stick  4g,http://www.amazon.in/Makeup-Nails/b/ref=sd_allcat_beauty_makeup/276-6718833-1247838?ie=UTF8&node=1374357031,None,Make-up & Nail,Face,Oriflame,http://ecx.images-amazon.com/images/I/31KjxSIR-cL._AA160_.jpg,None,self Colour,Beauty & Health,http://www.amazon.in/Oriflame-Organic-Rosemary-Purifying-Corrective/dp/B00FJSVXP4/ref=sr_1_2/280-3522466-6690359?s=beauty&ie=UTF8&qid=1395126833&sr=1-2,[<a href="/gp/help/seller/at-a-glance.html/280-3522466-6690359?ie=UTF8&amp;seller=A3COW1HPTTGVAS">Live Cosmetics</a>],Amazon.in: Buy Oriflame Pure Nature Organic Tea Tree and Rosemary Purifying Corrective Stick  4g Online at Best Price in India | Amazon Beauty Store,Buy Oriflame Pure Nature Organic Tea Tree and Rosemary Purifying Corrective Stick  4g at lowest price in India on Amazon.in. Check out Oriflame Pure Nature Organic Tea Tree and Rosemary Purifying Corrective Stick  4g reviews  ratings  features  specifications and browse more Beauty products online at best prices on Amazon.in.,None,<div class="bucket" id="productDescription"> <h2>Product Description</h2> <div class="content"> <h3 class="productDescriptionSource"></h3> <div class="productDescriptionWrapper">        Smart stick with pure organic tea tree and rosemary oil hides and helps dry out imperfections. First tone down redness with green shade. Then conceal with beige shade.              <div class="emptyClear"> </div> </div> </div> </div>,None,18:03:2014,None
B00EOV3U4O,Oriflame Beauty Studio Artist Concealer  Light shade  10ml,http://www.amazon.in/Makeup-Nails/b/ref=sd_allcat_beauty_makeup/276-6718833-1247838?ie=UTF8&node=1374357031,None,Make-up & Nail,Face,Oriflame,http://ecx.images-amazon.com/images/I/31KjxSIR-cL._AA160_.jpg,None,self Colour,Beauty & Health,http://www.amazon.in/Oriflame-Beauty-Studio-Artist-Concealer/dp/B00EOV3U4O/ref=sr_1_3/280-3522466-6690359?s=beauty&ie=UTF8&qid=1395126833&sr=1-3,[<a href="/gp/help/seller/at-a-glance.html/280-3522466-6690359?ie=UTF8&amp;seller=A3COW1HPTTGVAS">Live Cosmetics</a>],Amazon.in: Buy Oriflame Beauty Studio Artist Concealer  Light shade  10ml Online at Best Price in India | Amazon Beauty Store,Buy Oriflame Beauty Studio Artist Concealer  Light shade  10ml at lowest price in India on Amazon.in. Check out Oriflame Beauty Studio Artist Concealer  Light shade  10ml reviews  ratings  features  specifications and browse more Beauty products online at best prices on Amazon.in.,None,<div class="bucket" id="productDescription"> <h2>Product Description</h2> <div class="content"> <h3 class="productDescriptionSource"></h3> <div class="productDescriptionWrapper">        Illuma-flair light-reflecting complex diffuses light to minimise fine lines and imperfections - dark circles  blemishes and veins seemingly disappear under a perfectly natural finish. Buildable coverage and moisturising formula ensures weightless  comfortable wear and a stunning result.              <div class="emptyClear"> </div> </div> </div> </div>,None,18:03:2014,None
B00FJSQZ7K,Oriflame Very Me Peach Me Perfect Skin Glow  Dark shade  30ml,http://www.amazon.in/Makeup-Nails/b/ref=sd_allcat_beauty_makeup/276-6718833-1247838?ie=UTF8&node=1374357031,None,Make-up & Nail,Face,Oriflame,http://ecx.images-amazon.com/images/I/31KjxSIR-cL._AA160_.jpg,None,self Colour,Beauty & Health,http://www.amazon.in/Oriflame-Very-Peach-Perfect-shade/dp/B00FJSQZ7K/ref=sr_1_6/280-3522466-6690359?s=beauty&ie=UTF8&qid=1395126833&sr=1-6,[<a href="/gp/help/seller/at-a-glance.html/280-3522466-6690359?ie=UTF8&amp;seller=A3COW1HPTTGVAS">Live Cosmetics</a>],Amazon.in: Buy Oriflame Very Me Peach Me Perfect Skin Glow  Dark shade  30ml Online at Best Price in India | Amazon Beauty Store,Buy Oriflame Very Me Peach Me Perfect Skin Glow  Dark shade  30ml at lowest price in India on Amazon.in. Check out Oriflame Very Me Peach Me Perfect Skin Glow  Dark shade  30ml reviews  ratings  features  specifications and browse more Beauty products online at best prices on Amazon.in.,None,<div class="bucket" id="productDescription"> <h2>Product Description</h2> <div class="content"> <h3 class="productDescriptionSource"></h3> <div class="productDescriptionWrapper">        Bring out the best in your complexion. Tinted gel moisturiser with a lightweight finish gives you a peachy  natural glow. Can be worn alone or with your favourite foundation.              <div class="emptyClear"> </div> </div> </div> </div>,None,18:03:2014,None
B00FJSVSPO,Oriflame Very Me Peach Me Perfect Skin Glow  Light shade,http://www.amazon.in/Makeup-Nails/b/ref=sd_allcat_beauty_makeup/276-6718833-1247838?ie=UTF8&node=1374357031,None,Make-up & Nail,Face,Oriflame,http://ecx.images-amazon.com/images/I/31KjxSIR-cL._AA160_.jpg,None,Colorbar Velvet Matt Lipstick,Beauty & Health,http://www.amazon.in/Oriflame-Peach-Perfect-Light-shade/dp/B00FJSVSPO/ref=sr_1_1/280-3522466-6690359?s=beauty&ie=UTF8&qid=1395126833&sr=1-1,[<a href="/gp/help/seller/at-a-glance.html/280-3522466-6690359?ie=UTF8&amp;seller=A3COW1HPTTGVAS">Live Cosmetics</a>],Amazon.in: Buy Oriflame Very Me Peach Me Perfect Skin Glow  Light shade Online at Best Price in India | Amazon Beauty Store,Buy Oriflame Very Me Peach Me Perfect Skin Glow  Light shade at lowest price in India on Amazon.in. Check out Oriflame Very Me Peach Me Perfect Skin Glow  Light shade reviews  ratings  features  specifications and browse more Beauty products online at best prices on Amazon.in.,None,<div class="bucket" id="productDescription"> <h2>Product Description</h2> <div class="content"> <h3 class="productDescriptionSource"></h3> <div class="productDescriptionWrapper">        Bring out the best in your complexion. Tinted gel moisturiser with a lightweight finish gives you a peachy  natural glow. Can be worn alone or with your favourite foundation.              <div class="emptyClear"> </div> </div> </div> </div>,None,18:03:2014,None
B00FJSVTN0,Oriflame Pure Colour Perfect Powder  Light/Medium  20g,http://www.amazon.in/Makeup-Nails/b/ref=sd_allcat_beauty_makeup/276-6718833-1247838?ie=UTF8&node=1374357031,None,Make-up & Nail,Face,Oriflame,http://ecx.images-amazon.com/images/I/31KjxSIR-cL._AA160_.jpg,None,self Colour,Beauty & Health,http://www.amazon.in/Oriflame-Colour-Perfect-Powder-Medium/dp/B00FJSVTN0/ref=sr_1_8/280-3522466-6690359?s=beauty&ie=UTF8&qid=1395126833&sr=1-8,[<a href="/gp/help/seller/at-a-glance.html/280-3522466-6690359?ie=UTF8&amp;seller=A3T01OD6WSSRJ">shopfororiflame</a>],Amazon.in: Buy Oriflame Pure Colour Perfect Powder  Light/Medium  20g Online at Best Price in India | Amazon Beauty Store,Buy Oriflame Pure Colour Perfect Powder  Light/Medium  20g at lowest price in India on Amazon.in. Check out Oriflame Pure Colour Perfect Powder  Light/Medium  20g reviews  ratings  features  specifications and browse more Beauty products online at best prices on Amazon.in.,None,<div class="bucket" id="productDescription"> <h2>Product Description</h2> <div class="content"> <h3 class="productDescriptionSource"></h3> <div class="productDescriptionWrapper">        Compact Powder.              <div class="emptyClear"> </div> </div> </div> </div>,None,18:03:2014,None
B00FBZYH7G,Oriflame Beauty Studio Artist Loose Powder 7G,http://www.amazon.in/Makeup-Nails/b/ref=sd_allcat_beauty_makeup/276-6718833-1247838?ie=UTF8&node=1374357031,None,Make-up & Nail,Face,Oriflame,http://ecx.images-amazon.com/images/I/31KjxSIR-cL._AA160_.jpg,None,self Colour,Beauty & Health,http://www.amazon.in/Oriflame-Beauty-Studio-Artist-Powder/dp/B00FBZYH7G/ref=sr_1_7/280-3522466-6690359?s=beauty&ie=UTF8&qid=1395126833&sr=1-7,[<a href="/gp/help/seller/at-a-glance.html/280-3522466-6690359?ie=UTF8&amp;seller=A3COW1HPTTGVAS">Live Cosmetics</a>],Amazon.in: Buy Oriflame Beauty Studio Artist Loose Powder 7G Online at Best Price in India | Amazon Beauty Store,Buy Oriflame Beauty Studio Artist Loose Powder 7G at lowest price in India on Amazon.in. Check out Oriflame Beauty Studio Artist Loose Powder 7G reviews  ratings  features  specifications and browse more Beauty products online at best prices on Amazon.in.,None,<div class="bucket" id="productDescription"> <h2>Product Description</h2> <div class="content"> <h3 class="productDescriptionSource"></h3> <div class="productDescriptionWrapper">        ORIFLAME BEAUTY STUDIO ARTIST LOOSE POWDER 7G ULTRA-FINE LOOSE POWDER IN A TRANSLUSCENT FORMULA TO FIT EVERY SKIN-TONE. SETS MAKE-UP  KEEPING COMPLEXION SHINE-FREE AND FLAWLESS. CONTAINS LIGHT-REFLECTING AND LUMINOUS RESULT IN ANY LIGHT.              <div class="emptyClear"> </div> </div> </div> </div>,None,18:03:2014,None
B00EOV3YMC,Oriflame Beauty Studio Artist Pressed Powder 8G - Medium,http://www.amazon.in/Makeup-Nails/b/ref=sd_allcat_beauty_makeup/276-6718833-1247838?ie=UTF8&node=1374357031,None,Make-up & Nail,Face,Oriflame,http://ecx.images-amazon.com/images/I/31KjxSIR-cL._AA160_.jpg,None,self Colour,Beauty & Health,http://www.amazon.in/Oriflame-Beauty-Studio-Artist-Pressed/dp/B00EOV3YMC/ref=sr_1_9/280-3522466-6690359?s=beauty&ie=UTF8&qid=1395126833&sr=1-9,[<a href="/gp/help/seller/at-a-glance.html/280-3522466-6690359?ie=UTF8&amp;seller=A3COW1HPTTGVAS">Live Cosmetics</a>],Amazon.in: Buy Oriflame Beauty Studio Artist Pressed Powder 8G - Medium Online at Best Price in India | Amazon Beauty Store,Buy Oriflame Beauty Studio Artist Pressed Powder 8G - Medium at lowest price in India on Amazon.in. Check out Oriflame Beauty Studio Artist Pressed Powder 8G - Medium reviews  ratings  features  specifications and browse more Beauty products online at best prices on Amazon.in.,None,<div class="bucket" id="productDescription"> <h2>Product Description</h2> <div class="content"> <h3 class="productDescriptionSource"></h3> <div class="productDescriptionWrapper">        ORIFLAME BEAUTY STUDIO ARTIST PRESSED POWDER 8G - MEDIUM PERFECT FOR SETTING YOUR MAKE-UP OR TOUCHING UP DRING THE DAY LIGHT. LIGHT DIFUSSING PIGMENTS BLUR IMPERFECTIONS AND ITS ULTRA FINE TEXTURE FLAWLESSLY BLENDS WITH YOUR SKIN FOR A NATURAL LOOK  WITHOUT CAKING OR SETTING INTO FINE LINES.              <div class="emptyClear"> </div> </div> </div> </div>,None,18:03:2014,None
B008V9R5FU,Oriflame Beauty Perfecting Face Primer  30ml,http://www.amazon.in/Makeup-Nails/b/ref=sd_allcat_beauty_makeup/276-6718833-1247838?ie=UTF8&node=1374357031,None,Make-up & Nail,Face,Oriflame,http://ecx.images-amazon.com/images/I/31KjxSIR-cL._AA160_.jpg,None,self Colour,Beauty & Health,http://www.amazon.in/Oriflame-Beauty-Perfecting-Face-Primer/dp/B008V9R5FU/ref=sr_1_5/280-3522466-6690359?s=beauty&ie=UTF8&qid=1395126833&sr=1-5,[<a href="/gp/help/seller/at-a-glance.html/280-3522466-6690359?ie=UTF8&amp;seller=A3COW1HPTTGVAS">Live Cosmetics</a>],Amazon.in: Buy Oriflame Beauty Perfecting Face Primer  30ml Online at Best Price in India | Amazon Beauty Store,Buy Oriflame Beauty Perfecting Face Primer  30ml at lowest price in India on Amazon.in. Check out Oriflame Beauty Perfecting Face Primer  30ml reviews  ratings  features  specifications and browse more Beauty products online at best prices on Amazon.in.,None,<div class="bucket" id="productDescription"> <h2>Product Description</h2> <div class="content"> <h3 class="productDescriptionSource"></h3> <div class="productDescriptionWrapper">        Morning-fresh make-up - all day long. Light diffusing properties and emollients give your skin silky softness and an even complexion  whilst mattifying properties mean easier  more comfortable make-up application. The result is the perfect base for your make-up and a wonderfully radiant finish.              <div class="emptyClear"> </div> </div> </div> </div>,None,18:03:2014,None
B00EOV5R5E,Oriflame Beauty Whitening Powder Foundation  Bright Rose  6g,http://www.amazon.in/Makeup-Nails/b/ref=sd_allcat_beauty_makeup/276-6718833-1247838?ie=UTF8&node=1374357031,None,Make-up & Nail,Face,Oriflame,http://ecx.images-amazon.com/images/I/31KjxSIR-cL._AA160_.jpg,None,self Colour,Beauty & Health,http://www.amazon.in/Oriflame-Beauty-Whitening-Powder-Foundation/dp/B00EOV5R5E/ref=sr_1_4/280-3522466-6690359?s=beauty&ie=UTF8&qid=1395126833&sr=1-4,[<a href="/gp/help/seller/at-a-glance.html/280-3522466-6690359?ie=UTF8&amp;seller=A3COW1HPTTGVAS">Live Cosmetics</a>],Amazon.in: Buy Oriflame Beauty Whitening Powder Foundation  Bright Rose  6g Online at Best Price in India | Amazon Beauty Store,Buy Oriflame Beauty Whitening Powder Foundation  Bright Rose  6g at lowest price in India on Amazon.in. Check out Oriflame Beauty Whitening Powder Foundation  Bright Rose  6g reviews  ratings  features  specifications and browse more Beauty products online at best prices on Amazon.in.,None,<div class="bucket" id="productDescription"> <h2>Product Description</h2> <div class="content"> <h3 class="productDescriptionSource"></h3> <div class="productDescriptionWrapper">        Oriflame Beauty Whitening Powder Foundation. Both these foundations provide outstanding and superior whitening finish with long lasting  moisturizing and mattifying effect. The range features all this with SPF  for flawless coverage and perfect complexion. Quantity 6 gram all Oriflame products are purchased directly from Oriflame warehouse  Only after customer places order and will be having sufficient expiry time  but year of make cannot be guaranteed to be 2013 always.              <div class="emptyClear"> </div> </div> </div> </div>,None,18:03:2014,None
B00EOV5EEI,Oriflame Very Me Cover Up Concealer  Perfect light,http://www.amazon.in/Makeup-Nails/b/ref=sd_allcat_beauty_makeup/276-6718833-1247838?ie=UTF8&node=1374357031,None,Make-up & Nail,Face,Oriflame,http://ecx.images-amazon.com/images/I/31KjxSIR-cL._AA160_.jpg,None,self Colour,Beauty & Health,http://www.amazon.in/Oriflame-Cover-Concealer-Perfect-light/dp/B00EOV5EEI/ref=sr_1_10/280-3522466-6690359?s=beauty&ie=UTF8&qid=1395126833&sr=1-10,[<a href="/gp/help/seller/at-a-glance.html/280-3522466-6690359?ie=UTF8&amp;seller=A3T01OD6WSSRJ">shopfororiflame</a>],Amazon.in: Buy Oriflame Very Me Cover Up Concealer  Perfect light Online at Best Price in India | Amazon Beauty Store,Buy Oriflame Very Me Cover Up Concealer  Perfect light at lowest price in India on Amazon.in. Check out Oriflame Very Me Cover Up Concealer  Perfect light reviews  ratings  features  specifications and browse more Beauty products online at best prices on Amazon.in.,None,<div class="bucket" id="productDescription"> <h2>Product Description</h2> <div class="content"> <h3 class="productDescriptionSource"></h3> <div class="productDescriptionWrapper">        Get even  natural coverage with easy-to-use concealer stick. Contains tea tree oil to calm blemishes and soothe your skin. Perfect alone or paired with Very Me no time for Shine Powder.              <div class="emptyClear"> </div> </div> </div> </div>,None,18:03:2014,None
B00EOV3UAS,Oriflame Beauty Perfect Blush 4G - Fresh Pink,http://www.amazon.in/Makeup-Nails/b/ref=sd_allcat_beauty_makeup/276-6718833-1247838?ie=UTF8&node=1374357031,None,Make-up & Nail,Face,Oriflame,http://ecx.images-amazon.com/images/I/31KjxSIR-cL._AA160_.jpg,None,self Colour,Beauty & Health,http://www.amazon.in/Oriflame-Beauty-Perfect-Blush-4G/dp/B00EOV3UAS/ref=sr_1_11/280-3522466-6690359?s=beauty&ie=UTF8&qid=1395126833&sr=1-11,[<a href="/gp/help/seller/at-a-glance.html/280-3522466-6690359?ie=UTF8&amp;seller=A3COW1HPTTGVAS">Live Cosmetics</a>],Amazon.in: Buy Oriflame Beauty Perfect Blush 4G - Fresh Pink Online at Best Price in India | Amazon Beauty Store,Buy Oriflame Beauty Perfect Blush 4G - Fresh Pink at lowest price in India on Amazon.in. Check out Oriflame Beauty Perfect Blush 4G - Fresh Pink reviews  ratings  features  specifications and browse more Beauty products online at best prices on Amazon.in.,None,<div class="bucket" id="productDescription"> <h2>Product Description</h2> <div class="content"> <h3 class="productDescriptionSource"></h3> <div class="productDescriptionWrapper">        THE DELICATELY SOFT TEXTURE SCULPTS YOUR FACE AND CHEEKS ARE LEFT IN A STATE OF PURE RADIANCE - SUITED TO ALL SKIN TONES.              <div class="emptyClear"> </div> </div> </div> </div>,None,18:03:2014,None
B00FJSWAY2,Oriflame Giordani Gold Age Defying Foundation 30 ml,http://www.amazon.in/Makeup-Nails/b/ref=sd_allcat_beauty_makeup/276-6718833-1247838?ie=UTF8&node=1374357031,None,Make-up & Nail,Face,Oriflame,http://ecx.images-amazon.com/images/I/31KjxSIR-cL._AA160_.jpg,None,self Colour,Beauty & Health,http://www.amazon.in/Oriflame-Giordani-Gold-Defying-Foundation/dp/B00FJSWAY2/ref=sr_1_12/280-3522466-6690359?s=beauty&ie=UTF8&qid=1395126833&sr=1-12,[<a href="/gp/help/seller/at-a-glance.html/280-3522466-6690359?ie=UTF8&amp;seller=A3COW1HPTTGVAS">Live Cosmetics</a>],Amazon.in: Buy Oriflame Giordani Gold Age Defying Foundation 30 ml Online at Best Price in India | Amazon Beauty Store,Buy Oriflame Giordani Gold Age Defying Foundation 30 ml at lowest price in India on Amazon.in. Check out Oriflame Giordani Gold Age Defying Foundation 30 ml reviews  ratings  features  specifications and browse more Beauty products online at best prices on Amazon.in.,None,None,None,18:03:2014,None
