B00HXCSD8O,ALPHA MAN "Uptown Living  Downtown Chilling" Bracelet,http://www.amazon.in/Bangles-Bracelets/b/ref=sd_allcat_fj_bangles/276-6718833-1247838?ie=UTF8&node=2152549031,None,Bangles & Bracelet,Bangles & Bracelet,Alpha Man,http://ecx.images-amazon.com/images/I/41813dPITLL._SL190_CR0 0 190 246_.jpg,Rs. 719.00,self Colour,Watches & Fashion Jewellery,http://www.amazon.in/Uptown-Living-Downtown-Chilling-Bracelet/dp/B00HXCSD8O/ref=sr_1_56/275-0905959-1711169?s=jewelry&ie=UTF8&qid=1395127316&sr=1-56,[<a href="/gp/help/seller/at-a-glance.html/275-0905959-1711169?ie=UTF8&amp;seller=A2ICPVIIL9V508">Amaze Lifestyle</a>],Amazon.in: Buy ALPHA MAN "Uptown Living  Downtown Chilling" Bracelet at Low Prices in India | Fashion Jewellery Store,Buy ALPHA MAN "Uptown Living  Downtown Chilling" Bracelet at low prices in India at Amazon.in. Check out ALPHA MAN "Uptown Living  Downtown Chilling" Bracelet reviews  ratings  features  specifications and browse more Fashion Jewellery products online at best prices on Amazon.in.,None,<div class="bucket" id="productDescription"> <h2>Product Description</h2> <div class="content"> <h3 class="productDescriptionSource"></h3> <div class="productDescriptionWrapper">        -ALPHA MAN "Uptown Living  Downtown Chilling" Black Thread-Woven Tan Brown Bracelet Classic yet contemporary eye-catching designer White Faux Leather Bracelet with a focus on intricate design to make you stand out in the crowd  as the quintessential Man among the boys. - The perfect gift for Every Guy  be it your Facebook Friend  Best Buddy or Boyfriend or as an item to buy for yourself as a Birthday Gift or even as an Anniversary Gift for your Better Half (Husband or Wife  as the case may be) - This designer Gent's Bracelet comes equipped with Faux Leather Strap with Silver Metal Alloy enhancements studded into the material to ensure a smooth design  textured finish and superior comfort. - Classic Dual Button Clasp provides a comfortable fit while ensuring that the Bracelet stays on your wrist even while working on the laptop or phablet smartphone at Work or during Play. - Essential yet wonderful addition to up your style quotient this Summer without breaking bank. - Would match with almost every piece of clothing attire your own  be it jeans  tshirts  semi-formal or formal solid or stripes shirts or even your formals for a night out on the town Size: Free Size (One Size Fits All) Materials Used: Faux Leather  Metal Alloy Enhancements              <div class="emptyClear"> </div> </div> </div> </div>,<div align="left" class="bucket" id="techSpecSoftlinesWrap"><h2>Product Specifications </h2> <div class="content"> <div id="techSpecSoftlines"> <table cellspacing="0"> <tr> <th colspan="2">Jewellery Information</th> </tr> <tr> <td class="td1">Brand</td> <td class="td2">                                             Alpha Man                                         </td> </tr> <tr> <td class="td1">Material</td> <td class="td2">                                             leather                                         </td> </tr> <tr> <td class="td1">Model Number</td> <td class="td2">                                             AM_LB_ULBL                                         </td> </tr> </table> </div> </div> </div>,18:03:2014,None
B00HXCSEDS,ALPHA MAN "Uptown Living  Downtown Chilling" Bracelet,http://www.amazon.in/Bangles-Bracelets/b/ref=sd_allcat_fj_bangles/276-6718833-1247838?ie=UTF8&node=2152549031,None,Bangles & Bracelet,Bangles & Bracelet,Alpha Man,http://ecx.images-amazon.com/images/I/41813dPITLL._SL190_CR0 0 190 246_.jpg,Rs. 719.00,self Colour,Watches & Fashion Jewellery,http://www.amazon.in/Uptown-Living-Downtown-Chilling-Bracelet/dp/B00HXCSEDS/ref=sr_1_57/275-0905959-1711169?s=jewelry&ie=UTF8&qid=1395127316&sr=1-57,[<a href="/gp/help/seller/at-a-glance.html/275-0905959-1711169?ie=UTF8&amp;seller=A2ICPVIIL9V508">Amaze Lifestyle</a>],Amazon.in: Buy ALPHA MAN "Uptown Living  Downtown Chilling" Bracelet at Low Prices in India | Fashion Jewellery Store,Buy ALPHA MAN "Uptown Living  Downtown Chilling" Bracelet at low prices in India at Amazon.in. Check out ALPHA MAN "Uptown Living  Downtown Chilling" Bracelet reviews  ratings  features  specifications and browse more Fashion Jewellery products online at best prices on Amazon.in.,None,<div class="bucket" id="productDescription"> <h2>Product Description</h2> <div class="content"> <h3 class="productDescriptionSource"></h3> <div class="productDescriptionWrapper">        -ALPHA MAN "Uptown Living  Downtown Chilling" Black Thread-Woven Tan Brown Bracelet -Classic yet contemporary eye-catching designer White Faux Leather Bracelet with a focus on intricate design to make you stand out in the crowd  as the quintessential Man among the boys. - The perfect gift for Every Guy  be it your Facebook Friend  Best Buddy or Boyfriend or as an item to buy for yourself as a Birthday Gift or even as an Anniversary Gift for your Better Half (Husband or Wife  as the case may be) - This designer Gent's Bracelet comes equipped with Faux Leather Strap with Silver Metal Alloy enhancements studded into the material to ensure a smooth design  textured finish and superior comfort. - Classic Dual Button Clasp provides a comfortable fit while ensuring that the Bracelet stays on your wrist even while working on the laptop or phablet smartphone at Work or during Play. - Essential yet wonderful addition to up your style quotient this Summer without breaking bank. - Would match with almost every piece of clothing attire your own  be it jeans  tshirts  semi-formal or formal solid or stripes shirts or even your formals for a night out on the town Size: Free Size (One Size Fits All) Materials Used: Faux Leather  Metal Alloy Enhancements              <div class="emptyClear"> </div> </div> </div> </div>,<div align="left" class="bucket" id="techSpecSoftlinesWrap"><h2>Product Specifications </h2> <div class="content"> <div id="techSpecSoftlines"> <table cellspacing="0"> <tr> <th colspan="2">Jewellery Information</th> </tr> <tr> <td class="td1">Brand</td> <td class="td2">                                             Alpha Man                                         </td> </tr> <tr> <td class="td1">Material</td> <td class="td2">                                             leather                                         </td> </tr> <tr> <td class="td1">Model Number</td> <td class="td2">                                             AM_LB_ULDB                                         </td> </tr> </table> </div> </div> </div>,18:03:2014,None
B00ESYVIHS,Alpha Man Black Silicone Rope-Chain Bracelet For Men(AM_SLBK_017),http://www.amazon.in/Bangles-Bracelets/b/ref=sd_allcat_fj_bangles/276-6718833-1247838?ie=UTF8&node=2152549031,None,Bangles & Bracelet,Bangles & Bracelet,Alpha Man,http://ecx.images-amazon.com/images/I/41813dPITLL._SL190_CR0 0 190 246_.jpg,Rs. 1 199.00,self Colour,Watches & Fashion Jewellery,http://www.amazon.in/Alpha-Man-Silicone-Rope-Chain-AM_SLBK_017/dp/B00ESYVIHS/ref=sr_1_59/275-0905959-1711169?s=jewelry&ie=UTF8&qid=1395127316&sr=1-59,[<a href="/gp/help/seller/at-a-glance.html/275-0905959-1711169?ie=UTF8&amp;isAmazonFulfilled=1&amp;seller=A2ICPVIIL9V508">Amaze Lifestyle</a>  <a href="/gp/help/customer/display.html/275-0905959-1711169?ie=UTF8&amp;nodeId=200953360&amp;ref=dp_fulfillment" id="SSOFpopoverLink"><strong>Fulfilled by Amazon</strong></a>],Amazon.in: Buy Alpha Man Black Silicone Rope-Chain Bracelet For Men(AM_SLBK_017) at Low Prices in India | Fashion Jewellery Store,Buy Alpha Man Black Silicone Rope-Chain Bracelet For Men(AM_SLBK_017) at low prices in India at Amazon.in. Check out Alpha Man Black Silicone Rope-Chain Bracelet For Men(AM_SLBK_017) reviews  ratings  features  specifications and browse more Fashion Jewellery products online at best prices on Amazon.in.,None,<div class="bucket" id="productDescription"> <h2>Product Description</h2> <div class="content"> <h3 class="productDescriptionSource"></h3> <div class="productDescriptionWrapper">        Experience the true blend of classic luxury and quintessentially modern style by adorning this Limited Edition ALPHA MAN Textured Surgical Stainless Steel Silver Bracelet - Unique designer link shape gives this Gent's Bracelet a contemporary and modern feel while retaining the sense of effortless comfort that is the virtue of every ALPHA MAN. - Fashionable Handcuff-style clasp is easy-to-wear and can be adjusted to fit your wrist comfortably. - Apart from your favorite leather belt  those cool chronograph watches and aviator sunglasses  this Limited Edition Classic Stainless Steel Men's Bracelet is the best choice among luxury Men's Fashion Accessories for stylish ALPHA Males. - Perfect gift idea for Women seeking Men's Gift ideas or as the Perfect Birthday Gift for Boyfriend or Gift for Husband or as a Wedding Gift              <div class="emptyClear"> </div> </div> </div> </div>,<div align="left" class="bucket" id="techSpecSoftlinesWrap"><h2>Product Specifications </h2> <div class="content"> <div id="techSpecSoftlines"> <table cellspacing="0"> <tr> <th colspan="2">Jewellery Information</th> </tr> <tr> <td class="td1">Brand</td> <td class="td2">                                             Alpha Man                                         </td> </tr> <tr> <td class="td1">Material</td> <td class="td2">                                             Metal                                         </td> </tr> <tr> <td class="td1">Metal</td> <td class="td2">                                             Stainless Steel                                         </td> </tr> <tr> <td class="td1">Model Number</td> <td class="td2">                                             AM_SLBK_017                                         </td> </tr> </table> </div> </div> </div>,18:03:2014,None
B00HXCRPPG,ALPHA MAN Engraved Golden Silver Symphony Bracelet,http://www.amazon.in/Bangles-Bracelets/b/ref=sd_allcat_fj_bangles/276-6718833-1247838?ie=UTF8&node=2152549031,None,Bangles & Bracelet,Bangles & Bracelet,Alpha Man,http://ecx.images-amazon.com/images/I/41813dPITLL._SL190_CR0 0 190 246_.jpg,Rs. 1 200.00,self Colour,Watches & Fashion Jewellery,http://www.amazon.in/Engraved-Golden-Silver-Symphony-Bracelet/dp/B00HXCRPPG/ref=sr_1_60/275-0905959-1711169?s=jewelry&ie=UTF8&qid=1395127316&sr=1-60,[<a href="/gp/help/seller/at-a-glance.html/275-0905959-1711169?ie=UTF8&amp;seller=A2ICPVIIL9V508">Amaze Lifestyle</a>],Amazon.in: Buy ALPHA MAN Engraved Golden Silver Symphony Bracelet at Low Prices in India | Fashion Jewellery Store,Buy ALPHA MAN Engraved Golden Silver Symphony Bracelet at low prices in India at Amazon.in. Check out ALPHA MAN Engraved Golden Silver Symphony Bracelet reviews  ratings  features  specifications and browse more Fashion Jewellery products online at best prices on Amazon.in.,None,<div class="bucket" id="productDescription"> <h2>Product Description</h2> <div class="content"> <h3 class="productDescriptionSource"></h3> <div class="productDescriptionWrapper">        ALPHA MAN Engraved Golden Silver Symphony Bracelet '- Experience the true blend of classic luxury and quintessentially modern style by adorning this Limited Edition ALPHA MAN Textured Surgical Stainless Steel Dual-tone Gold &amp; Silver Bracelet - Perfect Fashion Accessory for Men who are of distinguished intellect  classic style and believe that Mens Fashion Accessories go beyond the leather belt  sunglasses and watch. - Get into the groove of sporting Exclusive Surgical Stainless Steel Fashion accessories from the primate Menswear and Men's Jewellery brand  ALPHA MAN - Draw the attention of all fashion-savvy and trendy Girls with this stylishly designed Men's bracelet. - Fashionable Handcuff-style clasp is easy-to-wear and can be adjusted to fit your wrist comfortably. - Apart from your favorite leather belt  those cool chronograph watches and aviator sunglasses  this Stainless Steel Men's Gold Bracelet design is unique and sure to mark you as the ALPHA MAN - the predator and the uber-metrosexual and draw the attention of all beautiful Indian women everywhere - This Gent's Bracelet comes in a unique designer link shape that gives it a contemporary and modern feel while retaining the sense of effortless comfort through the use of classic Surgical Stainless Steel materials of the highest quality. - Great addition to your wardrobe which would be the perfect accessory with Denims and Jeans as a neutral coloured Tshirt and can even go well with a open-collar Solid or Striped Formal Shirt or with Formal Suits for those office meetings. - Perfect gift idea for Women seeking Men Gift ideas or as the perfect Birthday Gift for Boyfriend or Gift for Husband or as a Wedding Gift for your Best Friends or even as an Online Gift to send to your Facebook Friend. Size: Free size (One size fits all) Material Used: Surgical Stainless Steel Metal Alloy              <div class="emptyClear"> </div> </div> </div> </div>,<div align="left" class="bucket" id="techSpecSoftlinesWrap"><h2>Product Specifications </h2> <div class="content"> <div id="techSpecSoftlines"> <table cellspacing="0"> <tr> <th colspan="2">Jewellery Information</th> </tr> <tr> <td class="td1">Brand</td> <td class="td2">                                             Alpha Man                                         </td> </tr> <tr> <td class="td1">Material</td> <td class="td2">                                             Metal                                         </td> </tr> <tr> <td class="td1">Model Number</td> <td class="td2">                                             AM_BR_EGSS                                         </td> </tr> </table> </div> </div> </div>,18:03:2014,None
B00HXCRVK0,ALPHA MAN Engraved Luxury Gold and Silver Bracelet,http://www.amazon.in/Bangles-Bracelets/b/ref=sd_allcat_fj_bangles/276-6718833-1247838?ie=UTF8&node=2152549031,None,Bangles & Bracelet,Bangles & Bracelet,Alpha Man,http://ecx.images-amazon.com/images/I/41813dPITLL._SL190_CR0 0 190 246_.jpg,Rs. 1 200.00,self Colour,Watches & Fashion Jewellery,http://www.amazon.in/ALPHA-Engraved-Luxury-Silver-Bracelet/dp/B00HXCRVK0/ref=sr_1_61/275-0905959-1711169?s=jewelry&ie=UTF8&qid=1395127316&sr=1-61,[<a href="/gp/help/seller/at-a-glance.html/275-0905959-1711169?ie=UTF8&amp;seller=A2ICPVIIL9V508">Amaze Lifestyle</a>],Amazon.in: Buy ALPHA MAN Engraved Luxury Gold and Silver Bracelet at Low Prices in India | Fashion Jewellery Store,Buy ALPHA MAN Engraved Luxury Gold and Silver Bracelet at low prices in India at Amazon.in. Check out ALPHA MAN Engraved Luxury Gold and Silver Bracelet reviews  ratings  features  specifications and browse more Fashion Jewellery products online at best prices on Amazon.in.,None,<div class="bucket" id="productDescription"> <h2>Product Description</h2> <div class="content"> <h3 class="productDescriptionSource"></h3> <div class="productDescriptionWrapper">        ALPHA MAN Engraved Luxury Gold and Silver '- Experience the true blend of classic luxury and quintessentially modern style by adorning this Limited Edition ALPHA MAN Textured Surgical Stainless Steel Dual-tone Gold &amp; Silver Bracelet - Perfect Fashion Accessory for Men who are of distinguished intellect  classic style and believe that Mens Fashion Accessories go beyond the leather belt  sunglasses and watch. - Get into the groove of sporting Exclusive Surgical Stainless Steel Fashion accessories from the primate Menswear and Men's Jewellery brand  ALPHA MAN - Draw the attention of all fashion-savvy and trendy Girls with this stylishly designed Men's bracelet. - Fashionable Handcuff-style clasp is easy-to-wear and can be adjusted to fit your wrist comfortably. - Apart from your favorite leather belt  those cool chronograph watches and aviator sunglasses  this Stainless Steel Men's Gold Bracelet design is unique and sure to mark you as the ALPHA MAN - the predator and the uber-metrosexual and draw the attention of all beautiful Indian women everywhere - This Gent's Bracelet comes in a unique designer link shape that gives it a contemporary and modern feel while retaining the sense of effortless comfort through the use of classic Surgical Stainless Steel materials of the highest quality. - Great addition to your wardrobe which would be the perfect accessory with Denims and Jeans as a neutral coloured Tshirt and can even go well with a open-collar Solid or Striped Formal Shirt or with Formal Suits for those office meetings. - Perfect gift idea for Women seeking Men Gift ideas or as the perfect Birthday Gift for Boyfriend or Gift for Husband or as a Wedding Gift for your Best Friends or even as an Online Gift to send to your Facebook Friend. Size: Free size (One size fits all) Material Used: Surgical Stainless Steel Metal Alloy              <div class="emptyClear"> </div> </div> </div> </div>,<div align="left" class="bucket" id="techSpecSoftlinesWrap"><h2>Product Specifications </h2> <div class="content"> <div id="techSpecSoftlines"> <table cellspacing="0"> <tr> <th colspan="2">Jewellery Information</th> </tr> <tr> <td class="td1">Brand</td> <td class="td2">                                             Alpha Man                                         </td> </tr> <tr> <td class="td1">Material</td> <td class="td2">                                             Metal                                         </td> </tr> <tr> <td class="td1">Model Number</td> <td class="td2">                                             AM_BR_ELGS                                         </td> </tr> </table> </div> </div> </div>,18:03:2014,None
B00HXCRTNE,ALPHA MAN Golden Silver Steps of Success Bracelet,http://www.amazon.in/Bangles-Bracelets/b/ref=sd_allcat_fj_bangles/276-6718833-1247838?ie=UTF8&node=2152549031,None,Bangles & Bracelet,Bangles & Bracelet,Alpha Man,http://ecx.images-amazon.com/images/I/41813dPITLL._SL190_CR0 0 190 246_.jpg,Rs. 1 200.00,self Colour,Watches & Fashion Jewellery,http://www.amazon.in/ALPHA-Golden-Silver-Success-Bracelet/dp/B00HXCRTNE/ref=sr_1_63/275-0905959-1711169?s=jewelry&ie=UTF8&qid=1395127316&sr=1-63,[<a href="/gp/help/seller/at-a-glance.html/275-0905959-1711169?ie=UTF8&amp;seller=A2ICPVIIL9V508">Amaze Lifestyle</a>],Amazon.in: Buy ALPHA MAN Golden Silver Steps of Success Bracelet at Low Prices in India | Fashion Jewellery Store,Buy ALPHA MAN Golden Silver Steps of Success Bracelet at low prices in India at Amazon.in. Check out ALPHA MAN Golden Silver Steps of Success Bracelet reviews  ratings  features  specifications and browse more Fashion Jewellery products online at best prices on Amazon.in.,None,<div class="bucket" id="productDescription"> <h2>Product Description</h2> <div class="content"> <h3 class="productDescriptionSource"></h3> <div class="productDescriptionWrapper">        ALPHA MAN Golden Silver Steps of Success Bracelet '- Experience the true blend of classic luxury and quintessentially modern style by adorning this Limited Edition ALPHA MAN Textured Surgical Stainless Steel Dual-tone Gold &amp; Silver Bracelet - Perfect Fashion Accessory for Men who are of distinguished intellect  classic style and believe that Mens Fashion Accessories go beyond the leather belt  sunglasses and watch. - Get into the groove of sporting Exclusive Surgical Stainless Steel Fashion accessories from the primate Menswear and Men's Jewellery brand  ALPHA MAN - Draw the attention of all fashion-savvy and trendy Girls with this stylishly designed Men's bracelet. - Fashionable Handcuff-style clasp is easy-to-wear and can be adjusted to fit your wrist comfortably. - Apart from your favorite leather belt  those cool chronograph watches and aviator sunglasses  this Stainless Steel Men's Gold Bracelet design is unique and sure to mark you as the ALPHA MAN - the predator and the uber-metrosexual and draw the attention of all beautiful Indian women everywhere - This Gent's Bracelet comes in a unique designer link shape that gives it a contemporary and modern feel while retaining the sense of effortless comfort through the use of classic Surgical Stainless Steel materials of the highest quality. - Great addition to your wardrobe which would be the perfect accessory with Denims and Jeans as a neutral coloured Tshirt and can even go well with a open-collar Solid or Striped Formal Shirt or with Formal Suits for those office meetings. - Perfect gift idea for Women seeking Men Gift ideas or as the perfect Birthday Gift for Boyfriend or Gift for Husband or as a Wedding Gift for your Best Friends or even as an Online Gift to send to your Facebook Friend. Size: Free size (One size fits all) Material Used: Surgical Stainless Steel Metal Alloy              <div class="emptyClear"> </div> </div> </div> </div>,<div align="left" class="bucket" id="techSpecSoftlinesWrap"><h2>Product Specifications </h2> <div class="content"> <div id="techSpecSoftlines"> <table cellspacing="0"> <tr> <th colspan="2">Jewellery Information</th> </tr> <tr> <td class="td1">Brand</td> <td class="td2">                                             Alpha Man                                         </td> </tr> <tr> <td class="td1">Material</td> <td class="td2">                                             Metal                                         </td> </tr> <tr> <td class="td1">Model Number</td> <td class="td2">                                             AM_BR_GSSS                                         </td> </tr> </table> </div> </div> </div>,18:03:2014,None
B00ESYVI5U,Alpha Man Faux Leather-Rope Chain Bracelet for Men (AM_SLBK_016),http://www.amazon.in/Bangles-Bracelets/b/ref=sd_allcat_fj_bangles/276-6718833-1247838?ie=UTF8&node=2152549031,None,Bangles & Bracelet,Bangles & Bracelet,Alpha Man,http://ecx.images-amazon.com/images/I/41813dPITLL._SL190_CR0 0 190 246_.jpg,Rs. 1 199.00,self Colour,Watches & Fashion Jewellery,http://www.amazon.in/Alpha-Man-Leather-Rope-Bracelet-AM_SLBK_016/dp/B00ESYVI5U/ref=sr_1_62/275-0905959-1711169?s=jewelry&ie=UTF8&qid=1395127316&sr=1-62,[<a href="/gp/help/seller/at-a-glance.html/275-0905959-1711169?ie=UTF8&amp;isAmazonFulfilled=1&amp;seller=A2ICPVIIL9V508">Amaze Lifestyle</a>  <a href="/gp/help/customer/display.html/275-0905959-1711169?ie=UTF8&amp;nodeId=200953360&amp;ref=dp_fulfillment" id="SSOFpopoverLink"><strong>Fulfilled by Amazon</strong></a>],Amazon.in: Buy Alpha Man Faux Leather-Rope Chain Bracelet for Men (AM_SLBK_016) at Low Prices in India | Fashion Jewellery Store,Buy Alpha Man Faux Leather-Rope Chain Bracelet for Men (AM_SLBK_016) at low prices in India at Amazon.in. Check out Alpha Man Faux Leather-Rope Chain Bracelet for Men (AM_SLBK_016) reviews  ratings  features  specifications and browse more Fashion Jewellery products online at best prices on Amazon.in.,None,<div class="bucket" id="productDescription"> <h2>Product Description</h2> <div class="content"> <h3 class="productDescriptionSource"></h3> <div class="productDescriptionWrapper">        Experience the true blend of classic luxury and quintessentially modern style by adorning this Limited Edition ALPHA MAN Textured Surgical Stainless Steel Silver Bracelet - Unique designer link shape gives this Gent's Bracelet a contemporary and modern feel while retaining the sense of effortless comfort that is the virtue of every ALPHA MAN. - Fashionable Handcuff-style clasp is easy-to-wear and can be adjusted to fit your wrist comfortably. - Apart from your favorite leather belt  those cool chronograph watches and aviator sunglasses  this Limited Edition Classic Stainless Steel Men's Bracelet is the best choice among luxury Men's Fashion Accessories for stylish ALPHA Males. - Perfect gift idea for Women seeking Men's Gift ideas or as the Perfect Birthday Gift for Boyfriend or Gift for Husband or as a Wedding Gift              <div class="emptyClear"> </div> </div> </div> </div>,<div align="left" class="bucket" id="techSpecSoftlinesWrap"><h2>Product Specifications </h2> <div class="content"> <div id="techSpecSoftlines"> <table cellspacing="0"> <tr> <th colspan="2">Jewellery Information</th> </tr> <tr> <td class="td1">Brand</td> <td class="td2">                                             Alpha Man                                         </td> </tr> <tr> <td class="td1">Material</td> <td class="td2">                                             Metal                                         </td> </tr> <tr> <td class="td1">Metal</td> <td class="td2">                                             Stainless Steel                                         </td> </tr> <tr> <td class="td1">Model Number</td> <td class="td2">                                             AM_SLBK_016                                         </td> </tr> </table> </div> </div> </div>,18:03:2014,None
