B00HXCSIU2,ALPHA MAN "Chain Gang Style" Grey Bracelet,http://www.amazon.in/Bangles-Bracelets/b/ref=sd_allcat_fj_bangles/276-6718833-1247838?ie=UTF8&node=2152549031,None,Bangles & Bracelet,Bangles & Bracelet,Alpha Man,http://ecx.images-amazon.com/images/I/41813dPITLL._SL190_CR0 0 190 246_.jpg,Rs. 749.00,self Colour,Watches & Fashion Jewellery,http://www.amazon.in/ALPHA-Chain-Gang-Style-Bracelet/dp/B00HXCSIU2/ref=sr_1_3/275-0905959-1711169?s=jewelry&ie=UTF8&qid=1395127313&sr=1-3,[<a href="/gp/help/seller/at-a-glance.html/275-0905959-1711169?ie=UTF8&amp;seller=A2ICPVIIL9V508">Amaze Lifestyle</a>],Amazon.in: Buy ALPHA MAN "Chain Gang Style" Grey Bracelet at Low Prices in India | Fashion Jewellery Store,Buy ALPHA MAN "Chain Gang Style" Grey Bracelet at low prices in India at Amazon.in. Check out ALPHA MAN "Chain Gang Style" Grey Bracelet reviews  ratings  features  specifications and browse more Fashion Jewellery products online at best prices on Amazon.in.,None,<div class="bucket" id="productDescription"> <h2>Product Description</h2> <div class="content"> <h3 class="productDescriptionSource"></h3> <div class="productDescriptionWrapper">        ALPHA MAN "Chain Gang Style" Grey Bracelet - ALPHA MAN Faux Leather Braod Bracelet is finely crafted and has Silver tone Star shaped studwork with dual button fold - Sublime craftsmanship melds with superior quality materials to deliver a look that is essentially masculine and bespoke with refined class and luxury - Wear this cool fashion accessory with casual wear (jeans and a tee) or even with semi-formal shirts and trousers - Ideal birthday gift or festive season gift for your best friend - Materials used: Faux Leather  Metal Alloy Studs - Size: Free Size              <div class="emptyClear"> </div> </div> </div> </div>,<div align="left" class="bucket" id="techSpecSoftlinesWrap"><h2>Product Specifications </h2> <div class="content"> <div id="techSpecSoftlines"> <table cellspacing="0"> <tr> <th colspan="2">Jewellery Information</th> </tr> <tr> <td class="td1">Brand</td> <td class="td2">                                             Alpha Man                                         </td> </tr> <tr> <td class="td1">Material</td> <td class="td2">                                             leather                                         </td> </tr> <tr> <td class="td1">Model Number</td> <td class="td2">                                             AM_BR_CGSGR                                         </td> </tr> </table> </div> </div> </div>,18:03:2014,None
B00ESYV5C6,Alpha Man Steel Silver Bracelet For Men (AM_BR_SS_014),http://www.amazon.in/Bangles-Bracelets/b/ref=sd_allcat_fj_bangles/276-6718833-1247838?ie=UTF8&node=2152549031,None,Bangles & Bracelet,Bangles & Bracelet,Alpha Man,http://ecx.images-amazon.com/images/I/41813dPITLL._SL190_CR0 0 190 246_.jpg,Rs. 1 349.00,self Colour,Watches & Fashion Jewellery,http://www.amazon.in/Alpha-Man-Silver-Bracelet-AM_BR_SS_014/dp/B00ESYV5C6/ref=sr_1_1/275-0905959-1711169?s=jewelry&ie=UTF8&qid=1395127313&sr=1-1,[<a href="/gp/help/seller/at-a-glance.html/275-0905959-1711169?ie=UTF8&amp;isAmazonFulfilled=1&amp;seller=A2ICPVIIL9V508">Amaze Lifestyle</a>  <a href="/gp/help/customer/display.html/275-0905959-1711169?ie=UTF8&amp;nodeId=200953360&amp;ref=dp_fulfillment" id="SSOFpopoverLink"><strong>Fulfilled by Amazon</strong></a>],Amazon.in: Buy Alpha Man Steel Silver Bracelet For Men (AM_BR_SS_014) at Low Prices in India | Fashion Jewellery Store,Buy Alpha Man Steel Silver Bracelet For Men (AM_BR_SS_014) at low prices in India at Amazon.in. Check out Alpha Man Steel Silver Bracelet For Men (AM_BR_SS_014) reviews  ratings  features  specifications and browse more Fashion Jewellery products online at best prices on Amazon.in.,None,<div class="bucket" id="productDescription"> <h2>Product Description</h2> <div class="content"> <h3 class="productDescriptionSource"></h3> <div class="productDescriptionWrapper">        Experience the true blend of classic luxury and quintessentially modern style by adorning this Limited Edition ALPHA MAN Textured Surgical Stainless Steel Silver Bracelet - Unique designer link shape gives this Gent's Bracelet a contemporary and modern feel while retaining the sense of effortless comfort that is the virtue of every ALPHA MAN. - Fashionable Handcuff-style clasp is easy-to-wear and can be adjusted to fit your wrist comfortably. - Apart from your favorite leather belt  those cool chronograph watches and aviator sunglasses  this Limited Edition Classic Stainless Steel Men's Bracelet is the best choice among luxury Men's Fashion Accessories for stylish ALPHA Males. - Perfect gift idea for Women seeking Men's Gift ideas or as the Perfect Birthday Gift for Boyfriend or Gift for Husband or as a Wedding Gift              <div class="emptyClear"> </div> </div> </div> </div>,<div align="left" class="bucket" id="techSpecSoftlinesWrap"><h2>Product Specifications </h2> <div class="content"> <div id="techSpecSoftlines"> <table cellspacing="0"> <tr> <th colspan="2">Jewellery Information</th> </tr> <tr> <td class="td1">Brand</td> <td class="td2">                                             Alpha Man                                         </td> </tr> <tr> <td class="td1">Material</td> <td class="td2">                                             Metal                                         </td> </tr> <tr> <td class="td1">Metal</td> <td class="td2">                                             Stainless Steel                                         </td> </tr> <tr> <td class="td1">Model Number</td> <td class="td2">                                             AM_BR_SS_014                                         </td> </tr> </table> </div> </div> </div>,18:03:2014,None
B00HXCRB6Y,ALPHA MAN "Man of steel in Black" Bracelet,http://www.amazon.in/Bangles-Bracelets/b/ref=sd_allcat_fj_bangles/276-6718833-1247838?ie=UTF8&node=2152549031,None,Bangles & Bracelet,Bangles & Bracelet,Alpha Man,http://ecx.images-amazon.com/images/I/41813dPITLL._SL190_CR0 0 190 246_.jpg,Rs. 600.00,self Colour,Watches & Fashion Jewellery,http://www.amazon.in/ALPHA-Man-steel-Black-Bracelet/dp/B00HXCRB6Y/ref=sr_1_5/275-0905959-1711169?s=jewelry&ie=UTF8&qid=1395127313&sr=1-5,[<a href="/gp/help/seller/at-a-glance.html/275-0905959-1711169?ie=UTF8&amp;seller=A2ICPVIIL9V508">Amaze Lifestyle</a>],Amazon.in: Buy ALPHA MAN "Man of steel in Black" Bracelet at Low Prices in India | Fashion Jewellery Store,Buy ALPHA MAN "Man of steel in Black" Bracelet at low prices in India at Amazon.in. Check out ALPHA MAN "Man of steel in Black" Bracelet reviews  ratings  features  specifications and browse more Fashion Jewellery products online at best prices on Amazon.in.,None,<div class="bucket" id="productDescription"> <h2>Product Description</h2> <div class="content"> <h3 class="productDescriptionSource"></h3> <div class="productDescriptionWrapper">        ALPHA MAN Men's Fashion Accessories "Man of steel in Black" Strap Faux Leather Bracelet - ANTIFORMAL Cool Broad Faux Leather Bracelet in dual tone is finely crafted and melded with silver tone metalwork - Sublime craftsmanship melds with superior quality materials to deliver a look that is elegant  contemporary and bespoke with luxury. - Wear this cool fashion accessory with casual wear (jeans and a tee or tank top) or even with semi-formal tops and skirts/ trousers - Ideal birthday gift or festive season gift for your best friend - Materials used: Faux Leather  Metal Enhancements - Size: Free Size              <div class="emptyClear"> </div> </div> </div> </div>,<div align="left" class="bucket" id="techSpecSoftlinesWrap"><h2>Product Specifications </h2> <div class="content"> <div id="techSpecSoftlines"> <table cellspacing="0"> <tr> <th colspan="2">Jewellery Information</th> </tr> <tr> <td class="td1">Brand</td> <td class="td2">                                             Alpha Man                                         </td> </tr> <tr> <td class="td1">Material</td> <td class="td2">                                             leather                                         </td> </tr> <tr> <td class="td1">Model Number</td> <td class="td2">                                             AM_BR_MOSBL                                         </td> </tr> </table> </div> </div> </div>,18:03:2014,None
B00HXCSC62,ALPHA MAN "Time is What You Make of it" Precious Time Bracelet,http://www.amazon.in/Bangles-Bracelets/b/ref=sd_allcat_fj_bangles/276-6718833-1247838?ie=UTF8&node=2152549031,None,Bangles & Bracelet,Bangles & Bracelet,Alpha Man,http://ecx.images-amazon.com/images/I/41813dPITLL._SL190_CR0 0 190 246_.jpg,Rs. 719.00,self Colour,Watches & Fashion Jewellery,http://www.amazon.in/ALPHA-Time-What-Precious-Bracelet/dp/B00HXCSC62/ref=sr_1_6/275-0905959-1711169?s=jewelry&ie=UTF8&qid=1395127313&sr=1-6,[<a href="/gp/help/seller/at-a-glance.html/275-0905959-1711169?ie=UTF8&amp;seller=A2ICPVIIL9V508">Amaze Lifestyle</a>],Amazon.in: Buy ALPHA MAN "Time is What You Make of it" Precious Time Bracelet at Low Prices in India | Fashion Jewellery Store,Buy ALPHA MAN "Time is What You Make of it" Precious Time Bracelet at low prices in India at Amazon.in. Check out ALPHA MAN "Time is What You Make of it" Precious Time Bracelet reviews  ratings  features  specifications and browse more Fashion Jewellery products online at best prices on Amazon.in.,None,<div class="bucket" id="productDescription"> <h2>Product Description</h2> <div class="content"> <h3 class="productDescriptionSource"></h3> <div class="productDescriptionWrapper">        -ALPHA MAN "Time is What You Make of it" Precious Time Maroon Thread-Woven Black Bracelet -Classic yet contemporary eye-catching designer White Faux Leather Bracelet with a focus on intricate design to make you stand out in the crowd  as the quintessential Man among the boys. - The perfect gift for Every Guy  be it your Facebook Friend  Best Buddy or Boyfriend or as an item to buy for yourself as a Birthday Gift or even as an Anniversary Gift for your Better Half (Husband or Wife  as the case may be) - This designer Gent's Bracelet comes equipped with Faux Leather Strap with Silver Metal Alloy enhancements studded into the material to ensure a smooth design  textured finish and superior comfort. - Classic Dual Button Clasp provides a comfortable fit while ensuring that the Bracelet stays on your wrist even while working on the laptop or phablet smartphone at Work or during Play. - Essential yet wonderful addition to up your style quotient this Summer without breaking bank. - Would match with almost every piece of clothing attire your own  be it jeans  tshirts  semi-formal or formal solid or stripes shirts or even your formals for a night out on the town Size: Free Size (One Size Fits All) Materials Used: Faux Leather  Metal Alloy Enhancements              <div class="emptyClear"> </div> </div> </div> </div>,<div align="left" class="bucket" id="techSpecSoftlinesWrap"><h2>Product Specifications </h2> <div class="content"> <div id="techSpecSoftlines"> <table cellspacing="0"> <tr> <th colspan="2">Jewellery Information</th> </tr> <tr> <td class="td1">Brand</td> <td class="td2">                                             Alpha Man                                         </td> </tr> <tr> <td class="td1">Material</td> <td class="td2">                                             leather                                         </td> </tr> <tr> <td class="td1">Model Number</td> <td class="td2">                                             AM_LB_TWM                                         </td> </tr> </table> </div> </div> </div>,18:03:2014,None
B00ESYV06C,Alpha Man Textured Prowess Steel Silver Bracelet For Men(AM_BR_SS_003),http://www.amazon.in/Bangles-Bracelets/b/ref=sd_allcat_fj_bangles/276-6718833-1247838?ie=UTF8&node=2152549031,None,Bangles & Bracelet,Bangles & Bracelet,Alpha Man,http://ecx.images-amazon.com/images/I/41813dPITLL._SL190_CR0 0 190 246_.jpg,Rs. 1 349.00,self Colour,Watches & Fashion Jewellery,http://www.amazon.in/Alpha-Man-Textured-Bracelet-AM_BR_SS_003/dp/B00ESYV06C/ref=sr_1_8/275-0905959-1711169?s=jewelry&ie=UTF8&qid=1395127313&sr=1-8,[<a href="/gp/help/seller/at-a-glance.html/275-0905959-1711169?ie=UTF8&amp;isAmazonFulfilled=1&amp;seller=A2ICPVIIL9V508">Amaze Lifestyle</a>  <a href="/gp/help/customer/display.html/275-0905959-1711169?ie=UTF8&amp;nodeId=200953360&amp;ref=dp_fulfillment" id="SSOFpopoverLink"><strong>Fulfilled by Amazon</strong></a>],Amazon.in: Buy Alpha Man Textured Prowess Steel Silver Bracelet For Men(AM_BR_SS_003) at Low Prices in India | Fashion Jewellery Store,Buy Alpha Man Textured Prowess Steel Silver Bracelet For Men(AM_BR_SS_003) at low prices in India at Amazon.in. Check out Alpha Man Textured Prowess Steel Silver Bracelet For Men(AM_BR_SS_003) reviews  ratings  features  specifications and browse more Fashion Jewellery products online at best prices on Amazon.in.,None,<div class="bucket" id="productDescription"> <h2>Product Description</h2> <div class="content"> <h3 class="productDescriptionSource"></h3> <div class="productDescriptionWrapper">        Experience the true blend of classic luxury and quintessentially modern style by adorning this Limited Edition ALPHA MAN Textured Surgical Stainless Steel Silver Bracelet - Unique designer link shape gives this Gent's Bracelet a contemporary and modern feel while retaining the sense of effortless comfort that is the virtue of every ALPHA MAN. - Fashionable Handcuff-style clasp is easy-to-wear and can be adjusted to fit your wrist comfortably. - Apart from your favorite leather belt  those cool chronograph watches and aviator sunglasses  this Limited Edition Classic Stainless Steel Men's Bracelet is the best choice among luxury Men's Fashion Accessories for stylish ALPHA Males. - Perfect gift idea for Women seeking Men's Gift ideas or as the Perfect Birthday Gift for Boyfriend or Gift for Husband or as a Wedding Gift              <div class="emptyClear"> </div> </div> </div> </div>,<div align="left" class="bucket" id="techSpecSoftlinesWrap"><h2>Product Specifications </h2> <div class="content"> <div id="techSpecSoftlines"> <table cellspacing="0"> <tr> <th colspan="2">Jewellery Information</th> </tr> <tr> <td class="td1">Brand</td> <td class="td2">                                             Alpha Man                                         </td> </tr> <tr> <td class="td1">Material</td> <td class="td2">                                             Metal                                         </td> </tr> <tr> <td class="td1">Metal</td> <td class="td2">                                             Stainless Steel                                         </td> </tr> <tr> <td class="td1">Model Number</td> <td class="td2">                                             AM_BR_SS_003                                         </td> </tr> </table> </div> </div> </div>,18:03:2014,None
B00HXCRCEK,ALPHA MAN "Rockstar Style white " Bracelet,http://www.amazon.in/Bangles-Bracelets/b/ref=sd_allcat_fj_bangles/276-6718833-1247838?ie=UTF8&node=2152549031,None,Bangles & Bracelet,Bangles & Bracelet,Alpha Man,http://ecx.images-amazon.com/images/I/41813dPITLL._SL190_CR0 0 190 246_.jpg,Rs. 700.00,self Colour,Watches & Fashion Jewellery,http://www.amazon.in/ALPHA-Rockstar-Style-white-Bracelet/dp/B00HXCRCEK/ref=sr_1_4/275-0905959-1711169?s=jewelry&ie=UTF8&qid=1395127313&sr=1-4,[<a href="/gp/help/seller/at-a-glance.html/277-2550481-8871765?ie=UTF8&amp;seller=A2ICPVIIL9V508">Amaze Lifestyle</a>],Amazon.in: Buy ALPHA MAN "Rockstar Style white " Bracelet at Low Prices in India | Fashion Jewellery Store,Buy ALPHA MAN "Rockstar Style white " Bracelet at low prices in India at Amazon.in. Check out ALPHA MAN "Rockstar Style white " Bracelet reviews  ratings  features  specifications and browse more Fashion Jewellery products online at best prices on Amazon.in.,None,<div class="bucket" id="productDescription"> <h2>Product Description</h2> <div class="content"> <h3 class="productDescriptionSource"></h3> <div class="productDescriptionWrapper">        ALPHA MAN Men's Fashion Accessories "Rockstar Style white " Strap Faux Leather Bracelet - ALPHA MAN Faux Leather Bracelet is finely crafted and has reinforced Silver tone studwork on the edges with classic belt-clip pierced lock - Sublime craftsmanship melds with superior quality materials to deliver a look that is essentially masculine and bespoke with refined class and luxury - Wear this cool fashion accessory with casual wear (jeans and a tee) or even with semi-formal shirts and trousers - Ideal birthday gift or festive season gift for your best friend - Materials used: Faux Leather  Metal Alloy Studs - Size: Free Size              <div class="emptyClear"> </div> </div> </div> </div>,<div align="left" class="bucket" id="techSpecSoftlinesWrap"><h2>Product Specifications </h2> <div class="content"> <div id="techSpecSoftlines"> <table cellspacing="0"> <tr> <th colspan="2">Jewellery Information</th> </tr> <tr> <td class="td1">Brand</td> <td class="td2">                                             Alpha Man                                         </td> </tr> <tr> <td class="td1">Material</td> <td class="td2">                                             leather                                         </td> </tr> <tr> <td class="td1">Model Number</td> <td class="td2">                                             AM_BR_RSWH                                         </td> </tr> </table> </div> </div> </div>,18:03:2014,None
B00ESYVOHW,Alpha Man Silicone Bracelet For Men (AM_SLBK_041),http://www.amazon.in/Bangles-Bracelets/b/ref=sd_allcat_fj_bangles/276-6718833-1247838?ie=UTF8&node=2152549031,None,Bangles & Bracelet,Bangles & Bracelet,Alpha Man,http://ecx.images-amazon.com/images/I/41813dPITLL._SL190_CR0 0 190 246_.jpg,Rs. 1 199.00,self Colour,Watches & Fashion Jewellery,http://www.amazon.in/Alpha-Man-Silicone-Bracelet-AM_SLBK_041/dp/B00ESYVOHW/ref=sr_1_10/275-0905959-1711169?s=jewelry&ie=UTF8&qid=1395127313&sr=1-10,[<a href="/gp/help/seller/at-a-glance.html/275-0905959-1711169?ie=UTF8&amp;isAmazonFulfilled=1&amp;seller=A2ICPVIIL9V508">Amaze Lifestyle</a>  <a href="/gp/help/customer/display.html/275-0905959-1711169?ie=UTF8&amp;nodeId=200953360&amp;ref=dp_fulfillment" id="SSOFpopoverLink"><strong>Fulfilled by Amazon</strong></a>],Amazon.in: Buy Alpha Man Silicone Bracelet For Men (AM_SLBK_041) at Low Prices in India | Fashion Jewellery Store,Buy Alpha Man Silicone Bracelet For Men (AM_SLBK_041) at low prices in India at Amazon.in. Check out Alpha Man Silicone Bracelet For Men (AM_SLBK_041) reviews  ratings  features  specifications and browse more Fashion Jewellery products online at best prices on Amazon.in.,None,<div class="bucket" id="productDescription"> <h2>Product Description</h2> <div class="content"> <h3 class="productDescriptionSource"></h3> <div class="productDescriptionWrapper">        Experience the true blend of classic luxury and quintessentially modern style by adorning this Limited Edition ALPHA MAN Textured Surgical Stainless Steel Silver Bracelet - Unique designer link shape gives this Gent's Bracelet a contemporary and modern feel while retaining the sense of effortless comfort that is the virtue of every ALPHA MAN. - Fashionable Handcuff-style clasp is easy-to-wear and can be adjusted to fit your wrist comfortably. - Apart from your favorite leather belt  those cool chronograph watches and aviator sunglasses  this Limited Edition Classic Stainless Steel Men's Bracelet is the best choice among luxury Men's Fashion Accessories for stylish ALPHA Males. - Perfect gift idea for Women seeking Men's Gift ideas or as the Perfect Birthday Gift for Boyfriend or Gift for Husband or as a Wedding Gift              <div class="emptyClear"> </div> </div> </div> </div>,<div align="left" class="bucket" id="techSpecSoftlinesWrap"><h2>Product Specifications </h2> <div class="content"> <div id="techSpecSoftlines"> <table cellspacing="0"> <tr> <th colspan="2">Jewellery Information</th> </tr> <tr> <td class="td1">Brand</td> <td class="td2">                                             Alpha Man                                         </td> </tr> <tr> <td class="td1">Material</td> <td class="td2">                                             Metal                                         </td> </tr> <tr> <td class="td1">Metal</td> <td class="td2">                                             Stainless Steel                                         </td> </tr> <tr> <td class="td1">Model Number</td> <td class="td2">                                             AM_SLBK_041                                         </td> </tr> </table> </div> </div> </div>,18:03:2014,None
B00ESYV2WO,Alpha Man Abstract Art Steel Silver Bracelet For Men(AM_BR_SS_009),http://www.amazon.in/Bangles-Bracelets/b/ref=sd_allcat_fj_bangles/276-6718833-1247838?ie=UTF8&node=2152549031,None,Bangles & Bracelet,Bangles & Bracelet,Alpha Man,http://ecx.images-amazon.com/images/I/41813dPITLL._SL190_CR0 0 190 246_.jpg,Rs. 1 349.00,self Colour,Watches & Fashion Jewellery,http://www.amazon.in/Alpha-Man-Abstract-Bracelet-AM_BR_SS_009/dp/B00ESYV2WO/ref=sr_1_7/275-0905959-1711169?s=jewelry&ie=UTF8&qid=1395127313&sr=1-7,[<a href="/gp/help/seller/at-a-glance.html/275-0905959-1711169?ie=UTF8&amp;isAmazonFulfilled=1&amp;seller=A2ICPVIIL9V508">Amaze Lifestyle</a>  <a href="/gp/help/customer/display.html/275-0905959-1711169?ie=UTF8&amp;nodeId=200953360&amp;ref=dp_fulfillment" id="SSOFpopoverLink"><strong>Fulfilled by Amazon</strong></a>],Amazon.in: Buy Alpha Man Abstract Art Steel Silver Bracelet For Men(AM_BR_SS_009) at Low Prices in India | Fashion Jewellery Store,Buy Alpha Man Abstract Art Steel Silver Bracelet For Men(AM_BR_SS_009) at low prices in India at Amazon.in. Check out Alpha Man Abstract Art Steel Silver Bracelet For Men(AM_BR_SS_009) reviews  ratings  features  specifications and browse more Fashion Jewellery products online at best prices on Amazon.in.,None,<div class="bucket" id="productDescription"> <h2>Product Description</h2> <div class="content"> <h3 class="productDescriptionSource"></h3> <div class="productDescriptionWrapper">        Experience the true blend of classic luxury and quintessentially modern style by adorning this Limited Edition ALPHA MAN Textured Surgical Stainless Steel Silver Bracelet - Unique designer link shape gives this Gent's Bracelet a contemporary and modern feel while retaining the sense of effortless comfort that is the virtue of every ALPHA MAN. - Fashionable Handcuff-style clasp is easy-to-wear and can be adjusted to fit your wrist comfortably. - Apart from your favorite leather belt  those cool chronograph watches and aviator sunglasses  this Limited Edition Classic Stainless Steel Men's Bracelet is the best choice among luxury Men's Fashion Accessories for stylish ALPHA Males. - Perfect gift idea for Women seeking Men's Gift ideas or as the Perfect Birthday Gift for Boyfriend or Gift for Husband or as a Wedding Gift              <div class="emptyClear"> </div> </div> </div> </div>,<div align="left" class="bucket" id="techSpecSoftlinesWrap"><h2>Product Specifications </h2> <div class="content"> <div id="techSpecSoftlines"> <table cellspacing="0"> <tr> <th colspan="2">Jewellery Information</th> </tr> <tr> <td class="td1">Brand</td> <td class="td2">                                             Alpha Man                                         </td> </tr> <tr> <td class="td1">Material</td> <td class="td2">                                             Metal                                         </td> </tr> <tr> <td class="td1">Metal</td> <td class="td2">                                             Stainless Steel                                         </td> </tr> <tr> <td class="td1">Model Number</td> <td class="td2">                                             AM_BR_SS_009                                         </td> </tr> </table> </div> </div> </div>,18:03:2014,None
