63226_c-103,lavanya saree-1610-b,http://www.bagittoday.com/apparel/c-36/,r1014/-,Apparel,Sarees,lavanya,http://images.bagittoday.com/0/images/product/63226/LAVANYA_SAREE-1610-B_225X225_00_0.jpg,r 1999/-,None,Women,http://www.bagittoday.com/lavanya-saree-1610-b/pr-63226_c-103/,bagittoday.com,Lavanya Saree-1610-b | Buy Online India,Buy original Lavanya Saree-1610-b at best price in India. Read its features  reviews and specifications. Get fast & assured delivery all over India.,[],<div class="tabs-content">                  <p>Lavanya Multicolour Printed Saree: 1610-B:<br>Spread the beauty of flowers with this stylishly designed saree from Lavanya. Made of light weight material  this multicoloured saree features pretty floral prints all over the body that adds to its feminine appeal. Further  the thin border perfectly complements the design of this saree and completes its look. Drape this saree from Lavanya with a short-sleeved blouse and accessorise with a pair of dangle earrings to get that gorgeous look. </p>                            </div>,None,1203i2014,None
63221_c-103,lavanya saree-1587,http://www.bagittoday.com/apparel/c-36/,r1999/-,Apparel,Sarees,lavanya,http://images.bagittoday.com/0/images/product/63221/LAVANYA_SAREE-1587_225X225_00_0.jpg,,None,Women,http://www.bagittoday.com/lavanya-saree-1587/pr-63221_c-103/,bagittoday.com,Lavanya Saree-1587 | Buy Online India,Buy original Lavanya Saree-1587 at best price in India. Read its features  reviews and specifications. Get fast & assured delivery all over India.,[],<div class="tabs-content">                  <p>Lavanya Multicolour Saree: 1587:<br>Add to your party wear collection with this exquisitely designed saree from Lavanya. This multicoloured saree is made of comfortable fabric and boasts of circular pattern on its body. What makes this saree stylish are the motifs and broad border that beautifully complement its body design. The net pallu with a big  beautiful patch work lend this saree a distinct and classy look. So  be the centre of attraction by draping this saree from Lavanya with a short-sleeved blouse and get oodles of compliments. </p>                            </div>,None,1203i2014,None
63229_c-103,lavanya saree-1624,http://www.bagittoday.com/apparel/c-36/,r1999/-,Apparel,Sarees,lavanya,http://images.bagittoday.com/0/images/product/63229/LAVANYA_SAREE-1624_225X225_00_0.jpg,,None,Women,http://www.bagittoday.com/lavanya-saree-1624/pr-63229_c-103/,bagittoday.com,Lavanya Saree-1624 | Buy Online India,Buy original Lavanya Saree-1624 at best price in India. Read its features  reviews and specifications. Get fast & assured delivery all over India.,[],<div class="tabs-content">                  <p>Lavanya Multicoloured Party Wear Saree: 1624:<br>Your brother's wedding is round-the-corner and you are wondering what to wear. Check out this saree from Lavanya that is a perfect melange of comfort and style. This multicoloured saree features circular pattern in self along with bog motifs that add to its design. The broad border and netted pallu with exquisite patch work on it complete the design of this saree on a gorgeous note. Wear this saree with its matching blouse to get that stunning look.</p>                            </div>,None,1203i2014,None
63225_c-103,lavanya saree-1607,http://www.bagittoday.com/apparel/c-36/,r1999/-,Apparel,Sarees,lavanya,http://images.bagittoday.com/0/images/product/63225/LAVANYA_SAREE-1607_225X225_00_0.jpg,,None,Women,http://www.bagittoday.com/lavanya-saree-1607/pr-63225_c-103/,bagittoday.com,Lavanya Saree-1607 | Buy Online India,Buy original Lavanya Saree-1607 at best price in India. Read its features  reviews and specifications. Get fast & assured delivery all over India.,[],<div class="tabs-content">                  <p>Lavanya Multicoloured Stylish Party Wear Saree: 1607:<br>Complete your look on a stunning note by draping this saree from Lavanya  a famous apparel brand. This saree from the brand is a melange of style and comfort that makes it a perfect pick for a party wear. The purple body of this saree is made of soft material that boasts of leafy design in self-pattern. Making this saree stylish is its green net pallu that features patch work in floral and curvy formations. So  wear this saree with a halter neck blouse to get that picture perfect look. </p>                            </div>,None,1203i2014,None
63220_c-103,lavanya saree-1586,http://www.bagittoday.com/apparel/c-36/,r1999/-,Apparel,Sarees,lavanya,http://images.bagittoday.com/0/images/product/63220/LAVANYA_SAREE-1586_225X225_00_0.jpg,,None,Women,http://www.bagittoday.com/lavanya-saree-1586/pr-63220_c-103/,bagittoday.com,Lavanya Saree-1586 | Buy Online India,Buy original Lavanya Saree-1586 at best price in India. Read its features  reviews and specifications. Get fast & assured delivery all over India.,[],<div class="tabs-content">                  <p>Lavanya Red and Green Saree: 1586:<br>Look glamorous in your upcoming family function by draping this exquisitely designed saree from Lavanya. This stylish saree features paisley pattern on its body and boasts of multicoloured border that complete its design on an elegant note. What makes this saree distinct from others is its green net pallu that is beautified with small motifs and broads classic border. Wear this saree from Lavanya with a halter neck blouse and accessorise it with dangle earrings to get that stunning look.</p>                            </div>,None,1203i2014,None
63228_c-103,lavanya saree-1615,http://www.bagittoday.com/apparel/c-36/,r1999/-,Apparel,Sarees,lavanya,http://images.bagittoday.com/0/images/product/63228/LAVANYA_SAREE-1615_225X225_00_0.jpg,,None,Women,http://www.bagittoday.com/lavanya-saree-1615/pr-63228_c-103/,bagittoday.com,Lavanya Saree-1615 | Buy Online India,Buy original Lavanya Saree-1615 at best price in India. Read its features  reviews and specifications. Get fast & assured delivery all over India.,[],<div class="tabs-content">                  <p>Lavanya Multicolour Lehenga Saree: 1615:<br>Stun everyone with your gorgeous look by wearing this lehenga style saree from Lavanya. The saree is made of a combination of net and soft material that makes it light weight and comfortable to wear. Adding to the design of this saree are the small motifs  multicoloured border and beautiful pallu that complete its look on a stylish note. Drape this saree from Lavanya in your cousin's marriage and team it up with a sleeveless blouse for that gorgeous look.</p>                            </div>,None,1203i2014,None
63223_c-103,lavanya saree-1590,http://www.bagittoday.com/apparel/c-36/,r1999/-,Apparel,Sarees,lavanya,http://images.bagittoday.com/0/images/product/63223/LAVANYA_SAREE-1590_225X225_00_0.jpg,,None,Women,http://www.bagittoday.com/lavanya-saree-1590/pr-63223_c-103/,bagittoday.com,Lavanya Saree-1590 | Buy Online India,Buy original Lavanya Saree-1590 at best price in India. Read its features  reviews and specifications. Get fast & assured delivery all over India.,[],<div class="tabs-content">                  <p>Lavanya Multicolour Stylish Saree - 1590:<br>Add to your beautiful look by draping this saree  which is presented to you by Lavanya. With printed design in floral and leafy patterns  this multicoloured saree exude simplicity and style. The blue border with golden polka dots on it adds to the design and completes its look on an elegant note. This saree from the house of Lavanya will look great if paired with sleeveless blouse that will surely speak about your smart sense of style. </p>                            </div>,None,1203i2014,None
