61040_c-2135,id kids shoes-idk0011 navy yellow,http://www.bagittoday.com/boys/c-2134/,r589/-,Boys,Footwear,private,http://images.bagittoday.com/0/images/product/61040/ID_KIDS_SHOES-IDK0011_225X225_00_0.jpg,r 745/-,NAVY YELLOW,Kids,http://www.bagittoday.com/id-kids-shoes-idk0011-navy-yellow/pr-61040_c-2135/,bagittoday.com,Id Kids Shoes-idk0011 Navy Yellow | Buy Online India,Buy original Id Kids Shoes-idk0011 Navy Yellow at best price in India. Read its features  reviews and specifications. Get fast & assured delivery all over India.,[''  'aV_1_2'  'NAVY YELLOW'],<div class="tabs-content">                  <p>ID Kids Blue and Black Shoes - IDK0011:<br>Fashionable and stylish  these blue and black shoes from ID will find a liking among young kids. This pair of shoes comprises a durable upper that is highlighted with yellow stitching. As these shoes come with velcro straps and cushioned inners  your child would have convenience and comfort in wearing them. For better traction while walking and running  these shoes come with textured tough soles. Gift these cool ID shoes to your kid on his birthday.</p>                            </div>,None,1203i2014,None
61038_c-2135,id kids shoes-idk0001 navy-silver,http://www.bagittoday.com/boys/c-2134/,r589/-,Boys,Footwear,private,http://images.bagittoday.com/0/images/product/61038/ID_KIDS_SHOES-IDK0001_NAVY-SILVER_225X225_00_0.jpg,r 745/-,NAVY SILVER,Kids,http://www.bagittoday.com/id-kids-shoes-idk0001-navy-silver/pr-61038_c-2135/,bagittoday.com,Id Kids Shoes-idk0001 Navy-silver | Buy Online India,Buy original Id Kids Shoes-idk0001 Navy-silver at best price in India. Read its features  reviews and specifications. Get fast & assured delivery all over India.,[''  'aV_1_4'  'NAVY SILVER'],<div class="tabs-content">                  <p>ID Kids Black and Grey Shoes - IDK0001:<br>Designed for the smart little kids  these black and grey sports shoes from ID are something that your kid would love to wear. These shoes boast of durable uppers  cushioned inners and velcro closures  which altogether ensure comfort and convenience to the child. The outsoles of these shoes are skid-resistant  lightweight and durable. Get these smart ID shoes for your child and make him wear it with a pair of denims.</p>                            </div>,None,1203i2014,None
61037_c-2135,id kids shoes-idk0001 black-silver,http://www.bagittoday.com/boys/c-2134/,r549/-,Boys,Footwear,private,http://images.bagittoday.com/0/images/product/61037/ID_KIDS_SHOES-IDK0001_BLACK-SILVER_SIZE-29_200X200_00_0.jpg,r 745/-,BLACK SILVER,Kids,http://www.bagittoday.com/id-kids-shoes-idk0001-black-silver/pr-61037_c-2135/,bagittoday.com,Id Kids Shoes-idk0001 Black-silver | Buy Online India,Buy original Id Kids Shoes-idk0001 Black-silver at best price in India. Read its features  reviews and specifications. Get fast & assured delivery all over India.,[''  'aV_1_4'  'BLACK SILVER'],<div class="tabs-content">                  <p>ID KIDS SHOES-IDK0001 BLACK_SILVER SIZE-29</p><div><br></div><div><table class='"MsoNormalTable"' border='"0"' cellspacing='"0"' cellpadding='"0"' width='"438"' style='"width:328.25pt;margin-left:4.65pt;border-collapse:collapse;mso-yfti-tbllook:'><tbody><tr style='"mso-yfti-irow:0;mso-yfti-firstrow:yes;height:15.0pt"'><td width='"438"' nowrap colspan='"8"' valign='"bottom"' style='"width:' border: solid windowtext padding: height:>    <p class='"MsoNormal"' align='"center"' style='"margin-bottom:' text-align: center><span style='"mso-ascii-font-family:' calibri new roman mso-bidi-font-family:>KIDS<p></p></span></p>    </td>   </tr><tr style='"mso-yfti-irow:1;height:15.0pt"'><td width='"87"' nowrap valign='"bottom"' style='"width:' border-style: none solid border-right-color: windowtext border-bottom-color: border-left-color: border-right-width: border-bottom-width: border-left-width: padding: height:>    <p class='"MsoNormal"' style='"margin-bottom:'><span style='"mso-ascii-font-family:Calibri;mso-fareast-font-family:' new roman color:black>European Size<p></p></span></p>    </td>    <td width='"29"' nowrap valign='"bottom"' style='"width:' border-style: none solid border-bottom-color: windowtext border-bottom-width: border-right-color: border-right-width: padding: height:>    <p class='"MsoNormal"' align='"right"' style='"margin-bottom:' text-align: right><span style='"mso-ascii-font-family:Calibri;' mso-fareast-font-family: new roman mso-bidi-font-family:>28<p></p></span></p>    </td>    <td width='"55"' nowrap valign='"bottom"' style='"width:' border-style: none solid border-bottom-color: windowtext border-bottom-width: border-right-color: border-right-width: padding: height:>    <p class='"MsoNormal"' align='"right"' style='"margin-bottom:' text-align: right><span style='"mso-ascii-font-family:Calibri;' mso-fareast-font-family: new roman mso-bidi-font-family:>29<p></p></span></p>    </td>    <td width='"57"' nowrap valign='"bottom"' style='"width:' border-style: none solid border-bottom-color: windowtext border-bottom-width: border-right-color: border-right-width: padding: height:>    <p class='"MsoNormal"' align='"right"' style='"margin-bottom:' text-align: right><span style='"mso-ascii-font-family:Calibri;' mso-fareast-font-family: new roman mso-bidi-font-family:>30<p></p></span></p>    </td>    <td width='"76"' nowrap valign='"bottom"' style='"width:' border-style: none solid border-bottom-color: windowtext border-bottom-width: border-right-color: border-right-width: padding: height:>    <p class='"MsoNormal"' align='"right"' style='"margin-bottom:' text-align: right><span style='"mso-ascii-font-family:Calibri;' mso-fareast-font-family: new roman mso-bidi-font-family:>31<p></p></span></p>    </td>    <td width='"76"' nowrap valign='"bottom"' style='"width:' border-style: none solid border-bottom-color: windowtext border-bottom-width: border-right-color: border-right-width: padding: height:>    <p class='"MsoNormal"' align='"right"' style='"margin-bottom:' text-align: right><span style='"mso-ascii-font-family:Calibri;' mso-fareast-font-family: new roman mso-bidi-font-family:>32<p></p></span></p>    </td>    <td width='"38"' nowrap valign='"bottom"' style='"width:' border-style: none solid border-bottom-color: windowtext border-bottom-width: border-right-color: border-right-width: padding: height:>    <p class='"MsoNormal"' align='"right"' style='"margin-bottom:' text-align: right><span style='"mso-ascii-font-family:Calibri;' mso-fareast-font-family: new roman mso-bidi-font-family:>33<p></p></span></p>    </td>    <td width='"21"' nowrap valign='"bottom"' style='"width:' border-style: none solid border-bottom-color: windowtext border-bottom-width: border-right-color: border-right-width: padding: height:>    <p class='"MsoNormal"' align='"right"' style='"margin-bottom:' text-align: right><span style='"mso-ascii-font-family:Calibri;' mso-fareast-font-family: new roman mso-bidi-font-family:>34<p></p></span></p>    </td>   </tr><tr style='"mso-yfti-irow:2;mso-yfti-lastrow:yes;height:15.0pt"'><td width='"87"' nowrap valign='"bottom"' style='"width:' border-style: none solid border-right-color: windowtext border-bottom-color: border-left-color: border-right-width: border-bottom-width: border-left-width: padding: height:>    <p class='"MsoNormal"' style='"margin-bottom:'><span style='"mso-ascii-font-family:Calibri;mso-fareast-font-family:' new roman color:black>UK size<p></p></span></p>    </td>    <td width='"29"' nowrap valign='"bottom"' style='"width:' border-style: none solid border-bottom-color: windowtext border-bottom-width: border-right-color: border-right-width: padding: height:>    <p class='"MsoNormal"' align='"right"' style='"margin-bottom:' text-align: right><span style='"mso-ascii-font-family:Calibri;' mso-fareast-font-family: new roman mso-bidi-font-family:>10<p></p></span></p>    </td>    <td width='"55"' nowrap valign='"bottom"' style='"width:' border-style: none solid border-bottom-color: windowtext border-bottom-width: border-right-color: border-right-width: padding: height:>    <p class='"MsoNormal"' align='"right"' style='"margin-bottom:' text-align: right><span style='"mso-ascii-font-family:Calibri;' mso-fareast-font-family: new roman mso-bidi-font-family:>10    1/2<p></p></span></p>    </td>    <td width='"57"' nowrap valign='"bottom"' style='"width:' border-style: none solid border-bottom-color: windowtext border-bottom-width: border-right-color: border-right-width: padding: height:>    <p class='"MsoNormal"' align='"right"' style='"margin-bottom:' text-align: right><span style='"mso-ascii-font-family:Calibri;' mso-fareast-font-family: new roman mso-bidi-font-family:>11    1/2<p></p></span></p>    </td>    <td width='"76"' nowrap valign='"bottom"' style='"width:' border-style: none solid border-bottom-color: windowtext border-bottom-width: border-right-color: border-right-width: padding: height:>    <p class='"MsoNormal"' style='"margin-bottom:'><span style='"mso-ascii-font-family:Calibri;mso-fareast-font-family:' new roman color:black>12  12 1/2<p></p></span></p>    </td>    <td width='"76"' nowrap valign='"bottom"' style='"width:' border-style: none solid border-bottom-color: windowtext border-bottom-width: border-right-color: border-right-width: padding: height:>    <p class='"MsoNormal"' style='"margin-bottom:'><span style='"mso-ascii-font-family:Calibri;mso-fareast-font-family:' new roman color:black>13  13 1/2<p></p></span></p>    </td>    <td width='"38"' nowrap valign='"bottom"' style='"width:' border-style: none solid border-bottom-color: windowtext border-bottom-width: border-right-color: border-right-width: padding: height:>    <p class='"MsoNormal"' align='"right"' style='"margin-bottom:' text-align: right><span style='"mso-ascii-font-family:Calibri;' mso-fareast-font-family: new roman mso-bidi-font-family:>1<p></p></span></p>    </td>    <td width='"21"' nowrap valign='"bottom"' style='"width:' border-style: none solid border-bottom-color: windowtext border-bottom-width: border-right-color: border-right-width: padding: height:>    <p class='"MsoNormal"' align='"right"' style='"margin-bottom:' text-align: right><span style='"mso-ascii-font-family:Calibri;' mso-fareast-font-family: new roman mso-bidi-font-family:>2<p></p></span></p>    </td>   </tr></tbody></table></div>                            </div>,None,1203i2014,None
61031_c-2135,id kids sandal-idk0008 khaki,http://www.bagittoday.com/boys/c-2134/,r464/-,Boys,Footwear,private,http://images.bagittoday.com/0/images/product/61031/ID_KIDS_SANDAL-IDK0008_KHAKI_OR_SIZE-28_225X225_00_0.jpg,r 645/-,BROWN,Kids,http://www.bagittoday.com/id-kids-sandal-idk0008-khaki/pr-61031_c-2135/,bagittoday.com,Id Kids Sandal-idk0008 Khaki | Buy Online India,Buy original Id Kids Sandal-idk0008 Khaki at best price in India. Read its features  reviews and specifications. Get fast & assured delivery all over India.,[''  'aV_1_4'  'BROWN'],<div class="tabs-content">                  <p>ID Kids Khaki and Orange Sandals - IDK0008 KHAKI_OR:<br>ID brings these khaki and orange sandals for young kids who would love to wear them. These sandals have cushioned footbeds that make it comfortable to wear and without the worry of straining the feet. The velcro straps of these sandals can be adjusted for a snug fit. The finely-textured outsoles of these sandals offer  better grip while walking  running and playing. Go for these ID sandals for your kid today!</p>                            </div>,None,1203i2014,None
61039_c-2135,id kids shoes-idk0002 navy yellow,http://www.bagittoday.com/boys/c-2134/,r589/-,Boys,Footwear,private,http://images.bagittoday.com/0/images/product/61039/ID_KIDS_SHOES-IDK0002_225X225_00_0.jpg,r 745/-,NAVY YELLOW,Kids,http://www.bagittoday.com/id-kids-shoes-idk0002-navy-yellow/pr-61039_c-2135/,bagittoday.com,Id Kids Shoes-idk0002 Navy Yellow | Buy Online India,Buy original Id Kids Shoes-idk0002 Navy Yellow at best price in India. Read its features  reviews and specifications. Get fast & assured delivery all over India.,[''  'aV_1_2'  'NAVY YELLOW'],<div class="tabs-content">                  <p>ID Kids Navy Blue and Yellow Shoes - IDK0002:<br>ID presents these navy blue and yellow shoes that would be loved by your kid. These shoes have mesh linings on the uppers and soft cushioned insoles  which provide breathability to the feet and ensure that they remain strain-free. The textured outsoles of these shoes are lightweight  durable and skid-resistant. These shoes can be teamed with a pair of blue shorts and casual white tee. Get this pair of shoes from ID for your child today!</p>                            </div>,None,1203i2014,None
61061_c-2135,id kids sandal-idk0007 red,http://www.bagittoday.com/boys/c-2134/,r499/-,Boys,Footwear,private,http://images.bagittoday.com/0/images/product/61061/ID_KIDS_SANDAL-IDK0007_900X900_00_0.jpg,r 645/-,RED,Kids,http://www.bagittoday.com/id-kids-sandal-idk0007-red/pr-61061_c-2135/,bagittoday.com,Id Kids Sandal-idk0007 Red | Buy Online India,Buy original Id Kids Sandal-idk0007 Red at best price in India. Read its features  reviews and specifications. Get fast & assured delivery all over India.,[''  'aV_1_0'  'RED'],<div class="tabs-content">                  <p>ID KIDS SANDAL-IDK0007 <br></p><div><br></div><div><table class='"MsoNormalTable"' border='"0"' cellspacing='"0"' cellpadding='"0"' width='"438"' style='"width:328.25pt;margin-left:4.65pt;border-collapse:collapse;mso-yfti-tbllook:'><tbody><tr style='"mso-yfti-irow:0;mso-yfti-firstrow:yes;height:15.0pt"'><td width='"438"' nowrap colspan='"8"' valign='"bottom"' style='"width:' border: solid windowtext padding: height:>    <p class='"MsoNormal"' align='"center"' style='"margin-bottom:' text-align: center><span style='"mso-ascii-font-family:' calibri new roman mso-bidi-font-family:>KIDS<p></p></span></p>    </td>   </tr><tr style='"mso-yfti-irow:1;height:15.0pt"'><td width='"87"' nowrap valign='"bottom"' style='"width:' border-style: none solid border-right-color: windowtext border-bottom-color: border-left-color: border-right-width: border-bottom-width: border-left-width: padding: height:>    <p class='"MsoNormal"' style='"margin-bottom:'><span style='"mso-ascii-font-family:Calibri;mso-fareast-font-family:' new roman color:black>European Size<p></p></span></p>    </td>    <td width='"29"' nowrap valign='"bottom"' style='"width:' border-style: none solid border-bottom-color: windowtext border-bottom-width: border-right-color: border-right-width: padding: height:>    <p class='"MsoNormal"' align='"right"' style='"margin-bottom:' text-align: right><span style='"mso-ascii-font-family:Calibri;' mso-fareast-font-family: new roman mso-bidi-font-family:>28<p></p></span></p>    </td>    <td width='"55"' nowrap valign='"bottom"' style='"width:' border-style: none solid border-bottom-color: windowtext border-bottom-width: border-right-color: border-right-width: padding: height:>    <p class='"MsoNormal"' align='"right"' style='"margin-bottom:' text-align: right><span style='"mso-ascii-font-family:Calibri;' mso-fareast-font-family: new roman mso-bidi-font-family:>29<p></p></span></p>    </td>    <td width='"57"' nowrap valign='"bottom"' style='"width:' border-style: none solid border-bottom-color: windowtext border-bottom-width: border-right-color: border-right-width: padding: height:>    <p class='"MsoNormal"' align='"right"' style='"margin-bottom:' text-align: right><span style='"mso-ascii-font-family:Calibri;' mso-fareast-font-family: new roman mso-bidi-font-family:>30<p></p></span></p>    </td>    <td width='"76"' nowrap valign='"bottom"' style='"width:' border-style: none solid border-bottom-color: windowtext border-bottom-width: border-right-color: border-right-width: padding: height:>    <p class='"MsoNormal"' align='"right"' style='"margin-bottom:' text-align: right><span style='"mso-ascii-font-family:Calibri;' mso-fareast-font-family: new roman mso-bidi-font-family:>31<p></p></span></p>    </td>    <td width='"76"' nowrap valign='"bottom"' style='"width:' border-style: none solid border-bottom-color: windowtext border-bottom-width: border-right-color: border-right-width: padding: height:>    <p class='"MsoNormal"' align='"right"' style='"margin-bottom:' text-align: right><span style='"mso-ascii-font-family:Calibri;' mso-fareast-font-family: new roman mso-bidi-font-family:>32<p></p></span></p>    </td>    <td width='"38"' nowrap valign='"bottom"' style='"width:' border-style: none solid border-bottom-color: windowtext border-bottom-width: border-right-color: border-right-width: padding: height:>    <p class='"MsoNormal"' align='"right"' style='"margin-bottom:' text-align: right><span style='"mso-ascii-font-family:Calibri;' mso-fareast-font-family: new roman mso-bidi-font-family:>33<p></p></span></p>    </td>    <td width='"21"' nowrap valign='"bottom"' style='"width:' border-style: none solid border-bottom-color: windowtext border-bottom-width: border-right-color: border-right-width: padding: height:>    <p class='"MsoNormal"' align='"right"' style='"margin-bottom:' text-align: right><span style='"mso-ascii-font-family:Calibri;' mso-fareast-font-family: new roman mso-bidi-font-family:>34<p></p></span></p>    </td>   </tr><tr style='"mso-yfti-irow:2;mso-yfti-lastrow:yes;height:15.0pt"'><td width='"87"' nowrap valign='"bottom"' style='"width:' border-style: none solid border-right-color: windowtext border-bottom-color: border-left-color: border-right-width: border-bottom-width: border-left-width: padding: height:>    <p class='"MsoNormal"' style='"margin-bottom:'><span style='"mso-ascii-font-family:Calibri;mso-fareast-font-family:' new roman color:black>UK size<p></p></span></p>    </td>    <td width='"29"' nowrap valign='"bottom"' style='"width:' border-style: none solid border-bottom-color: windowtext border-bottom-width: border-right-color: border-right-width: padding: height:>    <p class='"MsoNormal"' align='"right"' style='"margin-bottom:' text-align: right><span style='"mso-ascii-font-family:Calibri;' mso-fareast-font-family: new roman mso-bidi-font-family:>10<p></p></span></p>    </td>    <td width='"55"' nowrap valign='"bottom"' style='"width:' border-style: none solid border-bottom-color: windowtext border-bottom-width: border-right-color: border-right-width: padding: height:>    <p class='"MsoNormal"' align='"right"' style='"margin-bottom:' text-align: right><span style='"mso-ascii-font-family:Calibri;' mso-fareast-font-family: new roman mso-bidi-font-family:>10    1/2<p></p></span></p>    </td>    <td width='"57"' nowrap valign='"bottom"' style='"width:' border-style: none solid border-bottom-color: windowtext border-bottom-width: border-right-color: border-right-width: padding: height:>    <p class='"MsoNormal"' align='"right"' style='"margin-bottom:' text-align: right><span style='"mso-ascii-font-family:Calibri;' mso-fareast-font-family: new roman mso-bidi-font-family:>11    1/2<p></p></span></p>    </td>    <td width='"76"' nowrap valign='"bottom"' style='"width:' border-style: none solid border-bottom-color: windowtext border-bottom-width: border-right-color: border-right-width: padding: height:>    <p class='"MsoNormal"' style='"margin-bottom:'><span style='"mso-ascii-font-family:Calibri;mso-fareast-font-family:' new roman color:black>12  12 1/2<p></p></span></p>    </td>    <td width='"76"' nowrap valign='"bottom"' style='"width:' border-style: none solid border-bottom-color: windowtext border-bottom-width: border-right-color: border-right-width: padding: height:>    <p class='"MsoNormal"' style='"margin-bottom:'><span style='"mso-ascii-font-family:Calibri;mso-fareast-font-family:' new roman color:black>13  13 1/2<p></p></span></p>    </td>    <td width='"38"' nowrap valign='"bottom"' style='"width:' border-style: none solid border-bottom-color: windowtext border-bottom-width: border-right-color: border-right-width: padding: height:>    <p class='"MsoNormal"' align='"right"' style='"margin-bottom:' text-align: right><span style='"mso-ascii-font-family:Calibri;' mso-fareast-font-family: new roman mso-bidi-font-family:>1<p></p></span></p>    </td>    <td width='"21"' nowrap valign='"bottom"' style='"width:' border-style: none solid border-bottom-color: windowtext border-bottom-width: border-right-color: border-right-width: padding: height:>    <p class='"MsoNormal"' align='"right"' style='"margin-bottom:' text-align: right><span style='"mso-ascii-font-family:Calibri;' mso-fareast-font-family: new roman mso-bidi-font-family:>2<p></p></span></p>    </td>   </tr></tbody></table></div>                            </div>,None,1203i2014,None
