B0009OAGOC,Christian Dior Fahrenheit Eau De Toilette Spray for Men  100ml,http://www.amazon.in/Fragrances/b/ref=sd_allcat_beauty_fragrance/276-6718833-1247838?ie=UTF8&node=1374298031,Rs. 3 999.00,Fragranc,Men,Dior,http://ecx.images-amazon.com/images/I/31%2BBS0l9hwL._AA160_.jpg,Rs. 3 999.00,self Colour,Beauty & Health,http://www.amazon.in/Christian-Dior-Fahrenheit-Toilette-Spray/dp/B0009OAGOC/ref=sr_1_2/275-7196464-8359954?s=beauty&ie=UTF8&qid=1395127195&sr=1-2,[<a class="buyAction" href="/gp/offer-listing/B0009OAGOC/ref=dp_olp_0/275-7196464-8359954?ie=UTF8&amp;condition=all">these sellers</a>],Amazon.in: Buy Christian Dior Fahrenheit Eau De Toilette Spray for Men  100ml Online at Best Price in India | Amazon Beauty Store,Buy Christian Dior Fahrenheit Eau De Toilette Spray for Men  100ml at lowest price in India on Amazon.in. Check out Christian Dior Fahrenheit Eau De Toilette Spray for Men  100ml reviews  ratings  features  specifications and browse more Beauty products online at best prices on Amazon.in.,None,<div class="bucket" id="productDescription"> <h2>Product Description</h2> <div class="content"> <h3 class="productDescriptionSource"></h3> <div class="productDescriptionWrapper">        Introduced in 1988. Fragrance notes: honeysuckle  sandalwood and balsam. Recommended use: daytime.When applying any fragrance please consider that there are several factors which can affect the natural smell of your skin and  in turn  the way a scent smells on you. For instance  your mood  stress level  age  body chemistry  diet and current medications may all alter the scents you wear. Similarly  factor such as dry or oily skin can even affect the amount of time a fragrance will last after being applied.              <div class="emptyClear"> </div> </div> </div> </div>,None,18:03:2014,None
B003YIYIQC,Christian Dior Eau Sauvage EDT - 100 ml (For Men),http://www.amazon.in/Fragrances/b/ref=sd_allcat_beauty_fragrance/276-6718833-1247838?ie=UTF8&node=1374298031,None,Fragranc,Men,Dior,http://ecx.images-amazon.com/images/I/31%2BBS0l9hwL._AA160_.jpg,None,self Colour,Beauty & Health,http://www.amazon.in/Christian-Dior-Eau-Sauvage-EDT/dp/B003YIYIQC/ref=sr_1_11/275-7196464-8359954?s=beauty&ie=UTF8&qid=1395127195&sr=1-11,[<a href="/gp/help/seller/at-a-glance.html/275-7196464-8359954?ie=UTF8&amp;seller=A2NFQIUV2YGOLG">Fragume</a>],Amazon.in: Buy Christian Dior Eau Sauvage EDT - 100 ml (For Men) Online at Best Price in India | Amazon Beauty Store,Buy Christian Dior Eau Sauvage EDT - 100 ml (For Men) at lowest price in India on Amazon.in. Check out Christian Dior Eau Sauvage EDT - 100 ml (For Men) reviews  ratings  features  specifications and browse more Beauty products online at best prices on Amazon.in.,None,<div class="bucket" id="productDescription"> <h2>Product Description</h2> <div class="content"> <h3 class="productDescriptionSource"></h3> <div class="productDescriptionWrapper">        Ideal For Men Fragrance Classification Eau de Toilette Fragrance Family Woody Quantity 100 ml              <div class="emptyClear"> </div> </div> </div> </div>,None,18:03:2014,None
B000WZSXZM,Christian Dior Fahrenheit 32 for Men  100ml,http://www.amazon.in/Fragrances/b/ref=sd_allcat_beauty_fragrance/276-6718833-1247838?ie=UTF8&node=1374298031,None,Fragranc,Men,Dior,http://ecx.images-amazon.com/images/I/31%2BBS0l9hwL._AA160_.jpg,None,self Colour,Beauty & Health,http://www.amazon.in/Christian-Dior-Fahrenheit-Men-100ml/dp/B000WZSXZM/ref=sr_1_15/275-7196464-8359954?s=beauty&ie=UTF8&qid=1395127195&sr=1-15,[<a href="/gp/help/seller/at-a-glance.html/275-7196464-8359954?ie=UTF8&amp;seller=A2NFQIUV2YGOLG">Fragume</a>],Amazon.in: Buy Christian Dior Fahrenheit 32 for Men  100ml Online at Best Price in India | Amazon Beauty Store,Buy Christian Dior Fahrenheit 32 for Men  100ml at lowest price in India on Amazon.in. Check out Christian Dior Fahrenheit 32 for Men  100ml reviews  ratings  features  specifications and browse more Beauty products online at best prices on Amazon.in.,None,<div class="bucket" id="productDescription"> <h2>Product Description</h2> <div class="content"> <h3 class="productDescriptionSource"></h3> <div class="productDescriptionWrapper">        Design House: Christian Dior  Year Introduced: 2007  Recommended Use: Casual  Recommended Use: Casual              <div class="emptyClear"> </div> </div> </div> </div>,None,18:03:2014,None
B0009OAGNS,Christian Dior Fahrenheit By For Men. Eau De Toilette Spray,http://www.amazon.in/Fragrances/b/ref=sd_allcat_beauty_fragrance/276-6718833-1247838?ie=UTF8&node=1374298031,Rs. 6 059.00,Fragranc,Men,Dior,http://ecx.images-amazon.com/images/I/31%2BBS0l9hwL._AA160_.jpg,Rs. 6 059.00,self Colour,Beauty & Health,http://www.amazon.in/Christian-Dior-Fahrenheit-Toilette-Ounces/dp/B0009OAGNS/ref=sr_1_16/275-7196464-8359954?s=beauty&ie=UTF8&qid=1395127195&sr=1-16,[<a class="buyAction" href="/gp/offer-listing/B0009OAGNS/ref=dp_olp_0/275-7196464-8359954?ie=UTF8&amp;condition=all">these sellers</a>],Amazon.in: Buy Christian Dior Fahrenheit By For Men. Eau De Toilette Spray 1.7 Ounces Online at Best Price in India | Amazon Beauty Store,Buy Christian Dior Fahrenheit By For Men. Eau De Toilette Spray 1.7 Ounces at lowest price in India on Amazon.in. Check out Christian Dior Fahrenheit By For Men. Eau De Toilette Spray 1.7 Ounces reviews  ratings  features  specifications and browse more Beauty products online at best prices on Amazon.in.,None,<div class="bucket" id="productDescription"> <h2>Product Description</h2> <div class="disclaim">Size: <strong>1.7 Oz..s</strong></div> <div class="content"> <h3 class="productDescriptionSource"></h3> <div class="productDescriptionWrapper">        Introduced In 1988. Fragrance Notes: Honeysuckle  Sandalwood And Balsam. Recommended Use: Daytime.When Applying Any Fragrance Please Consider That There Are Several Factors Which Can Affect The Natural Smell Of Your Skin And  In Turn  The Way A Scent Smells On You.  For Instance  Your Mood  Stress Level  Age  Body Chemistry  Diet  And Current Medications May All Alter The Scents You Wear.  Similarly  Factor Such As Dry Or Oily Skin Can Even Affect The Amount Of Time A Fragrance Will Last After Being Applied              <div class="emptyClear"> </div> </div> </div> </div>,None,18:03:2014,None
B0020MMA2C,Christian Dior Homme Sport for Men Eau De Toilette Spray  100ml,http://www.amazon.in/Fragrances/b/ref=sd_allcat_beauty_fragrance/276-6718833-1247838?ie=UTF8&node=1374298031,None,Fragranc,Men,Dior,http://ecx.images-amazon.com/images/I/31%2BBS0l9hwL._AA160_.jpg,None,self Colour,Beauty & Health,http://www.amazon.in/Christian-Dior-Homme-Sport-Toilette/dp/B0020MMA2C/ref=sr_1_22/275-7196464-8359954?s=beauty&ie=UTF8&qid=1395127195&sr=1-22,[<a href="/gp/help/seller/at-a-glance.html/275-7196464-8359954?ie=UTF8&amp;seller=A2NFQIUV2YGOLG">Fragume</a>],Amazon.in: Buy Christian Dior Homme Sport for Men Eau De Toilette Spray  100ml Online at Best Price in India | Amazon Beauty Store,Buy Christian Dior Homme Sport for Men Eau De Toilette Spray  100ml at lowest price in India on Amazon.in. Check out Christian Dior Homme Sport for Men Eau De Toilette Spray  100ml reviews  ratings  features  specifications and browse more Beauty products online at best prices on Amazon.in.,None,<div class="bucket" id="productDescription"> <h2>Product Description</h2> <div class="content"> <h3 class="productDescriptionSource"></h3> <div class="productDescriptionWrapper">        When nbsp applying nbsp any fragrance please consider that there are several factors which can affect the natural smell of your skin and in turn the way a scent smells on you. nbsp For instance your mood stress level age body chemistry nbsp diet and current medications may all alter the scents you wear. nbsp nbsp Similarly factor such as dry or oily nbsp skin can even affect the amount of time a fragrance will last after being applied              <div class="emptyClear"> </div> </div> </div> </div>,None,18:03:2014,None
B0001YOB0U,Fahrenheit By Christian Dior For Men 200 Ml 100 ml,http://www.amazon.in/Fragrances/b/ref=sd_allcat_beauty_fragrance/276-6718833-1247838?ie=UTF8&node=1374298031,None,Fragranc,Men,Dior,http://ecx.images-amazon.com/images/I/31%2BBS0l9hwL._AA160_.jpg,None,self Colour,Beauty & Health,http://www.amazon.in/Fahrenheit-Christian-Dior-For-Men/dp/B0001YOB0U/ref=sr_1_33/275-7196464-8359954?s=beauty&ie=UTF8&qid=1395127200&sr=1-33,[<a href="/gp/help/seller/at-a-glance.html/275-7196464-8359954?ie=UTF8&amp;seller=A2O8H5ZZSCKU2K">Perfume Crush</a>],Amazon.in: Buy Fahrenheit By Christian Dior For Men 200 Ml 100 ml Online at Best Price in India | Amazon Beauty Store,Buy Fahrenheit By Christian Dior For Men 200 Ml 100 ml at lowest price in India on Amazon.in. Check out Fahrenheit By Christian Dior For Men 200 Ml 100 ml reviews  ratings  features  specifications and browse more Beauty products online at best prices on Amazon.in.,None,<div class="bucket" id="productDescription"> <h2>Product Description</h2> <div class="content"> <h3 class="productDescriptionSource"></h3> <div class="productDescriptionWrapper">        Design House: Christian Dior  Year Introduced: 1988  Recommended Use: Daytime  Recommended Use: Daytime              <div class="emptyClear"> </div> </div> </div> </div>,None,18:03:2014,None
