B000YPJ4RQ,True Love,http://www.amazon.in/Fragrances/b/ref=sd_allcat_beauty_fragrance/276-6718833-1247838?ie=UTF8&node=1374298031,Rs. 1 481.99,Fragranc,Elizabeth Arden,Versace,http://ecx.images-amazon.com/images/I/41BRTigKBpL._AA160_.jpg,Rs. 1 481.99,self Colour,Beauty & Health,http://www.amazon.in/Elizabeth-Arden-Eli-3373-True-Love/dp/B000YPJ4RQ/ref=sr_1_135/275-9715206-1097860?s=beauty&ie=UTF8&qid=1395126980&sr=1-135,[<a class="buyAction" href="/gp/offer-listing/B000YPJ4RQ/ref=dp_olp_0/275-9715206-1097860?ie=UTF8&amp;condition=all">these sellers</a>],Amazon.in: Buy True Love Online at Best Price in India | Amazon Beauty Store,Buy True Love at lowest price in India on Amazon.in. Check out True Love reviews  ratings  features  specifications and browse more Beauty products online at best prices on Amazon.in.,None,<div class="bucket" id="productDescription"> <h2>Product Description</h2> <div class="content"> <h3 class="productDescriptionSource"></h3> <div class="productDescriptionWrapper">        True Love Perfume By Elizabeth Arden  Launched By The Design House Of Elizabeth Arden In 1994  True Love Is Classified As A Refreshing  Gentle  Floral Fragrance. This Feminine Scent Possesses A Blend Of Lotus  Iris And Jasmine. Accompanied By The Distinct              <div class="emptyClear"> </div> </div> </div> </div>,None,18:03:2014,None
B009QZ9VUU,Versace - Versus Eau De Toilette Spray - 100ml/3.4oz,http://www.amazon.in/Fragrances/b/ref=sd_allcat_beauty_fragrance/276-6718833-1247838?ie=UTF8&node=1374298031,Rs. 2 790.00,Fragranc,Elizabeth Arden,Versace,http://ecx.images-amazon.com/images/I/41BRTigKBpL._AA160_.jpg,Rs. 2 790.00,self Colour,Beauty & Health,http://www.amazon.in/Versace-Versus-Toilette-Spray-100ml/dp/B009QZ9VUU/ref=sr_1_137/275-9715206-1097860?s=beauty&ie=UTF8&qid=1395126980&sr=1-137,[<a class="buyAction" href="/gp/offer-listing/B009QZ9VUU/ref=dp_olp_0/275-9715206-1097860?ie=UTF8&amp;condition=all">these sellers</a>],Versace - Versus Eau De Toilette Spray - 100ml/3.4oz: Amazon.in: Beauty,Versace - Versus Eau De Toilette Spray - 100ml/3.4oz: Amazon.in: Beauty,None,None,None,18:03:2014,None
B00F3WY466,Versace Bright Crystal 4 Pc Set for Women,http://www.amazon.in/Fragrances/b/ref=sd_allcat_beauty_fragrance/276-6718833-1247838?ie=UTF8&node=1374298031,Rs. 4 850.00,Fragranc,Elizabeth Arden,Versace,http://ecx.images-amazon.com/images/I/41BRTigKBpL._AA160_.jpg,Rs. 4 850.00,self Colour,Beauty & Health,http://www.amazon.in/Versace-Bright-Crystal-Set-Women/dp/B00F3WY466/ref=sr_1_139/275-9715206-1097860?s=beauty&ie=UTF8&qid=1395126980&sr=1-139,[<a class="buyAction" href="/gp/offer-listing/B00F3WY466/ref=dp_olp_0/275-9715206-1097860?ie=UTF8&amp;condition=all">these sellers</a>],Amazon.in: Buy Versace Bright Crystal 4 Pc Set for Women Online at Best Price in India | Amazon Beauty Store,Buy Versace Bright Crystal 4 Pc Set for Women at lowest price in India on Amazon.in. Check out Versace Bright Crystal 4 Pc Set for Women reviews  ratings  features  specifications and browse more Beauty products online at best prices on Amazon.in.,None,<div class="bucket" id="productDescription"> <h2>Product Description</h2> <div class="content"> <h3 class="productDescriptionSource"></h3> <div class="productDescriptionWrapper">        Versace Bright Crystal 4 Pc Gift Set for Women   Versace Bright Crystal Set includes:- EDT Spray  90 ml (3.0 Fl. OZ ) Body Lotion 100 ml (3.4 Fl OZ ) 2 Cosmetic Bags              <div class="emptyClear"> </div> </div> </div> </div>,None,18:03:2014,None
B00375W8WS,Versace Bright Crystal 50ml,http://www.amazon.in/Fragrances/b/ref=sd_allcat_beauty_fragrance/276-6718833-1247838?ie=UTF8&node=1374298031,None,Fragranc,Elizabeth Arden,Versace,http://ecx.images-amazon.com/images/I/41BRTigKBpL._AA160_.jpg,None,self Colour,Beauty & Health,http://www.amazon.in/Versace-VERSACE-BRIGHT-CRYSTAL-EDT/dp/B00375W8WS/ref=sr_1_140/275-9715206-1097860?s=beauty&ie=UTF8&qid=1395126980&sr=1-140,[<a href="/gp/help/seller/at-a-glance.html/275-9715206-1097860?ie=UTF8&amp;seller=A22G8HZGXYSWPZ">Taha &amp; Bros.</a>],Amazon.in: Buy Versace Bright Crystal 50ml Online at Best Price in India | Amazon Beauty Store,Buy Versace Bright Crystal 50ml at lowest price in India on Amazon.in. Check out Versace Bright Crystal 50ml reviews  ratings  features  specifications and browse more Beauty products online at best prices on Amazon.in.,None,<div class="bucket" id="productDescription"> <h2>Product Description</h2> <div class="content"> <h3 class="productDescriptionSource"></h3> <div class="productDescriptionWrapper">        Versace Bright Crystal is an enthralling and voluptuous fragrance for the Versace woman who is strong and confident yet feminine and seunsual.The effect is a combination of sheer sensuality  crystal transparency and luminous brightnes.Versace Bright Crystal is packaged in a timeless glass bottle with elegant crystal cap.              <div class="emptyClear"> </div> </div> </div> </div>,None,18:03:2014,None
B001QTW45S,Elizabeth Arden Green Tea Eau De Parfum Spray Tester for Women  100ml,http://www.amazon.in/Fragrances/b/ref=sd_allcat_beauty_fragrance/276-6718833-1247838?ie=UTF8&node=1374298031,Rs. 1 649.00,Fragranc,Elizabeth Arden,Versace,http://ecx.images-amazon.com/images/I/41BRTigKBpL._AA160_.jpg,Rs. 1 649.00,self Colour,Beauty & Health,http://www.amazon.in/Elizabeth-Arden-Green-Parfum-Tester/dp/B001QTW45S/ref=sr_1_54/275-9715206-1097860?s=beauty&ie=UTF8&qid=1395126961&sr=1-54,[<a class="buyAction" href="/gp/offer-listing/B001QTW45S/ref=dp_olp_0/275-9715206-1097860?ie=UTF8&amp;condition=all">these sellers</a>],Amazon.in: Buy Elizabeth Arden Green Tea Eau De Parfum Spray Tester for Women  100ml Online at Best Price in India | Amazon Beauty Store,Buy Elizabeth Arden Green Tea Eau De Parfum Spray Tester for Women  100ml at lowest price in India on Amazon.in. Check out Elizabeth Arden Green Tea Eau De Parfum Spray Tester for Women  100ml reviews  ratings  features  specifications and browse more Beauty products online at best prices on Amazon.in.,None,<div class="bucket" id="productDescription"> <h2>Product Description</h2> <div class="content"> <h3 class="productDescriptionSource"></h3> <div class="productDescriptionWrapper">        Launched by the design house of Elizabeth Arden in 1999  Green Tea by Elizabeth Arden possesses a blend of citrus lemon  rhubarb  peppermint  oakmoss  musk and amber. It is recommended for daytime wear. What is a Tester? A Tester is a perfume with no fancy packaging but with the same exact fragrance at an even better price. They are just like the one used to test the perfume in a department store but supplied in a plain box and often have the word tester printed on the bottle. Sometimes they do not come with a cap or box. These items are great for personal use but may not be great as gifts. Our testers are new unopened and have never been sprayed (Testers and unboxed product are exactly the same as the regular perfume  except testers usually come in a plain box--with or without a cap. Unboxed products are the perfume or bath product  only without the box.)              <div class="emptyClear"> </div> </div> </div> </div>,None,18:03:2014,None
B000VOHKK8,Versace Bright Crystal for Women  90ml,http://www.amazon.in/Fragrances/b/ref=sd_allcat_beauty_fragrance/276-6718833-1247838?ie=UTF8&node=1374298031,None,Fragranc,Elizabeth Arden,Versace,http://ecx.images-amazon.com/images/I/41BRTigKBpL._AA160_.jpg,None,self Colour,Beauty & Health,http://www.amazon.in/Versace-Bright-Crystal-Women-90ml/dp/B000VOHKK8/ref=sr_1_147/275-9715206-1097860?s=beauty&ie=UTF8&qid=1395126990&sr=1-147,[<a href="/gp/help/seller/at-a-glance.html/275-9715206-1097860?ie=UTF8&amp;seller=A2O8H5ZZSCKU2K">Perfume Crush</a>],Amazon.in: Buy Versace Bright Crystal for Women  90ml Online at Best Price in India | Amazon Beauty Store,Buy Versace Bright Crystal for Women  90ml at lowest price in India on Amazon.in. Check out Versace Bright Crystal for Women  90ml reviews  ratings  features  specifications and browse more Beauty products online at best prices on Amazon.in.,None,<div class="bucket" id="productDescription"> <h2>Product Description</h2> <div class="content"> <h3 class="productDescriptionSource"></h3> <div class="productDescriptionWrapper">        Design House: Gianni Versace  Year Introduced: 2006  Recommended Use: Casual  Recommended Use: Casual              <div class="emptyClear"> </div> </div> </div> </div>,None,18:03:2014,None
B0087BZJVE,Versace Crystal Noir 3 Pc Set for Women,http://www.amazon.in/Fragrances/b/ref=sd_allcat_beauty_fragrance/276-6718833-1247838?ie=UTF8&node=1374298031,Rs. 4 850.00,Fragranc,Elizabeth Arden,Versace,http://ecx.images-amazon.com/images/I/41BRTigKBpL._AA160_.jpg,Rs. 4 850.00,self Colour,Beauty & Health,http://www.amazon.in/Versace-Crystal-Noir-Set-Women/dp/B0087BZJVE/ref=sr_1_150/275-9715206-1097860?s=beauty&ie=UTF8&qid=1395126990&sr=1-150,[<a class="buyAction" href="/gp/offer-listing/B0087BZJVE/ref=dp_olp_0/275-9715206-1097860?ie=UTF8&amp;condition=all">these sellers</a>],Amazon.in: Buy Versace Crystal Noir 3 Pc Set for Women Online at Best Price in India | Amazon Beauty Store,Buy Versace Crystal Noir 3 Pc Set for Women at lowest price in India on Amazon.in. Check out Versace Crystal Noir 3 Pc Set for Women reviews  ratings  features  specifications and browse more Beauty products online at best prices on Amazon.in.,None,<div class="bucket" id="productDescription"> <h2>Product Description</h2> <div class="content"> <h3 class="productDescriptionSource"></h3> <div class="productDescriptionWrapper">        Versace Crystal Noir 3 Pc Set for Women    Versace Crystal Noir Set includes:- EDT Spray  90 ml (3.0 Fl. OZ ) Body Lotion 100 ml (3.4 Fl OZ ) 1 Bag   Featuring amber and gardenia  Crystal Noir is a magical fragrance  ethereal yet carnal. Precious  delicate and persistent  it has an ultra-feminine floral and oriental scent. The pyramid bottle is deliberately minimalist to enhance the intrinsic elegance of the ingredients. Gift set contains  eau de toilette fragrance  body lotion and a stylish bag with chain strap.              <div class="emptyClear"> </div> </div> </div> </div>,None,18:03:2014,None
B0084YDAYW,Versace Dreamer Men 100ML EDT,http://www.amazon.in/Fragrances/b/ref=sd_allcat_beauty_fragrance/276-6718833-1247838?ie=UTF8&node=1374298031,Rs. 2 800.00,Fragranc,Elizabeth Arden,Versace,http://ecx.images-amazon.com/images/I/41BRTigKBpL._AA160_.jpg,Rs. 2 800.00,self Colour,Beauty & Health,http://www.amazon.in/Versace-Dreamer-Men-100ML-EDT/dp/B0084YDAYW/ref=sr_1_155/275-9715206-1097860?s=beauty&ie=UTF8&qid=1395126990&sr=1-155,[<a class="buyAction" href="/gp/offer-listing/B0084YDAYW/ref=dp_olp_0/275-9715206-1097860?ie=UTF8&amp;condition=all">these sellers</a>],Amazon.in: Buy Versace Dreamer Men 100ML EDT Online at Best Price in India | Amazon Beauty Store,Buy Versace Dreamer Men 100ML EDT at lowest price in India on Amazon.in. Check out Versace Dreamer Men 100ML EDT reviews  ratings  features  specifications and browse more Beauty products online at best prices on Amazon.in.,None,None,None,18:03:2014,None
B00EXW6RSU,Versace Eros by Versace Eau De Toilette 3.3 oz Spray,http://www.amazon.in/Fragrances/b/ref=sd_allcat_beauty_fragrance/276-6718833-1247838?ie=UTF8&node=1374298031,Rs. 3 499.00,Fragranc,Elizabeth Arden,Versace,http://ecx.images-amazon.com/images/I/41BRTigKBpL._AA160_.jpg,Rs. 3 499.00,self Colour,Beauty & Health,http://www.amazon.in/Versace-Eros-Eau-Toilette-Spray/dp/B00EXW6RSU/ref=sr_1_158/275-9715206-1097860?s=beauty&ie=UTF8&qid=1395126990&sr=1-158,[<a class="buyAction" href="/gp/offer-listing/B00EXW6RSU/ref=dp_olp_0/275-9715206-1097860?ie=UTF8&amp;condition=all">these sellers</a>],Amazon.in: Buy Versace Eros by Versace Eau De Toilette 3.3 oz Spray Online at Best Price in India | Amazon Beauty Store,Buy Versace Eros by Versace Eau De Toilette 3.3 oz Spray at lowest price in India on Amazon.in. Check out Versace Eros by Versace Eau De Toilette 3.3 oz Spray reviews  ratings  features  specifications and browse more Beauty products online at best prices on Amazon.in.,None,None,None,18:03:2014,None
B004X2NV2U,VERSACE MAN BY VERSACE  EDT SPRAY 3.3 OZ EAU FRAICHE #)) BLUE BOTTLE,http://www.amazon.in/Fragrances/b/ref=sd_allcat_beauty_fragrance/276-6718833-1247838?ie=UTF8&node=1374298031,Rs. 4 099.00,Fragranc,Elizabeth Arden,Versace,http://ecx.images-amazon.com/images/I/41BRTigKBpL._AA160_.jpg,Rs. 4 099.00,self Colour,Beauty & Health,http://www.amazon.in/VERSACE-SPRAY-FRAICHE-BLUE-BOTTLE/dp/B004X2NV2U/ref=sr_1_160/275-9715206-1097860?s=beauty&ie=UTF8&qid=1395126990&sr=1-160,[<a class="buyAction" href="/gp/offer-listing/B004X2NV2U/ref=dp_olp_0/275-9715206-1097860?ie=UTF8&amp;condition=all">these sellers</a>],Amazon.in: Buy VERSACE MAN BY VERSACE  EDT SPRAY 3.3 OZ EAU FRAICHE #)) BLUE BOTTLE Online at Best Price in India | Amazon Beauty Store,Buy VERSACE MAN BY VERSACE  EDT SPRAY 3.3 OZ EAU FRAICHE #)) BLUE BOTTLE at lowest price in India on Amazon.in. Check out VERSACE MAN BY VERSACE  EDT SPRAY 3.3 OZ EAU FRAICHE #)) BLUE BOTTLE reviews  ratings  features  specifications and browse more Beauty products online at best prices on Amazon.in.,None,None,None,18:03:2014,None
B000E7SU9C,Versace L'Homme EDT Spray for Men  100ml,http://www.amazon.in/Fragrances/b/ref=sd_allcat_beauty_fragrance/276-6718833-1247838?ie=UTF8&node=1374298031,None,Fragranc,Elizabeth Arden,Versace,http://ecx.images-amazon.com/images/I/41BRTigKBpL._AA160_.jpg,None,self Colour,Beauty & Health,http://www.amazon.in/Versace-LHomme-EDT-Spray-100ml/dp/B000E7SU9C/ref=sr_1_159/275-9715206-1097860?s=beauty&ie=UTF8&qid=1395126990&sr=1-159,[<a href="/gp/help/seller/at-a-glance.html/275-9715206-1097860?ie=UTF8&amp;seller=A29ZFTNVZHDXBZ">Route2Fashion</a>],Amazon.in: Buy Versace L'Homme EDT Spray for Men  100ml Online at Best Price in India | Amazon Beauty Store,Buy Versace L'Homme EDT Spray for Men  100ml at lowest price in India on Amazon.in. Check out Versace L'Homme EDT Spray for Men  100ml reviews  ratings  features  specifications and browse more Beauty products online at best prices on Amazon.in.,None,<div class="bucket" id="productDescription"> <h2>Product Description</h2> <div class="content"> <h3 class="productDescriptionSource"></h3> <div class="productDescriptionWrapper">        Introduced in 1984. Fragrance notes: a spicy and fresh scent of fruits  jasmine musk  wood and amber. Recommended use: evening. When applying any fragrance please consider that there are several factors which can affect the natural smell of your skin and  in turn  the way a scent smells on you. For instance  your mood  stress level  age  body chemistry  diet and current medications may all alter the scents you wear. Similarly  factor such as dry or oily skin can even affect the amount of time a fragrance will last after being applied.              <div class="emptyClear"> </div> </div> </div> </div>,None,18:03:2014,None
B009VXWOBK,Elizabeth Arden SUNFLOWERS Dream Petals Edt Women100ML,http://www.amazon.in/Fragrances/b/ref=sd_allcat_beauty_fragrance/276-6718833-1247838?ie=UTF8&node=1374298031,None,Fragranc,Elizabeth Arden,Versace,http://ecx.images-amazon.com/images/I/41BRTigKBpL._AA160_.jpg,None,self Colour,Beauty & Health,http://www.amazon.in/Elizabeth-Arden-SUNFLOWERS-Petals-Women100ML/dp/B009VXWOBK/ref=sr_1_78/275-9715206-1097860?s=beauty&ie=UTF8&qid=1395126966&sr=1-78,[<a href="/gp/help/seller/at-a-glance.html/275-9715206-1097860?ie=UTF8&amp;seller=A2NFQIUV2YGOLG">Fragume</a>],Amazon.in: Buy Elizabeth Arden SUNFLOWERS Dream Petals Edt Women100ML Online at Best Price in India | Amazon Beauty Store,Buy Elizabeth Arden SUNFLOWERS Dream Petals Edt Women100ML at lowest price in India on Amazon.in. Check out Elizabeth Arden SUNFLOWERS Dream Petals Edt Women100ML reviews  ratings  features  specifications and browse more Beauty products online at best prices on Amazon.in.,None,<div class="bucket" id="productDescription"> <h2>Product Description</h2> <div class="content"> <h3 class="productDescriptionSource"></h3> <div class="productDescriptionWrapper">        Design House: Elizabeth Arden  Year Introduced: 2012                <div class="emptyClear"> </div> </div> </div> </div>,None,18:03:2014,None
B0084YDBY6,Versace Pour Homme EDT for Men  100ml,http://www.amazon.in/Fragrances/b/ref=sd_allcat_beauty_fragrance/276-6718833-1247838?ie=UTF8&node=1374298031,None,Fragranc,Elizabeth Arden,Versace,http://ecx.images-amazon.com/images/I/41BRTigKBpL._AA160_.jpg,None,self Colour,Beauty & Health,http://www.amazon.in/Versace-Pour-Homme-EDT-100ml/dp/B0084YDBY6/ref=sr_1_165/275-9715206-1097860?s=beauty&ie=UTF8&qid=1395126990&sr=1-165,[<a href="/gp/help/seller/at-a-glance.html/275-9715206-1097860?ie=UTF8&amp;seller=A2NFQIUV2YGOLG">Fragume</a>],Amazon.in: Buy Versace Pour Homme EDT for Men  100ml Online at Best Price in India | Amazon Beauty Store,Buy Versace Pour Homme EDT for Men  100ml at lowest price in India on Amazon.in. Check out Versace Pour Homme EDT for Men  100ml reviews  ratings  features  specifications and browse more Beauty products online at best prices on Amazon.in.,None,<div class="bucket" id="productDescription"> <h2>Product Description</h2> <div class="content"> <h3 class="productDescriptionSource"></h3> <div class="productDescriptionWrapper">        Introduced in 2007  Versace Signature contains notes including jasmine  Moroccan cedar wood  musk  Kashmir wood and Azalea. When applying any fragrance please consider that there are several factors which can affect the natural smell of your skin and  in turn  the way a scent smells on you.  For instance  your mood  stress level  age  body chemistry  diet  and current medications may all alter the scents you wear. Similarly  factor such as dry or oily skin can even affect the amount of time a fragrance will last after being applied.              <div class="emptyClear"> </div> </div> </div> </div>,None,18:03:2014,None
B001MSR7UU,Versace Pour Homme for Men  100ml,http://www.amazon.in/Fragrances/b/ref=sd_allcat_beauty_fragrance/276-6718833-1247838?ie=UTF8&node=1374298031,None,Fragranc,Elizabeth Arden,Versace,http://ecx.images-amazon.com/images/I/41BRTigKBpL._AA160_.jpg,None,self Colour,Beauty & Health,http://www.amazon.in/Versace-Pour-Homme-Men-100ml/dp/B001MSR7UU/ref=sr_1_166/275-9715206-1097860?s=beauty&ie=UTF8&qid=1395126990&sr=1-166,[<a href="/gp/help/seller/at-a-glance.html/275-9715206-1097860?ie=UTF8&amp;seller=A3ES9F57NVVRIK">MyLuckyScent</a>],Amazon.in: Buy Versace Pour Homme for Men  100ml Online at Best Price in India | Amazon Beauty Store,Buy Versace Pour Homme for Men  100ml at lowest price in India on Amazon.in. Check out Versace Pour Homme for Men  100ml reviews  ratings  features  specifications and browse more Beauty products online at best prices on Amazon.in.,None,<div class="bucket" id="productDescription"> <h2>Product Description</h2> <div class="content"> <h3 class="productDescriptionSource"></h3> <div class="productDescriptionWrapper">        Versace Pour Homme Versace for men.Versace Pour Homme by Versace is a Aromatic Fougere fragrance for men. Versace Pour Homme was launched in 2008. The nose behind this fragrance is Alberto Morillas. Top notes are citruses  neroli  bergamot and rose de mai; middle notes are hyacinth  clary sage  cedar and geranium; base notes are tonka bean  musk and amber.              <div class="emptyClear"> </div> </div> </div> </div>,None,18:03:2014,None
B0069RWD6W,Versace Vanitas Eau De Parfum Spray - 50ml/1.7oz,http://www.amazon.in/Fragrances/b/ref=sd_allcat_beauty_fragrance/276-6718833-1247838?ie=UTF8&node=1374298031,Rs. 3 800.00,Fragranc,Elizabeth Arden,Versace,http://ecx.images-amazon.com/images/I/41BRTigKBpL._AA160_.jpg,Rs. 3 800.00,self Colour,Beauty & Health,http://www.amazon.in/Versace-Vanitas-Eau-Parfum-Spray/dp/B0069RWD6W/ref=sr_1_173/275-9715206-1097860?s=beauty&ie=UTF8&qid=1395126994&sr=1-173,[<a class="buyAction" href="/gp/offer-listing/B0069RWD6W/ref=dp_olp_0/275-9715206-1097860?ie=UTF8&amp;condition=all">these sellers</a>],Amazon.in: Buy Versace Vanitas Eau De Parfum Spray - 50ml/1.7oz Online at Best Price in India | Amazon Beauty Store,Buy Versace Vanitas Eau De Parfum Spray - 50ml/1.7oz at lowest price in India on Amazon.in. Check out Versace Vanitas Eau De Parfum Spray - 50ml/1.7oz reviews  ratings  features  specifications and browse more Beauty products online at best prices on Amazon.in.,None,None,None,18:03:2014,None
B0084YDBFK,Versace Vanitas Women 100ML EDP,http://www.amazon.in/Fragrances/b/ref=sd_allcat_beauty_fragrance/276-6718833-1247838?ie=UTF8&node=1374298031,None,Fragranc,Elizabeth Arden,Versace,http://ecx.images-amazon.com/images/I/41BRTigKBpL._AA160_.jpg,None,self Colour,Beauty & Health,http://www.amazon.in/Versace-Vanitas-Women-100ML-EDP/dp/B0084YDBFK/ref=sr_1_174/275-9715206-1097860?s=beauty&ie=UTF8&qid=1395126994&sr=1-174,[<a href="/gp/help/seller/at-a-glance.html/275-9715206-1097860?ie=UTF8&amp;seller=A2NFQIUV2YGOLG">Fragume</a>],Amazon.in: Buy Versace Vanitas Women 100ML EDP Online at Best Price in India | Amazon Beauty Store,Buy Versace Vanitas Women 100ML EDP at lowest price in India on Amazon.in. Check out Versace Vanitas Women 100ML EDP reviews  ratings  features  specifications and browse more Beauty products online at best prices on Amazon.in.,None,None,None,18:03:2014,None
B004HO781O,Versace Versense 3 Pc Set For Women,http://www.amazon.in/Fragrances/b/ref=sd_allcat_beauty_fragrance/276-6718833-1247838?ie=UTF8&node=1374298031,Rs. 4 650.00,Fragranc,Elizabeth Arden,Versace,http://ecx.images-amazon.com/images/I/41BRTigKBpL._AA160_.jpg,Rs. 4 650.00,self Colour,Beauty & Health,http://www.amazon.in/Versace-Versense-Set-For-Women/dp/B004HO781O/ref=sr_1_177/275-9715206-1097860?s=beauty&ie=UTF8&qid=1395126994&sr=1-177,[<a class="buyAction" href="/gp/offer-listing/B004HO781O/ref=dp_olp_0/275-9715206-1097860?ie=UTF8&amp;condition=all">these sellers</a>],Amazon.in: Buy Versace Versense 3 Pc Set For Women Online at Best Price in India | Amazon Beauty Store,Buy Versace Versense 3 Pc Set For Women at lowest price in India on Amazon.in. Check out Versace Versense 3 Pc Set For Women reviews  ratings  features  specifications and browse more Beauty products online at best prices on Amazon.in.,None,<div class="bucket" id="productDescription"> <h2>Product Description</h2> <div class="content"> <h3 class="productDescriptionSource"></h3> <div class="productDescriptionWrapper">        Versace Versense set includes -  100ml EDT Spray 100ml Body Lotion  1 X Travel Bag  Versense combines Mediterranean top notes of bergamot  green mandarins  citrus fruit and prickly pear with a heart of jasmine  cardamom and sea daffodil  and a woody base of sandalwood and cedarwood mixed with olive tree and musk. Casual  fresh  likable and very wearable.     A fresh  sensual  luminous fragrance for modern women Delivers a seductive &amp; feminine touch Features notes of bergamot  green mandarin  fig  sea lily  jasmine Blended with notes of cardamom  cedar  sandalwood  olive wood  musk Perfect for daytime &amp; evening wear              <div class="emptyClear"> </div> </div> </div> </div>,None,18:03:2014,None
B002XQ1YOU,Versace Versence EDT for Women  100ml,http://www.amazon.in/Fragrances/b/ref=sd_allcat_beauty_fragrance/276-6718833-1247838?ie=UTF8&node=1374298031,None,Fragranc,Elizabeth Arden,Versace,http://ecx.images-amazon.com/images/I/41BRTigKBpL._AA160_.jpg,None,self Colour,Beauty & Health,http://www.amazon.in/Versace-Versence-EDT-Women-100ml/dp/B002XQ1YOU/ref=sr_1_176/275-9715206-1097860?s=beauty&ie=UTF8&qid=1395126994&sr=1-176,[<a href="/gp/help/seller/at-a-glance.html/275-9715206-1097860?ie=UTF8&amp;seller=A2O8H5ZZSCKU2K">Perfume Crush</a>],Amazon.in: Buy Versace Versence EDT for Women  100ml Online at Best Price in India | Amazon Beauty Store,Buy Versace Versence EDT for Women  100ml at lowest price in India on Amazon.in. Check out Versace Versence EDT for Women  100ml reviews  ratings  features  specifications and browse more Beauty products online at best prices on Amazon.in.,None,<div class="bucket" id="productDescription"> <h2>Product Description</h2> <div class="content"> <h3 class="productDescriptionSource"></h3> <div class="productDescriptionWrapper">        Versace Versense by Gianni Versace for Women EDT spray 3.4oz with green mandarin  musk bergamot  cardamom sea lily  cedar olive wood and sandalwood jasmine fig.              <div class="emptyClear"> </div> </div> </div> </div>,None,18:03:2014,None
