B0028VM7CI,ELIZABETH ARDEN GREEN TEA LOTUS FOR WOMEN 100ML,http://www.amazon.in/Fragrances/b/ref=sd_allcat_beauty_fragrance/276-6718833-1247838?ie=UTF8&node=1374298031,None,Fragranc,Elizabeth Arden,Versace,http://ecx.images-amazon.com/images/I/41BRTigKBpL._AA160_.jpg,None,self Colour,Beauty & Health,http://www.amazon.in/ELIZABETH-ARDEN-GREEN-LOTUS-WOMEN/dp/B0028VM7CI/ref=sr_1_60/275-9715206-1097860?s=beauty&ie=UTF8&qid=1395126961&sr=1-60,[<a href="/gp/help/seller/at-a-glance.html/275-9715206-1097860?ie=UTF8&amp;seller=A22G8HZGXYSWPZ">Taha &amp; Bros.</a>],Amazon.in: Buy ELIZABETH ARDEN GREEN TEA LOTUS FOR WOMEN 100ML Online at Best Price in India | Amazon Beauty Store,Buy ELIZABETH ARDEN GREEN TEA LOTUS FOR WOMEN 100ML at lowest price in India on Amazon.in. Check out ELIZABETH ARDEN GREEN TEA LOTUS FOR WOMEN 100ML reviews  ratings  features  specifications and browse more Beauty products online at best prices on Amazon.in.,None,<div class="bucket" id="productDescription"> <h2>Product Description</h2> <div class="content"> <h3 class="productDescriptionSource"></h3> <div class="productDescriptionWrapper">        Green Tea Lotus Elizabeth Arden for women. Green Tea Lotus was launched in 2008 as limited edition. It captures you with aroma of Asian lily  along with cherry blossom  yuzu and accords of plum. Characterized as tender  light and exotic  it greets you with plum (that symbolizes China  elegance and pureness)  cherry blossom (that reminds of transience of life and is a symbol of female beauty) and yuzu  Japanese citrus that smells similar to sweet pommel. The heart is composed of Asian lily  gracious lotus (a symbol of freedom and spiritual re-birth)  green tea and osmanthus              <div class="emptyClear"> </div> </div> </div> </div>,None,18:03:2014,None
B003YGOT2C,Elizabeth Arden Green Tea Lotus Women EDT  100ml,http://www.amazon.in/Fragrances/b/ref=sd_allcat_beauty_fragrance/276-6718833-1247838?ie=UTF8&node=1374298031,Rs. 1 465.00,Fragranc,Elizabeth Arden,Versace,http://ecx.images-amazon.com/images/I/41BRTigKBpL._AA160_.jpg,Rs. 1 465.00,self Colour,Beauty & Health,http://www.amazon.in/Elizabeth-Arden-Green-Lotus-Women/dp/B003YGOT2C/ref=sr_1_61/275-9715206-1097860?s=beauty&ie=UTF8&qid=1395126961&sr=1-61,[<a class="buyAction" href="/gp/offer-listing/B003YGOT2C/ref=dp_olp_0/275-9715206-1097860?ie=UTF8&amp;condition=all">these sellers</a>],Amazon.in: Buy Elizabeth Arden Green Tea Lotus Women EDT  100ml Online at Best Price in India | Amazon Beauty Store,Buy Elizabeth Arden Green Tea Lotus Women EDT  100ml at lowest price in India on Amazon.in. Check out Elizabeth Arden Green Tea Lotus Women EDT  100ml reviews  ratings  features  specifications and browse more Beauty products online at best prices on Amazon.in.,None,<div class="bucket" id="productDescription"> <h2>Product Description</h2> <div class="content"> <h3 class="productDescriptionSource"></h3> <div class="productDescriptionWrapper">        Elizabeth Arden ? the brand  has an uncompromising vision to create absolutely the best beauty products that not covered but benefited the feminine skin and body. Elizabeth Arden Green Tea Lotus Eau De Toilette (Women) is one such attempt to make the female skin look younger  while keeping it fresh and unharmed. Launched in 2008  as limited edition  Green Tea Lotus had the nose of Rodrigo Flores-Roux behind capturing its fragrance. This perfume blends Asian lily  cherry blossom  yuzu and fruity accords of plum to offer a fresh and reviving aroma. Tender and light  this exotic fragrance greets you with lily  gracious lotus  green tea and osmanthus at the heart. The base notes comprise of musk and white birch to contribute a sensuous  woodsy essence.              <div class="emptyClear"> </div> </div> </div> </div>,None,18:03:2014,None
B0020MM7HK,Elizabeth Arden Mediterranean Breeze EDP Spray  100ml,http://www.amazon.in/Fragrances/b/ref=sd_allcat_beauty_fragrance/276-6718833-1247838?ie=UTF8&node=1374298031,None,Fragranc,Elizabeth Arden,Versace,http://ecx.images-amazon.com/images/I/41BRTigKBpL._AA160_.jpg,None,self Colour,Beauty & Health,http://www.amazon.in/Elizabeth-Arden-Mediterranean-Breeze-Spray/dp/B0020MM7HK/ref=sr_1_63/275-9715206-1097860?s=beauty&ie=UTF8&qid=1395126961&sr=1-63,[<a href="/gp/help/seller/at-a-glance.html/275-9715206-1097860?ie=UTF8&amp;seller=A22G8HZGXYSWPZ">Taha &amp; Bros.</a>],Amazon.in: Buy Elizabeth Arden Mediterranean Breeze EDP Spray  100ml Online at Best Price in India | Amazon Beauty Store,Buy Elizabeth Arden Mediterranean Breeze EDP Spray  100ml at lowest price in India on Amazon.in. Check out Elizabeth Arden Mediterranean Breeze EDP Spray  100ml reviews  ratings  features  specifications and browse more Beauty products online at best prices on Amazon.in.,None,<div class="bucket" id="productDescription"> <h2>Product Description</h2> <div class="content"> <h3 class="productDescriptionSource"></h3> <div class="productDescriptionWrapper">        When applying any fragrance please consider that there are several factors which can affect the natural smell of your skin and in turn  the way a scent smells on you. For instance  your mood  stress level  age  body chemistry  diet and current medications may all alter the scents you wear. Similarly  factor such as dry or oily skin can even affect the amount of time a fragrance will last after being applied.              <div class="emptyClear"> </div> </div> </div> </div>,None,18:03:2014,None
B002HI54NG,Elizabeth Arden Provocative (W) Edp Spray 3.4 Oz (100 ml),http://www.amazon.in/Fragrances/b/ref=sd_allcat_beauty_fragrance/276-6718833-1247838?ie=UTF8&node=1374298031,Rs. 2 100.00,Fragranc,Elizabeth Arden,Versace,http://ecx.images-amazon.com/images/I/41BRTigKBpL._AA160_.jpg,Rs. 2 100.00,self Colour,Beauty & Health,http://www.amazon.in/Elizabeth-Arden-Provocative-Edp-Spray/dp/B002HI54NG/ref=sr_1_68/275-9715206-1097860?s=beauty&ie=UTF8&qid=1395126961&sr=1-68,[<a class="buyAction" href="/gp/offer-listing/B002HI54NG/ref=dp_olp_0/275-9715206-1097860?ie=UTF8&amp;condition=all">these sellers</a>],Elizabeth Arden Provocative (W) Edp Spray 3.4 Oz (100 ml): Amazon.in: Beauty,Elizabeth Arden Provocative (W) Edp Spray 3.4 Oz (100 ml): Amazon.in: Beauty,None,<div class="bucket" id="productDescription"> <h2>Product Description</h2> <div class="content"> <h3 class="productDescriptionSource"></h3> <div class="productDescriptionWrapper">        · Brand : Provocative (W) · Type : Eau De Toilette · For women · Sensual fragance · Long lasting fragrance · Makes you feel fresh &amp; rejuvenated · Keeps your confidence up all day long · Posesses an interesting mix of ingredients including lilies  lotus  orchids and freesia  with traces of amber and sweet woods notes · Ideal for gifting purpose ·Perfect for a very feminine ans sensual woman who loves a fragrance that inspires her to be in the mood for romance              <div class="emptyClear"> </div> </div> </div> </div>,None,18:03:2014,None
B004IWDR9W,Elizabeth Arden Pretty Perfume EDP 100ml,http://www.amazon.in/Fragrances/b/ref=sd_allcat_beauty_fragrance/276-6718833-1247838?ie=UTF8&node=1374298031,Rs. 2 100.00,Fragranc,Elizabeth Arden,Versace,http://ecx.images-amazon.com/images/I/41BRTigKBpL._AA160_.jpg,Rs. 2 100.00,self Colour,Beauty & Health,http://www.amazon.in/Elizabeth-Arden-Pretty-Perfume-100ml/dp/B004IWDR9W/ref=sr_1_67/275-9715206-1097860?s=beauty&ie=UTF8&qid=1395126961&sr=1-67,[<a class="buyAction" href="/gp/offer-listing/B004IWDR9W/ref=dp_olp_0/275-9715206-1097860?ie=UTF8&amp;condition=all">these sellers</a>],Amazon.in: Buy Elizabeth Arden Pretty Perfume EDP 100ml Online at Best Price in India | Amazon Beauty Store,Buy Elizabeth Arden Pretty Perfume EDP 100ml at lowest price in India on Amazon.in. Check out Elizabeth Arden Pretty Perfume EDP 100ml reviews  ratings  features  specifications and browse more Beauty products online at best prices on Amazon.in.,None,None,None,18:03:2014,None
B000P20QD4,ELIZABETH ARDEN PROVOCATIVE FOR WOMEN 100ML,http://www.amazon.in/Fragrances/b/ref=sd_allcat_beauty_fragrance/276-6718833-1247838?ie=UTF8&node=1374298031,Rs. 2 250.00,Fragranc,Elizabeth Arden,Versace,http://ecx.images-amazon.com/images/I/41BRTigKBpL._AA160_.jpg,Rs. 2 250.00,self Colour,Beauty & Health,http://www.amazon.in/ELIZABETH-ARDEN-PROVOCATIVE-WOMEN-100ML/dp/B000P20QD4/ref=sr_1_70/275-9715206-1097860?s=beauty&ie=UTF8&qid=1395126961&sr=1-70,[<a class="buyAction" href="/gp/offer-listing/B000P20QD4/ref=dp_olp_0/275-9715206-1097860?ie=UTF8&amp;condition=all">these sellers</a>],Amazon.in: Buy ELIZABETH ARDEN PROVOCATIVE FOR WOMEN 100ML Online at Best Price in India | Amazon Beauty Store,Buy ELIZABETH ARDEN PROVOCATIVE FOR WOMEN 100ML at lowest price in India on Amazon.in. Check out ELIZABETH ARDEN PROVOCATIVE FOR WOMEN 100ML reviews  ratings  features  specifications and browse more Beauty products online at best prices on Amazon.in.,None,<div class="bucket" id="productDescription"> <h2>Product Description</h2> <div class="content"> <h3 class="productDescriptionSource"></h3> <div class="productDescriptionWrapper">        Provocative woman Elizabeth Arden for women.Catherine Zeta-Jones' seductive walk and beauty were an inspiration to creators of this exciting and egzotic new fragrance from the house of Elizabeth Arden. Top notes include quince  water lotus  and ginger lily. Heart note is composed of midnight orchid  papaya blossom and pink freesia. Base notes are white sand notes  Hinoki wood and red amber. Provocative woman was launched in 2004. Provocative woman was created by Jean-Marc Chaillan and Loc Dong.              <div class="emptyClear"> </div> </div> </div> </div>,None,18:03:2014,None
B0009OAI1I,ELIZABETH ARDEN RED DOOR FOR WOMEN 100ML,http://www.amazon.in/Fragrances/b/ref=sd_allcat_beauty_fragrance/276-6718833-1247838?ie=UTF8&node=1374298031,None,Fragranc,Elizabeth Arden,Versace,http://ecx.images-amazon.com/images/I/41BRTigKBpL._AA160_.jpg,None,self Colour,Beauty & Health,http://www.amazon.in/ELIZABETH-ARDEN-DOOR-WOMEN-100ML/dp/B0009OAI1I/ref=sr_1_76/275-9715206-1097860?s=beauty&ie=UTF8&qid=1395126966&sr=1-76,[<a href="/gp/help/seller/at-a-glance.html/275-9715206-1097860?ie=UTF8&amp;seller=A22G8HZGXYSWPZ">Taha &amp; Bros.</a>],Amazon.in: Buy ELIZABETH ARDEN RED DOOR FOR WOMEN 100ML Online at Best Price in India | Amazon Beauty Store,Buy ELIZABETH ARDEN RED DOOR FOR WOMEN 100ML at lowest price in India on Amazon.in. Check out ELIZABETH ARDEN RED DOOR FOR WOMEN 100ML reviews  ratings  features  specifications and browse more Beauty products online at best prices on Amazon.in.,None,<div class="bucket" id="productDescription"> <h2>Product Description</h2> <div class="content"> <h3 class="productDescriptionSource"></h3> <div class="productDescriptionWrapper">        Red Door Elizabeth Arden for women. Created in1989  Red Door is a classic  elegant signature fragrance  a symbol of glamour and luxury  inspired by the famous Red Door Spa center. It opens with ylang-ylang and red rose  at its heart; orchid  jasmine  lily-of-the valley  orange blossom  wild violet and freesia. The base is composed of honey  sandalwood and vetiver. The nose behind this fragrance is Carlos Benaim.              <div class="emptyClear"> </div> </div> </div> </div>,None,18:03:2014,None
B009Q0ER1S,Elizabeth Arden Red Door Aura Eau De Toilette Spray for Women  100ml,http://www.amazon.in/Fragrances/b/ref=sd_allcat_beauty_fragrance/276-6718833-1247838?ie=UTF8&node=1374298031,None,Fragranc,Elizabeth Arden,Versace,http://ecx.images-amazon.com/images/I/41BRTigKBpL._AA160_.jpg,None,self Colour,Beauty & Health,http://www.amazon.in/Elizabeth-Arden-Toilette-Spray-Women/dp/B009Q0ER1S/ref=sr_1_74/275-9715206-1097860?s=beauty&ie=UTF8&qid=1395126966&sr=1-74,[<a href="/gp/help/seller/at-a-glance.html/275-9715206-1097860?ie=UTF8&amp;seller=A29ZFTNVZHDXBZ">Route2Fashion</a>],Amazon.in: Buy Elizabeth Arden Red Door Aura Eau De Toilette Spray for Women  100ml Online at Best Price in India | Amazon Beauty Store,Buy Elizabeth Arden Red Door Aura Eau De Toilette Spray for Women  100ml at lowest price in India on Amazon.in. Check out Elizabeth Arden Red Door Aura Eau De Toilette Spray for Women  100ml reviews  ratings  features  specifications and browse more Beauty products online at best prices on Amazon.in.,None,<div class="bucket" id="productDescription"> <h2>Product Description</h2> <div class="content"> <h3 class="productDescriptionSource"></h3> <div class="productDescriptionWrapper">        Introducing Red Door Aura  the vibrant new floral fragrance inspired by our luxurious classic Red Door. It takes a master perfumer to create a fragrance this luminous and sparkling while maintaining the elegant sensuality of our famous Red Door scent.              <div class="emptyClear"> </div> </div> </div> </div>,None,18:03:2014,None
B000C1Z4V2,Elizabeth Arden Red Door Revealed for Women  100ml,http://www.amazon.in/Fragrances/b/ref=sd_allcat_beauty_fragrance/276-6718833-1247838?ie=UTF8&node=1374298031,None,Fragranc,Elizabeth Arden,Versace,http://ecx.images-amazon.com/images/I/41BRTigKBpL._AA160_.jpg,None,self Colour,Beauty & Health,http://www.amazon.in/Elizabeth-Arden-Revealed-Women-100ml/dp/B000C1Z4V2/ref=sr_1_77/275-9715206-1097860?s=beauty&ie=UTF8&qid=1395126966&sr=1-77,[<a href="/gp/help/seller/at-a-glance.html/275-9715206-1097860?ie=UTF8&amp;seller=A2NFQIUV2YGOLG">Fragume</a>],Amazon.in: Buy Elizabeth Arden Red Door Revealed for Women  100ml Online at Best Price in India | Amazon Beauty Store,Buy Elizabeth Arden Red Door Revealed for Women  100ml at lowest price in India on Amazon.in. Check out Elizabeth Arden Red Door Revealed for Women  100ml reviews  ratings  features  specifications and browse more Beauty products online at best prices on Amazon.in.,None,<div class="bucket" id="productDescription"> <h2>Product Description</h2> <div class="content"> <h3 class="productDescriptionSource"></h3> <div class="productDescriptionWrapper">        Design House: Elizabeth Arden  Year Introduced: 2003  Recommended Use: Romantic  Recommended Use: Romantic              <div class="emptyClear"> </div> </div> </div> </div>,None,18:03:2014,None
B001KBYDCE,Elizabeth Arden Sunflowers Eau De Toilette Spray Tester for Women  100ml,http://www.amazon.in/Fragrances/b/ref=sd_allcat_beauty_fragrance/276-6718833-1247838?ie=UTF8&node=1374298031,Rs. 1 649.00,Fragranc,Elizabeth Arden,Versace,http://ecx.images-amazon.com/images/I/41BRTigKBpL._AA160_.jpg,Rs. 1 649.00,self Colour,Beauty & Health,http://www.amazon.in/Elizabeth-Arden-Sunflowers-Toilette-Tester/dp/B001KBYDCE/ref=sr_1_79/275-9715206-1097860?s=beauty&ie=UTF8&qid=1395126966&sr=1-79,[<a class="buyAction" href="/gp/offer-listing/B001KBYDCE/ref=dp_olp_0/275-9715206-1097860?ie=UTF8&amp;condition=all">these sellers</a>],Amazon.in: Buy Elizabeth Arden Sunflowers Eau De Toilette Spray Tester for Women  100ml Online at Best Price in India | Amazon Beauty Store,Buy Elizabeth Arden Sunflowers Eau De Toilette Spray Tester for Women  100ml at lowest price in India on Amazon.in. Check out Elizabeth Arden Sunflowers Eau De Toilette Spray Tester for Women  100ml reviews  ratings  features  specifications and browse more Beauty products online at best prices on Amazon.in.,None,<div class="bucket" id="productDescription"> <h2>Product Description</h2> <div class="content"> <h3 class="productDescriptionSource"></h3> <div class="productDescriptionWrapper">        Launched by the design house of Elizabeth Arden in 1993  Sunflowers by Elizabeth Arden possesses a blend of rose  cedar  lemon  musk  moss  amber  mandarin and jasmine. It is recommended for evening wear. What is a Tester? A Tester is a perfume with no fancy packaging but with the same exact fragrance at an even better price. They are just like the one used to test the perfume in a department store but supplied in a plain box and often have the word tester printed on the bottle. Sometimes they do not come with a cap or box. These items are great for personal use but may not be great as gifts. Our testers are new unopened and have never been sprayed (Testers and unboxed product are exactly the same as the regular perfume  except testers usually come in a plain box--with or without a cap. Unboxed products are the perfume or bath product  only without the box.)              <div class="emptyClear"> </div> </div> </div> </div>,None,18:03:2014,None
B0009OAISQ,Elizabeth Arden True Love EDT for Women  100ml,http://www.amazon.in/Fragrances/b/ref=sd_allcat_beauty_fragrance/276-6718833-1247838?ie=UTF8&node=1374298031,None,Fragranc,Elizabeth Arden,Versace,http://ecx.images-amazon.com/images/I/41BRTigKBpL._AA160_.jpg,None,self Colour,Beauty & Health,http://www.amazon.in/Elizabeth-Arden-True-Women-100ml/dp/B0009OAISQ/ref=sr_1_82/275-9715206-1097860?s=beauty&ie=UTF8&qid=1395126966&sr=1-82,[<a href="/gp/help/seller/at-a-glance.html/275-9715206-1097860?ie=UTF8&amp;seller=A2NFQIUV2YGOLG">Fragume</a>],Amazon.in: Buy Elizabeth Arden True Love EDT for Women  100ml Online at Best Price in India | Amazon Beauty Store,Buy Elizabeth Arden True Love EDT for Women  100ml at lowest price in India on Amazon.in. Check out Elizabeth Arden True Love EDT for Women  100ml reviews  ratings  features  specifications and browse more Beauty products online at best prices on Amazon.in.,None,<div class="bucket" id="productDescription"> <h2>Product Description</h2> <div class="content"> <h3 class="productDescriptionSource"></h3> <div class="productDescriptionWrapper">        Design House: Elizabeth Arden  Year Introduced: 1994  Recommended Use: Daytime  Recommended Use: Daytime              <div class="emptyClear"> </div> </div> </div> </div>,None,18:03:2014,None
B00AN66BU4,FIFTH AVENUE STYLE by Elizabeth Arden EAU DE PARFUM SPRAY 4.2 OZ,http://www.amazon.in/Fragrances/b/ref=sd_allcat_beauty_fragrance/276-6718833-1247838?ie=UTF8&node=1374298031,Rs. 2 030.00,Fragranc,Elizabeth Arden,Versace,http://ecx.images-amazon.com/images/I/41BRTigKBpL._AA160_.jpg,Rs. 2 030.00,self Colour,Beauty & Health,http://www.amazon.in/FIFTH-AVENUE-Elizabeth-Arden-PARFUM/dp/B00AN66BU4/ref=sr_1_85/275-9715206-1097860?s=beauty&ie=UTF8&qid=1395126966&sr=1-85,[<a class="buyAction" href="/gp/offer-listing/B00AN66BU4/ref=dp_olp_0/275-9715206-1097860?ie=UTF8&amp;condition=all">these sellers</a>],Amazon.in: Buy FIFTH AVENUE STYLE by Elizabeth Arden EAU DE PARFUM SPRAY 4.2 OZ Online at Best Price in India | Amazon Beauty Store,Buy FIFTH AVENUE STYLE by Elizabeth Arden EAU DE PARFUM SPRAY 4.2 OZ at lowest price in India on Amazon.in. Check out FIFTH AVENUE STYLE by Elizabeth Arden EAU DE PARFUM SPRAY 4.2 OZ reviews  ratings  features  specifications and browse more Beauty products online at best prices on Amazon.in.,None,None,None,18:03:2014,None
B00AC2L4CE,Green Tea Summer Elizabeth Arden for women 100ml,http://www.amazon.in/Fragrances/b/ref=sd_allcat_beauty_fragrance/276-6718833-1247838?ie=UTF8&node=1374298031,None,Fragranc,Elizabeth Arden,Versace,http://ecx.images-amazon.com/images/I/41BRTigKBpL._AA160_.jpg,None,self Colour,Beauty & Health,http://www.amazon.in/Green-Summer-Elizabeth-Arden-women/dp/B00AC2L4CE/ref=sr_1_108/275-9715206-1097860?s=beauty&ie=UTF8&qid=1395126975&sr=1-108,[<a href="/gp/help/seller/at-a-glance.html/275-9715206-1097860?ie=UTF8&amp;seller=A29ZFTNVZHDXBZ">Route2Fashion</a>],Amazon.in: Buy Green Tea Summer Elizabeth Arden for women 100ml Online at Best Price in India | Amazon Beauty Store,Buy Green Tea Summer Elizabeth Arden for women 100ml at lowest price in India on Amazon.in. Check out Green Tea Summer Elizabeth Arden for women 100ml reviews  ratings  features  specifications and browse more Beauty products online at best prices on Amazon.in.,None,<div class="bucket" id="productDescription"> <h2>Product Description</h2> <div class="content"> <h3 class="productDescriptionSource"></h3> <div class="productDescriptionWrapper">        Green Tea Summer Elizabeth Arden for women.Green Tea Summer by Elizabeth Arden is a Floral Fruity fragrance for women. Green Tea Summer was launched in 2005. Green Tea Summer was created by Rodrigo Flores-Roux and Claude Dir. Top notes are black currant  bergamot  tangerine and lemon; middle notes are cyclamen  passionfruit  water lily  watermelon and rose; base notes are musk  oakmoss and white amber.              <div class="emptyClear"> </div> </div> </div> </div>,None,18:03:2014,None
B00BGEWKFM,Red Door By Elizabeth Arden For Women Eau De Toilette Spray 3.3 Oz,http://www.amazon.in/Fragrances/b/ref=sd_allcat_beauty_fragrance/276-6718833-1247838?ie=UTF8&node=1374298031,Rs. 2 710.00,Fragranc,Elizabeth Arden,Versace,http://ecx.images-amazon.com/images/I/41BRTigKBpL._AA160_.jpg,Rs. 2 710.00,self Colour,Beauty & Health,http://www.amazon.in/Elizabeth-Arden-Women-Toilette-Spray/dp/B00BGEWKFM/ref=sr_1_120/275-9715206-1097860?s=beauty&ie=UTF8&qid=1395126975&sr=1-120,[<a class="buyAction" href="/gp/offer-listing/B00BGEWKFM/ref=dp_olp_0/275-9715206-1097860?ie=UTF8&amp;condition=all">these sellers</a>],Amazon.in: Buy Red Door By Elizabeth Arden For Women Eau De Toilette Spray 3.3 Oz Online at Best Price in India | Amazon Beauty Store,Buy Red Door By Elizabeth Arden For Women Eau De Toilette Spray 3.3 Oz at lowest price in India on Amazon.in. Check out Red Door By Elizabeth Arden For Women Eau De Toilette Spray 3.3 Oz reviews  ratings  features  specifications and browse more Beauty products online at best prices on Amazon.in.,None,None,None,18:03:2014,None
B000C1W6UE,RED JEANS VERSACE FOR WOMEN 75ML,http://www.amazon.in/Fragrances/b/ref=sd_allcat_beauty_fragrance/276-6718833-1247838?ie=UTF8&node=1374298031,Rs. 2 000.00,Fragranc,Elizabeth Arden,Versace,http://ecx.images-amazon.com/images/I/41BRTigKBpL._AA160_.jpg,Rs. 2 000.00,self Colour,Beauty & Health,http://www.amazon.in/RED-JEANS-VERSACE-WOMEN-75ML/dp/B000C1W6UE/ref=sr_1_127/275-9715206-1097860?s=beauty&ie=UTF8&qid=1395126980&sr=1-127,[<a class="buyAction" href="/gp/offer-listing/B000C1W6UE/ref=dp_olp_0/275-9715206-1097860?ie=UTF8&amp;condition=all">these sellers</a>],Amazon.in: Buy RED JEANS VERSACE FOR WOMEN 75ML Online at Best Price in India | Amazon Beauty Store,Buy RED JEANS VERSACE FOR WOMEN 75ML at lowest price in India on Amazon.in. Check out RED JEANS VERSACE FOR WOMEN 75ML reviews  ratings  features  specifications and browse more Beauty products online at best prices on Amazon.in.,None,<div class="bucket" id="productDescription"> <h2>Product Description</h2> <div class="content"> <h3 class="productDescriptionSource"></h3> <div class="productDescriptionWrapper">        Red Jeans Versace for women.This is a fruity-floral  described as sweet and casual  ment for the young and young-at-heart. Top notes are peach  apricot  freesia  blackcurrant.In the heart note  lily-of-the-valley  violet  water lily and rose. The base is composed of sandalwood  musk and vanilla. Red Jeans was created in 1994.              <div class="emptyClear"> </div> </div> </div> </div>,None,18:03:2014,None
B000S354CS,Splendor By Elizabeth Arden Womens Eau De Parfum (EDP) Spray 4.2 Oz,http://www.amazon.in/Fragrances/b/ref=sd_allcat_beauty_fragrance/276-6718833-1247838?ie=UTF8&node=1374298031,Rs. 1 995.00,Fragranc,Elizabeth Arden,Versace,http://ecx.images-amazon.com/images/I/41BRTigKBpL._AA160_.jpg,Rs. 1 995.00,self Colour,Beauty & Health,http://www.amazon.in/Splendor-Elizabeth-Arden-Womens-Parfum/dp/B000S354CS/ref=sr_1_130/275-9715206-1097860?s=beauty&ie=UTF8&qid=1395126980&sr=1-130,[<a class="buyAction" href="/gp/offer-listing/B000S354CS/ref=dp_olp_0/275-9715206-1097860?ie=UTF8&amp;condition=all">these sellers</a>],Amazon.in: Buy Splendor By Elizabeth Arden Womens Eau De Parfum (EDP) Spray 4.2 Oz Online at Best Price in India | Amazon Beauty Store,Buy Splendor By Elizabeth Arden Womens Eau De Parfum (EDP) Spray 4.2 Oz at lowest price in India on Amazon.in. Check out Splendor By Elizabeth Arden Womens Eau De Parfum (EDP) Spray 4.2 Oz reviews  ratings  features  specifications and browse more Beauty products online at best prices on Amazon.in.,None,None,None,18:03:2014,None
B000C1Z4VM,Splendor Elizabeth Arden for women 100ml,http://www.amazon.in/Fragrances/b/ref=sd_allcat_beauty_fragrance/276-6718833-1247838?ie=UTF8&node=1374298031,None,Fragranc,Elizabeth Arden,Versace,http://ecx.images-amazon.com/images/I/41BRTigKBpL._AA160_.jpg,None,self Colour,Beauty & Health,http://www.amazon.in/Splendor-Elizabeth-Arden-women-100ml/dp/B000C1Z4VM/ref=sr_1_131/275-9715206-1097860?s=beauty&ie=UTF8&qid=1395126980&sr=1-131,[<a href="/gp/help/seller/at-a-glance.html/275-9715206-1097860?ie=UTF8&amp;seller=A2NFQIUV2YGOLG">Fragume</a>],Amazon.in: Buy Splendor Elizabeth Arden for women 100ml Online at Best Price in India | Amazon Beauty Store,Buy Splendor Elizabeth Arden for women 100ml at lowest price in India on Amazon.in. Check out Splendor Elizabeth Arden for women 100ml reviews  ratings  features  specifications and browse more Beauty products online at best prices on Amazon.in.,None,<div class="bucket" id="productDescription"> <h2>Product Description</h2> <div class="content"> <h3 class="productDescriptionSource"></h3> <div class="productDescriptionWrapper">        Splendor Elizabeth Arden for women. Splendor by Elizabeth Arden is a Oriental Floral fragrance for women. Splendor was launched in 1998. The nose behind this fragrance is James Krivda. Top notes are pineapple  wisteria  freesia  peony  hiacynth  apple  sweet pea and bergamot; middle notes are magnolia  tea rose  lily  poppy  orchid  jasmine  lily-of-the-valley and rose; base notes are sandalwood  amber  dark woodsy notes  musk  cedar and brazilian rosewood.              <div class="emptyClear"> </div> </div> </div> </div>,None,18:03:2014,None
