B000YIGYSU,Herbatint Hair Color 4 Fluid Ounce,http://www.amazon.in/Hair-Care-Styling/b/ref=sd_allcat_beauty_haircare/276-6718833-1247838?ie=UTF8&node=1374305031,Rs. 1 810.00,Hair Care & Stylin,Hair Colour,Herbatint,http://ecx.images-amazon.com/images/I/51jwHt91sVL._AA160_.jpg,Rs. 1 810.00,Herbatint Hair Color 4 Fluid Ounce,Beauty & Health,http://www.amazon.in/Herbatint-Color-Swedish-Blonde-Fluid/dp/B000YIGYSU/ref=sr_1_7/279-7941336-1191315?s=beauty&ie=UTF8&qid=1395127104&sr=1-7,[<a class="buyAction" href="/gp/offer-listing/B000YIGYSU/ref=dp_olp_0/279-7941336-1191315?ie=UTF8&amp;condition=all">these sellers</a>],Amazon.in: Buy Herbatint Hair Color  10C Swedish Blonde  4 Fluid Ounce Online at Best Price in India | Amazon Beauty Store,Buy Herbatint Hair Color  10C Swedish Blonde  4 Fluid Ounce at lowest price in India on Amazon.in. Check out Herbatint Hair Color  10C Swedish Blonde  4 Fluid Ounce reviews  ratings  features  specifications and browse more Beauty products online at best prices on Amazon.in.,None,<div class="bucket" id="productDescription"> <h2>Product Description</h2> <div class="disclaim">Colour: <strong>Swedish Blonde</strong></div> <div class="content"> <h3 class="productDescriptionSource"></h3> <div class="productDescriptionWrapper">        Herbatint Has Been Formulated Using The Minimum Pharmaceutical Chemical Ingredients Which  Balanced With Vegetal Extracts From Natural Herbs Creates A Unique Hair Color Formula That Not Only Gently Colors Your Hair But Gives It A Natural Look.              <div class="emptyClear"> </div> </div> </div> </div>,None,18:03:2014,None
B0007V6L4Q,Herbatint 6D Dark Golden Blonde 4.50 Ounces,http://www.amazon.in/Hair-Care-Styling/b/ref=sd_allcat_beauty_haircare/276-6718833-1247838?ie=UTF8&node=1374305031,Rs. 1 725.00,Hair Care & Stylin,Hair Colour,Herbatint,http://ecx.images-amazon.com/images/I/51jwHt91sVL._AA160_.jpg,Rs. 1 725.00,self Colour,Beauty & Health,http://www.amazon.in/Herbatint-Dark-Golden-Blonde-Ounces/dp/B0007V6L4Q/ref=sr_1_3/279-7941336-1191315?s=beauty&ie=UTF8&qid=1395127104&sr=1-3,[<a class="buyAction" href="/gp/offer-listing/B0007V6L4Q/ref=dp_olp_0/279-7941336-1191315?ie=UTF8&amp;condition=all">these sellers</a>],Amazon.in: Buy Herbatint 6D Dark Golden Blonde 4.50 Ounces Online at Best Price in India | Amazon Beauty Store,Buy Herbatint 6D Dark Golden Blonde 4.50 Ounces at lowest price in India on Amazon.in. Check out Herbatint 6D Dark Golden Blonde 4.50 Ounces reviews  ratings  features  specifications and browse more Beauty products online at best prices on Amazon.in.,None,<div class="bucket" id="productDescription"> <h2>Product Description</h2> <div class="content"> <h3 class="productDescriptionSource"></h3> <div class="productDescriptionWrapper">        Herbatint-6D Dark Gold Blonde By Herbavita 4.5 Oz Liquid Herbavita Colours Are Available In Both Temporary And Permanent Shades.Herbatint The Permanent Colouring Will Stay In Your Hair Until Youchoose To Let It Grow Out. Herbatint Is Ideal For Covering Grey Hair And The Wide Variety Of Colours Means You Will Certainly Find Yournatural Shade Amongst Our Range. Click Here To View The Available Colours And Click Here To Find Out Which Colours Are Best For Your Hair And Some Extra Colouring Tips. Herbatint Is Our Leading Product And Is The Most Natural Permanent Haircolour Existing On The Market Today. The New Range Of Herbatint Colours Now Being Introduced All Come With Added Aloe Vera And No Ammonia Resorcinol Or Paraben - And Still Only 3 Peroxide. The Herbal Based Formula Comes In The Herbal Based Formula Comes In 30 Exciting Colours Including The 6 Flash Fashion Colours. Herbatint Mixes Into A Gel And Is Applied To Regrowthwith A Brush. For People With Short Hair It Allows Two Applic              <div class="emptyClear"> </div> </div> </div> </div>,None,18:03:2014,None
B00142AD2I,Herbatint Flash Fashion Violet 4.16 Ounces,http://www.amazon.in/Hair-Care-Styling/b/ref=sd_allcat_beauty_haircare/276-6718833-1247838?ie=UTF8&node=1374305031,Rs. 2 086.00,Hair Care & Stylin,Hair Colour,Herbatint,http://ecx.images-amazon.com/images/I/51jwHt91sVL._AA160_.jpg,Rs. 2 086.00,self Colour,Beauty & Health,http://www.amazon.in/Herbatint-Flash-Fashion-Violet-Ounces/dp/B00142AD2I/ref=sr_1_5/279-7941336-1191315?s=beauty&ie=UTF8&qid=1395127104&sr=1-5,[<a class="buyAction" href="/gp/offer-listing/B00142AD2I/ref=dp_olp_0/279-7941336-1191315?ie=UTF8&amp;condition=all">these sellers</a>],Amazon.in: Buy Herbatint Flash Fashion Violet 4.16 Ounces Online at Best Price in India | Amazon Beauty Store,Buy Herbatint Flash Fashion Violet 4.16 Ounces at lowest price in India on Amazon.in. Check out Herbatint Flash Fashion Violet 4.16 Ounces reviews  ratings  features  specifications and browse more Beauty products online at best prices on Amazon.in.,None,<div class="bucket" id="productDescription"> <h2>Product Description</h2> <div class="content"> <h3 class="productDescriptionSource"></h3> <div class="productDescriptionWrapper">        Herbatint Flash Fashion Violet              <div class="emptyClear"> </div> </div> </div> </div>,None,18:03:2014,None
B000M4EMZ8,Herbatint Vegetal Black 1 Kit,http://www.amazon.in/Hair-Care-Styling/b/ref=sd_allcat_beauty_haircare/276-6718833-1247838?ie=UTF8&node=1374305031,Rs. 1 775.00,Hair Care & Stylin,Hair Colour,Herbatint,http://ecx.images-amazon.com/images/I/51jwHt91sVL._AA160_.jpg,Rs. 1 775.00,self Colour,Beauty & Health,http://www.amazon.in/Herbatint-Vegetal-Black-1-Kit/dp/B000M4EMZ8/ref=sr_1_9/279-7941336-1191315?s=beauty&ie=UTF8&qid=1395127104&sr=1-9,[<a class="buyAction" href="/gp/offer-listing/B000M4EMZ8/ref=dp_olp_0/279-7941336-1191315?ie=UTF8&amp;condition=all">these sellers</a>],Amazon.in: Buy Herbatint Vegetal Black 1 Kit Online at Best Price in India | Amazon Beauty Store,Buy Herbatint Vegetal Black 1 Kit at lowest price in India on Amazon.in. Check out Herbatint Vegetal Black 1 Kit reviews  ratings  features  specifications and browse more Beauty products online at best prices on Amazon.in.,None,<div class="bucket" id="productDescription"> <h2>Product Description</h2> <div class="content"> <h3 class="productDescriptionSource"></h3> <div class="productDescriptionWrapper">        Vegetal Color Is A Semi Permanent Colorant That Contains No Ammonia  Peroxide Or Diaminobenzene. It Is Easy To Use. Apply Directly To Hair Without Mixing. The Color Washes Out Gradually. Vegetal Was Specially Formulated To Add Highlights To Your Hair And Allows You To Refresh Color Tones Between Permanent Hair Colorings. It Will Not Lighten Your Hair  And It Will Not Cover Gray.              <div class="emptyClear"> </div> </div> </div> </div>,None,18:03:2014,None
B000MF2934,Herbatint Vegetal Hair Color 4 Fluid Ounce,http://www.amazon.in/Hair-Care-Styling/b/ref=sd_allcat_beauty_haircare/276-6718833-1247838?ie=UTF8&node=1374305031,Rs. 1 775.00,Hair Care & Stylin,Hair Colour,Herbatint,http://ecx.images-amazon.com/images/I/51jwHt91sVL._AA160_.jpg,Rs. 1 775.00,Herbatint Vegetal Hair Color 4 Fluid Ounce,Beauty & Health,http://www.amazon.in/Herbatint-Vegetal-Color-Blonde-Fluid/dp/B000MF2934/ref=sr_1_10/279-7941336-1191315?s=beauty&ie=UTF8&qid=1395127104&sr=1-10,[<a class="buyAction" href="/gp/offer-listing/B000MF2934/ref=dp_olp_0/279-7941336-1191315?ie=UTF8&amp;condition=all">these sellers</a>],Amazon.in: Buy Herbatint Vegetal Hair Color  Ash Blonde  4 Fluid Ounce Online at Best Price in India | Amazon Beauty Store,Buy Herbatint Vegetal Hair Color  Ash Blonde  4 Fluid Ounce at lowest price in India on Amazon.in. Check out Herbatint Vegetal Hair Color  Ash Blonde  4 Fluid Ounce reviews  ratings  features  specifications and browse more Beauty products online at best prices on Amazon.in.,None,<div class="bucket" id="productDescription"> <h2>Product Description</h2> <div class="disclaim">Colour: <strong>Ash Blonde</strong></div> <div class="content"> <h3 class="productDescriptionSource"></h3> <div class="productDescriptionWrapper">        Non-Permanent  Ammonia-Free  Alcohol-Free Formula Contains No Ppd Or Peroxide. Specially Formulated From Herb Extracts  Herbatint Uses Rosemary  Cinchona And Walnut Husk  To Gently Deposit Color  Achieving A Natural  Vibrant Result For Your Hair.              <div class="emptyClear"> </div> </div> </div> </div>,None,18:03:2014,None
B000M4EDEI,Herbatint Hair Color Kit Flash Fashion Orange Ff6 - 1 Kit,http://www.amazon.in/Hair-Care-Styling/b/ref=sd_allcat_beauty_haircare/276-6718833-1247838?ie=UTF8&node=1374305031,Rs. 2 086.00,Hair Care & Stylin,Hair Colour,Herbatint,http://ecx.images-amazon.com/images/I/51jwHt91sVL._AA160_.jpg,Rs. 2 086.00,Herbatint Hair Color Kit Flash Fashion Orange Ff6 - 1 Kit,Beauty & Health,http://www.amazon.in/Herbatint-Color-Flash-Fashion-Orange/dp/B000M4EDEI/ref=sr_1_6/279-7941336-1191315?s=beauty&ie=UTF8&qid=1395127104&sr=1-6,[<a class="buyAction" href="/gp/offer-listing/B000M4EDEI/ref=dp_olp_0/279-7941336-1191315?ie=UTF8&amp;condition=all">these sellers</a>],Amazon.in: Buy Herbatint Hair Color Kit Flash Fashion Orange Ff6 - 1 Kit Online at Best Price in India | Amazon Beauty Store,Buy Herbatint Hair Color Kit Flash Fashion Orange Ff6 - 1 Kit at lowest price in India on Amazon.in. Check out Herbatint Hair Color Kit Flash Fashion Orange Ff6 - 1 Kit reviews  ratings  features  specifications and browse more Beauty products online at best prices on Amazon.in.,None,<div class="bucket" id="productDescription"> <h2>Product Description</h2> <div class="content"> <h3 class="productDescriptionSource"></h3> <div class="productDescriptionWrapper">        Herbatint - Natural Herb Baseherbatint Has Been Formulated Using The Minimum Pharmaceutical Chemical Ingredients Which  Balanced With Vegetal Extracts From Plants And Herbs Creates A Unique Hair Colour Formula That Not Only Gently Colours Your Hair But Protects And Nourishes It.No Ammoniaspecially Formulated From Herb Extracts And Proteins  Herbatint Uses Rosemary  Cinchona And Walnut Husk  To Gently Deposit Colour  Achieving A Natural  Vibrant Result For Your Hair.No Damagedue To Its Unique Composition  Herbatint Permanently Colours Hair Without Damage - Resulting In A Natural  Subtle Colour That Not Only Looks Great  But Feels Good Time After Time.Natural Gloss And Shineherbatint Has A Natural Translucent Property To Enhance Your Hair With A Light-Reflecting  Healthy Shine; So It Doesn'T Create The 'Block Colour' Look Often Associated With Chemical Colourants.Vegetal Hair Coloura Range Of True Semi-Permanent Hair Colours. These Colours Enhance The Shine And Clarity Of Your Natural Hair Colour Whilst Greatly Improving The Condition Of The Hair. Vegetal Hair Colour Will Not Do More Than Mask Any But The Earliest Few White Hairs.              <div class="emptyClear"> </div> </div> </div> </div>,None,18:03:2014,None
