B00F41TTMK,Salar Cushion Cover Digital Print Pink And White Floral,http://www.amazon.in/Cushions-Cushion-Covers/b/ref=sd_allcat_cushions?ie=UTF8&node=1380469031,None,Cushions & Cushion Cover,Cushions & Cushion Cover,Salar,http://ecx.images-amazon.com/images/I/31B3j1cQ0YL._AA160_.jpg,Rs. 650.00,self Colour,Home & Kitchen,http://www.amazon.in/Salar-Cushion-Cover-Digital-Print/dp/B00F41TTMK/ref=sr_1_34/279-8772023-7637911?s=kitchen&ie=UTF8&qid=1395127021&sr=1-34,[<a href="/gp/help/seller/at-a-glance.html/279-8772023-7637911?ie=UTF8&amp;seller=A03351651F3J1X5WAZNU1">Zansaar</a>],Salar Cushion Cover Digital Print Pink And White Floral: Amazon.in: Home & Kitchen,Salar Cushion Cover Digital Print Pink And White Floral: Amazon.in: Home & Kitchen,None,<div class="bucket" id="productDescription"> <h2>Product Description</h2> <div class="content"> <h3 class="productDescriptionSource"></h3> <div class="productDescriptionWrapper">        Bring a refreshing floral charm to your living room with this digital print cushion cover. Made of cotton  it promises comfort and easy style. The bright  life-like flowers in vivid pinks and white  create a dynamic energy in the room  with the pleasant visual appeal of floral prints. An exclusive in-house design  it adds a distinctive touch to your decor.               <div class="emptyClear"> </div> </div> </div> </div>,None,18:03:2014,None
B00F41X8SG,Salar Cushion Cover With Filler Round Burgundy,http://www.amazon.in/Cushions-Cushion-Covers/b/ref=sd_allcat_cushions?ie=UTF8&node=1380469031,None,Cushions & Cushion Cover,Cushions & Cushion Cover,Salar,http://ecx.images-amazon.com/images/I/31B3j1cQ0YL._AA160_.jpg,Rs. 1 900.00,self Colour,Home & Kitchen,http://www.amazon.in/Salar-Cushion-Filler-Round-Burgundy/dp/B00F41X8SG/ref=sr_1_45/279-8772023-7637911?s=kitchen&ie=UTF8&qid=1395127021&sr=1-45,[<a href="/gp/help/seller/at-a-glance.html/279-8772023-7637911?ie=UTF8&amp;seller=A03351651F3J1X5WAZNU1">Zansaar</a>],Salar Cushion Cover With Filler Round Burgundy: Amazon.in: Home & Kitchen,Salar Cushion Cover With Filler Round Burgundy: Amazon.in: Home & Kitchen,None,<div class="bucket" id="productDescription"> <h2>Product Description</h2> <div class="content"> <h3 class="productDescriptionSource"></h3> <div class="productDescriptionWrapper">        Bring a touch of whimsical style to your sofa set with this round cushion cover. The pattern of rings in burgundy and white creates an interesting bulls-eye effect that makes this a unique accent for your decor.              <div class="emptyClear"> </div> </div> </div> </div>,None,18:03:2014,None
B00FF7VGGK,Salar Cushion Cover Reversible Purple 30 X 46 Cm,http://www.amazon.in/Cushions-Cushion-Covers/b/ref=sd_allcat_cushions?ie=UTF8&node=1380469031,None,Cushions & Cushion Cover,Cushions & Cushion Cover,Salar,http://ecx.images-amazon.com/images/I/31B3j1cQ0YL._AA160_.jpg,Rs. 1 060.00,self Colour,Home & Kitchen,http://www.amazon.in/Salar-Cushion-Cover-Reversible-Purple/dp/B00FF7VGGK/ref=sr_1_44/279-8772023-7637911?s=kitchen&ie=UTF8&qid=1395127021&sr=1-44,[<a href="/gp/help/seller/at-a-glance.html/279-8772023-7637911?ie=UTF8&amp;seller=A03351651F3J1X5WAZNU1">Zansaar</a>],Salar Cushion Cover Reversible Purple 30 X 46 Cm: Amazon.in: Home & Kitchen,Salar Cushion Cover Reversible Purple 30 X 46 Cm: Amazon.in: Home & Kitchen,None,<div class="bucket" id="productDescription"> <h2>Product Description</h2> <div class="content"> <h3 class="productDescriptionSource"></h3> <div class="productDescriptionWrapper">        Make your living room look brand new with unique rectangular cushions. This cushion cover is pre-crinkled to create an attractive ruched effect and is reversible; flip between regal purple and luxuriant lavender to suit your moods. The 100% polyester fabric makes maintenance a hassle-free experience.  Use/Care:Machine washableDo not bleachDo not iron               <div class="emptyClear"> </div> </div> </div> </div>,None,18:03:2014,None
B00F41Y8U8,Salar Cushion Cover Metallic Suede Leather Purple,http://www.amazon.in/Cushions-Cushion-Covers/b/ref=sd_allcat_cushions?ie=UTF8&node=1380469031,None,Cushions & Cushion Cover,Cushions & Cushion Cover,Salar,http://ecx.images-amazon.com/images/I/31B3j1cQ0YL._AA160_.jpg,Rs. 1 215.00,self Colour,Home & Kitchen,http://www.amazon.in/Salar-Cushion-Metallic-Leather-Purple/dp/B00F41Y8U8/ref=sr_1_42/279-8772023-7637911?s=kitchen&ie=UTF8&qid=1395127021&sr=1-42,[<a href="/gp/help/seller/at-a-glance.html/279-8772023-7637911?ie=UTF8&amp;seller=A03351651F3J1X5WAZNU1">Zansaar</a>],Salar Cushion Cover Metallic Suede Leather Purple: Amazon.in: Home & Kitchen,Salar Cushion Cover Metallic Suede Leather Purple: Amazon.in: Home & Kitchen,None,<div class="bucket" id="productDescription"> <h2>Product Description</h2> <div class="content"> <h3 class="productDescriptionSource"></h3> <div class="productDescriptionWrapper">        A little bit of disco fever never hurt anybody. Bring back the charm of that lively era with this vibrant purple cushion cover. Made from comfortable leather  with an eye-catching metallic finish  it adds a touch of glitz and glam to your decor.              <div class="emptyClear"> </div> </div> </div> </div>,None,18:03:2014,None
B00F41YHBS,Salar Cushion Cover Digital Print Bird On Branch 2-Piece Set,http://www.amazon.in/Cushions-Cushion-Covers/b/ref=sd_allcat_cushions?ie=UTF8&node=1380469031,None,Cushions & Cushion Cover,Cushions & Cushion Cover,Salar,http://ecx.images-amazon.com/images/I/31B3j1cQ0YL._AA160_.jpg,Rs. 545.00,self Colour,Home & Kitchen,http://www.amazon.in/Salar-Cushion-Digital-Bird-Branch/dp/B00F41YHBS/ref=sr_1_2/280-0483197-3561341?s=kitchen&ie=UTF8&qid=1395127037&sr=1-2,[<a href="/gp/help/seller/at-a-glance.html/280-0483197-3561341?ie=UTF8&amp;seller=A03351651F3J1X5WAZNU1">Zansaar</a>],Salar Cushion Cover Digital Print Bird On Branch 2-Piece Set: Amazon.in: Home & Kitchen,Salar Cushion Cover Digital Print Bird On Branch 2-Piece Set: Amazon.in: Home & Kitchen,None,<div class="bucket" id="productDescription"> <h2>Product Description</h2> <div class="content"> <h3 class="productDescriptionSource"></h3> <div class="productDescriptionWrapper">        These cushion covers will be a delightful addition to your living room  especially if you love birds. The snapshot on the covers will transport you from the humdrum of urban living to the tranquility of nature. Made of cotton  the cushion covers are equipped with a zipper to facilitate removal.              <div class="emptyClear"> </div> </div> </div> </div>,None,18:03:2014,None
B00F41T6PA,Salar Cushion Cover Digital Print Birds In Paris 2-Piece Set,http://www.amazon.in/Cushions-Cushion-Covers/b/ref=sd_allcat_cushions?ie=UTF8&node=1380469031,None,Cushions & Cushion Cover,Cushions & Cushion Cover,Salar,http://ecx.images-amazon.com/images/I/31B3j1cQ0YL._AA160_.jpg,Rs. 645.00,self Colour,Home & Kitchen,http://www.amazon.in/Salar-Cushion-Cover-Digital-2-Piece/dp/B00F41T6PA/ref=sr_1_1/280-0483197-3561341?s=kitchen&ie=UTF8&qid=1395127037&sr=1-1,[<a href="/gp/help/seller/at-a-glance.html/280-0483197-3561341?ie=UTF8&amp;seller=A03351651F3J1X5WAZNU1">Zansaar</a>],Salar Cushion Cover Digital Print Birds In Paris 2-Piece Set: Amazon.in: Home & Kitchen,Salar Cushion Cover Digital Print Birds In Paris 2-Piece Set: Amazon.in: Home & Kitchen,None,<div class="bucket" id="productDescription"> <h2>Product Description</h2> <div class="content"> <h3 class="productDescriptionSource"></h3> <div class="productDescriptionWrapper">        Bring the charm of Paris with this artistic collage of the Eiffel tower  a bird  flowers  and elegant writing  these cushion covers add a tasteful flair to your home. Made of 100% cotton and in a set of two  these cushion covers are soft and durable.               <div class="emptyClear"> </div> </div> </div> </div>,None,18:03:2014,None
B00FF7HVKU,Salar Floor Cushion Pouf Pink,http://www.amazon.in/Cushions-Cushion-Covers/b/ref=sd_allcat_cushions?ie=UTF8&node=1380469031,None,Cushions & Cushion Cover,Cushions & Cushion Cover,Salar,http://ecx.images-amazon.com/images/I/31B3j1cQ0YL._AA160_.jpg,None,self Colour,Home & Kitchen,http://www.amazon.in/Salar-Floor-Cushion-Pouf-Pink/dp/B00FF7HVKU/ref=sr_1_46/279-8772023-7637911?s=kitchen&ie=UTF8&qid=1395127021&sr=1-46,[<a href="/gp/help/seller/at-a-glance.html/279-8772023-7637911?ie=UTF8&amp;seller=A03351651F3J1X5WAZNU1">Zansaar</a>],Salar Floor Cushion Pouf Pink: Amazon.in: Home & Kitchen,Salar Floor Cushion Pouf Pink: Amazon.in: Home & Kitchen,None,<div class="bucket" id="productDescription"> <h2>Product Description</h2> <div class="content"> <h3 class="productDescriptionSource"></h3> <div class="productDescriptionWrapper">        A bright  pink coloured pouf is sure to accentuate your modish  minimalistic home decor. The outer shell  made of net crafted from two layers of strong cotton  makes it durable and perfect for use in your living or bedroom. Filled with polystyrene beans  it doubles as stool or footrest.               <div class="emptyClear"> </div> </div> </div> </div>,None,18:03:2014,None
B00F41YUDI,Whale Cushion Orange,http://www.amazon.in/Cushions-Cushion-Covers/b/ref=sd_allcat_cushions?ie=UTF8&node=1380469031,None,Cushions & Cushion Cover,Cushions & Cushion Cover,Salar,http://ecx.images-amazon.com/images/I/31B3j1cQ0YL._AA160_.jpg,Rs. 719.00,self Colour,Home & Kitchen,http://www.amazon.in/Salar-Whale-Cushion-Orange/dp/B00F41YUDI/ref=sr_1_48/279-8772023-7637911?s=kitchen&ie=UTF8&qid=1395127021&sr=1-48,[<a href="/gp/help/seller/at-a-glance.html/279-8772023-7637911?ie=UTF8&amp;seller=A03351651F3J1X5WAZNU1">Zansaar</a>],Whale Cushion Orange: Amazon.in: Home & Kitchen,Whale Cushion Orange: Amazon.in: Home & Kitchen,None,<div class="bucket" id="productDescription"> <h2>Product Description</h2> <div class="content"> <h3 class="productDescriptionSource"></h3> <div class="productDescriptionWrapper">        Give your kids a playful start to each day with this adorable velvet cushion. Shaped like a happy whale it&amp; 39 s a bright and cheerful addition to your decor that your little one will love to cuddle up with.              <div class="emptyClear"> </div> </div> </div> </div>,None,18:03:2014,None
B00F41YA0Q,Bunny Cushion Pink,http://www.amazon.in/Cushions-Cushion-Covers/b/ref=sd_allcat_cushions?ie=UTF8&node=1380469031,None,Cushions & Cushion Cover,Cushions & Cushion Cover,Salar,http://ecx.images-amazon.com/images/I/31B3j1cQ0YL._AA160_.jpg,Rs. 475.00,self Colour,Home & Kitchen,http://www.amazon.in/Salar-Smiling-bunny-cushion-MSPT/dp/B00F41YA0Q/ref=sr_1_4/280-0483197-3561341?s=kitchen&ie=UTF8&qid=1395127037&sr=1-4,[<a href="/gp/help/seller/at-a-glance.html/280-0483197-3561341?ie=UTF8&amp;seller=A03351651F3J1X5WAZNU1">Zansaar</a>],Bunny Cushion Pink: Amazon.in: Home & Kitchen,Bunny Cushion Pink: Amazon.in: Home & Kitchen,None,<div class="bucket" id="productDescription"> <h2>Product Description</h2> <div class="content"> <h3 class="productDescriptionSource"></h3> <div class="productDescriptionWrapper">        Give your child a reason to look forward to nap-time with this adorable velvet cushion. With it&amp; 39 s laughing face and pretty colour this happy bunny is a bright and cheerful addition to your decor that your little one will love to cuddle up with.                <div class="emptyClear"> </div> </div> </div> </div>,None,18:03:2014,None
B00F41TBE6,Salar Floor Cushion Pouf Turquoise Blue,http://www.amazon.in/Cushions-Cushion-Covers/b/ref=sd_allcat_cushions?ie=UTF8&node=1380469031,None,Cushions & Cushion Cover,Cushions & Cushion Cover,Salar,http://ecx.images-amazon.com/images/I/31B3j1cQ0YL._AA160_.jpg,None,self Colour,Home & Kitchen,http://www.amazon.in/Salar-Floor-Cushion-Pouf-Turquoise/dp/B00F41TBE6/ref=sr_1_47/279-8772023-7637911?s=kitchen&ie=UTF8&qid=1395127021&sr=1-47,[<a href="/gp/help/seller/at-a-glance.html/279-8772023-7637911?ie=UTF8&amp;seller=A03351651F3J1X5WAZNU1">Zansaar</a>],Salar Floor Cushion Pouf Turquoise Blue: Amazon.in: Home & Kitchen,Salar Floor Cushion Pouf Turquoise Blue: Amazon.in: Home & Kitchen,None,<div class="bucket" id="productDescription"> <h2>Product Description</h2> <div class="content"> <h3 class="productDescriptionSource"></h3> <div class="productDescriptionWrapper">        Make your room look warm and welcoming by adding to its vibrant hues with this turquoise coloured pouf. The outer shell  made of net crafted from two layers of strong cotton  makes is durable and perfect for use in your living or dining room. Filled with polystyrene beans  it doubles as stool or footrest.               <div class="emptyClear"> </div> </div> </div> </div>,None,18:03:2014,None
B00FF7J59U,Cushion Cover Reversible Cream 30 X 46 Cm,http://www.amazon.in/Cushions-Cushion-Covers/b/ref=sd_allcat_cushions?ie=UTF8&node=1380469031,None,Cushions & Cushion Cover,Cushions & Cushion Cover,Salar,http://ecx.images-amazon.com/images/I/31B3j1cQ0YL._AA160_.jpg,Rs. 1 060.00,self Colour,Home & Kitchen,http://www.amazon.in/Cushion-Cover-Reversible-Cream-30/dp/B00FF7J59U/ref=sr_1_8/280-0483197-3561341?s=kitchen&ie=UTF8&qid=1395127037&sr=1-8,[<a href="/gp/help/seller/at-a-glance.html/280-0483197-3561341?ie=UTF8&amp;seller=A03351651F3J1X5WAZNU1">Zansaar</a>],Cushion Cover Reversible Cream 30 X 46 Cm: Amazon.in: Home & Kitchen,Cushion Cover Reversible Cream 30 X 46 Cm: Amazon.in: Home & Kitchen,None,<div class="bucket" id="productDescription"> <h2>Product Description</h2> <div class="content"> <h3 class="productDescriptionSource"></h3> <div class="productDescriptionWrapper">        Make your living room look brand new with unique rectangular cushions. This cushion cover is pre-crinkled to create an attractive ruched effect and is reversible; flip between gleaming off-white and rich cream to suit your moods. The 100% polyester fabric makes maintenance a hassle-free experience.  Use/Care:Machine washableDo not bleachDo not iron               <div class="emptyClear"> </div> </div> </div> </div>,None,18:03:2014,None
B00F41S5I4,Cushion Cover Blue Fur,http://www.amazon.in/Cushions-Cushion-Covers/b/ref=sd_allcat_cushions?ie=UTF8&node=1380469031,None,Cushions & Cushion Cover,Cushions & Cushion Cover,Salar,http://ecx.images-amazon.com/images/I/31B3j1cQ0YL._AA160_.jpg,Rs. 350.00,self Colour,Home & Kitchen,http://www.amazon.in/Salar-Cushion-Cover-Blue-Fur/dp/B00F41S5I4/ref=sr_1_6/280-0483197-3561341?s=kitchen&ie=UTF8&qid=1395127037&sr=1-6,[<a href="/gp/help/seller/at-a-glance.html/280-0483197-3561341?ie=UTF8&amp;seller=A03351651F3J1X5WAZNU1">Zansaar</a>],Cushion Cover Blue Fur: Amazon.in: Home & Kitchen,Cushion Cover Blue Fur: Amazon.in: Home & Kitchen,None,<div class="bucket" id="productDescription"> <h2>Product Description</h2> <div class="content"> <h3 class="productDescriptionSource"></h3> <div class="productDescriptionWrapper">        Give yourself the luxury of burrowing into a soft fur cushion that adds an inviting layer to your furniture. It comes in a light watercolour shade of blue. The playful excess of fur adds a funky note to your decor. This cushion cover is washable and comes with its own filler. This cushion cover is made of synthetic fibre.              <div class="emptyClear"> </div> </div> </div> </div>,None,18:03:2014,None
B00F41TQ0A,Cushion Cover Digital Print Radha and Krishna 2-Piece Set,http://www.amazon.in/Cushions-Cushion-Covers/b/ref=sd_allcat_cushions?ie=UTF8&node=1380469031,None,Cushions & Cushion Cover,Cushions & Cushion Cover,Salar,http://ecx.images-amazon.com/images/I/31B3j1cQ0YL._AA160_.jpg,None,self Colour,Home & Kitchen,http://www.amazon.in/Cushion-Digital-Radha-Krishna-2-Piece/dp/B00F41TQ0A/ref=sr_1_7/280-0483197-3561341?s=kitchen&ie=UTF8&qid=1395127037&sr=1-7,[<a href="/gp/help/seller/at-a-glance.html/280-0483197-3561341?ie=UTF8&amp;seller=A03351651F3J1X5WAZNU1">Zansaar</a>],Cushion Cover Digital Print Radha and Krishna 2-Piece Set: Amazon.in: Home & Kitchen,Cushion Cover Digital Print Radha and Krishna 2-Piece Set: Amazon.in: Home & Kitchen,None,<div class="bucket" id="productDescription"> <h2>Product Description</h2> <div class="content"> <h3 class="productDescriptionSource"></h3> <div class="productDescriptionWrapper">        Bring home a touch of classical ethnic charm with this set of cushion covers that depict Krishna and Radha. Digitally printed in a myriad of colours the pattern on these cushion covers is overlaid with lotus flowers and leaves in shades of red and green that float upon the luxuriously soft fabric as they would on a calm pond.               <div class="emptyClear"> </div> </div> </div> </div>,None,18:03:2014,None
B00F41SRTQ,Cushion Cover Balloons 2-Piece Set,http://www.amazon.in/Cushions-Cushion-Covers/b/ref=sd_allcat_cushions?ie=UTF8&node=1380469031,None,Cushions & Cushion Cover,Cushions & Cushion Cover,Salar,http://ecx.images-amazon.com/images/I/31B3j1cQ0YL._AA160_.jpg,Rs. 450.00,self Colour,Home & Kitchen,http://www.amazon.in/Cushion-Cover-Balloons-2-Piece-Set/dp/B00F41SRTQ/ref=sr_1_5/280-0483197-3561341?s=kitchen&ie=UTF8&qid=1395127037&sr=1-5,[<a href="/gp/help/seller/at-a-glance.html/280-0483197-3561341?ie=UTF8&amp;seller=A03351651F3J1X5WAZNU1">Zansaar</a>],Cushion Cover Balloons 2-Piece Set: Amazon.in: Home & Kitchen,Cushion Cover Balloons 2-Piece Set: Amazon.in: Home & Kitchen,None,<div class="bucket" id="productDescription"> <h2>Product Description</h2> <div class="content"> <h3 class="productDescriptionSource"></h3> <div class="productDescriptionWrapper">        A hint of quirky charm comes to lounge in your living room with this set of adorably kitsch cushion covers.   Made from easy-to-maintain poly dupion they come with a fanciful pattern of balloons in multicolour and help to bring vibrant life to your decor scheme.               <div class="emptyClear"> </div> </div> </div> </div>,None,18:03:2014,None
B00F41YHSQ,Fish Cushion Orange and pink,http://www.amazon.in/Cushions-Cushion-Covers/b/ref=sd_allcat_cushions?ie=UTF8&node=1380469031,None,Cushions & Cushion Cover,Cushions & Cushion Cover,Salar,http://ecx.images-amazon.com/images/I/31B3j1cQ0YL._AA160_.jpg,Rs. 719.00,self Colour,Home & Kitchen,http://www.amazon.in/Fish-Cushion-Orange-and-pink/dp/B00F41YHSQ/ref=sr_1_11/280-0483197-3561341?s=kitchen&ie=UTF8&qid=1395127037&sr=1-11,[<a href="/gp/help/seller/at-a-glance.html/280-0483197-3561341?ie=UTF8&amp;seller=A03351651F3J1X5WAZNU1">Zansaar</a>],Fish Cushion Orange and pink: Amazon.in: Home & Kitchen,Fish Cushion Orange and pink: Amazon.in: Home & Kitchen,None,<div class="bucket" id="productDescription"> <h2>Product Description</h2> <div class="content"> <h3 class="productDescriptionSource"></h3> <div class="productDescriptionWrapper">        Give your kids a playful start to each day with this adorable velvet cushion. The funny fish shape and vivid colours will quickly make this your little one&amp; 39 s favourite nap-time buddy.              <div class="emptyClear"> </div> </div> </div> </div>,None,18:03:2014,None
B00F41YAYC,Cushion Cover Sweet Tweet,http://www.amazon.in/Cushions-Cushion-Covers/b/ref=sd_allcat_cushions?ie=UTF8&node=1380469031,None,Cushions & Cushion Cover,Cushions & Cushion Cover,Salar,http://ecx.images-amazon.com/images/I/31B3j1cQ0YL._AA160_.jpg,Rs. 2 136.00,self Colour,Home & Kitchen,http://www.amazon.in/Salar-Sweet-Tweet-cushion-cover/dp/B00F41YAYC/ref=sr_1_9/280-0483197-3561341?s=kitchen&ie=UTF8&qid=1395127037&sr=1-9,[<a href="/gp/help/seller/at-a-glance.html/280-0483197-3561341?ie=UTF8&amp;seller=A03351651F3J1X5WAZNU1">Zansaar</a>],Cushion Cover Sweet Tweet: Amazon.in: Home & Kitchen,Cushion Cover Sweet Tweet: Amazon.in: Home & Kitchen,None,<div class="bucket" id="productDescription"> <h2>Product Description</h2> <div class="content"> <h3 class="productDescriptionSource"></h3> <div class="productDescriptionWrapper">        This charming polka dotted cushion cover is youthful but still tasteful. The lace detail adds to its childlike prettiness  and the bright colours make this cushion cover impossible to miss. Embellished with an adorable bird and a catchy phrase  it adds a touch of charm to any room.               <div class="emptyClear"> </div> </div> </div> </div>,None,18:03:2014,None
B00F41TR4K,Salar Cushion Cover Lotus Blossom Print 4-Piece Set,http://www.amazon.in/Cushions-Cushion-Covers/b/ref=sd_allcat_cushions?ie=UTF8&node=1380469031,None,Cushions & Cushion Cover,Cushions & Cushion Cover,Salar,http://ecx.images-amazon.com/images/I/31B3j1cQ0YL._AA160_.jpg,Rs. 395.00,self Colour,Home & Kitchen,http://www.amazon.in/Salar-Cushion-Cover-Blossom-4-Piece/dp/B00F41TR4K/ref=sr_1_41/279-8772023-7637911?s=kitchen&ie=UTF8&qid=1395127021&sr=1-41,[<a href="/gp/help/seller/at-a-glance.html/279-8772023-7637911?ie=UTF8&amp;seller=A03351651F3J1X5WAZNU1">Zansaar</a>],Salar Cushion Cover Lotus Blossom Print 4-Piece Set: Amazon.in: Home & Kitchen,Salar Cushion Cover Lotus Blossom Print 4-Piece Set: Amazon.in: Home & Kitchen,None,<div class="bucket" id="productDescription"> <h2>Product Description</h2> <div class="content"> <h3 class="productDescriptionSource"></h3> <div class="productDescriptionWrapper">        Bring a dash of floral brightness to your home with this set of four cushion covers. Decorated with lotus blossoms in a bold combination of pink  orange  and red  these cushion covers are made of 100% cotton.                 <div class="emptyClear"> </div> </div> </div> </div>,None,18:03:2014,None
B00IPHW0E4,Floor Cushion Cutlery,http://www.amazon.in/Cushions-Cushion-Covers/b/ref=sd_allcat_cushions?ie=UTF8&node=1380469031,None,Cushions & Cushion Cover,Cushions & Cushion Cover,Salar,http://ecx.images-amazon.com/images/I/31B3j1cQ0YL._AA160_.jpg,Rs. 890.00,self Colour,Home & Kitchen,http://www.amazon.in/Salar-Floor-Cushion-Cutlery/dp/B00IPHW0E4/ref=sr_1_12/280-0483197-3561341?s=kitchen&ie=UTF8&qid=1395127037&sr=1-12,[<a href="/gp/help/seller/at-a-glance.html/280-0483197-3561341?ie=UTF8&amp;seller=A03351651F3J1X5WAZNU1">Zansaar</a>],Amazon.in: Buy Floor Cushion Cutlery at Low Prices in India | Home & Kitchen Store,Buy Floor Cushion Cutlery at low prices in India on Amazon.in. Check out Floor Cushion Cutlery reviews  ratings  features  specifications and browse more Home & Kitchen products online at best prices on Amazon.in.,None,<div class="bucket" id="productDescription"> <h2>Product Description</h2> <div class="content"> <h3 class="productDescriptionSource"></h3> <div class="productDescriptionWrapper">        Give any room in the house a cosy and welcoming vibe with this floor cushion. Easily moved around and extremely comfortable it comes in handy when entertaining guests. It has a cotton shell and cotton filling which gives it a soft and luxurious feel.               <div class="emptyClear"> </div> </div> </div> </div>,None,18:03:2014,None
B00F41YQAK,Girl Cushion Cream,http://www.amazon.in/Cushions-Cushion-Covers/b/ref=sd_allcat_cushions?ie=UTF8&node=1380469031,None,Cushions & Cushion Cover,Cushions & Cushion Cover,Salar,http://ecx.images-amazon.com/images/I/31B3j1cQ0YL._AA160_.jpg,Rs. 475.00,self Colour,Home & Kitchen,http://www.amazon.in/Salar-Girl-Cushion-Cream/dp/B00F41YQAK/ref=sr_1_13/280-0483197-3561341?s=kitchen&ie=UTF8&qid=1395127037&sr=1-13,[<a href="/gp/help/seller/at-a-glance.html/280-0483197-3561341?ie=UTF8&amp;seller=A03351651F3J1X5WAZNU1">Zansaar</a>],Girl Cushion Cream: Amazon.in: Home & Kitchen,Girl Cushion Cream: Amazon.in: Home & Kitchen,None,<div class="bucket" id="productDescription"> <h2>Product Description</h2> <div class="content"> <h3 class="productDescriptionSource"></h3> <div class="productDescriptionWrapper">        This adorable velvet cushion will make a fun and functional addition to your kid&amp; 39 s room. With it&amp; 39 s friendly face and soft finish it&amp; 39 s the perfect cuddly companion for both nap-time and play-time.              <div class="emptyClear"> </div> </div> </div> </div>,None,18:03:2014,None
B00F41R5NU,Cushion Cover Yellow Fur,http://www.amazon.in/Cushions-Cushion-Covers/b/ref=sd_allcat_cushions?ie=UTF8&node=1380469031,None,Cushions & Cushion Cover,Cushions & Cushion Cover,Salar,http://ecx.images-amazon.com/images/I/31B3j1cQ0YL._AA160_.jpg,Rs. 350.00,self Colour,Home & Kitchen,http://www.amazon.in/Salar-Cushion-Cover-Yellow-Fur/dp/B00F41R5NU/ref=sr_1_10/280-0483197-3561341?s=kitchen&ie=UTF8&qid=1395127037&sr=1-10,[<a href="/gp/help/seller/at-a-glance.html/280-0483197-3561341?ie=UTF8&amp;seller=A03351651F3J1X5WAZNU1">Zansaar</a>],Cushion Cover Yellow Fur: Amazon.in: Home & Kitchen,Cushion Cover Yellow Fur: Amazon.in: Home & Kitchen,None,<div class="bucket" id="productDescription"> <h2>Product Description</h2> <div class="content"> <h3 class="productDescriptionSource"></h3> <div class="productDescriptionWrapper">        Give yourself the pleasure of burrowing into a soft fur cushion that adds an inviting layer to your furniture. It comes in a light sunny yellow. The playful excess of fur adds a funky element to your decor. This cushion cover is washable and comes with its own filler. This cushion cover is made of synthetic fibre.              <div class="emptyClear"> </div> </div> </div> </div>,None,18:03:2014,None
