B00F41S5I4,Cushion Cover Blue Fur,http://www.amazon.in/Cushions-Cushion-Covers/b/ref=sd_allcat_cushions?ie=UTF8&node=1380469031,None,Cushions & Cushion Cover,Cushions & Cushion Cover,Salar,http://ecx.images-amazon.com/images/I/31B3j1cQ0YL._AA160_.jpg,Rs. 350.00,self Colour,Home & Kitchen,http://www.amazon.in/Salar-Cushion-Cover-Blue-Fur/dp/B00F41S5I4/ref=sr_1_6/279-8772023-7637911?s=kitchen&ie=UTF8&qid=1395127012&sr=1-6,[<a href="/gp/help/seller/at-a-glance.html/279-8772023-7637911?ie=UTF8&amp;seller=A03351651F3J1X5WAZNU1">Zansaar</a>],Cushion Cover Blue Fur: Amazon.in: Home & Kitchen,Cushion Cover Blue Fur: Amazon.in: Home & Kitchen,None,<div class="bucket" id="productDescription"> <h2>Product Description</h2> <div class="content"> <h3 class="productDescriptionSource"></h3> <div class="productDescriptionWrapper">        Give yourself the luxury of burrowing into a soft fur cushion that adds an inviting layer to your furniture. It comes in a light watercolour shade of blue. The playful excess of fur adds a funky note to your decor. This cushion cover is washable and comes with its own filler. This cushion cover is made of synthetic fibre.              <div class="emptyClear"> </div> </div> </div> </div>,None,18:03:2014,None
B00F41YBRS,Boy Cushion Cream,http://www.amazon.in/Cushions-Cushion-Covers/b/ref=sd_allcat_cushions?ie=UTF8&node=1380469031,None,Cushions & Cushion Cover,Cushions & Cushion Cover,Salar,http://ecx.images-amazon.com/images/I/31B3j1cQ0YL._AA160_.jpg,Rs. 475.00,self Colour,Home & Kitchen,http://www.amazon.in/Salar-Boy-cushion-N002-Natural/dp/B00F41YBRS/ref=sr_1_3/279-8772023-7637911?s=kitchen&ie=UTF8&qid=1395127012&sr=1-3,[<a href="/gp/help/seller/at-a-glance.html/279-8772023-7637911?ie=UTF8&amp;seller=A03351651F3J1X5WAZNU1">Zansaar</a>],Boy Cushion Cream: Amazon.in: Home & Kitchen,Boy Cushion Cream: Amazon.in: Home & Kitchen,None,<div class="bucket" id="productDescription"> <h2>Product Description</h2> <div class="content"> <h3 class="productDescriptionSource"></h3> <div class="productDescriptionWrapper">        This adorable velvet cushion will make a fun and functional addition to your kid&amp; 39 s room. With it&amp; 39 s impish smile and soft finish it is the perfect cuddly companion for both nap-time and play-time.              <div class="emptyClear"> </div> </div> </div> </div>,None,18:03:2014,None
B00F41YHBS,Salar Cushion Cover Digital Print Bird On Branch 2-Piece Set,http://www.amazon.in/Cushions-Cushion-Covers/b/ref=sd_allcat_cushions?ie=UTF8&node=1380469031,None,Cushions & Cushion Cover,Cushions & Cushion Cover,Salar,http://ecx.images-amazon.com/images/I/31B3j1cQ0YL._AA160_.jpg,Rs. 545.00,self Colour,Home & Kitchen,http://www.amazon.in/Salar-Cushion-Digital-Bird-Branch/dp/B00F41YHBS/ref=sr_1_2/279-8772023-7637911?s=kitchen&ie=UTF8&qid=1395127012&sr=1-2,[<a href="/gp/help/seller/at-a-glance.html/279-8772023-7637911?ie=UTF8&amp;seller=A03351651F3J1X5WAZNU1">Zansaar</a>],Salar Cushion Cover Digital Print Bird On Branch 2-Piece Set: Amazon.in: Home & Kitchen,Salar Cushion Cover Digital Print Bird On Branch 2-Piece Set: Amazon.in: Home & Kitchen,None,<div class="bucket" id="productDescription"> <h2>Product Description</h2> <div class="content"> <h3 class="productDescriptionSource"></h3> <div class="productDescriptionWrapper">        These cushion covers will be a delightful addition to your living room  especially if you love birds. The snapshot on the covers will transport you from the humdrum of urban living to the tranquility of nature. Made of cotton  the cushion covers are equipped with a zipper to facilitate removal.              <div class="emptyClear"> </div> </div> </div> </div>,None,18:03:2014,None
B00F41T6PA,Salar Cushion Cover Digital Print Birds In Paris 2-Piece Set,http://www.amazon.in/Cushions-Cushion-Covers/b/ref=sd_allcat_cushions?ie=UTF8&node=1380469031,None,Cushions & Cushion Cover,Cushions & Cushion Cover,Salar,http://ecx.images-amazon.com/images/I/31B3j1cQ0YL._AA160_.jpg,Rs. 645.00,self Colour,Home & Kitchen,http://www.amazon.in/Salar-Cushion-Cover-Digital-2-Piece/dp/B00F41T6PA/ref=sr_1_1/279-8772023-7637911?s=kitchen&ie=UTF8&qid=1395127012&sr=1-1,[<a href="/gp/help/seller/at-a-glance.html/279-8772023-7637911?ie=UTF8&amp;seller=A03351651F3J1X5WAZNU1">Zansaar</a>],Salar Cushion Cover Digital Print Birds In Paris 2-Piece Set: Amazon.in: Home & Kitchen,Salar Cushion Cover Digital Print Birds In Paris 2-Piece Set: Amazon.in: Home & Kitchen,None,<div class="bucket" id="productDescription"> <h2>Product Description</h2> <div class="content"> <h3 class="productDescriptionSource"></h3> <div class="productDescriptionWrapper">        Bring the charm of Paris with this artistic collage of the Eiffel tower  a bird  flowers  and elegant writing  these cushion covers add a tasteful flair to your home. Made of 100% cotton and in a set of two  these cushion covers are soft and durable.               <div class="emptyClear"> </div> </div> </div> </div>,None,18:03:2014,None
B00F41YA0Q,Bunny Cushion Pink,http://www.amazon.in/Cushions-Cushion-Covers/b/ref=sd_allcat_cushions?ie=UTF8&node=1380469031,None,Cushions & Cushion Cover,Cushions & Cushion Cover,Salar,http://ecx.images-amazon.com/images/I/31B3j1cQ0YL._AA160_.jpg,Rs. 475.00,self Colour,Home & Kitchen,http://www.amazon.in/Salar-Smiling-bunny-cushion-MSPT/dp/B00F41YA0Q/ref=sr_1_4/279-8772023-7637911?s=kitchen&ie=UTF8&qid=1395127012&sr=1-4,[<a href="/gp/help/seller/at-a-glance.html/279-8772023-7637911?ie=UTF8&amp;seller=A03351651F3J1X5WAZNU1">Zansaar</a>],Bunny Cushion Pink: Amazon.in: Home & Kitchen,Bunny Cushion Pink: Amazon.in: Home & Kitchen,None,<div class="bucket" id="productDescription"> <h2>Product Description</h2> <div class="content"> <h3 class="productDescriptionSource"></h3> <div class="productDescriptionWrapper">        Give your child a reason to look forward to nap-time with this adorable velvet cushion. With it&amp; 39 s laughing face and pretty colour this happy bunny is a bright and cheerful addition to your decor that your little one will love to cuddle up with.                <div class="emptyClear"> </div> </div> </div> </div>,None,18:03:2014,None
B00F41R5NU,Cushion Cover Yellow Fur,http://www.amazon.in/Cushions-Cushion-Covers/b/ref=sd_allcat_cushions?ie=UTF8&node=1380469031,None,Cushions & Cushion Cover,Cushions & Cushion Cover,Salar,http://ecx.images-amazon.com/images/I/31B3j1cQ0YL._AA160_.jpg,Rs. 350.00,self Colour,Home & Kitchen,http://www.amazon.in/Salar-Cushion-Cover-Yellow-Fur/dp/B00F41R5NU/ref=sr_1_10/279-8772023-7637911?s=kitchen&ie=UTF8&qid=1395127012&sr=1-10,[<a href="/gp/help/seller/at-a-glance.html/279-8772023-7637911?ie=UTF8&amp;seller=A03351651F3J1X5WAZNU1">Zansaar</a>],Cushion Cover Yellow Fur: Amazon.in: Home & Kitchen,Cushion Cover Yellow Fur: Amazon.in: Home & Kitchen,None,<div class="bucket" id="productDescription"> <h2>Product Description</h2> <div class="content"> <h3 class="productDescriptionSource"></h3> <div class="productDescriptionWrapper">        Give yourself the pleasure of burrowing into a soft fur cushion that adds an inviting layer to your furniture. It comes in a light sunny yellow. The playful excess of fur adds a funky element to your decor. This cushion cover is washable and comes with its own filler. This cushion cover is made of synthetic fibre.              <div class="emptyClear"> </div> </div> </div> </div>,None,18:03:2014,None
B00F41YAYC,Cushion Cover Sweet Tweet,http://www.amazon.in/Cushions-Cushion-Covers/b/ref=sd_allcat_cushions?ie=UTF8&node=1380469031,None,Cushions & Cushion Cover,Cushions & Cushion Cover,Salar,http://ecx.images-amazon.com/images/I/31B3j1cQ0YL._AA160_.jpg,Rs. 2 136.00,self Colour,Home & Kitchen,http://www.amazon.in/Salar-Sweet-Tweet-cushion-cover/dp/B00F41YAYC/ref=sr_1_9/279-8772023-7637911?s=kitchen&ie=UTF8&qid=1395127012&sr=1-9,[<a href="/gp/help/seller/at-a-glance.html/279-8772023-7637911?ie=UTF8&amp;seller=A03351651F3J1X5WAZNU1">Zansaar</a>],Cushion Cover Sweet Tweet: Amazon.in: Home & Kitchen,Cushion Cover Sweet Tweet: Amazon.in: Home & Kitchen,None,<div class="bucket" id="productDescription"> <h2>Product Description</h2> <div class="content"> <h3 class="productDescriptionSource"></h3> <div class="productDescriptionWrapper">        This charming polka dotted cushion cover is youthful but still tasteful. The lace detail adds to its childlike prettiness  and the bright colours make this cushion cover impossible to miss. Embellished with an adorable bird and a catchy phrase  it adds a touch of charm to any room.               <div class="emptyClear"> </div> </div> </div> </div>,None,18:03:2014,None
B00F41SRTQ,Cushion Cover Balloons 2-Piece Set,http://www.amazon.in/Cushions-Cushion-Covers/b/ref=sd_allcat_cushions?ie=UTF8&node=1380469031,None,Cushions & Cushion Cover,Cushions & Cushion Cover,Salar,http://ecx.images-amazon.com/images/I/31B3j1cQ0YL._AA160_.jpg,Rs. 450.00,self Colour,Home & Kitchen,http://www.amazon.in/Cushion-Cover-Balloons-2-Piece-Set/dp/B00F41SRTQ/ref=sr_1_5/279-8772023-7637911?s=kitchen&ie=UTF8&qid=1395127012&sr=1-5,[<a href="/gp/help/seller/at-a-glance.html/276-7231537-0478766?ie=UTF8&amp;seller=A03351651F3J1X5WAZNU1">Zansaar</a>],Cushion Cover Balloons 2-Piece Set: Amazon.in: Home & Kitchen,Cushion Cover Balloons 2-Piece Set: Amazon.in: Home & Kitchen,None,<div class="bucket" id="productDescription"> <h2>Product Description</h2> <div class="content"> <h3 class="productDescriptionSource"></h3> <div class="productDescriptionWrapper">        A hint of quirky charm comes to lounge in your living room with this set of adorably kitsch cushion covers.   Made from easy-to-maintain poly dupion they come with a fanciful pattern of balloons in multicolour and help to bring vibrant life to your decor scheme.               <div class="emptyClear"> </div> </div> </div> </div>,None,18:03:2014,None
B00F41TQ0A,Cushion Cover Digital Print Radha and Krishna 2-Piece Set,http://www.amazon.in/Cushions-Cushion-Covers/b/ref=sd_allcat_cushions?ie=UTF8&node=1380469031,None,Cushions & Cushion Cover,Cushions & Cushion Cover,Salar,http://ecx.images-amazon.com/images/I/31B3j1cQ0YL._AA160_.jpg,None,self Colour,Home & Kitchen,http://www.amazon.in/Cushion-Digital-Radha-Krishna-2-Piece/dp/B00F41TQ0A/ref=sr_1_7/279-8772023-7637911?s=kitchen&ie=UTF8&qid=1395127012&sr=1-7,[<a href="/gp/help/seller/at-a-glance.html/279-8772023-7637911?ie=UTF8&amp;seller=A03351651F3J1X5WAZNU1">Zansaar</a>],Cushion Cover Digital Print Radha and Krishna 2-Piece Set: Amazon.in: Home & Kitchen,Cushion Cover Digital Print Radha and Krishna 2-Piece Set: Amazon.in: Home & Kitchen,None,<div class="bucket" id="productDescription"> <h2>Product Description</h2> <div class="content"> <h3 class="productDescriptionSource"></h3> <div class="productDescriptionWrapper">        Bring home a touch of classical ethnic charm with this set of cushion covers that depict Krishna and Radha. Digitally printed in a myriad of colours the pattern on these cushion covers is overlaid with lotus flowers and leaves in shades of red and green that float upon the luxuriously soft fabric as they would on a calm pond.               <div class="emptyClear"> </div> </div> </div> </div>,None,18:03:2014,None
B00F41YQAK,Girl Cushion Cream,http://www.amazon.in/Cushions-Cushion-Covers/b/ref=sd_allcat_cushions?ie=UTF8&node=1380469031,None,Cushions & Cushion Cover,Cushions & Cushion Cover,Salar,http://ecx.images-amazon.com/images/I/31B3j1cQ0YL._AA160_.jpg,Rs. 475.00,self Colour,Home & Kitchen,http://www.amazon.in/Salar-Girl-Cushion-Cream/dp/B00F41YQAK/ref=sr_1_13/279-8772023-7637911?s=kitchen&ie=UTF8&qid=1395127012&sr=1-13,[<a href="/gp/help/seller/at-a-glance.html/279-8772023-7637911?ie=UTF8&amp;seller=A03351651F3J1X5WAZNU1">Zansaar</a>],Girl Cushion Cream: Amazon.in: Home & Kitchen,Girl Cushion Cream: Amazon.in: Home & Kitchen,None,<div class="bucket" id="productDescription"> <h2>Product Description</h2> <div class="content"> <h3 class="productDescriptionSource"></h3> <div class="productDescriptionWrapper">        This adorable velvet cushion will make a fun and functional addition to your kid&amp; 39 s room. With it&amp; 39 s friendly face and soft finish it&amp; 39 s the perfect cuddly companion for both nap-time and play-time.              <div class="emptyClear"> </div> </div> </div> </div>,None,18:03:2014,None
B00F41SIG8,Salar Cushion Cover Blue And Pink Suzani 2-Piece Set,http://www.amazon.in/Cushions-Cushion-Covers/b/ref=sd_allcat_cushions?ie=UTF8&node=1380469031,None,Cushions & Cushion Cover,Cushions & Cushion Cover,Salar,http://ecx.images-amazon.com/images/I/31B3j1cQ0YL._AA160_.jpg,Rs. 595.00,self Colour,Home & Kitchen,http://www.amazon.in/Salar-Cushion-Blue-Pink-Suzani/dp/B00F41SIG8/ref=sr_1_15/279-8772023-7637911?s=kitchen&ie=UTF8&qid=1395127012&sr=1-15,[<a href="/gp/help/seller/at-a-glance.html/279-8772023-7637911?ie=UTF8&amp;seller=A03351651F3J1X5WAZNU1">Zansaar</a>],Salar Cushion Cover Blue And Pink Suzani 2-Piece Set: Amazon.in: Home & Kitchen,Salar Cushion Cover Blue And Pink Suzani 2-Piece Set: Amazon.in: Home & Kitchen,None,<div class="bucket" id="productDescription"> <h2>Product Description</h2> <div class="content"> <h3 class="productDescriptionSource"></h3> <div class="productDescriptionWrapper">        A slight ethnic twist gives these cotton cushion covers a striking beauty. With deep shades of blue  pink  and green  the floral design is digitally printed with reactive dye  which helps preserve the life of the print and keeps your cushion covers in tip-top condition for many days to come.               <div class="emptyClear"> </div> </div> </div> </div>,None,18:03:2014,None
B00IPHW0E4,Floor Cushion Cutlery,http://www.amazon.in/Cushions-Cushion-Covers/b/ref=sd_allcat_cushions?ie=UTF8&node=1380469031,None,Cushions & Cushion Cover,Cushions & Cushion Cover,Salar,http://ecx.images-amazon.com/images/I/31B3j1cQ0YL._AA160_.jpg,Rs. 890.00,self Colour,Home & Kitchen,http://www.amazon.in/Salar-Floor-Cushion-Cutlery/dp/B00IPHW0E4/ref=sr_1_12/279-8772023-7637911?s=kitchen&ie=UTF8&qid=1395127012&sr=1-12,[<a href="/gp/help/seller/at-a-glance.html/279-8772023-7637911?ie=UTF8&amp;seller=A03351651F3J1X5WAZNU1">Zansaar</a>],Amazon.in: Buy Floor Cushion Cutlery at Low Prices in India | Home & Kitchen Store,Buy Floor Cushion Cutlery at low prices in India on Amazon.in. Check out Floor Cushion Cutlery reviews  ratings  features  specifications and browse more Home & Kitchen products online at best prices on Amazon.in.,None,<div class="bucket" id="productDescription"> <h2>Product Description</h2> <div class="content"> <h3 class="productDescriptionSource"></h3> <div class="productDescriptionWrapper">        Give any room in the house a cosy and welcoming vibe with this floor cushion. Easily moved around and extremely comfortable it comes in handy when entertaining guests. It has a cotton shell and cotton filling which gives it a soft and luxurious feel.               <div class="emptyClear"> </div> </div> </div> </div>,None,18:03:2014,None
B00F41YWR2,Salar Cushion Cover Blossom 2-Piece Set,http://www.amazon.in/Cushions-Cushion-Covers/b/ref=sd_allcat_cushions?ie=UTF8&node=1380469031,None,Cushions & Cushion Cover,Cushions & Cushion Cover,Salar,http://ecx.images-amazon.com/images/I/31B3j1cQ0YL._AA160_.jpg,Rs. 1 050.00,self Colour,Home & Kitchen,http://www.amazon.in/Salar-Cushion-Cover-Blossom-Set/dp/B00F41YWR2/ref=sr_1_14/279-8772023-7637911?s=kitchen&ie=UTF8&qid=1395127012&sr=1-14,[<a href="/gp/help/seller/at-a-glance.html/279-8772023-7637911?ie=UTF8&amp;seller=A03351651F3J1X5WAZNU1">Zansaar</a>],Salar Cushion Cover Blossom 2-Piece Set: Amazon.in: Home & Kitchen,Salar Cushion Cover Blossom 2-Piece Set: Amazon.in: Home & Kitchen,None,<div class="bucket" id="productDescription"> <h2>Product Description</h2> <div class="content"> <h3 class="productDescriptionSource"></h3> <div class="productDescriptionWrapper">        These wrinkle free cushion covers add a zing to your decor with their vibrant colours. The beautiful floral pattern would infuse your interiors with a fresh feeling. Light coloured butterflies add to the overall charm of the scene.              <div class="emptyClear"> </div> </div> </div> </div>,None,18:03:2014,None
B00F41YHSQ,Fish Cushion Orange and pink,http://www.amazon.in/Cushions-Cushion-Covers/b/ref=sd_allcat_cushions?ie=UTF8&node=1380469031,None,Cushions & Cushion Cover,Cushions & Cushion Cover,Salar,http://ecx.images-amazon.com/images/I/31B3j1cQ0YL._AA160_.jpg,Rs. 719.00,self Colour,Home & Kitchen,http://www.amazon.in/Fish-Cushion-Orange-and-pink/dp/B00F41YHSQ/ref=sr_1_11/279-8772023-7637911?s=kitchen&ie=UTF8&qid=1395127012&sr=1-11,[<a href="/gp/help/seller/at-a-glance.html/279-8772023-7637911?ie=UTF8&amp;seller=A03351651F3J1X5WAZNU1">Zansaar</a>],Fish Cushion Orange and pink: Amazon.in: Home & Kitchen,Fish Cushion Orange and pink: Amazon.in: Home & Kitchen,None,<div class="bucket" id="productDescription"> <h2>Product Description</h2> <div class="content"> <h3 class="productDescriptionSource"></h3> <div class="productDescriptionWrapper">        Give your kids a playful start to each day with this adorable velvet cushion. The funny fish shape and vivid colours will quickly make this your little one&amp; 39 s favourite nap-time buddy.              <div class="emptyClear"> </div> </div> </div> </div>,None,18:03:2014,None
B00F41YGNW,Salar Cushion Cover Digital Print Bird In Garden 2-Piece Set,http://www.amazon.in/Cushions-Cushion-Covers/b/ref=sd_allcat_cushions?ie=UTF8&node=1380469031,None,Cushions & Cushion Cover,Cushions & Cushion Cover,Salar,http://ecx.images-amazon.com/images/I/31B3j1cQ0YL._AA160_.jpg,Rs. 545.00,self Colour,Home & Kitchen,http://www.amazon.in/Salar-Cushion-Digital-Bird-Garden/dp/B00F41YGNW/ref=sr_1_17/279-8772023-7637911?s=kitchen&ie=UTF8&qid=1395127012&sr=1-17,[<a href="/gp/help/seller/at-a-glance.html/279-8772023-7637911?ie=UTF8&amp;seller=A03351651F3J1X5WAZNU1">Zansaar</a>],Salar Cushion Cover Digital Print Bird In Garden 2-Piece Set: Amazon.in: Home & Kitchen,Salar Cushion Cover Digital Print Bird In Garden 2-Piece Set: Amazon.in: Home & Kitchen,None,<div class="bucket" id="productDescription"> <h2>Product Description</h2> <div class="content"> <h3 class="productDescriptionSource"></h3> <div class="productDescriptionWrapper">        Add a pop of colour to your living room decor with this set of cushion covers. Made of cotton  these covers are equipped with zippers so that they can be easily removed and cleaned. The multi-coloured floral prints stand out brilliantly against the white background and the bird makes for an interesting visual detail.              <div class="emptyClear"> </div> </div> </div> </div>,None,18:03:2014,None
B00F41XBPG,Salar Cushion Cover Digital Print Black Traditional Pattern,http://www.amazon.in/Cushions-Cushion-Covers/b/ref=sd_allcat_cushions?ie=UTF8&node=1380469031,None,Cushions & Cushion Cover,Cushions & Cushion Cover,Salar,http://ecx.images-amazon.com/images/I/31B3j1cQ0YL._AA160_.jpg,Rs. 450.00,self Colour,Home & Kitchen,http://www.amazon.in/Salar-Cushion-Digital-Traditional-Pattern/dp/B00F41XBPG/ref=sr_1_18/279-8772023-7637911?s=kitchen&ie=UTF8&qid=1395127012&sr=1-18,[<a href="/gp/help/seller/at-a-glance.html/279-8772023-7637911?ie=UTF8&amp;seller=A03351651F3J1X5WAZNU1">Zansaar</a>],Salar Cushion Cover Digital Print Black Traditional Pattern: Amazon.in: Home & Kitchen,Salar Cushion Cover Digital Print Black Traditional Pattern: Amazon.in: Home & Kitchen,None,<div class="bucket" id="productDescription"> <h2>Product Description</h2> <div class="content"> <h3 class="productDescriptionSource"></h3> <div class="productDescriptionWrapper">        Add a touch of unique detail to your decor with this black cushion cover. The abstract floral pattern in grey printed upon it  has a delicately ethnic theme that subtly brings a traditional flavour to your home.               <div class="emptyClear"> </div> </div> </div> </div>,None,18:03:2014,None
B00F41QSXS,Salar Cushion Cover Diamond Flower Printed 2-Piece Set - Blue,http://www.amazon.in/Cushions-Cushion-Covers/b/ref=sd_allcat_cushions?ie=UTF8&node=1380469031,None,Cushions & Cushion Cover,Cushions & Cushion Cover,Salar,http://ecx.images-amazon.com/images/I/31B3j1cQ0YL._AA160_.jpg,Rs. 395.00,self Colour,Home & Kitchen,http://www.amazon.in/Salar-Cushion-Diamond-Flower-Printed/dp/B00F41QSXS/ref=sr_1_16/279-8772023-7637911?s=kitchen&ie=UTF8&qid=1395127012&sr=1-16,[<a href="/gp/help/seller/at-a-glance.html/279-8772023-7637911?ie=UTF8&amp;seller=A03351651F3J1X5WAZNU1">Zansaar</a>],Salar Cushion Cover Diamond Flower Printed 2-Piece Set - Blue: Amazon.in: Home & Kitchen,Salar Cushion Cover Diamond Flower Printed 2-Piece Set - Blue: Amazon.in: Home & Kitchen,None,<div class="bucket" id="productDescription"> <h2>Product Description</h2> <div class="content"> <h3 class="productDescriptionSource"></h3> <div class="productDescriptionWrapper">        Add a touch of soothing tranquility to your living room or family room with this set of two cushion covers. Made of 100% cotton  they come with a sky blue background and a floral diamond pattern.               <div class="emptyClear"> </div> </div> </div> </div>,None,18:03:2014,None
B00F41XB5G,Salar Cushion Cover Digital Print Brown And Grey Paisley,http://www.amazon.in/Cushions-Cushion-Covers/b/ref=sd_allcat_cushions?ie=UTF8&node=1380469031,None,Cushions & Cushion Cover,Cushions & Cushion Cover,Salar,http://ecx.images-amazon.com/images/I/31B3j1cQ0YL._AA160_.jpg,Rs. 1 800.00,self Colour,Home & Kitchen,http://www.amazon.in/Salar-Cushion-Cover-Digital-Paisley/dp/B00F41XB5G/ref=sr_1_19/279-8772023-7637911?s=kitchen&ie=UTF8&qid=1395127012&sr=1-19,[<a href="/gp/help/seller/at-a-glance.html/279-8772023-7637911?ie=UTF8&amp;seller=A03351651F3J1X5WAZNU1">Zansaar</a>],Salar Cushion Cover Digital Print Brown And Grey Paisley: Amazon.in: Home & Kitchen,Salar Cushion Cover Digital Print Brown And Grey Paisley: Amazon.in: Home & Kitchen,None,<div class="bucket" id="productDescription"> <h2>Product Description</h2> <div class="content"> <h3 class="productDescriptionSource"></h3> <div class="productDescriptionWrapper">        Add a touch of drama to your decor with this vibrantly patterned digital print cushion cover. Featuring a traditionally styled paisley pattern in yellow and brown on a soft grey background  it brings a wonderful ethnic element to your living spaces.                <div class="emptyClear"> </div> </div> </div> </div>,None,18:03:2014,None
B00F41T7TA,Salar Cushion Cover Digital Print Butterflies 2-Piece Set,http://www.amazon.in/Cushions-Cushion-Covers/b/ref=sd_allcat_cushions?ie=UTF8&node=1380469031,None,Cushions & Cushion Cover,Cushions & Cushion Cover,Salar,http://ecx.images-amazon.com/images/I/31B3j1cQ0YL._AA160_.jpg,None,self Colour,Home & Kitchen,http://www.amazon.in/Salar-Cushion-Digital-Butterflies-2-Piece/dp/B00F41T7TA/ref=sr_1_20/279-8772023-7637911?s=kitchen&ie=UTF8&qid=1395127012&sr=1-20,[<a href="/gp/help/seller/at-a-glance.html/279-8772023-7637911?ie=UTF8&amp;seller=A03351651F3J1X5WAZNU1">Zansaar</a>],Salar Cushion Cover Digital Print Butterflies 2-Piece Set: Amazon.in: Home & Kitchen,Salar Cushion Cover Digital Print Butterflies 2-Piece Set: Amazon.in: Home & Kitchen,None,<div class="bucket" id="productDescription"> <h2>Product Description</h2> <div class="content"> <h3 class="productDescriptionSource"></h3> <div class="productDescriptionWrapper">        Infuse your home with colour and brightness with this set of two cushion covers. Digitally printed with multi-coloured butterflies  they are a vibrant addition to your collection. They are also made of 100% cotton  making them durable and soft.              <div class="emptyClear"> </div> </div> </div> </div>,None,18:03:2014,None
B00F41TUKG,Salar Cushion Cover Digital Print Eiffel Tower 2-Piece Set,http://www.amazon.in/Cushions-Cushion-Covers/b/ref=sd_allcat_cushions?ie=UTF8&node=1380469031,None,Cushions & Cushion Cover,Cushions & Cushion Cover,Salar,http://ecx.images-amazon.com/images/I/31B3j1cQ0YL._AA160_.jpg,Rs. 645.00,self Colour,Home & Kitchen,http://www.amazon.in/Salar-Cushion-Digital-Eiffel-2-Piece/dp/B00F41TUKG/ref=sr_1_22/279-8772023-7637911?s=kitchen&ie=UTF8&qid=1395127012&sr=1-22,[<a href="/gp/help/seller/at-a-glance.html/279-8772023-7637911?ie=UTF8&amp;seller=A03351651F3J1X5WAZNU1">Zansaar</a>],Salar Cushion Cover Digital Print Eiffel Tower 2-Piece Set: Amazon.in: Home & Kitchen,Salar Cushion Cover Digital Print Eiffel Tower 2-Piece Set: Amazon.in: Home & Kitchen,None,<div class="bucket" id="productDescription"> <h2>Product Description</h2> <div class="content"> <h3 class="productDescriptionSource"></h3> <div class="productDescriptionWrapper">        Bring the charm of Paris chez-vous. With an artistic collage of the Eiffel tower  postage stamps  and newspaper print  these cushion covers add a colourful flair to your home. Made of 100% cotton and in a set of two  these cushion covers are soft and durable.               <div class="emptyClear"> </div> </div> </div> </div>,None,18:03:2014,None
