30849_c-2193,dock iphone 4 & 4s  ipod & ipad white,http://www.bagittoday.com/accessories/c-221/,r699/-,Accessories,Other Accessories,private,http://images.bagittoday.com/0/images/product/30849/Dock-iPhone-4--4S-iPod--iPad-White-00.jpg,r 1000/-,BLACK,Electronics & Mobiles,http://www.bagittoday.com/dock-iphone-4-and-4s-ipod-and-ipad-white/pr-30849_c-2193/,bagittoday.com,Dock iPhone 4 & 4S  iPod & iPad White | Buy Online India,Buy original Dock iPhone 4 & 4S  iPod & iPad White at best price in India. Read its features  reviews and specifications. Get fast & assured delivery all over India.,[''  'aV_1_0'  'BLACK'],<div class="tabs-content">                  <p></p><p>Dock iPhone 4 &amp; 4S  iPod &amp; iPad White</p>                            </div>,None,1203i2014,None
142362_c-2193,inoodle usb data cable for apple devices,http://www.bagittoday.com/accessories/c-221/,r374/-,Accessories,Other Accessories,private,http://images.bagittoday.com/0/images/product/142362/KolorFish_iNoodle_USB_Data_Cable_for_Apple_Devices_Orange_225X225_00_0.jpg,r 799/-,ORANGE,Electronics & Mobiles,http://www.bagittoday.com/inoodle-usb-data-cable-for-apple-devices/pr-142362_c-2193/,bagittoday.com,iNoodle USB Data Cable for Apple Devices | Buy Online India,Buy original iNoodle USB Data Cable for Apple Devices at best price in India. Read its features  reviews and specifications. Get fast & assured delivery all over India.,[''  'aV_1_0'  'ORANGE'],<div class="tabs-content">                  <p><b>Features:</b></p><ul><li>You just popped it in the drawer 20 minutes ago  how is it tangled already?! Banish twisted cables forever with your very own colourful Flat USB Noodle cable. </li><li>No more annoying spaghetti junction on your desk! Work free from tangles and get some design cred while you're at it. </li><li>Featuring a USB connection on one end and port compatible with Apple products on the other  your new favourite gadget measures a totally useful 1m long! </li><li>Suitable for any Apple product including all generations of iPhone  iPad  Nano and iPod </li><li>Flat cord shape means no more tangles and easy storage</li></ul></div>,None,1203i2014,None
202351_c-2193,wireless door bell,http://www.bagittoday.com/accessories/c-221/,r249/-,Accessories,Other Accessories,private,http://images.bagittoday.com/0/images/product/202351/Wireless_Door_Bell_225X225_00_0.jpg,r 699/-,None,Electronics & Mobiles,http://www.bagittoday.com/wireless-door-bell/pr-202351_c-2193/,bagittoday.com,Wireless Door Bell | Buy Online India,Buy original Wireless Door Bell at best price in India. Read its features  reviews and specifications. Get fast & assured delivery all over India.,[],<div class="tabs-content">                  <p>                          Wireless Door Bell<br>Install this stylish door bell and get notified on the entry of guests   in a musical way. As it requires no wiring  the interior of your house   won&#8217;t get affected. It has 16 songs programmed in it and comes with   built-in double speakers. It is suitable for home and office. <br><br></p>                            </div>,None,1203i2014,None
