B007W15WU8,Nautica Aqua Rush Nautica for men,http://www.amazon.in/Fragrances/b/ref=sd_allcat_beauty_fragrance/276-6718833-1247838?ie=UTF8&node=1374298031,None,Fragranc,Men,NAUTICA,http://ecx.images-amazon.com/images/I/41gkgYfVw6L._AA160_.jpg,None,self Colour,Beauty & Health,http://www.amazon.in/Nautica-Aqua-Rush-men/dp/B007W15WU8/ref=sr_1_7/275-7196464-8359954?s=beauty&ie=UTF8&qid=1395127212&sr=1-7,[<a href="/gp/help/seller/at-a-glance.html/275-7196464-8359954?ie=UTF8&amp;seller=ATIGDIRBCF9VS">Haneez</a>],Amazon.in: Buy Nautica Aqua Rush Nautica for men Online at Best Price in India | Amazon Beauty Store,Buy Nautica Aqua Rush Nautica for men at lowest price in India on Amazon.in. Check out Nautica Aqua Rush Nautica for men reviews  ratings  features  specifications and browse more Beauty products online at best prices on Amazon.in.,None,<div class="bucket" id="productDescription"> <h2>Product Description</h2> <div class="content"> <h3 class="productDescriptionSource"></h3> <div class="productDescriptionWrapper">        NAUTICA AQUA RUSH by Nautica for MEN EDT SPRAY 1.7 OZ Launched by the design house of Nautica in 2012              <div class="emptyClear"> </div> </div> </div> </div>,None,18:03:2014,None
B005HTKJ00,NAUTICA BLUE by Nautica Eau De Toilette Spray 3.4 oz for Men,http://www.amazon.in/Fragrances/b/ref=sd_allcat_beauty_fragrance/276-6718833-1247838?ie=UTF8&node=1374298031,None,Fragranc,Men,NAUTICA,http://ecx.images-amazon.com/images/I/41gkgYfVw6L._AA160_.jpg,None,self Colour,Beauty & Health,http://www.amazon.in/NAUTICA-BLUE-Nautica-Toilette-Spray/dp/B005HTKJ00/ref=sr_1_8/275-7196464-8359954?s=beauty&ie=UTF8&qid=1395127212&sr=1-8,[<a href="/gp/help/seller/at-a-glance.html/275-7196464-8359954?ie=UTF8&amp;seller=A2IT7998C8946H">Perfume Nation</a>],Amazon.in: Buy NAUTICA BLUE by Nautica Eau De Toilette Spray 3.4 oz for Men Online at Best Price in India | Amazon Beauty Store,Buy NAUTICA BLUE by Nautica Eau De Toilette Spray 3.4 oz for Men at lowest price in India on Amazon.in. Check out NAUTICA BLUE by Nautica Eau De Toilette Spray 3.4 oz for Men reviews  ratings  features  specifications and browse more Beauty products online at best prices on Amazon.in.,None,<div class="bucket" id="productDescription"> <h2>Product Description</h2> <div class="content"> <h3 class="productDescriptionSource"></h3> <div class="productDescriptionWrapper">        "It has top notes of lavender and amber a heart of lemon rose and sage with a base of moss amber and musk."              <div class="emptyClear"> </div> </div> </div> </div>,None,18:03:2014,None
B000P22TIY,Nautica Voyage By Nautica For Men. Eau De Toilette Spray 3.4 oz,http://www.amazon.in/Fragrances/b/ref=sd_allcat_beauty_fragrance/276-6718833-1247838?ie=UTF8&node=1374298031,None,Fragranc,Men,NAUTICA,http://ecx.images-amazon.com/images/I/41gkgYfVw6L._AA160_.jpg,None,self Colour,Beauty & Health,http://www.amazon.in/Nautica-Voyage-Men-Toilette-Spray/dp/B000P22TIY/ref=sr_1_2/275-7196464-8359954?s=beauty&ie=UTF8&qid=1395127212&sr=1-2,[<a href="/gp/help/seller/at-a-glance.html/275-7196464-8359954?ie=UTF8&amp;seller=ATIGDIRBCF9VS">Haneez</a>],Amazon.in: Buy Nautica Voyage By Nautica For Men. Eau De Toilette Spray 3.4 oz Online at Best Price in India | Amazon Beauty Store,Buy Nautica Voyage By Nautica For Men. Eau De Toilette Spray 3.4 oz at lowest price in India on Amazon.in. Check out Nautica Voyage By Nautica For Men. Eau De Toilette Spray 3.4 oz reviews  ratings  features  specifications and browse more Beauty products online at best prices on Amazon.in.,None,<div class="bucket" id="productDescription"> <h2>Product Description</h2> <div class="content"> <h3 class="productDescriptionSource"></h3> <div class="productDescriptionWrapper">        Launched by the design house of Nautica.When nbsp applying nbsp any fragrance please consider that there are several factors which can affect the natural smell of your skin and in turn the way a scent smells on you. nbsp For instance your mood stress level age body chemistry nbsp diet and current medications may all alter the scents you wear. nbsp nbsp Similarly factor such as dry or oily nbsp skin can even affect the amount of time a fragrance will last after being applied              <div class="emptyClear"> </div> </div> </div> </div>,None,18:03:2014,None
B0020MMCJI,Nautica Blue Eau De Toilette Perfume  100ml,http://www.amazon.in/Fragrances/b/ref=sd_allcat_beauty_fragrance/276-6718833-1247838?ie=UTF8&node=1374298031,None,Fragranc,Men,NAUTICA,http://ecx.images-amazon.com/images/I/41gkgYfVw6L._AA160_.jpg,None,self Colour,Beauty & Health,http://www.amazon.in/Nautica-Blue-Toilette-Perfume-100ml/dp/B0020MMCJI/ref=sr_1_3/275-7196464-8359954?s=beauty&ie=UTF8&qid=1395127212&sr=1-3,[<a href="/gp/help/seller/at-a-glance.html/275-7196464-8359954?ie=UTF8&amp;seller=A2IT7998C8946H">Perfume Nation</a>],Amazon.in: Buy Nautica Blue Eau De Toilette Perfume  100ml Online at Best Price in India | Amazon Beauty Store,Buy Nautica Blue Eau De Toilette Perfume  100ml at lowest price in India on Amazon.in. Check out Nautica Blue Eau De Toilette Perfume  100ml reviews  ratings  features  specifications and browse more Beauty products online at best prices on Amazon.in.,None,<div class="bucket" id="productDescription"> <h2>Product Description</h2> <div class="content"> <h3 class="productDescriptionSource"></h3> <div class="productDescriptionWrapper">        NAUTICA by NAUTICA 3.4 oz EAU DE TOILETTE              <div class="emptyClear"> </div> </div> </div> </div>,None,18:03:2014,None
B00CFD1A0Y,Nautica Voyage By Nautica Edt Spray 100.55 ml,http://www.amazon.in/Fragrances/b/ref=sd_allcat_beauty_fragrance/276-6718833-1247838?ie=UTF8&node=1374298031,Rs. 2 450.00,Fragranc,Men,NAUTICA,http://ecx.images-amazon.com/images/I/41gkgYfVw6L._AA160_.jpg,Rs. 2 450.00,self Colour,Beauty & Health,http://www.amazon.in/Nautica-Voyage-Edt-Spray-100-55/dp/B00CFD1A0Y/ref=sr_1_18/275-7196464-8359954?s=beauty&ie=UTF8&qid=1395127212&sr=1-18,[<a class="buyAction" href="/gp/offer-listing/B00CFD1A0Y/ref=dp_olp_0/275-7196464-8359954?ie=UTF8&amp;condition=all">these sellers</a>],Amazon.in: Buy Nautica Voyage By Nautica Edt Spray 100.55 ml Online at Best Price in India | Amazon Beauty Store,Buy Nautica Voyage By Nautica Edt Spray 100.55 ml at lowest price in India on Amazon.in. Check out Nautica Voyage By Nautica Edt Spray 100.55 ml reviews  ratings  features  specifications and browse more Beauty products online at best prices on Amazon.in.,None,<div class="bucket" id="productDescription"> <h2>Product Description</h2> <div class="content"> <h3 class="productDescriptionSource"></h3> <div class="productDescriptionWrapper">        Design House: Nautica  Year Introduced: 2006  Recommended Use: Daytime  Recommended Use: Daytime              <div class="emptyClear"> </div> </div> </div> </div>,None,18:03:2014,None
B003YPCDU8,Nautica Pure By Nautica Edt Spray 100.55 ml,http://www.amazon.in/Fragrances/b/ref=sd_allcat_beauty_fragrance/276-6718833-1247838?ie=UTF8&node=1374298031,None,Fragranc,Men,NAUTICA,http://ecx.images-amazon.com/images/I/41gkgYfVw6L._AA160_.jpg,None,self Colour,Beauty & Health,http://www.amazon.in/Nautica-Pure-Edt-Spray-100-55/dp/B003YPCDU8/ref=sr_1_14/275-7196464-8359954?s=beauty&ie=UTF8&qid=1395127212&sr=1-14,[<a href="/gp/help/seller/at-a-glance.html/275-7196464-8359954?ie=UTF8&amp;seller=ATIGDIRBCF9VS">Haneez</a>],Amazon.in: Buy Nautica Pure By Nautica Edt Spray 100.55 ml Online at Best Price in India | Amazon Beauty Store,Buy Nautica Pure By Nautica Edt Spray 100.55 ml at lowest price in India on Amazon.in. Check out Nautica Pure By Nautica Edt Spray 100.55 ml reviews  ratings  features  specifications and browse more Beauty products online at best prices on Amazon.in.,None,<div class="bucket" id="productDescription"> <h2>Product Description</h2> <div class="content"> <h3 class="productDescriptionSource"></h3> <div class="productDescriptionWrapper">        Design House: Nautica  Year Introduced: 2010  Recommended Use: Casual  Recommended Use: Casual              <div class="emptyClear"> </div> </div> </div> </div>,None,18:03:2014,None
B001CT0AGC,Nautica Blue EDT Spray for Men  100ml,http://www.amazon.in/Fragrances/b/ref=sd_allcat_beauty_fragrance/276-6718833-1247838?ie=UTF8&node=1374298031,None,Fragranc,Men,NAUTICA,http://ecx.images-amazon.com/images/I/41gkgYfVw6L._AA160_.jpg,None,self Colour,Beauty & Health,http://www.amazon.in/Nautica-Blue-EDT-Spray-100ml/dp/B001CT0AGC/ref=sr_1_1/275-7196464-8359954?s=beauty&ie=UTF8&qid=1395127212&sr=1-1,[<a href="/gp/help/seller/at-a-glance.html/275-7196464-8359954?ie=UTF8&amp;seller=A2IT7998C8946H">Perfume Nation</a>],Amazon.in: Buy Nautica Blue EDT Spray for Men  100ml Online at Best Price in India | Amazon Beauty Store,Buy Nautica Blue EDT Spray for Men  100ml at lowest price in India on Amazon.in. Check out Nautica Blue EDT Spray for Men  100ml reviews  ratings  features  specifications and browse more Beauty products online at best prices on Amazon.in.,None,<div class="bucket" id="productDescription"> <h2>Product Description</h2> <div class="content"> <h3 class="productDescriptionSource"></h3> <div class="productDescriptionWrapper">        Nautica Blue by Nautica for Men EDT Spray 100.5 milliliters Peach  Pineapple  Jasmine  Cedar  Bergamot  Musk  Sandalwood  Water Lily when applying any fragrance please consider that there are several factors which can affect the natural smell of your skin and  in turn  the way a scent smells on you. For instance  your mood  stress level  age  body chemistry  diet and current medications may all alter the scents you wear. Similarly  factor such as dry or oily skin can even affect the amount of time a fragrance will last after being applied.              <div class="emptyClear"> </div> </div> </div> </div>,None,18:03:2014,None
