208390_c-2165,panasonic camcorder hc-v110 - black,http://www.bagittoday.com/cameras-and-camcorders/c-2163/,r15899/-,Cameras & Camcorders,Camcorders,panasonic,http://images.bagittoday.com/0/images/product/208390/Panasonic_Camcorder_HC-V110_-_Black_225X225_00_0.jpg,r 16990/-,BLACK,Electronics & Mobiles,http://www.bagittoday.com/panasonic-camcorder-hc-v110---black/pr-208390_c-2165/,bagittoday.com,Panasonic Camcorder HC-V110 - Black,Buy original Panasonic Camcorder HC-V110 - Black at best price in India. Read its features  reviews and specifications. Get fast & assured delivery all over India.,[''  'aV_1_0'  'BLACK'],<div class="tabs-content">                  <p><b>Features:</b></p><ul><li>35 mm Equivalent Focal Length: 34.4 - 1646 mm </li><li>8.9 Megapixel </li><li>2.7 inch Wide LCD Monitor </li><li>Full HD Recording </li><li>f/1.8 - f/4.2 Aperture </li><li>BSI MOS Image Sensor </li><li>38x Optical Zoom</li></ul><b>Specifications:</b><ul><li>General:<ul><li>Brand: Panasonic </li><li>Type: Camcorder </li><li>Model ID: HC-V110</li></ul></li><li>Dimension:<ul><li>Weight: 181 g (without Battery and SD Card) </li><li>Dimensions: 53 (W) x 60 (H) x 114 (D) mm</li></ul></li><li>Pixels:<ul><li>Optical Sensor Resolution (in MegaPixel): 8.9 Megapixels </li><li>Other Resolution: Recording / Playback Mode: HA (17 Mbps / VBR)  (1920 x 1080) HG (13 Mbps / VBR)  (1920 x 1080) HE (5 Mbps / VBR)  (1920 x 1080) iFrame (28 Mbps / VBR)  (960 x 540) MP4 (1.5 Mbps / VBR)  (640 x 360)  Image Size: 16:9 Aspect Ratio 3968 x 2232 (8.9 M)  1920 x 1080 (2.1 M)</li></ul></li><li>Zoom - Optical Zoom: 38x </li><li>LCD:<ul><li>LCD Display: Wide LCD Monitor </li><li>LCD Screen Size: 2.7 inch </li><li>Image Display Resolution: 230 400 dots </li><li>Video Display Resolution: 1920 x 1080 </li><li>Supported Aspect Ratio: 16:09</li></ul></li><li>Sensor:<ul><li>Sensor Type: BSI MOS </li><li>Sensor Size: 1/5.8 inch</li></ul></li><li>Lens:<ul><li>Auto Focus: Auto </li><li>Lens Type: Panasonic Lens </li><li>Manual Focus: Yes </li><li>Focal Length: 2.35 - 89.3 mm (35 mm Equivalent to 34.4 - 1646 mm)</li></ul></li><li>Battery:<ul><li>Power Supply: 5.0 V (AC Adaptor) </li><li>Battery Type: Li-ion Rechargeable Battery</li></ul></li><li>Interface:<ul><li>Microphone: Stereo </li><li>USB Cable: Hi-speed USB 2.0 </li><li>Audio Video Interface: Audio / Video Output (NTSC  PAL)</li></ul></li><li>Media And Software:<ul><li>Upgradeable Memory: Yes </li><li>Memory Card Type: SD / SDHC / SDXC</li></ul></li><li>Image:<ul><li>Audio Formats: Dolby Digital (2ch)  AAC (2ch) </li><li>Image Sizing: 3968 x 2232 (8.9 M) </li><li>Video Format: MPEG-4 AVC / H.264 </li><li>Image Format: JPEG  EXIF 2.2  DCF</li></ul></li><li>Shutter Speed:<ul><li>Maximum Shutter Speed: 1/8000 sec </li><li>Minimum Shutter Speed: 1/30 sec</li></ul></li><li>Other Features:<ul><li>Additional Features: 1400 lx Standard Illumination  Iris (Auto / Manual)  Thumbnail Display (20 Thumbnails / Page  9 Thumbnails / Page  1 Thumbnail / Page)  Dynamic Speaker  0.6 sec Quick Start </li><li>HDMI: Mini HDMI </li><li>Picture Angle: 34.4 mm Wide-angle </li><li>White Balancing: Auto  Indoor1  Indoor2  Sunny  Cloudy  White Set </li><li>Supported Languages: 10 </li><li>Aperture Range: F1.8 (W) - F4.2 (T)</li></ul></li></ul></div>,None,1203i2014,None
208391_c-2165,panasonic camcorder hv-v210 - black,http://www.bagittoday.com/cameras-and-camcorders/c-2163/,r20576/-,Cameras & Camcorders,Camcorders,panasonic,http://images.bagittoday.com/0/images/product/208391/Panasonic_Camcorder_HV-V210_-_Black_225X225_00_0.jpg,r 21990/-,BLACK,Electronics & Mobiles,http://www.bagittoday.com/panasonic-camcorder-hv-v210---black/pr-208391_c-2165/,bagittoday.com,Panasonic Camcorder HV-V210 - Black,Buy original Panasonic Camcorder HV-V210 - Black at best price in India. Read its features  reviews and specifications. Get fast & assured delivery all over India.,[''  'aV_1_0'  'BLACK'],<div class="tabs-content">                  <p><b>Features:</b></p><ul><li>f/1.8 - f/4.2 Aperture </li><li>Full HD Recording </li><li>10 Megapixel </li><li>2.7 inch Wide LCD Monitor </li><li>BSI MOS Image Sensor </li><li>38x Optical Zoom </li><li>35 mm Equivalent Focal Length: 32.3 - 1365 mm</li></ul><b>Specifications:</b><ul><li>General:<ul><li>Brand: Panasonic </li><li>Type: Camcorder </li><li>Model ID: HC-V210</li></ul></li><li>Dimension:<ul><li>Weight: 184 g (without Battery and SD Card) </li><li>Dimensions: 53 (W) x 60 (H) x 114 (D) mm</li></ul></li><li>Pixels:<ul><li>Optical Sensor Resolution (in MegaPixel): 10 Megapixels </li><li>Other Resolution: Recording / Playback Mode: HA (17 Mbps / VBR)  (1920 x 1080) HG (13 Mbps / VBR)  (1920 x 1080) HE (5 Mbps / VBR)  (1920 x 1080) iFrame (28 Mbps / VBR)  (960 x 540) MP4 (1.5 Mbps / VBR)  (640 x 360)  Image Size: 16:9 Aspect Ratio 4224 x 2376 (8.9 M)  1920 x 1080 (2.1 M)</li></ul></li><li>Zoom - Optical Zoom: 38x </li><li>LCD:<ul><li>LCD Display: Wide LCD Monitor </li><li>LCD Screen Size: 2.7 inch </li><li>Image Display Resolution: 230 400 dots </li><li>Video Display Resolution: 1920 x 1080 </li><li>Supported Aspect Ratio: 16:09</li></ul></li><li>Sensor:<ul><li>Sensor Type: BSI MOS </li><li>Sensor Size: 1/5.8 inch</li></ul></li><li>Lens:<ul><li>Auto Focus: Auto </li><li>Lens Type: Panasonic Lens </li><li>Manual Focus: Yes </li><li>Focal Length: 2.35 - 89.3 mm (35 mm Equivalent to 32.3 - 1365 mm)</li></ul></li><li>Battery:<ul><li>Power Supply: 5.0 V (AC Adaptor) </li><li>Battery Type: Li-ion Rechargeable Battery</li></ul></li><li>Interface:<ul><li>Microphone: Stereo </li><li>USB Cable: Hi-speed USB 2.0 </li><li>Audio Video Interface: Audio / Video Output (NTSC  PAL)</li></ul></li><li>Media And Software:<ul><li>Upgradeable Memory: Yes </li><li>Memory Card Type: SD / SDHC / SDXC</li></ul></li><li>Image:<ul><li>Audio Formats: Dolby Digital (2ch)  AAC (2ch) </li><li>Image Sizing: 4224 x 2376 (10 M) </li><li>Video Format: MPEG-4 AVC / H.264 </li><li>Image Format: JPEG  EXIF 2.2  DCF</li></ul></li><li>Shutter Speed:<ul><li>Maximum Shutter Speed: 1/8000 sec </li><li>Minimum Shutter Speed: 1/30 sec</li></ul></li><li>Other Features:<ul><li>Additional Features: 1400 lx Standard Illumination  Iris (Auto / Manual)  Thumbnail Display (20 Thumbnails / Page  9 Thumbnails / Page  1 Thumbnail / Page)  Dynamic Speaker  0.6 sec Quick Start  135 min of Recording </li><li>HDMI: Mini HDMI </li><li>Picture Angle: 32.3 mm Wide-angle </li><li>White Balancing: Auto  Indoor1  Indoor2  Sunny  Cloudy  White Set </li><li>Supported Languages: 10 </li><li>Aperture Range: F1.8 (W) - F4.2 (T)</li></ul></li></ul></div>,None,1203i2014,None
208392_c-2165,panasonic camcorder hc-v720 - black,http://www.bagittoday.com/cameras-and-camcorders/c-2163/,r36699/-,Cameras & Camcorders,Camcorders,panasonic,http://images.bagittoday.com/0/images/product/208392/Panasonic_Camcorder_HC-V720_-_Black_225X225_00_0.jpg,r 39990/-,BLACK,Electronics & Mobiles,http://www.bagittoday.com/panasonic-camcorder-hc-v720---black/pr-208392_c-2165/,bagittoday.com,Panasonic Camcorder HC-V720 - Black,Buy original Panasonic Camcorder HC-V720 - Black at best price in India. Read its features  reviews and specifications. Get fast & assured delivery all over India.,[''  'aV_1_0'  'BLACK'],<div class="tabs-content">                  <p><b>Features:</b></p><ul><li>3 inch Wide Touch LCD </li><li>17.52 Megapixel </li><li>21x Optical Zoom and 50x Digital Zoom </li><li>Full HD Recording </li><li>High Sensitivity MOS Sensor </li><li>35 mm Equivalent Focal Length: 28 - 729.6 mm </li><li>f/1.8 - f/3.5 Aperture</li></ul><b>Specifications:</b><ul><li>General:<ul><li>Brand: Panasonic </li><li>Type: Camcorder </li><li>Color: Black </li><li>Model ID: HC-V720</li></ul></li><li>Dimension:<ul><li>Weight: 277 g (without Battery and SD Meomry Card) </li><li>Dimensions: 60.1 (W) x 69.3 (H) x 124.4 (D) mm</li></ul></li><li>Pixels:<ul><li>Optical Sensor Resolution (in MegaPixel): 17.52 Megapixels </li><li>Other Resolution: Still Image: 16:9 Aspect Ratio 6016 x 3384 (20.4 M)  4096 x 2304 (9.4 M)  1920 x 1080 (2.1 M)  3:2 Aspect Ratio 4752 x 3168 (15.1 M)  3456 x 2304 (8 M)  1728 x 1152 (2 M)  4:3 Aspect Ratio 4480 x 3360 (15.1 M)  2784 x 2088 (5.8 M)  640 x 480 (0.3 M)  Simultaneous Recording: 16:9 Aspect Ratio 4096 x 2304 (9.4 M)  1920 x 1080 (2.1 M)  Recording / Playback Mode: 1080/60p 28Mbps / VBR  1920 x 1080 / PH 24 Mbps / VBR  1920 x 1080 / HA 17 Mbps / VBR  1920 x 1080 / HG 13 Mbps / VBR  1920 x 1080 / HE 5 Mbps / VBR  1920 x 1080 / iFrame 28 Mbps / VBR  960 x 540</li></ul></li><li>Zoom:<ul><li>Optical Zoom: 21x </li><li>Digital Zoom: 50x</li></ul></li><li>LCD:<ul><li>LCD Display: Wide Touch LCD Monitor </li><li>LCD Screen Size: 3 inch </li><li>Image Display Resolution: 460 800 dots </li><li>Video Display Resolution: 1920 x 1080  60p </li><li>Supported Aspect Ratio: 4:3  16:9  3:2</li></ul></li><li>Sensor:<ul><li>Sensor Type: High Sensitivity MOS </li><li>Sensor Size: 1/2.33 inch</li></ul></li><li>Lens:<ul><li>Auto Focus: Auto </li><li>Lens Type: Panasonic Lens </li><li>Manual Focus: Yes </li><li>Focal Length: 2.82 - 59.2 mm (35 mm Equivalent to 28 - 729.6 mm)</li></ul></li><li>Power Supply: 5.0 V (AC Adaptor) </li><li>Interface:<ul><li>Microphone: Stereo </li><li>USB Cable: Hi-speed USB 2.0 </li><li>Audio Video Interface: Audio / Video Output (NTSC  PAL)</li></ul></li><li>Media And Software:<ul><li>Upgradeable Memory: Yes </li><li>Memory Card Type: SD / SDHC / SDXC </li><li>Wi-Fi: Yes</li></ul></li><li>Image:<ul><li>Audio Formats: AAC </li><li>Image Sizing: 6016 x 3384 (20.4 M) </li><li>Video Format: AVCHD  MPEG-4  AVC  H.264 </li><li>Image Format: JPEG  DCF  EXIF 2.2</li></ul></li><li>Flash - Built in Flash: Yes </li><li>Shutter Speed:<ul><li>Maximum Shutter Speed: 1/2000 sec </li><li>Minimum Shutter Speed: 1/2 sec</li></ul></li><li>Other Features:<ul><li>Additional Features: Effective Pixels: Motion Image 4.14 Megapixels (16:9 Aspect Ratio) Level Shot Function OFF  Still Image 4.14 Megapixels (16:9 Aspect Ratio)  3.24 Megapixels (3:2 Aspect Ratio)  3.24 Megapixels (4:3 Aspect Ratio)  35 mm Equivalent Film Camera: Motion Image (28.0 - 729.6 mm (16:9 Aspect Ratio)  Still Image (33.2 - 697.6 mm (3:2 Aspect Ratio)  33.9 - 712.6 mm (4:3 Aspect Ratio))  46 mm Filter Diameter  1400 lx Standard Illumination  3 lx Minimum Illumination (Scene Mode Low Light 1/30)  1 lx (Color Night)  Auto Focus  26x Intelligent Zoom OFF  50x Intelligent Zoom ON  Digital Zoom 1 (60x / 1500x Maximum Value of Zoom Magnification)  Shutter Speed: Motion Image (60p / 60i)  Auto Slow Shutter ON (1/30 sec - 1/8000 sec)  Auto Slow Shutter OFF (1/60 sec - 1/8000 sec)  Iris (Auto / Manual)  Image Stabilizer (HYBRID O.I.S + with Active Mode  O.I.S Lock  Level Shot Function)  Creative Control (Miniature Effect  Silent Movie  8 mm Movie  Time Lapse Recording)  Microphone (5.1 Surround  Zoom  Focus and Stereo Microphone)  Dynamic Speaker  LED Video Light  Accessory Shoe  On-screen Display Language (English  French  Spanish)  Wi-Fi (Standard IEEE 802.11 b/g/n  Frequency 2.4 GHz  NFC)  Remote WiFi Mobile Device with Ustream Sharing  Built-in Creative Control Effects add Excitement to Videos  Level Shot Automatically Corrects Horizon for Natural Looking Video  Panasonic Image App  NFC (Near Field Communication)  Remote Shooting  Highlight Playback and Easy Share  Home Monitoring  Eye-Fi Compatible  3 High Sensitivity Sensor  Crystal Engine Pro  1080 TV Lines Horizontal Resolution  Wind Noise Canceller  Brightness Control  Touch Shutter  Focus Assist  Pre-recording Function  AGS (Auto Ground-Directional Standby)  Color Night Recording / Color Night View  Scene Mode  Advanced Highlight Playback  Face Highlight  Highlight and Time Frame Index  HD Writer  2D to 3D Conversion </li><li>HDMI: Mini HDMI </li><li>Picture Angle: 28 mm Wide-angle </li><li>White Balancing: Auto  Indoor 1  Indoor 2  Sunny  Cloudy  White Set </li><li>Supported Languages: 10 </li><li>Aperture Range: F1.8 (W) - F3.5 (T)</li></ul></li><li>Warranty Summary: 3 year Panasonic India Warranty</li></ul></div>,None,1203i2014,None
60623_c-2165,panasonic sdr h80 camcorder,http://www.bagittoday.com/cameras-and-camcorders/c-2163/,r25999/-,Cameras & Camcorders,Camcorders,panasonic,http://images.bagittoday.com/0/images/product/60623/PANASONIC_SDR_H80_CAMCORDER_225X225_00_0.jpg,,None,Electronics & Mobiles,http://www.bagittoday.com/panasonic-sdr-h80-camcorder/pr-60623_c-2165/,bagittoday.com,PANASONIC SDR H80 CAMCORDER | Buy Online India,Buy original PANASONIC SDR H80 CAMCORDER at best price in India. Read its features  reviews and specifications. Get fast & assured delivery all over India.,[],<div class="tabs-content">                  <p>PANASONIC SDR H80 CAMCORDER</p>                            </div>,None,1203i2014,None
