B00HSIWVAO,Prakriti Herbals Shikakai Haircare Kit,http://www.amazon.in/Hair-Care-Styling/b/ref=sd_allcat_beauty_haircare/276-6718833-1247838?ie=UTF8&node=1374305031,None,Hair Care & Stylin,Hair Care Sets,Prakriti Herbals,http://ecx.images-amazon.com/images/I/41rl5ccQhEL._AA160_.jpg,None,self Colour,Beauty & Health,http://www.amazon.in/Prakriti-Herbals-Shikakai-Haircare-Kit/dp/B00HSIWVAO/ref=sr_1_1/279-1694755-9664150?s=beauty&ie=UTF8&qid=1395127195&sr=1-1,[<a href="/gp/help/seller/at-a-glance.html/279-1694755-9664150?ie=UTF8&amp;seller=AYVHX6WA3NN8Y">Prakriti Herbals</a>],Amazon.in: Buy Prakriti Herbals Shikakai Haircare Kit Online at Best Price in India | Amazon Beauty Store,Buy Prakriti Herbals Shikakai Haircare Kit at lowest price in India on Amazon.in. Check out Prakriti Herbals Shikakai Haircare Kit reviews  ratings  features  specifications and browse more Beauty products online at best prices on Amazon.in.,None,<div class="bucket" id="productDescription"> <h2>Product Description</h2> <div class="content"> <h3 class="productDescriptionSource"></h3> <div class="productDescriptionWrapper">        Amla Shikakai Haircare Kit specially for oily and normal hair types. Keep oiliness &flat; hair away with a synergistic combination of Nourishing Amla Hibiscus Fenugreek Hair Oil  Amla Shikakai Shampoo  Hydrating Aloevera Cucumber Gel &amp; Silky Jojoba Aloevera Conditioner. It nourishes  strengthens and gives your hair a bounce  keeping dandruff and hair loss at bay Repeat regularly once a week for best results  Suitable for oily-normal type of hair including coloured or permed hair. Free from harmful chemicals in recyclable containers and not tested on animals  Repeat regularly once or twice a week for best results. Contents of the Hair Care hamper for Dry to Normal Hair Types. Nourishing Amla Hibiscus Fenugreek Hair Oil  Hydrating Aloevera Cucumber Gel  Hydrating Aloevera Silky Protein Shampoo  Jojoba Aloevera Silky Conditioner. Suitable for dry to normal type of hair. Free from harmful chemicals in recyclable containers.              <div class="emptyClear"> </div> </div> </div> </div>,None,18:03:2014,None
B00HSIWTKQ,Prakriti Herbals Aloevera Haircare Kit,http://www.amazon.in/Hair-Care-Styling/b/ref=sd_allcat_beauty_haircare/276-6718833-1247838?ie=UTF8&node=1374305031,None,Hair Care & Stylin,Hair Care Sets,Prakriti Herbals,http://ecx.images-amazon.com/images/I/41rl5ccQhEL._AA160_.jpg,None,self Colour,Beauty & Health,http://www.amazon.in/Prakriti-Herbals-Aloevera-Haircare-Kit/dp/B00HSIWTKQ/ref=sr_1_2/279-1694755-9664150?s=beauty&ie=UTF8&qid=1395127195&sr=1-2,[<a href="/gp/help/seller/at-a-glance.html/279-1694755-9664150?ie=UTF8&amp;seller=AYVHX6WA3NN8Y">Prakriti Herbals</a>],Amazon.in: Buy Prakriti Herbals Aloevera Haircare Kit Online at Best Price in India | Amazon Beauty Store,Buy Prakriti Herbals Aloevera Haircare Kit at lowest price in India on Amazon.in. Check out Prakriti Herbals Aloevera Haircare Kit reviews  ratings  features  specifications and browse more Beauty products online at best prices on Amazon.in.,None,<div class="bucket" id="productDescription"> <h2>Product Description</h2> <div class="content"> <h3 class="productDescriptionSource"></h3> <div class="productDescriptionWrapper">        Aloevera Haircare kit for dry to normal hair. Keep frizziness and split ends at bay with a synergistic combination of Nourishing Amla Hibiscus Fenugreek Hair Oil  Hydrating Aloevera Silk Protein Shampoo  Hydrating Aloevera Cucumber Gel &amp; Silky Jojoba Aloevera Conditioner. It nourishes  strengthens and softens your hair  keeping dandruff and hair loss away as well  Repeat regularly once or twice a week for best results  Contents of the Hair Care hamper for Dry to Normal Hair Types  Nourishing Amla Hibiscus Fenugreek Hair Oil  Hydrating Aloevera Cucumber Gel  Hydrating Aloevera Silky Protein Shampoo  Jojoba Aloevera Silky Conditioner  Suitable for dry to normal type of hair. Free from harmful chemicals in recyclable containers.              <div class="emptyClear"> </div> </div> </div> </div>,None,18:03:2014,None
B00HSIWRVC,Prakriti Herbals Hibiscus Haircare Kit,http://www.amazon.in/Hair-Care-Styling/b/ref=sd_allcat_beauty_haircare/276-6718833-1247838?ie=UTF8&node=1374305031,None,Hair Care & Stylin,Hair Care Sets,Prakriti Herbals,http://ecx.images-amazon.com/images/I/41rl5ccQhEL._AA160_.jpg,None,self Colour,Beauty & Health,http://www.amazon.in/Prakriti-Herbals-Hibiscus-Haircare-Kit/dp/B00HSIWRVC/ref=sr_1_4/279-1694755-9664150?s=beauty&ie=UTF8&qid=1395127195&sr=1-4,[<a href="/gp/help/seller/at-a-glance.html/279-1694755-9664150?ie=UTF8&amp;seller=AYVHX6WA3NN8Y">Prakriti Herbals</a>],Amazon.in: Buy Prakriti Herbals Hibiscus Haircare Kit Online at Best Price in India | Amazon Beauty Store,Buy Prakriti Herbals Hibiscus Haircare Kit at lowest price in India on Amazon.in. Check out Prakriti Herbals Hibiscus Haircare Kit reviews  ratings  features  specifications and browse more Beauty products online at best prices on Amazon.in.,None,<div class="bucket" id="productDescription"> <h2>Product Description</h2> <div class="content"> <h3 class="productDescriptionSource"></h3> <div class="productDescriptionWrapper">        Jojoba Aloevera Silky Conditioner.Keep dryness  dandruff and hair loss away with this synergistic combination which nourishes  strengthens and softens your hair  giving it shine and bounce. Repeat regularly once or twice a week for best results. Suitable for all types of hair. Free from harmful chemicals  packaged in recyclable containers. Not tested on animals.              <div class="emptyClear"> </div> </div> </div> </div>,None,18:03:2014,None
B00ITN6BW6,Prakriti Herbals Papaya Aloevera Olive oil Conditioning Hairmask  120ml,http://www.amazon.in/Hair-Care-Styling/b/ref=sd_allcat_beauty_haircare/276-6718833-1247838?ie=UTF8&node=1374305031,None,Hair Care & Stylin,Hair Care Sets,Prakriti Herbals,http://ecx.images-amazon.com/images/I/41rl5ccQhEL._AA160_.jpg,None,self Colour,Beauty & Health,http://www.amazon.in/Prakriti-Herbals-Aloevera-Conditioning-Hairmask/dp/B00ITN6BW6/ref=sr_1_5/279-1694755-9664150?s=beauty&ie=UTF8&qid=1395127195&sr=1-5,[<a href="/gp/help/seller/at-a-glance.html/279-1694755-9664150?ie=UTF8&amp;seller=AYVHX6WA3NN8Y">Prakriti Herbals</a>],Amazon.in: Buy Prakriti Herbals Papaya Aloevera Olive oil Conditioning Hairmask  120ml Online at Best Price in India | Amazon Beauty Store,Buy Prakriti Herbals Papaya Aloevera Olive oil Conditioning Hairmask  120ml at lowest price in India on Amazon.in. Check out Prakriti Herbals Papaya Aloevera Olive oil Conditioning Hairmask  120ml reviews  ratings  features  specifications and browse more Beauty products online at best prices on Amazon.in.,None,<div class="bucket" id="productDescription"> <h2>Product Description</h2> <div class="content"> <h3 class="productDescriptionSource"></h3> <div class="productDescriptionWrapper">        Get a hair spa at home and soften your dry damaged frizzy hair with a ready to use excellent conditioning and softening Papaya aloevera olive oil hairmask made from fresh papaya pulp  aloevera gel  herbal hair oil and olive oil.              <div class="emptyClear"> </div> </div> </div> </div>,None,18:03:2014,None
B00HSIWMTY,Prakriti Herbals Hair care Gift Box-set of 6,http://www.amazon.in/Hair-Care-Styling/b/ref=sd_allcat_beauty_haircare/276-6718833-1247838?ie=UTF8&node=1374305031,None,Hair Care & Stylin,Hair Care Sets,Prakriti Herbals,http://ecx.images-amazon.com/images/I/41rl5ccQhEL._AA160_.jpg,None,self Colour,Beauty & Health,http://www.amazon.in/Prakriti-Herbals-Hair-care-Box-set/dp/B00HSIWMTY/ref=sr_1_3/279-1694755-9664150?s=beauty&ie=UTF8&qid=1395127195&sr=1-3,[<a href="/gp/help/seller/at-a-glance.html/279-1694755-9664150?ie=UTF8&amp;seller=AYVHX6WA3NN8Y">Prakriti Herbals</a>],Amazon.in: Buy Prakriti Herbals Hair care Gift Box-set of 6 Online at Best Price in India | Amazon Beauty Store,Buy Prakriti Herbals Hair care Gift Box-set of 6 at lowest price in India on Amazon.in. Check out Prakriti Herbals Hair care Gift Box-set of 6 reviews  ratings  features  specifications and browse more Beauty products online at best prices on Amazon.in.,None,<div class="bucket" id="productDescription"> <h2>Product Description</h2> <div class="content"> <h3 class="productDescriptionSource"></h3> <div class="productDescriptionWrapper">        Shower your dear one with the love you have always experienced.....Gift them a hamper from Nature herself !! Bring in the festive cheer by giftingthese fabulous hair care hampers complete with heart shaped naturalhandmade soaps. These lovely gift boxes which can be preserved and cherished forever will be gift wrapped &amp; sent with apersonalised note from you to your beloved- your loved one will adorethese unique hampers for sure for adding a shine &amp; bounce to theircrowning glory!!              <div class="emptyClear"> </div> </div> </div> </div>,None,18:03:2014,None
B00ITN6DVU,Prakriti Herbals Papaya Aloevera Olive oil Conditioning Hairmask  200ml,http://www.amazon.in/Hair-Care-Styling/b/ref=sd_allcat_beauty_haircare/276-6718833-1247838?ie=UTF8&node=1374305031,None,Hair Care & Stylin,Hair Care Sets,Prakriti Herbals,http://ecx.images-amazon.com/images/I/41rl5ccQhEL._AA160_.jpg,None,self Colour,Beauty & Health,http://www.amazon.in/Prakriti-Herbals-Aloevera-Conditioning-Hairmask/dp/B00ITN6DVU/ref=sr_1_6/279-1694755-9664150?s=beauty&ie=UTF8&qid=1395127195&sr=1-6,[<a href="/gp/help/seller/at-a-glance.html/279-1694755-9664150?ie=UTF8&amp;seller=AYVHX6WA3NN8Y">Prakriti Herbals</a>],Amazon.in: Buy Prakriti Herbals Papaya Aloevera Olive oil Conditioning Hairmask  200ml Online at Best Price in India | Amazon Beauty Store,Buy Prakriti Herbals Papaya Aloevera Olive oil Conditioning Hairmask  200ml at lowest price in India on Amazon.in. Check out Prakriti Herbals Papaya Aloevera Olive oil Conditioning Hairmask  200ml reviews  ratings  features  specifications and browse more Beauty products online at best prices on Amazon.in.,None,<div class="bucket" id="productDescription"> <h2>Product Description</h2> <div class="content"> <h3 class="productDescriptionSource"></h3> <div class="productDescriptionWrapper">        Get a hair spa at home and soften your dry damaged frizzy hair with a ready to use excellent conditioning and softening Papaya aloevera olive oil hairmask made from fresh papaya pulp  aloevera gel  herbal hair oil and olive oil.              <div class="emptyClear"> </div> </div> </div> </div>,None,18:03:2014,None
B00HSIWIC0,Prakriti Herbals Xmas Haircare Gift hamper,http://www.amazon.in/Hair-Care-Styling/b/ref=sd_allcat_beauty_haircare/276-6718833-1247838?ie=UTF8&node=1374305031,None,Hair Care & Stylin,Hair Care Sets,Prakriti Herbals,http://ecx.images-amazon.com/images/I/41rl5ccQhEL._AA160_.jpg,None,self Colour,Beauty & Health,http://www.amazon.in/Prakriti-Herbals-Xmas-Haircare-hamper/dp/B00HSIWIC0/ref=sr_1_7/279-1694755-9664150?s=beauty&ie=UTF8&qid=1395127195&sr=1-7,[<a href="/gp/help/seller/at-a-glance.html/279-1694755-9664150?ie=UTF8&amp;seller=AYVHX6WA3NN8Y">Prakriti Herbals</a>],Amazon.in: Buy Prakriti Herbals Xmas Haircare Gift hamper Online at Best Price in India | Amazon Beauty Store,Buy Prakriti Herbals Xmas Haircare Gift hamper at lowest price in India on Amazon.in. Check out Prakriti Herbals Xmas Haircare Gift hamper reviews  ratings  features  specifications and browse more Beauty products online at best prices on Amazon.in.,None,<div class="bucket" id="productDescription"> <h2>Product Description</h2> <div class="content"> <h3 class="productDescriptionSource"></h3> <div class="productDescriptionWrapper">        This Christmas   Gift your loved ones a unique gift..It's called PerfectHair !! Bring in the festive cheer by gifting these fabulous haircare hamperscomplete with festive Christmas chocolates. These lovely giftboxes which will be cherished and preserved forever can begift wrapped and sent with a personalised note -Your loved one will adorethese unique hampers for sure for adding a shine &amp; bounce to theircrowning glory!!              <div class="emptyClear"> </div> </div> </div> </div>,None,18:03:2014,None
