B00BO8EYFY,Champion Eau De Toilette Spray 90ml/3oz,http://www.amazon.in/Fragrances/b/ref=sd_allcat_beauty_fragrance/276-6718833-1247838?ie=UTF8&node=1374298031,Rs. 2 149.00,Fragranc,Perfume,Davidoff,http://ecx.images-amazon.com/images/I/31JMYNUU0gL._AA160_.jpg,Rs. 2 149.00,self Colour,Beauty & Health,http://www.amazon.in/Champion-Eau-Toilette-Spray-90ml/dp/B00BO8EYFY/ref=sr_1_3/275-4834488-1298866?s=beauty&ie=UTF8&qid=1395126962&sr=1-3,[<a class="buyAction" href="/gp/offer-listing/B00BO8EYFY/ref=dp_olp_0/275-4834488-1298866?ie=UTF8&amp;condition=all">these sellers</a>],Amazon.in: Buy Champion Eau De Toilette Spray 90ml/3oz Online at Best Price in India | Amazon Beauty Store,Buy Champion Eau De Toilette Spray 90ml/3oz at lowest price in India on Amazon.in. Check out Champion Eau De Toilette Spray 90ml/3oz reviews  ratings  features  specifications and browse more Beauty products online at best prices on Amazon.in.,None,None,None,18:03:2014,None
B00EXW64YW,Cool Water Sensual Essence By Zino Davidoff Edp Spray For Women 3.4 Oz,http://www.amazon.in/Fragrances/b/ref=sd_allcat_beauty_fragrance/276-6718833-1247838?ie=UTF8&node=1374298031,Rs. 2 900.00,Fragranc,Perfume,Davidoff,http://ecx.images-amazon.com/images/I/31JMYNUU0gL._AA160_.jpg,Rs. 2 900.00,self Colour,Beauty & Health,http://www.amazon.in/Water-Sensual-Essence-Davidoff-Spray/dp/B00EXW64YW/ref=sr_1_4/275-4834488-1298866?s=beauty&ie=UTF8&qid=1395126962&sr=1-4,[<a class="buyAction" href="/gp/offer-listing/B00EXW64YW/ref=dp_olp_0/275-4834488-1298866?ie=UTF8&amp;condition=all">these sellers</a>],Amazon.in: Buy Cool Water Sensual Essence By Zino Davidoff Edp Spray For Women 3.4 Oz Online at Best Price in India | Amazon Beauty Store,Buy Cool Water Sensual Essence By Zino Davidoff Edp Spray For Women 3.4 Oz at lowest price in India on Amazon.in. Check out Cool Water Sensual Essence By Zino Davidoff Edp Spray For Women 3.4 Oz reviews  ratings  features  specifications and browse more Beauty products online at best prices on Amazon.in.,None,None,None,18:03:2014,None
B005LBRYPM,Davidoff Champion Energy Men 90ML,http://www.amazon.in/Fragrances/b/ref=sd_allcat_beauty_fragrance/276-6718833-1247838?ie=UTF8&node=1374298031,None,Fragranc,Perfume,Davidoff,http://ecx.images-amazon.com/images/I/31JMYNUU0gL._AA160_.jpg,None,self Colour,Beauty & Health,http://www.amazon.in/Davidoff-Champion-Energy-Men-90ML/dp/B005LBRYPM/ref=sr_1_6/275-4834488-1298866?s=beauty&ie=UTF8&qid=1395126962&sr=1-6,[<a href="/gp/help/seller/at-a-glance.html/275-4834488-1298866?ie=UTF8&amp;seller=A22G8HZGXYSWPZ">Taha &amp; Bros.</a>],Amazon.in: Buy Davidoff Champion Energy Men 90ML Online at Best Price in India | Amazon Beauty Store,Buy Davidoff Champion Energy Men 90ML at lowest price in India on Amazon.in. Check out Davidoff Champion Energy Men 90ML reviews  ratings  features  specifications and browse more Beauty products online at best prices on Amazon.in.,None,<div class="bucket" id="productDescription"> <h2>Product Description</h2> <div class="content"> <h3 class="productDescriptionSource"></h3> <div class="productDescriptionWrapper">        Successor of the last year's edition Champion is a new fragrance for men Champion Energy  which arrives on the market in July 2011. The new fragrance for men will be available in the same flacon as previous edition Champion  but composed of white cylindrical body and weights colored in metallic silver. The new masculine edition was created by perfumer Aurelien Guichard. Composition of Champion Energy opens with energetic and luminous notes of bergamot and grapefruit. A heart is ruled by galbanum and fresh  cold spices  while a base leaves a trail of cedar and oak moss. Advertising face of the new fragrance will be Tyler Wood. Champion Energy hits the shelves as 30  50 and 90 ml EDT  accompanied by perfumed body care products.              <div class="emptyClear"> </div> </div> </div> </div>,None,18:03:2014,None
B00733IRWU,Davidoff Cool Water Deodorant Spray 100ml/3.4oz,http://www.amazon.in/Fragrances/b/ref=sd_allcat_beauty_fragrance/276-6718833-1247838?ie=UTF8&node=1374298031,None,Fragranc,Perfume,Davidoff,http://ecx.images-amazon.com/images/I/31JMYNUU0gL._AA160_.jpg,None,self Colour,Beauty & Health,http://www.amazon.in/Davidoff-Water-Deodorant-Spray-100ml/dp/B00733IRWU/ref=sr_1_1/275-4834488-1298866?s=beauty&ie=UTF8&qid=1395126962&sr=1-1,[<a href="/gp/help/seller/at-a-glance.html/275-4834488-1298866?ie=UTF8&amp;seller=A3ES9F57NVVRIK">MyLuckyScent</a>],Amazon.in: Buy Davidoff Cool Water Deodorant Spray 100ml/3.4oz Online at Best Price in India | Amazon Beauty Store,Buy Davidoff Cool Water Deodorant Spray 100ml/3.4oz at lowest price in India on Amazon.in. Check out Davidoff Cool Water Deodorant Spray 100ml/3.4oz reviews  ratings  features  specifications and browse more Beauty products online at best prices on Amazon.in.,None,None,None,18:03:2014,None
B0012RX79Q,ECHO WOMAN DAVIDOFF FOR WOMEN 100 ML,http://www.amazon.in/Fragrances/b/ref=sd_allcat_beauty_fragrance/276-6718833-1247838?ie=UTF8&node=1374298031,None,Fragranc,Perfume,Davidoff,http://ecx.images-amazon.com/images/I/31JMYNUU0gL._AA160_.jpg,None,self Colour,Beauty & Health,http://www.amazon.in/ECHO-WOMAN-DAVIDOFF-FOR-WOMEN/dp/B0012RX79Q/ref=sr_1_10/275-4834488-1298866?s=beauty&ie=UTF8&qid=1395126962&sr=1-10,[<a href="/gp/help/seller/at-a-glance.html/275-4834488-1298866?ie=UTF8&amp;seller=A3ES9F57NVVRIK">MyLuckyScent</a>],Amazon.in: Buy ECHO WOMAN DAVIDOFF FOR WOMEN 100 ML Online at Best Price in India | Amazon Beauty Store,Buy ECHO WOMAN DAVIDOFF FOR WOMEN 100 ML at lowest price in India on Amazon.in. Check out ECHO WOMAN DAVIDOFF FOR WOMEN 100 ML reviews  ratings  features  specifications and browse more Beauty products online at best prices on Amazon.in.,None,<div class="bucket" id="productDescription"> <h2>Product Description</h2> <div class="content"> <h3 class="productDescriptionSource"></h3> <div class="productDescriptionWrapper">        Its scent possesses a blend of nutmeg  suede  black pepper  sandalwood  pimento  musk  and cedarwood entice everybody with echo woman.              <div class="emptyClear"> </div> </div> </div> </div>,None,18:03:2014,None
B000G9820A,Zino Davidoff Cool Water Cool Summer By Zino Davidoff For Women Eau De Toilette Spray 3.4-Ounce / 100 Ml,http://www.amazon.in/Fragrances/b/ref=sd_allcat_beauty_fragrance/276-6718833-1247838?ie=UTF8&node=1374298031,Rs. 3 720.00,Fragranc,Perfume,Davidoff,http://ecx.images-amazon.com/images/I/31JMYNUU0gL._AA160_.jpg,Rs. 3 720.00,self Colour,Beauty & Health,http://www.amazon.in/Davidoff-Water-Summer-Toilette-3-4-Ounce/dp/B000G9820A/ref=sr_1_13/275-4834488-1298866?s=beauty&ie=UTF8&qid=1395126962&sr=1-13,[<a class="buyAction" href="/gp/offer-listing/B000G9820A/ref=dp_olp_0/275-4834488-1298866?ie=UTF8&amp;condition=all">these sellers</a>],Amazon.in: Buy Zino Davidoff Cool Water Cool Summer By Zino Davidoff For Women Eau De Toilette Spray 3.4-Ounce / 100 Ml Online at Best Price in India | Amazon Beauty Store,Buy Zino Davidoff Cool Water Cool Summer By Zino Davidoff For Women Eau De Toilette Spray 3.4-Ounce / 100 Ml at lowest price in India on Amazon.in. Check out Zino Davidoff Cool Water Cool Summer By Zino Davidoff For Women Eau De Toilette Spray 3.4-Ounce / 100 Ml reviews  ratings  features  specifications and browse more Beauty products online at best prices on Amazon.in.,None,None,None,18:03:2014,None
B000JLEXEO,Davidoff Cool Water Game for Women  100ml,http://www.amazon.in/Fragrances/b/ref=sd_allcat_beauty_fragrance/276-6718833-1247838?ie=UTF8&node=1374298031,None,Fragranc,Perfume,Davidoff,http://ecx.images-amazon.com/images/I/31JMYNUU0gL._AA160_.jpg,None,self Colour,Beauty & Health,http://www.amazon.in/Davidoff-Cool-Water-Women-100ml/dp/B000JLEXEO/ref=sr_1_7/275-4834488-1298866?s=beauty&ie=UTF8&qid=1395126962&sr=1-7,[<a href="/gp/help/seller/at-a-glance.html/275-4834488-1298866?ie=UTF8&amp;seller=A29ZFTNVZHDXBZ">Route2Fashion</a>],Amazon.in: Buy Davidoff Cool Water Game for Women  100ml Online at Best Price in India | Amazon Beauty Store,Buy Davidoff Cool Water Game for Women  100ml at lowest price in India on Amazon.in. Check out Davidoff Cool Water Game for Women  100ml reviews  ratings  features  specifications and browse more Beauty products online at best prices on Amazon.in.,None,<div class="bucket" id="productDescription"> <h2>Product Description</h2> <div class="content"> <h3 class="productDescriptionSource"></h3> <div class="productDescriptionWrapper">        Fragrant freshness that is really Cool Water Game an EDT Pour Femme  for women by Davidoff is packed in an attractive blue bottle with a design pattern. This is a mix of flowery and spicy notes . The fragrance is for casual wear.              <div class="emptyClear"> </div> </div> </div> </div>,None,18:03:2014,None
B001FWXIL0,DAVIDOFF ADVENTURE FOR MEN 100ML,http://www.amazon.in/Fragrances/b/ref=sd_allcat_beauty_fragrance/276-6718833-1247838?ie=UTF8&node=1374298031,None,Fragranc,Perfume,Davidoff,http://ecx.images-amazon.com/images/I/31JMYNUU0gL._AA160_.jpg,None,self Colour,Beauty & Health,http://www.amazon.in/DAVIDOFF-ADVENTURE-FOR-MEN-100ML/dp/B001FWXIL0/ref=sr_1_5/275-4834488-1298866?s=beauty&ie=UTF8&qid=1395126962&sr=1-5,[<a href="/gp/help/seller/at-a-glance.html/275-4834488-1298866?ie=UTF8&amp;seller=A22G8HZGXYSWPZ">Taha &amp; Bros.</a>],Amazon.in: Buy DAVIDOFF ADVENTURE FOR MEN 100ML Online at Best Price in India | Amazon Beauty Store,Buy DAVIDOFF ADVENTURE FOR MEN 100ML at lowest price in India on Amazon.in. Check out DAVIDOFF ADVENTURE FOR MEN 100ML reviews  ratings  features  specifications and browse more Beauty products online at best prices on Amazon.in.,None,<div class="bucket" id="productDescription"> <h2>Product Description</h2> <div class="content"> <h3 class="productDescriptionSource"></h3> <div class="productDescriptionWrapper">        Launched by the design house of Davidoff in 2008 DAVIDOFF ADVENTURE is a men s fragrance that possesses a blend of Woody and spicy with mandarin lemon bergamot black sesame pimento cedar vetiver and white musksWhen applying any fragrance please consider that there are several factors which can affect the natural smell of your skin and in turn the way a scent smells on you. For instance your mood stress level age body chemistry diet and current medications may all alter the scents you wear. Similarly factor such as dry or oily skin can even affect the amount of time a fragrance will last after being appliedFeatures1) Packaging for this product may vary from that shown in the image above2) This item is not for sale in Catalina Island              <div class="emptyClear"> </div> </div> </div> </div>,None,18:03:2014,None
B00EXW2LI0,Champion,http://www.amazon.in/Fragrances/b/ref=sd_allcat_beauty_fragrance/276-6718833-1247838?ie=UTF8&node=1374298031,Rs. 2 275.00,Fragranc,Perfume,Davidoff,http://ecx.images-amazon.com/images/I/31JMYNUU0gL._AA160_.jpg,Rs. 2 275.00,self Colour,Beauty & Health,http://www.amazon.in/Davidoff-Champion/dp/B00EXW2LI0/ref=sr_1_2/275-4834488-1298866?s=beauty&ie=UTF8&qid=1395126962&sr=1-2,[<a class="buyAction" href="/gp/offer-listing/B00EXW2LI0/ref=dp_olp_0/275-4834488-1298866?ie=UTF8&amp;condition=all">these sellers</a>],Amazon.in: Buy Champion Online at Best Price in India | Amazon Beauty Store,Buy Champion at lowest price in India on Amazon.in. Check out Champion reviews  ratings  features  specifications and browse more Beauty products online at best prices on Amazon.in.,None,<div class="bucket" id="productDescription"> <h2>Product Description</h2> <div class="content"> <h3 class="productDescriptionSource"></h3> <div class="productDescriptionWrapper">        Champions Deserve A Fragrance Like This !! Champion An Eau De Toilette For Men By Davidoff Is Fragrance Created For Champions. This Impressive Fragrance Is Energetic In Its Content. The Notes Of The Fragrance Are Fruity And Woody. The Ingredients Of The              <div class="emptyClear"> </div> </div> </div> </div>,None,18:03:2014,None
B002P6BL5A,Hot Water After Shave Lotion By Davidoff For Men 110 ml,http://www.amazon.in/Fragrances/b/ref=sd_allcat_beauty_fragrance/276-6718833-1247838?ie=UTF8&node=1374298031,None,Fragranc,Perfume,Davidoff,http://ecx.images-amazon.com/images/I/31JMYNUU0gL._AA160_.jpg,None,self Colour,Beauty & Health,http://www.amazon.in/Water-After-Shave-Lotion-Davidoff/dp/B002P6BL5A/ref=sr_1_11/275-4834488-1298866?s=beauty&ie=UTF8&qid=1395126962&sr=1-11,[<a href="/gp/help/seller/at-a-glance.html/275-4834488-1298866?ie=UTF8&amp;seller=A2NFQIUV2YGOLG">Fragume</a>],Amazon.in: Buy Hot Water After Shave Lotion By Davidoff For Men 110 ml Online at Best Price in India | Amazon Beauty Store,Buy Hot Water After Shave Lotion By Davidoff For Men 110 ml at lowest price in India on Amazon.in. Check out Hot Water After Shave Lotion By Davidoff For Men 110 ml reviews  ratings  features  specifications and browse more Beauty products online at best prices on Amazon.in.,None,<div class="bucket" id="productDescription"> <h2>Product Description</h2> <div class="content"> <h3 class="productDescriptionSource"></h3> <div class="productDescriptionWrapper">        This fragrance is much like desires- raw  fiery and carnal. The sizzling aromas of absynth  red basil  pimento and patchouli add to its red hot charisma. And  you thought a perfume cannot reflect your inner desires! The clean  sharp and edgy feel of this fragrance definitely places it on our hot favourite list.              <div class="emptyClear"> </div> </div> </div> </div>,None,18:03:2014,None
B00BQKAUSU,Silver Shadow Altitude Eau De Toilette Spray 100ml/3.4oz,http://www.amazon.in/Fragrances/b/ref=sd_allcat_beauty_fragrance/276-6718833-1247838?ie=UTF8&node=1374298031,Rs. 2 040.00,Fragranc,Perfume,Davidoff,http://ecx.images-amazon.com/images/I/31JMYNUU0gL._AA160_.jpg,Rs. 2 040.00,self Colour,Beauty & Health,http://www.amazon.in/Silver-Shadow-Altitude-Toilette-Spray/dp/B00BQKAUSU/ref=sr_1_12/275-4834488-1298866?s=beauty&ie=UTF8&qid=1395126962&sr=1-12,[<a class="buyAction" href="/gp/offer-listing/B00BQKAUSU/ref=dp_olp_0/275-4834488-1298866?ie=UTF8&amp;condition=all">these sellers</a>],Amazon.in: Buy Silver Shadow Altitude Eau De Toilette Spray 100ml/3.4oz Online at Best Price in India | Amazon Beauty Store,Buy Silver Shadow Altitude Eau De Toilette Spray 100ml/3.4oz at lowest price in India on Amazon.in. Check out Silver Shadow Altitude Eau De Toilette Spray 100ml/3.4oz reviews  ratings  features  specifications and browse more Beauty products online at best prices on Amazon.in.,None,None,None,18:03:2014,None
