B00I4QA5S4,Ancient Living Natural Hair oil,http://www.amazon.in/Hair-Care-Styling/b/ref=sd_allcat_beauty_haircare/276-6718833-1247838?ie=UTF8&node=1374305031,Rs. 225.00,Hair Care & Stylin,Hair Oils,Ancient Living,http://ecx.images-amazon.com/images/I/41XBBDnRWxL._AA160_.jpg,Rs. 225.00,self Colour,Beauty & Health,http://www.amazon.in/Ancient-Living-Natural-Hair-oil/dp/B00I4QA5S4/ref=sr_1_5/278-6342540-8321801?s=beauty&ie=UTF8&qid=1395127279&sr=1-5,[<a class="buyAction" href="/gp/offer-listing/B00I4QA5S4/ref=dp_olp_0/278-6342540-8321801?ie=UTF8&amp;condition=all">these sellers</a>],Amazon.in: Buy Ancient Living Natural Hair oil Online at Best Price in India | Amazon Beauty Store,Buy Ancient Living Natural Hair oil at lowest price in India on Amazon.in. Check out Ancient Living Natural Hair oil reviews  ratings  features  specifications and browse more Beauty products online at best prices on Amazon.in.,None,<div class="bucket" id="productDescription"> <h2>Product Description</h2> <div class="content"> <h3 class="productDescriptionSource"></h3> <div class="productDescriptionWrapper">        Ancient Living Natural Hair oil nourishes the hair roots and effectively controls hair fall. It reduces dandruff  promotes hair growth.              <div class="emptyClear"> </div> </div> </div> </div>,None,18:03:2014,None
B00I4QAA66,Ancient Living Hibiscus Hair oil,http://www.amazon.in/Hair-Care-Styling/b/ref=sd_allcat_beauty_haircare/276-6718833-1247838?ie=UTF8&node=1374305031,Rs. 125.00,Hair Care & Stylin,Hair Oils,Ancient Living,http://ecx.images-amazon.com/images/I/41XBBDnRWxL._AA160_.jpg,Rs. 125.00,self Colour,Beauty & Health,http://www.amazon.in/Ancient-Living-Hibiscus-Hair-oil/dp/B00I4QAA66/ref=sr_1_1/278-6342540-8321801?s=beauty&ie=UTF8&qid=1395127279&sr=1-1,[<a class="buyAction" href="/gp/offer-listing/B00I4QAA66/ref=dp_olp_0/278-6342540-8321801?ie=UTF8&amp;condition=all">these sellers</a>],Amazon.in: Buy Ancient Living Hibiscus Hair oil Online at Best Price in India | Amazon Beauty Store,Buy Ancient Living Hibiscus Hair oil at lowest price in India on Amazon.in. Check out Ancient Living Hibiscus Hair oil reviews  ratings  features  specifications and browse more Beauty products online at best prices on Amazon.in.,None,<div class="bucket" id="productDescription"> <h2>Product Description</h2> <div class="content"> <h3 class="productDescriptionSource"></h3> <div class="productDescriptionWrapper">        Ancient Living Hibiscus hair oil gives you naturally dark black and beautiful hair.It also prevents premature graying of hair by giving hair a lustrous black shine.Regular usage prevents hair fall and fosters hair growth to certain extent.              <div class="emptyClear"> </div> </div> </div> </div>,None,18:03:2014,None
B00I4QAAY8,Ancient Living Bhringraj Hair oil,http://www.amazon.in/Hair-Care-Styling/b/ref=sd_allcat_beauty_haircare/276-6718833-1247838?ie=UTF8&node=1374305031,Rs. 125.00,Hair Care & Stylin,Hair Oils,Ancient Living,http://ecx.images-amazon.com/images/I/41XBBDnRWxL._AA160_.jpg,Rs. 125.00,self Colour,Beauty & Health,http://www.amazon.in/Ancient-Living-Bhringraj-Hair-oil/dp/B00I4QAAY8/ref=sr_1_3/278-6342540-8321801?s=beauty&ie=UTF8&qid=1395127279&sr=1-3,[<a class="buyAction" href="/gp/offer-listing/B00I4QAAY8/ref=dp_olp_0/278-6342540-8321801?ie=UTF8&amp;condition=all">these sellers</a>],Amazon.in: Buy Ancient Living Bhringraj Hair oil Online at Best Price in India | Amazon Beauty Store,Buy Ancient Living Bhringraj Hair oil at lowest price in India on Amazon.in. Check out Ancient Living Bhringraj Hair oil reviews  ratings  features  specifications and browse more Beauty products online at best prices on Amazon.in.,None,<div class="bucket" id="productDescription"> <h2>Product Description</h2> <div class="content"> <h3 class="productDescriptionSource"></h3> <div class="productDescriptionWrapper">        Ancient Living Bringraj hair oil is a remedy for hair loss and premature greying. It also gives strenght and nourishment to the hair roots.              <div class="emptyClear"> </div> </div> </div> </div>,None,18:03:2014,None
B00I4QA4SA,Ancient Living Almond oil,http://www.amazon.in/Hair-Care-Styling/b/ref=sd_allcat_beauty_haircare/276-6718833-1247838?ie=UTF8&node=1374305031,Rs. 275.00,Hair Care & Stylin,Hair Oils,Ancient Living,http://ecx.images-amazon.com/images/I/41XBBDnRWxL._AA160_.jpg,Rs. 275.00,self Colour,Beauty & Health,http://www.amazon.in/Ancient-Living-Almond-oil/dp/B00I4QA4SA/ref=sr_1_2/278-6342540-8321801?s=beauty&ie=UTF8&qid=1395127279&sr=1-2,[<a class="buyAction" href="/gp/offer-listing/B00I4QA4SA/ref=dp_olp_0/278-6342540-8321801?ie=UTF8&amp;condition=all">these sellers</a>],Amazon.in: Buy Ancient Living Almond oil Online at Best Price in India | Amazon Beauty Store,Buy Ancient Living Almond oil at lowest price in India on Amazon.in. Check out Ancient Living Almond oil reviews  ratings  features  specifications and browse more Beauty products online at best prices on Amazon.in.,None,<div class="bucket" id="productDescription"> <h2>Product Description</h2> <div class="content"> <h3 class="productDescriptionSource"></h3> <div class="productDescriptionWrapper">        Ancient Living Almond oil is an excellent emollient that works as a great moisturizer for the skin.The oil improves skin elasticity  making the skin soft and smooth.              <div class="emptyClear"> </div> </div> </div> </div>,None,18:03:2014,None
B00I4QA78C,Ancient Living Premium Hair oil,http://www.amazon.in/Hair-Care-Styling/b/ref=sd_allcat_beauty_haircare/276-6718833-1247838?ie=UTF8&node=1374305031,Rs. 275.00,Hair Care & Stylin,Hair Oils,Ancient Living,http://ecx.images-amazon.com/images/I/41XBBDnRWxL._AA160_.jpg,Rs. 275.00,self Colour,Beauty & Health,http://www.amazon.in/Ancient-Living-Premium-Hair-oil/dp/B00I4QA78C/ref=sr_1_6/278-6342540-8321801?s=beauty&ie=UTF8&qid=1395127279&sr=1-6,[<a class="buyAction" href="/gp/offer-listing/B00I4QA78C/ref=dp_olp_0/278-6342540-8321801?ie=UTF8&amp;condition=all">these sellers</a>],Amazon.in: Buy Ancient Living Premium Hair oil Online at Best Price in India | Amazon Beauty Store,Buy Ancient Living Premium Hair oil at lowest price in India on Amazon.in. Check out Ancient Living Premium Hair oil reviews  ratings  features  specifications and browse more Beauty products online at best prices on Amazon.in.,None,<div class="bucket" id="productDescription"> <h2>Product Description</h2> <div class="content"> <h3 class="productDescriptionSource"></h3> <div class="productDescriptionWrapper">        Ancient living Premium hair oil is enriched with essential oils like Rose mary  Ylong Ylong  Thyme. It nourishes the hair roots and effectively controls hair fall. Regular use result in long  soft and strong hair. · Ancient Living Amla Hair oil nourishes the hair roots and effectively controls hair fall.It promotes hair growth and prevents pre-mature graying.              <div class="emptyClear"> </div> </div> </div> </div>,None,18:03:2014,None
B00I4QA8M2,Ancient Living Brahmi Hair oil,http://www.amazon.in/Hair-Care-Styling/b/ref=sd_allcat_beauty_haircare/276-6718833-1247838?ie=UTF8&node=1374305031,Rs. 125.00,Hair Care & Stylin,Hair Oils,Ancient Living,http://ecx.images-amazon.com/images/I/41XBBDnRWxL._AA160_.jpg,Rs. 125.00,self Colour,Beauty & Health,http://www.amazon.in/Ancient-Living-Brahmi-Hair-oil/dp/B00I4QA8M2/ref=sr_1_4/278-6342540-8321801?s=beauty&ie=UTF8&qid=1395127279&sr=1-4,[<a class="buyAction" href="/gp/offer-listing/B00I4QA8M2/ref=dp_olp_0/278-6342540-8321801?ie=UTF8&amp;condition=all">these sellers</a>],Amazon.in: Buy Ancient Living Brahmi Hair oil Online at Best Price in India | Amazon Beauty Store,Buy Ancient Living Brahmi Hair oil at lowest price in India on Amazon.in. Check out Ancient Living Brahmi Hair oil reviews  ratings  features  specifications and browse more Beauty products online at best prices on Amazon.in.,None,<div class="bucket" id="productDescription"> <h2>Product Description</h2> <div class="content"> <h3 class="productDescriptionSource"></h3> <div class="productDescriptionWrapper">        Ancient Living Brahmi Hair oil prevents hair loss.              <div class="emptyClear"> </div> </div> </div> </div>,None,18:03:2014,None
