B000C212QW,Elizabeth Arden Splendor Women Edt 100 ml.,http://www.amazon.in/Fragrances/b/ref=sd_allcat_beauty_fragrance/276-6718833-1247838?ie=UTF8&node=1374298031,None,Fragranc,Eau de Toilette,Elizabeth Arden,http://ecx.images-amazon.com/images/I/21xJ9-3BjWL._AA160_.jpg,None,self Colour,Beauty & Health,http://www.amazon.in/Elizabeth-Arden-Splendor-Women-Edt/dp/B000C212QW/ref=sr_1_4/278-5111767-9472601?s=beauty&ie=UTF8&qid=1395126996&sr=1-4,[<a href="/gp/help/seller/at-a-glance.html/278-5111767-9472601?ie=UTF8&amp;seller=A2NFQIUV2YGOLG">Fragume</a>],Amazon.in: Buy Elizabeth Arden Splendor Women Edt 100 ml. Online at Best Price in India | Amazon Beauty Store,Buy Elizabeth Arden Splendor Women Edt 100 ml. at lowest price in India on Amazon.in. Check out Elizabeth Arden Splendor Women Edt 100 ml. reviews  ratings  features  specifications and browse more Beauty products online at best prices on Amazon.in.,None,<div class="bucket" id="productDescription"> <h2>Product Description</h2> <div class="content"> <h3 class="productDescriptionSource"></h3> <div class="productDescriptionWrapper">        Design House: Elizabeth Arden  Year Introduced: 1998  Recommended Use: Evening  Recommended Use: Evening              <div class="emptyClear"> </div> </div> </div> </div>,None,18:03:2014,None
B007HUMIG0,Elizabeth Arden Green Tea Eau De Toilette for Women  100ml,http://www.amazon.in/Fragrances/b/ref=sd_allcat_beauty_fragrance/276-6718833-1247838?ie=UTF8&node=1374298031,None,Fragranc,Eau de Toilette,Elizabeth Arden,http://ecx.images-amazon.com/images/I/21xJ9-3BjWL._AA160_.jpg,None,self Colour,Beauty & Health,http://www.amazon.in/Elizabeth-Arden-Green-Toilette-Women/dp/B007HUMIG0/ref=sr_1_8/278-5111767-9472601?s=beauty&ie=UTF8&qid=1395126996&sr=1-8,[<a href="/gp/help/seller/at-a-glance.html/278-5111767-9472601?ie=UTF8&amp;seller=A2NFQIUV2YGOLG">Fragume</a>],Amazon.in: Buy Elizabeth Arden Green Tea Eau De Toilette for Women  100ml Online at Best Price in India | Amazon Beauty Store,Buy Elizabeth Arden Green Tea Eau De Toilette for Women  100ml at lowest price in India on Amazon.in. Check out Elizabeth Arden Green Tea Eau De Toilette for Women  100ml reviews  ratings  features  specifications and browse more Beauty products online at best prices on Amazon.in.,None,<div class="bucket" id="productDescription"> <h2>Product Description</h2> <div class="content"> <h3 class="productDescriptionSource"></h3> <div class="productDescriptionWrapper">        Design House: Elizabeth Arden  Year Introduced: 2011  Recommended Use: Casual  Recommended Use: Casual              <div class="emptyClear"> </div> </div> </div> </div>,None,18:03:2014,None
B000XE7Q64,Elizabeth Arden Sunflowers EDT for Women  100ml,http://www.amazon.in/Fragrances/b/ref=sd_allcat_beauty_fragrance/276-6718833-1247838?ie=UTF8&node=1374298031,None,Fragranc,Eau de Toilette,Elizabeth Arden,http://ecx.images-amazon.com/images/I/21xJ9-3BjWL._AA160_.jpg,None,self Colour,Beauty & Health,http://www.amazon.in/Elizabeth-Arden-Sunflowers-Women-100ml/dp/B000XE7Q64/ref=sr_1_2/278-5111767-9472601?s=beauty&ie=UTF8&qid=1395126996&sr=1-2,[<a href="/gp/help/seller/at-a-glance.html/278-5111767-9472601?ie=UTF8&amp;seller=A2NFQIUV2YGOLG">Fragume</a>],Amazon.in: Buy Elizabeth Arden Sunflowers EDT for Women  100ml Online at Best Price in India | Amazon Beauty Store,Buy Elizabeth Arden Sunflowers EDT for Women  100ml at lowest price in India on Amazon.in. Check out Elizabeth Arden Sunflowers EDT for Women  100ml reviews  ratings  features  specifications and browse more Beauty products online at best prices on Amazon.in.,None,<div class="bucket" id="productDescription"> <h2>Product Description</h2> <div class="content"> <h3 class="productDescriptionSource"></h3> <div class="productDescriptionWrapper">        Sunflowers Elizabeth Arden for women. Floral fruity fragrance launched in 1993. It was designed by David Apel. The top notes are composed of luminous lemon notes  rosewood  orange blossom  sweet juicy mandarin  bergamot  melon and sweet peach. The heart brings notes of cyclamen  rose  pure jasmine  osmanthus and iris root. The sensual base is composed of musk  cedar  amber  moss and sandal wood.              <div class="emptyClear"> </div> </div> </div> </div>,None,18:03:2014,None
B00117PXSU,Elizabeth Arden Green Tea Tropical Eau De Toilette Spray for Women  100ml,http://www.amazon.in/Fragrances/b/ref=sd_allcat_beauty_fragrance/276-6718833-1247838?ie=UTF8&node=1374298031,None,Fragranc,Eau de Toilette,Elizabeth Arden,http://ecx.images-amazon.com/images/I/21xJ9-3BjWL._AA160_.jpg,None,self Colour,Beauty & Health,http://www.amazon.in/Elizabeth-Arden-Green-Tropical-Toilette/dp/B00117PXSU/ref=sr_1_7/278-5111767-9472601?s=beauty&ie=UTF8&qid=1395126996&sr=1-7,[<a href="/gp/help/seller/at-a-glance.html/278-5111767-9472601?ie=UTF8&amp;seller=A22G8HZGXYSWPZ">Taha &amp; Bros.</a>],Amazon.in: Buy Elizabeth Arden Green Tea Tropical Eau De Toilette Spray for Women  100ml Online at Best Price in India | Amazon Beauty Store,Buy Elizabeth Arden Green Tea Tropical Eau De Toilette Spray for Women  100ml at lowest price in India on Amazon.in. Check out Elizabeth Arden Green Tea Tropical Eau De Toilette Spray for Women  100ml reviews  ratings  features  specifications and browse more Beauty products online at best prices on Amazon.in.,None,<div class="bucket" id="productDescription"> <h2>Product Description</h2> <div class="content"> <h3 class="productDescriptionSource"></h3> <div class="productDescriptionWrapper">        Green Tea Tropical Elizabeth Arden for women.Green Tea Tropical by Elizabeth Arden is a Aromatic Fruity fragrance for women. Green Tea Tropical was launched in 2007. The nose behind this fragrance is Rodrigo Flores-Roux. Top notes are litchi and passion flower; middle notes are green tea  tea and magnolia; base notes are musk and tropical fruits.              <div class="emptyClear"> </div> </div> </div> </div>,None,18:03:2014,None
9790798695,Elizabeth Arden 5Th Avenue for Women  125ml,http://www.amazon.in/Fragrances/b/ref=sd_allcat_beauty_fragrance/276-6718833-1247838?ie=UTF8&node=1374298031,None,Fragranc,Eau de Toilette,Elizabeth Arden,http://ecx.images-amazon.com/images/I/21xJ9-3BjWL._AA160_.jpg,None,self Colour,Beauty & Health,http://www.amazon.in/Elizabeth-Arden-Avenue-Women-125ml/dp/9790798695/ref=sr_1_1/278-5111767-9472601?s=beauty&ie=UTF8&qid=1395126996&sr=1-1,[<a href="/gp/help/seller/at-a-glance.html/278-5111767-9472601?ie=UTF8&amp;seller=A2IT7998C8946H">Perfume Nation</a>],Amazon.in: Buy Elizabeth Arden 5Th Avenue for Women  125ml Online at Best Price in India | Amazon Beauty Store,Buy Elizabeth Arden 5Th Avenue for Women  125ml at lowest price in India on Amazon.in. Check out Elizabeth Arden 5Th Avenue for Women  125ml reviews  ratings  features  specifications and browse more Beauty products online at best prices on Amazon.in.,None,<div class="bucket" id="productDescription"> <h2>Product Description</h2> <div class="content"> <h3 class="productDescriptionSource"></h3> <div class="productDescriptionWrapper">        5TH AVENUE by Elizabeth Arden Eau De Parfum Spray 4.2 oz for WomenFeatures1) 5TH AVENUE by Elizabeth Arden Eau De Parfum Spray 4.2 oz for Women2) 5TH AVENUE by Elizabeth Arden for Women3) Eau De Parfum Spray 4.2 oz4) Packaging for this product may vary from that shown in the image above5) 100% Authentic Brand Name Merchandise!              <div class="emptyClear"> </div> </div> </div> </div>,None,18:03:2014,None
B000OABZTG,Elizabeth Arden 5th Avenue After 5 EDT for Women  125ml,http://www.amazon.in/Fragrances/b/ref=sd_allcat_beauty_fragrance/276-6718833-1247838?ie=UTF8&node=1374298031,None,Fragranc,Eau de Toilette,Elizabeth Arden,http://ecx.images-amazon.com/images/I/21xJ9-3BjWL._AA160_.jpg,None,self Colour,Beauty & Health,http://www.amazon.in/Elizabeth-Arden-Avenue-After-Women/dp/B000OABZTG/ref=sr_1_10/278-5111767-9472601?s=beauty&ie=UTF8&qid=1395126996&sr=1-10,[<a href="/gp/help/seller/at-a-glance.html/278-5111767-9472601?ie=UTF8&amp;seller=A29ZFTNVZHDXBZ">Route2Fashion</a>],Amazon.in: Buy Elizabeth Arden 5th Avenue After 5 EDT for Women  125ml Online at Best Price in India | Amazon Beauty Store,Buy Elizabeth Arden 5th Avenue After 5 EDT for Women  125ml at lowest price in India on Amazon.in. Check out Elizabeth Arden 5th Avenue After 5 EDT for Women  125ml reviews  ratings  features  specifications and browse more Beauty products online at best prices on Amazon.in.,None,<div class="bucket" id="productDescription"> <h2>Product Description</h2> <div class="content"> <h3 class="productDescriptionSource"></h3> <div class="productDescriptionWrapper">        Design House: Elizabeth Arden  Year Introduced: 2005  Recommended Use: Daytime  Recommended Use: Daytime              <div class="emptyClear"> </div> </div> </div> </div>,None,18:03:2014,None
B001DDX0QY,Elizabeth Arden Beauty for Women  100ml,http://www.amazon.in/Fragrances/b/ref=sd_allcat_beauty_fragrance/276-6718833-1247838?ie=UTF8&node=1374298031,None,Fragranc,Eau de Toilette,Elizabeth Arden,http://ecx.images-amazon.com/images/I/21xJ9-3BjWL._AA160_.jpg,None,self Colour,Beauty & Health,http://www.amazon.in/Elizabeth-Arden-Beauty-Women-100ml/dp/B001DDX0QY/ref=sr_1_15/278-5111767-9472601?s=beauty&ie=UTF8&qid=1395126996&sr=1-15,[<a href="/gp/help/seller/at-a-glance.html/278-5111767-9472601?ie=UTF8&amp;seller=A2NFQIUV2YGOLG">Fragume</a>],Amazon.in: Buy Elizabeth Arden Beauty for Women  100ml Online at Best Price in India | Amazon Beauty Store,Buy Elizabeth Arden Beauty for Women  100ml at lowest price in India on Amazon.in. Check out Elizabeth Arden Beauty for Women  100ml reviews  ratings  features  specifications and browse more Beauty products online at best prices on Amazon.in.,None,<div class="bucket" id="productDescription"> <h2>Product Description</h2> <div class="content"> <h3 class="productDescriptionSource"></h3> <div class="productDescriptionWrapper">        Beauty by Elizabeth Arden is a floral green fragrance for women. Arden Beauty was launched in 2002. The nose behind this fragrance is Antoine Lie. Top notes are iris  bergamot and rice flower; middle notes are orchid  ginger  rhubarb and lotus; base notes are sandalwood  amber and musk.              <div class="emptyClear"> </div> </div> </div> </div>,None,18:03:2014,None
B0020MM7IO,Elizabeth Arden 5TH AVENUE NIGHT Women Edt 125ML,http://www.amazon.in/Fragrances/b/ref=sd_allcat_beauty_fragrance/276-6718833-1247838?ie=UTF8&node=1374298031,None,Fragranc,Eau de Toilette,Elizabeth Arden,http://ecx.images-amazon.com/images/I/21xJ9-3BjWL._AA160_.jpg,None,self Colour,Beauty & Health,http://www.amazon.in/Elizabeth-Arden-AVENUE-NIGHT-Women/dp/B0020MM7IO/ref=sr_1_14/278-5111767-9472601?s=beauty&ie=UTF8&qid=1395126996&sr=1-14,[<a href="/gp/help/seller/at-a-glance.html/278-5111767-9472601?ie=UTF8&amp;seller=A3ES9F57NVVRIK">MyLuckyScent</a>],Amazon.in: Buy Elizabeth Arden 5TH AVENUE NIGHT Women Edt 125ML Online at Best Price in India | Amazon Beauty Store,Buy Elizabeth Arden 5TH AVENUE NIGHT Women Edt 125ML at lowest price in India on Amazon.in. Check out Elizabeth Arden 5TH AVENUE NIGHT Women Edt 125ML reviews  ratings  features  specifications and browse more Beauty products online at best prices on Amazon.in.,None,<div class="bucket" id="productDescription"> <h2>Product Description</h2> <div class="content"> <h3 class="productDescriptionSource"></h3> <div class="productDescriptionWrapper">        Design House: Elizabeth Arden  Year Introduced: 2008  Recommended Use: Daytime  Recommended Use: Daytime              <div class="emptyClear"> </div> </div> </div> </div>,None,18:03:2014,None
B001TM6IVI,Elizabeth Arden Elizabeth Arden Green Tea Scent Spray 1.7 Oz - 1.7 oz,http://www.amazon.in/Fragrances/b/ref=sd_allcat_beauty_fragrance/276-6718833-1247838?ie=UTF8&node=1374298031,Rs. 1 750.00,Fragranc,Eau de Toilette,Elizabeth Arden,http://ecx.images-amazon.com/images/I/21xJ9-3BjWL._AA160_.jpg,Rs. 1 750.00,self Colour,Beauty & Health,http://www.amazon.in/Elizabeth-Arden-Green-Scent-Spray/dp/B001TM6IVI/ref=sr_1_16/278-5111767-9472601?s=beauty&ie=UTF8&qid=1395126996&sr=1-16,[<a class="buyAction" href="/gp/offer-listing/B001TM6IVI/ref=dp_olp_0/278-5111767-9472601?ie=UTF8&amp;condition=all">these sellers</a>],Amazon.in: Buy Elizabeth Arden Elizabeth Arden Green Tea Scent Spray 1.7 Oz - 1.7 oz Online at Best Price in India | Amazon Beauty Store,Buy Elizabeth Arden Elizabeth Arden Green Tea Scent Spray 1.7 Oz - 1.7 oz at lowest price in India on Amazon.in. Check out Elizabeth Arden Elizabeth Arden Green Tea Scent Spray 1.7 Oz - 1.7 oz reviews  ratings  features  specifications and browse more Beauty products online at best prices on Amazon.in.,None,None,None,18:03:2014,None
B0028VM7CI,ELIZABETH ARDEN GREEN TEA LOTUS FOR WOMEN 100ML,http://www.amazon.in/Fragrances/b/ref=sd_allcat_beauty_fragrance/276-6718833-1247838?ie=UTF8&node=1374298031,None,Fragranc,Eau de Toilette,Elizabeth Arden,http://ecx.images-amazon.com/images/I/21xJ9-3BjWL._AA160_.jpg,None,self Colour,Beauty & Health,http://www.amazon.in/ELIZABETH-ARDEN-GREEN-LOTUS-WOMEN/dp/B0028VM7CI/ref=sr_1_21/278-5111767-9472601?s=beauty&ie=UTF8&qid=1395126996&sr=1-21,[<a href="/gp/help/seller/at-a-glance.html/278-5111767-9472601?ie=UTF8&amp;seller=A22G8HZGXYSWPZ">Taha &amp; Bros.</a>],Amazon.in: Buy ELIZABETH ARDEN GREEN TEA LOTUS FOR WOMEN 100ML Online at Best Price in India | Amazon Beauty Store,Buy ELIZABETH ARDEN GREEN TEA LOTUS FOR WOMEN 100ML at lowest price in India on Amazon.in. Check out ELIZABETH ARDEN GREEN TEA LOTUS FOR WOMEN 100ML reviews  ratings  features  specifications and browse more Beauty products online at best prices on Amazon.in.,None,<div class="bucket" id="productDescription"> <h2>Product Description</h2> <div class="content"> <h3 class="productDescriptionSource"></h3> <div class="productDescriptionWrapper">        Green Tea Lotus Elizabeth Arden for women. Green Tea Lotus was launched in 2008 as limited edition. It captures you with aroma of Asian lily  along with cherry blossom  yuzu and accords of plum. Characterized as tender  light and exotic  it greets you with plum (that symbolizes China  elegance and pureness)  cherry blossom (that reminds of transience of life and is a symbol of female beauty) and yuzu  Japanese citrus that smells similar to sweet pommel. The heart is composed of Asian lily  gracious lotus (a symbol of freedom and spiritual re-birth)  green tea and osmanthus              <div class="emptyClear"> </div> </div> </div> </div>,None,18:03:2014,None
B003YGOT2C,Elizabeth Arden Green Tea Lotus Women EDT  100ml,http://www.amazon.in/Fragrances/b/ref=sd_allcat_beauty_fragrance/276-6718833-1247838?ie=UTF8&node=1374298031,Rs. 1 465.00,Fragranc,Eau de Toilette,Elizabeth Arden,http://ecx.images-amazon.com/images/I/21xJ9-3BjWL._AA160_.jpg,Rs. 1 465.00,self Colour,Beauty & Health,http://www.amazon.in/Elizabeth-Arden-Green-Lotus-Women/dp/B003YGOT2C/ref=sr_1_22/278-5111767-9472601?s=beauty&ie=UTF8&qid=1395126996&sr=1-22,[<a class="buyAction" href="/gp/offer-listing/B003YGOT2C/ref=dp_olp_0/278-5111767-9472601?ie=UTF8&amp;condition=all">these sellers</a>],Amazon.in: Buy Elizabeth Arden Green Tea Lotus Women EDT  100ml Online at Best Price in India | Amazon Beauty Store,Buy Elizabeth Arden Green Tea Lotus Women EDT  100ml at lowest price in India on Amazon.in. Check out Elizabeth Arden Green Tea Lotus Women EDT  100ml reviews  ratings  features  specifications and browse more Beauty products online at best prices on Amazon.in.,None,<div class="bucket" id="productDescription"> <h2>Product Description</h2> <div class="content"> <h3 class="productDescriptionSource"></h3> <div class="productDescriptionWrapper">        Elizabeth Arden ? the brand  has an uncompromising vision to create absolutely the best beauty products that not covered but benefited the feminine skin and body. Elizabeth Arden Green Tea Lotus Eau De Toilette (Women) is one such attempt to make the female skin look younger  while keeping it fresh and unharmed. Launched in 2008  as limited edition  Green Tea Lotus had the nose of Rodrigo Flores-Roux behind capturing its fragrance. This perfume blends Asian lily  cherry blossom  yuzu and fruity accords of plum to offer a fresh and reviving aroma. Tender and light  this exotic fragrance greets you with lily  gracious lotus  green tea and osmanthus at the heart. The base notes comprise of musk and white birch to contribute a sensuous  woodsy essence.              <div class="emptyClear"> </div> </div> </div> </div>,None,18:03:2014,None
B003HFFRFI,Elizabeth Arden Green Tea Lavender Eau De Toilette Spray for Women  100ml,http://www.amazon.in/Fragrances/b/ref=sd_allcat_beauty_fragrance/276-6718833-1247838?ie=UTF8&node=1374298031,None,Fragranc,Eau de Toilette,Elizabeth Arden,http://ecx.images-amazon.com/images/I/21xJ9-3BjWL._AA160_.jpg,None,self Colour,Beauty & Health,http://www.amazon.in/Elizabeth-Arden-Green-Lavender-Toilette/dp/B003HFFRFI/ref=sr_1_19/278-5111767-9472601?s=beauty&ie=UTF8&qid=1395126996&sr=1-19,[<a href="/gp/help/seller/at-a-glance.html/278-5111767-9472601?ie=UTF8&amp;seller=A22G8HZGXYSWPZ">Taha &amp; Bros.</a>],Amazon.in: Buy Elizabeth Arden Green Tea Lavender Eau De Toilette Spray for Women  100ml Online at Best Price in India | Amazon Beauty Store,Buy Elizabeth Arden Green Tea Lavender Eau De Toilette Spray for Women  100ml at lowest price in India on Amazon.in. Check out Elizabeth Arden Green Tea Lavender Eau De Toilette Spray for Women  100ml reviews  ratings  features  specifications and browse more Beauty products online at best prices on Amazon.in.,None,<div class="bucket" id="productDescription"> <h2>Product Description</h2> <div class="content"> <h3 class="productDescriptionSource"></h3> <div class="productDescriptionWrapper">        Fresh  relaxing  carefree  close your eyes and let yourself be transported to a place of peace and endless optimism. Purple waves of blossoms captivate the eye  while the scent of natural lavender awakens your spirit. Launched by a the design house of Elizabeth Arden in 2010.              <div class="emptyClear"> </div> </div> </div> </div>,None,18:03:2014,None
B004IWDR9W,Elizabeth Arden Pretty Perfume EDP 100ml,http://www.amazon.in/Fragrances/b/ref=sd_allcat_beauty_fragrance/276-6718833-1247838?ie=UTF8&node=1374298031,Rs. 2 100.00,Fragranc,Eau de Toilette,Elizabeth Arden,http://ecx.images-amazon.com/images/I/21xJ9-3BjWL._AA160_.jpg,Rs. 2 100.00,self Colour,Beauty & Health,http://www.amazon.in/Elizabeth-Arden-Pretty-Perfume-100ml/dp/B004IWDR9W/ref=sr_1_23/278-5111767-9472601?s=beauty&ie=UTF8&qid=1395126996&sr=1-23,[<a class="buyAction" href="/gp/offer-listing/B004IWDR9W/ref=dp_olp_0/278-5111767-9472601?ie=UTF8&amp;condition=all">these sellers</a>],Amazon.in: Buy Elizabeth Arden Pretty Perfume EDP 100ml Online at Best Price in India | Amazon Beauty Store,Buy Elizabeth Arden Pretty Perfume EDP 100ml at lowest price in India on Amazon.in. Check out Elizabeth Arden Pretty Perfume EDP 100ml reviews  ratings  features  specifications and browse more Beauty products online at best prices on Amazon.in.,None,None,None,18:03:2014,None
B000P20QD4,ELIZABETH ARDEN PROVOCATIVE FOR WOMEN 100ML,http://www.amazon.in/Fragrances/b/ref=sd_allcat_beauty_fragrance/276-6718833-1247838?ie=UTF8&node=1374298031,Rs. 2 250.00,Fragranc,Eau de Toilette,Elizabeth Arden,http://ecx.images-amazon.com/images/I/21xJ9-3BjWL._AA160_.jpg,Rs. 2 250.00,self Colour,Beauty & Health,http://www.amazon.in/ELIZABETH-ARDEN-PROVOCATIVE-WOMEN-100ML/dp/B000P20QD4/ref=sr_1_24/278-5111767-9472601?s=beauty&ie=UTF8&qid=1395126996&sr=1-24,[<a class="buyAction" href="/gp/offer-listing/B000P20QD4/ref=dp_olp_0/278-5111767-9472601?ie=UTF8&amp;condition=all">these sellers</a>],Amazon.in: Buy ELIZABETH ARDEN PROVOCATIVE FOR WOMEN 100ML Online at Best Price in India | Amazon Beauty Store,Buy ELIZABETH ARDEN PROVOCATIVE FOR WOMEN 100ML at lowest price in India on Amazon.in. Check out ELIZABETH ARDEN PROVOCATIVE FOR WOMEN 100ML reviews  ratings  features  specifications and browse more Beauty products online at best prices on Amazon.in.,None,<div class="bucket" id="productDescription"> <h2>Product Description</h2> <div class="content"> <h3 class="productDescriptionSource"></h3> <div class="productDescriptionWrapper">        Provocative woman Elizabeth Arden for women.Catherine Zeta-Jones' seductive walk and beauty were an inspiration to creators of this exciting and egzotic new fragrance from the house of Elizabeth Arden. Top notes include quince  water lotus  and ginger lily. Heart note is composed of midnight orchid  papaya blossom and pink freesia. Base notes are white sand notes  Hinoki wood and red amber. Provocative woman was launched in 2004. Provocative woman was created by Jean-Marc Chaillan and Loc Dong.              <div class="emptyClear"> </div> </div> </div> </div>,None,18:03:2014,None
B000GHVIU8,Elizabeth Arden 5th Avenue After 5 EDT for Women  75ml,http://www.amazon.in/Fragrances/b/ref=sd_allcat_beauty_fragrance/276-6718833-1247838?ie=UTF8&node=1374298031,Rs. 1 170.00,Fragranc,Eau de Toilette,Elizabeth Arden,http://ecx.images-amazon.com/images/I/21xJ9-3BjWL._AA160_.jpg,Rs. 1 170.00,self Colour,Beauty & Health,http://www.amazon.in/Elizabeth-Arden-Avenue-After-Women/dp/B000GHVIU8/ref=sr_1_11/278-5111767-9472601?s=beauty&ie=UTF8&qid=1395126996&sr=1-11,[<a class="buyAction" href="/gp/offer-listing/B000GHVIU8/ref=dp_olp_0/278-5111767-9472601?ie=UTF8&amp;condition=all">these sellers</a>],Amazon.in: Buy Elizabeth Arden 5th Avenue After 5 EDT for Women  75ml Online at Best Price in India | Amazon Beauty Store,Buy Elizabeth Arden 5th Avenue After 5 EDT for Women  75ml at lowest price in India on Amazon.in. Check out Elizabeth Arden 5th Avenue After 5 EDT for Women  75ml reviews  ratings  features  specifications and browse more Beauty products online at best prices on Amazon.in.,None,<div class="bucket" id="productDescription"> <h2>Product Description</h2> <div class="content"> <h3 class="productDescriptionSource"></h3> <div class="productDescriptionWrapper">        Elizabeth Arden lived by a fundamental mantra that a woman?s beauty must not just lay in a layer of makeup. She created an intelligent relationship between science and nature  through her range of beauty products  to help a woman take her natural assets to the notch of finesse. A classic  sensuous fragrance from the house of Elizabeth Arden 5Th Avenue  After Five Eau De Toilette (Women) reminds you that the night is still young. This misty  musky fragrance fills the air around you with energy and romance that makes you expect the unexpected. Elizabeth Arden After Five Perfume starts with top notes of honeysuckle  coriander  plum  and bergamot that lend a vibrant mix of fruity and spicy blast to it. A floral heart with a gracious blend of Indian lotus  jasmine  saffron  and lily-of-the-valley make it all the more passionate. At the base  this perfume turns all the more promising with birch  sandalwood and Tonka bean intertwined in a distinct manner              <div class="emptyClear"> </div> </div> </div> </div>,None,18:03:2014,None
B0009OAI54,Elizabeth Arden 5th Avenue EDT for Women  125ml,http://www.amazon.in/Fragrances/b/ref=sd_allcat_beauty_fragrance/276-6718833-1247838?ie=UTF8&node=1374298031,None,Fragranc,Eau de Toilette,Elizabeth Arden,http://ecx.images-amazon.com/images/I/21xJ9-3BjWL._AA160_.jpg,None,self Colour,Beauty & Health,http://www.amazon.in/Elizabeth-Arden-Avenue-Women-125ml/dp/B0009OAI54/ref=sr_1_12/278-5111767-9472601?s=beauty&ie=UTF8&qid=1395126996&sr=1-12,[<a href="/gp/help/seller/at-a-glance.html/278-5111767-9472601?ie=UTF8&amp;seller=A3ES9F57NVVRIK">MyLuckyScent</a>],Amazon.in: Buy Elizabeth Arden 5th Avenue EDT for Women  125ml Online at Best Price in India | Amazon Beauty Store,Buy Elizabeth Arden 5th Avenue EDT for Women  125ml at lowest price in India on Amazon.in. Check out Elizabeth Arden 5th Avenue EDT for Women  125ml reviews  ratings  features  specifications and browse more Beauty products online at best prices on Amazon.in.,None,<div class="bucket" id="productDescription"> <h2>Product Description</h2> <div class="content"> <h3 class="productDescriptionSource"></h3> <div class="productDescriptionWrapper">        Design House: Elizabeth Arden  Year Introduced: 1996  Recommended Use: Daytime  Recommended Use: Daytime              <div class="emptyClear"> </div> </div> </div> </div>,None,18:03:2014,None
