B002XQ1R06,Calvin Klein Free Eau De Toilette for Men  100ml,http://www.amazon.in/Fragrances/b/ref=sd_allcat_beauty_fragrance/276-6718833-1247838?ie=UTF8&node=1374298031,None,Fragranc,Elizabeth Arden,Calvin Klein,http://ecx.images-amazon.com/images/I/31JrnC0qt%2BL._AA160_.jpg,None,self Colour,Beauty & Health,http://www.amazon.in/Calvin-Klein-Free-Toilette-100ml/dp/B002XQ1R06/ref=sr_1_129/275-9715206-1097860?s=beauty&ie=UTF8&qid=1395126972&sr=1-129,[<a href="/gp/help/seller/at-a-glance.html/275-9715206-1097860?ie=UTF8&amp;seller=A2NFQIUV2YGOLG">Fragume</a>],Amazon.in: Buy Calvin Klein Free Eau De Toilette for Men  100ml Online at Best Price in India | Amazon Beauty Store,Buy Calvin Klein Free Eau De Toilette for Men  100ml at lowest price in India on Amazon.in. Check out Calvin Klein Free Eau De Toilette for Men  100ml reviews  ratings  features  specifications and browse more Beauty products online at best prices on Amazon.in.,None,<div class="bucket" id="productDescription"> <h2>Product Description</h2> <div class="content"> <h3 class="productDescriptionSource"></h3> <div class="productDescriptionWrapper">        CK FREE by Calvin Klein for Men EDT SPRAY 3.4 OZ Suede Note Juniper Berry Absinthe Star Anise Texas Cedar Buchu Coffee Patchouli Musks Oak Ironwood Jackfruit Tobacco Leaf              <div class="emptyClear"> </div> </div> </div> </div>,None,18:03:2014,None
B0084YBJPO,Calvin Klein Free Eau De Toilette for Men  100ml,http://www.amazon.in/Fragrances/b/ref=sd_allcat_beauty_fragrance/276-6718833-1247838?ie=UTF8&node=1374298031,None,Fragranc,Elizabeth Arden,Calvin Klein,http://ecx.images-amazon.com/images/I/31JrnC0qt%2BL._AA160_.jpg,None,self Colour,Beauty & Health,http://www.amazon.in/Calvin-Klein-Free-Toilette-100ml/dp/B0084YBJPO/ref=sr_1_130/275-9715206-1097860?s=beauty&ie=UTF8&qid=1395126972&sr=1-130,[<a href="/gp/help/seller/at-a-glance.html/275-9715206-1097860?ie=UTF8&amp;seller=A22G8HZGXYSWPZ">Taha &amp; Bros.</a>],Amazon.in: Buy Calvin Klein Free Eau De Toilette for Men  100ml Online at Best Price in India | Amazon Beauty Store,Buy Calvin Klein Free Eau De Toilette for Men  100ml at lowest price in India on Amazon.in. Check out Calvin Klein Free Eau De Toilette for Men  100ml reviews  ratings  features  specifications and browse more Beauty products online at best prices on Amazon.in.,None,None,None,18:03:2014,None
B005YXNC1C,Calvin Klein Free Blue 100ml For Men,http://www.amazon.in/Fragrances/b/ref=sd_allcat_beauty_fragrance/276-6718833-1247838?ie=UTF8&node=1374298031,None,Fragranc,Elizabeth Arden,Calvin Klein,http://ecx.images-amazon.com/images/I/31JrnC0qt%2BL._AA160_.jpg,None,self Colour,Beauty & Health,http://www.amazon.in/Calvin-Klein-Free-Blue-100ml/dp/B005YXNC1C/ref=sr_1_128/275-9715206-1097860?s=beauty&ie=UTF8&qid=1395126972&sr=1-128,[<a href="/gp/help/seller/at-a-glance.html/275-9715206-1097860?ie=UTF8&amp;seller=A3ES9F57NVVRIK">MyLuckyScent</a>],Amazon.in: Buy Calvin Klein Free Blue 100ml For Men Online at Best Price in India | Amazon Beauty Store,Buy Calvin Klein Free Blue 100ml For Men at lowest price in India on Amazon.in. Check out Calvin Klein Free Blue 100ml For Men reviews  ratings  features  specifications and browse more Beauty products online at best prices on Amazon.in.,None,None,None,18:03:2014,None
B0084YBEMW,Calvin Klein Contradiction Men 100ML EDT,http://www.amazon.in/Fragrances/b/ref=sd_allcat_beauty_fragrance/276-6718833-1247838?ie=UTF8&node=1374298031,Rs. 2 460.00,Fragranc,Elizabeth Arden,Calvin Klein,http://ecx.images-amazon.com/images/I/31JrnC0qt%2BL._AA160_.jpg,Rs. 2 460.00,self Colour,Beauty & Health,http://www.amazon.in/Calvin-Klein-Contradiction-Men-100ML/dp/B0084YBEMW/ref=sr_1_91/275-9715206-1097860?s=beauty&ie=UTF8&qid=1395126958&sr=1-91,[<a class="buyAction" href="/gp/offer-listing/B0084YBEMW/ref=dp_olp_0/275-9715206-1097860?ie=UTF8&amp;condition=all">these sellers</a>],Amazon.in: Buy Calvin Klein Contradiction Men 100ML EDT Online at Best Price in India | Amazon Beauty Store,Buy Calvin Klein Contradiction Men 100ML EDT at lowest price in India on Amazon.in. Check out Calvin Klein Contradiction Men 100ML EDT reviews  ratings  features  specifications and browse more Beauty products online at best prices on Amazon.in.,None,None,None,18:03:2014,None
B000VYYVBO,Calvin Klein In 2 U Men Edt  50ml,http://www.amazon.in/Fragrances/b/ref=sd_allcat_beauty_fragrance/276-6718833-1247838?ie=UTF8&node=1374298031,Rs. 2 500.00,Fragranc,Elizabeth Arden,Calvin Klein,http://ecx.images-amazon.com/images/I/31JrnC0qt%2BL._AA160_.jpg,Rs. 2 500.00,self Colour,Beauty & Health,http://www.amazon.in/Calvin-Klein-Men-Edt-50ml/dp/B000VYYVBO/ref=sr_1_131/275-9715206-1097860?s=beauty&ie=UTF8&qid=1395126972&sr=1-131,[<a class="buyAction" href="/gp/offer-listing/B000VYYVBO/ref=dp_olp_0/275-9715206-1097860?ie=UTF8&amp;condition=all">these sellers</a>],Amazon.in: Buy Calvin Klein In 2 U Men Edt  50ml Online at Best Price in India | Amazon Beauty Store,Buy Calvin Klein In 2 U Men Edt  50ml at lowest price in India on Amazon.in. Check out Calvin Klein In 2 U Men Edt  50ml reviews  ratings  features  specifications and browse more Beauty products online at best prices on Amazon.in.,None,<div class="bucket" id="productDescription"> <h2>Product Description</h2> <div class="content"> <h3 class="productDescriptionSource"></h3> <div class="productDescriptionWrapper">        Size: 50mlLaunched: 2007100% Original CKIN2UType: FreshBest for Day wear              <div class="emptyClear"> </div> </div> </div> </div>,None,18:03:2014,None
B0079K4K0U,Calvin Klein In 2U,http://www.amazon.in/Fragrances/b/ref=sd_allcat_beauty_fragrance/276-6718833-1247838?ie=UTF8&node=1374298031,None,Fragranc,Elizabeth Arden,Calvin Klein,http://ecx.images-amazon.com/images/I/31JrnC0qt%2BL._AA160_.jpg,None,self Colour,Beauty & Health,http://www.amazon.in/Calvin-Klein-FCKE31103-In-2U/dp/B0079K4K0U/ref=sr_1_132/275-9715206-1097860?s=beauty&ie=UTF8&qid=1395126972&sr=1-132,[<a href="/gp/help/seller/at-a-glance.html/275-9715206-1097860?ie=UTF8&amp;seller=A2NFQIUV2YGOLG">Fragume</a>],Amazon.in: Buy Calvin Klein In 2U Online at Best Price in India | Amazon Beauty Store,Buy Calvin Klein In 2U at lowest price in India on Amazon.in. Check out Calvin Klein In 2U reviews  ratings  features  specifications and browse more Beauty products online at best prices on Amazon.in.,None,<div class="bucket" id="productDescription"> <h2>Product Description</h2> <div class="content"> <h3 class="productDescriptionSource"></h3> <div class="productDescriptionWrapper">        Entice Everybody With Ck In2U. It'S A Fresh Floriental With Scentnotes Of Redcurrant Leaves  Sicilian Bergamot  Pink Grapefruit Fizz  Sugar Orchid  White Cactus  Red Cedar  Neon Amber  And Vanilla Souffle.This Is 100% Original Ck In2U. Buy It At Discount              <div class="emptyClear"> </div> </div> </div> </div>,None,18:03:2014,None
B0084Z9E3C,Calvin Klein IN2U EDT for Women  100ml,http://www.amazon.in/Fragrances/b/ref=sd_allcat_beauty_fragrance/276-6718833-1247838?ie=UTF8&node=1374298031,Rs. 1 850.00,Fragranc,Elizabeth Arden,Calvin Klein,http://ecx.images-amazon.com/images/I/31JrnC0qt%2BL._AA160_.jpg,Rs. 1 850.00,self Colour,Beauty & Health,http://www.amazon.in/Calvin-Klein-IN2U-Women-100ml/dp/B0084Z9E3C/ref=sr_1_138/275-9715206-1097860?s=beauty&ie=UTF8&qid=1395126972&sr=1-138,[<a class="buyAction" href="/gp/offer-listing/B0084Z9E3C/ref=dp_olp_0/275-9715206-1097860?ie=UTF8&amp;condition=all">these sellers</a>],Amazon.in: Buy Calvin Klein IN2U EDT for Women  100ml Online at Best Price in India | Amazon Beauty Store,Buy Calvin Klein IN2U EDT for Women  100ml at lowest price in India on Amazon.in. Check out Calvin Klein IN2U EDT for Women  100ml reviews  ratings  features  specifications and browse more Beauty products online at best prices on Amazon.in.,None,<div class="bucket" id="productDescription"> <h2>Product Description</h2> <div class="content"> <h3 class="productDescriptionSource"></h3> <div class="productDescriptionWrapper">        A perfectly pleasant soothing smell is what IN2U by Calvin Klein offers to the woman of today. The note on this classic is pink grapefruit  red cedar and vanilla  a complete summer delight!!              <div class="emptyClear"> </div> </div> </div> </div>,None,18:03:2014,None
B000UUO5VK,Calvin Klein In2u for Men EDT 3.4 Ounce,http://www.amazon.in/Fragrances/b/ref=sd_allcat_beauty_fragrance/276-6718833-1247838?ie=UTF8&node=1374298031,None,Fragranc,Elizabeth Arden,Calvin Klein,http://ecx.images-amazon.com/images/I/31JrnC0qt%2BL._AA160_.jpg,None,self Colour,Beauty & Health,http://www.amazon.in/Calvin-Klein-In2u-Men-Ounce/dp/B000UUO5VK/ref=sr_1_139/275-9715206-1097860?s=beauty&ie=UTF8&qid=1395126972&sr=1-139,[<a href="/gp/help/seller/at-a-glance.html/275-9715206-1097860?ie=UTF8&amp;seller=A3ES9F57NVVRIK">MyLuckyScent</a>],Amazon.in: Buy Calvin Klein In2u for Men EDT 3.4 Ounce Online at Best Price in India | Amazon Beauty Store,Buy Calvin Klein In2u for Men EDT 3.4 Ounce at lowest price in India on Amazon.in. Check out Calvin Klein In2u for Men EDT 3.4 Ounce reviews  ratings  features  specifications and browse more Beauty products online at best prices on Amazon.in.,None,<div class="bucket" id="productDescription"> <h2>Product Description</h2> <div class="content"> <h3 class="productDescriptionSource"></h3> <div class="productDescriptionWrapper">        Design House: Calvin Klein  Year Introduced: 2007  Recommended Use: Evening  Recommended Use: Evening              <div class="emptyClear"> </div> </div> </div> </div>,None,18:03:2014,None
B001QTW4E4,Calvin Klein In2U Eau De Toilette Spray Tester for Women  100ml,http://www.amazon.in/Fragrances/b/ref=sd_allcat_beauty_fragrance/276-6718833-1247838?ie=UTF8&node=1374298031,Rs. 1 996.00,Fragranc,Elizabeth Arden,Calvin Klein,http://ecx.images-amazon.com/images/I/31JrnC0qt%2BL._AA160_.jpg,Rs. 1 996.00,self Colour,Beauty & Health,http://www.amazon.in/Calvin-Klein-Toilette-Spray-Tester/dp/B001QTW4E4/ref=sr_1_137/275-9715206-1097860?s=beauty&ie=UTF8&qid=1395126972&sr=1-137,[<a class="buyAction" href="/gp/offer-listing/B001QTW4E4/ref=dp_olp_0/275-9715206-1097860?ie=UTF8&amp;condition=all">these sellers</a>],Amazon.in: Buy Calvin Klein In2U Eau De Toilette Spray Tester for Women  100ml Online at Best Price in India | Amazon Beauty Store,Buy Calvin Klein In2U Eau De Toilette Spray Tester for Women  100ml at lowest price in India on Amazon.in. Check out Calvin Klein In2U Eau De Toilette Spray Tester for Women  100ml reviews  ratings  features  specifications and browse more Beauty products online at best prices on Amazon.in.,None,<div class="bucket" id="productDescription"> <h2>Product Description</h2> <div class="content"> <h3 class="productDescriptionSource"></h3> <div class="productDescriptionWrapper">        Launched by the design house of Calvin Klein in 2007  CK IN2U by Calvin Klein possesses a blend of Red Cedar  Bergamot  Red-Currant Leaves  Grapefruit  White Cactus  Orchid Sugar  Neon Amber  Vanilla What is a Tester? A Tester is a perfume with no fancy packaging but with the same exact fragrance at an even better price. They are just like the one used to test the perfume in a department store but supplied in a plain box and often have the word tester printed on the bottle. Sometimes they do not come with a cap or box. These items are great for personal use but may not be great as gifts. Our testers are new unopened and have never been sprayed (Testers and unboxed product are exactly the same as the regular perfume  except testers usually come in a plain box--with or without a cap. Unboxed products are the perfume or bath product  only without the box.)              <div class="emptyClear"> </div> </div> </div> </div>,None,18:03:2014,None
B000C21096,Calvin Klein Obsession Night Eau De Toilette Spray  118.29ml,http://www.amazon.in/Fragrances/b/ref=sd_allcat_beauty_fragrance/276-6718833-1247838?ie=UTF8&node=1374298031,None,Fragranc,Elizabeth Arden,Calvin Klein,http://ecx.images-amazon.com/images/I/31JrnC0qt%2BL._AA160_.jpg,None,self Colour,Beauty & Health,http://www.amazon.in/Calvin-Klein-Obsession-Toilette-118-29ml/dp/B000C21096/ref=sr_1_145/275-9715206-1097860?s=beauty&ie=UTF8&qid=1395126983&sr=1-145,[<a href="/gp/help/seller/at-a-glance.html/275-9715206-1097860?ie=UTF8&amp;seller=A29ZFTNVZHDXBZ">Route2Fashion</a>],Amazon.in: Buy Calvin Klein Obsession Night Eau De Toilette Spray  118.29ml Online at Best Price in India | Amazon Beauty Store,Buy Calvin Klein Obsession Night Eau De Toilette Spray  118.29ml at lowest price in India on Amazon.in. Check out Calvin Klein Obsession Night Eau De Toilette Spray  118.29ml reviews  ratings  features  specifications and browse more Beauty products online at best prices on Amazon.in.,None,<div class="bucket" id="productDescription"> <h2>Product Description</h2> <div class="content"> <h3 class="productDescriptionSource"></h3> <div class="productDescriptionWrapper">        Design House: Calvin Klein  Year Introduced: 2005  Recommended Use: Casual  Recommended Use: Casual              <div class="emptyClear"> </div> </div> </div> </div>,None,18:03:2014,None
B0084YBE0Y,Calvin Klein in 2U Eau De Toilette for Men  150ml,http://www.amazon.in/Fragrances/b/ref=sd_allcat_beauty_fragrance/276-6718833-1247838?ie=UTF8&node=1374298031,None,Fragranc,Elizabeth Arden,Calvin Klein,http://ecx.images-amazon.com/images/I/31JrnC0qt%2BL._AA160_.jpg,None,self Colour,Beauty & Health,http://www.amazon.in/Calvin-Klein-Eau-Toilette-150ml/dp/B0084YBE0Y/ref=sr_1_133/275-9715206-1097860?s=beauty&ie=UTF8&qid=1395126972&sr=1-133,[<a href="/gp/help/seller/at-a-glance.html/275-9715206-1097860?ie=UTF8&amp;seller=A22G8HZGXYSWPZ">Taha &amp; Bros.</a>],Amazon.in: Buy Calvin Klein in 2U Eau De Toilette for Men  150ml Online at Best Price in India | Amazon Beauty Store,Buy Calvin Klein in 2U Eau De Toilette for Men  150ml at lowest price in India on Amazon.in. Check out Calvin Klein in 2U Eau De Toilette for Men  150ml reviews  ratings  features  specifications and browse more Beauty products online at best prices on Amazon.in.,None,None,None,18:03:2014,None
B006L25ZF6,Calvin Klein Sheer Beauty Eau de Toilette Spray  3.4 Ounce,http://www.amazon.in/Fragrances/b/ref=sd_allcat_beauty_fragrance/276-6718833-1247838?ie=UTF8&node=1374298031,Rs. 3 945.00,Fragranc,Elizabeth Arden,Calvin Klein,http://ecx.images-amazon.com/images/I/31JrnC0qt%2BL._AA160_.jpg,Rs. 3 945.00,self Colour,Beauty & Health,http://www.amazon.in/Calvin-Klein-Sheer-Beauty-Toilette/dp/B006L25ZF6/ref=sr_1_149/275-9715206-1097860?s=beauty&ie=UTF8&qid=1395126983&sr=1-149,[<a class="buyAction" href="/gp/offer-listing/B006L25ZF6/ref=dp_olp_0/275-9715206-1097860?ie=UTF8&amp;condition=all">these sellers</a>],Amazon.in: Buy Calvin Klein Sheer Beauty Eau de Toilette Spray  3.4 Ounce Online at Best Price in India | Amazon Beauty Store,Buy Calvin Klein Sheer Beauty Eau de Toilette Spray  3.4 Ounce at lowest price in India on Amazon.in. Check out Calvin Klein Sheer Beauty Eau de Toilette Spray  3.4 Ounce reviews  ratings  features  specifications and browse more Beauty products online at best prices on Amazon.in.,None,None,None,18:03:2014,None
B000XE5TSG,Calvin Klein Truth for Women  100ml,http://www.amazon.in/Fragrances/b/ref=sd_allcat_beauty_fragrance/276-6718833-1247838?ie=UTF8&node=1374298031,None,Fragranc,Elizabeth Arden,Calvin Klein,http://ecx.images-amazon.com/images/I/31JrnC0qt%2BL._AA160_.jpg,None,self Colour,Beauty & Health,http://www.amazon.in/Calvin-Klein-Truth-Women-100ml/dp/B000XE5TSG/ref=sr_1_150/275-9715206-1097860?s=beauty&ie=UTF8&qid=1395126983&sr=1-150,[<a href="/gp/help/seller/at-a-glance.html/275-9715206-1097860?ie=UTF8&amp;seller=A2O8H5ZZSCKU2K">Perfume Crush</a>],Amazon.in: Buy Calvin Klein Truth for Women  100ml Online at Best Price in India | Amazon Beauty Store,Buy Calvin Klein Truth for Women  100ml at lowest price in India on Amazon.in. Check out Calvin Klein Truth for Women  100ml reviews  ratings  features  specifications and browse more Beauty products online at best prices on Amazon.in.,None,<div class="bucket" id="productDescription"> <h2>Product Description</h2> <div class="content"> <h3 class="productDescriptionSource"></h3> <div class="productDescriptionWrapper">        Design House: Calvin Klein  Year Introduced: 2000  Recommended Use: Daytime  Recommended Use: Daytime              <div class="emptyClear"> </div> </div> </div> </div>,None,18:03:2014,None
B000UIEMUQ,Calvin Klein Obsession Eau de Parfum Spray for Women  100ml,http://www.amazon.in/Fragrances/b/ref=sd_allcat_beauty_fragrance/276-6718833-1247838?ie=UTF8&node=1374298031,None,Fragranc,Elizabeth Arden,Calvin Klein,http://ecx.images-amazon.com/images/I/31JrnC0qt%2BL._AA160_.jpg,None,self Colour,Beauty & Health,http://www.amazon.in/Calvin-Klein-Obsession-Parfum-Spray/dp/B000UIEMUQ/ref=sr_1_142/275-9715206-1097860?s=beauty&ie=UTF8&qid=1395126972&sr=1-142,[<a href="/gp/help/seller/at-a-glance.html/275-9715206-1097860?ie=UTF8&amp;seller=A29ZFTNVZHDXBZ">Route2Fashion</a>],Amazon.in: Buy Calvin Klein Obsession Eau de Parfum Spray for Women  100ml Online at Best Price in India | Amazon Beauty Store,Buy Calvin Klein Obsession Eau de Parfum Spray for Women  100ml at lowest price in India on Amazon.in. Check out Calvin Klein Obsession Eau de Parfum Spray for Women  100ml reviews  ratings  features  specifications and browse more Beauty products online at best prices on Amazon.in.,None,<div class="bucket" id="productDescription"> <h2>Product Description</h2> <div class="content"> <h3 class="productDescriptionSource"></h3> <div class="productDescriptionWrapper">        Dry  moisture-deprived hair becomes soft  silky and deeply replenished. Infusium 23 does it all with an integrated system of proven science  exclusive technology and personalized products that transform hair for better-than-ever hair days.              <div class="emptyClear"> </div> </div> </div> </div>,None,18:03:2014,None
B006U0A7VQ,Calvin Klein Variety Gift Set for Men,http://www.amazon.in/Fragrances/b/ref=sd_allcat_beauty_fragrance/276-6718833-1247838?ie=UTF8&node=1374298031,None,Fragranc,Elizabeth Arden,Calvin Klein,http://ecx.images-amazon.com/images/I/31JrnC0qt%2BL._AA160_.jpg,None,self Colour,Beauty & Health,http://www.amazon.in/Calvin-Klein-Variety-Gift-Set/dp/B006U0A7VQ/ref=sr_1_153/275-9715206-1097860?s=beauty&ie=UTF8&qid=1395126983&sr=1-153,[<a href="/gp/help/seller/at-a-glance.html/275-9715206-1097860?ie=UTF8&amp;seller=A29ZFTNVZHDXBZ">Route2Fashion</a>],Amazon.in: Buy Calvin Klein Variety Gift Set for Men Online at Best Price in India | Amazon Beauty Store,Buy Calvin Klein Variety Gift Set for Men at lowest price in India on Amazon.in. Check out Calvin Klein Variety Gift Set for Men reviews  ratings  features  specifications and browse more Beauty products online at best prices on Amazon.in.,None,<div class="bucket" id="productDescription"> <h2>Product Description</h2> <div class="content"> <h3 class="productDescriptionSource"></h3> <div class="productDescriptionWrapper">        This was launched by the design house of Calvin Klein. The nose behind this fragrance is Calvin Klein.Top notes are Fresh notes middle notes are Clean notes.Base notes are Aromatic notes.This fragrance is classified as Masculine .              <div class="emptyClear"> </div> </div> </div> </div>,None,18:03:2014,None
B006W4D8X4,CK EUPHORIA FOR WOMEN 100ML,http://www.amazon.in/Fragrances/b/ref=sd_allcat_beauty_fragrance/276-6718833-1247838?ie=UTF8&node=1374298031,None,Fragranc,Elizabeth Arden,Calvin Klein,http://ecx.images-amazon.com/images/I/31JrnC0qt%2BL._AA160_.jpg,None,self Colour,Beauty & Health,http://www.amazon.in/CK-EUPHORIA-FOR-WOMEN-100ML/dp/B006W4D8X4/ref=sr_1_158/275-9715206-1097860?s=beauty&ie=UTF8&qid=1395126983&sr=1-158,[<a href="/gp/help/seller/at-a-glance.html/275-9715206-1097860?ie=UTF8&amp;seller=A2NFQIUV2YGOLG">Fragume</a>],Amazon.in: Buy CK EUPHORIA FOR WOMEN 100ML Online at Best Price in India | Amazon Beauty Store,Buy CK EUPHORIA FOR WOMEN 100ML at lowest price in India on Amazon.in. Check out CK EUPHORIA FOR WOMEN 100ML reviews  ratings  features  specifications and browse more Beauty products online at best prices on Amazon.in.,None,<div class="bucket" id="productDescription"> <h2>Product Description</h2> <div class="content"> <h3 class="productDescriptionSource"></h3> <div class="productDescriptionWrapper">        Euphoria Calvin Klein for women.Exotic floral-fruity fragrance Euphoria was launched in 2005. The fragrance is luminous and luscious like fruits notes of which are captured in it. Euphoria is mysterious and appealing like dark exotic flowers. It invites you to enjoy in joys of life. The main notes are rose hip  Japanese apple  green leaves  Lotus  black orchid  red woods  black violet and amber. Euphoria was created by Dominique Ropion  Carlos Benaim and Loc Dong in 2005.              <div class="emptyClear"> </div> </div> </div> </div>,None,18:03:2014,None
B001QTW494,CK Eternity moment for women 100ml,http://www.amazon.in/Fragrances/b/ref=sd_allcat_beauty_fragrance/276-6718833-1247838?ie=UTF8&node=1374298031,None,Fragranc,Elizabeth Arden,Calvin Klein,http://ecx.images-amazon.com/images/I/31JrnC0qt%2BL._AA160_.jpg,None,self Colour,Beauty & Health,http://www.amazon.in/CK-Eternity-moment-women-100ml/dp/B001QTW494/ref=sr_1_157/275-9715206-1097860?s=beauty&ie=UTF8&qid=1395126983&sr=1-157,[<a href="/gp/help/seller/at-a-glance.html/275-9715206-1097860?ie=UTF8&amp;seller=A22G8HZGXYSWPZ">Taha &amp; Bros.</a>],Amazon.in: Buy CK Eternity moment for women 100ml Online at Best Price in India | Amazon Beauty Store,Buy CK Eternity moment for women 100ml at lowest price in India on Amazon.in. Check out CK Eternity moment for women 100ml reviews  ratings  features  specifications and browse more Beauty products online at best prices on Amazon.in.,None,<div class="bucket" id="productDescription"> <h2>Product Description</h2> <div class="content"> <h3 class="productDescriptionSource"></h3> <div class="productDescriptionWrapper">        Eternity Moment Calvin Klein for women. Calvin Klein's classic fragrance Eternity has a nre version: Eternity Moment  ment for modern  young women. Its fine and fresh floral aroma is invited to capture the eternal moment of two souls meeting  gazing at each other  touching for the first time....The notes are: litchi  pomegranate blossom  water lily  Chinese pink peony  guava  musk and woody notes. Here you can read our article' Calvin Klein in step with time              <div class="emptyClear"> </div> </div> </div> </div>,None,18:03:2014,None
B004G0GQDA,Ck Free By Calvin Klein Edt Spray 50.27 ml,http://www.amazon.in/Fragrances/b/ref=sd_allcat_beauty_fragrance/276-6718833-1247838?ie=UTF8&node=1374298031,None,Fragranc,Elizabeth Arden,Calvin Klein,http://ecx.images-amazon.com/images/I/31JrnC0qt%2BL._AA160_.jpg,None,self Colour,Beauty & Health,http://www.amazon.in/Free-Calvin-Klein-Spray-50-27/dp/B004G0GQDA/ref=sr_1_159/275-9715206-1097860?s=beauty&ie=UTF8&qid=1395126983&sr=1-159,[<a href="/gp/help/seller/at-a-glance.html/275-9715206-1097860?ie=UTF8&amp;seller=A2NFQIUV2YGOLG">Fragume</a>],Amazon.in: Buy Ck Free By Calvin Klein Edt Spray 50.27 ml Online at Best Price in India | Amazon Beauty Store,Buy Ck Free By Calvin Klein Edt Spray 50.27 ml at lowest price in India on Amazon.in. Check out Ck Free By Calvin Klein Edt Spray 50.27 ml reviews  ratings  features  specifications and browse more Beauty products online at best prices on Amazon.in.,None,<div class="bucket" id="productDescription"> <h2>Product Description</h2> <div class="content"> <h3 class="productDescriptionSource"></h3> <div class="productDescriptionWrapper">        Design House: Calvin Klein  Year Introduced: 2009  Recommended Use: Casual  Recommended Use: Casual              <div class="emptyClear"> </div> </div> </div> </div>,None,18:03:2014,None
B005I4S3UW,Ck One Shock By Calvin Klein Edt Spray 100.55 ml,http://www.amazon.in/Fragrances/b/ref=sd_allcat_beauty_fragrance/276-6718833-1247838?ie=UTF8&node=1374298031,None,Fragranc,Elizabeth Arden,Calvin Klein,http://ecx.images-amazon.com/images/I/31JrnC0qt%2BL._AA160_.jpg,None,self Colour,Beauty & Health,http://www.amazon.in/Shock-Calvin-Klein-Spray-100-55/dp/B005I4S3UW/ref=sr_1_164/275-9715206-1097860?s=beauty&ie=UTF8&qid=1395126983&sr=1-164,[<a href="/gp/help/seller/at-a-glance.html/275-9715206-1097860?ie=UTF8&amp;seller=A3ES9F57NVVRIK">MyLuckyScent</a>],Amazon.in: Buy Ck One Shock By Calvin Klein Edt Spray 100.55 ml Online at Best Price in India | Amazon Beauty Store,Buy Ck One Shock By Calvin Klein Edt Spray 100.55 ml at lowest price in India on Amazon.in. Check out Ck One Shock By Calvin Klein Edt Spray 100.55 ml reviews  ratings  features  specifications and browse more Beauty products online at best prices on Amazon.in.,None,<div class="bucket" id="productDescription"> <h2>Product Description</h2> <div class="content"> <h3 class="productDescriptionSource"></h3> <div class="productDescriptionWrapper">        Design House: Calvin Klein  Year Introduced: 2011  Recommended Use: Daytime  Recommended Use: Daytime              <div class="emptyClear"> </div> </div> </div> </div>,None,18:03:2014,None
