B002Z13TKK,Elizabeth Arden Pretty EDP Spray  100ml,http://www.amazon.in/Fragrances/b/ref=sd_allcat_beauty_fragrance/276-6718833-1247838?ie=UTF8&node=1374298031,None,Fragranc,Elizabeth Arden,Calvin Klein,http://ecx.images-amazon.com/images/I/31JrnC0qt%2BL._AA160_.jpg,None,self Colour,Beauty & Health,http://www.amazon.in/Elizabeth-Arden-Pretty-Spray-100ml/dp/B002Z13TKK/ref=sr_1_29/275-9715206-1097860?s=beauty&ie=UTF8&qid=1395126938&sr=1-29,[<a href="/gp/help/seller/at-a-glance.html/275-9715206-1097860?ie=UTF8&amp;seller=A2NFQIUV2YGOLG">Fragume</a>],Amazon.in: Buy Elizabeth Arden Pretty EDP Spray  100ml Online at Best Price in India | Amazon Beauty Store,Buy Elizabeth Arden Pretty EDP Spray  100ml at lowest price in India on Amazon.in. Check out Elizabeth Arden Pretty EDP Spray  100ml reviews  ratings  features  specifications and browse more Beauty products online at best prices on Amazon.in.,None,<div class="bucket" id="productDescription"> <h2>Product Description</h2> <div class="content"> <h3 class="productDescriptionSource"></h3> <div class="productDescriptionWrapper">        Pretty Elizabeth Arden for women.Pretty seduces with its feminine concept  which rounds complete body and face care  as well as with floral juices created by perfumer Claude Dir of Givaudan. The fragrance opens with refreshing breezes of Italian mandarin and orange blossom mixed with peach juices. A heart is floral and gentle  created of petalia  starry jasmine  pink lily and peony  while base is soft and pleasant  composed of musk  Jacaranda wood and creamy amber.              <div class="emptyClear"> </div> </div> </div> </div>,None,18:03:2014,None
B0012RUL40,Mediterranean By Elizabeth Arden For Women 100 ml,http://www.amazon.in/Fragrances/b/ref=sd_allcat_beauty_fragrance/276-6718833-1247838?ie=UTF8&node=1374298031,None,Fragranc,Elizabeth Arden,Calvin Klein,http://ecx.images-amazon.com/images/I/31JrnC0qt%2BL._AA160_.jpg,None,self Colour,Beauty & Health,http://www.amazon.in/Mediterranean-Elizabeth-Arden-For-Women/dp/B0012RUL40/ref=sr_1_57/275-9715206-1097860?s=beauty&ie=UTF8&qid=1395126951&sr=1-57,[<a href="/gp/help/seller/at-a-glance.html/275-9715206-1097860?ie=UTF8&amp;seller=A22G8HZGXYSWPZ">Taha &amp; Bros.</a>],Amazon.in: Buy Mediterranean By Elizabeth Arden For Women 100 ml Online at Best Price in India | Amazon Beauty Store,Buy Mediterranean By Elizabeth Arden For Women 100 ml at lowest price in India on Amazon.in. Check out Mediterranean By Elizabeth Arden For Women 100 ml reviews  ratings  features  specifications and browse more Beauty products online at best prices on Amazon.in.,None,<div class="bucket" id="productDescription"> <h2>Product Description</h2> <div class="content"> <h3 class="productDescriptionSource"></h3> <div class="productDescriptionWrapper">        Design House: Elizabeth Arden  Year Introduced: 2007  Recommended Use: Evening  Recommended Use: Evening              <div class="emptyClear"> </div> </div> </div> </div>,None,18:03:2014,None
B000C1UBSI,CK TRUTH MEN 100ML,http://www.amazon.in/Fragrances/b/ref=sd_allcat_beauty_fragrance/276-6718833-1247838?ie=UTF8&node=1374298031,None,Fragranc,Elizabeth Arden,Calvin Klein,http://ecx.images-amazon.com/images/I/31JrnC0qt%2BL._AA160_.jpg,None,self Colour,Beauty & Health,http://www.amazon.in/Calvin-Klein-118386-TRUTH-100ML/dp/B000C1UBSI/ref=sr_1_60/275-9715206-1097860?s=beauty&ie=UTF8&qid=1395126951&sr=1-60,[<a href="/gp/help/seller/at-a-glance.html/275-9715206-1097860?ie=UTF8&amp;seller=A22G8HZGXYSWPZ">Taha &amp; Bros.</a>],Amazon.in: Buy CK TRUTH MEN 100ML Online at Best Price in India | Amazon Beauty Store,Buy CK TRUTH MEN 100ML at lowest price in India on Amazon.in. Check out CK TRUTH MEN 100ML reviews  ratings  features  specifications and browse more Beauty products online at best prices on Amazon.in.,None,<div class="bucket" id="productDescription"> <h2>Product Description</h2> <div class="content"> <h3 class="productDescriptionSource"></h3> <div class="productDescriptionWrapper">        Design House: Calvin Klein  Year Introduced: 2002  Recommended Use: Casual  Recommended Use: Casual              <div class="emptyClear"> </div> </div> </div> </div>,None,18:03:2014,None
B000VOPEKQ,Calvin Klein CKIN2U EDT Spray for Men  150ml,http://www.amazon.in/Fragrances/b/ref=sd_allcat_beauty_fragrance/276-6718833-1247838?ie=UTF8&node=1374298031,None,Fragranc,Elizabeth Arden,Calvin Klein,http://ecx.images-amazon.com/images/I/31JrnC0qt%2BL._AA160_.jpg,None,self Colour,Beauty & Health,http://www.amazon.in/Calvin-Klein-CKIN2U-Spray-150ml/dp/B000VOPEKQ/ref=sr_1_63/275-9715206-1097860?s=beauty&ie=UTF8&qid=1395126951&sr=1-63,[<a href="/gp/help/seller/at-a-glance.html/275-9715206-1097860?ie=UTF8&amp;seller=A2IT7998C8946H">Perfume Nation</a>],Amazon.in: Buy Calvin Klein CKIN2U EDT Spray for Men  150ml Online at Best Price in India | Amazon Beauty Store,Buy Calvin Klein CKIN2U EDT Spray for Men  150ml at lowest price in India on Amazon.in. Check out Calvin Klein CKIN2U EDT Spray for Men  150ml reviews  ratings  features  specifications and browse more Beauty products online at best prices on Amazon.in.,None,<div class="bucket" id="productDescription"> <h2>Product Description</h2> <div class="content"> <h3 class="productDescriptionSource"></h3> <div class="productDescriptionWrapper">        Launched by the design house of Calvin Klein. When applying any fragrance please consider that there are several factors which can affect the natural smell of your skin and  in turn  the way a scent smells on you.  For instance  your mood  stress level  age  body chemistry  diet and current medications may all alter the scents you wear. Similarly  factor such as dry or oily skin can even affect the amount of time a fragrance will last after being applied.              <div class="emptyClear"> </div> </div> </div> </div>,None,18:03:2014,None
B0012RQZGS,Calvin Klein Man EDT for Men 100,http://www.amazon.in/Fragrances/b/ref=sd_allcat_beauty_fragrance/276-6718833-1247838?ie=UTF8&node=1374298031,None,Fragranc,Elizabeth Arden,Calvin Klein,http://ecx.images-amazon.com/images/I/31JrnC0qt%2BL._AA160_.jpg,None,self Colour,Beauty & Health,http://www.amazon.in/Calvin-Klein-Man-EDT-Men/dp/B0012RQZGS/ref=sr_1_51/275-9715206-1097860?s=beauty&ie=UTF8&qid=1395126951&sr=1-51,[<a href="/gp/help/seller/at-a-glance.html/275-9715206-1097860?ie=UTF8&amp;seller=A22G8HZGXYSWPZ">Taha &amp; Bros.</a>],Amazon.in: Buy Calvin Klein Man EDT for Men  100 Online at Best Price in India | Amazon Beauty Store,Buy Calvin Klein Man EDT for Men  100 at lowest price in India on Amazon.in. Check out Calvin Klein Man EDT for Men  100 reviews  ratings  features  specifications and browse more Beauty products online at best prices on Amazon.in.,None,<div class="bucket" id="productDescription"> <h2>Product Description</h2> <div class="content"> <h3 class="productDescriptionSource"></h3> <div class="productDescriptionWrapper">        Design House: Calvin Klein  Year Introduced: 2007  Recommended Use: Casual  Recommended Use: Casual              <div class="emptyClear"> </div> </div> </div> </div>,None,18:03:2014,None
B000VOPETC,Calvin Klein Eternity Eau De Toilette Spray for Men  100ml,http://www.amazon.in/Fragrances/b/ref=sd_allcat_beauty_fragrance/276-6718833-1247838?ie=UTF8&node=1374298031,None,Fragranc,Elizabeth Arden,Calvin Klein,http://ecx.images-amazon.com/images/I/31JrnC0qt%2BL._AA160_.jpg,None,self Colour,Beauty & Health,http://www.amazon.in/Calvin-Klein-Eternity-Toilette-Spray/dp/B000VOPETC/ref=sr_1_64/275-9715206-1097860?s=beauty&ie=UTF8&qid=1395126951&sr=1-64,[<a href="/gp/help/seller/at-a-glance.html/275-9715206-1097860?ie=UTF8&amp;seller=A3ES9F57NVVRIK">MyLuckyScent</a>],Amazon.in: Buy Calvin Klein Eternity Eau De Toilette Spray for Men  100ml Online at Best Price in India | Amazon Beauty Store,Buy Calvin Klein Eternity Eau De Toilette Spray for Men  100ml at lowest price in India on Amazon.in. Check out Calvin Klein Eternity Eau De Toilette Spray for Men  100ml reviews  ratings  features  specifications and browse more Beauty products online at best prices on Amazon.in.,None,<div class="bucket" id="productDescription"> <h2>Product Description</h2> <div class="content"> <h3 class="productDescriptionSource"></h3> <div class="productDescriptionWrapper">        Launched by the design house of Calvin Klein in 1989  Eternity is a men's fragrance that possesses a blend of greens  crisp jasmine  sage  basil and rosewood  very refreshing and crisp. It is recommended for daytime wear. When applying any fragrance please consider that there are several factors which can affect the natural smell of your skin and in turn  the way a scent smells on you. For instance  your mood  stress level  age  body chemistry  diet and current medications may all alter the scents you wear. Similarly  factor such as dry or oily skin can even affect the amount of time a fragrance will last after being applied.              <div class="emptyClear"> </div> </div> </div> </div>,None,18:03:2014,None
B00117PXSU,Elizabeth Arden Green Tea Tropical Eau De Toilette Spray for Women  100ml,http://www.amazon.in/Fragrances/b/ref=sd_allcat_beauty_fragrance/276-6718833-1247838?ie=UTF8&node=1374298031,None,Fragranc,Elizabeth Arden,Calvin Klein,http://ecx.images-amazon.com/images/I/31JrnC0qt%2BL._AA160_.jpg,None,self Colour,Beauty & Health,http://www.amazon.in/Elizabeth-Arden-Green-Tropical-Toilette/dp/B00117PXSU/ref=sr_1_62/275-9715206-1097860?s=beauty&ie=UTF8&qid=1395126951&sr=1-62,[<a href="/gp/help/seller/at-a-glance.html/275-9715206-1097860?ie=UTF8&amp;seller=A22G8HZGXYSWPZ">Taha &amp; Bros.</a>],Amazon.in: Buy Elizabeth Arden Green Tea Tropical Eau De Toilette Spray for Women  100ml Online at Best Price in India | Amazon Beauty Store,Buy Elizabeth Arden Green Tea Tropical Eau De Toilette Spray for Women  100ml at lowest price in India on Amazon.in. Check out Elizabeth Arden Green Tea Tropical Eau De Toilette Spray for Women  100ml reviews  ratings  features  specifications and browse more Beauty products online at best prices on Amazon.in.,None,<div class="bucket" id="productDescription"> <h2>Product Description</h2> <div class="content"> <h3 class="productDescriptionSource"></h3> <div class="productDescriptionWrapper">        Green Tea Tropical Elizabeth Arden for women.Green Tea Tropical by Elizabeth Arden is a Aromatic Fruity fragrance for women. Green Tea Tropical was launched in 2007. The nose behind this fragrance is Rodrigo Flores-Roux. Top notes are litchi and passion flower; middle notes are green tea  tea and magnolia; base notes are musk and tropical fruits.              <div class="emptyClear"> </div> </div> </div> </div>,None,18:03:2014,None
B00CLC0ZVY,Elizabeth Arden 5Th Avenue Nyc  Eau de Parfum for Women  125ml,http://www.amazon.in/Fragrances/b/ref=sd_allcat_beauty_fragrance/276-6718833-1247838?ie=UTF8&node=1374298031,None,Fragranc,Elizabeth Arden,Calvin Klein,http://ecx.images-amazon.com/images/I/31JrnC0qt%2BL._AA160_.jpg,None,self Colour,Beauty & Health,http://www.amazon.in/Elizabeth-Arden-Avenue-Nyc-Parfum/dp/B00CLC0ZVY/ref=sr_1_68/275-9715206-1097860?s=beauty&ie=UTF8&qid=1395126951&sr=1-68,[<a href="/gp/help/seller/at-a-glance.html/275-9715206-1097860?ie=UTF8&amp;seller=A29ZFTNVZHDXBZ">Route2Fashion</a>],Amazon.in: Buy Elizabeth Arden 5Th Avenue Nyc Eau de Parfum for Women  125ml Online at Best Price in India | Amazon Beauty Store,Buy Elizabeth Arden 5Th Avenue Nyc Eau de Parfum for Women  125ml at lowest price in India on Amazon.in. Check out Elizabeth Arden 5Th Avenue Nyc Eau de Parfum for Women  125ml reviews  ratings  features  specifications and browse more Beauty products online at best prices on Amazon.in.,None,<div class="bucket" id="productDescription"> <h2>Product Description</h2> <div class="content"> <h3 class="productDescriptionSource"></h3> <div class="productDescriptionWrapper">        he beginning of the composition perfectly transmits energy pulse of New York  with a touch of sensuality introduced by the heart aroma. Juices of black currant intertwine with an exquisite bouquet of flowers (night blooming jasmine  plum blossom  peony) with scents complemented by the cozy  warm and sensual blend of notes in the base              <div class="emptyClear"> </div> </div> </div> </div>,None,18:03:2014,None
B000C2109Q,Calvin Klein Truth for Men EDT  100gm,http://www.amazon.in/Fragrances/b/ref=sd_allcat_beauty_fragrance/276-6718833-1247838?ie=UTF8&node=1374298031,None,Fragranc,Elizabeth Arden,Calvin Klein,http://ecx.images-amazon.com/images/I/31JrnC0qt%2BL._AA160_.jpg,None,self Colour,Beauty & Health,http://www.amazon.in/Calvin-Klein-Truth-Men-100gm/dp/B000C2109Q/ref=sr_1_66/275-9715206-1097860?s=beauty&ie=UTF8&qid=1395126951&sr=1-66,[<a href="/gp/help/seller/at-a-glance.html/275-9715206-1097860?ie=UTF8&amp;seller=A2O8H5ZZSCKU2K">Perfume Crush</a>],Amazon.in: Buy Calvin Klein Truth for Men EDT  100gm Online at Best Price in India | Amazon Beauty Store,Buy Calvin Klein Truth for Men EDT  100gm at lowest price in India on Amazon.in. Check out Calvin Klein Truth for Men EDT  100gm reviews  ratings  features  specifications and browse more Beauty products online at best prices on Amazon.in.,None,<div class="bucket" id="productDescription"> <h2>Product Description</h2> <div class="content"> <h3 class="productDescriptionSource"></h3> <div class="productDescriptionWrapper">        Fragrance notes: Green tea jasmine and musk lush and natural. When applying any fragrance please consider that there are several factors which can affect the natural smell of your skin and in turn the way a scent smells on you. For instance your mood stress level age body chemistry  diet and current medications may all alter the scents you wear. Similarly factor such as dry or oily skin can even affect the amount of time a fragrance will last after being applied.              <div class="emptyClear"> </div> </div> </div> </div>,None,18:03:2014,None
B007HUMIG0,Elizabeth Arden Green Tea Eau De Toilette for Women  100ml,http://www.amazon.in/Fragrances/b/ref=sd_allcat_beauty_fragrance/276-6718833-1247838?ie=UTF8&node=1374298031,None,Fragranc,Elizabeth Arden,Calvin Klein,http://ecx.images-amazon.com/images/I/31JrnC0qt%2BL._AA160_.jpg,None,self Colour,Beauty & Health,http://www.amazon.in/Elizabeth-Arden-Green-Toilette-Women/dp/B007HUMIG0/ref=sr_1_69/275-9715206-1097860?s=beauty&ie=UTF8&qid=1395126951&sr=1-69,[<a href="/gp/help/seller/at-a-glance.html/275-9715206-1097860?ie=UTF8&amp;seller=A2NFQIUV2YGOLG">Fragume</a>],Amazon.in: Buy Elizabeth Arden Green Tea Eau De Toilette for Women  100ml Online at Best Price in India | Amazon Beauty Store,Buy Elizabeth Arden Green Tea Eau De Toilette for Women  100ml at lowest price in India on Amazon.in. Check out Elizabeth Arden Green Tea Eau De Toilette for Women  100ml reviews  ratings  features  specifications and browse more Beauty products online at best prices on Amazon.in.,None,<div class="bucket" id="productDescription"> <h2>Product Description</h2> <div class="content"> <h3 class="productDescriptionSource"></h3> <div class="productDescriptionWrapper">        Design House: Elizabeth Arden  Year Introduced: 2011  Recommended Use: Casual  Recommended Use: Casual              <div class="emptyClear"> </div> </div> </div> </div>,None,18:03:2014,None
B000C2104G,Calvin Klein Be Eau De Toilette for Men and Women  100ml,http://www.amazon.in/Fragrances/b/ref=sd_allcat_beauty_fragrance/276-6718833-1247838?ie=UTF8&node=1374298031,None,Fragranc,Elizabeth Arden,Calvin Klein,http://ecx.images-amazon.com/images/I/31JrnC0qt%2BL._AA160_.jpg,None,self Colour,Beauty & Health,http://www.amazon.in/Calvin-Klein-Toilette-Women-100ml/dp/B000C2104G/ref=sr_1_77/275-9715206-1097860?s=beauty&ie=UTF8&qid=1395126958&sr=1-77,[<a href="/gp/help/seller/at-a-glance.html/275-9715206-1097860?ie=UTF8&amp;seller=A3ES9F57NVVRIK">MyLuckyScent</a>],Amazon.in: Buy Calvin Klein Be Eau De Toilette for Men and Women  100ml Online at Best Price in India | Amazon Beauty Store,Buy Calvin Klein Be Eau De Toilette for Men and Women  100ml at lowest price in India on Amazon.in. Check out Calvin Klein Be Eau De Toilette for Men and Women  100ml reviews  ratings  features  specifications and browse more Beauty products online at best prices on Amazon.in.,None,<div class="bucket" id="productDescription"> <h2>Product Description</h2> <div class="content"> <h3 class="productDescriptionSource"></h3> <div class="productDescriptionWrapper">        Introduced in 1996. Fragrance notes: musk  mandarin  magnolia  peach and sandalwood. Recommended use: daytime. When applying any fragrance please consider that there are several factors which can affect the natural smell of your skin and  in turn  the way a scent smells on you. For instance  your mood  stress level  age  body chemistry  diet and current medications may all alter the scents you wear. Similarly  factor such as dry or oily skin can even affect the amount of time a fragrance will last after being applied.              <div class="emptyClear"> </div> </div> </div> </div>,None,18:03:2014,None
B007WA8GMA,Calvin Klein Be Eau De Toilette for Unisex Eau De Toilette  198ml,http://www.amazon.in/Fragrances/b/ref=sd_allcat_beauty_fragrance/276-6718833-1247838?ie=UTF8&node=1374298031,Rs. 2 345.00,Fragranc,Elizabeth Arden,Calvin Klein,http://ecx.images-amazon.com/images/I/31JrnC0qt%2BL._AA160_.jpg,Rs. 2 345.00,self Colour,Beauty & Health,http://www.amazon.in/Calvin-Klein-Toilette-Unisex-198ml/dp/B007WA8GMA/ref=sr_1_78/275-9715206-1097860?s=beauty&ie=UTF8&qid=1395126958&sr=1-78,[<a class="buyAction" href="/gp/offer-listing/B007WA8GMA/ref=dp_olp_0/275-9715206-1097860?ie=UTF8&amp;condition=all">these sellers</a>],Amazon.in: Buy Calvin Klein Be Eau De Toilette for Unisex Eau De Toilette  198ml Online at Best Price in India | Amazon Beauty Store,Buy Calvin Klein Be Eau De Toilette for Unisex Eau De Toilette  198ml at lowest price in India on Amazon.in. Check out Calvin Klein Be Eau De Toilette for Unisex Eau De Toilette  198ml reviews  ratings  features  specifications and browse more Beauty products online at best prices on Amazon.in.,None,<div class="bucket" id="productDescription"> <h2>Product Description</h2> <div class="content"> <h3 class="productDescriptionSource"></h3> <div class="productDescriptionWrapper">        Calvin Klein Be Unisex 200ml EDT              <div class="emptyClear"> </div> </div> </div> </div>,None,18:03:2014,None
B0040NFYZ4,Calvin Klein Beauty By Calvin Klein Eau De Parfum Spray 100.55 ml,http://www.amazon.in/Fragrances/b/ref=sd_allcat_beauty_fragrance/276-6718833-1247838?ie=UTF8&node=1374298031,None,Fragranc,Elizabeth Arden,Calvin Klein,http://ecx.images-amazon.com/images/I/31JrnC0qt%2BL._AA160_.jpg,None,self Colour,Beauty & Health,http://www.amazon.in/Calvin-Klein-Beauty-Parfum-100-55/dp/B0040NFYZ4/ref=sr_1_79/275-9715206-1097860?s=beauty&ie=UTF8&qid=1395126958&sr=1-79,[<a href="/gp/help/seller/at-a-glance.html/275-9715206-1097860?ie=UTF8&amp;seller=A2IT7998C8946H">Perfume Nation</a>],Amazon.in: Buy Calvin Klein Beauty By Calvin Klein Eau De Parfum Spray 100.55 ml Online at Best Price in India | Amazon Beauty Store,Buy Calvin Klein Beauty By Calvin Klein Eau De Parfum Spray 100.55 ml at lowest price in India on Amazon.in. Check out Calvin Klein Beauty By Calvin Klein Eau De Parfum Spray 100.55 ml reviews  ratings  features  specifications and browse more Beauty products online at best prices on Amazon.in.,None,<div class="bucket" id="productDescription"> <h2>Product Description</h2> <div class="content"> <h3 class="productDescriptionSource"></h3> <div class="productDescriptionWrapper">        Design House: Calvin Klein  Year Introduced: 2010  Recommended Use: Casual  Recommended Use: Casual              <div class="emptyClear"> </div> </div> </div> </div>,None,18:03:2014,None
B00593VXRM,Calvin Klein Beauty Eau de Parfum for Women  100ml,http://www.amazon.in/Fragrances/b/ref=sd_allcat_beauty_fragrance/276-6718833-1247838?ie=UTF8&node=1374298031,Rs. 3 100.00,Fragranc,Elizabeth Arden,Calvin Klein,http://ecx.images-amazon.com/images/I/31JrnC0qt%2BL._AA160_.jpg,Rs. 3 100.00,self Colour,Beauty & Health,http://www.amazon.in/Calvin-Klein-Beauty-Parfum-Women/dp/B00593VXRM/ref=sr_1_81/275-9715206-1097860?s=beauty&ie=UTF8&qid=1395126958&sr=1-81,[<a class="buyAction" href="/gp/offer-listing/B00593VXRM/ref=dp_olp_0/275-9715206-1097860?ie=UTF8&amp;condition=all">these sellers</a>],Amazon.in: Buy Calvin Klein Beauty Eau de Parfum for Women  100ml Online at Best Price in India | Amazon Beauty Store,Buy Calvin Klein Beauty Eau de Parfum for Women  100ml at lowest price in India on Amazon.in. Check out Calvin Klein Beauty Eau de Parfum for Women  100ml reviews  ratings  features  specifications and browse more Beauty products online at best prices on Amazon.in.,None,<div class="bucket" id="productDescription"> <h2>Product Description</h2> <div class="content"> <h3 class="productDescriptionSource"></h3> <div class="productDescriptionWrapper">        The scent is dedicated to women in their forties  and celebrates their maturity  self-esteem and physical beauty. Each note co-relates to a facet of the woman. There is the top note which symbolizes her physical beauty  the heart of jasmine her self-esteem and the base note of Virginian cedar which evokes her wisdom.              <div class="emptyClear"> </div> </div> </div> </div>,None,18:03:2014,None
B009QZ6S56,CALVIN KLEIN CALVIN KLEIN BEAUTY EDP SPRAY 3.4 OZ,http://www.amazon.in/Fragrances/b/ref=sd_allcat_beauty_fragrance/276-6718833-1247838?ie=UTF8&node=1374298031,Rs. 3 000.00,Fragranc,Elizabeth Arden,Calvin Klein,http://ecx.images-amazon.com/images/I/31JrnC0qt%2BL._AA160_.jpg,Rs. 3 000.00,self Colour,Beauty & Health,http://www.amazon.in/CALVIN-KLEIN-BEAUTY-EDP-SPRAY/dp/B009QZ6S56/ref=sr_1_84/275-9715206-1097860?s=beauty&ie=UTF8&qid=1395126958&sr=1-84,[<a class="buyAction" href="/gp/offer-listing/B009QZ6S56/ref=dp_olp_0/275-9715206-1097860?ie=UTF8&amp;condition=all">these sellers</a>],Amazon.in: Buy CALVIN KLEIN CALVIN KLEIN BEAUTY EDP SPRAY 3.4 OZ Online at Best Price in India | Amazon Beauty Store,Buy CALVIN KLEIN CALVIN KLEIN BEAUTY EDP SPRAY 3.4 OZ at lowest price in India on Amazon.in. Check out CALVIN KLEIN CALVIN KLEIN BEAUTY EDP SPRAY 3.4 OZ reviews  ratings  features  specifications and browse more Beauty products online at best prices on Amazon.in.,None,None,None,18:03:2014,None
B002S8TPRQ,Calvin Klein Calvin Klein Eau De Toilette Spray  100.55ml,http://www.amazon.in/Fragrances/b/ref=sd_allcat_beauty_fragrance/276-6718833-1247838?ie=UTF8&node=1374298031,None,Fragranc,Elizabeth Arden,Calvin Klein,http://ecx.images-amazon.com/images/I/31JrnC0qt%2BL._AA160_.jpg,None,self Colour,Beauty & Health,http://www.amazon.in/Calvin-Klein-Toilette-Spray-100-55ml/dp/B002S8TPRQ/ref=sr_1_85/275-9715206-1097860?s=beauty&ie=UTF8&qid=1395126958&sr=1-85,[<a href="/gp/help/seller/at-a-glance.html/275-9715206-1097860?ie=UTF8&amp;seller=A2NFQIUV2YGOLG">Fragume</a>],Amazon.in: Buy Calvin Klein Calvin Klein Eau De Toilette Spray  100.55ml Online at Best Price in India | Amazon Beauty Store,Buy Calvin Klein Calvin Klein Eau De Toilette Spray  100.55ml at lowest price in India on Amazon.in. Check out Calvin Klein Calvin Klein Eau De Toilette Spray  100.55ml reviews  ratings  features  specifications and browse more Beauty products online at best prices on Amazon.in.,None,<div class="bucket" id="productDescription"> <h2>Product Description</h2> <div class="content"> <h3 class="productDescriptionSource"></h3> <div class="productDescriptionWrapper">        Design House: Calvin Klein  Year Introduced: 2009  Recommended Use: Casual  Recommended Use: Casual              <div class="emptyClear"> </div> </div> </div> </div>,None,18:03:2014,None
B007ZU6W46,Calvin Klein Ck One Eau De Toilette Spray for Women 3.4 Ounce,http://www.amazon.in/Fragrances/b/ref=sd_allcat_beauty_fragrance/276-6718833-1247838?ie=UTF8&node=1374298031,None,Fragranc,Elizabeth Arden,Calvin Klein,http://ecx.images-amazon.com/images/I/31JrnC0qt%2BL._AA160_.jpg,None,self Colour,Beauty & Health,http://www.amazon.in/Calvin-Klein-Toilette-Spray-Women/dp/B007ZU6W46/ref=sr_1_87/275-9715206-1097860?s=beauty&ie=UTF8&qid=1395126958&sr=1-87,[<a href="/gp/help/seller/at-a-glance.html/275-9715206-1097860?ie=UTF8&amp;seller=A2NFQIUV2YGOLG">Fragume</a>],Amazon.in: Buy Calvin Klein Ck One Eau De Toilette Spray for Women 3.4 Ounce Online at Best Price in India | Amazon Beauty Store,Buy Calvin Klein Ck One Eau De Toilette Spray for Women 3.4 Ounce at lowest price in India on Amazon.in. Check out Calvin Klein Ck One Eau De Toilette Spray for Women 3.4 Ounce reviews  ratings  features  specifications and browse more Beauty products online at best prices on Amazon.in.,None,<div class="bucket" id="productDescription"> <h2>Product Description</h2> <div class="content"> <h3 class="productDescriptionSource"></h3> <div class="productDescriptionWrapper">        "Ck One Perfume Eau De Toilette Spray 3.4 Oz 100 Ml for Men and Women and Women by Calvin Klein."              <div class="emptyClear"> </div> </div> </div> </div>,None,18:03:2014,None
