B005HNX7NW,CK One Shock For Him Calvin Klein for men,http://www.amazon.in/Fragrances/b/ref=sd_allcat_beauty_fragrance/276-6718833-1247838?ie=UTF8&node=1374298031,None,Fragranc,Elizabeth Arden,Calvin Klein,http://ecx.images-amazon.com/images/I/31JrnC0qt%2BL._AA160_.jpg,None,self Colour,Beauty & Health,http://www.amazon.in/One-Shock-For-Calvin-Klein/dp/B005HNX7NW/ref=sr_1_167/275-9715206-1097860?s=beauty&ie=UTF8&qid=1395126983&sr=1-167,[<a href="/gp/help/seller/at-a-glance.html/275-9715206-1097860?ie=UTF8&amp;seller=A2NFQIUV2YGOLG">Fragume</a>],Amazon.in: Buy CK One Shock For Him Calvin Klein for men Online at Best Price in India | Amazon Beauty Store,Buy CK One Shock For Him Calvin Klein for men at lowest price in India on Amazon.in. Check out CK One Shock For Him Calvin Klein for men reviews  ratings  features  specifications and browse more Beauty products online at best prices on Amazon.in.,None,<div class="bucket" id="productDescription"> <h2>Product Description</h2> <div class="content"> <h3 class="productDescriptionSource"></h3> <div class="productDescriptionWrapper">        Design House: Calvin Klein  Year Introduced: 2011  Recommended Use: Casual  Recommended Use: Casual              <div class="emptyClear"> </div> </div> </div> </div>,None,18:03:2014,None
B005A5W9F4,CK One Shock for Him Eau De Toilette Spray Men by Calvin Klein 6.7 Ounce,http://www.amazon.in/Fragrances/b/ref=sd_allcat_beauty_fragrance/276-6718833-1247838?ie=UTF8&node=1374298031,None,Fragranc,Elizabeth Arden,Calvin Klein,http://ecx.images-amazon.com/images/I/31JrnC0qt%2BL._AA160_.jpg,None,self Colour,Beauty & Health,http://www.amazon.in/Shock-Toilette-Spray-Calvin-Klein/dp/B005A5W9F4/ref=sr_1_168/275-9715206-1097860?s=beauty&ie=UTF8&qid=1395126983&sr=1-168,[<a href="/gp/help/seller/at-a-glance.html/275-9715206-1097860?ie=UTF8&amp;seller=A22G8HZGXYSWPZ">Taha &amp; Bros.</a>],Amazon.in: Buy CK One Shock for Him Eau De Toilette Spray Men by Calvin Klein 6.7 Ounce Online at Best Price in India | Amazon Beauty Store,Buy CK One Shock for Him Eau De Toilette Spray Men by Calvin Klein 6.7 Ounce at lowest price in India on Amazon.in. Check out CK One Shock for Him Eau De Toilette Spray Men by Calvin Klein 6.7 Ounce reviews  ratings  features  specifications and browse more Beauty products online at best prices on Amazon.in.,None,<div class="bucket" id="productDescription"> <h2>Product Description</h2> <div class="content"> <h3 class="productDescriptionSource"></h3> <div class="productDescriptionWrapper">        Ck One Shock By Calvin Klein Eau De Toilette Spray 6.7 Oz For Men : A surprise for all the fans of CK One line CK One Shock is built around a spicy aromatic and deep oriental tang. Created by Ann Gottlieb of IFF and introduced by Calvin Klein in 2011 this unique composition emphasizes your masculinity by adding the perfect blend of oomph and a mysterious charm. A flawless combination of citrusy Clementine and fresh cucumber aroma will capture your attention when you open this fragrance. The middle notes comprise of black pepper black basil and cardamom while the base of masculine tobacco musk patchouli and ambrene wood completes this signature scent. Sexy impulsive and edgy the women are sure to take notice.Features1) Ck One Shock By Calvin Klein Eau De Toilette Spray 6.7 Oz For Men2) Ck One Shock By Calvin Klein For Men3) Eau De Toilette Spray 6.7 Oz4) Packaging for this product may vary from that shown in the image above5) 100% Authentic Brand Name Merchandise!              <div class="emptyClear"> </div> </div> </div> </div>,None,18:03:2014,None
B000GHVIU8,Elizabeth Arden 5th Avenue After 5 EDT for Women  75ml,http://www.amazon.in/Fragrances/b/ref=sd_allcat_beauty_fragrance/276-6718833-1247838?ie=UTF8&node=1374298031,Rs. 1 170.00,Fragranc,Elizabeth Arden,Calvin Klein,http://ecx.images-amazon.com/images/I/31JrnC0qt%2BL._AA160_.jpg,Rs. 1 170.00,self Colour,Beauty & Health,http://www.amazon.in/Elizabeth-Arden-Avenue-After-Women/dp/B000GHVIU8/ref=sr_1_174/275-9715206-1097860?s=beauty&ie=UTF8&qid=1395126996&sr=1-174,[<a class="buyAction" href="/gp/offer-listing/B000GHVIU8/ref=dp_olp_0/275-9715206-1097860?ie=UTF8&amp;condition=all">these sellers</a>],Amazon.in: Buy Elizabeth Arden 5th Avenue After 5 EDT for Women  75ml Online at Best Price in India | Amazon Beauty Store,Buy Elizabeth Arden 5th Avenue After 5 EDT for Women  75ml at lowest price in India on Amazon.in. Check out Elizabeth Arden 5th Avenue After 5 EDT for Women  75ml reviews  ratings  features  specifications and browse more Beauty products online at best prices on Amazon.in.,None,<div class="bucket" id="productDescription"> <h2>Product Description</h2> <div class="content"> <h3 class="productDescriptionSource"></h3> <div class="productDescriptionWrapper">        Elizabeth Arden lived by a fundamental mantra that a woman?s beauty must not just lay in a layer of makeup. She created an intelligent relationship between science and nature  through her range of beauty products  to help a woman take her natural assets to the notch of finesse. A classic  sensuous fragrance from the house of Elizabeth Arden 5Th Avenue  After Five Eau De Toilette (Women) reminds you that the night is still young. This misty  musky fragrance fills the air around you with energy and romance that makes you expect the unexpected. Elizabeth Arden After Five Perfume starts with top notes of honeysuckle  coriander  plum  and bergamot that lend a vibrant mix of fruity and spicy blast to it. A floral heart with a gracious blend of Indian lotus  jasmine  saffron  and lily-of-the-valley make it all the more passionate. At the base  this perfume turns all the more promising with birch  sandalwood and Tonka bean intertwined in a distinct manner              <div class="emptyClear"> </div> </div> </div> </div>,None,18:03:2014,None
B0009OAI54,Elizabeth Arden 5th Avenue EDT for Women  125ml,http://www.amazon.in/Fragrances/b/ref=sd_allcat_beauty_fragrance/276-6718833-1247838?ie=UTF8&node=1374298031,None,Fragranc,Elizabeth Arden,Calvin Klein,http://ecx.images-amazon.com/images/I/31JrnC0qt%2BL._AA160_.jpg,None,self Colour,Beauty & Health,http://www.amazon.in/Elizabeth-Arden-Avenue-Women-125ml/dp/B0009OAI54/ref=sr_1_175/275-9715206-1097860?s=beauty&ie=UTF8&qid=1395126996&sr=1-175,[<a href="/gp/help/seller/at-a-glance.html/275-9715206-1097860?ie=UTF8&amp;seller=A3ES9F57NVVRIK">MyLuckyScent</a>],Amazon.in: Buy Elizabeth Arden 5th Avenue EDT for Women  125ml Online at Best Price in India | Amazon Beauty Store,Buy Elizabeth Arden 5th Avenue EDT for Women  125ml at lowest price in India on Amazon.in. Check out Elizabeth Arden 5th Avenue EDT for Women  125ml reviews  ratings  features  specifications and browse more Beauty products online at best prices on Amazon.in.,None,<div class="bucket" id="productDescription"> <h2>Product Description</h2> <div class="content"> <h3 class="productDescriptionSource"></h3> <div class="productDescriptionWrapper">        Design House: Elizabeth Arden  Year Introduced: 1996  Recommended Use: Daytime  Recommended Use: Daytime              <div class="emptyClear"> </div> </div> </div> </div>,None,18:03:2014,None
B005EG3610,Elizabeth Arden 5th Avenue Gold EDT for Women  125ml,http://www.amazon.in/Fragrances/b/ref=sd_allcat_beauty_fragrance/276-6718833-1247838?ie=UTF8&node=1374298031,None,Fragranc,Elizabeth Arden,Calvin Klein,http://ecx.images-amazon.com/images/I/31JrnC0qt%2BL._AA160_.jpg,None,self Colour,Beauty & Health,http://www.amazon.in/Elizabeth-Arden-Avenue-Women-125ml/dp/B005EG3610/ref=sr_1_176/275-9715206-1097860?s=beauty&ie=UTF8&qid=1395126996&sr=1-176,[<a href="/gp/help/seller/at-a-glance.html/275-9715206-1097860?ie=UTF8&amp;seller=A2NFQIUV2YGOLG">Fragume</a>],Amazon.in: Buy Elizabeth Arden 5th Avenue Gold EDT for Women  125ml Online at Best Price in India | Amazon Beauty Store,Buy Elizabeth Arden 5th Avenue Gold EDT for Women  125ml at lowest price in India on Amazon.in. Check out Elizabeth Arden 5th Avenue Gold EDT for Women  125ml reviews  ratings  features  specifications and browse more Beauty products online at best prices on Amazon.in.,None,<div class="bucket" id="productDescription"> <h2>Product Description</h2> <div class="content"> <h3 class="productDescriptionSource"></h3> <div class="productDescriptionWrapper">        It is the gleaming pendant set against the black velvet of your evening gown. It is the rising sun peeping at you from between two buildings  tickling your arm with its warmth and nourishment. It is the rainbow glow on the bubbles in your flute of clean straw-coloured champagne. It is 5th Avenue Gold. This flanker for the original 5th Avenue is lighter  a little sweeter and very subtle. 5th Avenue Gold begins with a pared down combination of bergamot  mandarin and lily of the valley  adds a guava note to the essential heart of iris  jasmine  and rose  and finally allow you to feel its weight in your hand through a sensual base note of musk.              <div class="emptyClear"> </div> </div> </div> </div>,None,18:03:2014,None
B0084YC322,Elizabeth Arden 5th Avenue Nights Women 125ML EDP,http://www.amazon.in/Fragrances/b/ref=sd_allcat_beauty_fragrance/276-6718833-1247838?ie=UTF8&node=1374298031,None,Fragranc,Elizabeth Arden,Calvin Klein,http://ecx.images-amazon.com/images/I/31JrnC0qt%2BL._AA160_.jpg,None,self Colour,Beauty & Health,http://www.amazon.in/Elizabeth-Arden-Avenue-Nights-Women/dp/B0084YC322/ref=sr_1_178/275-9715206-1097860?s=beauty&ie=UTF8&qid=1395126996&sr=1-178,[<a href="/gp/help/seller/at-a-glance.html/275-9715206-1097860?ie=UTF8&amp;seller=A2NFQIUV2YGOLG">Fragume</a>],Amazon.in: Buy Elizabeth Arden 5th Avenue Nights Women 125ML EDP Online at Best Price in India | Amazon Beauty Store,Buy Elizabeth Arden 5th Avenue Nights Women 125ML EDP at lowest price in India on Amazon.in. Check out Elizabeth Arden 5th Avenue Nights Women 125ML EDP reviews  ratings  features  specifications and browse more Beauty products online at best prices on Amazon.in.,None,None,None,18:03:2014,None
B0038ZWTD0,Elizabeth Arden 5TH AVENUE Style Women Edp 125ML,http://www.amazon.in/Fragrances/b/ref=sd_allcat_beauty_fragrance/276-6718833-1247838?ie=UTF8&node=1374298031,None,Fragranc,Elizabeth Arden,Calvin Klein,http://ecx.images-amazon.com/images/I/31JrnC0qt%2BL._AA160_.jpg,None,self Colour,Beauty & Health,http://www.amazon.in/Elizabeth-Arden-AVENUE-Style-Women/dp/B0038ZWTD0/ref=sr_1_179/275-9715206-1097860?s=beauty&ie=UTF8&qid=1395126996&sr=1-179,[<a href="/gp/help/seller/at-a-glance.html/275-9715206-1097860?ie=UTF8&amp;seller=A2NFQIUV2YGOLG">Fragume</a>],Amazon.in: Buy Elizabeth Arden 5TH AVENUE Style Women Edp 125ML Online at Best Price in India | Amazon Beauty Store,Buy Elizabeth Arden 5TH AVENUE Style Women Edp 125ML at lowest price in India on Amazon.in. Check out Elizabeth Arden 5TH AVENUE Style Women Edp 125ML reviews  ratings  features  specifications and browse more Beauty products online at best prices on Amazon.in.,None,<div class="bucket" id="productDescription"> <h2>Product Description</h2> <div class="content"> <h3 class="productDescriptionSource"></h3> <div class="productDescriptionWrapper">        Design House: Elizabeth Arden  Year Introduced: 2009  Recommended Use: Casual  Recommended Use: Casual              <div class="emptyClear"> </div> </div> </div> </div>,None,18:03:2014,None
B005A3HCL2,Calvin Klein One Shock for Her  100ml,http://www.amazon.in/Fragrances/b/ref=sd_allcat_beauty_fragrance/276-6718833-1247838?ie=UTF8&node=1374298031,None,Fragranc,Elizabeth Arden,Calvin Klein,http://ecx.images-amazon.com/images/I/31JrnC0qt%2BL._AA160_.jpg,None,self Colour,Beauty & Health,http://www.amazon.in/Calvin-Klein-One-Shock-100ml/dp/B005A3HCL2/ref=sr_1_147/275-9715206-1097860?s=beauty&ie=UTF8&qid=1395126983&sr=1-147,[<a href="/gp/help/seller/at-a-glance.html/275-9715206-1097860?ie=UTF8&amp;seller=A3ES9F57NVVRIK">MyLuckyScent</a>],Amazon.in: Buy Calvin Klein One Shock for Her  100ml Online at Best Price in India | Amazon Beauty Store,Buy Calvin Klein One Shock for Her  100ml at lowest price in India on Amazon.in. Check out Calvin Klein One Shock for Her  100ml reviews  ratings  features  specifications and browse more Beauty products online at best prices on Amazon.in.,None,<div class="bucket" id="productDescription"> <h2>Product Description</h2> <div class="content"> <h3 class="productDescriptionSource"></h3> <div class="productDescriptionWrapper">        Calvin Klein One Shock for Her by Calvin Klein Eau de Toilette Spray 3.4 OZ. Shock your senses. Experience a more energetic type of scent with CK One Shock for Her 3.4 OZ. CK Shock blends passionflower pink peony poppy flower. CK One Shock for Her accomplishes what it sets out to do: it s a flanker for a popular youth-oriented fragrance.Features1) CK One Shock by Calvin Klein for Women 3.4 oz EDT Spray: Buy Calvin Klein Women s Perfumes - CK One Shock by Calvin Klein for Her 3.4 oz Eau de Toilette Spray2) Type: Eau De Toilette              <div class="emptyClear"> </div> </div> </div> </div>,None,18:03:2014,None
B000MBXEQE,Ck One By Calvin Klein Eau De Toilette Spray (Unisex) 6.6 Oz,http://www.amazon.in/Fragrances/b/ref=sd_allcat_beauty_fragrance/276-6718833-1247838?ie=UTF8&node=1374298031,Rs. 3 949.00,Fragranc,Elizabeth Arden,Calvin Klein,http://ecx.images-amazon.com/images/I/31JrnC0qt%2BL._AA160_.jpg,Rs. 3 949.00,self Colour,Beauty & Health,http://www.amazon.in/Calvin-Klein-Toilette-Spray-Unisex/dp/B000MBXEQE/ref=sr_1_161/275-9715206-1097860?s=beauty&ie=UTF8&qid=1395126983&sr=1-161,[<a class="buyAction" href="/gp/offer-listing/B000MBXEQE/ref=dp_olp_0/275-9715206-1097860?ie=UTF8&amp;condition=all">these sellers</a>],Amazon.in: Buy Ck One By Calvin Klein Eau De Toilette Spray (Unisex) 6.6 Oz Online at Best Price in India | Amazon Beauty Store,Buy Ck One By Calvin Klein Eau De Toilette Spray (Unisex) 6.6 Oz at lowest price in India on Amazon.in. Check out Ck One By Calvin Klein Eau De Toilette Spray (Unisex) 6.6 Oz reviews  ratings  features  specifications and browse more Beauty products online at best prices on Amazon.in.,None,None,None,18:03:2014,None
B001DDX0QY,Elizabeth Arden Beauty for Women  100ml,http://www.amazon.in/Fragrances/b/ref=sd_allcat_beauty_fragrance/276-6718833-1247838?ie=UTF8&node=1374298031,None,Fragranc,Elizabeth Arden,Calvin Klein,http://ecx.images-amazon.com/images/I/31JrnC0qt%2BL._AA160_.jpg,None,self Colour,Beauty & Health,http://www.amazon.in/Elizabeth-Arden-Beauty-Women-100ml/dp/B001DDX0QY/ref=sr_1_180/275-9715206-1097860?s=beauty&ie=UTF8&qid=1395126996&sr=1-180,[<a href="/gp/help/seller/at-a-glance.html/275-9715206-1097860?ie=UTF8&amp;seller=A2NFQIUV2YGOLG">Fragume</a>],Amazon.in: Buy Elizabeth Arden Beauty for Women  100ml Online at Best Price in India | Amazon Beauty Store,Buy Elizabeth Arden Beauty for Women  100ml at lowest price in India on Amazon.in. Check out Elizabeth Arden Beauty for Women  100ml reviews  ratings  features  specifications and browse more Beauty products online at best prices on Amazon.in.,None,<div class="bucket" id="productDescription"> <h2>Product Description</h2> <div class="content"> <h3 class="productDescriptionSource"></h3> <div class="productDescriptionWrapper">        Beauty by Elizabeth Arden is a floral green fragrance for women. Arden Beauty was launched in 2002. The nose behind this fragrance is Antoine Lie. Top notes are iris  bergamot and rice flower; middle notes are orchid  ginger  rhubarb and lotus; base notes are sandalwood  amber and musk.              <div class="emptyClear"> </div> </div> </div> </div>,None,18:03:2014,None
B001TM6IVI,Elizabeth Arden Elizabeth Arden Green Tea Scent Spray 1.7 Oz - 1.7 oz,http://www.amazon.in/Fragrances/b/ref=sd_allcat_beauty_fragrance/276-6718833-1247838?ie=UTF8&node=1374298031,Rs. 1 750.00,Fragranc,Elizabeth Arden,Calvin Klein,http://ecx.images-amazon.com/images/I/31JrnC0qt%2BL._AA160_.jpg,Rs. 1 750.00,self Colour,Beauty & Health,http://www.amazon.in/Elizabeth-Arden-Green-Scent-Spray/dp/B001TM6IVI/ref=sr_1_183/275-9715206-1097860?s=beauty&ie=UTF8&qid=1395126996&sr=1-183,[<a class="buyAction" href="/gp/offer-listing/B001TM6IVI/ref=dp_olp_0/275-9715206-1097860?ie=UTF8&amp;condition=all">these sellers</a>],Amazon.in: Buy Elizabeth Arden Elizabeth Arden Green Tea Scent Spray 1.7 Oz - 1.7 oz Online at Best Price in India | Amazon Beauty Store,Buy Elizabeth Arden Elizabeth Arden Green Tea Scent Spray 1.7 Oz - 1.7 oz at lowest price in India on Amazon.in. Check out Elizabeth Arden Elizabeth Arden Green Tea Scent Spray 1.7 Oz - 1.7 oz reviews  ratings  features  specifications and browse more Beauty products online at best prices on Amazon.in.,None,None,None,18:03:2014,None
B001QTW44E,Elizabeth Arden Fifth Avenue After Five,http://www.amazon.in/Fragrances/b/ref=sd_allcat_beauty_fragrance/276-6718833-1247838?ie=UTF8&node=1374298031,Rs. 2 690.00,Fragranc,Elizabeth Arden,Calvin Klein,http://ecx.images-amazon.com/images/I/31JrnC0qt%2BL._AA160_.jpg,Rs. 2 690.00,self Colour,Beauty & Health,http://www.amazon.in/Elizabeth-Arden-Fifth-Avenue-After/dp/B001QTW44E/ref=sr_1_184/275-9715206-1097860?s=beauty&ie=UTF8&qid=1395126996&sr=1-184,[<a class="buyAction" href="/gp/offer-listing/B001QTW44E/ref=dp_olp_0/275-9715206-1097860?ie=UTF8&amp;condition=all">these sellers</a>],Amazon.in: Buy Elizabeth Arden Fifth Avenue After Five Online at Best Price in India | Amazon Beauty Store,Buy Elizabeth Arden Fifth Avenue After Five at lowest price in India on Amazon.in. Check out Elizabeth Arden Fifth Avenue After Five reviews  ratings  features  specifications and browse more Beauty products online at best prices on Amazon.in.,None,<div class="bucket" id="productDescription"> <h2>Product Description</h2> <div class="content"> <h3 class="productDescriptionSource"></h3> <div class="productDescriptionWrapper">        5th Avenue after five is a sheer oriental perfume. Incredibly sensual and totally unexpected it has top notes of luscious and silky nectar of ripe black plum with hints of bergamot and coriander wrapped in golden honeysuckle.              <div class="emptyClear"> </div> </div> </div> </div>,None,18:03:2014,None
B001QTW45S,Elizabeth Arden Green Tea Eau De Parfum Spray Tester for Women  100ml,http://www.amazon.in/Fragrances/b/ref=sd_allcat_beauty_fragrance/276-6718833-1247838?ie=UTF8&node=1374298031,Rs. 1 649.00,Fragranc,Elizabeth Arden,Calvin Klein,http://ecx.images-amazon.com/images/I/31JrnC0qt%2BL._AA160_.jpg,Rs. 1 649.00,self Colour,Beauty & Health,http://www.amazon.in/Elizabeth-Arden-Green-Parfum-Tester/dp/B001QTW45S/ref=sr_1_186/275-9715206-1097860?s=beauty&ie=UTF8&qid=1395126996&sr=1-186,[<a class="buyAction" href="/gp/offer-listing/B001QTW45S/ref=dp_olp_0/275-9715206-1097860?ie=UTF8&amp;condition=all">these sellers</a>],Amazon.in: Buy Elizabeth Arden Green Tea Eau De Parfum Spray Tester for Women  100ml Online at Best Price in India | Amazon Beauty Store,Buy Elizabeth Arden Green Tea Eau De Parfum Spray Tester for Women  100ml at lowest price in India on Amazon.in. Check out Elizabeth Arden Green Tea Eau De Parfum Spray Tester for Women  100ml reviews  ratings  features  specifications and browse more Beauty products online at best prices on Amazon.in.,None,<div class="bucket" id="productDescription"> <h2>Product Description</h2> <div class="content"> <h3 class="productDescriptionSource"></h3> <div class="productDescriptionWrapper">        Launched by the design house of Elizabeth Arden in 1999  Green Tea by Elizabeth Arden possesses a blend of citrus lemon  rhubarb  peppermint  oakmoss  musk and amber. It is recommended for daytime wear. What is a Tester? A Tester is a perfume with no fancy packaging but with the same exact fragrance at an even better price. They are just like the one used to test the perfume in a department store but supplied in a plain box and often have the word tester printed on the bottle. Sometimes they do not come with a cap or box. These items are great for personal use but may not be great as gifts. Our testers are new unopened and have never been sprayed (Testers and unboxed product are exactly the same as the regular perfume  except testers usually come in a plain box--with or without a cap. Unboxed products are the perfume or bath product  only without the box.)              <div class="emptyClear"> </div> </div> </div> </div>,None,18:03:2014,None
B000GHYVB6,ELIZABETH ARDEN GREEN TEA INTENSE FOR WOMEN 75ML,http://www.amazon.in/Fragrances/b/ref=sd_allcat_beauty_fragrance/276-6718833-1247838?ie=UTF8&node=1374298031,None,Fragranc,Elizabeth Arden,Calvin Klein,http://ecx.images-amazon.com/images/I/31JrnC0qt%2BL._AA160_.jpg,None,self Colour,Beauty & Health,http://www.amazon.in/ELIZABETH-ARDEN-GREEN-INTENSE-WOMEN/dp/B000GHYVB6/ref=sr_1_189/275-9715206-1097860?s=beauty&ie=UTF8&qid=1395126996&sr=1-189,[<a href="/gp/help/seller/at-a-glance.html/275-9715206-1097860?ie=UTF8&amp;seller=A2NFQIUV2YGOLG">Fragume</a>],Amazon.in: Buy ELIZABETH ARDEN GREEN TEA INTENSE FOR WOMEN 75ML Online at Best Price in India | Amazon Beauty Store,Buy ELIZABETH ARDEN GREEN TEA INTENSE FOR WOMEN 75ML at lowest price in India on Amazon.in. Check out ELIZABETH ARDEN GREEN TEA INTENSE FOR WOMEN 75ML reviews  ratings  features  specifications and browse more Beauty products online at best prices on Amazon.in.,None,<div class="bucket" id="productDescription"> <h2>Product Description</h2> <div class="content"> <h3 class="productDescriptionSource"></h3> <div class="productDescriptionWrapper">        "Launched by the design house of Elizabeth Arden.When nbsp applying nbsp any fragrance please consider that there are several factors which can affect the natural smell of your skin and in turn the way a scent smells on you. nbsp For instance your mood stress level age body chemistry nbsp diet and current medications may all alter the scents you wear. nbsp nbsp Similarly factor such as dry or oily nbsp skin can even affect the amount of time a fragrance will last after being applied"              <div class="emptyClear"> </div> </div> </div> </div>,None,18:03:2014,None
B003HFFRFI,Elizabeth Arden Green Tea Lavender Eau De Toilette Spray for Women  100ml,http://www.amazon.in/Fragrances/b/ref=sd_allcat_beauty_fragrance/276-6718833-1247838?ie=UTF8&node=1374298031,None,Fragranc,Elizabeth Arden,Calvin Klein,http://ecx.images-amazon.com/images/I/31JrnC0qt%2BL._AA160_.jpg,None,self Colour,Beauty & Health,http://www.amazon.in/Elizabeth-Arden-Green-Lavender-Toilette/dp/B003HFFRFI/ref=sr_1_190/275-9715206-1097860?s=beauty&ie=UTF8&qid=1395126996&sr=1-190,[<a href="/gp/help/seller/at-a-glance.html/275-9715206-1097860?ie=UTF8&amp;seller=A22G8HZGXYSWPZ">Taha &amp; Bros.</a>],Amazon.in: Buy Elizabeth Arden Green Tea Lavender Eau De Toilette Spray for Women  100ml Online at Best Price in India | Amazon Beauty Store,Buy Elizabeth Arden Green Tea Lavender Eau De Toilette Spray for Women  100ml at lowest price in India on Amazon.in. Check out Elizabeth Arden Green Tea Lavender Eau De Toilette Spray for Women  100ml reviews  ratings  features  specifications and browse more Beauty products online at best prices on Amazon.in.,None,<div class="bucket" id="productDescription"> <h2>Product Description</h2> <div class="content"> <h3 class="productDescriptionSource"></h3> <div class="productDescriptionWrapper">        Fresh  relaxing  carefree  close your eyes and let yourself be transported to a place of peace and endless optimism. Purple waves of blossoms captivate the eye  while the scent of natural lavender awakens your spirit. Launched by a the design house of Elizabeth Arden in 2010.              <div class="emptyClear"> </div> </div> </div> </div>,None,18:03:2014,None
B0028VM7CI,ELIZABETH ARDEN GREEN TEA LOTUS FOR WOMEN 100ML,http://www.amazon.in/Fragrances/b/ref=sd_allcat_beauty_fragrance/276-6718833-1247838?ie=UTF8&node=1374298031,None,Fragranc,Elizabeth Arden,Calvin Klein,http://ecx.images-amazon.com/images/I/31JrnC0qt%2BL._AA160_.jpg,None,self Colour,Beauty & Health,http://www.amazon.in/ELIZABETH-ARDEN-GREEN-LOTUS-WOMEN/dp/B0028VM7CI/ref=sr_1_192/275-9715206-1097860?s=beauty&ie=UTF8&qid=1395126996&sr=1-192,[<a href="/gp/help/seller/at-a-glance.html/275-9715206-1097860?ie=UTF8&amp;seller=A22G8HZGXYSWPZ">Taha &amp; Bros.</a>],Amazon.in: Buy ELIZABETH ARDEN GREEN TEA LOTUS FOR WOMEN 100ML Online at Best Price in India | Amazon Beauty Store,Buy ELIZABETH ARDEN GREEN TEA LOTUS FOR WOMEN 100ML at lowest price in India on Amazon.in. Check out ELIZABETH ARDEN GREEN TEA LOTUS FOR WOMEN 100ML reviews  ratings  features  specifications and browse more Beauty products online at best prices on Amazon.in.,None,<div class="bucket" id="productDescription"> <h2>Product Description</h2> <div class="content"> <h3 class="productDescriptionSource"></h3> <div class="productDescriptionWrapper">        Green Tea Lotus Elizabeth Arden for women. Green Tea Lotus was launched in 2008 as limited edition. It captures you with aroma of Asian lily  along with cherry blossom  yuzu and accords of plum. Characterized as tender  light and exotic  it greets you with plum (that symbolizes China  elegance and pureness)  cherry blossom (that reminds of transience of life and is a symbol of female beauty) and yuzu  Japanese citrus that smells similar to sweet pommel. The heart is composed of Asian lily  gracious lotus (a symbol of freedom and spiritual re-birth)  green tea and osmanthus              <div class="emptyClear"> </div> </div> </div> </div>,None,18:03:2014,None
