B0009STDCO,Calvin Klein Obsession for Men EDT  124ml,http://www.amazon.in/Fragrances/b/ref=sd_allcat_beauty_fragrance/276-6718833-1247838?ie=UTF8&node=1374298031,None,Fragranc,Elizabeth Arden,Calvin Klein,http://ecx.images-amazon.com/images/I/31JrnC0qt%2BL._AA160_.jpg,None,self Colour,Beauty & Health,http://www.amazon.in/Calvin-Klein-Obsession-Men-124ml/dp/B0009STDCO/ref=sr_1_1/275-9715206-1097860?s=beauty&ie=UTF8&qid=1395126933&sr=1-1,[<a href="/gp/help/seller/at-a-glance.html/275-9715206-1097860?ie=UTF8&amp;seller=A2NFQIUV2YGOLG">Fragume</a>],Amazon.in: Buy Calvin Klein Obsession for Men EDT  124ml Online at Best Price in India | Amazon Beauty Store,Buy Calvin Klein Obsession for Men EDT  124ml at lowest price in India on Amazon.in. Check out Calvin Klein Obsession for Men EDT  124ml reviews  ratings  features  specifications and browse more Beauty products online at best prices on Amazon.in.,None,<div class="bucket" id="productDescription"> <h2>Product Description</h2> <div class="content"> <h3 class="productDescriptionSource"></h3> <div class="productDescriptionWrapper">        Obsession by Calvin Klein designer fragrance for Men Eau De Toilette Spray 4.0 oz. A fascinating and classic scent Obsession for Him by top designer Calvin Klein. With scents of warm vanilla bergamot basil green mandarin jasmine orange blossom coriander vetiver incense amber and earthy sandalwood. Totally Appealing. Perfect for any season! Gift it now!              <div class="emptyClear"> </div> </div> </div> </div>,None,18:03:2014,None
B001DBRZL2,Calvin Klein in 2u Eau De Toilette Spray  100.55ml,http://www.amazon.in/Fragrances/b/ref=sd_allcat_beauty_fragrance/276-6718833-1247838?ie=UTF8&node=1374298031,None,Fragranc,Elizabeth Arden,Calvin Klein,http://ecx.images-amazon.com/images/I/31JrnC0qt%2BL._AA160_.jpg,None,self Colour,Beauty & Health,http://www.amazon.in/Calvin-Klein-Toilette-Spray-100-55ml/dp/B001DBRZL2/ref=sr_1_5/275-9715206-1097860?s=beauty&ie=UTF8&qid=1395126933&sr=1-5,[<a href="/gp/help/seller/at-a-glance.html/275-9715206-1097860?ie=UTF8&amp;seller=A2NFQIUV2YGOLG">Fragume</a>],Amazon.in: Buy Calvin Klein in 2u Eau De Toilette Spray  100.55ml Online at Best Price in India | Amazon Beauty Store,Buy Calvin Klein in 2u Eau De Toilette Spray  100.55ml at lowest price in India on Amazon.in. Check out Calvin Klein in 2u Eau De Toilette Spray  100.55ml reviews  ratings  features  specifications and browse more Beauty products online at best prices on Amazon.in.,None,<div class="bucket" id="productDescription"> <h2>Product Description</h2> <div class="content"> <h3 class="productDescriptionSource"></h3> <div class="productDescriptionWrapper">        Design House: Calvin Klein  Year Introduced: 2007  Recommended Use: Casual  Recommended Use: Casual              <div class="emptyClear"> </div> </div> </div> </div>,None,18:03:2014,None
B00883WGVC,Calvin Klein Encounter for Men  100ml,http://www.amazon.in/Fragrances/b/ref=sd_allcat_beauty_fragrance/276-6718833-1247838?ie=UTF8&node=1374298031,None,Fragranc,Elizabeth Arden,Calvin Klein,http://ecx.images-amazon.com/images/I/31JrnC0qt%2BL._AA160_.jpg,None,self Colour,Beauty & Health,http://www.amazon.in/Calvin-Klein-Encounter-Men-100ml/dp/B00883WGVC/ref=sr_1_9/275-9715206-1097860?s=beauty&ie=UTF8&qid=1395126933&sr=1-9,[<a href="/gp/help/seller/at-a-glance.html/275-9715206-1097860?ie=UTF8&amp;seller=A3ES9F57NVVRIK">MyLuckyScent</a>],Amazon.in: Buy Calvin Klein Encounter for Men  100ml Online at Best Price in India | Amazon Beauty Store,Buy Calvin Klein Encounter for Men  100ml at lowest price in India on Amazon.in. Check out Calvin Klein Encounter for Men  100ml reviews  ratings  features  specifications and browse more Beauty products online at best prices on Amazon.in.,None,<div class="bucket" id="productDescription"> <h2>Product Description</h2> <div class="content"> <h3 class="productDescriptionSource"></h3> <div class="productDescriptionWrapper">        Design House: Calvin Klein  Year Introduced: 2012  Recommended Use: Evening  Recommended Use: Evening              <div class="emptyClear"> </div> </div> </div> </div>,None,18:03:2014,None
B000VOLKEA,Calvin Klein In 2U Men Perfume  100ml,http://www.amazon.in/Fragrances/b/ref=sd_allcat_beauty_fragrance/276-6718833-1247838?ie=UTF8&node=1374298031,None,Fragranc,Elizabeth Arden,Calvin Klein,http://ecx.images-amazon.com/images/I/31JrnC0qt%2BL._AA160_.jpg,None,self Colour,Beauty & Health,http://www.amazon.in/Calvin-Klein-Men-Perfume-100ml/dp/B000VOLKEA/ref=sr_1_8/275-9715206-1097860?s=beauty&ie=UTF8&qid=1395126933&sr=1-8,[<a href="/gp/help/seller/at-a-glance.html/275-9715206-1097860?ie=UTF8&amp;seller=A3ES9F57NVVRIK">MyLuckyScent</a>],Amazon.in: Buy Calvin Klein In 2U Men Perfume  100ml Online at Best Price in India | Amazon Beauty Store,Buy Calvin Klein In 2U Men Perfume  100ml at lowest price in India on Amazon.in. Check out Calvin Klein In 2U Men Perfume  100ml reviews  ratings  features  specifications and browse more Beauty products online at best prices on Amazon.in.,None,<div class="bucket" id="productDescription"> <h2>Product Description</h2> <div class="content"> <h3 class="productDescriptionSource"></h3> <div class="productDescriptionWrapper">        Launched by the design house of Calvin Klein.When nbsp applying nbsp any fragrance please consider that there are several factors which can affect the natural smell of your skin and in turn the way a scent smells on you. nbsp For instance your mood stress level age body chemistry nbsp diet and current medications may all alter the scents you wear. nbsp nbsp Similarly factor such as dry or oily nbsp skin can even affect the amount of time a fragrance will last after being applied              <div class="emptyClear"> </div> </div> </div> </div>,None,18:03:2014,None
9790798695,Elizabeth Arden 5Th Avenue for Women  125ml,http://www.amazon.in/Fragrances/b/ref=sd_allcat_beauty_fragrance/276-6718833-1247838?ie=UTF8&node=1374298031,None,Fragranc,Elizabeth Arden,Calvin Klein,http://ecx.images-amazon.com/images/I/31JrnC0qt%2BL._AA160_.jpg,None,self Colour,Beauty & Health,http://www.amazon.in/Elizabeth-Arden-Avenue-Women-125ml/dp/9790798695/ref=sr_1_10/275-9715206-1097860?s=beauty&ie=UTF8&qid=1395126933&sr=1-10,[<a href="/gp/help/seller/at-a-glance.html/275-9715206-1097860?ie=UTF8&amp;seller=A2IT7998C8946H">Perfume Nation</a>],Amazon.in: Buy Elizabeth Arden 5Th Avenue for Women  125ml Online at Best Price in India | Amazon Beauty Store,Buy Elizabeth Arden 5Th Avenue for Women  125ml at lowest price in India on Amazon.in. Check out Elizabeth Arden 5Th Avenue for Women  125ml reviews  ratings  features  specifications and browse more Beauty products online at best prices on Amazon.in.,None,<div class="bucket" id="productDescription"> <h2>Product Description</h2> <div class="content"> <h3 class="productDescriptionSource"></h3> <div class="productDescriptionWrapper">        5TH AVENUE by Elizabeth Arden Eau De Parfum Spray 4.2 oz for WomenFeatures1) 5TH AVENUE by Elizabeth Arden Eau De Parfum Spray 4.2 oz for Women2) 5TH AVENUE by Elizabeth Arden for Women3) Eau De Parfum Spray 4.2 oz4) Packaging for this product may vary from that shown in the image above5) 100% Authentic Brand Name Merchandise!              <div class="emptyClear"> </div> </div> </div> </div>,None,18:03:2014,None
B0009OAI40,Elizabeth Arden Green Tea Scent Spray  100ml,http://www.amazon.in/Fragrances/b/ref=sd_allcat_beauty_fragrance/276-6718833-1247838?ie=UTF8&node=1374298031,None,Fragranc,Elizabeth Arden,Calvin Klein,http://ecx.images-amazon.com/images/I/31JrnC0qt%2BL._AA160_.jpg,None,self Colour,Beauty & Health,http://www.amazon.in/Elizabeth-Arden-Green-Scent-Spray/dp/B0009OAI40/ref=sr_1_4/275-9715206-1097860?s=beauty&ie=UTF8&qid=1395126933&sr=1-4,[<a href="/gp/help/seller/at-a-glance.html/275-9715206-1097860?ie=UTF8&amp;seller=A3ES9F57NVVRIK">MyLuckyScent</a>],Amazon.in: Buy Elizabeth Arden Green Tea Scent Spray  100ml Online at Best Price in India | Amazon Beauty Store,Buy Elizabeth Arden Green Tea Scent Spray  100ml at lowest price in India on Amazon.in. Check out Elizabeth Arden Green Tea Scent Spray  100ml reviews  ratings  features  specifications and browse more Beauty products online at best prices on Amazon.in.,None,<div class="bucket" id="productDescription"> <h2>Product Description</h2> <div class="content"> <h3 class="productDescriptionSource"></h3> <div class="productDescriptionWrapper">        Fragrance notes: Citrus lemon rhubarb peppermint oakmoss musk and amber. When applying any fragrance please consider that there are several factors which can affect the natural smell of your skin and in turn the way a scent smells on you. For instance your mood stress level age body chemistry  diet and current medications may all alter the scents you wear. Similarly factor such as dry or oily skin can even affect the amount of time a fragrance will last after being applied.              <div class="emptyClear"> </div> </div> </div> </div>,None,18:03:2014,None
B003JVVJZM,Eternity Aqua Men 100 ml,http://www.amazon.in/Fragrances/b/ref=sd_allcat_beauty_fragrance/276-6718833-1247838?ie=UTF8&node=1374298031,None,Fragranc,Elizabeth Arden,Calvin Klein,http://ecx.images-amazon.com/images/I/31JrnC0qt%2BL._AA160_.jpg,None,self Colour,Beauty & Health,http://www.amazon.in/Eternity-Aqua-Men-100-ml/dp/B003JVVJZM/ref=sr_1_3/275-9715206-1097860?s=beauty&ie=UTF8&qid=1395126933&sr=1-3,[<a href="/gp/help/seller/at-a-glance.html/275-9715206-1097860?ie=UTF8&amp;seller=A22G8HZGXYSWPZ">Taha &amp; Bros.</a>],Amazon.in: Buy Eternity Aqua Men 100 ml Online at Best Price in India | Amazon Beauty Store,Buy Eternity Aqua Men 100 ml at lowest price in India on Amazon.in. Check out Eternity Aqua Men 100 ml reviews  ratings  features  specifications and browse more Beauty products online at best prices on Amazon.in.,None,<div class="bucket" id="productDescription"> <h2>Product Description</h2> <div class="content"> <h3 class="productDescriptionSource"></h3> <div class="productDescriptionWrapper">        Design House: Calvin Klein  Year Introduced: 2010  Recommended Use: Daytime  Recommended Use: Daytime              <div class="emptyClear"> </div> </div> </div> </div>,None,18:03:2014,None
B001PTFXAM,Calvin Klein Secret Obsession Eau De Parfum Spray  100.55ml,http://www.amazon.in/Fragrances/b/ref=sd_allcat_beauty_fragrance/276-6718833-1247838?ie=UTF8&node=1374298031,None,Fragranc,Elizabeth Arden,Calvin Klein,http://ecx.images-amazon.com/images/I/31JrnC0qt%2BL._AA160_.jpg,None,self Colour,Beauty & Health,http://www.amazon.in/Calvin-Klein-Secret-Obsession-100-55ml/dp/B001PTFXAM/ref=sr_1_6/275-9715206-1097860?s=beauty&ie=UTF8&qid=1395126933&sr=1-6,[<a href="/gp/help/seller/at-a-glance.html/275-9715206-1097860?ie=UTF8&amp;seller=A29ZFTNVZHDXBZ">Route2Fashion</a>],Amazon.in: Buy Calvin Klein Secret Obsession Eau De Parfum Spray  100.55ml Online at Best Price in India | Amazon Beauty Store,Buy Calvin Klein Secret Obsession Eau De Parfum Spray  100.55ml at lowest price in India on Amazon.in. Check out Calvin Klein Secret Obsession Eau De Parfum Spray  100.55ml reviews  ratings  features  specifications and browse more Beauty products online at best prices on Amazon.in.,None,<div class="bucket" id="productDescription"> <h2>Product Description</h2> <div class="content"> <h3 class="productDescriptionSource"></h3> <div class="productDescriptionWrapper">        Design House: Calvin Klein  Year Introduced: 2008  Recommended Use: Casual  Recommended Use: Casual              <div class="emptyClear"> </div> </div> </div> </div>,None,18:03:2014,None
B000E7WFX4,Calvin Klein One Unisex EDT  200ml,http://www.amazon.in/Fragrances/b/ref=sd_allcat_beauty_fragrance/276-6718833-1247838?ie=UTF8&node=1374298031,None,Fragranc,Elizabeth Arden,Calvin Klein,http://ecx.images-amazon.com/images/I/31JrnC0qt%2BL._AA160_.jpg,None,self Colour,Beauty & Health,http://www.amazon.in/Calvin-Klein-One-Unisex-200ml/dp/B000E7WFX4/ref=sr_1_16/275-9715206-1097860?s=beauty&ie=UTF8&qid=1395126933&sr=1-16,[<a href="/gp/help/seller/at-a-glance.html/275-9715206-1097860?ie=UTF8&amp;seller=A2IT7998C8946H">Perfume Nation</a>],Amazon.in: Buy Calvin Klein One Unisex EDT  200ml Online at Best Price in India | Amazon Beauty Store,Buy Calvin Klein One Unisex EDT  200ml at lowest price in India on Amazon.in. Check out Calvin Klein One Unisex EDT  200ml reviews  ratings  features  specifications and browse more Beauty products online at best prices on Amazon.in.,None,<div class="bucket" id="productDescription"> <h2>Product Description</h2> <div class="content"> <h3 class="productDescriptionSource"></h3> <div class="productDescriptionWrapper">        Calvin Klein One for unisex was launched in 1994. Its fragrant nature explores two bodies minds and souls in the passion of One. This clean refreshing fragrance has sweet notes of pineapple and citrus with jasmine and rose mixed with green tea. Calvin Klein One is recommended for daytime wear. When applying any fragrance please consider that there are several factors which can affect the natural smell of your skin and in turn the way a scent smells on you. For instance your mood stress level age body chemistry diet and current medications may all alter the scents you wear. Similarly factor such as dry or oily skin can even affect the amount of time a fragrance will last after being applied.              <div class="emptyClear"> </div> </div> </div> </div>,None,18:03:2014,None
B000C1VTJI,Calvin Klein Contradiction for Women EDP 3.4 Ounce,http://www.amazon.in/Fragrances/b/ref=sd_allcat_beauty_fragrance/276-6718833-1247838?ie=UTF8&node=1374298031,None,Fragranc,Elizabeth Arden,Calvin Klein,http://ecx.images-amazon.com/images/I/31JrnC0qt%2BL._AA160_.jpg,None,self Colour,Beauty & Health,http://www.amazon.in/Calvin-Klein-Contradiction-Women-Ounce/dp/B000C1VTJI/ref=sr_1_13/275-9715206-1097860?s=beauty&ie=UTF8&qid=1395126933&sr=1-13,[<a href="/gp/help/seller/at-a-glance.html/275-9715206-1097860?ie=UTF8&amp;seller=A2NFQIUV2YGOLG">Fragume</a>],Amazon.in: Buy Calvin Klein Contradiction for Women EDP 3.4 Ounce Online at Best Price in India | Amazon Beauty Store,Buy Calvin Klein Contradiction for Women EDP 3.4 Ounce at lowest price in India on Amazon.in. Check out Calvin Klein Contradiction for Women EDP 3.4 Ounce reviews  ratings  features  specifications and browse more Beauty products online at best prices on Amazon.in.,None,<div class="bucket" id="productDescription"> <h2>Product Description</h2> <div class="content"> <h3 class="productDescriptionSource"></h3> <div class="productDescriptionWrapper">        Calvin Klein Contradiction for Women 100ml EDP              <div class="emptyClear"> </div> </div> </div> </div>,None,18:03:2014,None
B00021AJ5I,Calvin Klein Eternity EDP for Women  100ml,http://www.amazon.in/Fragrances/b/ref=sd_allcat_beauty_fragrance/276-6718833-1247838?ie=UTF8&node=1374298031,None,Fragranc,Elizabeth Arden,Calvin Klein,http://ecx.images-amazon.com/images/I/31JrnC0qt%2BL._AA160_.jpg,None,self Colour,Beauty & Health,http://www.amazon.in/Calvin-Klein-Eternity-Women-100ml/dp/B00021AJ5I/ref=sr_1_15/275-9715206-1097860?s=beauty&ie=UTF8&qid=1395126933&sr=1-15,[<a href="/gp/help/seller/at-a-glance.html/275-9715206-1097860?ie=UTF8&amp;seller=A2NFQIUV2YGOLG">Fragume</a>],Amazon.in: Buy Calvin Klein Eternity EDP for Women  100ml Online at Best Price in India | Amazon Beauty Store,Buy Calvin Klein Eternity EDP for Women  100ml at lowest price in India on Amazon.in. Check out Calvin Klein Eternity EDP for Women  100ml reviews  ratings  features  specifications and browse more Beauty products online at best prices on Amazon.in.,None,<div class="bucket" id="productDescription"> <h2>Product Description</h2> <div class="content"> <h3 class="productDescriptionSource"></h3> <div class="productDescriptionWrapper">        Eternity Moment is a feminine floral fragranced enhanced by the addition of ripe freshly squeezed fruits and sensual musk. This lovely fragrance by Calvin Klein captivates your audience with a luscious blend of dew kissed  fresh florals and fruits. Eternity Moment contains pomegranate  chinese pink peony blossom  tasberry cashmere  warm rose wood and musk  lychee  guava  romantic passionflower and nymphea.              <div class="emptyClear"> </div> </div> </div> </div>,None,18:03:2014,None
B000C1VTIY,Calvin Klein Be Unisex EDT  200ml,http://www.amazon.in/Fragrances/b/ref=sd_allcat_beauty_fragrance/276-6718833-1247838?ie=UTF8&node=1374298031,None,Fragranc,Elizabeth Arden,Calvin Klein,http://ecx.images-amazon.com/images/I/31JrnC0qt%2BL._AA160_.jpg,None,self Colour,Beauty & Health,http://www.amazon.in/Calvin-Klein-Unisex-EDT-200ml/dp/B000C1VTIY/ref=sr_1_12/275-9715206-1097860?s=beauty&ie=UTF8&qid=1395126933&sr=1-12,[<a href="/gp/help/seller/at-a-glance.html/275-9715206-1097860?ie=UTF8&amp;seller=A2NFQIUV2YGOLG">Fragume</a>],Amazon.in: Buy Calvin Klein Be Unisex EDT  200ml Online at Best Price in India | Amazon Beauty Store,Buy Calvin Klein Be Unisex EDT  200ml at lowest price in India on Amazon.in. Check out Calvin Klein Be Unisex EDT  200ml reviews  ratings  features  specifications and browse more Beauty products online at best prices on Amazon.in.,None,<div class="bucket" id="productDescription"> <h2>Product Description</h2> <div class="content"> <h3 class="productDescriptionSource"></h3> <div class="productDescriptionWrapper">        Features notes of musk  mandarin  magnolia  peach and sandalwood. When applying any fragrance please consider that there are several factors which can affect the natural smell of your skin and  in turn  the way a scent smells on you. For instance  your mood  stress level  age  body chemistry  diet  and current medications may all alter the scents you wear. Similarly  factor such as dry or oily skin can even affect the amount of time a fragrance will last after being applied.              <div class="emptyClear"> </div> </div> </div> </div>,None,18:03:2014,None
B000XE7Q64,Elizabeth Arden Sunflowers EDT for Women  100ml,http://www.amazon.in/Fragrances/b/ref=sd_allcat_beauty_fragrance/276-6718833-1247838?ie=UTF8&node=1374298031,None,Fragranc,Elizabeth Arden,Calvin Klein,http://ecx.images-amazon.com/images/I/31JrnC0qt%2BL._AA160_.jpg,None,self Colour,Beauty & Health,http://www.amazon.in/Elizabeth-Arden-Sunflowers-Women-100ml/dp/B000XE7Q64/ref=sr_1_20/275-9715206-1097860?s=beauty&ie=UTF8&qid=1395126933&sr=1-20,[<a href="/gp/help/seller/at-a-glance.html/275-9715206-1097860?ie=UTF8&amp;seller=A2NFQIUV2YGOLG">Fragume</a>],Amazon.in: Buy Elizabeth Arden Sunflowers EDT for Women  100ml Online at Best Price in India | Amazon Beauty Store,Buy Elizabeth Arden Sunflowers EDT for Women  100ml at lowest price in India on Amazon.in. Check out Elizabeth Arden Sunflowers EDT for Women  100ml reviews  ratings  features  specifications and browse more Beauty products online at best prices on Amazon.in.,None,<div class="bucket" id="productDescription"> <h2>Product Description</h2> <div class="content"> <h3 class="productDescriptionSource"></h3> <div class="productDescriptionWrapper">        Sunflowers Elizabeth Arden for women. Floral fruity fragrance launched in 1993. It was designed by David Apel. The top notes are composed of luminous lemon notes  rosewood  orange blossom  sweet juicy mandarin  bergamot  melon and sweet peach. The heart brings notes of cyclamen  rose  pure jasmine  osmanthus and iris root. The sensual base is composed of musk  cedar  amber  moss and sandal wood.              <div class="emptyClear"> </div> </div> </div> </div>,None,18:03:2014,None
B003TOZKVI,Calvin Klein Eternity Aqua EDT for Men  100ml,http://www.amazon.in/Fragrances/b/ref=sd_allcat_beauty_fragrance/276-6718833-1247838?ie=UTF8&node=1374298031,None,Fragranc,Elizabeth Arden,Calvin Klein,http://ecx.images-amazon.com/images/I/31JrnC0qt%2BL._AA160_.jpg,None,self Colour,Beauty & Health,http://www.amazon.in/Calvin-Klein-Eternity-Aqua-100ml/dp/B003TOZKVI/ref=sr_1_14/275-9715206-1097860?s=beauty&ie=UTF8&qid=1395126933&sr=1-14,[<a href="/gp/help/seller/at-a-glance.html/275-9715206-1097860?ie=UTF8&amp;seller=A22G8HZGXYSWPZ">Taha &amp; Bros.</a>],Amazon.in: Buy Calvin Klein Eternity Aqua EDT for Men  100ml Online at Best Price in India | Amazon Beauty Store,Buy Calvin Klein Eternity Aqua EDT for Men  100ml at lowest price in India on Amazon.in. Check out Calvin Klein Eternity Aqua EDT for Men  100ml reviews  ratings  features  specifications and browse more Beauty products online at best prices on Amazon.in.,None,<div class="bucket" id="productDescription"> <h2>Product Description</h2> <div class="content"> <h3 class="productDescriptionSource"></h3> <div class="productDescriptionWrapper">        The distinctive  romantic and timeless fragrance of Eternity takes on a freshness and sophistication in the spirit of today's man with Eternity Aqua. Masculine and modern with an aquatic and refreshing surge that leaves a lasting impression. Experience the relaxed sophistication with the Calvin Klein Eternity Aqua 3.4oz Eau de Toilette.              <div class="emptyClear"> </div> </div> </div> </div>,None,18:03:2014,None
B00BLQZ8RM,Calvin Klein 2013 Edition Ck One Summer Eau de Toilette Spray for Unisex 3.4 Ounce,http://www.amazon.in/Fragrances/b/ref=sd_allcat_beauty_fragrance/276-6718833-1247838?ie=UTF8&node=1374298031,None,Fragranc,Elizabeth Arden,Calvin Klein,http://ecx.images-amazon.com/images/I/31JrnC0qt%2BL._AA160_.jpg,None,self Colour,Beauty & Health,http://www.amazon.in/Calvin-Klein-Edition-Summer-Toilette/dp/B00BLQZ8RM/ref=sr_1_17/275-9715206-1097860?s=beauty&ie=UTF8&qid=1395126933&sr=1-17,[<a href="/gp/help/seller/at-a-glance.html/275-9715206-1097860?ie=UTF8&amp;seller=A3ES9F57NVVRIK">MyLuckyScent</a>],Amazon.in: Buy Calvin Klein 2013 Edition Ck One Summer Eau de Toilette Spray for Unisex 3.4 Ounce Online at Best Price in India | Amazon Beauty Store,Buy Calvin Klein 2013 Edition Ck One Summer Eau de Toilette Spray for Unisex 3.4 Ounce at lowest price in India on Amazon.in. Check out Calvin Klein 2013 Edition Ck One Summer Eau de Toilette Spray for Unisex 3.4 Ounce reviews  ratings  features  specifications and browse more Beauty products online at best prices on Amazon.in.,None,<div class="bucket" id="productDescription"> <h2>Product Description</h2> <div class="content"> <h3 class="productDescriptionSource"></h3> <div class="productDescriptionWrapper">        "This fresh and fruity unisex fragrance is the perfect summer scent. CK One Summer blends top notes of grapefruit mandarin orange watermelon and water mint middle notes of ginger marigold and orange blossom and base notes of guaiac wood orris root vanilla and vetiver. CK One Summer comes in a 3.4 oz. eau de toilette spray."              <div class="emptyClear"> </div> </div> </div> </div>,None,18:03:2014,None
B0049CTLUA,Calvin Klein One for Men and Women  200ml,http://www.amazon.in/Fragrances/b/ref=sd_allcat_beauty_fragrance/276-6718833-1247838?ie=UTF8&node=1374298031,None,Fragranc,Elizabeth Arden,Calvin Klein,http://ecx.images-amazon.com/images/I/31JrnC0qt%2BL._AA160_.jpg,None,self Colour,Beauty & Health,http://www.amazon.in/Calvin-Klein-One-Women-200ml/dp/B0049CTLUA/ref=sr_1_19/275-9715206-1097860?s=beauty&ie=UTF8&qid=1395126933&sr=1-19,[<a href="/gp/help/seller/at-a-glance.html/275-9715206-1097860?ie=UTF8&amp;seller=A3ES9F57NVVRIK">MyLuckyScent</a>],Amazon.in: Buy Calvin Klein One for Men and Women  200ml Online at Best Price in India | Amazon Beauty Store,Buy Calvin Klein One for Men and Women  200ml at lowest price in India on Amazon.in. Check out Calvin Klein One for Men and Women  200ml reviews  ratings  features  specifications and browse more Beauty products online at best prices on Amazon.in.,None,<div class="bucket" id="productDescription"> <h2>Product Description</h2> <div class="content"> <h3 class="productDescriptionSource"></h3> <div class="productDescriptionWrapper">        CK One Calvin Klein for women and men. CK One by Calvin Klein is a citrus aromatic fragrance for women and men. CK One was launched in 1994. CK One was created by Alberto Morillas and Harry Fremont. Top notes are pineapple  green notes  mandarin orange  papaya  bergamot  cardamom and lemon; middle notes are nutmeg  violet  orris root  jasmine  lily-of-the-valley and rose; base notes are sandalwood  amber  musk  cedar and oakmoss.              <div class="emptyClear"> </div> </div> </div> </div>,None,18:03:2014,None
B005A2M7WC,Calvin Klein Forbidden Euphoria for Women  100ml,http://www.amazon.in/Fragrances/b/ref=sd_allcat_beauty_fragrance/276-6718833-1247838?ie=UTF8&node=1374298031,None,Fragranc,Elizabeth Arden,Calvin Klein,http://ecx.images-amazon.com/images/I/31JrnC0qt%2BL._AA160_.jpg,None,self Colour,Beauty & Health,http://www.amazon.in/Calvin-Klein-Forbidden-Euphoria-Women/dp/B005A2M7WC/ref=sr_1_24/275-9715206-1097860?s=beauty&ie=UTF8&qid=1395126933&sr=1-24,[<a href="/gp/help/seller/at-a-glance.html/275-9715206-1097860?ie=UTF8&amp;seller=A3ES9F57NVVRIK">MyLuckyScent</a>],Amazon.in: Buy Calvin Klein Forbidden Euphoria for Women  100ml Online at Best Price in India | Amazon Beauty Store,Buy Calvin Klein Forbidden Euphoria for Women  100ml at lowest price in India on Amazon.in. Check out Calvin Klein Forbidden Euphoria for Women  100ml reviews  ratings  features  specifications and browse more Beauty products online at best prices on Amazon.in.,None,<div class="bucket" id="productDescription"> <h2>Product Description</h2> <div class="content"> <h3 class="productDescriptionSource"></h3> <div class="productDescriptionWrapper">        Design House: Calvin Klein  Year Introduced: 2011  Recommended Use: Casual  Recommended Use: Casual              <div class="emptyClear"> </div> </div> </div> </div>,None,18:03:2014,None
