B007PY9TYC,Hugo Boss Bottled Sport Edt 100 ml,http://www.amazon.in/Fragrances/b/ref=sd_allcat_beauty_fragrance/276-6718833-1247838?ie=UTF8&node=1374298031,None,Fragranc,Eau de Toilette,Hugo Boss,http://ecx.images-amazon.com/images/I/41ifdWzXCfL._AA160_.jpg,None,self Colour,Beauty & Health,http://www.amazon.in/Hugo-Boss-Bottled-Sport-Edt/dp/B007PY9TYC/ref=sr_1_49/278-5111767-9472601?s=beauty&ie=UTF8&qid=1395127009&sr=1-49,[<a href="/gp/help/seller/at-a-glance.html/278-5111767-9472601?ie=UTF8&amp;seller=A2NFQIUV2YGOLG">Fragume</a>],Amazon.in: Buy Hugo Boss Bottled Sport Edt 100 ml Online at Best Price in India | Amazon Beauty Store,Buy Hugo Boss Bottled Sport Edt 100 ml at lowest price in India on Amazon.in. Check out Hugo Boss Bottled Sport Edt 100 ml reviews  ratings  features  specifications and browse more Beauty products online at best prices on Amazon.in.,None,<div class="bucket" id="productDescription"> <h2>Product Description</h2> <div class="content"> <h3 class="productDescriptionSource"></h3> <div class="productDescriptionWrapper">        Brand: Hugo BossBrand: Hugo Boss Type: Fragrance Quantity: 100 ml For men A fresh  energetic and very masculine fragrance Aims at men of competitive spirit willing to challenge themselves Composition is aromatic - aldehyde Top Note: Fresh pink grapefruit Middle Note: Aromatic and spicy  lavender and cardamom accords Base Note: Masculine and woody Vetiver Recommended for daily wear Great for gifting purposes Perfect for all occasions Disclaimer: Please note that the perfume may or may not come in a ploy wrap or seal pertaining to the respective brand's original packaging standards              <div class="emptyClear"> </div> </div> </div> </div>,None,18:03:2014,None
B000RPO23Y,hugo boss deodorant for men 150ml,http://www.amazon.in/Fragrances/b/ref=sd_allcat_beauty_fragrance/276-6718833-1247838?ie=UTF8&node=1374298031,Rs. 1 200.00,Fragranc,Eau de Toilette,Hugo Boss,http://ecx.images-amazon.com/images/I/41ifdWzXCfL._AA160_.jpg,Rs. 1 200.00,self Colour,Beauty & Health,http://www.amazon.in/hugo-boss-deodorant-men-150ml/dp/B000RPO23Y/ref=sr_1_53/278-5111767-9472601?s=beauty&ie=UTF8&qid=1395127009&sr=1-53,[<a class="buyAction" href="/gp/offer-listing/B000RPO23Y/ref=dp_olp_0/278-5111767-9472601?ie=UTF8&amp;condition=all">these sellers</a>],Amazon.in: Buy hugo boss deodorant for men 150ml Online at Best Price in India | Amazon Beauty Store,Buy hugo boss deodorant for men 150ml at lowest price in India on Amazon.in. Check out hugo boss deodorant for men 150ml reviews  ratings  features  specifications and browse more Beauty products online at best prices on Amazon.in.,None,<div class="bucket" id="productDescription"> <h2>Product Description</h2> <div class="content"> <h3 class="productDescriptionSource"></h3> <div class="productDescriptionWrapper">        In Boss Bottled a fresh and fruity top note balances with thewarm and flowery- spicy middle note dominated by geraniums seasoned with just a dab of clove.The base note is decidedly male  a vibrating harmony ofsandalwood  cedarwood and vetiver.              <div class="emptyClear"> </div> </div> </div> </div>,None,18:03:2014,None
B000C214A6,Hugo Boss EDT for Men  150ml,http://www.amazon.in/Fragrances/b/ref=sd_allcat_beauty_fragrance/276-6718833-1247838?ie=UTF8&node=1374298031,None,Fragranc,Eau de Toilette,Hugo Boss,http://ecx.images-amazon.com/images/I/41ifdWzXCfL._AA160_.jpg,None,self Colour,Beauty & Health,http://www.amazon.in/Hugo-Boss-EDT-Men-150ml/dp/B000C214A6/ref=sr_1_56/278-5111767-9472601?s=beauty&ie=UTF8&qid=1395127009&sr=1-56,[<a href="/gp/help/seller/at-a-glance.html/278-5111767-9472601?ie=UTF8&amp;seller=ADJ7WREVGU39P">Zephyr Online</a>],Amazon.in: Buy Hugo Boss EDT for Men  150ml Online at Best Price in India | Amazon Beauty Store,Buy Hugo Boss EDT for Men  150ml at lowest price in India on Amazon.in. Check out Hugo Boss EDT for Men  150ml reviews  ratings  features  specifications and browse more Beauty products online at best prices on Amazon.in.,None,<div class="bucket" id="productDescription"> <h2>Product Description</h2> <div class="content"> <h3 class="productDescriptionSource"></h3> <div class="productDescriptionWrapper">        Fragrance notes: Woods fresh citrus and spicy leaves. When applying any fragrance please consider that there are several factors which can affect the natural smell of your skin and in turn the way a scent smells on you. For instance your mood stress level age body chemistry  diet and current medications may all alter the scents you wear. Similarly factor such as dry or oily skin can even affect the amount of time a fragrance will last after being applied.              <div class="emptyClear"> </div> </div> </div> </div>,None,18:03:2014,None
B0084YCGBA,Hugo Boss EDT for  Men  150ml,http://www.amazon.in/Fragrances/b/ref=sd_allcat_beauty_fragrance/276-6718833-1247838?ie=UTF8&node=1374298031,None,Fragranc,Eau de Toilette,Hugo Boss,http://ecx.images-amazon.com/images/I/41ifdWzXCfL._AA160_.jpg,None,self Colour,Beauty & Health,http://www.amazon.in/Hugo-Boss-EDT-Men-150ml/dp/B0084YCGBA/ref=sr_1_55/278-5111767-9472601?s=beauty&ie=UTF8&qid=1395127009&sr=1-55,[<a href="/gp/help/seller/at-a-glance.html/278-5111767-9472601?ie=UTF8&amp;seller=A3ES9F57NVVRIK">MyLuckyScent</a>],Amazon.in: Buy Hugo Boss EDT for Men  150ml Online at Best Price in India | Amazon Beauty Store,Buy Hugo Boss EDT for Men  150ml at lowest price in India on Amazon.in. Check out Hugo Boss EDT for Men  150ml reviews  ratings  features  specifications and browse more Beauty products online at best prices on Amazon.in.,None,<div class="bucket" id="productDescription"> <h2>Product Description</h2> <div class="content"> <h3 class="productDescriptionSource"></h3> <div class="productDescriptionWrapper">        Fresh  sharp and extremely masculine  Hugo is about living life on your own terms with a certain irreverence. It is created not for those who go with the trend of the moment  but for those who seek a style of their own. Hugo thrives on individualism  living on the edge and street adrenaline.              <div class="emptyClear"> </div> </div> </div> </div>,None,18:03:2014,None
B0084YCH9G,Hugo Boss Elements EDT for Men  90ml,http://www.amazon.in/Fragrances/b/ref=sd_allcat_beauty_fragrance/276-6718833-1247838?ie=UTF8&node=1374298031,None,Fragranc,Eau de Toilette,Hugo Boss,http://ecx.images-amazon.com/images/I/41ifdWzXCfL._AA160_.jpg,None,self Colour,Beauty & Health,http://www.amazon.in/Hugo-Boss-Elements-EDT-90ml/dp/B0084YCH9G/ref=sr_1_59/278-5111767-9472601?s=beauty&ie=UTF8&qid=1395127009&sr=1-59,[<a href="/gp/help/seller/at-a-glance.html/278-5111767-9472601?ie=UTF8&amp;seller=A2NFQIUV2YGOLG">Fragume</a>],Amazon.in: Buy Hugo Boss Elements EDT for Men  90ml Online at Best Price in India | Amazon Beauty Store,Buy Hugo Boss Elements EDT for Men  90ml at lowest price in India on Amazon.in. Check out Hugo Boss Elements EDT for Men  90ml reviews  ratings  features  specifications and browse more Beauty products online at best prices on Amazon.in.,None,<div class="bucket" id="productDescription"> <h2>Product Description</h2> <div class="content"> <h3 class="productDescriptionSource"></h3> <div class="productDescriptionWrapper">        A classic aromatic fougere for men. Top notes are aldehydes  Artemisia  Lavender  Basil  Bergamot and Lemon. Middle notes are Coriander  Violet  Clary sage  Jasmine  Caraway  Lily-of-the-valley and Rose. Base notes are Leather  Sandalwood  Amber  Musk  Oakmoss and Cedar. A traditional scent that has stood the test of time.              <div class="emptyClear"> </div> </div> </div> </div>,None,18:03:2014,None
B004NNA3GQ,Hugo Boss Energise Edt. Men 125 ml,http://www.amazon.in/Fragrances/b/ref=sd_allcat_beauty_fragrance/276-6718833-1247838?ie=UTF8&node=1374298031,Rs. 2 780.00,Fragranc,Eau de Toilette,Hugo Boss,http://ecx.images-amazon.com/images/I/41ifdWzXCfL._AA160_.jpg,Rs. 2 780.00,self Colour,Beauty & Health,http://www.amazon.in/Hugo-Boss-Energise-Edt-Men/dp/B004NNA3GQ/ref=sr_1_62/278-5111767-9472601?s=beauty&ie=UTF8&qid=1395127009&sr=1-62,[<a class="buyAction" href="/gp/offer-listing/B004NNA3GQ/ref=dp_olp_0/278-5111767-9472601?ie=UTF8&amp;condition=all">these sellers</a>],Hugo Boss Energise Edt. Men 125 ml: Amazon.in: Beauty,Hugo Boss Energise Edt. Men 125 ml: Amazon.in: Beauty,None,<div class="bucket" id="productDescription"> <h2>Product Description</h2> <div class="content"> <h3 class="productDescriptionSource"></h3> <div class="productDescriptionWrapper">        Hugo Energise by Hugo Boss is a Woody Aromatic fragrance for men. The nose behind this fragrance is Claude Dir. Top notes are mint  pink pepper  lemon  pineapple leaf  cardamom  kumquat and mandarin orange; middle notes are freesia  nutmeg  coriander  juniper  clary sage and jasmine; base notes are teak wood  leather and vanilla.              <div class="emptyClear"> </div> </div> </div> </div>,None,18:03:2014,None
B0045KD3K0,Hugo Boss Energise Eau De Toilette Spray for Men  125ml,http://www.amazon.in/Fragrances/b/ref=sd_allcat_beauty_fragrance/276-6718833-1247838?ie=UTF8&node=1374298031,None,Fragranc,Eau de Toilette,Hugo Boss,http://ecx.images-amazon.com/images/I/41ifdWzXCfL._AA160_.jpg,None,self Colour,Beauty & Health,http://www.amazon.in/Hugo-Boss-Energise-Toilette-Spray/dp/B0045KD3K0/ref=sr_1_60/278-5111767-9472601?s=beauty&ie=UTF8&qid=1395127009&sr=1-60,[<a href="/gp/help/seller/at-a-glance.html/278-5111767-9472601?ie=UTF8&amp;seller=A22G8HZGXYSWPZ">Taha &amp; Bros.</a>],Amazon.in: Buy Hugo Boss Energise Eau De Toilette Spray for Men  125ml Online at Best Price in India | Amazon Beauty Store,Buy Hugo Boss Energise Eau De Toilette Spray for Men  125ml at lowest price in India on Amazon.in. Check out Hugo Boss Energise Eau De Toilette Spray for Men  125ml reviews  ratings  features  specifications and browse more Beauty products online at best prices on Amazon.in.,None,None,None,18:03:2014,None
B0084YCGH4,Hugo Boss Hugo Dark Blue Men 75ML EDT,http://www.amazon.in/Fragrances/b/ref=sd_allcat_beauty_fragrance/276-6718833-1247838?ie=UTF8&node=1374298031,None,Fragranc,Eau de Toilette,Hugo Boss,http://ecx.images-amazon.com/images/I/41ifdWzXCfL._AA160_.jpg,None,self Colour,Beauty & Health,http://www.amazon.in/Hugo-Boss-Dark-Blue-75ML/dp/B0084YCGH4/ref=sr_1_65/278-5111767-9472601?s=beauty&ie=UTF8&qid=1395127009&sr=1-65,[<a href="/gp/help/seller/at-a-glance.html/278-5111767-9472601?ie=UTF8&amp;seller=A2NFQIUV2YGOLG">Fragume</a>],Amazon.in: Buy Hugo Boss Hugo Dark Blue Men 75ML EDT Online at Best Price in India | Amazon Beauty Store,Buy Hugo Boss Hugo Dark Blue Men 75ML EDT at lowest price in India on Amazon.in. Check out Hugo Boss Hugo Dark Blue Men 75ML EDT reviews  ratings  features  specifications and browse more Beauty products online at best prices on Amazon.in.,None,None,None,18:03:2014,None
B0084YCGV0,Hugo Boss Hugo XX Women 100ML EDT,http://www.amazon.in/Fragrances/b/ref=sd_allcat_beauty_fragrance/276-6718833-1247838?ie=UTF8&node=1374298031,None,Fragranc,Eau de Toilette,Hugo Boss,http://ecx.images-amazon.com/images/I/41ifdWzXCfL._AA160_.jpg,None,self Colour,Beauty & Health,http://www.amazon.in/Hugo-Boss-Women-100ML-EDT/dp/B0084YCGV0/ref=sr_1_66/278-5111767-9472601?s=beauty&ie=UTF8&qid=1395127009&sr=1-66,[<a href="/gp/help/seller/at-a-glance.html/278-5111767-9472601?ie=UTF8&amp;seller=A2NFQIUV2YGOLG">Fragume</a>],Amazon.in: Buy Hugo Boss Hugo XX Women 100ML EDT Online at Best Price in India | Amazon Beauty Store,Buy Hugo Boss Hugo XX Women 100ML EDT at lowest price in India on Amazon.in. Check out Hugo Boss Hugo XX Women 100ML EDT reviews  ratings  features  specifications and browse more Beauty products online at best prices on Amazon.in.,None,None,None,18:03:2014,None
B000C2148S,Hugo Boss In Motion for Men  90ml,http://www.amazon.in/Fragrances/b/ref=sd_allcat_beauty_fragrance/276-6718833-1247838?ie=UTF8&node=1374298031,None,Fragranc,Eau de Toilette,Hugo Boss,http://ecx.images-amazon.com/images/I/41ifdWzXCfL._AA160_.jpg,None,self Colour,Beauty & Health,http://www.amazon.in/Hugo-Boss-Motion-Men-90ml/dp/B000C2148S/ref=sr_1_69/278-5111767-9472601?s=beauty&ie=UTF8&qid=1395127009&sr=1-69,[<a href="/gp/help/seller/at-a-glance.html/278-5111767-9472601?ie=UTF8&amp;seller=A22G8HZGXYSWPZ">Taha &amp; Bros.</a>],Amazon.in: Buy Hugo Boss In Motion for Men  90ml Online at Best Price in India | Amazon Beauty Store,Buy Hugo Boss In Motion for Men  90ml at lowest price in India on Amazon.in. Check out Hugo Boss In Motion for Men  90ml reviews  ratings  features  specifications and browse more Beauty products online at best prices on Amazon.in.,None,<div class="bucket" id="productDescription"> <h2>Product Description</h2> <div class="content"> <h3 class="productDescriptionSource"></h3> <div class="productDescriptionWrapper">        Design House: Hugo Boss  Year Introduced: 2002  Recommended Use: Daytime  Recommended Use: Daytime              <div class="emptyClear"> </div> </div> </div> </div>,None,18:03:2014,None
B005R4TSLG,Hugo boss just different for men 150ml,http://www.amazon.in/Fragrances/b/ref=sd_allcat_beauty_fragrance/276-6718833-1247838?ie=UTF8&node=1374298031,None,Fragranc,Eau de Toilette,Hugo Boss,http://ecx.images-amazon.com/images/I/41ifdWzXCfL._AA160_.jpg,None,self Colour,Beauty & Health,http://www.amazon.in/Hugo-boss-just-different-150ml/dp/B005R4TSLG/ref=sr_1_70/278-5111767-9472601?s=beauty&ie=UTF8&qid=1395127009&sr=1-70,[<a href="/gp/help/seller/at-a-glance.html/278-5111767-9472601?ie=UTF8&amp;seller=A22G8HZGXYSWPZ">Taha &amp; Bros.</a>],Amazon.in: Buy Hugo boss just different for men 150ml Online at Best Price in India | Amazon Beauty Store,Buy Hugo boss just different for men 150ml at lowest price in India on Amazon.in. Check out Hugo boss just different for men 150ml reviews  ratings  features  specifications and browse more Beauty products online at best prices on Amazon.in.,None,<div class="bucket" id="productDescription"> <h2>Product Description</h2> <div class="content"> <h3 class="productDescriptionSource"></h3> <div class="productDescriptionWrapper">        Hugo Boss Just Different for Men For those edgy souls who inhabit the urban jungle Hugo Man presents Just Different: a scent full of irreverence and creative energy. The vibrant and cooling fragrance exhilarates the senses with a fusion of theFeatures1) 2) New in box              <div class="emptyClear"> </div> </div> </div> </div>,None,18:03:2014,None
B00EXW2FJA,Hugo Boss No 1 Edt  50ml,http://www.amazon.in/Fragrances/b/ref=sd_allcat_beauty_fragrance/276-6718833-1247838?ie=UTF8&node=1374298031,Rs. 2 975.00,Fragranc,Eau de Toilette,Hugo Boss,http://ecx.images-amazon.com/images/I/41ifdWzXCfL._AA160_.jpg,Rs. 2 975.00,self Colour,Beauty & Health,http://www.amazon.in/Hugo-Boss-No-Edt-50ml/dp/B00EXW2FJA/ref=sr_1_71/278-5111767-9472601?s=beauty&ie=UTF8&qid=1395127009&sr=1-71,[<a class="buyAction" href="/gp/offer-listing/B00EXW2FJA/ref=dp_olp_0/278-5111767-9472601?ie=UTF8&amp;condition=all">these sellers</a>],Amazon.in: Buy Hugo Boss No 1 Edt  50ml Online at Best Price in India | Amazon Beauty Store,Buy Hugo Boss No 1 Edt  50ml at lowest price in India on Amazon.in. Check out Hugo Boss No 1 Edt  50ml reviews  ratings  features  specifications and browse more Beauty products online at best prices on Amazon.in.,None,<div class="bucket" id="productDescription"> <h2>Product Description</h2> <div class="content"> <h3 class="productDescriptionSource"></h3> <div class="productDescriptionWrapper">        Blend of cardamom and nutmeg100% OriginalGives the required masculine effectRecommended for : Evening WearGender : MenBrand: BossQuantity : 50 ml              <div class="emptyClear"> </div> </div> </div> </div>,None,18:03:2014,None
B001FWXJ2I,HUGO BOSS PURE FOR MEN 75ML,http://www.amazon.in/Fragrances/b/ref=sd_allcat_beauty_fragrance/276-6718833-1247838?ie=UTF8&node=1374298031,None,Fragranc,Eau de Toilette,Hugo Boss,http://ecx.images-amazon.com/images/I/41ifdWzXCfL._AA160_.jpg,None,self Colour,Beauty & Health,http://www.amazon.in/HUGO-BOSS-PURE-FOR-75ML/dp/B001FWXJ2I/ref=sr_1_74/278-5111767-9472601?s=beauty&ie=UTF8&qid=1395127012&sr=1-74,[<a href="/gp/help/seller/at-a-glance.html/278-5111767-9472601?ie=UTF8&amp;seller=A2NFQIUV2YGOLG">Fragume</a>],Amazon.in: Buy HUGO BOSS PURE FOR MEN 75ML Online at Best Price in India | Amazon Beauty Store,Buy HUGO BOSS PURE FOR MEN 75ML at lowest price in India on Amazon.in. Check out HUGO BOSS PURE FOR MEN 75ML reviews  ratings  features  specifications and browse more Beauty products online at best prices on Amazon.in.,None,<div class="bucket" id="productDescription"> <h2>Product Description</h2> <div class="content"> <h3 class="productDescriptionSource"></h3> <div class="productDescriptionWrapper">        Boss Pure Hugo Boss for men. In April 2008 Hugo Boss launches new fragrance for men with very strong refreshing notes. It is a modern fragrance composed of luminous sunny citruses blended with woodsy notes.This scent is made to represent purity and freshness of water.The fragrance is named simply Pure. The bottle is simple  of straight square lines  transparent and filled with bluish colored fragrance. The fragrance is inspired with the power of water and the cool blue color is in line with its name and composition.              <div class="emptyClear"> </div> </div> </div> </div>,None,18:03:2014,None
B000P251NE,Hugo Boss Selection EDT for Men Sparay  88ml,http://www.amazon.in/Fragrances/b/ref=sd_allcat_beauty_fragrance/276-6718833-1247838?ie=UTF8&node=1374298031,None,Fragranc,Eau de Toilette,Hugo Boss,http://ecx.images-amazon.com/images/I/41ifdWzXCfL._AA160_.jpg,None,self Colour,Beauty & Health,http://www.amazon.in/Hugo-Boss-Selection-Sparay-88ml/dp/B000P251NE/ref=sr_1_76/278-5111767-9472601?s=beauty&ie=UTF8&qid=1395127012&sr=1-76,[<a href="/gp/help/seller/at-a-glance.html/278-5111767-9472601?ie=UTF8&amp;seller=A29ZFTNVZHDXBZ">Route2Fashion</a>],Amazon.in: Buy Hugo Boss Selection EDT for Men Sparay  88ml Online at Best Price in India | Amazon Beauty Store,Buy Hugo Boss Selection EDT for Men Sparay  88ml at lowest price in India on Amazon.in. Check out Hugo Boss Selection EDT for Men Sparay  88ml reviews  ratings  features  specifications and browse more Beauty products online at best prices on Amazon.in.,None,<div class="bucket" id="productDescription"> <h2>Product Description</h2> <div class="content"> <h3 class="productDescriptionSource"></h3> <div class="productDescriptionWrapper">        Design House: Hugo Boss  Year Introduced: 2006  Recommended Use: Daytime  Recommended Use: Daytime              <div class="emptyClear"> </div> </div> </div> </div>,None,18:03:2014,None
B008BVM33C,Hugo Boss Sport Edtion EDT for Men  100ml,http://www.amazon.in/Fragrances/b/ref=sd_allcat_beauty_fragrance/276-6718833-1247838?ie=UTF8&node=1374298031,None,Fragranc,Eau de Toilette,Hugo Boss,http://ecx.images-amazon.com/images/I/41ifdWzXCfL._AA160_.jpg,None,self Colour,Beauty & Health,http://www.amazon.in/Hugo-Boss-Sport-Edtion-100ml/dp/B008BVM33C/ref=sr_1_79/278-5111767-9472601?s=beauty&ie=UTF8&qid=1395127012&sr=1-79,[<a href="/gp/help/seller/at-a-glance.html/278-5111767-9472601?ie=UTF8&amp;seller=A22G8HZGXYSWPZ">Taha &amp; Bros.</a>],Amazon.in: Buy Hugo Boss Sport Edtion EDT for Men  100ml Online at Best Price in India | Amazon Beauty Store,Buy Hugo Boss Sport Edtion EDT for Men  100ml at lowest price in India on Amazon.in. Check out Hugo Boss Sport Edtion EDT for Men  100ml reviews  ratings  features  specifications and browse more Beauty products online at best prices on Amazon.in.,None,<div class="bucket" id="productDescription"> <h2>Product Description</h2> <div class="content"> <h3 class="productDescriptionSource"></h3> <div class="productDescriptionWrapper">        Boss Bottled Sport  the sporty edition of the men's fragrance Boss bottled from 1998  was presented in spring 2012. The scent is described as fresh  energetic and very masculine  aiming at men of competitive spirit willing to challenge themselves. The composition is an aromatic - aldehyde opening with fresh pink grapefruit. The heart is aromatic and spicy  thanks to lavender and cardamom accords. The fragrance is available as 50ml and 100ml EDT.              <div class="emptyClear"> </div> </div> </div> </div>,None,18:03:2014,None
B00294T9W0,Hugo Boss Xy men 100ml,http://www.amazon.in/Fragrances/b/ref=sd_allcat_beauty_fragrance/276-6718833-1247838?ie=UTF8&node=1374298031,None,Fragranc,Eau de Toilette,Hugo Boss,http://ecx.images-amazon.com/images/I/41ifdWzXCfL._AA160_.jpg,None,self Colour,Beauty & Health,http://www.amazon.in/Hugo-Boss-Xy-men-100ml/dp/B00294T9W0/ref=sr_1_81/278-5111767-9472601?s=beauty&ie=UTF8&qid=1395127012&sr=1-81,[<a href="/gp/help/seller/at-a-glance.html/278-5111767-9472601?ie=UTF8&amp;seller=A22G8HZGXYSWPZ">Taha &amp; Bros.</a>],Amazon.in: Buy Hugo Boss Xy men 100ml Online at Best Price in India | Amazon Beauty Store,Buy Hugo Boss Xy men 100ml at lowest price in India on Amazon.in. Check out Hugo Boss Xy men 100ml reviews  ratings  features  specifications and browse more Beauty products online at best prices on Amazon.in.,None,<div class="bucket" id="productDescription"> <h2>Product Description</h2> <div class="content"> <h3 class="productDescriptionSource"></h3> <div class="productDescriptionWrapper">        Hugo XY Hugo Boss for men.Hugo XY by Hugo Boss is a Woody Aromatic fragrance for men. Top notes are pear leaf  cedar and bergamot; middle notes are basil and mint; base notes are patchouli  musk and cedar.              <div class="emptyClear"> </div> </div> </div> </div>,None,18:03:2014,None
B00BOJNF9E,Hugo Element Eau De Toilette  90ml,http://www.amazon.in/Fragrances/b/ref=sd_allcat_beauty_fragrance/276-6718833-1247838?ie=UTF8&node=1374298031,None,Fragranc,Eau de Toilette,Hugo Boss,http://ecx.images-amazon.com/images/I/41ifdWzXCfL._AA160_.jpg,None,self Colour,Beauty & Health,http://www.amazon.in/Hugo-Element-Eau-Toilette-90ml/dp/B00BOJNF9E/ref=sr_1_89/278-5111767-9472601?s=beauty&ie=UTF8&qid=1395127012&sr=1-89,[<a href="/gp/help/seller/at-a-glance.html/278-5111767-9472601?ie=UTF8&amp;seller=A22G8HZGXYSWPZ">Taha &amp; Bros.</a>],Amazon.in: Buy Hugo Element Eau De Toilette  90ml Online at Best Price in India | Amazon Beauty Store,Buy Hugo Element Eau De Toilette  90ml at lowest price in India on Amazon.in. Check out Hugo Element Eau De Toilette  90ml reviews  ratings  features  specifications and browse more Beauty products online at best prices on Amazon.in.,None,<div class="bucket" id="productDescription"> <h2>Product Description</h2> <div class="content"> <h3 class="productDescriptionSource"></h3> <div class="productDescriptionWrapper">        It features notes of Calone  Coumarin  Ginger  Coriander and Cedar wood.              <div class="emptyClear"> </div> </div> </div> </div>,None,18:03:2014,None
B002ZH7DY2,HUGO ENERGISE MEN 125ML,http://www.amazon.in/Fragrances/b/ref=sd_allcat_beauty_fragrance/276-6718833-1247838?ie=UTF8&node=1374298031,None,Fragranc,Eau de Toilette,Hugo Boss,http://ecx.images-amazon.com/images/I/41ifdWzXCfL._AA160_.jpg,None,self Colour,Beauty & Health,http://www.amazon.in/Hugo-Boss-HUGO-ENERGISE-125ML/dp/B002ZH7DY2/ref=sr_1_90/278-5111767-9472601?s=beauty&ie=UTF8&qid=1395127012&sr=1-90,[<a href="/gp/help/seller/at-a-glance.html/278-5111767-9472601?ie=UTF8&amp;seller=A2NFQIUV2YGOLG">Fragume</a>],Amazon.in: Buy HUGO ENERGISE MEN 125ML Online at Best Price in India | Amazon Beauty Store,Buy HUGO ENERGISE MEN 125ML at lowest price in India on Amazon.in. Check out HUGO ENERGISE MEN 125ML reviews  ratings  features  specifications and browse more Beauty products online at best prices on Amazon.in.,None,<div class="bucket" id="productDescription"> <h2>Product Description</h2> <div class="content"> <h3 class="productDescriptionSource"></h3> <div class="productDescriptionWrapper">        Hugo Energise Hugo Boss for men.Hugo Energise by Hugo Boss is a Woody Aromatic fragrance for men. The nose behind this fragrance is Claude Dir. Top notes are mint  pink pepper  lemon  pineapple leaf  cardamom  kumquat and mandarin orange; middle notes are freesia  nutmeg  coriander  juniper  clary sage and jasmine; base notes are teak wood  leather and vanilla.              <div class="emptyClear"> </div> </div> </div> </div>,None,18:03:2014,None
B00B87ME5S,Orange Sunset By Hugo Boss for Women - 2.5 Oz Edt Spray  2.5 Ounce,http://www.amazon.in/Fragrances/b/ref=sd_allcat_beauty_fragrance/276-6718833-1247838?ie=UTF8&node=1374298031,Rs. 3 490.00,Fragranc,Eau de Toilette,Hugo Boss,http://ecx.images-amazon.com/images/I/41ifdWzXCfL._AA160_.jpg,Rs. 3 490.00,self Colour,Beauty & Health,http://www.amazon.in/Orange-Sunset-Hugo-Boss-Women/dp/B00B87ME5S/ref=sr_1_97/278-5111767-9472601?s=beauty&ie=UTF8&qid=1395127020&sr=1-97,[<a class="buyAction" href="/gp/offer-listing/B00B87ME5S/ref=dp_olp_0/278-5111767-9472601?ie=UTF8&amp;condition=all">these sellers</a>],Amazon.in: Buy Orange Sunset By Hugo Boss for Women - 2.5 Oz Edt Spray  2.5 Ounce Online at Best Price in India | Amazon Beauty Store,Buy Orange Sunset By Hugo Boss for Women - 2.5 Oz Edt Spray  2.5 Ounce at lowest price in India on Amazon.in. Check out Orange Sunset By Hugo Boss for Women - 2.5 Oz Edt Spray  2.5 Ounce reviews  ratings  features  specifications and browse more Beauty products online at best prices on Amazon.in.,None,None,None,18:03:2014,None
