B000IMSCFU,Hugo Boss Number 1 EDT for Men  125ml,http://www.amazon.in/Fragrances/b/ref=sd_allcat_beauty_fragrance/276-6718833-1247838?ie=UTF8&node=1374298031,None,Fragranc,Eau de Toilette,Hugo Boss,http://ecx.images-amazon.com/images/I/41ifdWzXCfL._AA160_.jpg,None,self Colour,Beauty & Health,http://www.amazon.in/Hugo-Boss-Number-EDT-125ml/dp/B000IMSCFU/ref=sr_1_6/278-5111767-9472601?s=beauty&ie=UTF8&qid=1395126996&sr=1-6,[<a href="/gp/help/seller/at-a-glance.html/278-5111767-9472601?ie=UTF8&amp;seller=A2NFQIUV2YGOLG">Fragume</a>],Amazon.in: Buy Hugo Boss Number 1 EDT for Men  125ml Online at Best Price in India | Amazon Beauty Store,Buy Hugo Boss Number 1 EDT for Men  125ml at lowest price in India on Amazon.in. Check out Hugo Boss Number 1 EDT for Men  125ml reviews  ratings  features  specifications and browse more Beauty products online at best prices on Amazon.in.,None,<div class="bucket" id="productDescription"> <h2>Product Description</h2> <div class="content"> <h3 class="productDescriptionSource"></h3> <div class="productDescriptionWrapper">        Launched by Hugo Boss in 1985 is classified as a sharp spicy lavender amber fragrance. This masculine scent possesses a blend of oak cedar mandarin musk and amber.              <div class="emptyClear"> </div> </div> </div> </div>,None,18:03:2014,None
B000PS8P3Q,Hugo Boss Dark Blue for Men  75ml,http://www.amazon.in/Fragrances/b/ref=sd_allcat_beauty_fragrance/276-6718833-1247838?ie=UTF8&node=1374298031,None,Fragranc,Eau de Toilette,Hugo Boss,http://ecx.images-amazon.com/images/I/41ifdWzXCfL._AA160_.jpg,None,self Colour,Beauty & Health,http://www.amazon.in/Hugo-Boss-Dark-Blue-75ml/dp/B000PS8P3Q/ref=sr_1_3/278-5111767-9472601?s=beauty&ie=UTF8&qid=1395126996&sr=1-3,[<a href="/gp/help/seller/at-a-glance.html/278-5111767-9472601?ie=UTF8&amp;seller=A2NFQIUV2YGOLG">Fragume</a>],Amazon.in: Buy Hugo Boss Dark Blue for Men  75ml Online at Best Price in India | Amazon Beauty Store,Buy Hugo Boss Dark Blue for Men  75ml at lowest price in India on Amazon.in. Check out Hugo Boss Dark Blue for Men  75ml reviews  ratings  features  specifications and browse more Beauty products online at best prices on Amazon.in.,None,<div class="bucket" id="productDescription"> <h2>Product Description</h2> <div class="content"> <h3 class="productDescriptionSource"></h3> <div class="productDescriptionWrapper">        Introduced in 1999. Fragrance notes: a fresh invigorating scent of mosses and citrus. Recommended use: daytime.When nbsp applying nbsp any fragrance please consider that there are several factors which can affect the natural smell of your skin and in turn the way a scent smells on you. nbsp For instance your mood stress level age body chemistry nbsp diet and current medications may all alter the scents you wear. nbsp nbsp Similarly factor such as dry or oily nbsp skin can even affect the amount of time a fragrance will last after being applied              <div class="emptyClear"> </div> </div> </div> </div>,None,18:03:2014,None
B00FO033KK,Boss Selection Men EDT  90 ml,http://www.amazon.in/Fragrances/b/ref=sd_allcat_beauty_fragrance/276-6718833-1247838?ie=UTF8&node=1374298031,None,Fragranc,Eau de Toilette,Hugo Boss,http://ecx.images-amazon.com/images/I/41ifdWzXCfL._AA160_.jpg,None,self Colour,Beauty & Health,http://www.amazon.in/Boss-Selection-Men-EDT-90/dp/B00FO033KK/ref=sr_1_8/278-5111767-9472601?s=beauty&ie=UTF8&qid=1395126996&sr=1-8,[<a href="/gp/help/seller/at-a-glance.html/278-5111767-9472601?ie=UTF8&amp;seller=A2NFQIUV2YGOLG">Fragume</a>],Amazon.in: Buy Boss Selection Men EDT  90 ml Online at Best Price in India | Amazon Beauty Store,Buy Boss Selection Men EDT  90 ml at lowest price in India on Amazon.in. Check out Boss Selection Men EDT  90 ml reviews  ratings  features  specifications and browse more Beauty products online at best prices on Amazon.in.,None,<div class="bucket" id="productDescription"> <h2>Product Description</h2> <div class="content"> <h3 class="productDescriptionSource"></h3> <div class="productDescriptionWrapper">        A fragrance with notes consisting of mandarin orange pink pepper grapefruit cedar needles star anise geranium heliotrope vetiver musks cedar and patchouli.Features1) Boss Selection by Hugo Boss Eau De Toilette Spray 3 oz for Men2) Boss Selection by Hugo Boss for Men3) Eau De Toilette Spray 3 oz4) Packaging for this product may vary from that shown in the image above5) 100% Authentic Brand Name Merchandise!              <div class="emptyClear"> </div> </div> </div> </div>,None,18:03:2014,None
B000GHVJPW,Hugo Boss Soul for Men  90ml,http://www.amazon.in/Fragrances/b/ref=sd_allcat_beauty_fragrance/276-6718833-1247838?ie=UTF8&node=1374298031,None,Fragranc,Eau de Toilette,Hugo Boss,http://ecx.images-amazon.com/images/I/41ifdWzXCfL._AA160_.jpg,None,self Colour,Beauty & Health,http://www.amazon.in/Hugo-Boss-Soul-Men-90ml/dp/B000GHVJPW/ref=sr_1_10/278-5111767-9472601?s=beauty&ie=UTF8&qid=1395126996&sr=1-10,[<a href="/gp/help/seller/at-a-glance.html/278-5111767-9472601?ie=UTF8&amp;seller=A2NFQIUV2YGOLG">Fragume</a>],Amazon.in: Buy Hugo Boss Soul for Men  90ml Online at Best Price in India | Amazon Beauty Store,Buy Hugo Boss Soul for Men  90ml at lowest price in India on Amazon.in. Check out Hugo Boss Soul for Men  90ml reviews  ratings  features  specifications and browse more Beauty products online at best prices on Amazon.in.,None,<div class="bucket" id="productDescription"> <h2>Product Description</h2> <div class="content"> <h3 class="productDescriptionSource"></h3> <div class="productDescriptionWrapper">        Launched by the design house of Hugo Boss.When applying any fragrance please consider that there are several factors which can affect the natural smell of your skin and in turn the way a scent smells on you. For instance your mood stress level age body chemistry diet and current medications may all alter the scents you wear. Similarly factor such as dry or oily skin can even affect the amount of time a fragrance will last after being appliedFeatures1) Packaging for this product may vary from that shown in the image above2) This item is not for sale in Catalina Island              <div class="emptyClear"> </div> </div> </div> </div>,None,18:03:2014,None
B0020MMDNS,Hugo Boss XY EDT for Men  100ml,http://www.amazon.in/Fragrances/b/ref=sd_allcat_beauty_fragrance/276-6718833-1247838?ie=UTF8&node=1374298031,None,Fragranc,Eau de Toilette,Hugo Boss,http://ecx.images-amazon.com/images/I/41ifdWzXCfL._AA160_.jpg,None,self Colour,Beauty & Health,http://www.amazon.in/Hugo-Boss-EDT-Men-100ml/dp/B0020MMDNS/ref=sr_1_7/278-5111767-9472601?s=beauty&ie=UTF8&qid=1395126996&sr=1-7,[<a href="/gp/help/seller/at-a-glance.html/278-5111767-9472601?ie=UTF8&amp;seller=A29ZFTNVZHDXBZ">Route2Fashion</a>],Amazon.in: Buy Hugo Boss XY EDT for Men  100ml Online at Best Price in India | Amazon Beauty Store,Buy Hugo Boss XY EDT for Men  100ml at lowest price in India on Amazon.in. Check out Hugo Boss XY EDT for Men  100ml reviews  ratings  features  specifications and browse more Beauty products online at best prices on Amazon.in.,None,<div class="bucket" id="productDescription"> <h2>Product Description</h2> <div class="content"> <h3 class="productDescriptionSource"></h3> <div class="productDescriptionWrapper">        When applying any fragrance please consider that there are several factors which can affect the natural smell of your skin and in turn the way a scent smells on you. For instance your mood stress level age body chemistry  diet and current medications may all alter the scents you wear. Similarly factor such as dry or oily nbsp skin can even affect the amount of time a fragrance will last after being applied.              <div class="emptyClear"> </div> </div> </div> </div>,None,18:03:2014,None
B005I9YHA2,Boss By Hugo Boss For Women Eau De Parfum Spray 3 Oz,http://www.amazon.in/Fragrances/b/ref=sd_allcat_beauty_fragrance/276-6718833-1247838?ie=UTF8&node=1374298031,Rs. 2 980.00,Fragranc,Eau de Toilette,Hugo Boss,http://ecx.images-amazon.com/images/I/41ifdWzXCfL._AA160_.jpg,Rs. 2 980.00,self Colour,Beauty & Health,http://www.amazon.in/Boss-Hugo-Women-Parfum-Spray/dp/B005I9YHA2/ref=sr_1_18/278-5111767-9472601?s=beauty&ie=UTF8&qid=1395126996&sr=1-18,[<a class="buyAction" href="/gp/offer-listing/B005I9YHA2/ref=dp_olp_0/278-5111767-9472601?ie=UTF8&amp;condition=all">these sellers</a>],Amazon.in: Buy Boss By Hugo Boss For Women Eau De Parfum Spray 3 Oz Online at Best Price in India | Amazon Beauty Store,Buy Boss By Hugo Boss For Women Eau De Parfum Spray 3 Oz at lowest price in India on Amazon.in. Check out Boss By Hugo Boss For Women Eau De Parfum Spray 3 Oz reviews  ratings  features  specifications and browse more Beauty products online at best prices on Amazon.in.,None,None,None,18:03:2014,None
B000P22UPQ,Baldessarini Del Mar By Hugo Boss For Men. Eau De Toilette Spray 3 oz,http://www.amazon.in/Fragrances/b/ref=sd_allcat_beauty_fragrance/276-6718833-1247838?ie=UTF8&node=1374298031,None,Fragranc,Eau de Toilette,Hugo Boss,http://ecx.images-amazon.com/images/I/41ifdWzXCfL._AA160_.jpg,None,self Colour,Beauty & Health,http://www.amazon.in/Baldessarini-Hugo-Boss-Toilette-Spray/dp/B000P22UPQ/ref=sr_1_12/278-5111767-9472601?s=beauty&ie=UTF8&qid=1395126996&sr=1-12,[<a href="/gp/help/seller/at-a-glance.html/278-5111767-9472601?ie=UTF8&amp;seller=A3ES9F57NVVRIK">MyLuckyScent</a>],Amazon.in: Buy Baldessarini Del Mar By Hugo Boss For Men. Eau De Toilette Spray 3 oz Online at Best Price in India | Amazon Beauty Store,Buy Baldessarini Del Mar By Hugo Boss For Men. Eau De Toilette Spray 3 oz at lowest price in India on Amazon.in. Check out Baldessarini Del Mar By Hugo Boss For Men. Eau De Toilette Spray 3 oz reviews  ratings  features  specifications and browse more Beauty products online at best prices on Amazon.in.,None,<div class="bucket" id="productDescription"> <h2>Product Description</h2> <div class="content"> <h3 class="productDescriptionSource"></h3> <div class="productDescriptionWrapper">        Launched by the design house of Hugo Boss.When nbsp applying nbsp any fragrance please consider that there are several factors which can affect the natural smell of your skin and in turn the way a scent smells on you. nbsp For instance your mood stress level age body chemistry nbsp diet and current medications may all alter the scents you wear. nbsp nbsp Similarly factor such as dry or oily nbsp skin can even affect the amount of time a fragrance will last after being applied              <div class="emptyClear"> </div> </div> </div> </div>,None,18:03:2014,None
B000RPLZAM,Boss Grey EDT Men  100ml,http://www.amazon.in/Fragrances/b/ref=sd_allcat_beauty_fragrance/276-6718833-1247838?ie=UTF8&node=1374298031,None,Fragranc,Eau de Toilette,Hugo Boss,http://ecx.images-amazon.com/images/I/41ifdWzXCfL._AA160_.jpg,None,self Colour,Beauty & Health,http://www.amazon.in/Boss-Grey-EDT-Men-100ml/dp/B000RPLZAM/ref=sr_1_22/278-5111767-9472601?s=beauty&ie=UTF8&qid=1395126996&sr=1-22,[<a href="/gp/help/seller/at-a-glance.html/278-5111767-9472601?ie=UTF8&amp;seller=ADJ7WREVGU39P">Zephyr Online</a>],Amazon.in: Buy Boss Grey EDT Men  100ml Online at Best Price in India | Amazon Beauty Store,Buy Boss Grey EDT Men  100ml at lowest price in India on Amazon.in. Check out Boss Grey EDT Men  100ml reviews  ratings  features  specifications and browse more Beauty products online at best prices on Amazon.in.,None,<div class="bucket" id="productDescription"> <h2>Product Description</h2> <div class="content"> <h3 class="productDescriptionSource"></h3> <div class="productDescriptionWrapper">        Boss No 6 perfume by Hugo Boss has a fragrant nature that explores essences of fern  bergamot and pineapple. Blended with notes of lavender  juniper and geranium  Boss # 6 is a casual type of fragrance for everyday wear.              <div class="emptyClear"> </div> </div> </div> </div>,None,18:03:2014,None
B0054QLED2,Hugo Boss Just Different for Men  150ml,http://www.amazon.in/Fragrances/b/ref=sd_allcat_beauty_fragrance/276-6718833-1247838?ie=UTF8&node=1374298031,None,Fragranc,Eau de Toilette,Hugo Boss,http://ecx.images-amazon.com/images/I/41ifdWzXCfL._AA160_.jpg,None,self Colour,Beauty & Health,http://www.amazon.in/Hugo-Boss-Just-Different-150ml/dp/B0054QLED2/ref=sr_1_4/278-5111767-9472601?s=beauty&ie=UTF8&qid=1395126996&sr=1-4,[<a href="/gp/help/seller/at-a-glance.html/278-5111767-9472601?ie=UTF8&amp;seller=A3ES9F57NVVRIK">MyLuckyScent</a>],Amazon.in: Buy Hugo Boss Just Different for Men  150ml Online at Best Price in India | Amazon Beauty Store,Buy Hugo Boss Just Different for Men  150ml at lowest price in India on Amazon.in. Check out Hugo Boss Just Different for Men  150ml reviews  ratings  features  specifications and browse more Beauty products online at best prices on Amazon.in.,None,<div class="bucket" id="productDescription"> <h2>Product Description</h2> <div class="content"> <h3 class="productDescriptionSource"></h3> <div class="productDescriptionWrapper">        Year Introduced: 2011  Fragrance Notes: Mint Leaves  Freesia  Basil And Musk.                <div class="emptyClear"> </div> </div> </div> </div>,None,18:03:2014,None
B000C230HQ,Boss In Motion Blue By Hugo Boss For Men. Eau De Toilette Spray 3 Ounces,http://www.amazon.in/Fragrances/b/ref=sd_allcat_beauty_fragrance/276-6718833-1247838?ie=UTF8&node=1374298031,None,Fragranc,Eau de Toilette,Hugo Boss,http://ecx.images-amazon.com/images/I/41ifdWzXCfL._AA160_.jpg,None,self Colour,Beauty & Health,http://www.amazon.in/Boss-Motion-Hugo-Toilette-Ounces/dp/B000C230HQ/ref=sr_1_23/278-5111767-9472601?s=beauty&ie=UTF8&qid=1395126996&sr=1-23,[<a href="/gp/help/seller/at-a-glance.html/278-5111767-9472601?ie=UTF8&amp;seller=A2NFQIUV2YGOLG">Fragume</a>],Amazon.in: Buy Boss In Motion Blue By Hugo Boss For Men. Eau De Toilette Spray 3 Ounces Online at Best Price in India | Amazon Beauty Store,Buy Boss In Motion Blue By Hugo Boss For Men. Eau De Toilette Spray 3 Ounces at lowest price in India on Amazon.in. Check out Boss In Motion Blue By Hugo Boss For Men. Eau De Toilette Spray 3 Ounces reviews  ratings  features  specifications and browse more Beauty products online at best prices on Amazon.in.,None,None,None,18:03:2014,None
B000JL3YGC,Boss In Motion Green Hugo Boss for men 100ml,http://www.amazon.in/Fragrances/b/ref=sd_allcat_beauty_fragrance/276-6718833-1247838?ie=UTF8&node=1374298031,None,Fragranc,Eau de Toilette,Hugo Boss,http://ecx.images-amazon.com/images/I/41ifdWzXCfL._AA160_.jpg,None,self Colour,Beauty & Health,http://www.amazon.in/Boss-Motion-Green-Hugo-100ml/dp/B000JL3YGC/ref=sr_1_26/278-5111767-9472601?s=beauty&ie=UTF8&qid=1395127002&sr=1-26,[<a href="/gp/help/seller/at-a-glance.html/278-5111767-9472601?ie=UTF8&amp;seller=A2NFQIUV2YGOLG">Fragume</a>],Amazon.in: Buy Boss In Motion Green Hugo Boss for men 100ml Online at Best Price in India | Amazon Beauty Store,Buy Boss In Motion Green Hugo Boss for men 100ml at lowest price in India on Amazon.in. Check out Boss In Motion Green Hugo Boss for men 100ml reviews  ratings  features  specifications and browse more Beauty products online at best prices on Amazon.in.,None,<div class="bucket" id="productDescription"> <h2>Product Description</h2> <div class="content"> <h3 class="productDescriptionSource"></h3> <div class="productDescriptionWrapper">        Boss In Motion Green Hugo Boss for men.This is a limited edition from 2005. Boss In Motion Green is a fresh woody and energetic fragrance  intended to dynamic self-assured young man. This new edition is composed around "green" notes with fresh spiciness in the heart and woody notes in the base. The composition opens with fresh mandarin tangerine  sage and a light accord of cognac. The spicy heart includes cardamom  nutmeg and red pepper. Precious woods white cedarwood  patchouli and sandalwood.make strong masculine trail.              <div class="emptyClear"> </div> </div> </div> </div>,None,18:03:2014,None
B005G3A95W,Boss In Motion Orange Made For Summer Hugo Boss for men 90ML,http://www.amazon.in/Fragrances/b/ref=sd_allcat_beauty_fragrance/276-6718833-1247838?ie=UTF8&node=1374298031,None,Fragranc,Eau de Toilette,Hugo Boss,http://ecx.images-amazon.com/images/I/41ifdWzXCfL._AA160_.jpg,None,self Colour,Beauty & Health,http://www.amazon.in/Boss-Motion-Orange-Summer-Hugo/dp/B005G3A95W/ref=sr_1_27/278-5111767-9472601?s=beauty&ie=UTF8&qid=1395127002&sr=1-27,[<a href="/gp/help/seller/at-a-glance.html/278-5111767-9472601?ie=UTF8&amp;seller=A2NFQIUV2YGOLG">Fragume</a>],Amazon.in: Buy Boss In Motion Orange Made For Summer Hugo Boss for men 90ML Online at Best Price in India | Amazon Beauty Store,Buy Boss In Motion Orange Made For Summer Hugo Boss for men 90ML at lowest price in India on Amazon.in. Check out Boss In Motion Orange Made For Summer Hugo Boss for men 90ML reviews  ratings  features  specifications and browse more Beauty products online at best prices on Amazon.in.,None,<div class="bucket" id="productDescription"> <h2>Product Description</h2> <div class="content"> <h3 class="productDescriptionSource"></h3> <div class="productDescriptionWrapper">        Boss In Motion Orange Made For Summer Hugo Boss for men.Hugo Boss adds a new fragrance to the Boss In Motion collection in 2011. Boss In Motion Orange Made For Summer is an aromatic and invigorating summer cocktail  inspired by the youthful Boss Orange collection. The composition's opening is extremely cool and fresh due to mint and passion fruit notes. The heart is sharp and spicy with geranium flower  laid on the base made of vetiver grass.              <div class="emptyClear"> </div> </div> </div> </div>,None,18:03:2014,None
B002XITZA8,Boss In Motion White By Hugo Boss For Men 90 ml,http://www.amazon.in/Fragrances/b/ref=sd_allcat_beauty_fragrance/276-6718833-1247838?ie=UTF8&node=1374298031,None,Fragranc,Eau de Toilette,Hugo Boss,http://ecx.images-amazon.com/images/I/41ifdWzXCfL._AA160_.jpg,None,self Colour,Beauty & Health,http://www.amazon.in/Boss-Motion-White-Hugo-For/dp/B002XITZA8/ref=sr_1_29/278-5111767-9472601?s=beauty&ie=UTF8&qid=1395127002&sr=1-29,[<a href="/gp/help/seller/at-a-glance.html/278-5111767-9472601?ie=UTF8&amp;seller=A22G8HZGXYSWPZ">Taha &amp; Bros.</a>],Amazon.in: Buy Boss In Motion White By Hugo Boss For Men 90 ml Online at Best Price in India | Amazon Beauty Store,Buy Boss In Motion White By Hugo Boss For Men 90 ml at lowest price in India on Amazon.in. Check out Boss In Motion White By Hugo Boss For Men 90 ml reviews  ratings  features  specifications and browse more Beauty products online at best prices on Amazon.in.,None,<div class="bucket" id="productDescription"> <h2>Product Description</h2> <div class="content"> <h3 class="productDescriptionSource"></h3> <div class="productDescriptionWrapper">        Design House: Hugo Boss  Year Introduced: 2009  Recommended Use: Casual  Recommended Use: Casual              <div class="emptyClear"> </div> </div> </div> </div>,None,18:03:2014,None
B0041WNJSS,Boss Orange Sunset Edt 50 ML,http://www.amazon.in/Fragrances/b/ref=sd_allcat_beauty_fragrance/276-6718833-1247838?ie=UTF8&node=1374298031,Rs. 3 449.00,Fragranc,Eau de Toilette,Hugo Boss,http://ecx.images-amazon.com/images/I/41ifdWzXCfL._AA160_.jpg,Rs. 3 449.00,self Colour,Beauty & Health,http://www.amazon.in/Boss-Orange-Sunset-Edt-50/dp/B0041WNJSS/ref=sr_1_35/278-5111767-9472601?s=beauty&ie=UTF8&qid=1395127002&sr=1-35,[<a class="buyAction" href="/gp/offer-listing/B0041WNJSS/ref=dp_olp_0/278-5111767-9472601?ie=UTF8&amp;condition=all">these sellers</a>],Amazon.in: Buy Boss Orange Sunset Edt 50 ML Online at Best Price in India | Amazon Beauty Store,Buy Boss Orange Sunset Edt 50 ML at lowest price in India on Amazon.in. Check out Boss Orange Sunset Edt 50 ML reviews  ratings  features  specifications and browse more Beauty products online at best prices on Amazon.in.,None,<div class="bucket" id="productDescription"> <h2>Product Description</h2> <div class="content"> <h3 class="productDescriptionSource"></h3> <div class="productDescriptionWrapper">        00% Original product Brand: Hugo Boss Launched: 2010 For women Type: floral Size: 75ML Perfect as evening wear              <div class="emptyClear"> </div> </div> </div> </div>,None,18:03:2014,None
B005HSVQAS,Boss Orange Men Edt 100Ml,http://www.amazon.in/Fragrances/b/ref=sd_allcat_beauty_fragrance/276-6718833-1247838?ie=UTF8&node=1374298031,None,Fragranc,Eau de Toilette,Hugo Boss,http://ecx.images-amazon.com/images/I/41ifdWzXCfL._AA160_.jpg,None,self Colour,Beauty & Health,http://www.amazon.in/Boss-Orange-Men-Edt-100Ml/dp/B005HSVQAS/ref=sr_1_34/278-5111767-9472601?s=beauty&ie=UTF8&qid=1395127002&sr=1-34,[<a href="/gp/help/seller/at-a-glance.html/278-5111767-9472601?ie=UTF8&amp;seller=A22G8HZGXYSWPZ">Taha &amp; Bros.</a>],Amazon.in: Buy Boss Orange Men Edt 100Ml Online at Best Price in India | Amazon Beauty Store,Buy Boss Orange Men Edt 100Ml at lowest price in India on Amazon.in. Check out Boss Orange Men Edt 100Ml reviews  ratings  features  specifications and browse more Beauty products online at best prices on Amazon.in.,None,<div class="bucket" id="productDescription"> <h2>Product Description</h2> <div class="content"> <h3 class="productDescriptionSource"></h3> <div class="productDescriptionWrapper">        Boss Orange for Men is a powerful scent that embodies free  optimistic and joyful spirit of a man. That man is passionate  casual  spontaneous and relaxed. The composition is intensely spicy with notes of fresh apple  vanilla  warm incense and exotic African Bubinga wood. The brand chose the actor Orlando Bloom for their campaign  as his appearance  his style  personality and cool attitude perfectly embody the image of the Boss Orange brand. The campaign is shot by the photographer Steven Klein. Boss Orange for Men is available from 1st February 2011 as 60 and 100 ml EDT with an accompanying collection including 60 and 100 ml after shave lotion  75 ml after shave balm  150 ml deodorant spray and 75 ml deodorant stick.              <div class="emptyClear"> </div> </div> </div> </div>,None,18:03:2014,None
B00C4A368W,Hugo Boss Baldessarini Ambre Eau De Toilette Spray  88.72ml,http://www.amazon.in/Fragrances/b/ref=sd_allcat_beauty_fragrance/276-6718833-1247838?ie=UTF8&node=1374298031,None,Fragranc,Eau de Toilette,Hugo Boss,http://ecx.images-amazon.com/images/I/41ifdWzXCfL._AA160_.jpg,None,self Colour,Beauty & Health,http://www.amazon.in/Hugo-Boss-Baldessarini-Toilette-88-72ml/dp/B00C4A368W/ref=sr_1_45/278-5111767-9472601?s=beauty&ie=UTF8&qid=1395127002&sr=1-45,[<a href="/gp/help/seller/at-a-glance.html/278-5111767-9472601?ie=UTF8&amp;seller=A3ES9F57NVVRIK">MyLuckyScent</a>],Amazon.in: Buy Hugo Boss Baldessarini Ambre Eau De Toilette Spray  88.72ml Online at Best Price in India | Amazon Beauty Store,Buy Hugo Boss Baldessarini Ambre Eau De Toilette Spray  88.72ml at lowest price in India on Amazon.in. Check out Hugo Boss Baldessarini Ambre Eau De Toilette Spray  88.72ml reviews  ratings  features  specifications and browse more Beauty products online at best prices on Amazon.in.,None,<div class="bucket" id="productDescription"> <h2>Product Description</h2> <div class="content"> <h3 class="productDescriptionSource"></h3> <div class="productDescriptionWrapper">        Design House: Hugo Boss  Year Introduced: 2007  Recommended Use: Casual  Recommended Use: Casual              <div class="emptyClear"> </div> </div> </div> </div>,None,18:03:2014,None
B0084YCFR0,Hugo Boss Boss Soul Men 90ML EDT,http://www.amazon.in/Fragrances/b/ref=sd_allcat_beauty_fragrance/276-6718833-1247838?ie=UTF8&node=1374298031,Rs. 2 610.00,Fragranc,Eau de Toilette,Hugo Boss,http://ecx.images-amazon.com/images/I/41ifdWzXCfL._AA160_.jpg,Rs. 2 610.00,self Colour,Beauty & Health,http://www.amazon.in/Hugo-Boss-Soul-Men-90ML/dp/B0084YCFR0/ref=sr_1_47/278-5111767-9472601?s=beauty&ie=UTF8&qid=1395127002&sr=1-47,[<a class="buyAction" href="/gp/offer-listing/B0084YCFR0/ref=dp_olp_0/278-5111767-9472601?ie=UTF8&amp;condition=all">these sellers</a>],Amazon.in: Buy Hugo Boss Boss Soul Men 90ML EDT Online at Best Price in India | Amazon Beauty Store,Buy Hugo Boss Boss Soul Men 90ML EDT at lowest price in India on Amazon.in. Check out Hugo Boss Boss Soul Men 90ML EDT reviews  ratings  features  specifications and browse more Beauty products online at best prices on Amazon.in.,None,None,None,18:03:2014,None
B000UU6E6O,Hugo Boss Collector Edition for Men  100ml,http://www.amazon.in/Fragrances/b/ref=sd_allcat_beauty_fragrance/276-6718833-1247838?ie=UTF8&node=1374298031,None,Fragranc,Eau de Toilette,Hugo Boss,http://ecx.images-amazon.com/images/I/41ifdWzXCfL._AA160_.jpg,None,self Colour,Beauty & Health,http://www.amazon.in/Hugo-Boss-Collector-Edition-100ml/dp/B000UU6E6O/ref=sr_1_51/278-5111767-9472601?s=beauty&ie=UTF8&qid=1395127009&sr=1-51,[<a href="/gp/help/seller/at-a-glance.html/278-5111767-9472601?ie=UTF8&amp;seller=A2O8H5ZZSCKU2K">Perfume Crush</a>],Amazon.in: Buy Hugo Boss Collector Edition for Men  100ml Online at Best Price in India | Amazon Beauty Store,Buy Hugo Boss Collector Edition for Men  100ml at lowest price in India on Amazon.in. Check out Hugo Boss Collector Edition for Men  100ml reviews  ratings  features  specifications and browse more Beauty products online at best prices on Amazon.in.,None,<div class="bucket" id="productDescription"> <h2>Product Description</h2> <div class="content"> <h3 class="productDescriptionSource"></h3> <div class="productDescriptionWrapper">        A Fragrance Worth Cherishing Boss Collector'S Edition An Eau De Toilette For Men By Hugo Boss Is An Intense   Masculine And Refreshing Fragrance . The Other Ingredients Of The Fragrance Include Alcohol Denat  Aqua/ Water  Parfum / Fragrance Linalool                <div class="emptyClear"> </div> </div> </div> </div>,None,18:03:2014,None
