B00FQF4C30,Skipper Scattered Playing Cards Blended Cushion Cover - Multicolor,http://www.amazon.in/Cushions-Cushion-Covers/b/ref=sd_allcat_cushions?ie=UTF8&node=1380469031,None,Cushions & Cushion Cover,Cushions & Cushion Cover,skipper,http://ecx.images-amazon.com/images/I/61tsxWL7mVL._AA160_.jpg,Rs. 299.00,self Colour,Home & Kitchen,http://www.amazon.in/Skipper-Scattered-Playing-Blended-Cushion/dp/B00FQF4C30/ref=sr_1_21/279-8772023-7637911?s=kitchen&ie=UTF8&qid=1395127013&sr=1-21,[<a href="/gp/help/seller/at-a-glance.html/279-8772023-7637911?ie=UTF8&amp;seller=A1MZL298BH4HVW">Skipper Furnishings</a>],Skipper Scattered Playing Cards Blended Cushion Cover - Multicolor: Amazon.in: Home & Kitchen,Skipper Scattered Playing Cards Blended Cushion Cover - Multicolor: Amazon.in: Home & Kitchen,None,<div class="bucket" id="productDescription"> <h2>Product Description</h2> <div class="content"> <h3 class="productDescriptionSource"></h3> <div class="productDescriptionWrapper">        Give your room décor a funky overhaul by introducing this piece of multicoloured cushion covers from Skipper to it. The modish digital print gives it a touch of welcoming vibrancy  thus making it a visual treat. Furthermore  its gives a soft feel  but also exudes its own subtle sheen.              <div class="emptyClear"> </div> </div> </div> </div>,None,18:03:2014,None
B00FQF4G22,Skipper I Love Kolkata Blended Cushion Cover - Multicolor,http://www.amazon.in/Cushions-Cushion-Covers/b/ref=sd_allcat_cushions?ie=UTF8&node=1380469031,None,Cushions & Cushion Cover,Cushions & Cushion Cover,skipper,http://ecx.images-amazon.com/images/I/61tsxWL7mVL._AA160_.jpg,Rs. 399.00,self Colour,Home & Kitchen,http://www.amazon.in/Skipper-Kolkata-Blended-Cushion-Cover/dp/B00FQF4G22/ref=sr_1_15/279-8772023-7637911?s=kitchen&ie=UTF8&qid=1395127013&sr=1-15,[<a href="/gp/help/seller/at-a-glance.html/279-8772023-7637911?ie=UTF8&amp;seller=A1MZL298BH4HVW">Skipper Furnishings</a>],Skipper I Love Kolkata Blended Cushion Cover - Multicolor: Amazon.in: Home & Kitchen,Skipper I Love Kolkata Blended Cushion Cover - Multicolor: Amazon.in: Home & Kitchen,None,<div class="bucket" id="productDescription"> <h2>Product Description</h2> <div class="content"> <h3 class="productDescriptionSource"></h3> <div class="productDescriptionWrapper">        Give your room décor a funky overhaul by introducing this piece of multicoloured cushion covers from Skipper to it. The modish digital print gives it a touch of welcoming vibrancy  thus making it a visual treat. Furthermore  its gives a soft feel  but also exudes its own subtle sheen.              <div class="emptyClear"> </div> </div> </div> </div>,None,18:03:2014,None
B00FQF5A3G,Skipper Krrish3 Masks Blended Cushion Cover - Multicolor,http://www.amazon.in/Cushions-Cushion-Covers/b/ref=sd_allcat_cushions?ie=UTF8&node=1380469031,None,Cushions & Cushion Cover,Cushions & Cushion Cover,skipper,http://ecx.images-amazon.com/images/I/61tsxWL7mVL._AA160_.jpg,Rs. 399.00,Simba Krrish Face Mask Plastic  Multi Color,Home & Kitchen,http://www.amazon.in/Skipper-Krrish3-Masks-Blended-Cushion/dp/B00FQF5A3G/ref=sr_1_2/280-0483197-3561341?s=kitchen&ie=UTF8&qid=1395127038&sr=1-2,[<a href="/gp/help/seller/at-a-glance.html/280-0483197-3561341?ie=UTF8&amp;seller=A1MZL298BH4HVW">Skipper Furnishings</a>],Skipper Krrish3 Masks Blended Cushion Cover - Multicolor: Amazon.in: Home & Kitchen,Skipper Krrish3 Masks Blended Cushion Cover - Multicolor: Amazon.in: Home & Kitchen,None,<div class="bucket" id="productDescription"> <h2>Product Description</h2> <div class="content"> <h3 class="productDescriptionSource"></h3> <div class="productDescriptionWrapper">        For all 'Krrish' fans! This digital print cushion cover is perfect for your rooms. This 'power-packed' coloured cushion cover is light in weight and easy to wash.              <div class="emptyClear"> </div> </div> </div> </div>,None,18:03:2014,None
B00FQF596Y,Skipper Krrish3 The Fighters Blended Cushion Cover - Multicolor,http://www.amazon.in/Cushions-Cushion-Covers/b/ref=sd_allcat_cushions?ie=UTF8&node=1380469031,None,Cushions & Cushion Cover,Cushions & Cushion Cover,skipper,http://ecx.images-amazon.com/images/I/61tsxWL7mVL._AA160_.jpg,Rs. 399.00,self Colour,Home & Kitchen,http://www.amazon.in/Skipper-Krrish3-Fighters-Blended-Cushion/dp/B00FQF596Y/ref=sr_1_3/280-0483197-3561341?s=kitchen&ie=UTF8&qid=1395127038&sr=1-3,[<a href="/gp/help/seller/at-a-glance.html/280-0483197-3561341?ie=UTF8&amp;seller=A1MZL298BH4HVW">Skipper Furnishings</a>],Skipper Krrish3 The Fighters Blended Cushion Cover - Multicolor: Amazon.in: Home & Kitchen,Skipper Krrish3 The Fighters Blended Cushion Cover - Multicolor: Amazon.in: Home & Kitchen,None,<div class="bucket" id="productDescription"> <h2>Product Description</h2> <div class="content"> <h3 class="productDescriptionSource"></h3> <div class="productDescriptionWrapper">        For all 'Krrish' fans! This digital print cushion cover is perfect for your rooms. This 'power-packed' coloured cushion cover is light in weight and easy to wash.              <div class="emptyClear"> </div> </div> </div> </div>,None,18:03:2014,None
B00FQF4WBC,Skipper Chacha Chaudhary Crossword Blended Cushion Cover - Multicolor,http://www.amazon.in/Cushions-Cushion-Covers/b/ref=sd_allcat_cushions?ie=UTF8&node=1380469031,None,Cushions & Cushion Cover,Cushions & Cushion Cover,skipper,http://ecx.images-amazon.com/images/I/61tsxWL7mVL._AA160_.jpg,Rs. 399.00,self Colour,Home & Kitchen,http://www.amazon.in/Skipper-Chaudhary-Crossword-Blended-Cushion/dp/B00FQF4WBC/ref=sr_1_7/280-0483197-3561341?s=kitchen&ie=UTF8&qid=1395127038&sr=1-7,[<a href="/gp/help/seller/at-a-glance.html/280-0483197-3561341?ie=UTF8&amp;seller=A1MZL298BH4HVW">Skipper Furnishings</a>],Skipper Chacha Chaudhary Crossword Blended Cushion Cover - Multicolor: Amazon.in: Home & Kitchen,Skipper Chacha Chaudhary Crossword Blended Cushion Cover - Multicolor: Amazon.in: Home & Kitchen,None,<div class="bucket" id="productDescription"> <h2>Product Description</h2> <div class="content"> <h3 class="productDescriptionSource"></h3> <div class="productDescriptionWrapper">        Featuring a fabulous 'Chacha Chaudhary' digital print  this cushion cover will be a perfect pick for your home. This multi-coloured cushion cover is light in weight and easy to wash              <div class="emptyClear"> </div> </div> </div> </div>,None,18:03:2014,None
B00FQF4JYC,Skipper Woman Attitude Blended Cushion Cover - Multicolor,http://www.amazon.in/Cushions-Cushion-Covers/b/ref=sd_allcat_cushions?ie=UTF8&node=1380469031,None,Cushions & Cushion Cover,Cushions & Cushion Cover,skipper,http://ecx.images-amazon.com/images/I/61tsxWL7mVL._AA160_.jpg,Rs. 399.00,self Colour,Home & Kitchen,http://www.amazon.in/Skipper-Woman-Attitude-Blended-Cushion/dp/B00FQF4JYC/ref=sr_1_22/279-8772023-7637911?s=kitchen&ie=UTF8&qid=1395127013&sr=1-22,[<a href="/gp/help/seller/at-a-glance.html/279-8772023-7637911?ie=UTF8&amp;seller=A1MZL298BH4HVW">Skipper Furnishings</a>],Skipper Woman Attitude Blended Cushion Cover - Multicolor: Amazon.in: Home & Kitchen,Skipper Woman Attitude Blended Cushion Cover - Multicolor: Amazon.in: Home & Kitchen,None,<div class="bucket" id="productDescription"> <h2>Product Description</h2> <div class="content"> <h3 class="productDescriptionSource"></h3> <div class="productDescriptionWrapper">        Give your room décor a funky overhaul by introducing this piece of multicoloured cushion covers from Skipper to it. The modish digital print gives it a touch of welcoming vibrancy  thus making it a visual treat. Furthermore  its gives a soft feel  but also exudes its own subtle sheen.              <div class="emptyClear"> </div> </div> </div> </div>,None,18:03:2014,None
B00HM0WYQY,Skipper Batik Polyester Cushion Cover - Silver,http://www.amazon.in/Cushions-Cushion-Covers/b/ref=sd_allcat_cushions?ie=UTF8&node=1380469031,None,Cushions & Cushion Cover,Cushions & Cushion Cover,skipper,http://ecx.images-amazon.com/images/I/61tsxWL7mVL._AA160_.jpg,Rs. 399.00,self Colour,Home & Kitchen,http://www.amazon.in/Skipper-Batik-Polyester-Cushion-Cover/dp/B00HM0WYQY/ref=sr_1_6/280-0483197-3561341?s=kitchen&ie=UTF8&qid=1395127038&sr=1-6,[<a href="/gp/help/seller/at-a-glance.html/280-0483197-3561341?ie=UTF8&amp;seller=A1MZL298BH4HVW">Skipper Furnishings</a>],Skipper Batik Polyester Cushion Cover - Silver: Amazon.in: Home & Kitchen,Skipper Batik Polyester Cushion Cover - Silver: Amazon.in: Home & Kitchen,None,<div class="bucket" id="productDescription"> <h2>Product Description</h2> <div class="content"> <h3 class="productDescriptionSource"></h3> <div class="productDescriptionWrapper">        These cushion covers follow a decorative sequence pattern that makes them appealing. Made from sturdy polyester fabric  these cushion covers are durable and skin friendly. The zipper closure secures the cushion inside.              <div class="emptyClear"> </div> </div> </div> </div>,None,18:03:2014,None
B00HM0WRYI,Skipper Floral Cotton Cushion Cover - Black,http://www.amazon.in/Cushions-Cushion-Covers/b/ref=sd_allcat_cushions?ie=UTF8&node=1380469031,None,Cushions & Cushion Cover,Cushions & Cushion Cover,skipper,http://ecx.images-amazon.com/images/I/61tsxWL7mVL._AA160_.jpg,Rs. 549.00,self Colour,Home & Kitchen,http://www.amazon.in/Skipper-Floral-Cotton-Cushion-Cover/dp/B00HM0WRYI/ref=sr_1_12/280-0483197-3561341?s=kitchen&ie=UTF8&qid=1395127038&sr=1-12,[<a href="/gp/help/seller/at-a-glance.html/280-0483197-3561341?ie=UTF8&amp;seller=A1MZL298BH4HVW">Skipper Furnishings</a>],Skipper Floral Cotton Cushion Cover - Black: Amazon.in: Home & Kitchen,Skipper Floral Cotton Cushion Cover - Black: Amazon.in: Home & Kitchen,None,<div class="bucket" id="productDescription"> <h2>Product Description</h2> <div class="content"> <h3 class="productDescriptionSource"></h3> <div class="productDescriptionWrapper">        These cushion covers follow a designer pattern that makes them appealing. Made from comfort cotton fabric  these cushion covers are durable and skin friendly. The zipper closure secures the cushion inside.              <div class="emptyClear"> </div> </div> </div> </div>,None,18:03:2014,None
B00FQF4XMA,Skipper Chacha Chaudhary Loves Pink City Blended Cushion Cover - Multicolor,http://www.amazon.in/Cushions-Cushion-Covers/b/ref=sd_allcat_cushions?ie=UTF8&node=1380469031,None,Cushions & Cushion Cover,Cushions & Cushion Cover,skipper,http://ecx.images-amazon.com/images/I/61tsxWL7mVL._AA160_.jpg,Rs. 399.00,self Colour,Home & Kitchen,http://www.amazon.in/Skipper-Chacha-Chaudhary-Blended-Cushion/dp/B00FQF4XMA/ref=sr_1_8/280-0483197-3561341?s=kitchen&ie=UTF8&qid=1395127038&sr=1-8,[<a href="/gp/help/seller/at-a-glance.html/280-0483197-3561341?ie=UTF8&amp;seller=A1MZL298BH4HVW">Skipper Furnishings</a>],Skipper Chacha Chaudhary Loves Pink City Blended Cushion Cover - Multicolor: Amazon.in: Home & Kitchen,Skipper Chacha Chaudhary Loves Pink City Blended Cushion Cover - Multicolor: Amazon.in: Home & Kitchen,None,<div class="bucket" id="productDescription"> <h2>Product Description</h2> <div class="content"> <h3 class="productDescriptionSource"></h3> <div class="productDescriptionWrapper">        Featuring a fabulous 'Chacha Chaudhary' digital print  this cushion cover will be a perfect pick for your home. This multi-coloured cushion cover is light in weight and easy to wash              <div class="emptyClear"> </div> </div> </div> </div>,None,18:03:2014,None
B00HM0WN10,Skipper Argyle Velvet Cushion Cover - White,http://www.amazon.in/Cushions-Cushion-Covers/b/ref=sd_allcat_cushions?ie=UTF8&node=1380469031,None,Cushions & Cushion Cover,Cushions & Cushion Cover,skipper,http://ecx.images-amazon.com/images/I/61tsxWL7mVL._AA160_.jpg,Rs. 399.00,self Colour,Home & Kitchen,http://www.amazon.in/Skipper-Argyle-Velvet-Cushion-Cover/dp/B00HM0WN10/ref=sr_1_5/280-0483197-3561341?s=kitchen&ie=UTF8&qid=1395127038&sr=1-5,[<a href="/gp/help/seller/at-a-glance.html/280-0483197-3561341?ie=UTF8&amp;seller=A1MZL298BH4HVW">Skipper Furnishings</a>],Skipper Argyle Velvet Cushion Cover - White: Amazon.in: Home & Kitchen,Skipper Argyle Velvet Cushion Cover - White: Amazon.in: Home & Kitchen,None,<div class="bucket" id="productDescription"> <h2>Product Description</h2> <div class="content"> <h3 class="productDescriptionSource"></h3> <div class="productDescriptionWrapper">        These cushion covers follow a designer pattern that makes them appealing. Made from sturdy velvet fabric  these cushion covers are durable and skin friendly. The zipper closure secures the cushion inside.              <div class="emptyClear"> </div> </div> </div> </div>,None,18:03:2014,None
B00FQF4SHU,Skipper Antique Book Blended Cushion Cover - Multicolor,http://www.amazon.in/Cushions-Cushion-Covers/b/ref=sd_allcat_cushions?ie=UTF8&node=1380469031,None,Cushions & Cushion Cover,Cushions & Cushion Cover,skipper,http://ecx.images-amazon.com/images/I/61tsxWL7mVL._AA160_.jpg,Rs. 399.00,self Colour,Home & Kitchen,http://www.amazon.in/Skipper-Antique-Blended-Cushion-Cover/dp/B00FQF4SHU/ref=sr_1_4/280-0483197-3561341?s=kitchen&ie=UTF8&qid=1395127038&sr=1-4,[<a href="/gp/help/seller/at-a-glance.html/280-0483197-3561341?ie=UTF8&amp;seller=A1MZL298BH4HVW">Skipper Furnishings</a>],Skipper Antique Book Blended Cushion Cover - Multicolor: Amazon.in: Home & Kitchen,Skipper Antique Book Blended Cushion Cover - Multicolor: Amazon.in: Home & Kitchen,None,<div class="bucket" id="productDescription"> <h2>Product Description</h2> <div class="content"> <h3 class="productDescriptionSource"></h3> <div class="productDescriptionWrapper">        Give your room décor a funky overhaul by introducing this piece of multicoloured cushion covers from Skipper to it. The modish digital print gives it a touch of welcoming vibrancy  thus making it a visual treat. Furthermore  its gives a soft feel  but also exudes its own subtle sheen.              <div class="emptyClear"> </div> </div> </div> </div>,None,18:03:2014,None
B00FQF5EN2,Skipper Krrish and Kaal Blended Cushion Cover - Multicolor,http://www.amazon.in/Cushions-Cushion-Covers/b/ref=sd_allcat_cushions?ie=UTF8&node=1380469031,None,Cushions & Cushion Cover,Cushions & Cushion Cover,skipper,http://ecx.images-amazon.com/images/I/61tsxWL7mVL._AA160_.jpg,Rs. 399.00,self Colour,Home & Kitchen,http://www.amazon.in/Skipper-Krrish-Blended-Cushion-Cover/dp/B00FQF5EN2/ref=sr_1_16/280-0483197-3561341?s=kitchen&ie=UTF8&qid=1395127038&sr=1-16,[<a href="/gp/help/seller/at-a-glance.html/280-0483197-3561341?ie=UTF8&amp;seller=A1MZL298BH4HVW">Skipper Furnishings</a>],Skipper Krrish and Kaal Blended Cushion Cover - Multicolor: Amazon.in: Home & Kitchen,Skipper Krrish and Kaal Blended Cushion Cover - Multicolor: Amazon.in: Home & Kitchen,None,<div class="bucket" id="productDescription"> <h2>Product Description</h2> <div class="content"> <h3 class="productDescriptionSource"></h3> <div class="productDescriptionWrapper">        For all 'Krrish' fans! This digital print cushion cover is perfect for your rooms. This 'power-packed' coloured cushion cover is light in weight and easy to wash.              <div class="emptyClear"> </div> </div> </div> </div>,None,18:03:2014,None
B00FQF49A6,Skipper Frogs for Kids Blended Cushion Cover - Multicolor,http://www.amazon.in/Cushions-Cushion-Covers/b/ref=sd_allcat_cushions?ie=UTF8&node=1380469031,None,Cushions & Cushion Cover,Cushions & Cushion Cover,skipper,http://ecx.images-amazon.com/images/I/61tsxWL7mVL._AA160_.jpg,Rs. 299.00,self Colour,Home & Kitchen,http://www.amazon.in/Skipper-Frogs-Blended-Cushion-Cover/dp/B00FQF49A6/ref=sr_1_13/280-0483197-3561341?s=kitchen&ie=UTF8&qid=1395127038&sr=1-13,[<a href="/gp/help/seller/at-a-glance.html/280-0483197-3561341?ie=UTF8&amp;seller=A1MZL298BH4HVW">Skipper Furnishings</a>],Skipper Frogs for Kids Blended Cushion Cover - Multicolor: Amazon.in: Home & Kitchen,Skipper Frogs for Kids Blended Cushion Cover - Multicolor: Amazon.in: Home & Kitchen,None,<div class="bucket" id="productDescription"> <h2>Product Description</h2> <div class="content"> <h3 class="productDescriptionSource"></h3> <div class="productDescriptionWrapper">        Give your room décor a funky overhaul by introducing this piece of multicoloured cushion covers from Skipper to it. The modish digital print gives it a touch of welcoming vibrancy  thus making it a visual treat. Furthermore  its gives a soft feel  but also exudes its own subtle sheen.              <div class="emptyClear"> </div> </div> </div> </div>,None,18:03:2014,None
B00H1RMEYU,Skipper Cotton Cushion Cover - Red (2536),http://www.amazon.in/Cushions-Cushion-Covers/b/ref=sd_allcat_cushions?ie=UTF8&node=1380469031,None,Cushions & Cushion Cover,Cushions & Cushion Cover,skipper,http://ecx.images-amazon.com/images/I/61tsxWL7mVL._AA160_.jpg,Rs. 183.00,self Colour,Home & Kitchen,http://www.amazon.in/Skipper-Cotton-Cushion-Cover-Red/dp/B00H1RMEYU/ref=sr_1_11/280-0483197-3561341?s=kitchen&ie=UTF8&qid=1395127038&sr=1-11,[<a href="/gp/help/seller/at-a-glance.html/280-0483197-3561341?ie=UTF8&amp;seller=A1MZL298BH4HVW">Skipper Furnishings</a>],Skipper Cotton Cushion Cover - Red (2536): Amazon.in: Home & Kitchen,Skipper Cotton Cushion Cover - Red (2536): Amazon.in: Home & Kitchen,None,<div class="bucket" id="productDescription"> <h2>Product Description</h2> <div class="content"> <h3 class="productDescriptionSource"></h3> <div class="productDescriptionWrapper">        Enhance your room interiors with the addition of these cushion covers featuring a decorative design. The cotton fabric ensures durability  while the zipper closure secures the cushion inside.              <div class="emptyClear"> </div> </div> </div> </div>,None,18:03:2014,None
B00H1RMFDU,Skipper Cotton Cushion Cover - Grey (2529),http://www.amazon.in/Cushions-Cushion-Covers/b/ref=sd_allcat_cushions?ie=UTF8&node=1380469031,None,Cushions & Cushion Cover,Cushions & Cushion Cover,skipper,http://ecx.images-amazon.com/images/I/61tsxWL7mVL._AA160_.jpg,Rs. 183.00,self Colour,Home & Kitchen,http://www.amazon.in/Skipper-Cotton-Cushion-Cover-Grey/dp/B00H1RMFDU/ref=sr_1_10/280-0483197-3561341?s=kitchen&ie=UTF8&qid=1395127038&sr=1-10,[<a href="/gp/help/seller/at-a-glance.html/280-0483197-3561341?ie=UTF8&amp;seller=A1MZL298BH4HVW">Skipper Furnishings</a>],Skipper Cotton Cushion Cover - Grey (2529): Amazon.in: Home & Kitchen,Skipper Cotton Cushion Cover - Grey (2529): Amazon.in: Home & Kitchen,None,<div class="bucket" id="productDescription"> <h2>Product Description</h2> <div class="content"> <h3 class="productDescriptionSource"></h3> <div class="productDescriptionWrapper">        Enhance your room interiors with the addition of these cushion covers featuring a decorative design. The cotton fabric ensures durability  while the zipper closure secures the cushion inside.              <div class="emptyClear"> </div> </div> </div> </div>,None,18:03:2014,None
B00FQF5I5G,Skipper Chacha Chaudhary Plays Cricket Blended Cushion Cover - Multicolor,http://www.amazon.in/Cushions-Cushion-Covers/b/ref=sd_allcat_cushions?ie=UTF8&node=1380469031,None,Cushions & Cushion Cover,Cushions & Cushion Cover,skipper,http://ecx.images-amazon.com/images/I/61tsxWL7mVL._AA160_.jpg,Rs. 399.00,self Colour,Home & Kitchen,http://www.amazon.in/Skipper-Chaudhary-Cricket-Blended-Cushion/dp/B00FQF5I5G/ref=sr_1_9/280-0483197-3561341?s=kitchen&ie=UTF8&qid=1395127038&sr=1-9,[<a href="/gp/help/seller/at-a-glance.html/280-0483197-3561341?ie=UTF8&amp;seller=A1MZL298BH4HVW">Skipper Furnishings</a>],Skipper Chacha Chaudhary Plays Cricket Blended Cushion Cover - Multicolor: Amazon.in: Home & Kitchen,Skipper Chacha Chaudhary Plays Cricket Blended Cushion Cover - Multicolor: Amazon.in: Home & Kitchen,None,<div class="bucket" id="productDescription"> <h2>Product Description</h2> <div class="content"> <h3 class="productDescriptionSource"></h3> <div class="productDescriptionWrapper">        Featuring a fabulous 'Chacha Chaudhary' digital print  this cushion cover will be a perfect pick for your home. This multi-coloured cushion cover is light in weight and easy to wash              <div class="emptyClear"> </div> </div> </div> </div>,None,18:03:2014,None
B00HM0WTAA,Skipper Geometric Cotton Cushion Cover - Beige,http://www.amazon.in/Cushions-Cushion-Covers/b/ref=sd_allcat_cushions?ie=UTF8&node=1380469031,None,Cushions & Cushion Cover,Cushions & Cushion Cover,skipper,http://ecx.images-amazon.com/images/I/61tsxWL7mVL._AA160_.jpg,Rs. 499.00,self Colour,Home & Kitchen,http://www.amazon.in/Skipper-Geometric-Cotton-Cushion-Cover/dp/B00HM0WTAA/ref=sr_1_14/280-0483197-3561341?s=kitchen&ie=UTF8&qid=1395127038&sr=1-14,[<a href="/gp/help/seller/at-a-glance.html/280-0483197-3561341?ie=UTF8&amp;seller=A1MZL298BH4HVW">Skipper Furnishings</a>],Skipper Geometric Cotton Cushion Cover - Beige: Amazon.in: Home & Kitchen,Skipper Geometric Cotton Cushion Cover - Beige: Amazon.in: Home & Kitchen,None,<div class="bucket" id="productDescription"> <h2>Product Description</h2> <div class="content"> <h3 class="productDescriptionSource"></h3> <div class="productDescriptionWrapper">        These cushion covers follow a designer pattern that makes them appealing. Made from comfort cotton fabric with printed designs  these cushion covers are durable and skin friendly. The zipper closure secures the cushion inside.              <div class="emptyClear"> </div> </div> </div> </div>,None,18:03:2014,None
B00FQF4G22,Skipper I Love Kolkata Blended Cushion Cover - Multicolor,http://www.amazon.in/Cushions-Cushion-Covers/b/ref=sd_allcat_cushions?ie=UTF8&node=1380469031,None,Cushions & Cushion Cover,Cushions & Cushion Cover,skipper,http://ecx.images-amazon.com/images/I/61tsxWL7mVL._AA160_.jpg,Rs. 399.00,self Colour,Home & Kitchen,http://www.amazon.in/Skipper-Kolkata-Blended-Cushion-Cover/dp/B00FQF4G22/ref=sr_1_15/280-0483197-3561341?s=kitchen&ie=UTF8&qid=1395127038&sr=1-15,[<a href="/gp/help/seller/at-a-glance.html/280-0483197-3561341?ie=UTF8&amp;seller=A1MZL298BH4HVW">Skipper Furnishings</a>],Skipper I Love Kolkata Blended Cushion Cover - Multicolor: Amazon.in: Home & Kitchen,Skipper I Love Kolkata Blended Cushion Cover - Multicolor: Amazon.in: Home & Kitchen,None,<div class="bucket" id="productDescription"> <h2>Product Description</h2> <div class="content"> <h3 class="productDescriptionSource"></h3> <div class="productDescriptionWrapper">        Give your room décor a funky overhaul by introducing this piece of multicoloured cushion covers from Skipper to it. The modish digital print gives it a touch of welcoming vibrancy  thus making it a visual treat. Furthermore  its gives a soft feel  but also exudes its own subtle sheen.              <div class="emptyClear"> </div> </div> </div> </div>,None,18:03:2014,None
B00FQF5DMO,Skipper Krrish3 Kaal Blended Cushion Cover - Multicolor,http://www.amazon.in/Cushions-Cushion-Covers/b/ref=sd_allcat_cushions?ie=UTF8&node=1380469031,None,Cushions & Cushion Cover,Cushions & Cushion Cover,skipper,http://ecx.images-amazon.com/images/I/61tsxWL7mVL._AA160_.jpg,Rs. 399.00,self Colour,Home & Kitchen,http://www.amazon.in/Skipper-Krrish3-Blended-Cushion-Cover/dp/B00FQF5DMO/ref=sr_1_17/280-0483197-3561341?s=kitchen&ie=UTF8&qid=1395127038&sr=1-17,[<a href="/gp/help/seller/at-a-glance.html/280-0483197-3561341?ie=UTF8&amp;seller=A1MZL298BH4HVW">Skipper Furnishings</a>],Skipper Krrish3 Kaal Blended Cushion Cover - Multicolor: Amazon.in: Home & Kitchen,Skipper Krrish3 Kaal Blended Cushion Cover - Multicolor: Amazon.in: Home & Kitchen,None,<div class="bucket" id="productDescription"> <h2>Product Description</h2> <div class="content"> <h3 class="productDescriptionSource"></h3> <div class="productDescriptionWrapper">        For all 'Krrish' fans! This digital print cushion cover is perfect for your rooms. This 'power-packed' coloured cushion cover is light in weight and easy to wash.              <div class="emptyClear"> </div> </div> </div> </div>,None,18:03:2014,None
B00FQF4H6C,Skipper Mary Had A Little Lamb Blended Cushion Cover - Multicolor,http://www.amazon.in/Cushions-Cushion-Covers/b/ref=sd_allcat_cushions?ie=UTF8&node=1380469031,None,Cushions & Cushion Cover,Cushions & Cushion Cover,skipper,http://ecx.images-amazon.com/images/I/61tsxWL7mVL._AA160_.jpg,Rs. 399.00,self Colour,Home & Kitchen,http://www.amazon.in/Skipper-Little-Blended-Cushion-Cover/dp/B00FQF4H6C/ref=sr_1_18/280-0483197-3561341?s=kitchen&ie=UTF8&qid=1395127038&sr=1-18,[<a href="/gp/help/seller/at-a-glance.html/280-0483197-3561341?ie=UTF8&amp;seller=A1MZL298BH4HVW">Skipper Furnishings</a>],Skipper Mary Had A Little Lamb Blended Cushion Cover - Multicolor: Amazon.in: Home & Kitchen,Skipper Mary Had A Little Lamb Blended Cushion Cover - Multicolor: Amazon.in: Home & Kitchen,None,<div class="bucket" id="productDescription"> <h2>Product Description</h2> <div class="content"> <h3 class="productDescriptionSource"></h3> <div class="productDescriptionWrapper">        Give your room décor a funky overhaul by introducing this piece of multicoloured cushion covers from Skipper to it. The modish digital print gives it a touch of welcoming vibrancy  thus making it a visual treat. Furthermore  its gives a soft feel  but also exudes its own subtle sheen.              <div class="emptyClear"> </div> </div> </div> </div>,None,18:03:2014,None
