B00H1RMI1E,Skipper Polyester Cushion Cover - Blue,http://www.amazon.in/Cushions-Cushion-Covers/b/ref=sd_allcat_cushions?ie=UTF8&node=1380469031,None,Cushions & Cushion Cover,Cushions & Cushion Cover,skipper,http://ecx.images-amazon.com/images/I/61tsxWL7mVL._AA160_.jpg,Rs. 283.00,self Colour,Home & Kitchen,http://www.amazon.in/Skipper-Polyester-Cushion-Cover-Blue/dp/B00H1RMI1E/ref=sr_1_19/280-1123240-9275852?s=kitchen&ie=UTF8&qid=1395127191&sr=1-19,[<a href="/gp/help/seller/at-a-glance.html/280-1123240-9275852?ie=UTF8&amp;seller=A1MZL298BH4HVW">Skipper Furnishings</a>],Skipper Polyester Cushion Cover - Blue: Amazon.in: Home & Kitchen,Skipper Polyester Cushion Cover - Blue: Amazon.in: Home & Kitchen,None,<div class="bucket" id="productDescription"> <h2>Product Description</h2> <div class="content"> <h3 class="productDescriptionSource"></h3> <div class="productDescriptionWrapper">        Enhance your room interiors with the addition of these cushion covers featuring a decorative design. The polyester fabric and sequence work ensures durability  while the zipper closure secures the cushion inside.              <div class="emptyClear"> </div> </div> </div> </div>,None,18:03:2014,None
B00FQF4C30,Skipper Scattered Playing Cards Blended Cushion Cover - Multicolor,http://www.amazon.in/Cushions-Cushion-Covers/b/ref=sd_allcat_cushions?ie=UTF8&node=1380469031,None,Cushions & Cushion Cover,Cushions & Cushion Cover,skipper,http://ecx.images-amazon.com/images/I/61tsxWL7mVL._AA160_.jpg,Rs. 299.00,self Colour,Home & Kitchen,http://www.amazon.in/Skipper-Scattered-Playing-Blended-Cushion/dp/B00FQF4C30/ref=sr_1_21/280-1123240-9275852?s=kitchen&ie=UTF8&qid=1395127191&sr=1-21,[<a href="/gp/help/seller/at-a-glance.html/280-1123240-9275852?ie=UTF8&amp;seller=A1MZL298BH4HVW">Skipper Furnishings</a>],Skipper Scattered Playing Cards Blended Cushion Cover - Multicolor: Amazon.in: Home & Kitchen,Skipper Scattered Playing Cards Blended Cushion Cover - Multicolor: Amazon.in: Home & Kitchen,None,<div class="bucket" id="productDescription"> <h2>Product Description</h2> <div class="content"> <h3 class="productDescriptionSource"></h3> <div class="productDescriptionWrapper">        Give your room décor a funky overhaul by introducing this piece of multicoloured cushion covers from Skipper to it. The modish digital print gives it a touch of welcoming vibrancy  thus making it a visual treat. Furthermore  its gives a soft feel  but also exudes its own subtle sheen.              <div class="emptyClear"> </div> </div> </div> </div>,None,18:03:2014,None
B00FQF4JYC,Skipper Woman Attitude Blended Cushion Cover - Multicolor,http://www.amazon.in/Cushions-Cushion-Covers/b/ref=sd_allcat_cushions?ie=UTF8&node=1380469031,None,Cushions & Cushion Cover,Cushions & Cushion Cover,skipper,http://ecx.images-amazon.com/images/I/61tsxWL7mVL._AA160_.jpg,Rs. 399.00,self Colour,Home & Kitchen,http://www.amazon.in/Skipper-Woman-Attitude-Blended-Cushion/dp/B00FQF4JYC/ref=sr_1_22/280-1123240-9275852?s=kitchen&ie=UTF8&qid=1395127191&sr=1-22,[<a href="/gp/help/seller/at-a-glance.html/280-1123240-9275852?ie=UTF8&amp;seller=A1MZL298BH4HVW">Skipper Furnishings</a>],Skipper Woman Attitude Blended Cushion Cover - Multicolor: Amazon.in: Home & Kitchen,Skipper Woman Attitude Blended Cushion Cover - Multicolor: Amazon.in: Home & Kitchen,None,<div class="bucket" id="productDescription"> <h2>Product Description</h2> <div class="content"> <h3 class="productDescriptionSource"></h3> <div class="productDescriptionWrapper">        Give your room décor a funky overhaul by introducing this piece of multicoloured cushion covers from Skipper to it. The modish digital print gives it a touch of welcoming vibrancy  thus making it a visual treat. Furthermore  its gives a soft feel  but also exudes its own subtle sheen.              <div class="emptyClear"> </div> </div> </div> </div>,None,18:03:2014,None
B00HM0WRYI,Skipper Floral Cotton Cushion Cover - Black,http://www.amazon.in/Cushions-Cushion-Covers/b/ref=sd_allcat_cushions?ie=UTF8&node=1380469031,None,Cushions & Cushion Cover,Cushions & Cushion Cover,skipper,http://ecx.images-amazon.com/images/I/61tsxWL7mVL._AA160_.jpg,Rs. 549.00,self Colour,Home & Kitchen,http://www.amazon.in/Skipper-Floral-Cotton-Cushion-Cover/dp/B00HM0WRYI/ref=sr_1_12/280-1123240-9275852?s=kitchen&ie=UTF8&qid=1395127191&sr=1-12,[<a href="/gp/help/seller/at-a-glance.html/280-1123240-9275852?ie=UTF8&amp;seller=A1MZL298BH4HVW">Skipper Furnishings</a>],Skipper Floral Cotton Cushion Cover - Black: Amazon.in: Home & Kitchen,Skipper Floral Cotton Cushion Cover - Black: Amazon.in: Home & Kitchen,None,<div class="bucket" id="productDescription"> <h2>Product Description</h2> <div class="content"> <h3 class="productDescriptionSource"></h3> <div class="productDescriptionWrapper">        These cushion covers follow a designer pattern that makes them appealing. Made from comfort cotton fabric  these cushion covers are durable and skin friendly. The zipper closure secures the cushion inside.              <div class="emptyClear"> </div> </div> </div> </div>,None,18:03:2014,None
B00H1RMFDU,Skipper Cotton Cushion Cover - Grey (2529),http://www.amazon.in/Cushions-Cushion-Covers/b/ref=sd_allcat_cushions?ie=UTF8&node=1380469031,None,Cushions & Cushion Cover,Cushions & Cushion Cover,skipper,http://ecx.images-amazon.com/images/I/61tsxWL7mVL._AA160_.jpg,Rs. 183.00,self Colour,Home & Kitchen,http://www.amazon.in/Skipper-Cotton-Cushion-Cover-Grey/dp/B00H1RMFDU/ref=sr_1_10/280-1123240-9275852?s=kitchen&ie=UTF8&qid=1395127191&sr=1-10,[<a href="/gp/help/seller/at-a-glance.html/280-1123240-9275852?ie=UTF8&amp;seller=A1MZL298BH4HVW">Skipper Furnishings</a>],Skipper Cotton Cushion Cover - Grey (2529): Amazon.in: Home & Kitchen,Skipper Cotton Cushion Cover - Grey (2529): Amazon.in: Home & Kitchen,None,<div class="bucket" id="productDescription"> <h2>Product Description</h2> <div class="content"> <h3 class="productDescriptionSource"></h3> <div class="productDescriptionWrapper">        Enhance your room interiors with the addition of these cushion covers featuring a decorative design. The cotton fabric ensures durability  while the zipper closure secures the cushion inside.              <div class="emptyClear"> </div> </div> </div> </div>,None,18:03:2014,None
B00FQF5DMO,Skipper Krrish3 Kaal Blended Cushion Cover - Multicolor,http://www.amazon.in/Cushions-Cushion-Covers/b/ref=sd_allcat_cushions?ie=UTF8&node=1380469031,None,Cushions & Cushion Cover,Cushions & Cushion Cover,skipper,http://ecx.images-amazon.com/images/I/61tsxWL7mVL._AA160_.jpg,Rs. 399.00,self Colour,Home & Kitchen,http://www.amazon.in/Skipper-Krrish3-Blended-Cushion-Cover/dp/B00FQF5DMO/ref=sr_1_17/280-1123240-9275852?s=kitchen&ie=UTF8&qid=1395127191&sr=1-17,[<a href="/gp/help/seller/at-a-glance.html/280-1123240-9275852?ie=UTF8&amp;seller=A1MZL298BH4HVW">Skipper Furnishings</a>],Skipper Krrish3 Kaal Blended Cushion Cover - Multicolor: Amazon.in: Home & Kitchen,Skipper Krrish3 Kaal Blended Cushion Cover - Multicolor: Amazon.in: Home & Kitchen,None,<div class="bucket" id="productDescription"> <h2>Product Description</h2> <div class="content"> <h3 class="productDescriptionSource"></h3> <div class="productDescriptionWrapper">        For all 'Krrish' fans! This digital print cushion cover is perfect for your rooms. This 'power-packed' coloured cushion cover is light in weight and easy to wash.              <div class="emptyClear"> </div> </div> </div> </div>,None,18:03:2014,None
