B00G6MPOAC,Nivea Lipcare Med Protection  4.8g (Pack of 2),http://www.amazon.in/Skin-Care/b/ref=sd_allcat_beauty_skincare/276-6718833-1247838?ie=UTF8&node=1374407031,None,Skin Car,Lips,Nivea,http://ecx.images-amazon.com/images/I/51H8OBWgTmL._AA160_.jpg,None,self Colour,Beauty & Health,http://www.amazon.in/Nivea-Lipcare-Protection-4-8g-Pack/dp/B00G6MPOAC/ref=sr_1_18/278-6275138-8771966?s=beauty&ie=UTF8&qid=1395127052&sr=1-18,[<a href="/gp/help/seller/at-a-glance.html/278-6275138-8771966?ie=UTF8&amp;seller=A36B2MUBQK4XRS">SnapitToday</a>],Amazon.in: Buy Nivea Lipcare Med Protection  4.8g (Pack of 2) Online at Best Price in India | Amazon Beauty Store,Buy Nivea Lipcare Med Protection  4.8g (Pack of 2) at lowest price in India on Amazon.in. Check out Nivea Lipcare Med Protection  4.8g (Pack of 2) reviews  ratings  features  specifications and browse more Beauty products online at best prices on Amazon.in.,None,<div class="bucket" id="productDescription"> <h2>Product Description</h2> <div class="content"> <h3 class="productDescriptionSource"></h3> <div class="productDescriptionWrapper">        Protects and strengthens sensitive lips.Details : The moisturizing formula of Nivea Med Protection with SPF 15 enriched with natural ingredients like Bisabolol and Wheat Germ Oil effectively protect lips from drying out  providing long lasting care. Your lips feel soft and smooth and look healthy.              <div class="emptyClear"> </div> </div> </div> </div>,None,18:03:2014,None
B00G6MQ9TM,Nivea Lipcare Fruity Shine Cherry  4.8g (Pack of 2),http://www.amazon.in/Skin-Care/b/ref=sd_allcat_beauty_skincare/276-6718833-1247838?ie=UTF8&node=1374407031,None,Skin Car,Lips,Nivea,http://ecx.images-amazon.com/images/I/51H8OBWgTmL._AA160_.jpg,None,self Colour,Beauty & Health,http://www.amazon.in/Nivea-Lipcare-Fruity-Shine-Cherry/dp/B00G6MQ9TM/ref=sr_1_21/278-6275138-8771966?s=beauty&ie=UTF8&qid=1395127052&sr=1-21,[<a href="/gp/help/seller/at-a-glance.html/278-6275138-8771966?ie=UTF8&amp;seller=A36B2MUBQK4XRS">SnapitToday</a>],Amazon.in: Buy Nivea Lipcare Fruity Shine Cherry  4.8g (Pack of 2) Online at Best Price in India | Amazon Beauty Store,Buy Nivea Lipcare Fruity Shine Cherry  4.8g (Pack of 2) at lowest price in India on Amazon.in. Check out Nivea Lipcare Fruity Shine Cherry  4.8g (Pack of 2) reviews  ratings  features  specifications and browse more Beauty products online at best prices on Amazon.in.,None,<div class="bucket" id="productDescription"> <h2>Product Description</h2> <div class="content"> <h3 class="productDescriptionSource"></h3> <div class="productDescriptionWrapper">        Nivea Fruity Shine Cherry Lip Balm Enjoy the scent of summer cherry while accentuating your smile with a glossy shine and a deep red toned glow.The new formula of NIVEA Fruity Shine Cherry lip balm combines rich almond oil  jojoba oil and shea butter to keep your lips as soft and fresh as they can be! Delights young delicate lips with a fruity scent and smoothing  long lasting care Naturally enhances your lips with shimmering pigments and a soft glossy color Dermatologist tested.NIVEA - for lips that love to talk  smile  laugh and kiss.              <div class="emptyClear"> </div> </div> </div> </div>,None,18:03:2014,None
B00G6MPR3Q,Nivea Lipcare Fruity Shine Strawberry (Pack of 3) 4.8 g,http://www.amazon.in/Skin-Care/b/ref=sd_allcat_beauty_skincare/276-6718833-1247838?ie=UTF8&node=1374407031,None,Skin Car,Lips,Nivea,http://ecx.images-amazon.com/images/I/51H8OBWgTmL._AA160_.jpg,None,self Colour,Beauty & Health,http://www.amazon.in/Nivea-Lipcare-Fruity-Shine-Strawberry/dp/B00G6MPR3Q/ref=sr_1_24/278-6275138-8771966?s=beauty&ie=UTF8&qid=1395127052&sr=1-24,[<a href="/gp/help/seller/at-a-glance.html/278-6275138-8771966?ie=UTF8&amp;seller=A36B2MUBQK4XRS">SnapitToday</a>],Amazon.in: Buy Nivea Lipcare Fruity Shine Strawberry (Pack of 3) 4.8 g Online at Best Price in India | Amazon Beauty Store,Buy Nivea Lipcare Fruity Shine Strawberry (Pack of 3) 4.8 g at lowest price in India on Amazon.in. Check out Nivea Lipcare Fruity Shine Strawberry (Pack of 3) 4.8 g reviews  ratings  features  specifications and browse more Beauty products online at best prices on Amazon.in.,None,<div class="bucket" id="productDescription"> <h2>Product Description</h2> <div class="content"> <h3 class="productDescriptionSource"></h3> <div class="productDescriptionWrapper">        A reddish tinted strawberry flavored lip balm. Details : The innovative formula of Nivea Fruity Shine Strawberry  with fruit extracts and shimmering pigments  provides long lasting moisturization and an exciting fruity flavor to your lips. It gives you soft and smooth lips with a delicate reddish shimmer.              <div class="emptyClear"> </div> </div> </div> </div>,None,18:03:2014,None
B00G6MPQ6Y,Nivea Lipcare Fruity Shine Strawberry (Pack of 2) 4.8 g,http://www.amazon.in/Skin-Care/b/ref=sd_allcat_beauty_skincare/276-6718833-1247838?ie=UTF8&node=1374407031,None,Skin Car,Lips,Nivea,http://ecx.images-amazon.com/images/I/51H8OBWgTmL._AA160_.jpg,None,self Colour,Beauty & Health,http://www.amazon.in/Nivea-Lipcare-Fruity-Shine-Strawberry/dp/B00G6MPQ6Y/ref=sr_1_23/278-6275138-8771966?s=beauty&ie=UTF8&qid=1395127052&sr=1-23,[<a href="/gp/help/seller/at-a-glance.html/278-6275138-8771966?ie=UTF8&amp;seller=A36B2MUBQK4XRS">SnapitToday</a>],Amazon.in: Buy Nivea Lipcare Fruity Shine Strawberry (Pack of 2) 4.8 g Online at Best Price in India | Amazon Beauty Store,Buy Nivea Lipcare Fruity Shine Strawberry (Pack of 2) 4.8 g at lowest price in India on Amazon.in. Check out Nivea Lipcare Fruity Shine Strawberry (Pack of 2) 4.8 g reviews  ratings  features  specifications and browse more Beauty products online at best prices on Amazon.in.,None,<div class="bucket" id="productDescription"> <h2>Product Description</h2> <div class="content"> <h3 class="productDescriptionSource"></h3> <div class="productDescriptionWrapper">        A reddish tinted strawberry flavored lip balm Details The innovative formula of Nivea Fruity Shine Strawberry  with fruit extracts and shimmering pigments  provides long lasting moisturization and an exciting fruity flavor to your lips. It gives you soft and smooth lips with a delicate reddish shimmer.              <div class="emptyClear"> </div> </div> </div> </div>,None,18:03:2014,None
B00G6MPH0O,Nivea Lipcare Hydro Care  4.8g (Pack of 2),http://www.amazon.in/Skin-Care/b/ref=sd_allcat_beauty_skincare/276-6718833-1247838?ie=UTF8&node=1374407031,None,Skin Car,Lips,Nivea,http://ecx.images-amazon.com/images/I/51H8OBWgTmL._AA160_.jpg,None,self Colour,Beauty & Health,http://www.amazon.in/Nivea-Lipcare-Hydro-Care-4-8g/dp/B00G6MPH0O/ref=sr_1_25/278-6275138-8771966?s=beauty&ie=UTF8&qid=1395127057&sr=1-25,[<a href="/gp/help/seller/at-a-glance.html/278-6275138-8771966?ie=UTF8&amp;seller=A36B2MUBQK4XRS">SnapitToday</a>],Amazon.in: Buy Nivea Lipcare Hydro Care  4.8g (Pack of 2) Online at Best Price in India | Amazon Beauty Store,Buy Nivea Lipcare Hydro Care  4.8g (Pack of 2) at lowest price in India on Amazon.in. Check out Nivea Lipcare Hydro Care  4.8g (Pack of 2) reviews  ratings  features  specifications and browse more Beauty products online at best prices on Amazon.in.,None,<div class="bucket" id="productDescription"> <h2>Product Description</h2> <div class="content"> <h3 class="productDescriptionSource"></h3> <div class="productDescriptionWrapper">        Enriched with pure water and aloe vera  for long lasting intensive moisture. Details : The innovative formula of Nivea Hydro Care enriched with Pure Water and moisturising Aloe Vera  provides lon lasting support to the lip's natural moisturization process leaving a light and soft feeling on your lips.              <div class="emptyClear"> </div> </div> </div> </div>,None,18:03:2014,None
B00G6MQAY6,Nivea Lipcare Fruity Shine Cherry (Pack of 3) 4.8 g,http://www.amazon.in/Skin-Care/b/ref=sd_allcat_beauty_skincare/276-6718833-1247838?ie=UTF8&node=1374407031,None,Skin Car,Lips,Nivea,http://ecx.images-amazon.com/images/I/51H8OBWgTmL._AA160_.jpg,None,self Colour,Beauty & Health,http://www.amazon.in/Nivea-Lipcare-Fruity-Shine-Cherry/dp/B00G6MQAY6/ref=sr_1_20/278-6275138-8771966?s=beauty&ie=UTF8&qid=1395127052&sr=1-20,[<a href="/gp/help/seller/at-a-glance.html/278-6275138-8771966?ie=UTF8&amp;seller=A36B2MUBQK4XRS">SnapitToday</a>],Amazon.in: Buy Nivea Lipcare Fruity Shine Cherry (Pack of 3) 4.8 g Online at Best Price in India | Amazon Beauty Store,Buy Nivea Lipcare Fruity Shine Cherry (Pack of 3) 4.8 g at lowest price in India on Amazon.in. Check out Nivea Lipcare Fruity Shine Cherry (Pack of 3) 4.8 g reviews  ratings  features  specifications and browse more Beauty products online at best prices on Amazon.in.,None,<div class="bucket" id="productDescription"> <h2>Product Description</h2> <div class="content"> <h3 class="productDescriptionSource"></h3> <div class="productDescriptionWrapper">        Nivea Fruity Shine Cherry Lip Balm : Enjoy the scent of summer cherry while accentuating your smile with a glossy shine and a deep red toned glow.The new formula of NIVEA Fruity Shine Cherry lip balm combines rich almond oil  jojoba oil and shea butter to keep your lips as soft and fresh as they can be!Delights young delicate lips with a fruity scent and smoothing  long lasting care Naturally enhances your lips with shimmering pigments and a soft glossy color Dermatologist tested.NIVEA - for lips that love to talk  smile  laugh and kiss.              <div class="emptyClear"> </div> </div> </div> </div>,None,18:03:2014,None
B00G6MQ6HW,Nivea Lipcare Pearly Shine (Pack of 2) 4.8 g,http://www.amazon.in/Skin-Care/b/ref=sd_allcat_beauty_skincare/276-6718833-1247838?ie=UTF8&node=1374407031,None,Skin Car,Lips,Nivea,http://ecx.images-amazon.com/images/I/51H8OBWgTmL._AA160_.jpg,None,self Colour,Beauty & Health,http://www.amazon.in/Nivea-Lipcare-Pearly-Shine-Pack/dp/B00G6MQ6HW/ref=sr_1_26/278-6275138-8771966?s=beauty&ie=UTF8&qid=1395127057&sr=1-26,[<a href="/gp/help/seller/at-a-glance.html/278-6275138-8771966?ie=UTF8&amp;seller=A36B2MUBQK4XRS">SnapitToday</a>],Amazon.in: Buy Nivea Lipcare Pearly Shine (Pack of 2) 4.8 g Online at Best Price in India | Amazon Beauty Store,Buy Nivea Lipcare Pearly Shine (Pack of 2) 4.8 g at lowest price in India on Amazon.in. Check out Nivea Lipcare Pearly Shine (Pack of 2) 4.8 g reviews  ratings  features  specifications and browse more Beauty products online at best prices on Amazon.in.,None,<div class="bucket" id="productDescription"> <h2>Product Description</h2> <div class="content"> <h3 class="productDescriptionSource"></h3> <div class="productDescriptionWrapper">        A lip balm for soft lips and natural pearly shimmer. Details : The innovative formula of Nivea Pearly Shine with precious pearl and silk extracts combines long lasting moisture and a beautiful pearly shine leaving your lips well cared for. It also protects your lips from harmful UVA and UVB rays with SPF 10.              <div class="emptyClear"> </div> </div> </div> </div>,None,18:03:2014,None
B00G6MQ5A0,Nivea Lipcare Pure Natural Camomile And Calendula (Pack of 2) 4.8 g,http://www.amazon.in/Skin-Care/b/ref=sd_allcat_beauty_skincare/276-6718833-1247838?ie=UTF8&node=1374407031,None,Skin Car,Lips,Nivea,http://ecx.images-amazon.com/images/I/51H8OBWgTmL._AA160_.jpg,None,self Colour,Beauty & Health,http://www.amazon.in/Nivea-Lipcare-Natural-Camomile-Calendula/dp/B00G6MQ5A0/ref=sr_1_27/278-6275138-8771966?s=beauty&ie=UTF8&qid=1395127057&sr=1-27,[<a href="/gp/help/seller/at-a-glance.html/278-6275138-8771966?ie=UTF8&amp;seller=A36B2MUBQK4XRS">SnapitToday</a>],Amazon.in: Buy Nivea Lipcare Pure Natural Camomile And Calendula (Pack of 2) 4.8 g Online at Best Price in India | Amazon Beauty Store,Buy Nivea Lipcare Pure Natural Camomile And Calendula (Pack of 2) 4.8 g at lowest price in India on Amazon.in. Check out Nivea Lipcare Pure Natural Camomile And Calendula (Pack of 2) 4.8 g reviews  ratings  features  specifications and browse more Beauty products online at best prices on Amazon.in.,None,<div class="bucket" id="productDescription"> <h2>Product Description</h2> <div class="content"> <h3 class="productDescriptionSource"></h3> <div class="productDescriptionWrapper">        Extra mild care and protection for sensitive lips. Details : The innovative formula of Nivea Pure and Natural is truly inspired by nature. This lip balm comes in a stick form and contains calming camomile and soothing calendula extracts  which heal and protect your lips with extra mild care. Natural ingredients like organic shea butter and jojoba oil pamper and nourish your lips.              <div class="emptyClear"> </div> </div> </div> </div>,None,18:03:2014,None
B00G6MOJBW,Nivea Lipcare Fruity Shine Pink Guava   4.8g (Pack of 2),http://www.amazon.in/Skin-Care/b/ref=sd_allcat_beauty_skincare/276-6718833-1247838?ie=UTF8&node=1374407031,None,Skin Car,Lips,Nivea,http://ecx.images-amazon.com/images/I/51H8OBWgTmL._AA160_.jpg,None,self Colour,Beauty & Health,http://www.amazon.in/Nivea-Lipcare-Fruity-Shine-Guava/dp/B00G6MOJBW/ref=sr_1_22/278-6275138-8771966?s=beauty&ie=UTF8&qid=1395127052&sr=1-22,[<a href="/gp/help/seller/at-a-glance.html/278-6275138-8771966?ie=UTF8&amp;seller=A36B2MUBQK4XRS">SnapitToday</a>],Amazon.in: Buy Nivea Lipcare Fruity Shine Pink Guava  4.8g (Pack of 2) Online at Best Price in India | Amazon Beauty Store,Buy Nivea Lipcare Fruity Shine Pink Guava  4.8g (Pack of 2) at lowest price in India on Amazon.in. Check out Nivea Lipcare Fruity Shine Pink Guava  4.8g (Pack of 2) reviews  ratings  features  specifications and browse more Beauty products online at best prices on Amazon.in.,None,<div class="bucket" id="productDescription"> <h2>Product Description</h2> <div class="content"> <h3 class="productDescriptionSource"></h3> <div class="productDescriptionWrapper">        The innovative formula of Nivea Fruity Shine with Pink Guava extracts and shimmering pigments  provides long lasting moisturization and a delicious fruity flavor to your lips. It gives you soft and smooth lips with a fabulous light pink shimmer.              <div class="emptyClear"> </div> </div> </div> </div>,None,18:03:2014,None
B00G6MQ48I,Nivea Lipcare Pure Natural Olive and Lemon  4.8g (Pack of 2),http://www.amazon.in/Skin-Care/b/ref=sd_allcat_beauty_skincare/276-6718833-1247838?ie=UTF8&node=1374407031,None,Skin Car,Lips,Nivea,http://ecx.images-amazon.com/images/I/51H8OBWgTmL._AA160_.jpg,None,self Colour,Beauty & Health,http://www.amazon.in/Nivea-Lipcare-Natural-Olive-Lemon/dp/B00G6MQ48I/ref=sr_1_28/278-6275138-8771966?s=beauty&ie=UTF8&qid=1395127057&sr=1-28,[<a href="/gp/help/seller/at-a-glance.html/278-6275138-8771966?ie=UTF8&amp;seller=A36B2MUBQK4XRS">SnapitToday</a>],Amazon.in: Buy Nivea Lipcare Pure Natural Olive and Lemon  4.8g (Pack of 2) Online at Best Price in India | Amazon Beauty Store,Buy Nivea Lipcare Pure Natural Olive and Lemon  4.8g (Pack of 2) at lowest price in India on Amazon.in. Check out Nivea Lipcare Pure Natural Olive and Lemon  4.8g (Pack of 2) reviews  ratings  features  specifications and browse more Beauty products online at best prices on Amazon.in.,None,<div class="bucket" id="productDescription"> <h2>Product Description</h2> <div class="content"> <h3 class="productDescriptionSource"></h3> <div class="productDescriptionWrapper">        Long lasting moisture and protection for dry lips. Details : The innovative formula of Nivea Pure and Natural is inspired by nature and contains natural olive oil and lemon extracts  which provide intensive moisturization and protection. Natural ingredients like organic shea butter and jojoba oil pamper and nourish your lips.              <div class="emptyClear"> </div> </div> </div> </div>,None,18:03:2014,None
B00G45TV7I,Nivea Lip Care Vitamin Shake  4.8g,http://www.amazon.in/Skin-Care/b/ref=sd_allcat_beauty_skincare/276-6718833-1247838?ie=UTF8&node=1374407031,None,Skin Car,Lips,Nivea,http://ecx.images-amazon.com/images/I/51H8OBWgTmL._AA160_.jpg,None,self Colour,Beauty & Health,http://www.amazon.in/Nivea-Care-Vitamin-Shake-4-8g/dp/B00G45TV7I/ref=sr_1_14/278-6275138-8771966?s=beauty&ie=UTF8&qid=1395127052&sr=1-14,[<a href="/gp/help/seller/at-a-glance.html/278-6275138-8771966?ie=UTF8&amp;isAmazonFulfilled=1&amp;seller=A3S589APE53IEY">Nykaa</a>  <a href="/gp/help/customer/display.html/278-6275138-8771966?ie=UTF8&amp;nodeId=200953360&amp;ref=dp_fulfillment" id="SSOFpopoverLink"><strong>Fulfilled by Amazon</strong></a>],Amazon.in: Buy Nivea Lip Care Vitamin Shake  4.8g Online at Best Price in India | Amazon Beauty Store,Buy Nivea Lip Care Vitamin Shake  4.8g at lowest price in India on Amazon.in. Check out Nivea Lip Care Vitamin Shake  4.8g reviews  ratings  features  specifications and browse more Beauty products online at best prices on Amazon.in.,None,None,None,18:03:2014,None
