B007E9JFK6,Nivea Lip Care Fruity Shine Strawberry  4.8g,http://www.amazon.in/Skin-Care/b/ref=sd_allcat_beauty_skincare/276-6718833-1247838?ie=UTF8&node=1374407031,Rs. 125.00,Skin Car,Lips,Nivea,http://ecx.images-amazon.com/images/I/51H8OBWgTmL._AA160_.jpg,Rs. 125.00,self Colour,Beauty & Health,http://www.amazon.in/Nivea-Care-Fruity-Shine-Strawberry/dp/B007E9JFK6/ref=sr_1_1/278-6275138-8771966?s=beauty&ie=UTF8&qid=1395127052&sr=1-1,[<a class="buyAction" href="/gp/offer-listing/B007E9JFK6/ref=dp_olp_0/278-6275138-8771966?ie=UTF8&amp;condition=all">these sellers</a>],Amazon.in: Buy Nivea Lip Care Fruity Shine Strawberry  4.8g Online at Best Price in India | Amazon Beauty Store,Buy Nivea Lip Care Fruity Shine Strawberry  4.8g at lowest price in India on Amazon.in. Check out Nivea Lip Care Fruity Shine Strawberry  4.8g reviews  ratings  features  specifications and browse more Beauty products online at best prices on Amazon.in.,None,<div class="bucket" id="productDescription"> <h2>Product Description</h2> <div class="content"> <h3 class="productDescriptionSource"></h3> <div class="productDescriptionWrapper">        Makes your lips delicious  kissing them with a fruity fresh strawberry taste. It cover your lips with glossy shine  over a subtle  red-toned glow . With rich almond oil  jojoba oil and shea butter .              <div class="emptyClear"> </div> </div> </div> </div>,None,18:03:2014,None
B00E96MRNY,Nivea Lip Care Repair and Beauty  4.8 g,http://www.amazon.in/Skin-Care/b/ref=sd_allcat_beauty_skincare/276-6718833-1247838?ie=UTF8&node=1374407031,None,Skin Car,Lips,Nivea,http://ecx.images-amazon.com/images/I/51H8OBWgTmL._AA160_.jpg,None,self Colour,Beauty & Health,http://www.amazon.in/Nivea-Lip-Care-Repair-Beauty/dp/B00E96MRNY/ref=sr_1_4/278-6275138-8771966?s=beauty&ie=UTF8&qid=1395127052&sr=1-4,[<a href="/gp/help/seller/at-a-glance.html/278-6275138-8771966?ie=UTF8&amp;isAmazonFulfilled=1&amp;seller=ADJ7WREVGU39P">Zephyr Online</a>  <a href="/gp/help/customer/display.html/278-6275138-8771966?ie=UTF8&amp;nodeId=200953360&amp;ref=dp_fulfillment" id="SSOFpopoverLink"><strong>Fulfilled by Amazon</strong></a>],Amazon.in: Buy Nivea Lip Care Repair and Beauty  4.8 g Online at Best Price in India | Amazon Beauty Store,Buy Nivea Lip Care Repair and Beauty  4.8 g at lowest price in India on Amazon.in. Check out Nivea Lip Care Repair and Beauty  4.8 g reviews  ratings  features  specifications and browse more Beauty products online at best prices on Amazon.in.,None,<div class="bucket" id="productDescription"> <h2>Product Description</h2> <div class="content"> <h3 class="productDescriptionSource"></h3> <div class="productDescriptionWrapper">        With its innovative dual core technology  nivea repair and Beauty gives instant relief and effective repair for dry  chapped lips while giving them a beautiful touch of color              <div class="emptyClear"> </div> </div> </div> </div>,None,18:03:2014,None
B00G9Z3LSI,Nivea Vitamin Shake Lip Balm  Cranberry Raspberry  4.8 g,http://www.amazon.in/Skin-Care/b/ref=sd_allcat_beauty_skincare/276-6718833-1247838?ie=UTF8&node=1374407031,None,Skin Car,Lips,Nivea,http://ecx.images-amazon.com/images/I/51H8OBWgTmL._AA160_.jpg,None,Maybelline Lip Smooth Color Bloom  Peach Blossom,Beauty & Health,http://www.amazon.in/Nivea-Vitamin-Shake-Cranberry-Raspberry/dp/B00G9Z3LSI/ref=sr_1_5/278-6275138-8771966?s=beauty&ie=UTF8&qid=1395127052&sr=1-5,[<a href="/gp/help/seller/at-a-glance.html/278-6275138-8771966?ie=UTF8&amp;isAmazonFulfilled=1&amp;seller=ADJ7WREVGU39P">Zephyr Online</a>  <a href="/gp/help/customer/display.html/278-6275138-8771966?ie=UTF8&amp;nodeId=200953360&amp;ref=dp_fulfillment" id="SSOFpopoverLink"><strong>Fulfilled by Amazon</strong></a>],Amazon.in: Buy Nivea Vitamin Shake Lip Balm  Cranberry Raspberry  4.8 g Online at Best Price in India | Amazon Beauty Store,Buy Nivea Vitamin Shake Lip Balm  Cranberry Raspberry  4.8 g at lowest price in India on Amazon.in. Check out Nivea Vitamin Shake Lip Balm  Cranberry Raspberry  4.8 g reviews  ratings  features  specifications and browse more Beauty products online at best prices on Amazon.in.,None,None,None,18:03:2014,None
B006LXA7L2,Nivea Lip Care Pure and Natural Olive and Lemon  4.8 g,http://www.amazon.in/Skin-Care/b/ref=sd_allcat_beauty_skincare/276-6718833-1247838?ie=UTF8&node=1374407031,None,Skin Car,Lips,Nivea,http://ecx.images-amazon.com/images/I/51H8OBWgTmL._AA160_.jpg,None,self Colour,Beauty & Health,http://www.amazon.in/Nivea-Care-Natural-Olive-Lemon/dp/B006LXA7L2/ref=sr_1_8/278-6275138-8771966?s=beauty&ie=UTF8&qid=1395127052&sr=1-8,[<a href="/gp/help/seller/at-a-glance.html/278-6275138-8771966?ie=UTF8&amp;isAmazonFulfilled=1&amp;seller=ADJ7WREVGU39P">Zephyr Online</a>  <a href="/gp/help/customer/display.html/278-6275138-8771966?ie=UTF8&amp;nodeId=200953360&amp;ref=dp_fulfillment" id="SSOFpopoverLink"><strong>Fulfilled by Amazon</strong></a>],Amazon.in: Buy Nivea Lip Care Pure and Natural Olive and Lemon  4.8 g Online at Best Price in India | Amazon Beauty Store,Buy Nivea Lip Care Pure and Natural Olive and Lemon  4.8 g at lowest price in India on Amazon.in. Check out Nivea Lip Care Pure and Natural Olive and Lemon  4.8 g reviews  ratings  features  specifications and browse more Beauty products online at best prices on Amazon.in.,None,<div class="bucket" id="productDescription"> <h2>Product Description</h2> <div class="content"> <h3 class="productDescriptionSource"></h3> <div class="productDescriptionWrapper">        Olive and Lemon The innovative formula of Nivea Pure and Natural is inspired by nature and contains natural olive oil and lemon extracts  which provide intensive moisturization and protection. Natural ingredients like organic shea butter and jojoba oil pamper and nourish your lips.              <div class="emptyClear"> </div> </div> </div> </div>,None,18:03:2014,None
B007E9JEIO,Nivea Lip Care Hydro Care  4.8 g,http://www.amazon.in/Skin-Care/b/ref=sd_allcat_beauty_skincare/276-6718833-1247838?ie=UTF8&node=1374407031,None,Skin Car,Lips,Nivea,http://ecx.images-amazon.com/images/I/51H8OBWgTmL._AA160_.jpg,None,self Colour,Beauty & Health,http://www.amazon.in/Nivea-Lip-Care-Hydro-4-8/dp/B007E9JEIO/ref=sr_1_2/278-6275138-8771966?s=beauty&ie=UTF8&qid=1395127052&sr=1-2,[<a href="/gp/help/seller/at-a-glance.html/278-6275138-8771966?ie=UTF8&amp;isAmazonFulfilled=1&amp;seller=ADJ7WREVGU39P">Zephyr Online</a>  <a href="/gp/help/customer/display.html/278-6275138-8771966?ie=UTF8&amp;nodeId=200953360&amp;ref=dp_fulfillment" id="SSOFpopoverLink"><strong>Fulfilled by Amazon</strong></a>],Amazon.in: Buy Nivea Lip Care Hydro Care  4.8 g Online at Best Price in India | Amazon Beauty Store,Buy Nivea Lip Care Hydro Care  4.8 g at lowest price in India on Amazon.in. Check out Nivea Lip Care Hydro Care  4.8 g reviews  ratings  features  specifications and browse more Beauty products online at best prices on Amazon.in.,None,<div class="bucket" id="productDescription"> <h2>Product Description</h2> <div class="content"> <h3 class="productDescriptionSource"></h3> <div class="productDescriptionWrapper">        Nivea Lip Care - Hydro Care the innovative formula of Nivea Hydro Care enriched with Pure Water and moisturising Aloe Vera  provides lon lasting support to the lip's natural moisturization process leaving a light and soft feeling on your lips.              <div class="emptyClear"> </div> </div> </div> </div>,None,18:03:2014,None
B00791D3QG,Nivea Lip Care Fruity Shine Cherry  4.8 g,http://www.amazon.in/Skin-Care/b/ref=sd_allcat_beauty_skincare/276-6718833-1247838?ie=UTF8&node=1374407031,None,Skin Car,Lips,Nivea,http://ecx.images-amazon.com/images/I/51H8OBWgTmL._AA160_.jpg,None,self Colour,Beauty & Health,http://www.amazon.in/Nivea-Care-Fruity-Shine-Cherry/dp/B00791D3QG/ref=sr_1_6/278-6275138-8771966?s=beauty&ie=UTF8&qid=1395127052&sr=1-6,[<a href="/gp/help/seller/at-a-glance.html/278-6275138-8771966?ie=UTF8&amp;isAmazonFulfilled=1&amp;seller=ADJ7WREVGU39P">Zephyr Online</a>  <a href="/gp/help/customer/display.html/278-6275138-8771966?ie=UTF8&amp;nodeId=200953360&amp;ref=dp_fulfillment" id="SSOFpopoverLink"><strong>Fulfilled by Amazon</strong></a>],Amazon.in: Buy Nivea Lip Care Fruity Shine Cherry  4.8 g Online at Best Price in India | Amazon Beauty Store,Buy Nivea Lip Care Fruity Shine Cherry  4.8 g at lowest price in India on Amazon.in. Check out Nivea Lip Care Fruity Shine Cherry  4.8 g reviews  ratings  features  specifications and browse more Beauty products online at best prices on Amazon.in.,None,<div class="bucket" id="productDescription"> <h2>Product Description</h2> <div class="content"> <h3 class="productDescriptionSource"></h3> <div class="productDescriptionWrapper">        Nivea Fruity Shine Cherry Lip Balm enjoy the scent of summer cherry while accentuating your smile with a glossy shine and a deep red toned glow. The new formula of NIVEA Fruity Shine Cherry lip balm combines rich almond oil  jojoba oil and shea butter to keep your lips as soft and fresh as they can be. Delights young delicate lips with a fruity scent and smoothing  long lasting care Naturally enhances your lips with shimmering pigments and a soft glossy color dermatologist tested.              <div class="emptyClear"> </div> </div> </div> </div>,None,18:03:2014,None
B007E9JC7W,Nivea Lip Care Essential Care  4.8 g,http://www.amazon.in/Skin-Care/b/ref=sd_allcat_beauty_skincare/276-6718833-1247838?ie=UTF8&node=1374407031,None,Skin Car,Lips,Nivea,http://ecx.images-amazon.com/images/I/51H8OBWgTmL._AA160_.jpg,None,self Colour,Beauty & Health,http://www.amazon.in/Nivea-Lip-Care-Essential-4-8/dp/B007E9JC7W/ref=sr_1_7/278-6275138-8771966?s=beauty&ie=UTF8&qid=1395127052&sr=1-7,[<a href="/gp/help/seller/at-a-glance.html/278-6275138-8771966?ie=UTF8&amp;isAmazonFulfilled=1&amp;seller=ADJ7WREVGU39P">Zephyr Online</a>  <a href="/gp/help/customer/display.html/278-6275138-8771966?ie=UTF8&amp;nodeId=200953360&amp;ref=dp_fulfillment" id="SSOFpopoverLink"><strong>Fulfilled by Amazon</strong></a>],Amazon.in: Buy Nivea Lip Care Essential Care  4.8 g Online at Best Price in India | Amazon Beauty Store,Buy Nivea Lip Care Essential Care  4.8 g at lowest price in India on Amazon.in. Check out Nivea Lip Care Essential Care  4.8 g reviews  ratings  features  specifications and browse more Beauty products online at best prices on Amazon.in.,None,<div class="bucket" id="productDescription"> <h2>Product Description</h2> <div class="content"> <h3 class="productDescriptionSource"></h3> <div class="productDescriptionWrapper">        Nivea Essential Lip Balm contains an innovative moisture storing formula –  the highly effective solution is enriched with Hydramine  an active ingredient found naturally in the skin  and Shea Butter that cares for your lips and prevents them from losing moisture  leaving them soft and smooth. Provides long lasting and intensive care. Effectively protects your lips from drying out in all weather Dermatologist tested. Nivea - for lips that love to talk  smile.              <div class="emptyClear"> </div> </div> </div> </div>,None,18:03:2014,None
B00HQW4FEM,Nivea Lip Butter Caramel Cream  16.7g,http://www.amazon.in/Skin-Care/b/ref=sd_allcat_beauty_skincare/276-6718833-1247838?ie=UTF8&node=1374407031,None,Skin Car,Lips,Nivea,http://ecx.images-amazon.com/images/I/51H8OBWgTmL._AA160_.jpg,None,self Colour,Beauty & Health,http://www.amazon.in/Nivea-Butter-Caramel-Cream-16-7g/dp/B00HQW4FEM/ref=sr_1_3/278-6275138-8771966?s=beauty&ie=UTF8&qid=1395127052&sr=1-3,[<a href="/gp/help/seller/at-a-glance.html/278-6275138-8771966?ie=UTF8&amp;isAmazonFulfilled=1&amp;seller=ADJ7WREVGU39P">Zephyr Online</a>  <a href="/gp/help/customer/display.html/278-6275138-8771966?ie=UTF8&amp;nodeId=200953360&amp;ref=dp_fulfillment" id="SSOFpopoverLink"><strong>Fulfilled by Amazon</strong></a>],Amazon.in: Buy Nivea Lip Butter Caramel Cream  16.7g Online at Best Price in India | Amazon Beauty Store,Buy Nivea Lip Butter Caramel Cream  16.7g at lowest price in India on Amazon.in. Check out Nivea Lip Butter Caramel Cream  16.7g reviews  ratings  features  specifications and browse more Beauty products online at best prices on Amazon.in.,None,None,None,18:03:2014,None
B006LXA85M,Nivea Lip Care Fruity Shine Pomegranate,http://www.amazon.in/Skin-Care/b/ref=sd_allcat_beauty_skincare/276-6718833-1247838?ie=UTF8&node=1374407031,None,Skin Car,Lips,Nivea,http://ecx.images-amazon.com/images/I/51H8OBWgTmL._AA160_.jpg,None,self Colour,Beauty & Health,http://www.amazon.in/Nivea-Care-Fruity-Shine-Pomegranate/dp/B006LXA85M/ref=sr_1_11/278-6275138-8771966?s=beauty&ie=UTF8&qid=1395127052&sr=1-11,[<a href="/gp/help/seller/at-a-glance.html/278-6275138-8771966?ie=UTF8&amp;isAmazonFulfilled=1&amp;seller=ADJ7WREVGU39P">Zephyr Online</a>  <a href="/gp/help/customer/display.html/278-6275138-8771966?ie=UTF8&amp;nodeId=200953360&amp;ref=dp_fulfillment" id="SSOFpopoverLink"><strong>Fulfilled by Amazon</strong></a>],Amazon.in: Buy Nivea Lip Care Fruity Shine Pomegranate Online at Best Price in India | Amazon Beauty Store,Buy Nivea Lip Care Fruity Shine Pomegranate at lowest price in India on Amazon.in. Check out Nivea Lip Care Fruity Shine Pomegranate reviews  ratings  features  specifications and browse more Beauty products online at best prices on Amazon.in.,None,<div class="bucket" id="productDescription"> <h2>Product Description</h2> <div class="content"> <h3 class="productDescriptionSource"></h3> <div class="productDescriptionWrapper">        The innovative formula of Nivea Fruity Shine Pomegranate  with fruit extracts and shimmering pigments  provides long lasting moisturization and an exciting fruity flavor to your lips. It gives you soft and smooth lips with a delicate light reddish shimmer.              <div class="emptyClear"> </div> </div> </div> </div>,None,18:03:2014,None
B007E9J1LY,Nivea Lip Care Fruity Shine Pink Guava  4.8g,http://www.amazon.in/Skin-Care/b/ref=sd_allcat_beauty_skincare/276-6718833-1247838?ie=UTF8&node=1374407031,None,Skin Car,Lips,Nivea,http://ecx.images-amazon.com/images/I/51H8OBWgTmL._AA160_.jpg,None,self Colour,Beauty & Health,http://www.amazon.in/Nivea-Care-Fruity-Shine-Guava/dp/B007E9J1LY/ref=sr_1_9/278-6275138-8771966?s=beauty&ie=UTF8&qid=1395127052&sr=1-9,[<a href="/gp/help/seller/at-a-glance.html/278-6275138-8771966?ie=UTF8&amp;isAmazonFulfilled=1&amp;seller=A3S589APE53IEY">Nykaa</a>  <a href="/gp/help/customer/display.html/278-6275138-8771966?ie=UTF8&amp;nodeId=200953360&amp;ref=dp_fulfillment" id="SSOFpopoverLink"><strong>Fulfilled by Amazon</strong></a>],Amazon.in: Buy Nivea Lip Care Fruity Shine Pink Guava  4.8g Online at Best Price in India | Amazon Beauty Store,Buy Nivea Lip Care Fruity Shine Pink Guava  4.8g at lowest price in India on Amazon.in. Check out Nivea Lip Care Fruity Shine Pink Guava  4.8g reviews  ratings  features  specifications and browse more Beauty products online at best prices on Amazon.in.,None,<div class="bucket" id="productDescription"> <h2>Product Description</h2> <div class="content"> <h3 class="productDescriptionSource"></h3> <div class="productDescriptionWrapper">        Nivea Lip Care Fruity Shine - Pink Guava The innovative formula of Nivea Fruity Shine  with pink guava extracts and shimmering pigments  provides long lasting moisturization and a delicious fruity flavor to your lips. It gives you soft and smooth lips with a fabulous light pink shimmer.              <div class="emptyClear"> </div> </div> </div> </div>,None,18:03:2014,None
B00HQW4GGO,Nivea Lip Butter Raspberry Rose  16.7g,http://www.amazon.in/Skin-Care/b/ref=sd_allcat_beauty_skincare/276-6718833-1247838?ie=UTF8&node=1374407031,None,Skin Car,Lips,Nivea,http://ecx.images-amazon.com/images/I/51H8OBWgTmL._AA160_.jpg,None,self Colour,Beauty & Health,http://www.amazon.in/Nivea-Butter-Raspberry-Rose-16-7g/dp/B00HQW4GGO/ref=sr_1_12/278-6275138-8771966?s=beauty&ie=UTF8&qid=1395127052&sr=1-12,[<a href="/gp/help/seller/at-a-glance.html/278-6275138-8771966?ie=UTF8&amp;isAmazonFulfilled=1&amp;seller=ADJ7WREVGU39P">Zephyr Online</a>  <a href="/gp/help/customer/display.html/278-6275138-8771966?ie=UTF8&amp;nodeId=200953360&amp;ref=dp_fulfillment" id="SSOFpopoverLink"><strong>Fulfilled by Amazon</strong></a>],Amazon.in: Buy Nivea Lip Butter Raspberry Rose  16.7g Online at Best Price in India | Amazon Beauty Store,Buy Nivea Lip Butter Raspberry Rose  16.7g at lowest price in India on Amazon.in. Check out Nivea Lip Butter Raspberry Rose  16.7g reviews  ratings  features  specifications and browse more Beauty products online at best prices on Amazon.in.,None,None,None,18:03:2014,None
B007E9JBOG,Nivea Lip Care Pure and Natural Camomile and Calendula,http://www.amazon.in/Skin-Care/b/ref=sd_allcat_beauty_skincare/276-6718833-1247838?ie=UTF8&node=1374407031,None,Skin Car,Lips,Nivea,http://ecx.images-amazon.com/images/I/51H8OBWgTmL._AA160_.jpg,None,self Colour,Beauty & Health,http://www.amazon.in/Nivea-Care-Natural-Camomile-Calendula/dp/B007E9JBOG/ref=sr_1_13/278-6275138-8771966?s=beauty&ie=UTF8&qid=1395127052&sr=1-13,[<a href="/gp/help/seller/at-a-glance.html/278-6275138-8771966?ie=UTF8&amp;isAmazonFulfilled=1&amp;seller=A3S589APE53IEY">Nykaa</a>  <a href="/gp/help/customer/display.html/278-6275138-8771966?ie=UTF8&amp;nodeId=200953360&amp;ref=dp_fulfillment" id="SSOFpopoverLink"><strong>Fulfilled by Amazon</strong></a>],Amazon.in: Buy Nivea Lip Care Pure and Natural Camomile and Calendula Online at Best Price in India | Amazon Beauty Store,Buy Nivea Lip Care Pure and Natural Camomile and Calendula at lowest price in India on Amazon.in. Check out Nivea Lip Care Pure and Natural Camomile and Calendula reviews  ratings  features  specifications and browse more Beauty products online at best prices on Amazon.in.,None,<div class="bucket" id="productDescription"> <h2>Product Description</h2> <div class="content"> <h3 class="productDescriptionSource"></h3> <div class="productDescriptionWrapper">        Nivea Pure and Natural Camomile and Calendula Lip Balm  the innovative formula of Nivea Pure and Natural is inspired by nature and contains chamomile and calendula extracts that calm and soothe through miniaturization. Your lips will be soft and healthy looking so you can feel naturally beautiful. Soothes sensitive lips through moisturization  no parabens  silicones or artificial colorants added with natural ingredients  certified organic shea butter and natural jojoba oil. Dermatologist tested.              <div class="emptyClear"> </div> </div> </div> </div>,None,18:03:2014,None
B007E9JD9Y,Nivea Lip Care Med Protection  4.8g,http://www.amazon.in/Skin-Care/b/ref=sd_allcat_beauty_skincare/276-6718833-1247838?ie=UTF8&node=1374407031,Rs. 145.00,Skin Car,Lips,Nivea,http://ecx.images-amazon.com/images/I/51H8OBWgTmL._AA160_.jpg,Rs. 145.00,self Colour,Beauty & Health,http://www.amazon.in/Nivea-Lip-Care-Protection-4-8g/dp/B007E9JD9Y/ref=sr_1_16/278-6275138-8771966?s=beauty&ie=UTF8&qid=1395127052&sr=1-16,[<a class="buyAction" href="/gp/offer-listing/B007E9JD9Y/ref=dp_olp_0/278-6275138-8771966?ie=UTF8&amp;condition=all">these sellers</a>],Amazon.in: Buy Nivea Lip Care Med Protection  4.8g Online at Best Price in India | Amazon Beauty Store,Buy Nivea Lip Care Med Protection  4.8g at lowest price in India on Amazon.in. Check out Nivea Lip Care Med Protection  4.8g reviews  ratings  features  specifications and browse more Beauty products online at best prices on Amazon.in.,None,<div class="bucket" id="productDescription"> <h2>Product Description</h2> <div class="content"> <h3 class="productDescriptionSource"></h3> <div class="productDescriptionWrapper">        Nivea Med Protection Lip Balm  the formula with the natural ingredients bisabol and wheat germ oil support the lips natural moisturisation process and protect them before they crack. Nivea Lip Care Med Protection is a must-have in dry conditions. Strengthens the resistance of your lips against external influences  gives long lasting moisture  provides extra care and protection. Contains SPF 12 and protection against UVA and UVB rays.              <div class="emptyClear"> </div> </div> </div> </div>,None,18:03:2014,None
B006LXA5XC,Nivea Lip Care Glamorous Gloss Pink Sugar,http://www.amazon.in/Skin-Care/b/ref=sd_allcat_beauty_skincare/276-6718833-1247838?ie=UTF8&node=1374407031,None,Skin Car,Lips,Nivea,http://ecx.images-amazon.com/images/I/51H8OBWgTmL._AA160_.jpg,None,self Colour,Beauty & Health,http://www.amazon.in/Nivea-Care-Glamorous-Gloss-Sugar/dp/B006LXA5XC/ref=sr_1_17/278-6275138-8771966?s=beauty&ie=UTF8&qid=1395127052&sr=1-17,[<a href="/gp/help/seller/at-a-glance.html/278-6275138-8771966?ie=UTF8&amp;seller=A2LF7LJJKR15QL">khoobsurati</a>],Amazon.in: Buy Nivea Lip Care Glamorous Gloss Pink Sugar Online at Best Price in India | Amazon Beauty Store,Buy Nivea Lip Care Glamorous Gloss Pink Sugar at lowest price in India on Amazon.in. Check out Nivea Lip Care Glamorous Gloss Pink Sugar reviews  ratings  features  specifications and browse more Beauty products online at best prices on Amazon.in.,None,<div class="bucket" id="productDescription"> <h2>Product Description</h2> <div class="content"> <h3 class="productDescriptionSource"></h3> <div class="productDescriptionWrapper">        Pink Sugar Nivea care gloss and shine pink gives your lips ultra-shiny finish. The high gloss formula of Nivea lip care glamorous gloss pink sugar gives a blush of pink and adds glamour and gloss to your lips. Ultra shine pigments give your lips a brilliant glow  while shea butter and vitamin E join forces to moisturize your lips  whether during the day or for that special night out. It beautifies your lips with stunning brilliance thanks to pink ultra-shine pigments.              <div class="emptyClear"> </div> </div> </div> </div>,None,18:03:2014,None
B006LXA8NY,Nivea Lip Care Pearly Shine  4.8g,http://www.amazon.in/Skin-Care/b/ref=sd_allcat_beauty_skincare/276-6718833-1247838?ie=UTF8&node=1374407031,None,Skin Car,Lips,Nivea,http://ecx.images-amazon.com/images/I/51H8OBWgTmL._AA160_.jpg,None,self Colour,Beauty & Health,http://www.amazon.in/Nivea-Care-Pearly-Shine-4-8g/dp/B006LXA8NY/ref=sr_1_15/278-6275138-8771966?s=beauty&ie=UTF8&qid=1395127052&sr=1-15,[<a href="/gp/help/seller/at-a-glance.html/278-6275138-8771966?ie=UTF8&amp;isAmazonFulfilled=1&amp;seller=ADJ7WREVGU39P">Zephyr Online</a>  <a href="/gp/help/customer/display.html/278-6275138-8771966?ie=UTF8&amp;nodeId=200953360&amp;ref=dp_fulfillment" id="SSOFpopoverLink"><strong>Fulfilled by Amazon</strong></a>],Amazon.in: Buy Nivea Lip Care Pearly Shine  4.8g Online at Best Price in India | Amazon Beauty Store,Buy Nivea Lip Care Pearly Shine  4.8g at lowest price in India on Amazon.in. Check out Nivea Lip Care Pearly Shine  4.8g reviews  ratings  features  specifications and browse more Beauty products online at best prices on Amazon.in.,None,<div class="bucket" id="productDescription"> <h2>Product Description</h2> <div class="content"> <h3 class="productDescriptionSource"></h3> <div class="productDescriptionWrapper">        Nivea Pearly Shine Lip Balm with a hint of rose and a pearly shimmer enhances the beauty of your lips. This new formula with precious pearl and silk extracts stores long lasting moisture while natural oils soften and condition. A creamy treat that leaves your lips velvety soft and silky smooth. Leaves your lips irresistibly silky smooth and well protected against chapping due to dryness and brings out the natural beauty of your lips with a sweet pearly shine.              <div class="emptyClear"> </div> </div> </div> </div>,None,18:03:2014,None
B00G6MOKE8,Nivea Lip Care Fruity Shine Pink Guava  4.8g (Pack of 3),http://www.amazon.in/Skin-Care/b/ref=sd_allcat_beauty_skincare/276-6718833-1247838?ie=UTF8&node=1374407031,None,Skin Car,Lips,Nivea,http://ecx.images-amazon.com/images/I/51H8OBWgTmL._AA160_.jpg,None,self Colour,Beauty & Health,http://www.amazon.in/Nivea-Care-Fruity-Shine-Guava/dp/B00G6MOKE8/ref=sr_1_19/278-6275138-8771966?s=beauty&ie=UTF8&qid=1395127052&sr=1-19,[<a href="/gp/help/seller/at-a-glance.html/278-6275138-8771966?ie=UTF8&amp;seller=A36B2MUBQK4XRS">SnapitToday</a>],Amazon.in: Buy Nivea Lip Care Fruity Shine Pink Guava  4.8g (Pack of 3) Online at Best Price in India | Amazon Beauty Store,Buy Nivea Lip Care Fruity Shine Pink Guava  4.8g (Pack of 3) at lowest price in India on Amazon.in. Check out Nivea Lip Care Fruity Shine Pink Guava  4.8g (Pack of 3) reviews  ratings  features  specifications and browse more Beauty products online at best prices on Amazon.in.,None,<div class="bucket" id="productDescription"> <h2>Product Description</h2> <div class="content"> <h3 class="productDescriptionSource"></h3> <div class="productDescriptionWrapper">        Nivea Lip Care Fruity Shine - Pink Guava : The innovative formula of Nivea Fruity Shine  with pink guava extracts and shimmering pigments  provides long lasting moisturization and a delicious fruity flavor to your lips. It gives you soft and smooth lips with a fabulous light pink shimmer.              <div class="emptyClear"> </div> </div> </div> </div>,None,18:03:2014,None
