B00G0Q3G22,Mebelkart Cushion Doormat-7,http://www.amazon.in/Cushions-Cushion-Covers/b/ref=sd_allcat_cushions?ie=UTF8&node=1380469031,Rs. 457.00,Cushions & Cushion Cover,Cushions & Cushion Cover,Mebelkart,http://ecx.images-amazon.com/images/I/31OaD0yyfZL._AA160_.jpg,Rs. 457.00,self Colour,Home & Kitchen,http://www.amazon.in/Mebelkart-MK3201CMVFBE2-Cushion-Doormat-7/dp/B00G0Q3G22/ref=sr_1_71/280-1123240-9275852?s=kitchen&ie=UTF8&qid=1395127195&sr=1-71,[<a class="buyAction" href="/gp/offer-listing/B00G0Q3G22/ref=dp_olp_0/280-1123240-9275852?ie=UTF8&amp;condition=all">these sellers</a>],Mebelkart Cushion Doormat-7: Amazon.in: Home & Kitchen,Mebelkart Cushion Doormat-7: Amazon.in: Home & Kitchen,None,<div class="bucket" id="productDescription"> <h2>Product Description</h2> <div class="content"> <h3 class="productDescriptionSource"></h3> <div class="productDescriptionWrapper">        These medium cushion mat is a soft vinyl net which trapes dirt as one wall of it has vinyl body construction which promotes moisture &amp; odour free net. These mats are incombustible.BRAND: FreelanceCOLOR :BeigeSIZE :68 X 40 CM              <div class="emptyClear"> </div> </div> </div> </div>,None,18:03:2014,None
B00G0Q3GL8,Mebelkart Cushion Doormat-8,http://www.amazon.in/Cushions-Cushion-Covers/b/ref=sd_allcat_cushions?ie=UTF8&node=1380469031,Rs. 457.00,Cushions & Cushion Cover,Cushions & Cushion Cover,Mebelkart,http://ecx.images-amazon.com/images/I/31OaD0yyfZL._AA160_.jpg,Rs. 457.00,self Colour,Home & Kitchen,http://www.amazon.in/Mebelkart-MK3202CMVFBR2-Cushion-Doormat-8/dp/B00G0Q3GL8/ref=sr_1_72/280-1123240-9275852?s=kitchen&ie=UTF8&qid=1395127195&sr=1-72,[<a class="buyAction" href="/gp/offer-listing/B00G0Q3GL8/ref=dp_olp_0/280-1123240-9275852?ie=UTF8&amp;condition=all">these sellers</a>],Mebelkart Cushion Doormat-8: Amazon.in: Home & Kitchen,Mebelkart Cushion Doormat-8: Amazon.in: Home & Kitchen,None,<div class="bucket" id="productDescription"> <h2>Product Description</h2> <div class="content"> <h3 class="productDescriptionSource"></h3> <div class="productDescriptionWrapper">        These medium cushion mat is a soft vinyl net which trapes dirt as one wall of it has vinyl body construction which promotes moisture &amp; odour free net. These mats are incombustible.BRAND: FreelanceCOLOR :BrownSIZE :68 X 40 CM              <div class="emptyClear"> </div> </div> </div> </div>,None,18:03:2014,None
B00GGBPG4W,Mebelkart Daddy Cool Cushion Cover,http://www.amazon.in/Cushions-Cushion-Covers/b/ref=sd_allcat_cushions?ie=UTF8&node=1380469031,Rs. 734.00,Cushions & Cushion Cover,Cushions & Cushion Cover,Mebelkart,http://ecx.images-amazon.com/images/I/31OaD0yyfZL._AA160_.jpg,Rs. 734.00,self Colour,Home & Kitchen,http://www.amazon.in/Mebelkart-Daddy-Cool-Cushion-Cover/dp/B00GGBPG4W/ref=sr_1_74/280-1123240-9275852?s=kitchen&ie=UTF8&qid=1395127199&sr=1-74,[<a class="buyAction" href="/gp/offer-listing/B00GGBPG4W/ref=dp_olp_0/280-1123240-9275852?ie=UTF8&amp;condition=all">these sellers</a>],Mebelkart Daddy Cool Cushion Cover: Amazon.in: Home & Kitchen,Mebelkart Daddy Cool Cushion Cover: Amazon.in: Home & Kitchen,None,<div class="bucket" id="productDescription"> <h2>Product Description</h2> <div class="content"> <h3 class="productDescriptionSource"></h3> <div class="productDescriptionWrapper">        Faux Dupion cushion cover with embroidery MATERIAL: Faux Dupion COLOR: Ivory SIZE: 16X16 (Inches) Brand : ULTRASNOB              <div class="emptyClear"> </div> </div> </div> </div>,None,18:03:2014,None
B00G0Q46D0,Mebelkart Daphnis Cushion Cover,http://www.amazon.in/Cushions-Cushion-Covers/b/ref=sd_allcat_cushions?ie=UTF8&node=1380469031,Rs. 944.00,Cushions & Cushion Cover,Cushions & Cushion Cover,Mebelkart,http://ecx.images-amazon.com/images/I/31OaD0yyfZL._AA160_.jpg,Rs. 944.00,self Colour,Home & Kitchen,http://www.amazon.in/Mebelkart-MK2696USDaphnis-Daphnis-Cushion-Cover/dp/B00G0Q46D0/ref=sr_1_76/280-1123240-9275852?s=kitchen&ie=UTF8&qid=1395127199&sr=1-76,[<a class="buyAction" href="/gp/offer-listing/B00G0Q46D0/ref=dp_olp_0/280-1123240-9275852?ie=UTF8&amp;condition=all">these sellers</a>],Mebelkart Daphnis Cushion Cover: Amazon.in: Home & Kitchen,Mebelkart Daphnis Cushion Cover: Amazon.in: Home & Kitchen,None,<div class="bucket" id="productDescription"> <h2>Product Description</h2> <div class="content"> <h3 class="productDescriptionSource"></h3> <div class="productDescriptionWrapper">        Pure Linen cushion with antique metallic embroidery MATERIAL: Pure Linen COLOR: Natural SIZE: 12X12 (Inches) Brand : ULTRASNOB              <div class="emptyClear"> </div> </div> </div> </div>,None,18:03:2014,None
B00EFDL5N4,Mebelkart Digital Funky Blue Yellow Swirls Cushion Cover Set,http://www.amazon.in/Cushions-Cushion-Covers/b/ref=sd_allcat_cushions?ie=UTF8&node=1380469031,Rs. 734.00,Cushions & Cushion Cover,Cushions & Cushion Cover,Mebelkart,http://ecx.images-amazon.com/images/I/31OaD0yyfZL._AA160_.jpg,Rs. 734.00,self Colour,Home & Kitchen,http://www.amazon.in/Mebelkart-Digital-Yellow-Swirls-Cushion/dp/B00EFDL5N4/ref=sr_1_77/280-1123240-9275852?s=kitchen&ie=UTF8&qid=1395127199&sr=1-77,[<a class="buyAction" href="/gp/offer-listing/B00EFDL5N4/ref=dp_olp_0/280-1123240-9275852?ie=UTF8&amp;condition=all">these sellers</a>],Mebelkart Digital Funky Blue Yellow Swirls Cushion Cover Set: Amazon.in: Home & Kitchen,Mebelkart Digital Funky Blue Yellow Swirls Cushion Cover Set: Amazon.in: Home & Kitchen,None,<div class="bucket" id="productDescription"> <h2>Product Description</h2> <div class="content"> <h3 class="productDescriptionSource"></h3> <div class="productDescriptionWrapper">        Features : Shape or Design description : Digital Printed Cushion Cover Set Dimensions ( in Inches ) : 16 x 16 in Color : Blue &amp; Yellow Fabric : Polytaffeta              <div class="emptyClear"> </div> </div> </div> </div>,None,18:03:2014,None
B00EFDLBCY,Mebelkart Digital Funky Candy Pink Cushion Cover Set,http://www.amazon.in/Cushions-Cushion-Covers/b/ref=sd_allcat_cushions?ie=UTF8&node=1380469031,Rs. 734.00,Cushions & Cushion Cover,Cushions & Cushion Cover,Mebelkart,http://ecx.images-amazon.com/images/I/31OaD0yyfZL._AA160_.jpg,Rs. 734.00,self Colour,Home & Kitchen,http://www.amazon.in/Mebelkart-Digital-Funky-Candy-Cushion/dp/B00EFDLBCY/ref=sr_1_78/280-1123240-9275852?s=kitchen&ie=UTF8&qid=1395127199&sr=1-78,[<a class="buyAction" href="/gp/offer-listing/B00EFDLBCY/ref=dp_olp_0/280-1123240-9275852?ie=UTF8&amp;condition=all">these sellers</a>],Mebelkart Digital Funky Candy Pink Cushion Cover Set: Amazon.in: Home & Kitchen,Mebelkart Digital Funky Candy Pink Cushion Cover Set: Amazon.in: Home & Kitchen,None,<div class="bucket" id="productDescription"> <h2>Product Description</h2> <div class="content"> <h3 class="productDescriptionSource"></h3> <div class="productDescriptionWrapper">        Features : Shape or Design description : Digital Printed Cushion Cover Set Dimensions ( in Inches ) : 16 x 16 in Color : Red &amp; Blue Fabric : Polytaffeta              <div class="emptyClear"> </div> </div> </div> </div>,None,18:03:2014,None
B00EFDLCFA,Mebelkart Digital Funky Colorful Geometrics Cushion Cover Set,http://www.amazon.in/Cushions-Cushion-Covers/b/ref=sd_allcat_cushions?ie=UTF8&node=1380469031,Rs. 734.00,Cushions & Cushion Cover,Cushions & Cushion Cover,Mebelkart,http://ecx.images-amazon.com/images/I/31OaD0yyfZL._AA160_.jpg,Rs. 734.00,Mebelkart Digital Funky Colorful Geometrics Cushion Cover Set,Home & Kitchen,http://www.amazon.in/Mebelkart-Digital-Colorful-Geometrics-Cushion/dp/B00EFDLCFA/ref=sr_1_79/280-1123240-9275852?s=kitchen&ie=UTF8&qid=1395127199&sr=1-79,[<a class="buyAction" href="/gp/offer-listing/B00EFDLCFA/ref=dp_olp_0/280-1123240-9275852?ie=UTF8&amp;condition=all">these sellers</a>],Mebelkart Digital Funky Colorful Geometrics Cushion Cover Set: Amazon.in: Home & Kitchen,Mebelkart Digital Funky Colorful Geometrics Cushion Cover Set: Amazon.in: Home & Kitchen,None,<div class="bucket" id="productDescription"> <h2>Product Description</h2> <div class="content"> <h3 class="productDescriptionSource"></h3> <div class="productDescriptionWrapper">        Features : Shape or Design description : Digital Printed Cushion Cover Set Dimensions ( in Inches ) : 16 x 16 in Color : Multicolor Fabric : Polytaffeta              <div class="emptyClear"> </div> </div> </div> </div>,None,18:03:2014,None
B00EFDL85Y,Mebelkart Digital Funky Colorful Waves Cushion Cover Set,http://www.amazon.in/Cushions-Cushion-Covers/b/ref=sd_allcat_cushions?ie=UTF8&node=1380469031,Rs. 734.00,Cushions & Cushion Cover,Cushions & Cushion Cover,Mebelkart,http://ecx.images-amazon.com/images/I/31OaD0yyfZL._AA160_.jpg,Rs. 734.00,Mebelkart Digital Funky Colorful Waves Cushion Cover Set,Home & Kitchen,http://www.amazon.in/Mebelkart-Digital-Funky-Colorful-Cushion/dp/B00EFDL85Y/ref=sr_1_80/280-1123240-9275852?s=kitchen&ie=UTF8&qid=1395127199&sr=1-80,[<a class="buyAction" href="/gp/offer-listing/B00EFDL85Y/ref=dp_olp_0/280-1123240-9275852?ie=UTF8&amp;condition=all">these sellers</a>],Mebelkart Digital Funky Colorful Waves Cushion Cover Set: Amazon.in: Home & Kitchen,Mebelkart Digital Funky Colorful Waves Cushion Cover Set: Amazon.in: Home & Kitchen,None,<div class="bucket" id="productDescription"> <h2>Product Description</h2> <div class="content"> <h3 class="productDescriptionSource"></h3> <div class="productDescriptionWrapper">        Features : Shape or Design description : Digital Printed Cushion Cover Set Dimensions ( in Inches ) : 16 x 16 in Color : Multicolor Fabric : Polytaffeta              <div class="emptyClear"> </div> </div> </div> </div>,None,18:03:2014,None
B00G0Q3H8K,Mebelkart Cushion Doormat-9,http://www.amazon.in/Cushions-Cushion-Covers/b/ref=sd_allcat_cushions?ie=UTF8&node=1380469031,Rs. 615.00,Cushions & Cushion Cover,Cushions & Cushion Cover,Mebelkart,http://ecx.images-amazon.com/images/I/31OaD0yyfZL._AA160_.jpg,Rs. 615.00,self Colour,Home & Kitchen,http://www.amazon.in/Mebelkart-MK3203CMVFBG3-Cushion-Doormat-9/dp/B00G0Q3H8K/ref=sr_1_73/280-1123240-9275852?s=kitchen&ie=UTF8&qid=1395127199&sr=1-73,[<a class="buyAction" href="/gp/offer-listing/B00G0Q3H8K/ref=dp_olp_0/280-1123240-9275852?ie=UTF8&amp;condition=all">these sellers</a>],Mebelkart Cushion Doormat-9: Amazon.in: Home & Kitchen,Mebelkart Cushion Doormat-9: Amazon.in: Home & Kitchen,None,<div class="bucket" id="productDescription"> <h2>Product Description</h2> <div class="content"> <h3 class="productDescriptionSource"></h3> <div class="productDescriptionWrapper">        These large cushion mat is a soft vinyl net which trapes dirt as one wall of it has vinyl body construction which promotes moisture &amp; odour free net. These mats are incombustible.BRAND: FreelanceCOLOR :BurgundySIZE :76 X 46 CM              <div class="emptyClear"> </div> </div> </div> </div>,None,18:03:2014,None
B00EFDL74G,Mebelkart Digital Funky Multi Color Swirls Cushion Cover Set,http://www.amazon.in/Cushions-Cushion-Covers/b/ref=sd_allcat_cushions?ie=UTF8&node=1380469031,Rs. 734.00,Cushions & Cushion Cover,Cushions & Cushion Cover,Mebelkart,http://ecx.images-amazon.com/images/I/31OaD0yyfZL._AA160_.jpg,Rs. 734.00,Mebelkart Digital Funky Multi Color Swirls Cushion Cover Set,Home & Kitchen,http://www.amazon.in/Mebelkart-Digital-Funky-Swirls-Cushion/dp/B00EFDL74G/ref=sr_1_81/280-1123240-9275852?s=kitchen&ie=UTF8&qid=1395127199&sr=1-81,[<a class="buyAction" href="/gp/offer-listing/B00EFDL74G/ref=dp_olp_0/280-1123240-9275852?ie=UTF8&amp;condition=all">these sellers</a>],Mebelkart Digital Funky Multi Color Swirls Cushion Cover Set: Amazon.in: Home & Kitchen,Mebelkart Digital Funky Multi Color Swirls Cushion Cover Set: Amazon.in: Home & Kitchen,None,<div class="bucket" id="productDescription"> <h2>Product Description</h2> <div class="content"> <h3 class="productDescriptionSource"></h3> <div class="productDescriptionWrapper">        Features : Shape or Design description : Digital Printed Cushion Cover Set Dimensions ( in Inches ) : 16 x 16 in Color : Multi Fabric : Polytaffeta              <div class="emptyClear"> </div> </div> </div> </div>,None,18:03:2014,None
B00G0Q4FNQ,Mebelkart Doniv Cushion "Printed Feathers design",http://www.amazon.in/Cushions-Cushion-Covers/b/ref=sd_allcat_cushions?ie=UTF8&node=1380469031,Rs. 683.00,Cushions & Cushion Cover,Cushions & Cushion Cover,Mebelkart,http://ecx.images-amazon.com/images/I/31OaD0yyfZL._AA160_.jpg,Rs. 683.00,self Colour,Home & Kitchen,http://www.amazon.in/Mebelkart-Cushion-Printed-Feathers-design/dp/B00G0Q4FNQ/ref=sr_1_83/280-1123240-9275852?s=kitchen&ie=UTF8&qid=1395127199&sr=1-83,[<a class="buyAction" href="/gp/offer-listing/B00G0Q4FNQ/ref=dp_olp_0/280-1123240-9275852?ie=UTF8&amp;condition=all">these sellers</a>],Mebelkart Doniv Cushion "Printed Feathers design": Amazon.in: Home & Kitchen,Mebelkart Doniv Cushion "Printed Feathers design": Amazon.in: Home & Kitchen,None,<div class="bucket" id="productDescription"> <h2>Product Description</h2> <div class="content"> <h3 class="productDescriptionSource"></h3> <div class="productDescriptionWrapper">        Cushion Cover Without FillerColor: MultiMaterial: Poly DupionDimensions(LxW in inches):16X16              <div class="emptyClear"> </div> </div> </div> </div>,None,18:03:2014,None
B00G0Q4AVI,Mebelkart Eirene Cushion Cover,http://www.amazon.in/Cushions-Cushion-Covers/b/ref=sd_allcat_cushions?ie=UTF8&node=1380469031,Rs. 1 259.00,Cushions & Cushion Cover,Cushions & Cushion Cover,Mebelkart,http://ecx.images-amazon.com/images/I/31OaD0yyfZL._AA160_.jpg,Rs. 1 259.00,self Colour,Home & Kitchen,http://www.amazon.in/Mebelkart-MK2708USEirene-Eirene-Cushion-Cover/dp/B00G0Q4AVI/ref=sr_1_84/280-1123240-9275852?s=kitchen&ie=UTF8&qid=1395127199&sr=1-84,[<a class="buyAction" href="/gp/offer-listing/B00G0Q4AVI/ref=dp_olp_0/280-1123240-9275852?ie=UTF8&amp;condition=all">these sellers</a>],Mebelkart Eirene Cushion Cover: Amazon.in: Home & Kitchen,Mebelkart Eirene Cushion Cover: Amazon.in: Home & Kitchen,None,<div class="bucket" id="productDescription"> <h2>Product Description</h2> <div class="content"> <h3 class="productDescriptionSource"></h3> <div class="productDescriptionWrapper">        Pure Linen with silver foiling cushion cover with antique beadwork MATERIAL: Pure Linen COLOR: Silver/Natural SIZE: 16X16 (Inches) Brand : ULTRASNOB              <div class="emptyClear"> </div> </div> </div> </div>,None,18:03:2014,None
B00ESG4DZK,Mebelkart El Verde-Fishscales Cushion Cover,http://www.amazon.in/Cushions-Cushion-Covers/b/ref=sd_allcat_cushions?ie=UTF8&node=1380469031,Rs. 944.00,Cushions & Cushion Cover,Cushions & Cushion Cover,Mebelkart,http://ecx.images-amazon.com/images/I/31OaD0yyfZL._AA160_.jpg,Rs. 944.00,self Colour,Home & Kitchen,http://www.amazon.in/Mebelkart-El-Verde-Fishscales-Cushion-Cover/dp/B00ESG4DZK/ref=sr_1_85/280-1123240-9275852?s=kitchen&ie=UTF8&qid=1395127199&sr=1-85,[<a class="buyAction" href="/gp/offer-listing/B00ESG4DZK/ref=dp_olp_0/280-1123240-9275852?ie=UTF8&amp;condition=all">these sellers</a>],Mebelkart El Verde-Fishscales Cushion Cover: Amazon.in: Home & Kitchen,Mebelkart El Verde-Fishscales Cushion Cover: Amazon.in: Home & Kitchen,None,<div class="bucket" id="productDescription"> <h2>Product Description</h2> <div class="content"> <h3 class="productDescriptionSource"></h3> <div class="productDescriptionWrapper">        Jade Faux Silk sequins work cushion cover MATERIAL: Faux Silk COLOR: Jade SIZE: 12X16 (Inches) Brand : ULTRASNOB              <div class="emptyClear"> </div> </div> </div> </div>,None,18:03:2014,None
B00EFDL9VC,Mebelkart Digital Funky Rainbow Cushion Cover Set,http://www.amazon.in/Cushions-Cushion-Covers/b/ref=sd_allcat_cushions?ie=UTF8&node=1380469031,Rs. 734.00,Cushions & Cushion Cover,Cushions & Cushion Cover,Mebelkart,http://ecx.images-amazon.com/images/I/31OaD0yyfZL._AA160_.jpg,Rs. 734.00,self Colour,Home & Kitchen,http://www.amazon.in/Mebelkart-Digital-Funky-Rainbow-Cushion/dp/B00EFDL9VC/ref=sr_1_82/280-1123240-9275852?s=kitchen&ie=UTF8&qid=1395127199&sr=1-82,[<a class="buyAction" href="/gp/offer-listing/B00EFDL9VC/ref=dp_olp_0/280-1123240-9275852?ie=UTF8&amp;condition=all">these sellers</a>],Mebelkart Digital Funky Rainbow Cushion Cover Set: Amazon.in: Home & Kitchen,Mebelkart Digital Funky Rainbow Cushion Cover Set: Amazon.in: Home & Kitchen,None,<div class="bucket" id="productDescription"> <h2>Product Description</h2> <div class="content"> <h3 class="productDescriptionSource"></h3> <div class="productDescriptionWrapper">        Features : Shape or Design description : Digital Printed Cushion Cover Set Dimensions ( in Inches ) : 16 x 16 in Color : Multi Fabric : Polytaffeta              <div class="emptyClear"> </div> </div> </div> </div>,None,18:03:2014,None
B00ESG4E9A,Mebelkart El Verde-Flora Cushion Cover,http://www.amazon.in/Cushions-Cushion-Covers/b/ref=sd_allcat_cushions?ie=UTF8&node=1380469031,Rs. 839.00,Cushions & Cushion Cover,Cushions & Cushion Cover,Mebelkart,http://ecx.images-amazon.com/images/I/31OaD0yyfZL._AA160_.jpg,Rs. 839.00,self Colour,Home & Kitchen,http://www.amazon.in/Mebelkart-El-Verde-Flora-Cushion-Cover/dp/B00ESG4E9A/ref=sr_1_86/280-1123240-9275852?s=kitchen&ie=UTF8&qid=1395127199&sr=1-86,[<a class="buyAction" href="/gp/offer-listing/B00ESG4E9A/ref=dp_olp_0/280-1123240-9275852?ie=UTF8&amp;condition=all">these sellers</a>],Mebelkart El Verde-Flora Cushion Cover: Amazon.in: Home & Kitchen,Mebelkart El Verde-Flora Cushion Cover: Amazon.in: Home & Kitchen,None,<div class="bucket" id="productDescription"> <h2>Product Description</h2> <div class="content"> <h3 class="productDescriptionSource"></h3> <div class="productDescriptionWrapper">        Lime Faux Silk cushion cover with quilting and embroidery MATERIAL: Faux Silk COLOR: Lime SIZE: 12X16 (Inches) Brand : ULTRASNOB              <div class="emptyClear"> </div> </div> </div> </div>,None,18:03:2014,None
B00ESG4F4E,Mebelkart El Verde-Swirls Cushion Cover,http://www.amazon.in/Cushions-Cushion-Covers/b/ref=sd_allcat_cushions?ie=UTF8&node=1380469031,Rs. 839.00,Cushions & Cushion Cover,Cushions & Cushion Cover,Mebelkart,http://ecx.images-amazon.com/images/I/31OaD0yyfZL._AA160_.jpg,Rs. 839.00,self Colour,Home & Kitchen,http://www.amazon.in/Mebelkart-El-Verde-Swirls-Cushion-Cover/dp/B00ESG4F4E/ref=sr_1_89/280-1123240-9275852?s=kitchen&ie=UTF8&qid=1395127199&sr=1-89,[<a class="buyAction" href="/gp/offer-listing/B00ESG4F4E/ref=dp_olp_0/280-1123240-9275852?ie=UTF8&amp;condition=all">these sellers</a>],Mebelkart El Verde-Swirls Cushion Cover: Amazon.in: Home & Kitchen,Mebelkart El Verde-Swirls Cushion Cover: Amazon.in: Home & Kitchen,None,<div class="bucket" id="productDescription"> <h2>Product Description</h2> <div class="content"> <h3 class="productDescriptionSource"></h3> <div class="productDescriptionWrapper">        Green organza embroidered and sequins work cushion cover MATERIAL: Organza COLOR: Green SIZE: 16X16 (Inches) Brand : ULTRASNOB              <div class="emptyClear"> </div> </div> </div> </div>,None,18:03:2014,None
B00ESG4EJA,Mebelkart El Verde-Glitterati Cushion Cover,http://www.amazon.in/Cushions-Cushion-Covers/b/ref=sd_allcat_cushions?ie=UTF8&node=1380469031,Rs. 944.00,Cushions & Cushion Cover,Cushions & Cushion Cover,Mebelkart,http://ecx.images-amazon.com/images/I/31OaD0yyfZL._AA160_.jpg,Rs. 944.00,self Colour,Home & Kitchen,http://www.amazon.in/Mebelkart-El-Verde-Glitterati-Cushion-Cover/dp/B00ESG4EJA/ref=sr_1_87/280-1123240-9275852?s=kitchen&ie=UTF8&qid=1395127199&sr=1-87,[<a class="buyAction" href="/gp/offer-listing/B00ESG4EJA/ref=dp_olp_0/280-1123240-9275852?ie=UTF8&amp;condition=all">these sellers</a>],Mebelkart El Verde-Glitterati Cushion Cover: Amazon.in: Home & Kitchen,Mebelkart El Verde-Glitterati Cushion Cover: Amazon.in: Home & Kitchen,None,<div class="bucket" id="productDescription"> <h2>Product Description</h2> <div class="content"> <h3 class="productDescriptionSource"></h3> <div class="productDescriptionWrapper">        Lime Faux silk cushion cover with sequins work MATERIAL: Faux Silk COLOR: Lime SIZE: 12X16 (Inches) Brand : ULTRASNOB              <div class="emptyClear"> </div> </div> </div> </div>,None,18:03:2014,None
B00ESG4ERW,Mebelkart El Verde-Sprinkle Cushion Cover,http://www.amazon.in/Cushions-Cushion-Covers/b/ref=sd_allcat_cushions?ie=UTF8&node=1380469031,Rs. 839.00,Cushions & Cushion Cover,Cushions & Cushion Cover,Mebelkart,http://ecx.images-amazon.com/images/I/31OaD0yyfZL._AA160_.jpg,Rs. 839.00,self Colour,Home & Kitchen,http://www.amazon.in/Mebelkart-El-Verde-Sprinkle-Cushion-Cover/dp/B00ESG4ERW/ref=sr_1_88/280-1123240-9275852?s=kitchen&ie=UTF8&qid=1395127199&sr=1-88,[<a class="buyAction" href="/gp/offer-listing/B00ESG4ERW/ref=dp_olp_0/280-1123240-9275852?ie=UTF8&amp;condition=all">these sellers</a>],Mebelkart El Verde-Sprinkle Cushion Cover: Amazon.in: Home & Kitchen,Mebelkart El Verde-Sprinkle Cushion Cover: Amazon.in: Home & Kitchen,None,<div class="bucket" id="productDescription"> <h2>Product Description</h2> <div class="content"> <h3 class="productDescriptionSource"></h3> <div class="productDescriptionWrapper">        Green all-over zigzag sequins work cushion cover MATERIAL: Faux Silk COLOR: Green SIZE: 16X16 (Inches) Brand : ULTRASNOB              <div class="emptyClear"> </div> </div> </div> </div>,None,18:03:2014,None
B00ESG3YYQ,Mebelkart Eridanus-Chocolate Cushion Cover,http://www.amazon.in/Cushions-Cushion-Covers/b/ref=sd_allcat_cushions?ie=UTF8&node=1380469031,Rs. 734.00,Cushions & Cushion Cover,Cushions & Cushion Cover,Mebelkart,http://ecx.images-amazon.com/images/I/31OaD0yyfZL._AA160_.jpg,Rs. 734.00,self Colour,Home & Kitchen,http://www.amazon.in/Mebelkart-MK2573USEridanus-Chocolate-Eridanus-Chocolate-Cushion-Cover/dp/B00ESG3YYQ/ref=sr_1_90/280-1123240-9275852?s=kitchen&ie=UTF8&qid=1395127199&sr=1-90,[<a class="buyAction" href="/gp/offer-listing/B00ESG3YYQ/ref=dp_olp_0/280-1123240-9275852?ie=UTF8&amp;condition=all">these sellers</a>],Mebelkart Eridanus-Chocolate Cushion Cover: Amazon.in: Home & Kitchen,Mebelkart Eridanus-Chocolate Cushion Cover: Amazon.in: Home & Kitchen,None,<div class="bucket" id="productDescription"> <h2>Product Description</h2> <div class="content"> <h3 class="productDescriptionSource"></h3> <div class="productDescriptionWrapper">        Rich Clustered beads/sequins covered cushion cover MATERIAL: Faux Dupion COLOR: Chocolate SIZE: 12X12 (Inches) Brand : ULTRASNOB              <div class="emptyClear"> </div> </div> </div> </div>,None,18:03:2014,None
B00ESG3ZLS,Mebelkart Eridanus-Lavender Cushion Cover,http://www.amazon.in/Cushions-Cushion-Covers/b/ref=sd_allcat_cushions?ie=UTF8&node=1380469031,Rs. 734.00,Cushions & Cushion Cover,Cushions & Cushion Cover,Mebelkart,http://ecx.images-amazon.com/images/I/31OaD0yyfZL._AA160_.jpg,Rs. 734.00,self Colour,Home & Kitchen,http://www.amazon.in/Mebelkart-MK2575USEridanus-Lavender-Eridanus-Lavender-Cushion-Cover/dp/B00ESG3ZLS/ref=sr_1_92/280-1123240-9275852?s=kitchen&ie=UTF8&qid=1395127199&sr=1-92,[<a class="buyAction" href="/gp/offer-listing/B00ESG3ZLS/ref=dp_olp_0/280-1123240-9275852?ie=UTF8&amp;condition=all">these sellers</a>],Mebelkart Eridanus-Lavender Cushion Cover: Amazon.in: Home & Kitchen,Mebelkart Eridanus-Lavender Cushion Cover: Amazon.in: Home & Kitchen,None,<div class="bucket" id="productDescription"> <h2>Product Description</h2> <div class="content"> <h3 class="productDescriptionSource"></h3> <div class="productDescriptionWrapper">        Rich Clustered beads/sequins covered cushion cover MATERIAL: Faux Dupion COLOR: Lavender SIZE: 12X12 (Inches) Brand : ULTRASNOB              <div class="emptyClear"> </div> </div> </div> </div>,None,18:03:2014,None
B00ESG3ZCM,Mebelkart Eridanus-Damson Cushion Cover,http://www.amazon.in/Cushions-Cushion-Covers/b/ref=sd_allcat_cushions?ie=UTF8&node=1380469031,Rs. 734.00,Cushions & Cushion Cover,Cushions & Cushion Cover,Mebelkart,http://ecx.images-amazon.com/images/I/31OaD0yyfZL._AA160_.jpg,Rs. 734.00,self Colour,Home & Kitchen,http://www.amazon.in/Mebelkart-MK2574USEridanus-Damson-Eridanus-Damson-Cushion-Cover/dp/B00ESG3ZCM/ref=sr_1_91/280-1123240-9275852?s=kitchen&ie=UTF8&qid=1395127199&sr=1-91,[<a class="buyAction" href="/gp/offer-listing/B00ESG3ZCM/ref=dp_olp_0/280-1123240-9275852?ie=UTF8&amp;condition=all">these sellers</a>],Mebelkart Eridanus-Damson Cushion Cover: Amazon.in: Home & Kitchen,Mebelkart Eridanus-Damson Cushion Cover: Amazon.in: Home & Kitchen,None,<div class="bucket" id="productDescription"> <h2>Product Description</h2> <div class="content"> <h3 class="productDescriptionSource"></h3> <div class="productDescriptionWrapper">        Rich Clustered beads/sequins covered cushion cover MATERIAL: Faux Dupion COLOR: Damson SIZE: 12X12 (Inches) Brand : ULTRASNOB              <div class="emptyClear"> </div> </div> </div> </div>,None,18:03:2014,None
B00ESG403U,Mebelkart Eridanus-Silver Cushion Cover,http://www.amazon.in/Cushions-Cushion-Covers/b/ref=sd_allcat_cushions?ie=UTF8&node=1380469031,Rs. 734.00,Cushions & Cushion Cover,Cushions & Cushion Cover,Mebelkart,http://ecx.images-amazon.com/images/I/31OaD0yyfZL._AA160_.jpg,Rs. 734.00,self Colour,Home & Kitchen,http://www.amazon.in/Mebelkart-MK2576USEridanus-Silver-Eridanus-Silver-Cushion-Cover/dp/B00ESG403U/ref=sr_1_93/280-1123240-9275852?s=kitchen&ie=UTF8&qid=1395127199&sr=1-93,[<a class="buyAction" href="/gp/offer-listing/B00ESG403U/ref=dp_olp_0/280-1123240-9275852?ie=UTF8&amp;condition=all">these sellers</a>],Mebelkart Eridanus-Silver Cushion Cover: Amazon.in: Home & Kitchen,Mebelkart Eridanus-Silver Cushion Cover: Amazon.in: Home & Kitchen,None,<div class="bucket" id="productDescription"> <h2>Product Description</h2> <div class="content"> <h3 class="productDescriptionSource"></h3> <div class="productDescriptionWrapper">        Rich Clustered beads/sequins covered cushion cover MATERIAL: Faux Dupion COLOR: Silver SIZE: 12X12 (Inches) Brand : ULTRASNOB              <div class="emptyClear"> </div> </div> </div> </div>,None,18:03:2014,None
