B00G0Q3E6K,Mebelkart Achoris Cushion Cover,http://www.amazon.in/Cushions-Cushion-Covers/b/ref=sd_allcat_cushions?ie=UTF8&node=1380469031,Rs. 734.00,Cushions & Cushion Cover,Cushions & Cushion Cover,Mebelkart,http://ecx.images-amazon.com/images/I/31OaD0yyfZL._AA160_.jpg,Rs. 734.00,self Colour,Home & Kitchen,http://www.amazon.in/Mebelkart-MK2628USAchoris-Achoris-Cushion-Cover/dp/B00G0Q3E6K/ref=sr_1_5/279-8772023-7637911?s=kitchen&ie=UTF8&qid=1395127012&sr=1-5,[<a class="buyAction" href="/gp/offer-listing/B00G0Q3E6K/ref=dp_olp_0/279-8772023-7637911?ie=UTF8&amp;condition=all">these sellers</a>],Mebelkart Achoris Cushion Cover: Amazon.in: Home & Kitchen,Mebelkart Achoris Cushion Cover: Amazon.in: Home & Kitchen,None,<div class="bucket" id="productDescription"> <h2>Product Description</h2> <div class="content"> <h3 class="productDescriptionSource"></h3> <div class="productDescriptionWrapper">        Printed Leather/Faux Dupion Reversible filled cushion with antique broach MATERIAL: Faux Leather COLOR: Grey SIZE: 12X12 (Inches) Brand : ULTRASNOB              <div class="emptyClear"> </div> </div> </div> </div>,None,18:03:2014,None
B00G0Q3EM4,Mebelkart Adonis Cushion Cover,http://www.amazon.in/Cushions-Cushion-Covers/b/ref=sd_allcat_cushions?ie=UTF8&node=1380469031,Rs. 734.00,Cushions & Cushion Cover,Cushions & Cushion Cover,Mebelkart,http://ecx.images-amazon.com/images/I/31OaD0yyfZL._AA160_.jpg,Rs. 734.00,self Colour,Home & Kitchen,http://www.amazon.in/Mebelkart-MK2629USAdonis-Adonis-Cushion-Cover/dp/B00G0Q3EM4/ref=sr_1_7/279-8772023-7637911?s=kitchen&ie=UTF8&qid=1395127012&sr=1-7,[<a class="buyAction" href="/gp/offer-listing/B00G0Q3EM4/ref=dp_olp_0/279-8772023-7637911?ie=UTF8&amp;condition=all">these sellers</a>],Mebelkart Adonis Cushion Cover: Amazon.in: Home & Kitchen,Mebelkart Adonis Cushion Cover: Amazon.in: Home & Kitchen,None,<div class="bucket" id="productDescription"> <h2>Product Description</h2> <div class="content"> <h3 class="productDescriptionSource"></h3> <div class="productDescriptionWrapper">        Faux Dupion cushion cover with soutache embroidery MATERIAL: Faux Dupion COLOR: Olive SIZE: 18X18 (Inches) Brand : ULTRASNOB              <div class="emptyClear"> </div> </div> </div> </div>,None,18:03:2014,None
B00G0Q436U,Mebelkart Acastus Cushion Cover,http://www.amazon.in/Cushions-Cushion-Covers/b/ref=sd_allcat_cushions?ie=UTF8&node=1380469031,Rs. 944.00,Cushions & Cushion Cover,Cushions & Cushion Cover,Mebelkart,http://ecx.images-amazon.com/images/I/31OaD0yyfZL._AA160_.jpg,Rs. 944.00,self Colour,Home & Kitchen,http://www.amazon.in/Mebelkart-MK2688USAcastus-Acastus-Cushion-Cover/dp/B00G0Q436U/ref=sr_1_3/279-8772023-7637911?s=kitchen&ie=UTF8&qid=1395127012&sr=1-3,[<a class="buyAction" href="/gp/offer-listing/B00G0Q436U/ref=dp_olp_0/279-8772023-7637911?ie=UTF8&amp;condition=all">these sellers</a>],Mebelkart Acastus Cushion Cover: Amazon.in: Home & Kitchen,Mebelkart Acastus Cushion Cover: Amazon.in: Home & Kitchen,None,<div class="bucket" id="productDescription"> <h2>Product Description</h2> <div class="content"> <h3 class="productDescriptionSource"></h3> <div class="productDescriptionWrapper">        Pure Linen cushion with antique metallic embroidery MATERIAL: Pure Linen COLOR: Natural SIZE: 12X12 (Inches) Brand : ULTRASNOB              <div class="emptyClear"> </div> </div> </div> </div>,None,18:03:2014,None
B00G0Q3DTI,Mebelkart Achilles Cushion Cover,http://www.amazon.in/Cushions-Cushion-Covers/b/ref=sd_allcat_cushions?ie=UTF8&node=1380469031,Rs. 839.00,Cushions & Cushion Cover,Cushions & Cushion Cover,Mebelkart,http://ecx.images-amazon.com/images/I/31OaD0yyfZL._AA160_.jpg,Rs. 839.00,self Colour,Home & Kitchen,http://www.amazon.in/Mebelkart-MK2627USAchilles-Achilles-Cushion-Cover/dp/B00G0Q3DTI/ref=sr_1_4/279-8772023-7637911?s=kitchen&ie=UTF8&qid=1395127012&sr=1-4,[<a class="buyAction" href="/gp/offer-listing/B00G0Q3DTI/ref=dp_olp_0/279-8772023-7637911?ie=UTF8&amp;condition=all">these sellers</a>],Mebelkart Achilles Cushion Cover: Amazon.in: Home & Kitchen,Mebelkart Achilles Cushion Cover: Amazon.in: Home & Kitchen,None,<div class="bucket" id="productDescription"> <h2>Product Description</h2> <div class="content"> <h3 class="productDescriptionSource"></h3> <div class="productDescriptionWrapper">        Faux Dupion cushion cover with quilted embroidery MATERIAL: Faux Dupion COLOR: Silver SIZE: 18X18 (Inches) Brand : ULTRASNOB              <div class="emptyClear"> </div> </div> </div> </div>,None,18:03:2014,None
B00G0Q46YY,Mebelkart Acantha Cushion Cover,http://www.amazon.in/Cushions-Cushion-Covers/b/ref=sd_allcat_cushions?ie=UTF8&node=1380469031,Rs. 1 049.00,Cushions & Cushion Cover,Cushions & Cushion Cover,Mebelkart,http://ecx.images-amazon.com/images/I/31OaD0yyfZL._AA160_.jpg,Rs. 1 049.00,self Colour,Home & Kitchen,http://www.amazon.in/Mebelkart-MK2698USAcantha-Acantha-Cushion-Cover/dp/B00G0Q46YY/ref=sr_1_2/279-8772023-7637911?s=kitchen&ie=UTF8&qid=1395127012&sr=1-2,[<a class="buyAction" href="/gp/offer-listing/B00G0Q46YY/ref=dp_olp_0/279-8772023-7637911?ie=UTF8&amp;condition=all">these sellers</a>],Mebelkart Acantha Cushion Cover: Amazon.in: Home & Kitchen,Mebelkart Acantha Cushion Cover: Amazon.in: Home & Kitchen,None,<div class="bucket" id="productDescription"> <h2>Product Description</h2> <div class="content"> <h3 class="productDescriptionSource"></h3> <div class="productDescriptionWrapper">        Oxford Weave Pure Linen Cushion Cover with antiuqe beadwork MATERIAL: Pure Linen COLOR: Natural SIZE: 18X18 (Inches) Brand : ULTRASNOB              <div class="emptyClear"> </div> </div> </div> </div>,None,18:03:2014,None
B00G0Q3JVA,Mebelkart Actaeon Cushion Cover,http://www.amazon.in/Cushions-Cushion-Covers/b/ref=sd_allcat_cushions?ie=UTF8&node=1380469031,Rs. 944.00,Cushions & Cushion Cover,Cushions & Cushion Cover,Mebelkart,http://ecx.images-amazon.com/images/I/31OaD0yyfZL._AA160_.jpg,Rs. 944.00,self Colour,Home & Kitchen,http://www.amazon.in/Mebelkart-MK2642USActaeon-Actaeon-Cushion-Cover/dp/B00G0Q3JVA/ref=sr_1_6/279-8772023-7637911?s=kitchen&ie=UTF8&qid=1395127012&sr=1-6,[<a class="buyAction" href="/gp/offer-listing/B00G0Q3JVA/ref=dp_olp_0/279-8772023-7637911?ie=UTF8&amp;condition=all">these sellers</a>],Mebelkart Actaeon Cushion Cover: Amazon.in: Home & Kitchen,Mebelkart Actaeon Cushion Cover: Amazon.in: Home & Kitchen,None,<div class="bucket" id="productDescription"> <h2>Product Description</h2> <div class="content"> <h3 class="productDescriptionSource"></h3> <div class="productDescriptionWrapper">        Intricately beaded/sequins worked net cushion with contrast satin underlay MATERIAL: Net/Satin COLOR: Black/Silver SIZE: 9X17 (Inches) Brand : ULTRASNOB              <div class="emptyClear"> </div> </div> </div> </div>,None,18:03:2014,None
B00G0Q3F1Y,Mebelkart Aedan Cushion Cover,http://www.amazon.in/Cushions-Cushion-Covers/b/ref=sd_allcat_cushions?ie=UTF8&node=1380469031,Rs. 734.00,Cushions & Cushion Cover,Cushions & Cushion Cover,Mebelkart,http://ecx.images-amazon.com/images/I/31OaD0yyfZL._AA160_.jpg,Rs. 734.00,self Colour,Home & Kitchen,http://www.amazon.in/Mebelkart-MK2630USAedan-Aedan-Cushion-Cover/dp/B00G0Q3F1Y/ref=sr_1_9/279-8772023-7637911?s=kitchen&ie=UTF8&qid=1395127012&sr=1-9,[<a class="buyAction" href="/gp/offer-listing/B00G0Q3F1Y/ref=dp_olp_0/279-8772023-7637911?ie=UTF8&amp;condition=all">these sellers</a>],Mebelkart Aedan Cushion Cover: Amazon.in: Home & Kitchen,Mebelkart Aedan Cushion Cover: Amazon.in: Home & Kitchen,None,<div class="bucket" id="productDescription"> <h2>Product Description</h2> <div class="content"> <h3 class="productDescriptionSource"></h3> <div class="productDescriptionWrapper">        Faux Silk cushion cover with felt applique MATERIAL: Faux Silk COLOR: Chocolate SIZE: 18X18 (Inches) Brand : ULTRASNOB              <div class="emptyClear"> </div> </div> </div> </div>,None,18:03:2014,None
B00G0Q43MY,Mebelkart Adrastea Cushion Cover,http://www.amazon.in/Cushions-Cushion-Covers/b/ref=sd_allcat_cushions?ie=UTF8&node=1380469031,Rs. 944.00,Cushions & Cushion Cover,Cushions & Cushion Cover,Mebelkart,http://ecx.images-amazon.com/images/I/31OaD0yyfZL._AA160_.jpg,Rs. 944.00,self Colour,Home & Kitchen,http://www.amazon.in/Mebelkart-MK2689USAdrastea-Adrastea-Cushion-Cover/dp/B00G0Q43MY/ref=sr_1_8/279-8772023-7637911?s=kitchen&ie=UTF8&qid=1395127012&sr=1-8,[<a class="buyAction" href="/gp/offer-listing/B00G0Q43MY/ref=dp_olp_0/279-8772023-7637911?ie=UTF8&amp;condition=all">these sellers</a>],Mebelkart Adrastea Cushion Cover: Amazon.in: Home & Kitchen,Mebelkart Adrastea Cushion Cover: Amazon.in: Home & Kitchen,None,<div class="bucket" id="productDescription"> <h2>Product Description</h2> <div class="content"> <h3 class="productDescriptionSource"></h3> <div class="productDescriptionWrapper">        Pure Linen cushion with antique metallic embroidery MATERIAL: Pure Linen COLOR: Natural SIZE: 12X12 (Inches) Brand : ULTRASNOB              <div class="emptyClear"> </div> </div> </div> </div>,None,18:03:2014,None
B00G0Q3FSW,Mebelkart Aeolus Cushion Cover,http://www.amazon.in/Cushions-Cushion-Covers/b/ref=sd_allcat_cushions?ie=UTF8&node=1380469031,Rs. 734.00,Cushions & Cushion Cover,Cushions & Cushion Cover,Mebelkart,http://ecx.images-amazon.com/images/I/31OaD0yyfZL._AA160_.jpg,Rs. 734.00,self Colour,Home & Kitchen,http://www.amazon.in/Mebelkart-MK2632USAeolus-Aeolus-Cushion-Cover/dp/B00G0Q3FSW/ref=sr_1_14/279-8772023-7637911?s=kitchen&ie=UTF8&qid=1395127012&sr=1-14,[<a class="buyAction" href="/gp/offer-listing/B00G0Q3FSW/ref=dp_olp_0/279-8772023-7637911?ie=UTF8&amp;condition=all">these sellers</a>],Mebelkart Aeolus Cushion Cover: Amazon.in: Home & Kitchen,Mebelkart Aeolus Cushion Cover: Amazon.in: Home & Kitchen,None,<div class="bucket" id="productDescription"> <h2>Product Description</h2> <div class="content"> <h3 class="productDescriptionSource"></h3> <div class="productDescriptionWrapper">        Faux Silk cushion cover with embroidery MATERIAL: Faux Silk COLOR: Chocolate SIZE: 18X18 (Inches) Brand : ULTRASNOB              <div class="emptyClear"> </div> </div> </div> </div>,None,18:03:2014,None
B00D6KE7OG,Mebelkart Vivien Cushion cum Pillow Set of 2,http://www.amazon.in/Cushions-Cushion-Covers/b/ref=sd_allcat_cushions?ie=UTF8&node=1380469031,Rs. 419.00,Cushions & Cushion Cover,Cushions & Cushion Cover,Mebelkart,http://ecx.images-amazon.com/images/I/31OaD0yyfZL._AA160_.jpg,Rs. 419.00,self Colour,Home & Kitchen,http://www.amazon.in/Mebelkart-Vivien-Cushion-cum-Pillow/dp/B00D6KE7OG/ref=sr_1_1/279-8772023-7637911?s=kitchen&ie=UTF8&qid=1395127012&sr=1-1,[<a class="buyAction" href="/gp/offer-listing/B00D6KE7OG/ref=dp_olp_0/279-8772023-7637911?ie=UTF8&amp;condition=all">these sellers</a>],Mebelkart Vivien Cushion cum Pillow Set of 2: Amazon.in: Home & Kitchen,Mebelkart Vivien Cushion cum Pillow Set of 2: Amazon.in: Home & Kitchen,None,<div class="bucket" id="productDescription"> <h2>Product Description</h2> <div class="content"> <h3 class="productDescriptionSource"></h3> <div class="productDescriptionWrapper">        Vivien cushion in a rectangular shape  add more comfort to your sofa  bed in style. Also you can browse from our vast collection of cushion covers. Features : 1) 2 cushions 2) 12" x 16" size in rectangular shape 3) Light weight of around 0.2 kg 4) Non woven cushion              <div class="emptyClear"> </div> </div> </div> </div>,None,18:03:2014,None
B00G0Q44BE,Mebelkart Aegina Cushion Cover,http://www.amazon.in/Cushions-Cushion-Covers/b/ref=sd_allcat_cushions?ie=UTF8&node=1380469031,Rs. 944.00,Cushions & Cushion Cover,Cushions & Cushion Cover,Mebelkart,http://ecx.images-amazon.com/images/I/31OaD0yyfZL._AA160_.jpg,Rs. 944.00,self Colour,Home & Kitchen,http://www.amazon.in/Mebelkart-MK2691USAegina-Aegina-Cushion-Cover/dp/B00G0Q44BE/ref=sr_1_11/279-8772023-7637911?s=kitchen&ie=UTF8&qid=1395127012&sr=1-11,[<a class="buyAction" href="/gp/offer-listing/B00G0Q44BE/ref=dp_olp_0/279-8772023-7637911?ie=UTF8&amp;condition=all">these sellers</a>],Mebelkart Aegina Cushion Cover: Amazon.in: Home & Kitchen,Mebelkart Aegina Cushion Cover: Amazon.in: Home & Kitchen,None,<div class="bucket" id="productDescription"> <h2>Product Description</h2> <div class="content"> <h3 class="productDescriptionSource"></h3> <div class="productDescriptionWrapper">        Pure Linen cushion with antique metallic embroidery MATERIAL: Pure Linen COLOR: Natural SIZE: 12X12 (Inches) Brand : ULTRASNOB              <div class="emptyClear"> </div> </div> </div> </div>,None,18:03:2014,None
B00G0Q47DE,Mebelkart Aegle Cushion Cover,http://www.amazon.in/Cushions-Cushion-Covers/b/ref=sd_allcat_cushions?ie=UTF8&node=1380469031,Rs. 1 049.00,Cushions & Cushion Cover,Cushions & Cushion Cover,Mebelkart,http://ecx.images-amazon.com/images/I/31OaD0yyfZL._AA160_.jpg,Rs. 1 049.00,self Colour,Home & Kitchen,http://www.amazon.in/Mebelkart-MK2699USAegle-Aegle-Cushion-Cover/dp/B00G0Q47DE/ref=sr_1_12/279-8772023-7637911?s=kitchen&ie=UTF8&qid=1395127012&sr=1-12,[<a class="buyAction" href="/gp/offer-listing/B00G0Q47DE/ref=dp_olp_0/279-8772023-7637911?ie=UTF8&amp;condition=all">these sellers</a>],Mebelkart Aegle Cushion Cover: Amazon.in: Home & Kitchen,Mebelkart Aegle Cushion Cover: Amazon.in: Home & Kitchen,None,<div class="bucket" id="productDescription"> <h2>Product Description</h2> <div class="content"> <h3 class="productDescriptionSource"></h3> <div class="productDescriptionWrapper">        Oxford Weave Pure Linen Cushion Cover with antiuqe beadwork MATERIAL: Pure Linen COLOR: Natural SIZE: 18X18 (Inches) Brand : ULTRASNOB              <div class="emptyClear"> </div> </div> </div> </div>,None,18:03:2014,None
B00G0Q43YM,Mebelkart Aegeus Cushion Cover,http://www.amazon.in/Cushions-Cushion-Covers/b/ref=sd_allcat_cushions?ie=UTF8&node=1380469031,Rs. 1 049.00,Cushions & Cushion Cover,Cushions & Cushion Cover,Mebelkart,http://ecx.images-amazon.com/images/I/31OaD0yyfZL._AA160_.jpg,Rs. 1 049.00,self Colour,Home & Kitchen,http://www.amazon.in/Mebelkart-MK2690USAegeus-Aegeus-Cushion-Cover/dp/B00G0Q43YM/ref=sr_1_10/279-8772023-7637911?s=kitchen&ie=UTF8&qid=1395127012&sr=1-10,[<a class="buyAction" href="/gp/offer-listing/B00G0Q43YM/ref=dp_olp_0/279-8772023-7637911?ie=UTF8&amp;condition=all">these sellers</a>],Mebelkart Aegeus Cushion Cover: Amazon.in: Home & Kitchen,Mebelkart Aegeus Cushion Cover: Amazon.in: Home & Kitchen,None,<div class="bucket" id="productDescription"> <h2>Product Description</h2> <div class="content"> <h3 class="productDescriptionSource"></h3> <div class="productDescriptionWrapper">        Pure Linen cushion with antique metallic embroidery MATERIAL: Pure Linen COLOR: Natural SIZE: 12X16 (Inches) Brand : ULTRASNOB              <div class="emptyClear"> </div> </div> </div> </div>,None,18:03:2014,None
B00G0Q3FFU,Mebelkart Aeneas Cushion Cover,http://www.amazon.in/Cushions-Cushion-Covers/b/ref=sd_allcat_cushions?ie=UTF8&node=1380469031,Rs. 734.00,Cushions & Cushion Cover,Cushions & Cushion Cover,Mebelkart,http://ecx.images-amazon.com/images/I/31OaD0yyfZL._AA160_.jpg,Rs. 734.00,self Colour,Home & Kitchen,http://www.amazon.in/Mebelkart-MK2631USAeneas-Aeneas-Cushion-Cover/dp/B00G0Q3FFU/ref=sr_1_13/279-8772023-7637911?s=kitchen&ie=UTF8&qid=1395127012&sr=1-13,[<a class="buyAction" href="/gp/offer-listing/B00G0Q3FFU/ref=dp_olp_0/279-8772023-7637911?ie=UTF8&amp;condition=all">these sellers</a>],Mebelkart Aeneas Cushion Cover: Amazon.in: Home & Kitchen,Mebelkart Aeneas Cushion Cover: Amazon.in: Home & Kitchen,None,<div class="bucket" id="productDescription"> <h2>Product Description</h2> <div class="content"> <h3 class="productDescriptionSource"></h3> <div class="productDescriptionWrapper">        Faux Silk cushion cover with embroidery MATERIAL: Faux Silk COLOR: Chocolate SIZE: 18X18 (Inches) Brand : ULTRASNOB              <div class="emptyClear"> </div> </div> </div> </div>,None,18:03:2014,None
B00G0Q3K6E,Mebelkart Aglaia Cushion Cover,http://www.amazon.in/Cushions-Cushion-Covers/b/ref=sd_allcat_cushions?ie=UTF8&node=1380469031,Rs. 839.00,Cushions & Cushion Cover,Cushions & Cushion Cover,Mebelkart,http://ecx.images-amazon.com/images/I/31OaD0yyfZL._AA160_.jpg,Rs. 839.00,self Colour,Home & Kitchen,http://www.amazon.in/Mebelkart-MK2643USAglaia-Aglaia-Cushion-Cover/dp/B00G0Q3K6E/ref=sr_1_17/279-8772023-7637911?s=kitchen&ie=UTF8&qid=1395127012&sr=1-17,[<a class="buyAction" href="/gp/offer-listing/B00G0Q3K6E/ref=dp_olp_0/279-8772023-7637911?ie=UTF8&amp;condition=all">these sellers</a>],Mebelkart Aglaia Cushion Cover: Amazon.in: Home & Kitchen,Mebelkart Aglaia Cushion Cover: Amazon.in: Home & Kitchen,None,<div class="bucket" id="productDescription"> <h2>Product Description</h2> <div class="content"> <h3 class="productDescriptionSource"></h3> <div class="productDescriptionWrapper">        Intricately beaded/sequins worked net cushion with contrast satin underlay MATERIAL: Net/Satin COLOR: Black/Damson SIZE: 12X12 (Inches) Brand : ULTRASNOB              <div class="emptyClear"> </div> </div> </div> </div>,None,18:03:2014,None
B00G0Q47QQ,Mebelkart Alvis Cushion Cover,http://www.amazon.in/Cushions-Cushion-Covers/b/ref=sd_allcat_cushions?ie=UTF8&node=1380469031,Rs. 1 049.00,Cushions & Cushion Cover,Cushions & Cushion Cover,Mebelkart,http://ecx.images-amazon.com/images/I/31OaD0yyfZL._AA160_.jpg,Rs. 1 049.00,self Colour,Home & Kitchen,http://www.amazon.in/Mebelkart-MK2700USAlvis-Alvis-Cushion-Cover/dp/B00G0Q47QQ/ref=sr_1_20/279-8772023-7637911?s=kitchen&ie=UTF8&qid=1395127012&sr=1-20,[<a class="buyAction" href="/gp/offer-listing/B00G0Q47QQ/ref=dp_olp_0/279-8772023-7637911?ie=UTF8&amp;condition=all">these sellers</a>],Mebelkart Alvis Cushion Cover: Amazon.in: Home & Kitchen,Mebelkart Alvis Cushion Cover: Amazon.in: Home & Kitchen,None,<div class="bucket" id="productDescription"> <h2>Product Description</h2> <div class="content"> <h3 class="productDescriptionSource"></h3> <div class="productDescriptionWrapper">        Oxford Weave Pure Linen Cushion Cover with antiuqe beadwork MATERIAL: Pure Linen COLOR: Natural SIZE: 18X18 (Inches) Brand : ULTRASNOB              <div class="emptyClear"> </div> </div> </div> </div>,None,18:03:2014,None
B00G0Q4572,Mebelkart Alcestis Cushion Cover,http://www.amazon.in/Cushions-Cushion-Covers/b/ref=sd_allcat_cushions?ie=UTF8&node=1380469031,Rs. 1 049.00,Cushions & Cushion Cover,Cushions & Cushion Cover,Mebelkart,http://ecx.images-amazon.com/images/I/31OaD0yyfZL._AA160_.jpg,Rs. 1 049.00,self Colour,Home & Kitchen,http://www.amazon.in/Mebelkart-MK2693USAlcestis-Alcestis-Cushion-Cover/dp/B00G0Q4572/ref=sr_1_19/279-8772023-7637911?s=kitchen&ie=UTF8&qid=1395127012&sr=1-19,[<a class="buyAction" href="/gp/offer-listing/B00G0Q4572/ref=dp_olp_0/279-8772023-7637911?ie=UTF8&amp;condition=all">these sellers</a>],Mebelkart Alcestis Cushion Cover: Amazon.in: Home & Kitchen,Mebelkart Alcestis Cushion Cover: Amazon.in: Home & Kitchen,None,<div class="bucket" id="productDescription"> <h2>Product Description</h2> <div class="content"> <h3 class="productDescriptionSource"></h3> <div class="productDescriptionWrapper">        Pure Linen cushion with antique metallic embroidery MATERIAL: Pure Linen COLOR: Natural SIZE: 12X16 (Inches) Brand : ULTRASNOB              <div class="emptyClear"> </div> </div> </div> </div>,None,18:03:2014,None
B00ESG4CTW,Mebelkart Amores-Damson Cushion Cover,http://www.amazon.in/Cushions-Cushion-Covers/b/ref=sd_allcat_cushions?ie=UTF8&node=1380469031,Rs. 839.00,Cushions & Cushion Cover,Cushions & Cushion Cover,Mebelkart,http://ecx.images-amazon.com/images/I/31OaD0yyfZL._AA160_.jpg,Rs. 839.00,self Colour,Home & Kitchen,http://www.amazon.in/Mebelkart-MK2654USAmores-Damson-Amores-Damson-Cushion-Cover/dp/B00ESG4CTW/ref=sr_1_21/279-8772023-7637911?s=kitchen&ie=UTF8&qid=1395127012&sr=1-21,[<a class="buyAction" href="/gp/offer-listing/B00ESG4CTW/ref=dp_olp_0/279-8772023-7637911?ie=UTF8&amp;condition=all">these sellers</a>],Mebelkart Amores-Damson Cushion Cover: Amazon.in: Home & Kitchen,Mebelkart Amores-Damson Cushion Cover: Amazon.in: Home & Kitchen,None,<div class="bucket" id="productDescription"> <h2>Product Description</h2> <div class="content"> <h3 class="productDescriptionSource"></h3> <div class="productDescriptionWrapper">        Embossed velvet cushion cover with Diamante MATERIAL: Embossed Velvet COLOR: Damson SIZE: 12X12 (Inches) Brand : ULTRASNOB              <div class="emptyClear"> </div> </div> </div> </div>,None,18:03:2014,None
B00G0Q3GIG,Mebelkart Agrona Cushion Cover,http://www.amazon.in/Cushions-Cushion-Covers/b/ref=sd_allcat_cushions?ie=UTF8&node=1380469031,Rs. 734.00,Cushions & Cushion Cover,Cushions & Cushion Cover,Mebelkart,http://ecx.images-amazon.com/images/I/31OaD0yyfZL._AA160_.jpg,Rs. 734.00,self Colour,Home & Kitchen,http://www.amazon.in/Mebelkart-MK2634USAgrona-Agrona-Cushion-Cover/dp/B00G0Q3GIG/ref=sr_1_18/279-8772023-7637911?s=kitchen&ie=UTF8&qid=1395127012&sr=1-18,[<a class="buyAction" href="/gp/offer-listing/B00G0Q3GIG/ref=dp_olp_0/279-8772023-7637911?ie=UTF8&amp;condition=all">these sellers</a>],Mebelkart Agrona Cushion Cover: Amazon.in: Home & Kitchen,Mebelkart Agrona Cushion Cover: Amazon.in: Home & Kitchen,None,<div class="bucket" id="productDescription"> <h2>Product Description</h2> <div class="content"> <h3 class="productDescriptionSource"></h3> <div class="productDescriptionWrapper">        Faux Dupion cushion cover with zari embroidery MATERIAL: Faux Dupion COLOR: Burnt Orange SIZE: 18X18 (Inches) Brand : ULTRASNOB              <div class="emptyClear"> </div> </div> </div> </div>,None,18:03:2014,None
B00G0Q3G7C,Mebelkart Aeron Cushion Cover,http://www.amazon.in/Cushions-Cushion-Covers/b/ref=sd_allcat_cushions?ie=UTF8&node=1380469031,Rs. 734.00,Cushions & Cushion Cover,Cushions & Cushion Cover,Mebelkart,http://ecx.images-amazon.com/images/I/31OaD0yyfZL._AA160_.jpg,Rs. 734.00,self Colour,Home & Kitchen,http://www.amazon.in/Mebelkart-MK2633USAeron-Aeron-Cushion-Cover/dp/B00G0Q3G7C/ref=sr_1_15/279-8772023-7637911?s=kitchen&ie=UTF8&qid=1395127012&sr=1-15,[<a class="buyAction" href="/gp/offer-listing/B00G0Q3G7C/ref=dp_olp_0/279-8772023-7637911?ie=UTF8&amp;condition=all">these sellers</a>],Mebelkart Aeron Cushion Cover: Amazon.in: Home & Kitchen,Mebelkart Aeron Cushion Cover: Amazon.in: Home & Kitchen,None,<div class="bucket" id="productDescription"> <h2>Product Description</h2> <div class="content"> <h3 class="productDescriptionSource"></h3> <div class="productDescriptionWrapper">        Faux Silk cushion cover with embroidery MATERIAL: Faux Silk COLOR: Chocolate SIZE: 18X18 (Inches) Brand : ULTRASNOB              <div class="emptyClear"> </div> </div> </div> </div>,None,18:03:2014,None
B00G0Q44QE,Mebelkart Afrodita Cushion Cover,http://www.amazon.in/Cushions-Cushion-Covers/b/ref=sd_allcat_cushions?ie=UTF8&node=1380469031,Rs. 1 049.00,Cushions & Cushion Cover,Cushions & Cushion Cover,Mebelkart,http://ecx.images-amazon.com/images/I/31OaD0yyfZL._AA160_.jpg,Rs. 1 049.00,self Colour,Home & Kitchen,http://www.amazon.in/Mebelkart-MK2692USAfrodita-Afrodita-Cushion-Cover/dp/B00G0Q44QE/ref=sr_1_16/279-8772023-7637911?s=kitchen&ie=UTF8&qid=1395127012&sr=1-16,[<a class="buyAction" href="/gp/offer-listing/B00G0Q44QE/ref=dp_olp_0/279-8772023-7637911?ie=UTF8&amp;condition=all">these sellers</a>],Mebelkart Afrodita Cushion Cover: Amazon.in: Home & Kitchen,Mebelkart Afrodita Cushion Cover: Amazon.in: Home & Kitchen,None,<div class="bucket" id="productDescription"> <h2>Product Description</h2> <div class="content"> <h3 class="productDescriptionSource"></h3> <div class="productDescriptionWrapper">        Pure Linen cushion with antique metallic embroidery MATERIAL: Pure Linen COLOR: Natural SIZE: 12X16 (Inches) Brand : ULTRASNOB              <div class="emptyClear"> </div> </div> </div> </div>,None,18:03:2014,None
B00GGBYRR4,Mebelkart Ares-Wine Cushion Cover,http://www.amazon.in/Cushions-Cushion-Covers/b/ref=sd_allcat_cushions?ie=UTF8&node=1380469031,Rs. 734.00,Cushions & Cushion Cover,Cushions & Cushion Cover,Mebelkart,http://ecx.images-amazon.com/images/I/31OaD0yyfZL._AA160_.jpg,Rs. 734.00,self Colour,Home & Kitchen,http://www.amazon.in/Mebelkart-Ares-Wine-Cushion-Cover/dp/B00GGBYRR4/ref=sr_1_27/279-8772023-7637911?s=kitchen&ie=UTF8&qid=1395127018&sr=1-27,[<a class="buyAction" href="/gp/offer-listing/B00GGBYRR4/ref=dp_olp_0/279-8772023-7637911?ie=UTF8&amp;condition=all">these sellers</a>],Mebelkart Ares-Wine Cushion Cover: Amazon.in: Home & Kitchen,Mebelkart Ares-Wine Cushion Cover: Amazon.in: Home & Kitchen,None,<div class="bucket" id="productDescription"> <h2>Product Description</h2> <div class="content"> <h3 class="productDescriptionSource"></h3> <div class="productDescriptionWrapper">        Faux Leather filled cushion with diamontees MATERIAL: Faux Leather COLOR: Wine SIZE: 12X12 (Inches) Brand : ULTRASNOB              <div class="emptyClear"> </div> </div> </div> </div>,None,18:03:2014,None
B00G0Q3PVE,Mebelkart Amour Cushion Cover,http://www.amazon.in/Cushions-Cushion-Covers/b/ref=sd_allcat_cushions?ie=UTF8&node=1380469031,Rs. 839.00,Cushions & Cushion Cover,Cushions & Cushion Cover,Mebelkart,http://ecx.images-amazon.com/images/I/31OaD0yyfZL._AA160_.jpg,Rs. 839.00,self Colour,Home & Kitchen,http://www.amazon.in/Mebelkart-MK2656USAmour-Amour-Cushion-Cover/dp/B00G0Q3PVE/ref=sr_1_23/279-8772023-7637911?s=kitchen&ie=UTF8&qid=1395127012&sr=1-23,[<a class="buyAction" href="/gp/offer-listing/B00G0Q3PVE/ref=dp_olp_0/279-8772023-7637911?ie=UTF8&amp;condition=all">these sellers</a>],Mebelkart Amour Cushion Cover: Amazon.in: Home & Kitchen,Mebelkart Amour Cushion Cover: Amazon.in: Home & Kitchen,None,<div class="bucket" id="productDescription"> <h2>Product Description</h2> <div class="content"> <h3 class="productDescriptionSource"></h3> <div class="productDescriptionWrapper">        Velvet cushion cover with Diamante MATERIAL: Velvet COLOR: Purple SIZE: 12X12 (Inches) Brand : ULTRASNOB              <div class="emptyClear"> </div> </div> </div> </div>,None,18:03:2014,None
