B00G0Q33VQ,Mebelkart Hermes Cushion Cover,http://www.amazon.in/Cushions-Cushion-Covers/b/ref=sd_allcat_cushions?ie=UTF8&node=1380469031,Rs. 734.00,Cushions & Cushion Cover,Cushions & Cushion Cover,Mebelkart,http://ecx.images-amazon.com/images/I/31OaD0yyfZL._AA160_.jpg,Rs. 734.00,self Colour,Home & Kitchen,http://www.amazon.in/Mebelkart-MK2592USHermes-Hermes-Cushion-Cover/dp/B00G0Q33VQ/ref=sr_1_132/279-8772023-7637911?s=kitchen&ie=UTF8&qid=1395127042&sr=1-132,[<a class="buyAction" href="/gp/offer-listing/B00G0Q33VQ/ref=dp_olp_0/279-8772023-7637911?ie=UTF8&amp;condition=all">these sellers</a>],Mebelkart Hermes Cushion Cover: Amazon.in: Home & Kitchen,Mebelkart Hermes Cushion Cover: Amazon.in: Home & Kitchen,None,<div class="bucket" id="productDescription"> <h2>Product Description</h2> <div class="content"> <h3 class="productDescriptionSource"></h3> <div class="productDescriptionWrapper">        Rich antique velvet cushion with metallic leather motifs &amp; diamonttees MATERIAL: Antique Velvet COLOR: Black/Silver SIZE: 12X16 (Inches) Brand : ULTRASNOB              <div class="emptyClear"> </div> </div> </div> </div>,None,18:03:2014,None
B00ESG4P3U,Mebelkart I'm on Dad's Side Cushion Cover,http://www.amazon.in/Cushions-Cushion-Covers/b/ref=sd_allcat_cushions?ie=UTF8&node=1380469031,Rs. 734.00,Cushions & Cushion Cover,Cushions & Cushion Cover,Mebelkart,http://ecx.images-amazon.com/images/I/31OaD0yyfZL._AA160_.jpg,Rs. 734.00,self Colour,Home & Kitchen,http://www.amazon.in/Mebelkart-Dads-Side-Cushion-Cover/dp/B00ESG4P3U/ref=sr_1_133/279-8772023-7637911?s=kitchen&ie=UTF8&qid=1395127042&sr=1-133,[<a class="buyAction" href="/gp/offer-listing/B00ESG4P3U/ref=dp_olp_0/279-8772023-7637911?ie=UTF8&amp;condition=all">these sellers</a>],Mebelkart I'm on Dad's Side Cushion Cover: Amazon.in: Home & Kitchen,Mebelkart I'm on Dad's Side Cushion Cover: Amazon.in: Home & Kitchen,None,<div class="bucket" id="productDescription"> <h2>Product Description</h2> <div class="content"> <h3 class="productDescriptionSource"></h3> <div class="productDescriptionWrapper">        Supercombed Cotton Pillow Cover with embroidery MATERIAL: Supercombed Cotton COLOR: White SIZE: 17X24" + Flanges Brand : ULTRASNOB              <div class="emptyClear"> </div> </div> </div> </div>,None,18:03:2014,None
B00G0Q3F46,Mebelkart Cushion Doormat-5,http://www.amazon.in/Cushions-Cushion-Covers/b/ref=sd_allcat_cushions?ie=UTF8&node=1380469031,Rs. 457.00,Cushions & Cushion Cover,Cushions & Cushion Cover,Mebelkart,http://ecx.images-amazon.com/images/I/31OaD0yyfZL._AA160_.jpg,Rs. 457.00,self Colour,Home & Kitchen,http://www.amazon.in/Mebelkart-MK3199CMVFBG2-Cushion-Doormat-5/dp/B00G0Q3F46/ref=sr_1_69/279-8772023-7637911?s=kitchen&ie=UTF8&qid=1395127021&sr=1-69,[<a class="buyAction" href="/gp/offer-listing/B00G0Q3F46/ref=dp_olp_0/279-8772023-7637911?ie=UTF8&amp;condition=all">these sellers</a>],Mebelkart Cushion Doormat-5: Amazon.in: Home & Kitchen,Mebelkart Cushion Doormat-5: Amazon.in: Home & Kitchen,None,<div class="bucket" id="productDescription"> <h2>Product Description</h2> <div class="content"> <h3 class="productDescriptionSource"></h3> <div class="productDescriptionWrapper">        These medium cushion mat is a soft vinyl net which trapes dirt as one wall of it has vinyl body construction which promotes moisture &amp; odour free net. These mats are incombustible.BRAND: FreelanceCOLOR :BurgundySIZE :68 X 40 CM              <div class="emptyClear"> </div> </div> </div> </div>,None,18:03:2014,None
B00G0Q3R8U,Mebelkart Je t`aime Cushion Cover,http://www.amazon.in/Cushions-Cushion-Covers/b/ref=sd_allcat_cushions?ie=UTF8&node=1380469031,Rs. 839.00,Cushions & Cushion Cover,Cushions & Cushion Cover,Mebelkart,http://ecx.images-amazon.com/images/I/31OaD0yyfZL._AA160_.jpg,Rs. 839.00,self Colour,Home & Kitchen,http://www.amazon.in/Mebelkart-Je-t%60aime-Cushion-Cover/dp/B00G0Q3R8U/ref=sr_1_134/279-8772023-7637911?s=kitchen&ie=UTF8&qid=1395127042&sr=1-134,[<a class="buyAction" href="/gp/offer-listing/B00G0Q3R8U/ref=dp_olp_0/279-8772023-7637911?ie=UTF8&amp;condition=all">these sellers</a>],Mebelkart Je t`aime Cushion Cover: Amazon.in: Home & Kitchen,Mebelkart Je t`aime Cushion Cover: Amazon.in: Home & Kitchen,None,<div class="bucket" id="productDescription"> <h2>Product Description</h2> <div class="content"> <h3 class="productDescriptionSource"></h3> <div class="productDescriptionWrapper">        Antique velvet cushion cover with Diamante MATERIAL: Antique Velvet COLOR: Turq SIZE: 12X16 (Inches) Brand : ULTRASNOB              <div class="emptyClear"> </div> </div> </div> </div>,None,18:03:2014,None
B00D6KEAVG,Mebelkart Kushk Cushion,http://www.amazon.in/Cushions-Cushion-Covers/b/ref=sd_allcat_cushions?ie=UTF8&node=1380469031,Rs. 367.00,Cushions & Cushion Cover,Cushions & Cushion Cover,Mebelkart,http://ecx.images-amazon.com/images/I/31OaD0yyfZL._AA160_.jpg,Rs. 367.00,self Colour,Home & Kitchen,http://www.amazon.in/Mebelkart-MK655KKCFC-Kushk-Cushion/dp/B00D6KEAVG/ref=sr_1_136/279-8772023-7637911?s=kitchen&ie=UTF8&qid=1395127042&sr=1-136,[<a class="buyAction" href="/gp/offer-listing/B00D6KEAVG/ref=dp_olp_0/279-8772023-7637911?ie=UTF8&amp;condition=all">these sellers</a>],Mebelkart Kushk Cushion: Amazon.in: Home & Kitchen,Mebelkart Kushk Cushion: Amazon.in: Home & Kitchen,None,<div class="bucket" id="productDescription"> <h2>Product Description</h2> <div class="content"> <h3 class="productDescriptionSource"></h3> <div class="productDescriptionWrapper">        Kushk cushion is a cute small filler for your sofa or bed. Oozes comfort and eliminates back pain. Also you can browse from our vast collection of cushion covers. Features : 1) 1 cushions 2) 12" x 12" size in square shape 3) Light weight of around 0.2 kg 4) 100% cotton              <div class="emptyClear"> </div> </div> </div> </div>,None,18:03:2014,None
B00G0Q4ER8,Mebelkart King Dad Cushion Cover,http://www.amazon.in/Cushions-Cushion-Covers/b/ref=sd_allcat_cushions?ie=UTF8&node=1380469031,Rs. 734.00,Cushions & Cushion Cover,Cushions & Cushion Cover,Mebelkart,http://ecx.images-amazon.com/images/I/31OaD0yyfZL._AA160_.jpg,Rs. 734.00,self Colour,Home & Kitchen,http://www.amazon.in/Mebelkart-King-Dad-Cushion-Cover/dp/B00G0Q4ER8/ref=sr_1_135/279-8772023-7637911?s=kitchen&ie=UTF8&qid=1395127042&sr=1-135,[<a class="buyAction" href="/gp/offer-listing/B00G0Q4ER8/ref=dp_olp_0/279-8772023-7637911?ie=UTF8&amp;condition=all">these sellers</a>],Mebelkart King Dad Cushion Cover: Amazon.in: Home & Kitchen,Mebelkart King Dad Cushion Cover: Amazon.in: Home & Kitchen,None,<div class="bucket" id="productDescription"> <h2>Product Description</h2> <div class="content"> <h3 class="productDescriptionSource"></h3> <div class="productDescriptionWrapper">        Antique Velvet Cushion cover with embroidery MATERIAL: Antique Velvet COLOR: Black SIZE: 12X12 (Inches) Brand : ULTRASNOB              <div class="emptyClear"> </div> </div> </div> </div>,None,18:03:2014,None
B00G0Q3MJY,Mebelkart Lavinia Cushion Cover,http://www.amazon.in/Cushions-Cushion-Covers/b/ref=sd_allcat_cushions?ie=UTF8&node=1380469031,Rs. 944.00,Cushions & Cushion Cover,Cushions & Cushion Cover,Mebelkart,http://ecx.images-amazon.com/images/I/31OaD0yyfZL._AA160_.jpg,Rs. 944.00,self Colour,Home & Kitchen,http://www.amazon.in/Mebelkart-MK2649USLavinia-Lavinia-Cushion-Cover/dp/B00G0Q3MJY/ref=sr_1_137/279-8772023-7637911?s=kitchen&ie=UTF8&qid=1395127042&sr=1-137,[<a class="buyAction" href="/gp/offer-listing/B00G0Q3MJY/ref=dp_olp_0/279-8772023-7637911?ie=UTF8&amp;condition=all">these sellers</a>],Mebelkart Lavinia Cushion Cover: Amazon.in: Home & Kitchen,Mebelkart Lavinia Cushion Cover: Amazon.in: Home & Kitchen,None,<div class="bucket" id="productDescription"> <h2>Product Description</h2> <div class="content"> <h3 class="productDescriptionSource"></h3> <div class="productDescriptionWrapper">        Intricately beaded/sequins worked net cushion with contrast satin underlay MATERIAL: Net/Satin COLOR: Black/Pewter SIZE: 12X16 (Inches) Brand : ULTRASNOB              <div class="emptyClear"> </div> </div> </div> </div>,None,18:03:2014,None
B00EFDL2AA,Mebelkart Lily On Leaves Cushion Cover,http://www.amazon.in/Cushions-Cushion-Covers/b/ref=sd_allcat_cushions?ie=UTF8&node=1380469031,Rs. 578.00,Cushions & Cushion Cover,Cushions & Cushion Cover,Mebelkart,http://ecx.images-amazon.com/images/I/31OaD0yyfZL._AA160_.jpg,Rs. 578.00,self Colour,Home & Kitchen,http://www.amazon.in/Mebelkart-Lily-Leaves-Cushion-Cover/dp/B00EFDL2AA/ref=sr_1_138/279-8772023-7637911?s=kitchen&ie=UTF8&qid=1395127042&sr=1-138,[<a class="buyAction" href="/gp/offer-listing/B00EFDL2AA/ref=dp_olp_0/279-8772023-7637911?ie=UTF8&amp;condition=all">these sellers</a>],Mebelkart Lily On Leaves Cushion Cover: Amazon.in: Home & Kitchen,Mebelkart Lily On Leaves Cushion Cover: Amazon.in: Home & Kitchen,None,<div class="bucket" id="productDescription"> <h2>Product Description</h2> <div class="content"> <h3 class="productDescriptionSource"></h3> <div class="productDescriptionWrapper">        Features : Shape or Design description : Digital Printed Cushion Cover Dimensions ( in Inches ) : 8 x 16 in Color : White &amp; Purple Fabric : Polytaffeta              <div class="emptyClear"> </div> </div> </div> </div>,None,18:03:2014,None
B00ESG4J0O,Mebelkart Limon-Swirls Cushion Cover,http://www.amazon.in/Cushions-Cushion-Covers/b/ref=sd_allcat_cushions?ie=UTF8&node=1380469031,Rs. 944.00,Cushions & Cushion Cover,Cushions & Cushion Cover,Mebelkart,http://ecx.images-amazon.com/images/I/31OaD0yyfZL._AA160_.jpg,Rs. 944.00,self Colour,Home & Kitchen,http://www.amazon.in/Mebelkart-MK2680USLimon-Swirls-Limon-Swirls-Cushion-Cover/dp/B00ESG4J0O/ref=sr_1_141/279-8772023-7637911?s=kitchen&ie=UTF8&qid=1395127042&sr=1-141,[<a class="buyAction" href="/gp/offer-listing/B00ESG4J0O/ref=dp_olp_0/279-8772023-7637911?ie=UTF8&amp;condition=all">these sellers</a>],Mebelkart Limon-Swirls Cushion Cover: Amazon.in: Home & Kitchen,Mebelkart Limon-Swirls Cushion Cover: Amazon.in: Home & Kitchen,None,<div class="bucket" id="productDescription"> <h2>Product Description</h2> <div class="content"> <h3 class="productDescriptionSource"></h3> <div class="productDescriptionWrapper">        Antique Velvet cushion cover with all over embroidery MATERIAL: Antique Velvet COLOR: Lime SIZE: 16X16 (Inches) Brand : ULTRASNOB              <div class="emptyClear"> </div> </div> </div> </div>,None,18:03:2014,None
B00ESG4ISW,Mebelkart Limon-Leaves Cushion Cover,http://www.amazon.in/Cushions-Cushion-Covers/b/ref=sd_allcat_cushions?ie=UTF8&node=1380469031,Rs. 944.00,Cushions & Cushion Cover,Cushions & Cushion Cover,Mebelkart,http://ecx.images-amazon.com/images/I/31OaD0yyfZL._AA160_.jpg,Rs. 944.00,self Colour,Home & Kitchen,http://www.amazon.in/Mebelkart-MK2679USLimon-Leaves-Limon-Leaves-Cushion-Cover/dp/B00ESG4ISW/ref=sr_1_140/279-8772023-7637911?s=kitchen&ie=UTF8&qid=1395127042&sr=1-140,[<a class="buyAction" href="/gp/offer-listing/B00ESG4ISW/ref=dp_olp_0/279-8772023-7637911?ie=UTF8&amp;condition=all">these sellers</a>],Mebelkart Limon-Leaves Cushion Cover: Amazon.in: Home & Kitchen,Mebelkart Limon-Leaves Cushion Cover: Amazon.in: Home & Kitchen,None,<div class="bucket" id="productDescription"> <h2>Product Description</h2> <div class="content"> <h3 class="productDescriptionSource"></h3> <div class="productDescriptionWrapper">        Antique Velvet cushion cover with all over embroidery MATERIAL: Antique Velvet COLOR: Lime SIZE: 18X18 (Inches) Brand : ULTRASNOB              <div class="emptyClear"> </div> </div> </div> </div>,None,18:03:2014,None
B00ESG4IKK,Mebelkart Limon-Flora Cushion Cover,http://www.amazon.in/Cushions-Cushion-Covers/b/ref=sd_allcat_cushions?ie=UTF8&node=1380469031,Rs. 839.00,Cushions & Cushion Cover,Cushions & Cushion Cover,Mebelkart,http://ecx.images-amazon.com/images/I/31OaD0yyfZL._AA160_.jpg,Rs. 839.00,self Colour,Home & Kitchen,http://www.amazon.in/Mebelkart-MK2678USLimon-Flora-Limon-Flora-Cushion-Cover/dp/B00ESG4IKK/ref=sr_1_139/279-8772023-7637911?s=kitchen&ie=UTF8&qid=1395127042&sr=1-139,[<a class="buyAction" href="/gp/offer-listing/B00ESG4IKK/ref=dp_olp_0/279-8772023-7637911?ie=UTF8&amp;condition=all">these sellers</a>],Mebelkart Limon-Flora Cushion Cover: Amazon.in: Home & Kitchen,Mebelkart Limon-Flora Cushion Cover: Amazon.in: Home & Kitchen,None,<div class="bucket" id="productDescription"> <h2>Product Description</h2> <div class="content"> <h3 class="productDescriptionSource"></h3> <div class="productDescriptionWrapper">        Faux Dupion cushion cover with embroidery MATERIAL: Faux Dupion COLOR: Lime SIZE: 16X16 (Inches) Brand : ULTRASNOB              <div class="emptyClear"> </div> </div> </div> </div>,None,18:03:2014,None
B00D6KEDBI,Mebelkart Miam Cushion Set of 2,http://www.amazon.in/Cushions-Cushion-Covers/b/ref=sd_allcat_cushions?ie=UTF8&node=1380469031,Rs. 892.00,Cushions & Cushion Cover,Cushions & Cushion Cover,Mebelkart,http://ecx.images-amazon.com/images/I/31OaD0yyfZL._AA160_.jpg,Rs. 892.00,self Colour,Home & Kitchen,http://www.amazon.in/Mebelkart-Miam-Cushion-Set-2/dp/B00D6KEDBI/ref=sr_1_143/279-8772023-7637911?s=kitchen&ie=UTF8&qid=1395127042&sr=1-143,[<a class="buyAction" href="/gp/offer-listing/B00D6KEDBI/ref=dp_olp_0/279-8772023-7637911?ie=UTF8&amp;condition=all">these sellers</a>],Mebelkart Miam Cushion Set of 2: Amazon.in: Home & Kitchen,Mebelkart Miam Cushion Set of 2: Amazon.in: Home & Kitchen,None,<div class="bucket" id="productDescription"> <h2>Product Description</h2> <div class="content"> <h3 class="productDescriptionSource"></h3> <div class="productDescriptionWrapper">        Miam cushion : Uber cool medium sized cushion  comes in a set of 2 cushions. Also you can browse from our vast collection of cushion covers. Features : 1) 2 cushions 2) 16" x 16" size in square shape 3) Light weight of around 0.3 kg 4) 100% cotton              <div class="emptyClear"> </div> </div> </div> </div>,None,18:03:2014,None
B00G0Q3N3E,Mebelkart Medusa Cushion Cover,http://www.amazon.in/Cushions-Cushion-Covers/b/ref=sd_allcat_cushions?ie=UTF8&node=1380469031,Rs. 944.00,Cushions & Cushion Cover,Cushions & Cushion Cover,Mebelkart,http://ecx.images-amazon.com/images/I/31OaD0yyfZL._AA160_.jpg,Rs. 944.00,self Colour,Home & Kitchen,http://www.amazon.in/Mebelkart-MK2650USMedusa-Medusa-Cushion-Cover/dp/B00G0Q3N3E/ref=sr_1_142/279-8772023-7637911?s=kitchen&ie=UTF8&qid=1395127042&sr=1-142,[<a class="buyAction" href="/gp/offer-listing/B00G0Q3N3E/ref=dp_olp_0/279-8772023-7637911?ie=UTF8&amp;condition=all">these sellers</a>],Mebelkart Medusa Cushion Cover: Amazon.in: Home & Kitchen,Mebelkart Medusa Cushion Cover: Amazon.in: Home & Kitchen,None,<div class="bucket" id="productDescription"> <h2>Product Description</h2> <div class="content"> <h3 class="productDescriptionSource"></h3> <div class="productDescriptionWrapper">        Intricately beaded/sequins worked satin cushion cover MATERIAL: Satin COLOR: Brown/Turq SIZE: 16X16 (Inches) Brand : ULTRASNOB              <div class="emptyClear"> </div> </div> </div> </div>,None,18:03:2014,None
B00D6KE9PS,Mebelkart Mimanta Cushion,http://www.amazon.in/Cushions-Cushion-Covers/b/ref=sd_allcat_cushions?ie=UTF8&node=1380469031,Rs. 629.00,Cushions & Cushion Cover,Cushions & Cushion Cover,Mebelkart,http://ecx.images-amazon.com/images/I/31OaD0yyfZL._AA160_.jpg,Rs. 629.00,self Colour,Home & Kitchen,http://www.amazon.in/Mebelkart-MK654KKCMCNW-Mimanta-Cushion/dp/B00D6KE9PS/ref=sr_1_144/279-8772023-7637911?s=kitchen&ie=UTF8&qid=1395127042&sr=1-144,[<a class="buyAction" href="/gp/offer-listing/B00D6KE9PS/ref=dp_olp_0/279-8772023-7637911?ie=UTF8&amp;condition=all">these sellers</a>],Mebelkart Mimanta Cushion: Amazon.in: Home & Kitchen,Mebelkart Mimanta Cushion: Amazon.in: Home & Kitchen,None,<div class="bucket" id="productDescription"> <h2>Product Description</h2> <div class="content"> <h3 class="productDescriptionSource"></h3> <div class="productDescriptionWrapper">        Mimanta cushion is quite big in size and comfortable complements your big sofa or bed. Extremely comfortable and friendly. Also you can browse from our vast collection of cushion covers. Features : 1) 1 cushions 2) 20" x 20" size in square shape 3) Light weight of around 0.6 kg 4) Non woven cushion              <div class="emptyClear"> </div> </div> </div> </div>,None,18:03:2014,None
B00G0Q3L7M,Mebelkart Creon Cushion Cover,http://www.amazon.in/Cushions-Cushion-Covers/b/ref=sd_allcat_cushions?ie=UTF8&node=1380469031,Rs. 839.00,Cushions & Cushion Cover,Cushions & Cushion Cover,Mebelkart,http://ecx.images-amazon.com/images/I/31OaD0yyfZL._AA160_.jpg,Rs. 839.00,self Colour,Home & Kitchen,http://www.amazon.in/Mebelkart-MK2646USCreon-Creon-Cushion-Cover/dp/B00G0Q3L7M/ref=sr_1_49/280-0483197-3561341?s=kitchen&ie=UTF8&qid=1395127048&sr=1-49,[<a class="buyAction" href="/gp/offer-listing/B00G0Q3L7M/ref=dp_olp_0/280-0483197-3561341?ie=UTF8&amp;condition=all">these sellers</a>],Mebelkart Creon Cushion Cover: Amazon.in: Home & Kitchen,Mebelkart Creon Cushion Cover: Amazon.in: Home & Kitchen,None,<div class="bucket" id="productDescription"> <h2>Product Description</h2> <div class="content"> <h3 class="productDescriptionSource"></h3> <div class="productDescriptionWrapper">        Intricately beaded/sequins worked net cushion with contrast satin underlay MATERIAL: Net/Satin COLOR: Black/Red SIZE: 12X12 (Inches) Brand : ULTRASNOB              <div class="emptyClear"> </div> </div> </div> </div>,None,18:03:2014,None
B00G0Q2VZ0,Mebelkart Golden Love,http://www.amazon.in/Cushions-Cushion-Covers/b/ref=sd_allcat_cushions?ie=UTF8&node=1380469031,Rs. 420.00,Cushions & Cushion Cover,Cushions & Cushion Cover,Mebelkart,http://ecx.images-amazon.com/images/I/31OaD0yyfZL._AA160_.jpg,Rs. 420.00,self Colour,Home & Kitchen,http://www.amazon.in/Mebelkart-MK1925CCCO265-Golden-Love/dp/B00G0Q2VZ0/ref=sr_1_130/279-8772023-7637911?s=kitchen&ie=UTF8&qid=1395127042&sr=1-130,[<a class="buyAction" href="/gp/offer-listing/B00G0Q2VZ0/ref=dp_olp_0/279-8772023-7637911?ie=UTF8&amp;condition=all">these sellers</a>],Mebelkart Golden Love: Amazon.in: Home & Kitchen,Mebelkart Golden Love: Amazon.in: Home & Kitchen,None,<div class="bucket" id="productDescription"> <h2>Product Description</h2> <div class="content"> <h3 class="productDescriptionSource"></h3> <div class="productDescriptionWrapper">        Features : Shape or Design description : Digital Printed Cushion with filler Dimensions ( in Inches ) : 12 x 12 in Color : Yellow &amp; Black Fabric : Cotton              <div class="emptyClear"> </div> </div> </div> </div>,None,18:03:2014,None
B00G0Q6PR0,Mebelkart Cushion Cover Elephant Savari 14x19,http://www.amazon.in/Cushions-Cushion-Covers/b/ref=sd_allcat_cushions?ie=UTF8&node=1380469031,Rs. 709.00,Cushions & Cushion Cover,Cushions & Cushion Cover,Mebelkart,http://ecx.images-amazon.com/images/I/31OaD0yyfZL._AA160_.jpg,Rs. 709.00,self Colour,Home & Kitchen,http://www.amazon.in/Mebelkart-Cushion-Cover-Elephant-Savari/dp/B00G0Q6PR0/ref=sr_1_50/280-0483197-3561341?s=kitchen&ie=UTF8&qid=1395127048&sr=1-50,[<a class="buyAction" href="/gp/offer-listing/B00G0Q6PR0/ref=dp_olp_0/280-0483197-3561341?ie=UTF8&amp;condition=all">these sellers</a>],Mebelkart Cushion Cover Elephant Savari 14x19: Amazon.in: Home & Kitchen,Mebelkart Cushion Cover Elephant Savari 14x19: Amazon.in: Home & Kitchen,None,<div class="bucket" id="productDescription"> <h2>Product Description</h2> <div class="content"> <h3 class="productDescriptionSource"></h3> <div class="productDescriptionWrapper">        Elephants are highly intelligent animals that display complex social behavior. Their sensitive hearing allows them to keep in touch over long distances and they use their ears as signaling devices. This theme is inspired by the elephants that guarded the beautiful Hawa Mahal that is set in a stunning surrounding of colourful motif and grandeur. Add charm to your surroundings with this attractive and vibrant cushion cover that embellishes wherever placed. It looks good with both contemporary as well as with traditional home decor. Size: 14 inchx19 inchColor: MulticolorMaterial: Polysilk/Benaras silk              <div class="emptyClear"> </div> </div> </div> </div>,None,18:03:2014,None
B00G0Q6QEW,Mebelkart Cushion Cover Flying Elephants Navy 16x16,http://www.amazon.in/Cushions-Cushion-Covers/b/ref=sd_allcat_cushions?ie=UTF8&node=1380469031,Rs. 730.00,Cushions & Cushion Cover,Cushions & Cushion Cover,Mebelkart,http://ecx.images-amazon.com/images/I/31OaD0yyfZL._AA160_.jpg,Rs. 730.00,self Colour,Home & Kitchen,http://www.amazon.in/Mebelkart-Cushion-Cover-Flying-Elephants/dp/B00G0Q6QEW/ref=sr_1_53/280-0483197-3561341?s=kitchen&ie=UTF8&qid=1395127048&sr=1-53,[<a class="buyAction" href="/gp/offer-listing/B00G0Q6QEW/ref=dp_olp_0/280-0483197-3561341?ie=UTF8&amp;condition=all">these sellers</a>],Mebelkart Cushion Cover Flying Elephants Navy 16x16: Amazon.in: Home & Kitchen,Mebelkart Cushion Cover Flying Elephants Navy 16x16: Amazon.in: Home & Kitchen,None,<div class="bucket" id="productDescription"> <h2>Product Description</h2> <div class="content"> <h3 class="productDescriptionSource"></h3> <div class="productDescriptionWrapper">        The Flying Elephants design is a multi coloured collage of the traditional and beautifully decorated Indian umbrella and embroidered parasols atop the regal Indian Elephant. This design is inspired from carousels at carnivals  which are cheerful  colourful and bright. The Flying Elephants design  with the simple elegance of its polka dotted background creates a contagious vibrant energy. Add charm to your surroundings with this attractive and vibrant cushion cover that embellishes wherever placed. It looks good with both contemporary as well as with traditional home decor. Also available in orange  lime and turquoise  this designer cushion is a must have!Size: 16 inchx16 inchColor: Navy BlueMaterial: Polysilk              <div class="emptyClear"> </div> </div> </div> </div>,None,18:03:2014,None
B00G0Q6P98,Mebelkart Cushion Cover Elephant Savari 16x16,http://www.amazon.in/Cushions-Cushion-Covers/b/ref=sd_allcat_cushions?ie=UTF8&node=1380469031,Rs. 730.00,Cushions & Cushion Cover,Cushions & Cushion Cover,Mebelkart,http://ecx.images-amazon.com/images/I/31OaD0yyfZL._AA160_.jpg,Rs. 730.00,self Colour,Home & Kitchen,http://www.amazon.in/Mebelkart-Cushion-Cover-Elephant-Savari/dp/B00G0Q6P98/ref=sr_1_51/280-0483197-3561341?s=kitchen&ie=UTF8&qid=1395127048&sr=1-51,[<a class="buyAction" href="/gp/offer-listing/B00G0Q6P98/ref=dp_olp_0/280-0483197-3561341?ie=UTF8&amp;condition=all">these sellers</a>],Mebelkart Cushion Cover Elephant Savari 16x16: Amazon.in: Home & Kitchen,Mebelkart Cushion Cover Elephant Savari 16x16: Amazon.in: Home & Kitchen,None,<div class="bucket" id="productDescription"> <h2>Product Description</h2> <div class="content"> <h3 class="productDescriptionSource"></h3> <div class="productDescriptionWrapper">        Elephants are highly intelligent animals that display complex social behavior. Their sensitive hearing allows them to keep in touch over long distances and they use their ears as signaling devices. This theme is inspired by the elephants that guarded the beautiful Hawa Mahal that is set in a stunning surrounding of colourful motif and grandeur. Add charm to your surroundings with this attractive and vibrant cushion cover that embellishes wherever placed. It looks good with both contemporary as well as with traditional home decor. Size: 16 inchx16 inchColor: MulticolorMaterial: Polysilk/Benaras silk              <div class="emptyClear"> </div> </div> </div> </div>,None,18:03:2014,None
B00G0Q3WPS,Mebelkart Fiore Uno Cushion Cover,http://www.amazon.in/Cushions-Cushion-Covers/b/ref=sd_allcat_cushions?ie=UTF8&node=1380469031,Rs. 734.00,Cushions & Cushion Cover,Cushions & Cushion Cover,Mebelkart,http://ecx.images-amazon.com/images/I/31OaD0yyfZL._AA160_.jpg,Rs. 734.00,self Colour,Home & Kitchen,http://www.amazon.in/Mebelkart-Fiore-Uno-Cushion-Cover/dp/B00G0Q3WPS/ref=sr_1_124/279-8772023-7637911?s=kitchen&ie=UTF8&qid=1395127042&sr=1-124,[<a class="buyAction" href="/gp/offer-listing/B00G0Q3WPS/ref=dp_olp_0/279-8772023-7637911?ie=UTF8&amp;condition=all">these sellers</a>],Mebelkart Fiore Uno Cushion Cover: Amazon.in: Home & Kitchen,Mebelkart Fiore Uno Cushion Cover: Amazon.in: Home & Kitchen,None,<div class="bucket" id="productDescription"> <h2>Product Description</h2> <div class="content"> <h3 class="productDescriptionSource"></h3> <div class="productDescriptionWrapper">        Burnt Orange Faux Dupion cushion cover with embroidery MATERIAL: Faux Dupion COLOR: Burnt Orange SIZE: 16X16 (Inches) Brand : ULTRASNOB              <div class="emptyClear"> </div> </div> </div> </div>,None,18:03:2014,None
