B00G6MUBUK,Biotique Hair Care Vitaliser Poly Vegetable Compound for Hair Regrowth Mountain Ebony 120ml (Pack of 2),http://www.amazon.in/Hair-Care-Styling/b/ref=sd_allcat_beauty_haircare/276-6718833-1247838?ie=UTF8&node=1374305031,None,Hair Care & Stylin,Hair Loss Products,Biotique,http://ecx.images-amazon.com/images/I/41lYMrywDHL._AA160_.jpg,None,self Colour,Beauty & Health,http://www.amazon.in/Biotique-Vitaliser-Vegetable-Compound-Regrowth/dp/B00G6MUBUK/ref=sr_1_8/276-4839360-6937557?s=beauty&ie=UTF8&qid=1395127155&sr=1-8,[<a href="/gp/help/seller/at-a-glance.html/276-4839360-6937557?ie=UTF8&amp;seller=A36B2MUBQK4XRS">SnapitToday</a>],Amazon.in: Buy Biotique Hair Care Vitaliser Poly Vegetable Compound for Hair Regrowth Mountain Ebony  120ml (Pack of 2) Online at Best Price in India | Amazon Beauty Store,Buy Biotique Hair Care Vitaliser Poly Vegetable Compound for Hair Regrowth Mountain Ebony  120ml (Pack of 2) at lowest price in India on Amazon.in. Check out Biotique Hair Care Vitaliser Poly Vegetable Compound for Hair Regrowth Mountain Ebony  120ml (Pack of 2) reviews  ratings  features  specifications and browse more Beauty products online at best prices on Amazon.in.,None,<div class="bucket" id="productDescription"> <h2>Product Description</h2> <div class="content"> <h3 class="productDescriptionSource"></h3> <div class="productDescriptionWrapper">        Growth stimulating serum for intensive hair growth treatment. Details : This intensive serum is blended with pure extracts of Mountain ebony  Long Pepper  Glycyrrhizin and the Euphorbia tree  to promote new and healthy hair growth. Stimulates hair  from root to tip  and leaves scalp feeling toned  exhilarated  free from dryness and irritation. Qty : 120ml              <div class="emptyClear"> </div> </div> </div> </div>,None,18:03:2014,None
B00DREAJ0C,BIOTIQUE HENNA LEAF FRESH TEXTURE SHAMPOO & CONDITIONER ECOPACK 1000ML,http://www.amazon.in/Hair-Care-Styling/b/ref=sd_allcat_beauty_haircare/276-6718833-1247838?ie=UTF8&node=1374305031,Rs. 600.00,Hair Care & Stylin,Hair Loss Products,Biotique,http://ecx.images-amazon.com/images/I/41lYMrywDHL._AA160_.jpg,Rs. 600.00,self Colour,Beauty & Health,http://www.amazon.in/BIOTIQUE-TEXTURE-SHAMPOO-CONDITIONER-ECOPACK/dp/B00DREAJ0C/ref=sr_1_9/276-4839360-6937557?s=beauty&ie=UTF8&qid=1395127155&sr=1-9,[<a class="buyAction" href="/gp/offer-listing/B00DREAJ0C/ref=dp_olp_0/276-4839360-6937557?ie=UTF8&amp;condition=all">these sellers</a>],Amazon.in: Buy BIOTIQUE HENNA LEAF FRESH TEXTURE SHAMPOO & CONDITIONER ECOPACK 1000ML Online at Best Price in India | Amazon Beauty Store,Buy BIOTIQUE HENNA LEAF FRESH TEXTURE SHAMPOO & CONDITIONER ECOPACK 1000ML at lowest price in India on Amazon.in. Check out BIOTIQUE HENNA LEAF FRESH TEXTURE SHAMPOO & CONDITIONER ECOPACK 1000ML reviews  ratings  features  specifications and browse more Beauty products online at best prices on Amazon.in.,None,<div class="bucket" id="productDescription"> <h2>Product Description</h2> <div class="content"> <h3 class="productDescriptionSource"></h3> <div class="productDescriptionWrapper">        This luxurious formula is a blend of pure henna leaves  soap nut and berberry to cleanse  condition and add a hint of henna highlights. Smoothes hair texture and brings out the richest brown tones. It leaves hair full of natural body and shine. It can be used daily to keep away premature grey.              <div class="emptyClear"> </div> </div> </div> </div>,None,18:03:2014,None
B009A9PBCE,Biotique Avocado Body Massage Oil - Cado 1100ml,http://www.amazon.in/Hair-Care-Styling/b/ref=sd_allcat_beauty_haircare/276-6718833-1247838?ie=UTF8&node=1374305031,Rs. 540.00,Hair Care & Stylin,Hair Loss Products,Biotique,http://ecx.images-amazon.com/images/I/41lYMrywDHL._AA160_.jpg,Rs. 540.00,self Colour,Beauty & Health,http://www.amazon.in/Biotique-Avocado-Body-Massage-Oil/dp/B009A9PBCE/ref=sr_1_6/276-4839360-6937557?s=beauty&ie=UTF8&qid=1395127155&sr=1-6,[<a class="buyAction" href="/gp/offer-listing/B009A9PBCE/ref=dp_olp_0/276-4839360-6937557?ie=UTF8&amp;condition=all">these sellers</a>],Amazon.in: Buy Biotique Avocado Body Massage Oil - Cado 1100ml Online at Best Price in India | Amazon Beauty Store,Buy Biotique Avocado Body Massage Oil - Cado 1100ml at lowest price in India on Amazon.in. Check out Biotique Avocado Body Massage Oil - Cado 1100ml reviews  ratings  features  specifications and browse more Beauty products online at best prices on Amazon.in.,None,<div class="bucket" id="productDescription"> <h2>Product Description</h2> <div class="content"> <h3 class="productDescriptionSource"></h3> <div class="productDescriptionWrapper">        Biotique  a well-known natural cosmetic brand  presents this Biotique Avocado Body Massage Oil-Bio Cado (Normal). An effective Ayurvedic remedy for stress-relieving  this massage oil is blended with natural ingredients to provide utmost relaxation to the body while relieving body fatigue and tension. Additionally  Biotique oil relaxes the muscles thereby relieving the body of all tiredness. With regular use  you will fall in love with your smooth  soft and supple skin. This oil has avocado as the key ingredient which is known to prevent dry skin. Also  enriched with the goodness of essential oils  it is completely safe to use on a consistent basis. Feel relaxed and relieved after the tiring day by gently massaging your body with this oil from Biotique.ÿ              <div class="emptyClear"> </div> </div> </div> </div>,None,18:03:2014,None
B00FXM1HV6,Biotique Kelp Shampoo  400ml,http://www.amazon.in/Hair-Care-Styling/b/ref=sd_allcat_beauty_haircare/276-6718833-1247838?ie=UTF8&node=1374305031,None,Hair Care & Stylin,Hair Loss Products,Biotique,http://ecx.images-amazon.com/images/I/41lYMrywDHL._AA160_.jpg,None,self Colour,Beauty & Health,http://www.amazon.in/Biotique-Kelp-Shampoo-400ml/dp/B00FXM1HV6/ref=sr_1_10/276-4839360-6937557?s=beauty&ie=UTF8&qid=1395127155&sr=1-10,[<a href="/gp/help/seller/at-a-glance.html/276-4839360-6937557?ie=UTF8&amp;isAmazonFulfilled=1&amp;seller=A2C6OV23728K9C">Newu</a>  <a href="/gp/help/customer/display.html/276-4839360-6937557?ie=UTF8&amp;nodeId=200953360&amp;ref=dp_fulfillment" id="SSOFpopoverLink"><strong>Fulfilled by Amazon</strong></a>],Amazon.in: Buy Biotique Kelp Shampoo  400ml Online at Best Price in India | Amazon Beauty Store,Buy Biotique Kelp Shampoo  400ml at lowest price in India on Amazon.in. Check out Biotique Kelp Shampoo  400ml reviews  ratings  features  specifications and browse more Beauty products online at best prices on Amazon.in.,None,<div class="bucket" id="productDescription"> <h2>Product Description</h2> <div class="content"> <h3 class="productDescriptionSource"></h3> <div class="productDescriptionWrapper">        This nourishing shampoo is a blend of pure kelp  natural proteins  peppermint oil and mint leaf extract  to gently cleanse hair and invigorate the scalp for fresh growth and healthier shine.              <div class="emptyClear"> </div> </div> </div> </div>,None,18:03:2014,None
B008TO71NS,BIO KELP Fresh Growth Protein Shampoo 1100 ML,http://www.amazon.in/Hair-Care-Styling/b/ref=sd_allcat_beauty_haircare/276-6718833-1247838?ie=UTF8&node=1374305031,Rs. 670.00,Hair Care & Stylin,Hair Loss Products,Biotique,http://ecx.images-amazon.com/images/I/41lYMrywDHL._AA160_.jpg,Rs. 670.00,self Colour,Beauty & Health,http://www.amazon.in/KELP-Fresh-Growth-Protein-Shampoo/dp/B008TO71NS/ref=sr_1_5/276-4839360-6937557?s=beauty&ie=UTF8&qid=1395127155&sr=1-5,[<a class="buyAction" href="/gp/offer-listing/B008TO71NS/ref=dp_olp_0/276-4839360-6937557?ie=UTF8&amp;condition=all">these sellers</a>],Amazon.in: Buy BIO KELP Fresh Growth Protein Shampoo 1100 ML Online at Best Price in India | Amazon Beauty Store,Buy BIO KELP Fresh Growth Protein Shampoo 1100 ML at lowest price in India on Amazon.in. Check out BIO KELP Fresh Growth Protein Shampoo 1100 ML reviews  ratings  features  specifications and browse more Beauty products online at best prices on Amazon.in.,None,<div class="bucket" id="productDescription"> <h2>Product Description</h2> <div class="content"> <h3 class="productDescriptionSource"></h3> <div class="productDescriptionWrapper">        This nourishing shampoo is a blend of pure kelp  natural proteins  peppermint oil and mint leaf extract  to gently cleanse hair and invigorate the scalp for fresh growth and healthier shine.              <div class="emptyClear"> </div> </div> </div> </div>,None,18:03:2014,None
B00G6MTPK2,Biotique Hair Care Therapeutic Oil for Hair Regrowth Bhringraj  120ml (Pack of 2),http://www.amazon.in/Hair-Care-Styling/b/ref=sd_allcat_beauty_haircare/276-6718833-1247838?ie=UTF8&node=1374305031,None,Hair Care & Stylin,Hair Loss Products,Biotique,http://ecx.images-amazon.com/images/I/41lYMrywDHL._AA160_.jpg,None,self Colour,Beauty & Health,http://www.amazon.in/Biotique-Therapeutic-Regrowth-Bhringraj-120ml/dp/B00G6MTPK2/ref=sr_1_7/276-4839360-6937557?s=beauty&ie=UTF8&qid=1395127155&sr=1-7,[<a href="/gp/help/seller/at-a-glance.html/276-4839360-6937557?ie=UTF8&amp;seller=A36B2MUBQK4XRS">SnapitToday</a>],Amazon.in: Buy Biotique Hair Care Therapeutic Oil for Hair Regrowth Bhringraj  120ml (Pack of 2) Online at Best Price in India | Amazon Beauty Store,Buy Biotique Hair Care Therapeutic Oil for Hair Regrowth Bhringraj  120ml (Pack of 2) at lowest price in India on Amazon.in. Check out Biotique Hair Care Therapeutic Oil for Hair Regrowth Bhringraj  120ml (Pack of 2) reviews  ratings  features  specifications and browse more Beauty products online at best prices on Amazon.in.,None,<div class="bucket" id="productDescription"> <h2>Product Description</h2> <div class="content"> <h3 class="productDescriptionSource"></h3> <div class="productDescriptionWrapper">        Intensive hair growth treatment.Details : Perfect blend of Bhringraj herb  coconut oil and goat milk helps you restore the health of your hair and diminish greying. The oil treats alopecia and many other causes of hair loss. It nourishes the scalp and strengthens hair strands  which in-turn encourages fresh growth.Get those long and strong tresses you have always dreamed of! How to Use;Apply liberally to dry hair and scalp. Gently massage in circular motions.Qty : 120ml              <div class="emptyClear"> </div> </div> </div> </div>,None,18:03:2014,None
B004C1VIPY,Biotique Bio Bhringraj Fresh Growth Therapeutic Oil  120ml,http://www.amazon.in/Hair-Care-Styling/b/ref=sd_allcat_beauty_haircare/276-6718833-1247838?ie=UTF8&node=1374305031,None,Hair Care & Stylin,Hair Loss Products,Biotique,http://ecx.images-amazon.com/images/I/41lYMrywDHL._AA160_.jpg,None,self Colour,Beauty & Health,http://www.amazon.in/Biotique-Bhringraj-Fresh-Growth-Therapeutic/dp/B004C1VIPY/ref=sr_1_1/276-4839360-6937557?s=beauty&ie=UTF8&qid=1395127155&sr=1-1,[<a href="/gp/help/seller/at-a-glance.html/276-4839360-6937557?ie=UTF8&amp;isAmazonFulfilled=1&amp;seller=ADJ7WREVGU39P">Zephyr Online</a>  <a href="/gp/help/customer/display.html/276-4839360-6937557?ie=UTF8&amp;nodeId=200953360&amp;ref=dp_fulfillment" id="SSOFpopoverLink"><strong>Fulfilled by Amazon</strong></a>],Amazon.in: Buy Biotique Bio Bhringraj Fresh Growth Therapeutic Oil  120ml Online at Best Price in India | Amazon Beauty Store,Buy Biotique Bio Bhringraj Fresh Growth Therapeutic Oil  120ml at lowest price in India on Amazon.in. Check out Biotique Bio Bhringraj Fresh Growth Therapeutic Oil  120ml reviews  ratings  features  specifications and browse more Beauty products online at best prices on Amazon.in.,None,<div class="bucket" id="productDescription"> <h2>Product Description</h2> <div class="content"> <h3 class="productDescriptionSource"></h3> <div class="productDescriptionWrapper">        Perfect blend of Bhringraj herb  coconut oil and goat milk helps you restore the health of your hair and diminish greying. The oil treats alopecia and many other causes of hair loss. It nourishes the scalp and strengthens hair strands  which in-turn encourages fresh growth.              <div class="emptyClear"> </div> </div> </div> </div>,None,18:03:2014,None
B00G6MT188,Biotique Hair Care Protein Cleaner for Hair Regrowth and Falling Hair Kelp Therapeutic  210ml (Pack of 2),http://www.amazon.in/Hair-Care-Styling/b/ref=sd_allcat_beauty_haircare/276-6718833-1247838?ie=UTF8&node=1374305031,None,Hair Care & Stylin,Hair Loss Products,Biotique,http://ecx.images-amazon.com/images/I/41lYMrywDHL._AA160_.jpg,None,self Colour,Beauty & Health,http://www.amazon.in/Biotique-Protein-Cleaner-Regrowth-Therapeutic/dp/B00G6MT188/ref=sr_1_4/276-4839360-6937557?s=beauty&ie=UTF8&qid=1395127155&sr=1-4,[<a href="/gp/help/seller/at-a-glance.html/276-4839360-6937557?ie=UTF8&amp;seller=A36B2MUBQK4XRS">SnapitToday</a>],Amazon.in: Buy Biotique Hair Care Protein Cleaner for Hair Regrowth and Falling Hair Kelp Therapeutic  210ml (Pack of 2) Online at Best Price in India | Amazon Beauty Store,Buy Biotique Hair Care Protein Cleaner for Hair Regrowth and Falling Hair Kelp Therapeutic  210ml (Pack of 2) at lowest price in India on Amazon.in. Check out Biotique Hair Care Protein Cleaner for Hair Regrowth and Falling Hair Kelp Therapeutic  210ml (Pack of 2) reviews  ratings  features  specifications and browse more Beauty products online at best prices on Amazon.in.,None,<div class="bucket" id="productDescription"> <h2>Product Description</h2> <div class="content"> <h3 class="productDescriptionSource"></h3> <div class="productDescriptionWrapper">        Intensive hair growth treatment.Details: Perfect blend of Bhringraj herb  coconut oil and goat milk helps you restore the health of your hair and diminish greying. The oil treats alopecia and many other causes of hair loss. It nourishes the scalp and strengthens hair strands  which in-turn encourages fresh growth. Get those long and strong tresses you have always dreamed of! How to Use : Apply liberally to dry hair and scalp. Gently massage in circular motions.Qty 210ml              <div class="emptyClear"> </div> </div> </div> </div>,None,18:03:2014,None
