B00HHVI2DM,Voylla Cream And Blue Ceramic Beaded Bracelet,http://www.amazon.in/Bangles-Bracelets/b/ref=sd_allcat_fj_bangles/276-6718833-1247838?ie=UTF8&node=2152549031,None,Bangles & Bracelet,Bangles & Bracelet,Voylla.com,http://ecx.images-amazon.com/images/I/31jtxUOpx0L._SL246_SX190_CR0 0 190 246_.jpg,Rs. 370.00,Color: Cream And Blue,Watches & Fashion Jewellery,http://www.amazon.in/Voylla-Cream-Ceramic-Beaded-Bracelet/dp/B00HHVI2DM/ref=sr_1_206/275-0905959-1711169?s=jewelry&ie=UTF8&qid=1395127326&sr=1-206,[<a href="/gp/help/seller/at-a-glance.html/275-0905959-1711169?ie=UTF8&amp;seller=A2GYSPAJ7WDF11">Voylla</a>],Amazon.in: Buy Voylla Cream And Blue Ceramic Beaded Bracelet at Low Prices in India | Fashion Jewellery Store,Buy Voylla Cream And Blue Ceramic Beaded Bracelet at low prices in India at Amazon.in. Check out Voylla Cream And Blue Ceramic Beaded Bracelet reviews  ratings  features  specifications and browse more Fashion Jewellery products online at best prices on Amazon.in.,None,<div class="bucket" id="productDescription"> <h2>Product Description</h2> <div class="content"> <h3 class="productDescriptionSource"></h3> <div class="productDescriptionWrapper">        Creating trendy look is easy when you have these bracelet crafted from ceramic. These stylish bracelet are a must-have to spruce up your collection.              <div class="emptyClear"> </div> </div> </div> </div>,<div align="left" class="bucket" id="techSpecSoftlinesWrap"><h2>Product Specifications </h2> <div class="content"> <div id="techSpecSoftlines"> <table cellspacing="0"> <tr> <th colspan="2">Jewellery Information</th> </tr> <tr> <td class="td1">Brand</td> <td class="td2">                                             Voylla.com                                         </td> </tr> <tr> <td class="td1">Resizable?</td> <td class="td2">                                             Y                                         </td> </tr> <tr> <td class="td1">Material</td> <td class="td2">                                             plastic                                         </td> </tr> <tr> <td class="td1">Model Number</td> <td class="td2">                                             CMBLR20039                                         </td> </tr> <tr> <td class="td1">Warranty Description</td> <td class="td2">                                             CMBLR20039                                         </td> </tr> </table> </div> </div> </div>,18:03:2014,None
B00HHVHJC2,Voylla Crystal Studded Bangles With Gold Plating,http://www.amazon.in/Bangles-Bracelets/b/ref=sd_allcat_fj_bangles/276-6718833-1247838?ie=UTF8&node=2152549031,None,Bangles & Bracelet,Bangles & Bracelet,Voylla.com,http://ecx.images-amazon.com/images/I/31jtxUOpx0L._SL246_SX190_CR0 0 190 246_.jpg,Rs. 450.00,self Colour,Watches & Fashion Jewellery,http://www.amazon.in/Voylla-Crystal-Studded-Bangles-Plating/dp/B00HHVHJC2/ref=sr_1_208/275-0905959-1711169?s=jewelry&ie=UTF8&qid=1395127326&sr=1-208,[<a href="/gp/help/seller/at-a-glance.html/275-0905959-1711169?ie=UTF8&amp;seller=A2GYSPAJ7WDF11">Voylla</a>],Amazon.in: Buy Voylla Crystal Studded Bangles With Gold Plating at Low Prices in India | Fashion Jewellery Store,Buy Voylla Crystal Studded Bangles With Gold Plating at low prices in India at Amazon.in. Check out Voylla Crystal Studded Bangles With Gold Plating reviews  ratings  features  specifications and browse more Fashion Jewellery products online at best prices on Amazon.in.,None,<div class="bucket" id="productDescription"> <h2>Product Description</h2> <div class="content"> <h3 class="productDescriptionSource"></h3> <div class="productDescriptionWrapper">        Simply captivating; this sparkling gold plated bangle pair comes embellished with glimmering cz stones and crystals that lend you prominence and enhances your festive look.              <div class="emptyClear"> </div> </div> </div> </div>,<div align="left" class="bucket" id="techSpecSoftlinesWrap"><h2>Product Specifications </h2> <div class="content"> <div id="techSpecSoftlines"> <table cellspacing="0"> <tr> <th colspan="2">Jewellery Information</th> </tr> <tr> <td class="td1">Brand</td> <td class="td2">                                             Voylla.com                                         </td> </tr> <tr> <td class="td1">Material</td> <td class="td2">                                             Non-Precious Metal                                         </td> </tr> <tr> <td class="td1">Model Number</td> <td class="td2">                                             PSJAI23241                                         </td> </tr> <tr> <td class="td1">Ring Size</td> <td class="td2">                                             2.25                                         </td> </tr> <tr> <td class="td1">Warranty Description</td> <td class="td2">                                             PSJAI23241                                         </td> </tr> </table> </div> </div> </div>,18:03:2014,None
B00HHVGR2K,Voylla Cz Encrusted Bangles With Gold Plating; Charming Contemporary Look,http://www.amazon.in/Bangles-Bracelets/b/ref=sd_allcat_fj_bangles/276-6718833-1247838?ie=UTF8&node=2152549031,None,Bangles & Bracelet,Bangles & Bracelet,Voylla.com,http://ecx.images-amazon.com/images/I/31jtxUOpx0L._SL246_SX190_CR0 0 190 246_.jpg,Rs. 540.00,Color: White; golden; maroon and green,Watches & Fashion Jewellery,http://www.amazon.in/Encrusted-Bangles-Plating-Charming-Contemporary/dp/B00HHVGR2K/ref=sr_1_209/275-0905959-1711169?s=jewelry&ie=UTF8&qid=1395127326&sr=1-209,[<a href="/gp/help/seller/at-a-glance.html/275-0905959-1711169?ie=UTF8&amp;seller=A2GYSPAJ7WDF11">Voylla</a>],Amazon.in: Buy Voylla Cz Encrusted Bangles With Gold Plating; Charming Contemporary Look at Low Prices in India | Fashion Jewellery Store,Buy Voylla Cz Encrusted Bangles With Gold Plating; Charming Contemporary Look at low prices in India at Amazon.in. Check out Voylla Cz Encrusted Bangles With Gold Plating; Charming Contemporary Look reviews  ratings  features  specifications and browse more Fashion Jewellery products online at best prices on Amazon.in.,None,<div class="bucket" id="productDescription"> <h2>Product Description</h2> <div class="content"> <h3 class="productDescriptionSource"></h3> <div class="productDescriptionWrapper">        Coming with a delightful blend of traditional and contemporary beauty; this magnificent gold plated bangle pair with scintillating Cz and traditional stones is up for grabs. Team this stylish pair with your favorite attire and you'll be good to go! A must              <div class="emptyClear"> </div> </div> </div> </div>,<div align="left" class="bucket" id="techSpecSoftlinesWrap"><h2>Product Specifications </h2> <div class="content"> <div id="techSpecSoftlines"> <table cellspacing="0"> <tr> <th colspan="2">Jewellery Information</th> </tr> <tr> <td class="td1">Brand</td> <td class="td2">                                             Voylla.com                                         </td> </tr> <tr> <td class="td1">Material</td> <td class="td2">                                             Non-Precious Metal                                         </td> </tr> <tr> <td class="td1">Model Number</td> <td class="td2">                                             PSJAI23261                                         </td> </tr> <tr> <td class="td1">Ring Size</td> <td class="td2">                                             2.25                                         </td> </tr> <tr> <td class="td1">Warranty Description</td> <td class="td2">                                             PSJAI23261                                         </td> </tr> </table> </div> </div> </div>,18:03:2014,None
B00HHVHANK,Voylla Cz Encrusted Bangles With Wavy Design; Gold Plating,http://www.amazon.in/Bangles-Bracelets/b/ref=sd_allcat_fj_bangles/276-6718833-1247838?ie=UTF8&node=2152549031,None,Bangles & Bracelet,Bangles & Bracelet,Voylla.com,http://ecx.images-amazon.com/images/I/31jtxUOpx0L._SL246_SX190_CR0 0 190 246_.jpg,Rs. 790.00,self Colour,Watches & Fashion Jewellery,http://www.amazon.in/Voylla-Encrusted-Bangles-Design-Plating/dp/B00HHVHANK/ref=sr_1_210/275-0905959-1711169?s=jewelry&ie=UTF8&qid=1395127326&sr=1-210,[<a href="/gp/help/seller/at-a-glance.html/275-0905959-1711169?ie=UTF8&amp;seller=A2GYSPAJ7WDF11">Voylla</a>],Amazon.in: Buy Voylla Cz Encrusted Bangles With Wavy Design; Gold Plating at Low Prices in India | Fashion Jewellery Store,Buy Voylla Cz Encrusted Bangles With Wavy Design; Gold Plating at low prices in India at Amazon.in. Check out Voylla Cz Encrusted Bangles With Wavy Design; Gold Plating reviews  ratings  features  specifications and browse more Fashion Jewellery products online at best prices on Amazon.in.,None,<div class="bucket" id="productDescription"> <h2>Product Description</h2> <div class="content"> <h3 class="productDescriptionSource"></h3> <div class="productDescriptionWrapper">        Add a sparkling contemporary touch with these classy gold plated bangles; replete with shimmering cubic zirconia stones! Embellished with maroon and green stones; these elegant bangles are perfect to adorn on any special occasion!              <div class="emptyClear"> </div> </div> </div> </div>,<div align="left" class="bucket" id="techSpecSoftlinesWrap"><h2>Product Specifications </h2> <div class="content"> <div id="techSpecSoftlines"> <table cellspacing="0"> <tr> <th colspan="2">Jewellery Information</th> </tr> <tr> <td class="td1">Brand</td> <td class="td2">                                             Voylla.com                                         </td> </tr> <tr> <td class="td1">Material</td> <td class="td2">                                             Non-Precious Metal                                         </td> </tr> <tr> <td class="td1">Model Number</td> <td class="td2">                                             PSJAI23230                                         </td> </tr> </table> </div> </div> </div>,18:03:2014,None
B00HHVI1V0,Voylla Cz Encrusted Sophisticated Bangle Set With Gold Plating,http://www.amazon.in/Bangles-Bracelets/b/ref=sd_allcat_fj_bangles/276-6718833-1247838?ie=UTF8&node=2152549031,None,Bangles & Bracelet,Bangles & Bracelet,Voylla.com,http://ecx.images-amazon.com/images/I/31jtxUOpx0L._SL246_SX190_CR0 0 190 246_.jpg,None,Color: White and golden,Watches & Fashion Jewellery,http://www.amazon.in/Voylla-Encrusted-Sophisticated-Bangle-Plating/dp/B00HHVI1V0/ref=sr_1_211/275-0905959-1711169?s=jewelry&ie=UTF8&qid=1395127326&sr=1-211,[<a href="/gp/help/seller/at-a-glance.html/275-0905959-1711169?ie=UTF8&amp;seller=A2GYSPAJ7WDF11">Voylla</a>],Amazon.in: Buy Voylla Cz Encrusted Sophisticated Bangle Set With Gold Plating at Low Prices in India | Fashion Jewellery Store,Buy Voylla Cz Encrusted Sophisticated Bangle Set With Gold Plating at low prices in India at Amazon.in. Check out Voylla Cz Encrusted Sophisticated Bangle Set With Gold Plating reviews  ratings  features  specifications and browse more Fashion Jewellery products online at best prices on Amazon.in.,None,<div class="bucket" id="productDescription"> <h2>Product Description</h2> <div class="content"> <h3 class="productDescriptionSource"></h3> <div class="productDescriptionWrapper">        Outshine the rest with this stunning gold plated bangle pair; set with brilliant cubic zirconia stones in an alluring and conspicuous design. Get this remarkable piece of perfection today!              <div class="emptyClear"> </div> </div> </div> </div>,<div align="left" class="bucket" id="techSpecSoftlinesWrap"><h2>Product Specifications </h2> <div class="content"> <div id="techSpecSoftlines"> <table cellspacing="0"> <tr> <th colspan="2">Jewellery Information</th> </tr> <tr> <td class="td1">Brand</td> <td class="td2">                                             Voylla.com                                         </td> </tr> <tr> <td class="td1">Material</td> <td class="td2">                                             Non-Precious Metal                                         </td> </tr> <tr> <td class="td1">Model Number</td> <td class="td2">                                             SCCCU20101                                         </td> </tr> <tr> <td class="td1">Ring Size</td> <td class="td2">                                             2.5                                         </td> </tr> <tr> <td class="td1">Warranty Description</td> <td class="td2">                                             SCCCU20101                                         </td> </tr> </table> </div> </div> </div>,18:03:2014,None
B00HHVK0XW,Voylla Cz Studded Bangle Pair With Rhodium; Gold Plating,http://www.amazon.in/Bangles-Bracelets/b/ref=sd_allcat_fj_bangles/276-6718833-1247838?ie=UTF8&node=2152549031,None,Bangles & Bracelet,Bangles & Bracelet,Voylla.com,http://ecx.images-amazon.com/images/I/31jtxUOpx0L._SL246_SX190_CR0 0 190 246_.jpg,None,Color: Golden; silver and black,Watches & Fashion Jewellery,http://www.amazon.in/Voylla-Studded-Bangle-Rhodium-Plating/dp/B00HHVK0XW/ref=sr_1_212/275-0905959-1711169?s=jewelry&ie=UTF8&qid=1395127326&sr=1-212,[<a href="/gp/help/seller/at-a-glance.html/275-0905959-1711169?ie=UTF8&amp;seller=A2GYSPAJ7WDF11">Voylla</a>],Amazon.in: Buy Voylla Cz Studded Bangle Pair With Rhodium; Gold Plating at Low Prices in India | Fashion Jewellery Store,Buy Voylla Cz Studded Bangle Pair With Rhodium; Gold Plating at low prices in India at Amazon.in. Check out Voylla Cz Studded Bangle Pair With Rhodium; Gold Plating reviews  ratings  features  specifications and browse more Fashion Jewellery products online at best prices on Amazon.in.,None,<div class="bucket" id="productDescription"> <h2>Product Description</h2> <div class="content"> <h3 class="productDescriptionSource"></h3> <div class="productDescriptionWrapper">        Bring a touch of class and opulence with these immaculately crafted pair of gold and rhodium plated bangles. Replete with cubic zirconia stones; these bangles embellished in striking design make you the star of the occasion the moment you adorn them!              <div class="emptyClear"> </div> </div> </div> </div>,<div align="left" class="bucket" id="techSpecSoftlinesWrap"><h2>Product Specifications </h2> <div class="content"> <div id="techSpecSoftlines"> <table cellspacing="0"> <tr> <th colspan="2">Jewellery Information</th> </tr> <tr> <td class="td1">Brand</td> <td class="td2">                                             Voylla.com                                         </td> </tr> <tr> <td class="td1">Material</td> <td class="td2">                                             Non-Precious Metal                                         </td> </tr> <tr> <td class="td1">Model Number</td> <td class="td2">                                             PSJAI23491                                         </td> </tr> <tr> <td class="td1">Ring Size</td> <td class="td2">                                             2.5                                         </td> </tr> <tr> <td class="td1">Warranty Description</td> <td class="td2">                                             PSJAI23491                                         </td> </tr> </table> </div> </div> </div>,18:03:2014,None
B00HHVJZP6,Voylla Cz Studded Graceful Bangles With Eye Design; Gold Plating,http://www.amazon.in/Bangles-Bracelets/b/ref=sd_allcat_fj_bangles/276-6718833-1247838?ie=UTF8&node=2152549031,None,Bangles & Bracelet,Bangles & Bracelet,Voylla.com,http://ecx.images-amazon.com/images/I/31jtxUOpx0L._SL246_SX190_CR0 0 190 246_.jpg,None,self Colour,Watches & Fashion Jewellery,http://www.amazon.in/Voylla-Studded-Graceful-Bangles-Plating/dp/B00HHVJZP6/ref=sr_1_213/275-0905959-1711169?s=jewelry&ie=UTF8&qid=1395127326&sr=1-213,[<a href="/gp/help/seller/at-a-glance.html/275-0905959-1711169?ie=UTF8&amp;seller=A2GYSPAJ7WDF11">Voylla</a>],Amazon.in: Buy Voylla Cz Studded Graceful Bangles With Eye Design; Gold Plating at Low Prices in India | Fashion Jewellery Store,Buy Voylla Cz Studded Graceful Bangles With Eye Design; Gold Plating at low prices in India at Amazon.in. Check out Voylla Cz Studded Graceful Bangles With Eye Design; Gold Plating reviews  ratings  features  specifications and browse more Fashion Jewellery products online at best prices on Amazon.in.,None,<div class="bucket" id="productDescription"> <h2>Product Description</h2> <div class="content"> <h3 class="productDescriptionSource"></h3> <div class="productDescriptionWrapper">        Outshine the rest with this stunning pair of gold plated bangles; studded with shimmering cubic zirconia and traditional maroon and green stones. This contemporary style set is certainly neighbor's envy; owner's pride.              <div class="emptyClear"> </div> </div> </div> </div>,<div align="left" class="bucket" id="techSpecSoftlinesWrap"><h2>Product Specifications </h2> <div class="content"> <div id="techSpecSoftlines"> <table cellspacing="0"> <tr> <th colspan="2">Jewellery Information</th> </tr> <tr> <td class="td1">Brand</td> <td class="td2">                                             Voylla.com                                         </td> </tr> <tr> <td class="td1">Material</td> <td class="td2">                                             Non-Precious Metal                                         </td> </tr> <tr> <td class="td1">Model Number</td> <td class="td2">                                             PSJAI23557                                         </td> </tr> </table> </div> </div> </div>,18:03:2014,None
B00HHVFEFG,Voylla Dainty Four Bangle Set Decorated with Cz Red; Yellow; Green Stones,http://www.amazon.in/Bangles-Bracelets/b/ref=sd_allcat_fj_bangles/276-6718833-1247838?ie=UTF8&node=2152549031,None,Bangles & Bracelet,Bangles & Bracelet,Voylla.com,http://ecx.images-amazon.com/images/I/31jtxUOpx0L._SL246_SX190_CR0 0 190 246_.jpg,None,self Colour,Watches & Fashion Jewellery,http://www.amazon.in/Voylla-Dainty-Bangle-Decorated-Yellow/dp/B00HHVFEFG/ref=sr_1_214/275-0905959-1711169?s=jewelry&ie=UTF8&qid=1395127326&sr=1-214,[<a href="/gp/help/seller/at-a-glance.html/275-0905959-1711169?ie=UTF8&amp;seller=A2GYSPAJ7WDF11">Voylla</a>],Amazon.in: Buy Voylla Dainty Four Bangle Set Decorated with Cz Red; Yellow; Green Stones at Low Prices in India | Fashion Jewellery Store,Buy Voylla Dainty Four Bangle Set Decorated with Cz Red; Yellow; Green Stones at low prices in India at Amazon.in. Check out Voylla Dainty Four Bangle Set Decorated with Cz Red; Yellow; Green Stones reviews  ratings  features  specifications and browse more Fashion Jewellery products online at best prices on Amazon.in.,None,<div class="bucket" id="productDescription"> <h2>Product Description</h2> <div class="content"> <h3 class="productDescriptionSource"></h3> <div class="productDescriptionWrapper">        Add a delightful sparkle of the traditional and the contemporary with this charming gold plated four bangle set; lavishly encrusted with cubic zirconia and yellow; red and green stones. This striking pair with chic wavy design instantly invigorates your look with mesmerizing beauty!              <div class="emptyClear"> </div> </div> </div> </div>,<div align="left" class="bucket" id="techSpecSoftlinesWrap"><h2>Product Specifications </h2> <div class="content"> <div id="techSpecSoftlines"> <table cellspacing="0"> <tr> <th colspan="2">Jewellery Information</th> </tr> <tr> <td class="td1">Brand</td> <td class="td2">                                             Voylla.com                                         </td> </tr> <tr> <td class="td1">Material</td> <td class="td2">                                             Non-Precious Metal                                         </td> </tr> <tr> <td class="td1">Model Number</td> <td class="td2">                                             PSJAI23518                                         </td> </tr> <tr> <td class="td1">Ring Size</td> <td class="td2">                                             2.5                                         </td> </tr> <tr> <td class="td1">Warranty Description</td> <td class="td2">                                             PSJAI23518                                         </td> </tr> </table> </div> </div> </div>,18:03:2014,None
B00HHVGHSE,Voylla Dazzling Beauty: Set of Bangles with Oval Shape; Slanting Row; Crystal,http://www.amazon.in/Bangles-Bracelets/b/ref=sd_allcat_fj_bangles/276-6718833-1247838?ie=UTF8&node=2152549031,None,Bangles & Bracelet,Bangles & Bracelet,Voylla.com,http://ecx.images-amazon.com/images/I/31jtxUOpx0L._SL246_SX190_CR0 0 190 246_.jpg,None,Color: Golden; maroon; green and white,Watches & Fashion Jewellery,http://www.amazon.in/Voylla-Dazzling-Beauty-Bangles-Slanting/dp/B00HHVGHSE/ref=sr_1_215/275-0905959-1711169?s=jewelry&ie=UTF8&qid=1395127326&sr=1-215,[<a href="/gp/help/seller/at-a-glance.html/275-0905959-1711169?ie=UTF8&amp;seller=A2GYSPAJ7WDF11">Voylla</a>],Amazon.in: Buy Voylla Dazzling Beauty: Set of Bangles with Oval Shape; Slanting Row; Crystal at Low Prices in India | Fashion Jewellery Store,Buy Voylla Dazzling Beauty: Set of Bangles with Oval Shape; Slanting Row; Crystal at low prices in India at Amazon.in. Check out Voylla Dazzling Beauty: Set of Bangles with Oval Shape; Slanting Row; Crystal reviews  ratings  features  specifications and browse more Fashion Jewellery products online at best prices on Amazon.in.,None,<div class="bucket" id="productDescription"> <h2>Product Description</h2> <div class="content"> <h3 class="productDescriptionSource"></h3> <div class="productDescriptionWrapper">        This bangles with dazzling beauty has a unique design which epitomises the fashion statement with culmination of ethnicity. The sun kissed and multi-colored stones will make you a ramp scorcher              <div class="emptyClear"> </div> </div> </div> </div>,<div align="left" class="bucket" id="techSpecSoftlinesWrap"><h2>Product Specifications </h2> <div class="content"> <div id="techSpecSoftlines"> <table cellspacing="0"> <tr> <th colspan="2">Jewellery Information</th> </tr> <tr> <td class="td1">Brand</td> <td class="td2">                                             Voylla.com                                         </td> </tr> <tr> <td class="td1">Material</td> <td class="td2">                                             Non-Precious Metal                                         </td> </tr> <tr> <td class="td1">Model Number</td> <td class="td2">                                             PSJAI23510                                         </td> </tr> <tr> <td class="td1">Ring Size</td> <td class="td2">                                             2.5                                         </td> </tr> <tr> <td class="td1">Warranty Description</td> <td class="td2">                                             PSJAI23510                                         </td> </tr> </table> </div> </div> </div>,18:03:2014,None
B00HFSAQEU,Voylla Elegant Bangles With Sparkling Cubic Zirconia stones,http://www.amazon.in/Bangles-Bracelets/b/ref=sd_allcat_fj_bangles/276-6718833-1247838?ie=UTF8&node=2152549031,None,Bangles & Bracelet,Bangles & Bracelet,Voylla.com,http://ecx.images-amazon.com/images/I/31jtxUOpx0L._SL246_SX190_CR0 0 190 246_.jpg,Rs. 3 940.00,Color: Silver,Watches & Fashion Jewellery,http://www.amazon.in/Voylla-Elegant-Bangles-Sparkling-Zirconia/dp/B00HFSAQEU/ref=sr_1_217/275-0905959-1711169?s=jewelry&ie=UTF8&qid=1395127326&sr=1-217,[<a href="/gp/help/seller/at-a-glance.html/275-0905959-1711169?ie=UTF8&amp;seller=A2GYSPAJ7WDF11">Voylla</a>],Amazon.in: Buy Voylla Elegant Bangles With Sparkling Cubic Zirconia stones at Low Prices in India | Fashion Jewellery Store,Buy Voylla Elegant Bangles With Sparkling Cubic Zirconia stones at low prices in India at Amazon.in. Check out Voylla Elegant Bangles With Sparkling Cubic Zirconia stones reviews  ratings  features  specifications and browse more Fashion Jewellery products online at best prices on Amazon.in.,None,<div class="bucket" id="productDescription"> <h2>Product Description</h2> <div class="content"> <h3 class="productDescriptionSource"></h3> <div class="productDescriptionWrapper">        Stylish and sophisticated pair of silver polished bangles beautifully designed. The sparkling cubic zirconia embellishments simply add more beauty to these bangles. Team it with your ethnic wear for the complete look.              <div class="emptyClear"> </div> </div> </div> </div>,<div align="left" class="bucket" id="techSpecSoftlinesWrap"><h2>Product Specifications </h2> <div class="content"> <div id="techSpecSoftlines"> <table cellspacing="0"> <tr> <th colspan="2">Jewellery Information</th> </tr> <tr> <td class="td1">Brand</td> <td class="td2">                                             Voylla.com                                         </td> </tr> <tr> <td class="td1">Material</td> <td class="td2">                                             Non-Precious Metal                                         </td> </tr> <tr> <td class="td1">Model Number</td> <td class="td2">                                             PSJAI20034                                         </td> </tr> <tr> <td class="td1">Ring Size</td> <td class="td2">                                             2.25                                         </td> </tr> <tr> <td class="td1">Warranty Description</td> <td class="td2">                                             PSJAI20034                                         </td> </tr> </table> </div> </div> </div>,18:03:2014,None
