B00HHVHD3C,Red Cherry Bead Bracelet,http://www.amazon.in/Bangles-Bracelets/b/ref=sd_allcat_fj_bangles/276-6718833-1247838?ie=UTF8&node=2152549031,None,Bangles & Bracelet,Bangles & Bracelet,Voylla.com,http://ecx.images-amazon.com/images/I/31jtxUOpx0L._SL246_SX190_CR0 0 190 246_.jpg,Rs. 270.00,Color: Red,Watches & Fashion Jewellery,http://www.amazon.in/Voylla-com-MAPNQ20687-Cherry-Bead-Bracelet/dp/B00HHVHD3C/ref=sr_1_110/275-0905959-1711169?s=jewelry&ie=UTF8&qid=1395127318&sr=1-110,[<a href="/gp/help/seller/at-a-glance.html/275-0905959-1711169?ie=UTF8&amp;seller=A2GYSPAJ7WDF11">Voylla</a>],Amazon.in: Buy Red Cherry Bead Bracelet at Low Prices in India | Fashion Jewellery Store,Buy Red Cherry Bead Bracelet at low prices in India at Amazon.in. Check out Red Cherry Bead Bracelet reviews  ratings  features  specifications and browse more Fashion Jewellery products online at best prices on Amazon.in.,None,<div class="bucket" id="productDescription"> <h2>Product Description</h2> <div class="content"> <h3 class="productDescriptionSource"></h3> <div class="productDescriptionWrapper">        This funky elastic bracelet will adored by the youngsters. Featuring a tempting red cherry bead design; this bracelet is up for grabs!              <div class="emptyClear"> </div> </div> </div> </div>,<div align="left" class="bucket" id="techSpecSoftlinesWrap"><h2>Product Specifications </h2> <div class="content"> <div id="techSpecSoftlines"> <table cellspacing="0"> <tr> <th colspan="2">Jewellery Information</th> </tr> <tr> <td class="td1">Brand</td> <td class="td2">                                             Voylla.com                                         </td> </tr> <tr> <td class="td1">Material</td> <td class="td2">                                             plastic                                         </td> </tr> <tr> <td class="td1">Model Number</td> <td class="td2">                                             MAPNQ20687                                         </td> </tr> </table> </div> </div> </div>,18:03:2014,None
B00IAJV9AI,Silver Plated Flutter Bracelet,http://www.amazon.in/Bangles-Bracelets/b/ref=sd_allcat_fj_bangles/276-6718833-1247838?ie=UTF8&node=2152549031,None,Bangles & Bracelet,Bangles & Bracelet,Voylla.com,http://ecx.images-amazon.com/images/I/31jtxUOpx0L._SL246_SX190_CR0 0 190 246_.jpg,None,Color: Silver,Watches & Fashion Jewellery,http://www.amazon.in/Voylla-com-FSBOM20034-Silver-Flutter-Bracelet/dp/B00IAJV9AI/ref=sr_1_111/275-0905959-1711169?s=jewelry&ie=UTF8&qid=1395127318&sr=1-111,[<a href="/gp/help/seller/at-a-glance.html/275-0905959-1711169?ie=UTF8&amp;seller=A2GYSPAJ7WDF11">Voylla</a>],Amazon.in: Buy Silver Plated Flutter Bracelet at Low Prices in India | Fashion Jewellery Store,Buy Silver Plated Flutter Bracelet at low prices in India at Amazon.in. Check out Silver Plated Flutter Bracelet reviews  ratings  features  specifications and browse more Fashion Jewellery products online at best prices on Amazon.in.,None,<div class="bucket" id="productDescription"> <h2>Product Description</h2> <div class="content"> <h3 class="productDescriptionSource"></h3> <div class="productDescriptionWrapper">        Grab this dainty silver plated metallic charm bracelet; embellished with cute and radiant butterfly dangles. Pretty accessory for a petite you!              <div class="emptyClear"> </div> </div> </div> </div>,<div align="left" class="bucket" id="techSpecSoftlinesWrap"><h2>Product Specifications </h2> <div class="content"> <div id="techSpecSoftlines"> <table cellspacing="0"> <tr> <th colspan="2">Jewellery Information</th> </tr> <tr> <td class="td1">Brand</td> <td class="td2">                                             Voylla.com                                         </td> </tr> <tr> <td class="td1">Resizable?</td> <td class="td2">                                             Y                                         </td> </tr> <tr> <td class="td1">Material</td> <td class="td2">                                             Metal                                         </td> </tr> <tr> <td class="td1">Model Number</td> <td class="td2">                                             FSBOM20034                                         </td> </tr> </table> </div> </div> </div>,18:03:2014,None
B00IML4YKQ,Simple and Sleek Gold Plated Bracelet,http://www.amazon.in/Bangles-Bracelets/b/ref=sd_allcat_fj_bangles/276-6718833-1247838?ie=UTF8&node=2152549031,None,Bangles & Bracelet,Bangles & Bracelet,Voylla.com,http://ecx.images-amazon.com/images/I/31jtxUOpx0L._SL246_SX190_CR0 0 190 246_.jpg,Rs. 790.00,Color: Metallic Gold,Watches & Fashion Jewellery,http://www.amazon.in/Simple-Sleek-Gold-Plated-Bracelet/dp/B00IML4YKQ/ref=sr_1_112/275-0905959-1711169?s=jewelry&ie=UTF8&qid=1395127318&sr=1-112,[<a href="/gp/help/seller/at-a-glance.html/275-0905959-1711169?ie=UTF8&amp;seller=A2GYSPAJ7WDF11">Voylla</a>],Amazon.in: Buy Simple and Sleek Gold Plated Bracelet at Low Prices in India | Fashion Jewellery Store,Buy Simple and Sleek Gold Plated Bracelet at low prices in India at Amazon.in. Check out Simple and Sleek Gold Plated Bracelet reviews  ratings  features  specifications and browse more Fashion Jewellery products online at best prices on Amazon.in.,None,<div class="bucket" id="productDescription"> <h2>Product Description</h2> <div class="content"> <h3 class="productDescriptionSource"></h3> <div class="productDescriptionWrapper">        Crafted from fine metal alloy; get this elegant bracelet today! Simple and sleek; this gold plated adornment is a delightful addition to your accessory collection. Get one today!              <div class="emptyClear"> </div> </div> </div> </div>,<div align="left" class="bucket" id="techSpecSoftlinesWrap"><h2>Product Specifications </h2> <div class="content"> <div id="techSpecSoftlines"> <table cellspacing="0"> <tr> <th colspan="2">Jewellery Information</th> </tr> <tr> <td class="td1">Brand</td> <td class="td2">                                             Voylla.com                                         </td> </tr> <tr> <td class="td1">Material</td> <td class="td2">                                             Metal                                         </td> </tr> <tr> <td class="td1">Model Number</td> <td class="td2">                                             SNJAI20084                                         </td> </tr> </table> </div> </div> </div>,18:03:2014,None
B00IML5NTC,Sleek Cz Bracelet With Rhodium Plating; Green Stone,http://www.amazon.in/Bangles-Bracelets/b/ref=sd_allcat_fj_bangles/276-6718833-1247838?ie=UTF8&node=2152549031,None,Bangles & Bracelet,Bangles & Bracelet,Voylla.com,http://ecx.images-amazon.com/images/I/31jtxUOpx0L._SL246_SX190_CR0 0 190 246_.jpg,None,self Colour,Watches & Fashion Jewellery,http://www.amazon.in/Sleek-Bracelet-Rhodium-Plating-Green/dp/B00IML5NTC/ref=sr_1_113/275-0905959-1711169?s=jewelry&ie=UTF8&qid=1395127318&sr=1-113,[<a href="/gp/help/seller/at-a-glance.html/275-0905959-1711169?ie=UTF8&amp;seller=A2GYSPAJ7WDF11">Voylla</a>],Amazon.in: Buy Sleek Cz Bracelet With Rhodium Plating; Green Stone at Low Prices in India | Fashion Jewellery Store,Buy Sleek Cz Bracelet With Rhodium Plating; Green Stone at low prices in India at Amazon.in. Check out Sleek Cz Bracelet With Rhodium Plating; Green Stone reviews  ratings  features  specifications and browse more Fashion Jewellery products online at best prices on Amazon.in.,None,<div class="bucket" id="productDescription"> <h2>Product Description</h2> <div class="content"> <h3 class="productDescriptionSource"></h3> <div class="productDescriptionWrapper">        Flaunt unmatched elegance with this rhodium plated bracelet; studded with resplendent cz stones; the epitome of refined grace and lan. The delightful green stone adds a splash of delicate charm to your look. Get it today!              <div class="emptyClear"> </div> </div> </div> </div>,<div align="left" class="bucket" id="techSpecSoftlinesWrap"><h2>Product Specifications </h2> <div class="content"> <div id="techSpecSoftlines"> <table cellspacing="0"> <tr> <th colspan="2">Jewellery Information</th> </tr> <tr> <td class="td1">Brand</td> <td class="td2">                                             Voylla.com                                         </td> </tr> <tr> <td class="td1">Material</td> <td class="td2">                                             Metal                                         </td> </tr> <tr> <td class="td1">Model Number</td> <td class="td2">                                             SCCCU20034                                         </td> </tr> </table> </div> </div> </div>,18:03:2014,None
B00IML9EVK,Smart 925 Sterling Silver Nazariya Bracelet Pair,http://www.amazon.in/Bangles-Bracelets/b/ref=sd_allcat_fj_bangles/276-6718833-1247838?ie=UTF8&node=2152549031,None,Bangles & Bracelet,Bangles & Bracelet,Voylla.com,http://ecx.images-amazon.com/images/I/31jtxUOpx0L._SL246_SX190_CR0 0 190 246_.jpg,None,Color: Black And Silver,Watches & Fashion Jewellery,http://www.amazon.in/Smart-Sterling-Silver-Nazariya-Bracelet/dp/B00IML9EVK/ref=sr_1_114/275-0905959-1711169?s=jewelry&ie=UTF8&qid=1395127318&sr=1-114,[<a href="/gp/help/seller/at-a-glance.html/275-0905959-1711169?ie=UTF8&amp;seller=A2GYSPAJ7WDF11">Voylla</a>],Amazon.in: Buy Smart 925 Sterling Silver Nazariya Bracelet Pair at Low Prices in India | Fashion Jewellery Store,Buy Smart 925 Sterling Silver Nazariya Bracelet Pair at low prices in India at Amazon.in. Check out Smart 925 Sterling Silver Nazariya Bracelet Pair reviews  ratings  features  specifications and browse more Fashion Jewellery products online at best prices on Amazon.in.,None,<div class="bucket" id="productDescription"> <h2>Product Description</h2> <div class="content"> <h3 class="productDescriptionSource"></h3> <div class="productDescriptionWrapper">        Surprise your little one with this pair of smart Nazariya baby bracelet; crafted from 925 sterling silver and embellished with black crystals!!              <div class="emptyClear"> </div> </div> </div> </div>,<div align="left" class="bucket" id="techSpecSoftlinesWrap"><h2>Product Specifications </h2> <div class="content"> <div id="techSpecSoftlines"> <table cellspacing="0"> <tr> <th colspan="2">Jewellery Information</th> </tr> <tr> <td class="td1">Brand</td> <td class="td2">                                             Voylla.com                                         </td> </tr> <tr> <td class="td1">Material</td> <td class="td2">                                             sterling-silver                                         </td> </tr> <tr> <td class="td1">Model Number</td> <td class="td2">                                             RUSSE30071                                         </td> </tr> </table> </div> </div> </div>,18:03:2014,None
B00HHVILB0,Spike Bracelet With Lovely Lavender Beads,http://www.amazon.in/Bangles-Bracelets/b/ref=sd_allcat_fj_bangles/276-6718833-1247838?ie=UTF8&node=2152549031,None,Bangles & Bracelet,Bangles & Bracelet,Voylla.com,http://ecx.images-amazon.com/images/I/31jtxUOpx0L._SL246_SX190_CR0 0 190 246_.jpg,Rs. 330.00,Color: Lavender and beige,Watches & Fashion Jewellery,http://www.amazon.in/Spike-Bracelet-Lovely-Lavender-Beads/dp/B00HHVILB0/ref=sr_1_115/275-0905959-1711169?s=jewelry&ie=UTF8&qid=1395127318&sr=1-115,[<a href="/gp/help/seller/at-a-glance.html/275-0905959-1711169?ie=UTF8&amp;seller=A2GYSPAJ7WDF11">Voylla</a>],Amazon.in: Buy Spike Bracelet With Lovely Lavender Beads at Low Prices in India | Fashion Jewellery Store,Buy Spike Bracelet With Lovely Lavender Beads at low prices in India at Amazon.in. Check out Spike Bracelet With Lovely Lavender Beads reviews  ratings  features  specifications and browse more Fashion Jewellery products online at best prices on Amazon.in.,None,<div class="bucket" id="productDescription"> <h2>Product Description</h2> <div class="content"> <h3 class="productDescriptionSource"></h3> <div class="productDescriptionWrapper">        No funky collection is complete without this uniquely designed bracelet. Glam up your casuals with this spike design bracelet; embellished with pristine lavender beads; grabs the attention everywhere!              <div class="emptyClear"> </div> </div> </div> </div>,<div align="left" class="bucket" id="techSpecSoftlinesWrap"><h2>Product Specifications </h2> <div class="content"> <div id="techSpecSoftlines"> <table cellspacing="0"> <tr> <th colspan="2">Jewellery Information</th> </tr> <tr> <td class="td1">Brand</td> <td class="td2">                                             Voylla.com                                         </td> </tr> <tr> <td class="td1">Material</td> <td class="td2">                                             Metal                                         </td> </tr> <tr> <td class="td1">Model Number</td> <td class="td2">                                             MAPNQ20617                                         </td> </tr> </table> </div> </div> </div>,18:03:2014,None
B00HHVIIRW,Spike Bracelet With Lovely Orange Beads; Gold Plating,http://www.amazon.in/Bangles-Bracelets/b/ref=sd_allcat_fj_bangles/276-6718833-1247838?ie=UTF8&node=2152549031,None,Bangles & Bracelet,Bangles & Bracelet,Voylla.com,http://ecx.images-amazon.com/images/I/31jtxUOpx0L._SL246_SX190_CR0 0 190 246_.jpg,Rs. 280.00,Color: Orange and Silver,Watches & Fashion Jewellery,http://www.amazon.in/Spike-Bracelet-Lovely-Orange-Plating/dp/B00HHVIIRW/ref=sr_1_116/275-0905959-1711169?s=jewelry&ie=UTF8&qid=1395127318&sr=1-116,[<a href="/gp/help/seller/at-a-glance.html/275-0905959-1711169?ie=UTF8&amp;seller=A2GYSPAJ7WDF11">Voylla</a>],Amazon.in: Buy Spike Bracelet With Lovely Orange Beads; Gold Plating at Low Prices in India | Fashion Jewellery Store,Buy Spike Bracelet With Lovely Orange Beads; Gold Plating at low prices in India at Amazon.in. Check out Spike Bracelet With Lovely Orange Beads; Gold Plating reviews  ratings  features  specifications and browse more Fashion Jewellery products online at best prices on Amazon.in.,None,<div class="bucket" id="productDescription"> <h2>Product Description</h2> <div class="content"> <h3 class="productDescriptionSource"></h3> <div class="productDescriptionWrapper">        No funky collection is complete without this uniquely designed orange spiked silver bracelet. Glam up your casuals with this spike design bracelet; embellished with pristine lavender beads; grabs the attention everywhere!              <div class="emptyClear"> </div> </div> </div> </div>,<div align="left" class="bucket" id="techSpecSoftlinesWrap"><h2>Product Specifications </h2> <div class="content"> <div id="techSpecSoftlines"> <table cellspacing="0"> <tr> <th colspan="2">Jewellery Information</th> </tr> <tr> <td class="td1">Brand</td> <td class="td2">                                             Voylla.com                                         </td> </tr> <tr> <td class="td1">Material</td> <td class="td2">                                             Metal                                         </td> </tr> <tr> <td class="td1">Model Number</td> <td class="td2">                                             MAPNQ20618                                         </td> </tr> </table> </div> </div> </div>,18:03:2014,None
B00HHVH0GM,Prominent Metallic Bracelet With Sparkle Layers,http://www.amazon.in/Bangles-Bracelets/b/ref=sd_allcat_fj_bangles/276-6718833-1247838?ie=UTF8&node=2152549031,None,Bangles & Bracelet,Bangles & Bracelet,Voylla.com,http://ecx.images-amazon.com/images/I/31jtxUOpx0L._SL246_SX190_CR0 0 190 246_.jpg,Rs. 360.00,Color: Silver,Watches & Fashion Jewellery,http://www.amazon.in/Prominent-Metallic-Bracelet-Sparkle-Layers/dp/B00HHVH0GM/ref=sr_1_109/275-0905959-1711169?s=jewelry&ie=UTF8&qid=1395127318&sr=1-109,[<a href="/gp/help/seller/at-a-glance.html/275-0905959-1711169?ie=UTF8&amp;seller=A2GYSPAJ7WDF11">Voylla</a>],Amazon.in: Buy Prominent Metallic Bracelet With Sparkle Layers at Low Prices in India | Fashion Jewellery Store,Buy Prominent Metallic Bracelet With Sparkle Layers at low prices in India at Amazon.in. Check out Prominent Metallic Bracelet With Sparkle Layers reviews  ratings  features  specifications and browse more Fashion Jewellery products online at best prices on Amazon.in.,None,<div class="bucket" id="productDescription"> <h2>Product Description</h2> <div class="content"> <h3 class="productDescriptionSource"></h3> <div class="productDescriptionWrapper">        Punctuate your look with this striking bracelet; conspicuous by its magnificent size and lustrous texture. Crafted from metal alloy              <div class="emptyClear"> </div> </div> </div> </div>,<div align="left" class="bucket" id="techSpecSoftlinesWrap"><h2>Product Specifications </h2> <div class="content"> <div id="techSpecSoftlines"> <table cellspacing="0"> <tr> <th colspan="2">Jewellery Information</th> </tr> <tr> <td class="td1">Brand</td> <td class="td2">                                             Voylla.com                                         </td> </tr> <tr> <td class="td1">Material</td> <td class="td2">                                             Metal                                         </td> </tr> <tr> <td class="td1">Model Number</td> <td class="td2">                                             MAPNQ20616                                         </td> </tr> </table> </div> </div> </div>,18:03:2014,None
B00HHVHBI4,Stylish Beaded Thread Bracelet,http://www.amazon.in/Bangles-Bracelets/b/ref=sd_allcat_fj_bangles/276-6718833-1247838?ie=UTF8&node=2152549031,None,Bangles & Bracelet,Bangles & Bracelet,Voylla.com,http://ecx.images-amazon.com/images/I/31jtxUOpx0L._SL246_SX190_CR0 0 190 246_.jpg,Rs. 340.00,Color: Pink And Maroon,Watches & Fashion Jewellery,http://www.amazon.in/Voylla-com-CMBLR20054-Stylish-Beaded-Bracelet/dp/B00HHVHBI4/ref=sr_1_118/275-0905959-1711169?s=jewelry&ie=UTF8&qid=1395127318&sr=1-118,[<a href="/gp/help/seller/at-a-glance.html/275-0905959-1711169?ie=UTF8&amp;seller=A2GYSPAJ7WDF11">Voylla</a>],Amazon.in: Buy Stylish Beaded Thread Bracelet at Low Prices in India | Fashion Jewellery Store,Buy Stylish Beaded Thread Bracelet at low prices in India at Amazon.in. Check out Stylish Beaded Thread Bracelet reviews  ratings  features  specifications and browse more Fashion Jewellery products online at best prices on Amazon.in.,None,<div class="bucket" id="productDescription"> <h2>Product Description</h2> <div class="content"> <h3 class="productDescriptionSource"></h3> <div class="productDescriptionWrapper">        Creating trendy look is easy when you have these beaded bracelet. These stylish bracelet are a must-have to spruce up your collection.              <div class="emptyClear"> </div> </div> </div> </div>,<div align="left" class="bucket" id="techSpecSoftlinesWrap"><h2>Product Specifications </h2> <div class="content"> <div id="techSpecSoftlines"> <table cellspacing="0"> <tr> <th colspan="2">Jewellery Information</th> </tr> <tr> <td class="td1">Brand</td> <td class="td2">                                             Voylla.com                                         </td> </tr> <tr> <td class="td1">Material</td> <td class="td2">                                             plastic                                         </td> </tr> <tr> <td class="td1">Model Number</td> <td class="td2">                                             CMBLR20054                                         </td> </tr> </table> </div> </div> </div>,18:03:2014,None
B00HHVEPQ0,Stylish Blue Beaded Bracelet,http://www.amazon.in/Bangles-Bracelets/b/ref=sd_allcat_fj_bangles/276-6718833-1247838?ie=UTF8&node=2152549031,None,Bangles & Bracelet,Bangles & Bracelet,Voylla.com,http://ecx.images-amazon.com/images/I/31jtxUOpx0L._SL246_SX190_CR0 0 190 246_.jpg,Rs. 240.00,Color: Blue;Red And Yellow,Watches & Fashion Jewellery,http://www.amazon.in/Voylla-com-CMBLR20163-Stylish-Beaded-Bracelet/dp/B00HHVEPQ0/ref=sr_1_119/275-0905959-1711169?s=jewelry&ie=UTF8&qid=1395127318&sr=1-119,[<a href="/gp/help/seller/at-a-glance.html/275-0905959-1711169?ie=UTF8&amp;seller=A2GYSPAJ7WDF11">Voylla</a>],Amazon.in: Buy Stylish Blue Beaded Bracelet at Low Prices in India | Fashion Jewellery Store,Buy Stylish Blue Beaded Bracelet at low prices in India at Amazon.in. Check out Stylish Blue Beaded Bracelet reviews  ratings  features  specifications and browse more Fashion Jewellery products online at best prices on Amazon.in.,None,None,<div align="left" class="bucket" id="techSpecSoftlinesWrap"><h2>Product Specifications </h2> <div class="content"> <div id="techSpecSoftlines"> <table cellspacing="0"> <tr> <th colspan="2">Jewellery Information</th> </tr> <tr> <td class="td1">Brand</td> <td class="td2">                                             Voylla.com                                         </td> </tr> <tr> <td class="td1">Material</td> <td class="td2">                                             plastic                                         </td> </tr> <tr> <td class="td1">Model Number</td> <td class="td2">                                             CMBLR20163                                         </td> </tr> </table> </div> </div> </div>,18:03:2014,None
B00HHVH00I,Spike Bracelet With Lovely Orange Beads; Silver Plating,http://www.amazon.in/Bangles-Bracelets/b/ref=sd_allcat_fj_bangles/276-6718833-1247838?ie=UTF8&node=2152549031,None,Bangles & Bracelet,Bangles & Bracelet,Voylla.com,http://ecx.images-amazon.com/images/I/31jtxUOpx0L._SL246_SX190_CR0 0 190 246_.jpg,Rs. 280.00,Color: Orange and Golden,Watches & Fashion Jewellery,http://www.amazon.in/Bracelet-Lovely-Orange-Silver-Plating/dp/B00HHVH00I/ref=sr_1_117/275-0905959-1711169?s=jewelry&ie=UTF8&qid=1395127318&sr=1-117,[<a href="/gp/help/seller/at-a-glance.html/275-0905959-1711169?ie=UTF8&amp;seller=A2GYSPAJ7WDF11">Voylla</a>],Amazon.in: Buy Spike Bracelet With Lovely Orange Beads; Silver Plating at Low Prices in India | Fashion Jewellery Store,Buy Spike Bracelet With Lovely Orange Beads; Silver Plating at low prices in India at Amazon.in. Check out Spike Bracelet With Lovely Orange Beads; Silver Plating reviews  ratings  features  specifications and browse more Fashion Jewellery products online at best prices on Amazon.in.,None,<div class="bucket" id="productDescription"> <h2>Product Description</h2> <div class="content"> <h3 class="productDescriptionSource"></h3> <div class="productDescriptionWrapper">        No funky collection is complete without this uniquely designed orange spiked golden bracelet. Glam up your casuals with this spike design bracelet; embellished with pristine lavender beads; grabs the attention everywhere!              <div class="emptyClear"> </div> </div> </div> </div>,<div align="left" class="bucket" id="techSpecSoftlinesWrap"><h2>Product Specifications </h2> <div class="content"> <div id="techSpecSoftlines"> <table cellspacing="0"> <tr> <th colspan="2">Jewellery Information</th> </tr> <tr> <td class="td1">Brand</td> <td class="td2">                                             Voylla.com                                         </td> </tr> <tr> <td class="td1">Material</td> <td class="td2">                                             Metal                                         </td> </tr> <tr> <td class="td1">Model Number</td> <td class="td2">                                             MAPNQ20619                                         </td> </tr> </table> </div> </div> </div>,18:03:2014,None
B00HHVJKTM,Trendy Multicolor Leather Bracelet,http://www.amazon.in/Bangles-Bracelets/b/ref=sd_allcat_fj_bangles/276-6718833-1247838?ie=UTF8&node=2152549031,None,Bangles & Bracelet,Bangles & Bracelet,Voylla.com,http://ecx.images-amazon.com/images/I/31jtxUOpx0L._SL246_SX190_CR0 0 190 246_.jpg,Rs. 999.00,Color: Brown;Pink;Red And Blue,Watches & Fashion Jewellery,http://www.amazon.in/Voylla-com-MAPNQ20321-Multicolor-Leather-Bracelet/dp/B00HHVJKTM/ref=sr_1_121/275-0905959-1711169?s=jewelry&ie=UTF8&qid=1395127318&sr=1-121,[<a href="/gp/help/seller/at-a-glance.html/275-0905959-1711169?ie=UTF8&amp;seller=A2GYSPAJ7WDF11">Voylla</a>],Amazon.in: Buy Trendy Multicolor Leather Bracelet at Low Prices in India | Fashion Jewellery Store,Buy Trendy Multicolor Leather Bracelet at low prices in India at Amazon.in. Check out Trendy Multicolor Leather Bracelet reviews  ratings  features  specifications and browse more Fashion Jewellery products online at best prices on Amazon.in.,None,<div class="bucket" id="productDescription"> <h2>Product Description</h2> <div class="content"> <h3 class="productDescriptionSource"></h3> <div class="productDescriptionWrapper">        Look trendy with this evergreen multicolor watch style adjustable leather bracelet from Mon Amie. Pair this bracelet it at your next party and receive tons of compliments!!              <div class="emptyClear"> </div> </div> </div> </div>,<div align="left" class="bucket" id="techSpecSoftlinesWrap"><h2>Product Specifications </h2> <div class="content"> <div id="techSpecSoftlines"> <table cellspacing="0"> <tr> <th colspan="2">Jewellery Information</th> </tr> <tr> <td class="td1">Brand</td> <td class="td2">                                             Voylla.com                                         </td> </tr> <tr> <td class="td1">Material</td> <td class="td2">                                             Metal                                         </td> </tr> <tr> <td class="td1">Model Number</td> <td class="td2">                                             MAPNQ20321                                         </td> </tr> </table> </div> </div> </div>,18:03:2014,None
