B00HHVIGN8,Voylla Gold Plated Wavy Style Bangles Studded With Cz,http://www.amazon.in/Bangles-Bracelets/b/ref=sd_allcat_fj_bangles/276-6718833-1247838?ie=UTF8&node=2152549031,None,Bangles & Bracelet,Bangles & Bracelet,Voylla.com,http://ecx.images-amazon.com/images/I/31jtxUOpx0L._SL246_SX190_CR0 0 190 246_.jpg,Rs. 680.00,Color: White and golden,Watches & Fashion Jewellery,http://www.amazon.in/Voylla-Plated-Style-Bangles-Studded/dp/B00HHVIGN8/ref=sr_1_288/275-0905959-1711169?s=jewelry&ie=UTF8&qid=1395127343&sr=1-288,[<a href="/gp/help/seller/at-a-glance.html/275-0905959-1711169?ie=UTF8&amp;seller=A2GYSPAJ7WDF11">Voylla</a>],Amazon.in: Buy Voylla Gold Plated Wavy Style Bangles Studded With Cz at Low Prices in India | Fashion Jewellery Store,Buy Voylla Gold Plated Wavy Style Bangles Studded With Cz at low prices in India at Amazon.in. Check out Voylla Gold Plated Wavy Style Bangles Studded With Cz reviews  ratings  features  specifications and browse more Fashion Jewellery products online at best prices on Amazon.in.,None,<div class="bucket" id="productDescription"> <h2>Product Description</h2> <div class="content"> <h3 class="productDescriptionSource"></h3> <div class="productDescriptionWrapper">        Step out in style with this stunning pair of gold plated bangles; featuring a voguish wavy design; and studded with cz stones. Welcome the festive season adorning this charming piece of perfection!              <div class="emptyClear"> </div> </div> </div> </div>,<div align="left" class="bucket" id="techSpecSoftlinesWrap"><h2>Product Specifications </h2> <div class="content"> <div id="techSpecSoftlines"> <table cellspacing="0"> <tr> <th colspan="2">Jewellery Information</th> </tr> <tr> <td class="td1">Brand</td> <td class="td2">                                             Voylla.com                                         </td> </tr> <tr> <td class="td1">Material</td> <td class="td2">                                             Non-Precious Metal                                         </td> </tr> <tr> <td class="td1">Model Number</td> <td class="td2">                                             PSJAI23247                                         </td> </tr> <tr> <td class="td1">Ring Size</td> <td class="td2">                                             2.25                                         </td> </tr> <tr> <td class="td1">Warranty Description</td> <td class="td2">                                             PSJAI23247                                         </td> </tr> </table> </div> </div> </div>,18:03:2014,None
B00HHVJB1Y,Voylla Golden Twist: Bangle Set with Twisted Golden Design; Crystals,http://www.amazon.in/Bangles-Bracelets/b/ref=sd_allcat_fj_bangles/276-6718833-1247838?ie=UTF8&node=2152549031,None,Bangles & Bracelet,Bangles & Bracelet,Voylla.com,http://ecx.images-amazon.com/images/I/31jtxUOpx0L._SL246_SX190_CR0 0 190 246_.jpg,None,Color: White and Golden,Watches & Fashion Jewellery,http://www.amazon.in/Voylla-Golden-Twist-Twisted-Crystals/dp/B00HHVJB1Y/ref=sr_1_289/275-0905959-1711169?s=jewelry&ie=UTF8&qid=1395127350&sr=1-289,[<a href="/gp/help/seller/at-a-glance.html/275-0905959-1711169?ie=UTF8&amp;seller=A2GYSPAJ7WDF11">Voylla</a>],Amazon.in: Buy Voylla Golden Twist: Bangle Set with Twisted Golden Design; Crystals at Low Prices in India | Fashion Jewellery Store,Buy Voylla Golden Twist: Bangle Set with Twisted Golden Design; Crystals at low prices in India at Amazon.in. Check out Voylla Golden Twist: Bangle Set with Twisted Golden Design; Crystals reviews  ratings  features  specifications and browse more Fashion Jewellery products online at best prices on Amazon.in.,None,<div class="bucket" id="productDescription"> <h2>Product Description</h2> <div class="content"> <h3 class="productDescriptionSource"></h3> <div class="productDescriptionWrapper">        Exude a graceful contemporary charm with this gold plated bangle pair with a golden twist. Designed to perfection; this elegant pair studded with cz stones goes well with your party outfits; get these bangles today!              <div class="emptyClear"> </div> </div> </div> </div>,<div align="left" class="bucket" id="techSpecSoftlinesWrap"><h2>Product Specifications </h2> <div class="content"> <div id="techSpecSoftlines"> <table cellspacing="0"> <tr> <th colspan="2">Jewellery Information</th> </tr> <tr> <td class="td1">Brand</td> <td class="td2">                                             Voylla.com                                         </td> </tr> <tr> <td class="td1">Material</td> <td class="td2">                                             Non-Precious Metal                                         </td> </tr> <tr> <td class="td1">Model Number</td> <td class="td2">                                             PSJAI23540                                         </td> </tr> <tr> <td class="td1">Ring Size</td> <td class="td2">                                             2.5                                         </td> </tr> <tr> <td class="td1">Warranty Description</td> <td class="td2">                                             PSJAI23540                                         </td> </tr> </table> </div> </div> </div>,18:03:2014,None
B00HHVIRWI,Voylla Good Luck Turquoise friendship band,http://www.amazon.in/Bangles-Bracelets/b/ref=sd_allcat_fj_bangles/276-6718833-1247838?ie=UTF8&node=2152549031,None,Bangles & Bracelet,Bangles & Bracelet,Voylla.com,http://ecx.images-amazon.com/images/I/31jtxUOpx0L._SL246_SX190_CR0 0 190 246_.jpg,Rs. 890.00,Color: Turquoise,Watches & Fashion Jewellery,http://www.amazon.in/Voylla-Good-Luck-Turquoise-friendship/dp/B00HHVIRWI/ref=sr_1_290/275-0905959-1711169?s=jewelry&ie=UTF8&qid=1395127350&sr=1-290,[<a href="/gp/help/seller/at-a-glance.html/275-0905959-1711169?ie=UTF8&amp;seller=A2GYSPAJ7WDF11">Voylla</a>],Amazon.in: Buy Voylla Good Luck Turquoise friendship band at Low Prices in India | Fashion Jewellery Store,Buy Voylla Good Luck Turquoise friendship band at low prices in India at Amazon.in. Check out Voylla Good Luck Turquoise friendship band reviews  ratings  features  specifications and browse more Fashion Jewellery products online at best prices on Amazon.in.,None,<div class="bucket" id="productDescription"> <h2>Product Description</h2> <div class="content"> <h3 class="productDescriptionSource"></h3> <div class="productDescriptionWrapper">        Turquoise is a Gemstone of Good Luck and good luck is what one friend desire for another; so a perfect stone for your friend.              <div class="emptyClear"> </div> </div> </div> </div>,<div align="left" class="bucket" id="techSpecSoftlinesWrap"><h2>Product Specifications </h2> <div class="content"> <div id="techSpecSoftlines"> <table cellspacing="0"> <tr> <th colspan="2">Jewellery Information</th> </tr> <tr> <td class="td1">Brand</td> <td class="td2">                                             Voylla.com                                         </td> </tr> <tr> <td class="td1">Material</td> <td class="td2">                                             Non-Precious Metal                                         </td> </tr> <tr> <td class="td1">Model Number</td> <td class="td2">                                             ABPNQ20014                                         </td> </tr> <tr> <td class="td1">Warranty Description</td> <td class="td2">                                             ABPNQ20014                                         </td> </tr> </table> </div> </div> </div>,18:03:2014,None
B00HHVKFRS,Voylla Gorgeous Beaded Pink Bracelet,http://www.amazon.in/Bangles-Bracelets/b/ref=sd_allcat_fj_bangles/276-6718833-1247838?ie=UTF8&node=2152549031,None,Bangles & Bracelet,Bangles & Bracelet,Voylla.com,http://ecx.images-amazon.com/images/I/31jtxUOpx0L._SL246_SX190_CR0 0 190 246_.jpg,Rs. 320.00,Color: Pink;White And Red,Watches & Fashion Jewellery,http://www.amazon.in/Voylla-Gorgeous-Beaded-Pink-Bracelet/dp/B00HHVKFRS/ref=sr_1_291/275-0905959-1711169?s=jewelry&ie=UTF8&qid=1395127350&sr=1-291,[<a href="/gp/help/seller/at-a-glance.html/275-0905959-1711169?ie=UTF8&amp;seller=A2GYSPAJ7WDF11">Voylla</a>],Amazon.in: Buy Voylla Gorgeous Beaded Pink Bracelet at Low Prices in India | Fashion Jewellery Store,Buy Voylla Gorgeous Beaded Pink Bracelet at low prices in India at Amazon.in. Check out Voylla Gorgeous Beaded Pink Bracelet reviews  ratings  features  specifications and browse more Fashion Jewellery products online at best prices on Amazon.in.,None,<div class="bucket" id="productDescription"> <h2>Product Description</h2> <div class="content"> <h3 class="productDescriptionSource"></h3> <div class="productDescriptionWrapper">        Fashionable and trendy will be the only two things that will come to a person's mind when they see you these pink beaded bracelet. Can be paired with casual outfits. The bracelet has elastic which can be stretched as per your size.              <div class="emptyClear"> </div> </div> </div> </div>,<div align="left" class="bucket" id="techSpecSoftlinesWrap"><h2>Product Specifications </h2> <div class="content"> <div id="techSpecSoftlines"> <table cellspacing="0"> <tr> <th colspan="2">Jewellery Information</th> </tr> <tr> <td class="td1">Brand</td> <td class="td2">                                             Voylla.com                                         </td> </tr> <tr> <td class="td1">Resizable?</td> <td class="td2">                                             Y                                         </td> </tr> <tr> <td class="td1">Material</td> <td class="td2">                                             plastic                                         </td> </tr> <tr> <td class="td1">Model Number</td> <td class="td2">                                             CMBLR20197                                         </td> </tr> <tr> <td class="td1">Warranty Description</td> <td class="td2">                                             CMBLR20197                                         </td> </tr> </table> </div> </div> </div>,18:03:2014,None
B00HHVG7YI,Voylla Gorgeous Cream Enamel Bracelet With Stones,http://www.amazon.in/Bangles-Bracelets/b/ref=sd_allcat_fj_bangles/276-6718833-1247838?ie=UTF8&node=2152549031,None,Bangles & Bracelet,Bangles & Bracelet,Voylla.com,http://ecx.images-amazon.com/images/I/31jtxUOpx0L._SL246_SX190_CR0 0 190 246_.jpg,Rs. 500.00,Color: Cream;White And Golden,Watches & Fashion Jewellery,http://www.amazon.in/Voylla-Gorgeous-Enamel-Bracelet-Stones/dp/B00HHVG7YI/ref=sr_1_292/275-0905959-1711169?s=jewelry&ie=UTF8&qid=1395127350&sr=1-292,[<a href="/gp/help/seller/at-a-glance.html/275-0905959-1711169?ie=UTF8&amp;seller=A2GYSPAJ7WDF11">Voylla</a>],Amazon.in: Buy Voylla Gorgeous Cream Enamel Bracelet With Stones at Low Prices in India | Fashion Jewellery Store,Buy Voylla Gorgeous Cream Enamel Bracelet With Stones at low prices in India at Amazon.in. Check out Voylla Gorgeous Cream Enamel Bracelet With Stones reviews  ratings  features  specifications and browse more Fashion Jewellery products online at best prices on Amazon.in.,None,<div class="bucket" id="productDescription"> <h2>Product Description</h2> <div class="content"> <h3 class="productDescriptionSource"></h3> <div class="productDescriptionWrapper">        Fashionable yet elegant; these cream glossy enamel finished bracelet look absolutely stunning and adorable with sparkling stones!!              <div class="emptyClear"> </div> </div> </div> </div>,<div align="left" class="bucket" id="techSpecSoftlinesWrap"><h2>Product Specifications </h2> <div class="content"> <div id="techSpecSoftlines"> <table cellspacing="0"> <tr> <th colspan="2">Jewellery Information</th> </tr> <tr> <td class="td1">Brand</td> <td class="td2">                                             Voylla.com                                         </td> </tr> <tr> <td class="td1">Material</td> <td class="td2">                                             Non-Precious Metal                                         </td> </tr> <tr> <td class="td1">Model Number</td> <td class="td2">                                             MAPNQ20177                                         </td> </tr> <tr> <td class="td1">Ring Size</td> <td class="td2">                                             2.25                                         </td> </tr> <tr> <td class="td1">Warranty Description</td> <td class="td2">                                             MAPNQ20177                                         </td> </tr> </table> </div> </div> </div>,18:03:2014,None
B00HFSET84,Voylla Gorgeous Pair Of Bangles Encrusted With Cubic Zirconia,http://www.amazon.in/Bangles-Bracelets/b/ref=sd_allcat_fj_bangles/276-6718833-1247838?ie=UTF8&node=2152549031,None,Bangles & Bracelet,Bangles & Bracelet,Voylla.com,http://ecx.images-amazon.com/images/I/31jtxUOpx0L._SL246_SX190_CR0 0 190 246_.jpg,Rs. 2 470.00,Color: Golden,Watches & Fashion Jewellery,http://www.amazon.in/Voylla-Gorgeous-Bangles-Encrusted-Zirconia/dp/B00HFSET84/ref=sr_1_294/275-0905959-1711169?s=jewelry&ie=UTF8&qid=1395127350&sr=1-294,[<a href="/gp/help/seller/at-a-glance.html/275-0905959-1711169?ie=UTF8&amp;seller=A2GYSPAJ7WDF11">Voylla</a>],Amazon.in: Buy Voylla Gorgeous Pair Of Bangles Encrusted With Cubic Zirconia at Low Prices in India | Fashion Jewellery Store,Buy Voylla Gorgeous Pair Of Bangles Encrusted With Cubic Zirconia at low prices in India at Amazon.in. Check out Voylla Gorgeous Pair Of Bangles Encrusted With Cubic Zirconia reviews  ratings  features  specifications and browse more Fashion Jewellery products online at best prices on Amazon.in.,None,<div class="bucket" id="productDescription"> <h2>Product Description</h2> <div class="content"> <h3 class="productDescriptionSource"></h3> <div class="productDescriptionWrapper">        Adorn these elegant and gold polished bangles studded with sparkling cubic zirconia; it will instantly accentuate your look. Snag it now and pair it with western or ethnic attire for fashion-forward.              <div class="emptyClear"> </div> </div> </div> </div>,<div align="left" class="bucket" id="techSpecSoftlinesWrap"><h2>Product Specifications </h2> <div class="content"> <div id="techSpecSoftlines"> <table cellspacing="0"> <tr> <th colspan="2">Jewellery Information</th> </tr> <tr> <td class="td1">Brand</td> <td class="td2">                                             Voylla.com                                         </td> </tr> <tr> <td class="td1">Material</td> <td class="td2">                                             Non-Precious Metal                                         </td> </tr> <tr> <td class="td1">Model Number</td> <td class="td2">                                             PSJAI20041                                         </td> </tr> <tr> <td class="td1">Ring Size</td> <td class="td2">                                             2.25                                         </td> </tr> <tr> <td class="td1">Warranty Description</td> <td class="td2">                                             PSJAI20041                                         </td> </tr> </table> </div> </div> </div>,18:03:2014,None
B00HFS79WC,Voylla Gorgeous Gold Polished Bangles With Dazzling Cubic Zirconia,http://www.amazon.in/Bangles-Bracelets/b/ref=sd_allcat_fj_bangles/276-6718833-1247838?ie=UTF8&node=2152549031,None,Bangles & Bracelet,Bangles & Bracelet,Voylla.com,http://ecx.images-amazon.com/images/I/31jtxUOpx0L._SL246_SX190_CR0 0 190 246_.jpg,Rs. 2 880.00,Color: Golden,Watches & Fashion Jewellery,http://www.amazon.in/Gorgeous-Polished-Bangles-Dazzling-Zirconia/dp/B00HFS79WC/ref=sr_1_293/275-0905959-1711169?s=jewelry&ie=UTF8&qid=1395127350&sr=1-293,[<a href="/gp/help/seller/at-a-glance.html/275-0905959-1711169?ie=UTF8&amp;seller=A2GYSPAJ7WDF11">Voylla</a>],Amazon.in: Buy Voylla Gorgeous Gold Polished Bangles With Dazzling Cubic Zirconia at Low Prices in India | Fashion Jewellery Store,Buy Voylla Gorgeous Gold Polished Bangles With Dazzling Cubic Zirconia at low prices in India at Amazon.in. Check out Voylla Gorgeous Gold Polished Bangles With Dazzling Cubic Zirconia reviews  ratings  features  specifications and browse more Fashion Jewellery products online at best prices on Amazon.in.,None,<div class="bucket" id="productDescription"> <h2>Product Description</h2> <div class="content"> <h3 class="productDescriptionSource"></h3> <div class="productDescriptionWrapper">        Wear these elegant and gold polished bangles studded with sparkling cubic zirconia; it will instantly accentuate your look. Snag it now and pair it with western or ethnic attire for fashion-forward.              <div class="emptyClear"> </div> </div> </div> </div>,<div align="left" class="bucket" id="techSpecSoftlinesWrap"><h2>Product Specifications </h2> <div class="content"> <div id="techSpecSoftlines"> <table cellspacing="0"> <tr> <th colspan="2">Jewellery Information</th> </tr> <tr> <td class="td1">Brand</td> <td class="td2">                                             Voylla.com                                         </td> </tr> <tr> <td class="td1">Material</td> <td class="td2">                                             Non-Precious Metal                                         </td> </tr> <tr> <td class="td1">Model Number</td> <td class="td2">                                             PSJAI20022                                         </td> </tr> <tr> <td class="td1">Ring Size</td> <td class="td2">                                             2.25                                         </td> </tr> <tr> <td class="td1">Warranty Description</td> <td class="td2">                                             PSJAI20022                                         </td> </tr> </table> </div> </div> </div>,18:03:2014,None
B00HHVK7OO,Voylla Green And Orange Reshmi Dori Bangles,http://www.amazon.in/Bangles-Bracelets/b/ref=sd_allcat_fj_bangles/276-6718833-1247838?ie=UTF8&node=2152549031,None,Bangles & Bracelet,Bangles & Bracelet,Voylla.com,http://ecx.images-amazon.com/images/I/31jtxUOpx0L._SL246_SX190_CR0 0 190 246_.jpg,Rs. 700.00,Color: Green And Orange,Watches & Fashion Jewellery,http://www.amazon.in/Voylla-Green-Orange-Reshmi-Bangles/dp/B00HHVK7OO/ref=sr_1_295/275-0905959-1711169?s=jewelry&ie=UTF8&qid=1395127350&sr=1-295,[<a href="/gp/help/seller/at-a-glance.html/275-0905959-1711169?ie=UTF8&amp;seller=A2GYSPAJ7WDF11">Voylla</a>],Amazon.in: Buy Voylla Green And Orange Reshmi Dori Bangles at Low Prices in India | Fashion Jewellery Store,Buy Voylla Green And Orange Reshmi Dori Bangles at low prices in India at Amazon.in. Check out Voylla Green And Orange Reshmi Dori Bangles reviews  ratings  features  specifications and browse more Fashion Jewellery products online at best prices on Amazon.in.,None,<div class="bucket" id="productDescription"> <h2>Product Description</h2> <div class="content"> <h3 class="productDescriptionSource"></h3> <div class="productDescriptionWrapper">        Adorn this beautiful pair of bangles with green and orange reshmi dori wrapped light and comfortable on your wrist that you won't even realize you are wearing them.              <div class="emptyClear"> </div> </div> </div> </div>,<div align="left" class="bucket" id="techSpecSoftlinesWrap"><h2>Product Specifications </h2> <div class="content"> <div id="techSpecSoftlines"> <table cellspacing="0"> <tr> <th colspan="2">Jewellery Information</th> </tr> <tr> <td class="td1">Brand</td> <td class="td2">                                             Voylla.com                                         </td> </tr> <tr> <td class="td1">Material</td> <td class="td2">                                             Fabric                                         </td> </tr> <tr> <td class="td1">Model Number</td> <td class="td2">                                             VCBLR20140                                         </td> </tr> <tr> <td class="td1">Ring Size</td> <td class="td2">                                             2.25                                         </td> </tr> <tr> <td class="td1">Warranty Description</td> <td class="td2">                                             VCBLR20140                                         </td> </tr> </table> </div> </div> </div>,18:03:2014,None
B00HHVGEK0,Voylla Green Flat Circular Beaded Bracelet,http://www.amazon.in/Bangles-Bracelets/b/ref=sd_allcat_fj_bangles/276-6718833-1247838?ie=UTF8&node=2152549031,None,Bangles & Bracelet,Bangles & Bracelet,Voylla.com,http://ecx.images-amazon.com/images/I/31jtxUOpx0L._SL246_SX190_CR0 0 190 246_.jpg,Rs. 260.00,Color: Green And Silver,Watches & Fashion Jewellery,http://www.amazon.in/Voylla-Green-Circular-Beaded-Bracelet/dp/B00HHVGEK0/ref=sr_1_296/275-0905959-1711169?s=jewelry&ie=UTF8&qid=1395127350&sr=1-296,[<a href="/gp/help/seller/at-a-glance.html/275-0905959-1711169?ie=UTF8&amp;seller=A2GYSPAJ7WDF11">Voylla</a>],Amazon.in: Buy Voylla Green Flat Circular Beaded Bracelet at Low Prices in India | Fashion Jewellery Store,Buy Voylla Green Flat Circular Beaded Bracelet at low prices in India at Amazon.in. Check out Voylla Green Flat Circular Beaded Bracelet reviews  ratings  features  specifications and browse more Fashion Jewellery products online at best prices on Amazon.in.,None,<div class="bucket" id="productDescription"> <h2>Product Description</h2> <div class="content"> <h3 class="productDescriptionSource"></h3> <div class="productDescriptionWrapper">        Trendy and chic; these flat circular beaded bracelet with small silver beads in between gives you a stylish look.Can be paired with casual outfits. The bracelet has elastic which can be stretched as per your size.              <div class="emptyClear"> </div> </div> </div> </div>,<div align="left" class="bucket" id="techSpecSoftlinesWrap"><h2>Product Specifications </h2> <div class="content"> <div id="techSpecSoftlines"> <table cellspacing="0"> <tr> <th colspan="2">Jewellery Information</th> </tr> <tr> <td class="td1">Brand</td> <td class="td2">                                             Voylla.com                                         </td> </tr> <tr> <td class="td1">Resizable?</td> <td class="td2">                                             Y                                         </td> </tr> <tr> <td class="td1">Material</td> <td class="td2">                                             plastic                                         </td> </tr> <tr> <td class="td1">Model Number</td> <td class="td2">                                             CMBLR20195                                         </td> </tr> <tr> <td class="td1">Warranty Description</td> <td class="td2">                                             CMBLR20195                                         </td> </tr> </table> </div> </div> </div>,18:03:2014,None
B00HHVH4PO,Voylla Green Rubber Ball Bracelet,http://www.amazon.in/Bangles-Bracelets/b/ref=sd_allcat_fj_bangles/276-6718833-1247838?ie=UTF8&node=2152549031,None,Bangles & Bracelet,Bangles & Bracelet,Voylla.com,http://ecx.images-amazon.com/images/I/31jtxUOpx0L._SL246_SX190_CR0 0 190 246_.jpg,Rs. 250.00,self Colour,Watches & Fashion Jewellery,http://www.amazon.in/Voylla-Green-Rubber-Ball-Bracelet/dp/B00HHVH4PO/ref=sr_1_297/275-0905959-1711169?s=jewelry&ie=UTF8&qid=1395127350&sr=1-297,[<a href="/gp/help/seller/at-a-glance.html/275-0905959-1711169?ie=UTF8&amp;seller=A2GYSPAJ7WDF11">Voylla</a>],Amazon.in: Buy Voylla Green Rubber Ball Bracelet at Low Prices in India | Fashion Jewellery Store,Buy Voylla Green Rubber Ball Bracelet at low prices in India at Amazon.in. Check out Voylla Green Rubber Ball Bracelet reviews  ratings  features  specifications and browse more Fashion Jewellery products online at best prices on Amazon.in.,None,<div class="bucket" id="productDescription"> <h2>Product Description</h2> <div class="content"> <h3 class="productDescriptionSource"></h3> <div class="productDescriptionWrapper">        This neon glow bracelet makes for a cute gift for the youngsters. Featuring an attractive ball bead design; this fluorescent green bracelet can make for a great friendship band!              <div class="emptyClear"> </div> </div> </div> </div>,<div align="left" class="bucket" id="techSpecSoftlinesWrap"><h2>Product Specifications </h2> <div class="content"> <div id="techSpecSoftlines"> <table cellspacing="0"> <tr> <th colspan="2">Jewellery Information</th> </tr> <tr> <td class="td1">Brand</td> <td class="td2">                                             Voylla.com                                         </td> </tr> <tr> <td class="td1">Resizable?</td> <td class="td2">                                             Y                                         </td> </tr> <tr> <td class="td1">Material</td> <td class="td2">                                             Non-Precious Metal                                         </td> </tr> <tr> <td class="td1">Model Number</td> <td class="td2">                                             SYDEL20118                                         </td> </tr> <tr> <td class="td1">Ring Size</td> <td class="td2">                                             8                                         </td> </tr> <tr> <td class="td1">Warranty Description</td> <td class="td2">                                             SYDEL20118                                         </td> </tr> </table> </div> </div> </div>,18:03:2014,None
