B00IML5A5Y,925 Silver Bracelet with Bold Oval Links; Rose Golden Crescent Charms,http://www.amazon.in/Bangles-Bracelets/b/ref=sd_allcat_fj_bangles/276-6718833-1247838?ie=UTF8&node=2152549031,None,Bangles & Bracelet,Bangles & Bracelet,Voylla.com,http://ecx.images-amazon.com/images/I/31jtxUOpx0L._SL246_SX190_CR0 0 190 246_.jpg,None,Color: Rose Gold and Grayish Black,Watches & Fashion Jewellery,http://www.amazon.in/Silver-Bracelet-Golden-Crescent-Charms/dp/B00IML5A5Y/ref=sr_1_6/275-0905959-1711169?s=jewelry&ie=UTF8&qid=1395127306&sr=1-6,[<a href="/gp/help/seller/at-a-glance.html/275-0905959-1711169?ie=UTF8&amp;seller=A2GYSPAJ7WDF11">Voylla</a>],Amazon.in: Buy 925 Silver Bracelet with Bold Oval Links; Rose Golden Crescent Charms at Low Prices in India | Fashion Jewellery Store,Buy 925 Silver Bracelet with Bold Oval Links; Rose Golden Crescent Charms at low prices in India at Amazon.in. Check out 925 Silver Bracelet with Bold Oval Links; Rose Golden Crescent Charms reviews  ratings  features  specifications and browse more Fashion Jewellery products online at best prices on Amazon.in.,None,<div class="bucket" id="productDescription"> <h2>Product Description</h2> <div class="content"> <h3 class="productDescriptionSource"></h3> <div class="productDescriptionWrapper">        Flaunt worthy sleek hand accessory featuring bold oval links; rose golden crescent charms is winner all the way. This jewellery piece is part of the finely crafted collection which is popular across India; thanks to its sleek styling; intricate designs and adherence to traditional styles. Your loved one deserves nothing less than these 925 silver bracelet              <div class="emptyClear"> </div> </div> </div> </div>,<div align="left" class="bucket" id="techSpecSoftlinesWrap"><h2>Product Specifications </h2> <div class="content"> <div id="techSpecSoftlines"> <table cellspacing="0"> <tr> <th colspan="2">Jewellery Information</th> </tr> <tr> <td class="td1">Brand</td> <td class="td2">                                             Voylla.com                                         </td> </tr> <tr> <td class="td1">Material</td> <td class="td2">                                             sterling-silver                                         </td> </tr> <tr> <td class="td1">Model Number</td> <td class="td2">                                             RUSSE21210                                         </td> </tr> </table> </div> </div> </div>,18:03:2014,None
B00HHVK59G,Voylla Brilliant Floral Cz Encrusted Gold Plated Bracelet,http://www.amazon.in/Bangles-Bracelets/b/ref=sd_allcat_fj_bangles/276-6718833-1247838?ie=UTF8&node=2152549031,None,Bangles & Bracelet,Bangles & Bracelet,Voylla.com,http://ecx.images-amazon.com/images/I/31jtxUOpx0L._SL246_SX190_CR0 0 190 246_.jpg,Rs. 1 080.00,Color: Metallic Gold,Watches & Fashion Jewellery,http://www.amazon.in/Voylla-Brilliant-Floral-Encrusted-Bracelet/dp/B00HHVK59G/ref=sr_1_3/275-0905959-1711169?s=jewelry&ie=UTF8&qid=1395127306&sr=1-3,[<a href="/gp/help/seller/at-a-glance.html/275-0905959-1711169?ie=UTF8&amp;seller=A2GYSPAJ7WDF11">Voylla</a>],Amazon.in: Buy Voylla Brilliant Floral Cz Encrusted Gold Plated Bracelet at Low Prices in India | Fashion Jewellery Store,Buy Voylla Brilliant Floral Cz Encrusted Gold Plated Bracelet at low prices in India at Amazon.in. Check out Voylla Brilliant Floral Cz Encrusted Gold Plated Bracelet reviews  ratings  features  specifications and browse more Fashion Jewellery products online at best prices on Amazon.in.,None,<div class="bucket" id="productDescription"> <h2>Product Description</h2> <div class="content"> <h3 class="productDescriptionSource"></h3> <div class="productDescriptionWrapper">        Sport this lavish floral gold plated bracelet; crafted from fine metal alloy and embellished with cubic zirconia stones that add a sparkling appeal to your look!              <div class="emptyClear"> </div> </div> </div> </div>,<div align="left" class="bucket" id="techSpecSoftlinesWrap"><h2>Product Specifications </h2> <div class="content"> <div id="techSpecSoftlines"> <table cellspacing="0"> <tr> <th colspan="2">Jewellery Information</th> </tr> <tr> <td class="td1">Brand</td> <td class="td2">                                             Voylla.com                                         </td> </tr> <tr> <td class="td1">Material</td> <td class="td2">                                             Non-Precious Metal                                         </td> </tr> <tr> <td class="td1">Model Number</td> <td class="td2">                                             SNJAI20087                                         </td> </tr> <tr> <td class="td1">Warranty Description</td> <td class="td2">                                             SNJAI20087                                         </td> </tr> </table> </div> </div> </div>,18:03:2014,None
B00IML4T56,925 Silver Bracelet Featuring Ten Sleek Chains,http://www.amazon.in/Bangles-Bracelets/b/ref=sd_allcat_fj_bangles/276-6718833-1247838?ie=UTF8&node=2152549031,None,Bangles & Bracelet,Bangles & Bracelet,Voylla.com,http://ecx.images-amazon.com/images/I/31jtxUOpx0L._SL246_SX190_CR0 0 190 246_.jpg,None,Color: Golden and Grayish Black,Watches & Fashion Jewellery,http://www.amazon.in/Silver-Bracelet-Featuring-Sleek-Chains/dp/B00IML4T56/ref=sr_1_5/275-0905959-1711169?s=jewelry&ie=UTF8&qid=1395127306&sr=1-5,[<a href="/gp/help/seller/at-a-glance.html/275-0905959-1711169?ie=UTF8&amp;seller=A2GYSPAJ7WDF11">Voylla</a>],Amazon.in: Buy 925 Silver Bracelet Featuring Ten Sleek Chains at Low Prices in India | Fashion Jewellery Store,Buy 925 Silver Bracelet Featuring Ten Sleek Chains at low prices in India at Amazon.in. Check out 925 Silver Bracelet Featuring Ten Sleek Chains reviews  ratings  features  specifications and browse more Fashion Jewellery products online at best prices on Amazon.in.,None,<div class="bucket" id="productDescription"> <h2>Product Description</h2> <div class="content"> <h3 class="productDescriptionSource"></h3> <div class="productDescriptionWrapper">        Flaunt worthy sleek hand accessory featuring ten sleek chains is winner all the way. This jewellery piece is part of the finely crafted collection which is popular across India; thanks to its sleek styling; intricate designs and adherence to traditional styles. Your loved one deserves nothing less than these 925 silver bracelet              <div class="emptyClear"> </div> </div> </div> </div>,<div align="left" class="bucket" id="techSpecSoftlinesWrap"><h2>Product Specifications </h2> <div class="content"> <div id="techSpecSoftlines"> <table cellspacing="0"> <tr> <th colspan="2">Jewellery Information</th> </tr> <tr> <td class="td1">Brand</td> <td class="td2">                                             Voylla.com                                         </td> </tr> <tr> <td class="td1">Material</td> <td class="td2">                                             sterling-silver                                         </td> </tr> <tr> <td class="td1">Model Number</td> <td class="td2">                                             RUSSE21225                                         </td> </tr> </table> </div> </div> </div>,18:03:2014,None
B00I9ZEK7M,Silver Plated Beaded; Starry Bracelet,http://www.amazon.in/Bangles-Bracelets/b/ref=sd_allcat_fj_bangles/276-6718833-1247838?ie=UTF8&node=2152549031,None,Bangles & Bracelet,Bangles & Bracelet,Voylla.com,http://ecx.images-amazon.com/images/I/31jtxUOpx0L._SL246_SX190_CR0 0 190 246_.jpg,None,Color: Silver,Watches & Fashion Jewellery,http://www.amazon.in/Silver-Plated-Beaded-Starry-Bracelet/dp/B00I9ZEK7M/ref=sr_1_1/275-0905959-1711169?s=jewelry&ie=UTF8&qid=1395127306&sr=1-1,[<a href="/gp/help/seller/at-a-glance.html/275-0905959-1711169?ie=UTF8&amp;seller=A2GYSPAJ7WDF11">Voylla</a>],Amazon.in: Buy Silver Plated Beaded; Starry Bracelet at Low Prices in India | Fashion Jewellery Store,Buy Silver Plated Beaded; Starry Bracelet at low prices in India at Amazon.in. Check out Silver Plated Beaded; Starry Bracelet reviews  ratings  features  specifications and browse more Fashion Jewellery products online at best prices on Amazon.in.,None,<div class="bucket" id="productDescription"> <h2>Product Description</h2> <div class="content"> <h3 class="productDescriptionSource"></h3> <div class="productDescriptionWrapper">        Sleek and pretty; adorn your wrist with this classy bracelet; embellished with dainty metallic stars and beads. Adds a pristine sheen to your look.              <div class="emptyClear"> </div> </div> </div> </div>,<div align="left" class="bucket" id="techSpecSoftlinesWrap"><h2>Product Specifications </h2> <div class="content"> <div id="techSpecSoftlines"> <table cellspacing="0"> <tr> <th colspan="2">Jewellery Information</th> </tr> <tr> <td class="td1">Brand</td> <td class="td2">                                             Voylla.com                                         </td> </tr> <tr> <td class="td1">Material</td> <td class="td2">                                             Metal                                         </td> </tr> <tr> <td class="td1">Model Number</td> <td class="td2">                                             FSBOM20031                                         </td> </tr> </table> </div> </div> </div>,18:03:2014,None
B00IML4S0C,925 Silver Bracelet with Chain; Golden Disc; Two Round Loops,http://www.amazon.in/Bangles-Bracelets/b/ref=sd_allcat_fj_bangles/276-6718833-1247838?ie=UTF8&node=2152549031,None,Bangles & Bracelet,Bangles & Bracelet,Voylla.com,http://ecx.images-amazon.com/images/I/31jtxUOpx0L._SL246_SX190_CR0 0 190 246_.jpg,None,Color: Golden and Grayish Black,Watches & Fashion Jewellery,http://www.amazon.in/Silver-Bracelet-Chain-Golden-Round/dp/B00IML4S0C/ref=sr_1_8/275-0905959-1711169?s=jewelry&ie=UTF8&qid=1395127306&sr=1-8,[<a href="/gp/help/seller/at-a-glance.html/275-0905959-1711169?ie=UTF8&amp;seller=A2GYSPAJ7WDF11">Voylla</a>],Amazon.in: Buy 925 Silver Bracelet with Chain; Golden Disc; Two Round Loops at Low Prices in India | Fashion Jewellery Store,Buy 925 Silver Bracelet with Chain; Golden Disc; Two Round Loops at low prices in India at Amazon.in. Check out 925 Silver Bracelet with Chain; Golden Disc; Two Round Loops reviews  ratings  features  specifications and browse more Fashion Jewellery products online at best prices on Amazon.in.,None,<div class="bucket" id="productDescription"> <h2>Product Description</h2> <div class="content"> <h3 class="productDescriptionSource"></h3> <div class="productDescriptionWrapper">        Flaunt worthy sleek hand accessory featuring chain; golden disc; two round loops is winner all the way. This jewellery piece is part of the finely crafted collection which is popular across India; thanks to its sleek styling; intricate designs and adherence to traditional styles. Your loved one deserves nothing less than these 925 silver bracelet              <div class="emptyClear"> </div> </div> </div> </div>,<div align="left" class="bucket" id="techSpecSoftlinesWrap"><h2>Product Specifications </h2> <div class="content"> <div id="techSpecSoftlines"> <table cellspacing="0"> <tr> <th colspan="2">Jewellery Information</th> </tr> <tr> <td class="td1">Brand</td> <td class="td2">                                             Voylla.com                                         </td> </tr> <tr> <td class="td1">Material</td> <td class="td2">                                             sterling-silver                                         </td> </tr> <tr> <td class="td1">Model Number</td> <td class="td2">                                             RUSSE21222                                         </td> </tr> </table> </div> </div> </div>,18:03:2014,None
B00IML4U5K,925 Silver Bracelet with Five Sparkling Round Charms,http://www.amazon.in/Bangles-Bracelets/b/ref=sd_allcat_fj_bangles/276-6718833-1247838?ie=UTF8&node=2152549031,None,Bangles & Bracelet,Bangles & Bracelet,Voylla.com,http://ecx.images-amazon.com/images/I/31jtxUOpx0L._SL246_SX190_CR0 0 190 246_.jpg,None,Color: Silver,Watches & Fashion Jewellery,http://www.amazon.in/Silver-Bracelet-Sparkling-Round-Charms/dp/B00IML4U5K/ref=sr_1_12/275-0905959-1711169?s=jewelry&ie=UTF8&qid=1395127306&sr=1-12,[<a href="/gp/help/seller/at-a-glance.html/275-0905959-1711169?ie=UTF8&amp;seller=A2GYSPAJ7WDF11">Voylla</a>],Amazon.in: Buy 925 Silver Bracelet with Five Sparkling Round Charms at Low Prices in India | Fashion Jewellery Store,Buy 925 Silver Bracelet with Five Sparkling Round Charms at low prices in India at Amazon.in. Check out 925 Silver Bracelet with Five Sparkling Round Charms reviews  ratings  features  specifications and browse more Fashion Jewellery products online at best prices on Amazon.in.,None,<div class="bucket" id="productDescription"> <h2>Product Description</h2> <div class="content"> <h3 class="productDescriptionSource"></h3> <div class="productDescriptionWrapper">        Flaunt worthy sleek hand accessory featuring five sparkling round charms is winner all the way. This jewellery piece is part of the finely crafted collection which is popular across India; thanks to its sleek styling; intricate designs and adherence to traditional styles. Your loved one deserves nothing less than these 925 silver bracelet              <div class="emptyClear"> </div> </div> </div> </div>,<div align="left" class="bucket" id="techSpecSoftlinesWrap"><h2>Product Specifications </h2> <div class="content"> <div id="techSpecSoftlines"> <table cellspacing="0"> <tr> <th colspan="2">Jewellery Information</th> </tr> <tr> <td class="td1">Brand</td> <td class="td2">                                             Voylla.com                                         </td> </tr> <tr> <td class="td1">Material</td> <td class="td2">                                             sterling-silver                                         </td> </tr> <tr> <td class="td1">Model Number</td> <td class="td2">                                             RUSSE21227                                         </td> </tr> </table> </div> </div> </div>,18:03:2014,None
B00HHVEJB6,Gold Plated Bracelet With Rose Cut Theme,http://www.amazon.in/Bangles-Bracelets/b/ref=sd_allcat_fj_bangles/276-6718833-1247838?ie=UTF8&node=2152549031,None,Bangles & Bracelet,Bangles & Bracelet,Voylla.com,http://ecx.images-amazon.com/images/I/31jtxUOpx0L._SL246_SX190_CR0 0 190 246_.jpg,Rs. 310.00,Color: Silver; golden and white,Watches & Fashion Jewellery,http://www.amazon.in/Gold-Plated-Bracelet-With-Theme/dp/B00HHVEJB6/ref=sr_1_2/275-0905959-1711169?s=jewelry&ie=UTF8&qid=1395127306&sr=1-2,[<a href="/gp/help/seller/at-a-glance.html/275-0905959-1711169?ie=UTF8&amp;seller=A2GYSPAJ7WDF11">Voylla</a>],Amazon.in: Buy Gold Plated Bracelet With Rose Cut Theme at Low Prices in India | Fashion Jewellery Store,Buy Gold Plated Bracelet With Rose Cut Theme at low prices in India at Amazon.in. Check out Gold Plated Bracelet With Rose Cut Theme reviews  ratings  features  specifications and browse more Fashion Jewellery products online at best prices on Amazon.in.,None,<div class="bucket" id="productDescription"> <h2>Product Description</h2> <div class="content"> <h3 class="productDescriptionSource"></h3> <div class="productDescriptionWrapper">        This sophisticated gold plated bracelet is set with exquisite rose theme cut work and sparkling texture. Make a style statement with this stellar piece at any do or semi-formal gathering and hog the limelight!              <div class="emptyClear"> </div> </div> </div> </div>,<div align="left" class="bucket" id="techSpecSoftlinesWrap"><h2>Product Specifications </h2> <div class="content"> <div id="techSpecSoftlines"> <table cellspacing="0"> <tr> <th colspan="2">Jewellery Information</th> </tr> <tr> <td class="td1">Brand</td> <td class="td2">                                             Voylla.com                                         </td> </tr> <tr> <td class="td1">Material</td> <td class="td2">                                             Metal                                         </td> </tr> <tr> <td class="td1">Model Number</td> <td class="td2">                                             MAPNQ20622                                         </td> </tr> </table> </div> </div> </div>,18:03:2014,None
B00IML5B08,925 Silver Bracelet with Dainty Oxidised Chain; Rose Golden Charms,http://www.amazon.in/Bangles-Bracelets/b/ref=sd_allcat_fj_bangles/276-6718833-1247838?ie=UTF8&node=2152549031,None,Bangles & Bracelet,Bangles & Bracelet,Voylla.com,http://ecx.images-amazon.com/images/I/31jtxUOpx0L._SL246_SX190_CR0 0 190 246_.jpg,None,Color: Rose Gold and Grayish Black,Watches & Fashion Jewellery,http://www.amazon.in/Silver-Bracelet-Dainty-Oxidised-Golden/dp/B00IML5B08/ref=sr_1_10/275-0905959-1711169?s=jewelry&ie=UTF8&qid=1395127306&sr=1-10,[<a href="/gp/help/seller/at-a-glance.html/275-0905959-1711169?ie=UTF8&amp;seller=A2GYSPAJ7WDF11">Voylla</a>],Amazon.in: Buy 925 Silver Bracelet with Dainty Oxidised Chain; Rose Golden Charms at Low Prices in India | Fashion Jewellery Store,Buy 925 Silver Bracelet with Dainty Oxidised Chain; Rose Golden Charms at low prices in India at Amazon.in. Check out 925 Silver Bracelet with Dainty Oxidised Chain; Rose Golden Charms reviews  ratings  features  specifications and browse more Fashion Jewellery products online at best prices on Amazon.in.,None,<div class="bucket" id="productDescription"> <h2>Product Description</h2> <div class="content"> <h3 class="productDescriptionSource"></h3> <div class="productDescriptionWrapper">        Flaunt worthy sleek hand accessory featuring dainty oxidised chain and rose golden charms is winner all the way. This jewellery piece is part of the finely crafted collection which is popular across India; thanks to its sleek styling; intricate designs and adherence to traditional styles. Your loved one deserves nothing less than these 925 silver bracelet              <div class="emptyClear"> </div> </div> </div> </div>,<div align="left" class="bucket" id="techSpecSoftlinesWrap"><h2>Product Specifications </h2> <div class="content"> <div id="techSpecSoftlines"> <table cellspacing="0"> <tr> <th colspan="2">Jewellery Information</th> </tr> <tr> <td class="td1">Brand</td> <td class="td2">                                             Voylla.com                                         </td> </tr> <tr> <td class="td1">Material</td> <td class="td2">                                             sterling-silver                                         </td> </tr> <tr> <td class="td1">Model Number</td> <td class="td2">                                             RUSSE21198                                         </td> </tr> </table> </div> </div> </div>,18:03:2014,None
B00IML4G9U,925 Silver Adorable Bracelet Embellished With Amethyst; White Topaz,http://www.amazon.in/Bangles-Bracelets/b/ref=sd_allcat_fj_bangles/276-6718833-1247838?ie=UTF8&node=2152549031,None,Bangles & Bracelet,Bangles & Bracelet,Voylla.com,http://ecx.images-amazon.com/images/I/31jtxUOpx0L._SL246_SX190_CR0 0 190 246_.jpg,Rs. 3 800.00,Color: Silver and lavender,Watches & Fashion Jewellery,http://www.amazon.in/Silver-Adorable-Bracelet-Embellished-Amethyst/dp/B00IML4G9U/ref=sr_1_4/275-0905959-1711169?s=jewelry&ie=UTF8&qid=1395127306&sr=1-4,[<a href="/gp/help/seller/at-a-glance.html/275-0905959-1711169?ie=UTF8&amp;seller=A2GYSPAJ7WDF11">Voylla</a>],Amazon.in: Buy 925 Silver Adorable Bracelet Embellished With Amethyst; White Topaz at Low Prices in India | Fashion Jewellery Store,Buy 925 Silver Adorable Bracelet Embellished With Amethyst; White Topaz at low prices in India at Amazon.in. Check out 925 Silver Adorable Bracelet Embellished With Amethyst; White Topaz reviews  ratings  features  specifications and browse more Fashion Jewellery products online at best prices on Amazon.in.,None,<div class="bucket" id="productDescription"> <h2>Product Description</h2> <div class="content"> <h3 class="productDescriptionSource"></h3> <div class="productDescriptionWrapper">        Hearts to fill you with love and affection! Crafted in .925 heart shape sterling silver; oval &amp; round shaped amethyst &amp; white topaz; this bracelet fills your simplicity with the magical touch of style and elegance.              <div class="emptyClear"> </div> </div> </div> </div>,<div align="left" class="bucket" id="techSpecSoftlinesWrap"><h2>Product Specifications </h2> <div class="content"> <div id="techSpecSoftlines"> <table cellspacing="0"> <tr> <th colspan="2">Jewellery Information</th> </tr> <tr> <td class="td1">Brand</td> <td class="td2">                                             Voylla.com                                         </td> </tr> <tr> <td class="td1">Material</td> <td class="td2">                                             sterling-silver                                         </td> </tr> <tr> <td class="td1">Model Number</td> <td class="td2">                                             JZJAI20176                                         </td> </tr> </table> </div> </div> </div>,18:03:2014,None
B00IML43MU,925 Silver Bracelet with Dainty Tri-Layered Designs in Three Colours,http://www.amazon.in/Bangles-Bracelets/b/ref=sd_allcat_fj_bangles/276-6718833-1247838?ie=UTF8&node=2152549031,None,Bangles & Bracelet,Bangles & Bracelet,Voylla.com,http://ecx.images-amazon.com/images/I/31jtxUOpx0L._SL246_SX190_CR0 0 190 246_.jpg,None,Color: Golden; Grayish Black; Black and Silver,Watches & Fashion Jewellery,http://www.amazon.in/Silver-Bracelet-Tri-Layered-Designs-Colours/dp/B00IML43MU/ref=sr_1_11/275-0905959-1711169?s=jewelry&ie=UTF8&qid=1395127306&sr=1-11,[<a href="/gp/help/seller/at-a-glance.html/275-0905959-1711169?ie=UTF8&amp;seller=A2GYSPAJ7WDF11">Voylla</a>],Amazon.in: Buy 925 Silver Bracelet with Dainty Tri-Layered Designs in Three Colours at Low Prices in India | Fashion Jewellery Store,Buy 925 Silver Bracelet with Dainty Tri-Layered Designs in Three Colours at low prices in India at Amazon.in. Check out 925 Silver Bracelet with Dainty Tri-Layered Designs in Three Colours reviews  ratings  features  specifications and browse more Fashion Jewellery products online at best prices on Amazon.in.,None,<div class="bucket" id="productDescription"> <h2>Product Description</h2> <div class="content"> <h3 class="productDescriptionSource"></h3> <div class="productDescriptionWrapper">        Flaunt worthy sleek hand accessory featuring dainty tri-layered designs in three colours is winner all the way. This jewellery piece is part of the finely crafted collection which is popular across India; thanks to its sleek styling; intricate designs and adherence to traditional styles. Your loved one deserves nothing less than these 925 silver bracelet              <div class="emptyClear"> </div> </div> </div> </div>,<div align="left" class="bucket" id="techSpecSoftlinesWrap"><h2>Product Specifications </h2> <div class="content"> <div id="techSpecSoftlines"> <table cellspacing="0"> <tr> <th colspan="2">Jewellery Information</th> </tr> <tr> <td class="td1">Brand</td> <td class="td2">                                             Voylla.com                                         </td> </tr> <tr> <td class="td1">Material</td> <td class="td2">                                             sterling-silver                                         </td> </tr> <tr> <td class="td1">Model Number</td> <td class="td2">                                             RUSSE21204                                         </td> </tr> </table> </div> </div> </div>,18:03:2014,None
B00IML4R4Y,925 Silver Bracelet with Chain; Two Golden Discs; Oxidised Oval Ring,http://www.amazon.in/Bangles-Bracelets/b/ref=sd_allcat_fj_bangles/276-6718833-1247838?ie=UTF8&node=2152549031,None,Bangles & Bracelet,Bangles & Bracelet,Voylla.com,http://ecx.images-amazon.com/images/I/31jtxUOpx0L._SL246_SX190_CR0 0 190 246_.jpg,None,Color: Golden and Grayish Black,Watches & Fashion Jewellery,http://www.amazon.in/Silver-Bracelet-Chain-Golden-Oxidised/dp/B00IML4R4Y/ref=sr_1_9/275-0905959-1711169?s=jewelry&ie=UTF8&qid=1395127306&sr=1-9,[<a href="/gp/help/seller/at-a-glance.html/275-0905959-1711169?ie=UTF8&amp;seller=A2GYSPAJ7WDF11">Voylla</a>],Amazon.in: Buy 925 Silver Bracelet with Chain; Two Golden Discs; Oxidised Oval Ring at Low Prices in India | Fashion Jewellery Store,Buy 925 Silver Bracelet with Chain; Two Golden Discs; Oxidised Oval Ring at low prices in India at Amazon.in. Check out 925 Silver Bracelet with Chain; Two Golden Discs; Oxidised Oval Ring reviews  ratings  features  specifications and browse more Fashion Jewellery products online at best prices on Amazon.in.,None,<div class="bucket" id="productDescription"> <h2>Product Description</h2> <div class="content"> <h3 class="productDescriptionSource"></h3> <div class="productDescriptionWrapper">        Flaunt worthy sleek hand accessory featuring chain; two golden discs and oxidised oval ring is winner all the way. This jewellery piece is part of the finely crafted collection which is popular across India; thanks to its sleek styling; intricate designs and adherence to traditional styles. Your loved one deserves nothing less than these 925 silver bracelet              <div class="emptyClear"> </div> </div> </div> </div>,<div align="left" class="bucket" id="techSpecSoftlinesWrap"><h2>Product Specifications </h2> <div class="content"> <div id="techSpecSoftlines"> <table cellspacing="0"> <tr> <th colspan="2">Jewellery Information</th> </tr> <tr> <td class="td1">Brand</td> <td class="td2">                                             Voylla.com                                         </td> </tr> <tr> <td class="td1">Material</td> <td class="td2">                                             sterling-silver                                         </td> </tr> <tr> <td class="td1">Model Number</td> <td class="td2">                                             RUSSE21220                                         </td> </tr> </table> </div> </div> </div>,18:03:2014,None
