B001441TVA,Adventure By Davidoff For Men 100 ml,http://www.amazon.in/Fragrances/b/ref=sd_allcat_beauty_fragrance/276-6718833-1247838?ie=UTF8&node=1374298031,Rs. 2 550.00,Fragranc,Davidoff,BVLGARI,http://ecx.images-amazon.com/images/I/41GGCYK3CML._AA160_.jpg,Rs. 2 550.00,self Colour,Beauty & Health,http://www.amazon.in/Adventure-Davidoff-For-Men-100/dp/B001441TVA/ref=sr_1_29/279-5651777-0977715?s=beauty&ie=UTF8&qid=1395126791&sr=1-29,[<a class="buyAction" href="/gp/offer-listing/B001441TVA/ref=dp_olp_0/279-5651777-0977715?ie=UTF8&amp;condition=all">these sellers</a>],Adventure By Davidoff For Men 100 ml: Amazon.in: Beauty,Adventure By Davidoff For Men 100 ml: Amazon.in: Beauty,None,<div class="bucket" id="productDescription"> <h2>Product Description</h2> <div class="content"> <h3 class="productDescriptionSource"></h3> <div class="productDescriptionWrapper">        Revised- Davidoff Adventure is a fresher and more lively variant of rain forest aromas  the characteristic feature of the first edition of Adventure. Now you can buy Adventure by DAVIDOFF for Men at PerfumeCrush with the Cash on Delivery facility of PerfumeCrush. It was never so easy to buy perfumes online.              <div class="emptyClear"> </div> </div> </div> </div>,None,18:03:2014,None
B000E7YK3W,Davidoff Echo Eau De Toilette Spray for Men  100ml,http://www.amazon.in/Fragrances/b/ref=sd_allcat_beauty_fragrance/276-6718833-1247838?ie=UTF8&node=1374298031,None,Fragranc,Davidoff,BVLGARI,http://ecx.images-amazon.com/images/I/41GGCYK3CML._AA160_.jpg,None,self Colour,Beauty & Health,http://www.amazon.in/Davidoff-Echo-Toilette-Spray-100ml/dp/B000E7YK3W/ref=sr_1_23/279-5651777-0977715?s=beauty&ie=UTF8&qid=1395126787&sr=1-23,[<a href="/gp/help/seller/at-a-glance.html/279-5651777-0977715?ie=UTF8&amp;seller=A2O8H5ZZSCKU2K">Perfume Crush</a>],Amazon.in: Buy Davidoff Echo Eau De Toilette Spray for Men  100ml Online at Best Price in India | Amazon Beauty Store,Buy Davidoff Echo Eau De Toilette Spray for Men  100ml at lowest price in India on Amazon.in. Check out Davidoff Echo Eau De Toilette Spray for Men  100ml reviews  ratings  features  specifications and browse more Beauty products online at best prices on Amazon.in.,None,<div class="bucket" id="productDescription"> <h2>Product Description</h2> <div class="content"> <h3 class="productDescriptionSource"></h3> <div class="productDescriptionWrapper">        Introduced in 2003. Fragrance notes: cardamon and cedarwood create this masculine fragrance. Recommended use: daytime. When applying any fragrance please consider that there are several factors which can affect the natural smell of your skin and in turn  the way a scent smells on you. For instance  your mood  stress level  age  body chemistry  diet and current medications may all alter the scents you wear. Similarly  factor such as dry or oily skin can even affect the amount of time a fragrance will last after being applied.              <div class="emptyClear"> </div> </div> </div> </div>,None,18:03:2014,None
B002XITZ1C,Davidoff Cool Water for Men  200ml,http://www.amazon.in/Fragrances/b/ref=sd_allcat_beauty_fragrance/276-6718833-1247838?ie=UTF8&node=1374298031,None,Fragranc,Davidoff,BVLGARI,http://ecx.images-amazon.com/images/I/41GGCYK3CML._AA160_.jpg,None,self Colour,Beauty & Health,http://www.amazon.in/Davidoff-Cool-Water-Men-200ml/dp/B002XITZ1C/ref=sr_1_21/279-5651777-0977715?s=beauty&ie=UTF8&qid=1395126787&sr=1-21,[<a href="/gp/help/seller/at-a-glance.html/279-5651777-0977715?ie=UTF8&amp;seller=A29ZFTNVZHDXBZ">Route2Fashion</a>],Amazon.in: Buy Davidoff Cool Water for Men  200ml Online at Best Price in India | Amazon Beauty Store,Buy Davidoff Cool Water for Men  200ml at lowest price in India on Amazon.in. Check out Davidoff Cool Water for Men  200ml reviews  ratings  features  specifications and browse more Beauty products online at best prices on Amazon.in.,None,<div class="bucket" id="productDescription"> <h2>Product Description</h2> <div class="content"> <h3 class="productDescriptionSource"></h3> <div class="productDescriptionWrapper">        "COOL WATER by Davidoff for Men EDT SPRAY 6.7 OZ lavender jasmine oakmoss musk sandalwood.When nbsp applying nbsp any fragrance please consider that there are several factors which can affect the natural smell of your skin and in turn the way a scent smells on you. nbsp For instance your mood stress level age body chemistry nbsp diet and current medications may all alter the scents you wear. nbsp nbsp Similarly factor such as dry or oily nbsp skin can even affect the amount of time a fragrance will last after being applied"              <div class="emptyClear"> </div> </div> </div> </div>,None,18:03:2014,None
B0049FGKU6,ADVENTURE AMAZONIA DAVIDOFF FOR MEN 100ML,http://www.amazon.in/Fragrances/b/ref=sd_allcat_beauty_fragrance/276-6718833-1247838?ie=UTF8&node=1374298031,Rs. 2 799.00,Fragranc,Davidoff,BVLGARI,http://ecx.images-amazon.com/images/I/41GGCYK3CML._AA160_.jpg,Rs. 2 799.00,self Colour,Beauty & Health,http://www.amazon.in/ADVENTURE-AMAZONIA-DAVIDOFF-FOR-100ML/dp/B0049FGKU6/ref=sr_1_28/279-5651777-0977715?s=beauty&ie=UTF8&qid=1395126791&sr=1-28,[<a class="buyAction" href="/gp/offer-listing/B0049FGKU6/ref=dp_olp_0/279-5651777-0977715?ie=UTF8&amp;condition=all">these sellers</a>],Amazon.in: Buy ADVENTURE AMAZONIA DAVIDOFF FOR MEN 100ML Online at Best Price in India | Amazon Beauty Store,Buy ADVENTURE AMAZONIA DAVIDOFF FOR MEN 100ML at lowest price in India on Amazon.in. Check out ADVENTURE AMAZONIA DAVIDOFF FOR MEN 100ML reviews  ratings  features  specifications and browse more Beauty products online at best prices on Amazon.in.,None,<div class="bucket" id="productDescription"> <h2>Product Description</h2> <div class="content"> <h3 class="productDescriptionSource"></h3> <div class="productDescriptionWrapper"> <p> Davidoff Adventure Amazonia is a fresher and more energetic variation of rain forest aromas. Adventure Amazonia arrives in a bottle of the same design  with cold  frozen glass which represents freshness of its contents. Outer carton is coloured in warm  brown nuances of earth and burnt wood  with a map of Amazonia. Top notes incorporate crushed leaves of Mate  subtropical plant which grows in South America (Argentina  East Paraguay  West Uruguay and South Brazil). A heart also includes cru              <div class="emptyClear"> </div> </p></div> </div> </div>,None,18:03:2014,None
B000068DEH,BLV Pour Homme,http://www.amazon.in/Fragrances/b/ref=sd_allcat_beauty_fragrance/276-6718833-1247838?ie=UTF8&node=1374298031,Rs. 3 190.00,Fragranc,Davidoff,BVLGARI,http://ecx.images-amazon.com/images/I/41GGCYK3CML._AA160_.jpg,Rs. 3 190.00,self Colour,Beauty & Health,http://www.amazon.in/BVLGARI-1UI2701-BLV-Pour-Homme/dp/B000068DEH/ref=sr_1_31/279-5651777-0977715?s=beauty&ie=UTF8&qid=1395126791&sr=1-31,[<a class="buyAction" href="/gp/offer-listing/B000068DEH/ref=dp_olp_0/279-5651777-0977715?ie=UTF8&amp;condition=all">these sellers</a>],BLV Pour Homme: Amazon.in: Beauty,BLV Pour Homme: Amazon.in: Beauty,None,<div class="bucket" id="productDescription"> <h2>Product Description</h2> <div class="content"> <h3 class="productDescriptionSource"></h3> <div class="productDescriptionWrapper">        Its scent possesses a blend of juniper berries  sandalwood  cedar and galanga entice everybody with bvlgari blv.              <div class="emptyClear"> </div> </div> </div> </div>,None,18:03:2014,None
B000XE3IM0,BLV POUR HOMME BVLGARI FOR MEN 100ML,http://www.amazon.in/Fragrances/b/ref=sd_allcat_beauty_fragrance/276-6718833-1247838?ie=UTF8&node=1374298031,None,Fragranc,Davidoff,BVLGARI,http://ecx.images-amazon.com/images/I/41GGCYK3CML._AA160_.jpg,None,self Colour,Beauty & Health,http://www.amazon.in/BLV-POUR-HOMME-BVLGARI-100ML/dp/B000XE3IM0/ref=sr_1_32/279-5651777-0977715?s=beauty&ie=UTF8&qid=1395126791&sr=1-32,[<a href="/gp/help/seller/at-a-glance.html/279-5651777-0977715?ie=UTF8&amp;seller=A2NFQIUV2YGOLG">Fragume</a>],Amazon.in: Buy BLV POUR HOMME BVLGARI FOR MEN 100ML Online at Best Price in India | Amazon Beauty Store,Buy BLV POUR HOMME BVLGARI FOR MEN 100ML at lowest price in India on Amazon.in. Check out BLV POUR HOMME BVLGARI FOR MEN 100ML reviews  ratings  features  specifications and browse more Beauty products online at best prices on Amazon.in.,None,<div class="bucket" id="productDescription"> <h2>Product Description</h2> <div class="content"> <h3 class="productDescriptionSource"></h3> <div class="productDescriptionWrapper">        BLV Pour Homme Bvlgari for men Attractive and seductive  this masculine Eau de Toilette was built on contrasts that blend together in a perfect harmony. BLV pout Homme is fresh  woody-spicy fragrance. Ginger  as a main note in both BLV pour Femme and BLV pour Homme  is harmonized with the velvety and silkier note of tobacco blossom.The fresh and spicy beginning gradually envolves into the lovely blend of tobacco blossom  juniper and gingko              <div class="emptyClear"> </div> </div> </div> </div>,None,18:03:2014,None
B004UR30II,Bvlgari Aqva Toniq Eau De Toilette for Men  100ml,http://www.amazon.in/Fragrances/b/ref=sd_allcat_beauty_fragrance/276-6718833-1247838?ie=UTF8&node=1374298031,None,Fragranc,Davidoff,BVLGARI,http://ecx.images-amazon.com/images/I/41GGCYK3CML._AA160_.jpg,None,self Colour,Beauty & Health,http://www.amazon.in/Bvlgari-Aqva-Toniq-Toilette-100ml/dp/B004UR30II/ref=sr_1_42/279-5651777-0977715?s=beauty&ie=UTF8&qid=1395126791&sr=1-42,[<a href="/gp/help/seller/at-a-glance.html/279-5651777-0977715?ie=UTF8&amp;seller=A29ZFTNVZHDXBZ">Route2Fashion</a>],Amazon.in: Buy Bvlgari Aqva Toniq Eau De Toilette for Men  100ml Online at Best Price in India | Amazon Beauty Store,Buy Bvlgari Aqva Toniq Eau De Toilette for Men  100ml at lowest price in India on Amazon.in. Check out Bvlgari Aqva Toniq Eau De Toilette for Men  100ml reviews  ratings  features  specifications and browse more Beauty products online at best prices on Amazon.in.,None,<div class="bucket" id="productDescription"> <h2>Product Description</h2> <div class="content"> <h3 class="productDescriptionSource"></h3> <div class="productDescriptionWrapper">        Design House: Bvlgari  Year Introduced: 2011  Recommended Use: Casual  Recommended Use: Casual              <div class="emptyClear"> </div> </div> </div> </div>,None,18:03:2014,None
B0084YBD0K,Bvlgari Aqva Marine Toniq Eau De Toilette for Men  100ml,http://www.amazon.in/Fragrances/b/ref=sd_allcat_beauty_fragrance/276-6718833-1247838?ie=UTF8&node=1374298031,None,Fragranc,Davidoff,BVLGARI,http://ecx.images-amazon.com/images/I/41GGCYK3CML._AA160_.jpg,None,self Colour,Beauty & Health,http://www.amazon.in/Bvlgari-Marine-Toniq-Toilette-100ml/dp/B0084YBD0K/ref=sr_1_41/279-5651777-0977715?s=beauty&ie=UTF8&qid=1395126791&sr=1-41,[<a href="/gp/help/seller/at-a-glance.html/279-5651777-0977715?ie=UTF8&amp;seller=A22G8HZGXYSWPZ">Taha &amp; Bros.</a>],Amazon.in: Buy Bvlgari Aqva Marine Toniq Eau De Toilette for Men  100ml Online at Best Price in India | Amazon Beauty Store,Buy Bvlgari Aqva Marine Toniq Eau De Toilette for Men  100ml at lowest price in India on Amazon.in. Check out Bvlgari Aqva Marine Toniq Eau De Toilette for Men  100ml reviews  ratings  features  specifications and browse more Beauty products online at best prices on Amazon.in.,None,<div class="bucket" id="productDescription"> <h2>Product Description</h2> <div class="content"> <h3 class="productDescriptionSource"></h3> <div class="productDescriptionWrapper">        Aqva Marine Toniq includes the freshness of mineral waters in each of its crystal droplets. Energetic  vivid and cool summer holiday scent opens with intense notes of tangy Pear and Grapefruit. Its core contains a mixture of Crystal ice and Posidonia sea weed  deposited on light woody base notes of Sandalwood and White cedar.              <div class="emptyClear"> </div> </div> </div> </div>,None,18:03:2014,None
B0084YB8F0,Bvlgari Black Men 75ML EDT,http://www.amazon.in/Fragrances/b/ref=sd_allcat_beauty_fragrance/276-6718833-1247838?ie=UTF8&node=1374298031,Rs. 3 491.00,Fragranc,Davidoff,BVLGARI,http://ecx.images-amazon.com/images/I/41GGCYK3CML._AA160_.jpg,Rs. 3 491.00,self Colour,Beauty & Health,http://www.amazon.in/Bvlgari-Black-Men-75ML-EDT/dp/B0084YB8F0/ref=sr_1_45/279-5651777-0977715?s=beauty&ie=UTF8&qid=1395126791&sr=1-45,[<a class="buyAction" href="/gp/offer-listing/B0084YB8F0/ref=dp_olp_0/279-5651777-0977715?ie=UTF8&amp;condition=all">these sellers</a>],Amazon.in: Buy Bvlgari Black Men 75ML EDT Online at Best Price in India | Amazon Beauty Store,Buy Bvlgari Black Men 75ML EDT at lowest price in India on Amazon.in. Check out Bvlgari Black Men 75ML EDT reviews  ratings  features  specifications and browse more Beauty products online at best prices on Amazon.in.,None,<div class="bucket" id="productDescription"> <h2>Product Description</h2> <div class="content"> <h3 class="productDescriptionSource"></h3> <div class="productDescriptionWrapper">        Black Bvlgari for women and men.As its smokey  rubbery and woody notes implie  Black is created for a man living a metropolitan life. Black was composed without an olfactive pyramid. It starts with a smoky black tea  in this case lapsang souchong  urban and masculine  simulating rubber  car tires  cars  roads and motor noise while the notes of amber and woody notes remind that even the largest cities hide romantic moments at sunsets. It is created by Annick Menardo in 1998.              <div class="emptyClear"> </div> </div> </div> </div>,None,18:03:2014,None
B004I69E1S,Bvlgari Blv EDP Ii for Women  75ml,http://www.amazon.in/Fragrances/b/ref=sd_allcat_beauty_fragrance/276-6718833-1247838?ie=UTF8&node=1374298031,None,Fragranc,Davidoff,BVLGARI,http://ecx.images-amazon.com/images/I/41GGCYK3CML._AA160_.jpg,None,self Colour,Beauty & Health,http://www.amazon.in/Bvlgari-Blv-EDP-Women-75ml/dp/B004I69E1S/ref=sr_1_55/279-5651777-0977715?s=beauty&ie=UTF8&qid=1395126804&sr=1-55,[<a href="/gp/help/seller/at-a-glance.html/279-5651777-0977715?ie=UTF8&amp;seller=A2NFQIUV2YGOLG">Fragume</a>],Amazon.in: Buy Bvlgari Blv EDP Ii for Women  75ml Online at Best Price in India | Amazon Beauty Store,Buy Bvlgari Blv EDP Ii for Women  75ml at lowest price in India on Amazon.in. Check out Bvlgari Blv EDP Ii for Women  75ml reviews  ratings  features  specifications and browse more Beauty products online at best prices on Amazon.in.,None,<div class="bucket" id="productDescription"> <h2>Product Description</h2> <div class="content"> <h3 class="productDescriptionSource"></h3> <div class="productDescriptionWrapper">        A new azure-blue Bvlgari fragrance  more closely linked to jeweller heritage and perfumery savoir-faire. This new natural and feminine interpretation lies in perfect harmony with a quest for true Beauty. An elegant jewel of glass and light in a unique object of design.              <div class="emptyClear"> </div> </div> </div> </div>,None,18:03:2014,None
B0084YB90Y,Bvlgari BLV Eau De Parfum II Women 75ML EDP,http://www.amazon.in/Fragrances/b/ref=sd_allcat_beauty_fragrance/276-6718833-1247838?ie=UTF8&node=1374298031,None,Fragranc,Davidoff,BVLGARI,http://ecx.images-amazon.com/images/I/41GGCYK3CML._AA160_.jpg,None,self Colour,Beauty & Health,http://www.amazon.in/Bvlgari-BLV-Parfum-Women-75ML/dp/B0084YB90Y/ref=sr_1_54/279-5651777-0977715?s=beauty&ie=UTF8&qid=1395126804&sr=1-54,[<a href="/gp/help/seller/at-a-glance.html/279-5651777-0977715?ie=UTF8&amp;seller=A2NFQIUV2YGOLG">Fragume</a>],Amazon.in: Buy Bvlgari BLV Eau De Parfum II Women 75ML EDP Online at Best Price in India | Amazon Beauty Store,Buy Bvlgari BLV Eau De Parfum II Women 75ML EDP at lowest price in India on Amazon.in. Check out Bvlgari BLV Eau De Parfum II Women 75ML EDP reviews  ratings  features  specifications and browse more Beauty products online at best prices on Amazon.in.,None,<div class="bucket" id="productDescription"> <h2>Product Description</h2> <div class="content"> <h3 class="productDescriptionSource"></h3> <div class="productDescriptionWrapper">        BLV Eau de Parfum II Bvlgari for women. Bvlgari is launching a new fragrance in September this year. The perfume named BLV Eau de Parfum II joins their opulent collection of perfumes as a feminine aroma which gives a feeling of nature  femininity  magnetism and harmony. Bluish nuances and modern vision of perfume BLV EDP II were created in cooperation with perfumer Jacques Cavallier.              <div class="emptyClear"> </div> </div> </div> </div>,None,18:03:2014,None
B000068LN9,Bvlgari Blv for Women  75ml,http://www.amazon.in/Fragrances/b/ref=sd_allcat_beauty_fragrance/276-6718833-1247838?ie=UTF8&node=1374298031,None,Fragranc,Davidoff,BVLGARI,http://ecx.images-amazon.com/images/I/41GGCYK3CML._AA160_.jpg,None,self Colour,Beauty & Health,http://www.amazon.in/Bvlgari-Blv-for-Women-75ml/dp/B000068LN9/ref=sr_1_57/279-5651777-0977715?s=beauty&ie=UTF8&qid=1395126804&sr=1-57,[<a href="/gp/help/seller/at-a-glance.html/279-5651777-0977715?ie=UTF8&amp;seller=A2NFQIUV2YGOLG">Fragume</a>],Amazon.in: Buy Bvlgari Blv for Women  75ml Online at Best Price in India | Amazon Beauty Store,Buy Bvlgari Blv for Women  75ml at lowest price in India on Amazon.in. Check out Bvlgari Blv for Women  75ml reviews  ratings  features  specifications and browse more Beauty products online at best prices on Amazon.in.,None,<div class="bucket" id="productDescription"> <h2>Product Description</h2> <div class="content"> <h3 class="productDescriptionSource"></h3> <div class="productDescriptionWrapper">        Design House: Bvlgari  Year Introduced: 2000  Recommended Use: Daytime  Recommended Use: Daytime              <div class="emptyClear"> </div> </div> </div> </div>,None,18:03:2014,None
B0009J74NS,Bvlgari BLV EDT for Men  100ml,http://www.amazon.in/Fragrances/b/ref=sd_allcat_beauty_fragrance/276-6718833-1247838?ie=UTF8&node=1374298031,None,Fragranc,Davidoff,BVLGARI,http://ecx.images-amazon.com/images/I/41GGCYK3CML._AA160_.jpg,None,self Colour,Beauty & Health,http://www.amazon.in/Bvlgari-BLV-EDT-Men-100ml/dp/B0009J74NS/ref=sr_1_56/279-5651777-0977715?s=beauty&ie=UTF8&qid=1395126804&sr=1-56,[<a href="/gp/help/seller/at-a-glance.html/279-5651777-0977715?ie=UTF8&amp;seller=A2NFQIUV2YGOLG">Fragume</a>],Amazon.in: Buy Bvlgari BLV EDT for Men  100ml Online at Best Price in India | Amazon Beauty Store,Buy Bvlgari BLV EDT for Men  100ml at lowest price in India on Amazon.in. Check out Bvlgari BLV EDT for Men  100ml reviews  ratings  features  specifications and browse more Beauty products online at best prices on Amazon.in.,None,<div class="bucket" id="productDescription"> <h2>Product Description</h2> <div class="content"> <h3 class="productDescriptionSource"></h3> <div class="productDescriptionWrapper">        Design House: Bvlgari  Year Introduced: 2001  Recommended Use: Casual  Recommended Use: Casual              <div class="emptyClear"> </div> </div> </div> </div>,None,18:03:2014,None
B000C20ZSS,Bvlgari Blv By Bvlgari For Women. Eau De Parfum Spray 2.5 Ounces,http://www.amazon.in/Fragrances/b/ref=sd_allcat_beauty_fragrance/276-6718833-1247838?ie=UTF8&node=1374298031,None,Fragranc,Davidoff,BVLGARI,http://ecx.images-amazon.com/images/I/41GGCYK3CML._AA160_.jpg,None,self Colour,Beauty & Health,http://www.amazon.in/Bvlgari-Women-Parfum-Spray-Ounces/dp/B000C20ZSS/ref=sr_1_52/279-5651777-0977715?s=beauty&ie=UTF8&qid=1395126804&sr=1-52,[<a href="/gp/help/seller/at-a-glance.html/279-5651777-0977715?ie=UTF8&amp;seller=A2NFQIUV2YGOLG">Fragume</a>],Amazon.in: Buy Bvlgari Blv By Bvlgari For Women. Eau De Parfum Spray 2.5 Ounces Online at Best Price in India | Amazon Beauty Store,Buy Bvlgari Blv By Bvlgari For Women. Eau De Parfum Spray 2.5 Ounces at lowest price in India on Amazon.in. Check out Bvlgari Blv By Bvlgari For Women. Eau De Parfum Spray 2.5 Ounces reviews  ratings  features  specifications and browse more Beauty products online at best prices on Amazon.in.,None,<div class="bucket" id="productDescription"> <h2>Product Description</h2> <div class="content"> <h3 class="productDescriptionSource"></h3> <div class="productDescriptionWrapper">        "Introduced in 2000. Fragrance notes: a cool scent musk vanilla and ginger with low woodsy notes. Recommended use: daytime.When nbsp applying nbsp any fragrance please consider that there are several factors which can affect the natural smell of your skin and in turn the way a scent smells on you. nbsp For instance your mood stress level age body chemistry nbsp diet and current medications may all alter the scents you wear. nbsp nbsp Similarly factor such as dry or oily nbsp skin can even affect the amount of time a fragrance will last after being applied"              <div class="emptyClear"> </div> </div> </div> </div>,None,18:03:2014,None
B000C20ZS8,Bvlgari BLV Notte EDP for Men  100ml,http://www.amazon.in/Fragrances/b/ref=sd_allcat_beauty_fragrance/276-6718833-1247838?ie=UTF8&node=1374298031,None,Fragranc,Davidoff,BVLGARI,http://ecx.images-amazon.com/images/I/41GGCYK3CML._AA160_.jpg,None,self Colour,Beauty & Health,http://www.amazon.in/Bvlgari-BLV-Notte-EDP-100ml/dp/B000C20ZS8/ref=sr_1_64/279-5651777-0977715?s=beauty&ie=UTF8&qid=1395126804&sr=1-64,[<a href="/gp/help/seller/at-a-glance.html/279-5651777-0977715?ie=UTF8&amp;seller=A2NFQIUV2YGOLG">Fragume</a>],Amazon.in: Buy Bvlgari BLV Notte EDP for Men  100ml Online at Best Price in India | Amazon Beauty Store,Buy Bvlgari BLV Notte EDP for Men  100ml at lowest price in India on Amazon.in. Check out Bvlgari BLV Notte EDP for Men  100ml reviews  ratings  features  specifications and browse more Beauty products online at best prices on Amazon.in.,None,<div class="bucket" id="productDescription"> <h2>Product Description</h2> <div class="content"> <h3 class="productDescriptionSource"></h3> <div class="productDescriptionWrapper">        Fragrance notes: Juniper berries sandalwood cedar and galanga. When applying any fragrance please consider that there are several factors which can affect the natural smell of your skin and in turn the way a scent smells on you. For instance your mood stress level age body chemistry  diet and current medications may all alter the scents you wear. Similarly factor such as dry or oily skin can even affect the amount of time a fragrance will last after being applied.              <div class="emptyClear"> </div> </div> </div> </div>,None,18:03:2014,None
B0084YB8OQ,Bvlgari BLV Women 100ML EDT,http://www.amazon.in/Fragrances/b/ref=sd_allcat_beauty_fragrance/276-6718833-1247838?ie=UTF8&node=1374298031,Rs. 3 071.00,Fragranc,Davidoff,BVLGARI,http://ecx.images-amazon.com/images/I/41GGCYK3CML._AA160_.jpg,Rs. 3 071.00,self Colour,Beauty & Health,http://www.amazon.in/Bvlgari-BLV-Women-100ML-EDT/dp/B0084YB8OQ/ref=sr_1_66/279-5651777-0977715?s=beauty&ie=UTF8&qid=1395126804&sr=1-66,[<a class="buyAction" href="/gp/offer-listing/B0084YB8OQ/ref=dp_olp_0/279-5651777-0977715?ie=UTF8&amp;condition=all">these sellers</a>],Amazon.in: Buy Bvlgari BLV Women 100ML EDT Online at Best Price in India | Amazon Beauty Store,Buy Bvlgari BLV Women 100ML EDT at lowest price in India on Amazon.in. Check out Bvlgari BLV Women 100ML EDT reviews  ratings  features  specifications and browse more Beauty products online at best prices on Amazon.in.,None,None,None,18:03:2014,None
B000C1UBHE,Bvlgari Extreme By Bvlgari For Men. Eau De Toilette Spray 3.4 Ounces,http://www.amazon.in/Fragrances/b/ref=sd_allcat_beauty_fragrance/276-6718833-1247838?ie=UTF8&node=1374298031,None,Fragranc,Davidoff,BVLGARI,http://ecx.images-amazon.com/images/I/41GGCYK3CML._AA160_.jpg,None,self Colour,Beauty & Health,http://www.amazon.in/Bvlgari-Extreme-Toilette-Spray-Ounces/dp/B000C1UBHE/ref=sr_1_76/279-5651777-0977715?s=beauty&ie=UTF8&qid=1395126819&sr=1-76,[<a href="/gp/help/seller/at-a-glance.html/279-5651777-0977715?ie=UTF8&amp;seller=A2NFQIUV2YGOLG">Fragume</a>],Amazon.in: Buy Bvlgari Extreme By Bvlgari For Men. Eau De Toilette Spray 3.4 Ounces Online at Best Price in India | Amazon Beauty Store,Buy Bvlgari Extreme By Bvlgari For Men. Eau De Toilette Spray 3.4 Ounces at lowest price in India on Amazon.in. Check out Bvlgari Extreme By Bvlgari For Men. Eau De Toilette Spray 3.4 Ounces reviews  ratings  features  specifications and browse more Beauty products online at best prices on Amazon.in.,None,<div class="bucket" id="productDescription"> <h2>Product Description</h2> <div class="content"> <h3 class="productDescriptionSource"></h3> <div class="productDescriptionWrapper">        Introduced in 1999. Fragrance notes: woods and spices with low notes of lavender. Recommended use: romantic.When nbsp applying nbsp any fragrance please consider that there are several factors which can affect the natural smell of your skin and in turn the way a scent smells on you. nbsp For instance your mood stress level age body chemistry nbsp diet and current medications may all alter the scents you wear. nbsp nbsp Similarly factor such as dry or oily nbsp skin can even affect the amount of time a fragrance will last after being applied              <div class="emptyClear"> </div> </div> </div> </div>,None,18:03:2014,None
