B003X5KAA4,Davidoff Champion Eau De Toilette Spray for Men  90ml,http://www.amazon.in/Fragrances/b/ref=sd_allcat_beauty_fragrance/276-6718833-1247838?ie=UTF8&node=1374298031,None,Fragranc,Davidoff,BVLGARI,http://ecx.images-amazon.com/images/I/41GGCYK3CML._AA160_.jpg,None,self Colour,Beauty & Health,http://www.amazon.in/Davidoff-Champion-Toilette-Spray-90ml/dp/B003X5KAA4/ref=sr_1_3/279-5651777-0977715?s=beauty&ie=UTF8&qid=1395126787&sr=1-3,[<a href="/gp/help/seller/at-a-glance.html/279-5651777-0977715?ie=UTF8&amp;seller=A22G8HZGXYSWPZ">Taha &amp; Bros.</a>],Amazon.in: Buy Davidoff Champion Eau De Toilette Spray for Men  90ml Online at Best Price in India | Amazon Beauty Store,Buy Davidoff Champion Eau De Toilette Spray for Men  90ml at lowest price in India on Amazon.in. Check out Davidoff Champion Eau De Toilette Spray for Men  90ml reviews  ratings  features  specifications and browse more Beauty products online at best prices on Amazon.in.,None,<div class="bucket" id="productDescription"> <h2>Product Description</h2> <div class="content"> <h3 class="productDescriptionSource"></h3> <div class="productDescriptionWrapper">        Launched by the design house of Davidoff in 2010. It is classified as masculine fragrance. It is recommended for casual wear.              <div class="emptyClear"> </div> </div> </div> </div>,None,18:03:2014,None
B00733IRWU,Davidoff Cool Water Deodorant Spray 100ml/3.4oz,http://www.amazon.in/Fragrances/b/ref=sd_allcat_beauty_fragrance/276-6718833-1247838?ie=UTF8&node=1374298031,None,Fragranc,Davidoff,BVLGARI,http://ecx.images-amazon.com/images/I/41GGCYK3CML._AA160_.jpg,None,self Colour,Beauty & Health,http://www.amazon.in/Davidoff-Water-Deodorant-Spray-100ml/dp/B00733IRWU/ref=sr_1_7/279-5651777-0977715?s=beauty&ie=UTF8&qid=1395126787&sr=1-7,[<a href="/gp/help/seller/at-a-glance.html/279-5651777-0977715?ie=UTF8&amp;seller=A3ES9F57NVVRIK">MyLuckyScent</a>],Amazon.in: Buy Davidoff Cool Water Deodorant Spray 100ml/3.4oz Online at Best Price in India | Amazon Beauty Store,Buy Davidoff Cool Water Deodorant Spray 100ml/3.4oz at lowest price in India on Amazon.in. Check out Davidoff Cool Water Deodorant Spray 100ml/3.4oz reviews  ratings  features  specifications and browse more Beauty products online at best prices on Amazon.in.,None,None,None,18:03:2014,None
B0009OAHCS,Davidoff Cool Water Eau De Toilette Spray for Women  100ml,http://www.amazon.in/Fragrances/b/ref=sd_allcat_beauty_fragrance/276-6718833-1247838?ie=UTF8&node=1374298031,None,Fragranc,Davidoff,BVLGARI,http://ecx.images-amazon.com/images/I/41GGCYK3CML._AA160_.jpg,None,self Colour,Beauty & Health,http://www.amazon.in/Davidoff-Water-Toilette-Spray-Women/dp/B0009OAHCS/ref=sr_1_5/279-5651777-0977715?s=beauty&ie=UTF8&qid=1395126787&sr=1-5,[<a href="/gp/help/seller/at-a-glance.html/279-5651777-0977715?ie=UTF8&amp;seller=A2NFQIUV2YGOLG">Fragume</a>],Amazon.in: Buy Davidoff Cool Water Eau De Toilette Spray for Women  100ml Online at Best Price in India | Amazon Beauty Store,Buy Davidoff Cool Water Eau De Toilette Spray for Women  100ml at lowest price in India on Amazon.in. Check out Davidoff Cool Water Eau De Toilette Spray for Women  100ml reviews  ratings  features  specifications and browse more Beauty products online at best prices on Amazon.in.,None,<div class="bucket" id="productDescription"> <h2>Product Description</h2> <div class="content"> <h3 class="productDescriptionSource"></h3> <div class="productDescriptionWrapper">        Introduced in 1996. Fragrance notes: citrus  pineapple and woody notes  blended with the scent of ocean air. Recommended use: casual. When applying any fragrance please consider that there are several factors which can affect the natural smell of your skin and in turn  the way a scent smells on you. For instance  your mood  stress level  age  body chemistry  diet and current medications may all alter the scents you wear. Similarly  factor such as dry or oily skin can even affect the amount of time a fragrance will last after being applied.              <div class="emptyClear"> </div> </div> </div> </div>,None,18:03:2014,None
B000C1UBFQ,Bvlgari Aqua Eau De Toilette Spray for Men  100ml,http://www.amazon.in/Fragrances/b/ref=sd_allcat_beauty_fragrance/276-6718833-1247838?ie=UTF8&node=1374298031,None,Fragranc,Davidoff,BVLGARI,http://ecx.images-amazon.com/images/I/41GGCYK3CML._AA160_.jpg,None,self Colour,Beauty & Health,http://www.amazon.in/Bvlgari-Aqua-Toilette-Spray-100ml/dp/B000C1UBFQ/ref=sr_1_1/279-5651777-0977715?s=beauty&ie=UTF8&qid=1395126787&sr=1-1,[<a href="/gp/help/seller/at-a-glance.html/279-5651777-0977715?ie=UTF8&amp;seller=A2NFQIUV2YGOLG">Fragume</a>],Amazon.in: Buy Bvlgari Aqua Eau De Toilette Spray for Men  100ml Online at Best Price in India | Amazon Beauty Store,Buy Bvlgari Aqua Eau De Toilette Spray for Men  100ml at lowest price in India on Amazon.in. Check out Bvlgari Aqua Eau De Toilette Spray for Men  100ml reviews  ratings  features  specifications and browse more Beauty products online at best prices on Amazon.in.,None,<div class="bucket" id="productDescription"> <h2>Product Description</h2> <div class="content"> <h3 class="productDescriptionSource"></h3> <div class="productDescriptionWrapper">        When applying any fragrance please consider that there are several factors which can affect the natural smell of your skin and in turn  the way a scent smells on you. For instance  your mood  stress level  age  body chemistry  diet and current medications may all alter the scents you wear. Similarly  factor such as dry or oily skin can even affect the amount of time a fragrance will last after being applied.              <div class="emptyClear"> </div> </div> </div> </div>,None,18:03:2014,None
B0084YBVG6,Davidoff Silver Shadow EDT for Men  100ml,http://www.amazon.in/Fragrances/b/ref=sd_allcat_beauty_fragrance/276-6718833-1247838?ie=UTF8&node=1374298031,None,Fragranc,Davidoff,BVLGARI,http://ecx.images-amazon.com/images/I/41GGCYK3CML._AA160_.jpg,None,self Colour,Beauty & Health,http://www.amazon.in/Davidoff-Silver-Shadow-EDT-100ml/dp/B0084YBVG6/ref=sr_1_13/279-5651777-0977715?s=beauty&ie=UTF8&qid=1395126787&sr=1-13,[<a href="/gp/help/seller/at-a-glance.html/279-5651777-0977715?ie=UTF8&amp;seller=A2NFQIUV2YGOLG">Fragume</a>],Amazon.in: Buy Davidoff Silver Shadow EDT for Men  100ml Online at Best Price in India | Amazon Beauty Store,Buy Davidoff Silver Shadow EDT for Men  100ml at lowest price in India on Amazon.in. Check out Davidoff Silver Shadow EDT for Men  100ml reviews  ratings  features  specifications and browse more Beauty products online at best prices on Amazon.in.,None,<div class="bucket" id="productDescription"> <h2>Product Description</h2> <div class="content"> <h3 class="productDescriptionSource"></h3> <div class="productDescriptionWrapper">        Silver Shadow by Davidoff was introduced in 2005 for a mature  charismatic scent for men. Silver Shadow opens with Orange  Coriander and Cedar  then blends into Saffron and Patchouli that ends with Amber and Oak moss. Top notes are Bitter orange  Cinnamon leaves.              <div class="emptyClear"> </div> </div> </div> </div>,None,18:03:2014,None
B002XITZ08,Davidoff Cool Water EDT for Women  100ml,http://www.amazon.in/Fragrances/b/ref=sd_allcat_beauty_fragrance/276-6718833-1247838?ie=UTF8&node=1374298031,None,Fragranc,Davidoff,BVLGARI,http://ecx.images-amazon.com/images/I/41GGCYK3CML._AA160_.jpg,None,self Colour,Beauty & Health,http://www.amazon.in/Davidoff-Cool-Water-Women-100ml/dp/B002XITZ08/ref=sr_1_4/279-5651777-0977715?s=beauty&ie=UTF8&qid=1395126787&sr=1-4,[<a href="/gp/help/seller/at-a-glance.html/279-5651777-0977715?ie=UTF8&amp;seller=A22G8HZGXYSWPZ">Taha &amp; Bros.</a>],Amazon.in: Buy Davidoff Cool Water EDT for Women  100ml Online at Best Price in India | Amazon Beauty Store,Buy Davidoff Cool Water EDT for Women  100ml at lowest price in India on Amazon.in. Check out Davidoff Cool Water EDT for Women  100ml reviews  ratings  features  specifications and browse more Beauty products online at best prices on Amazon.in.,None,<div class="bucket" id="productDescription"> <h2>Product Description</h2> <div class="content"> <h3 class="productDescriptionSource"></h3> <div class="productDescriptionWrapper">        Cool Water by Davidoff for women EDT spray 6.7oz citrus pineapple and woody notes blended with the scent of ocean air. When applying any fragrance please consider that there are several factors which can affect the natural smell of your skin and in turn the way a scent smells on you. For instance your mood stress level age body chemistry diet and current medications may all alter the scents you wear. Similarly factor such as dry or oily nbsp skin can even affect the amount of time a fragrance will last after being applied.              <div class="emptyClear"> </div> </div> </div> </div>,None,18:03:2014,None
B000P22UUG,Bvlgari Omnia Crystalline for Women  65ml,http://www.amazon.in/Fragrances/b/ref=sd_allcat_beauty_fragrance/276-6718833-1247838?ie=UTF8&node=1374298031,None,Fragranc,Davidoff,BVLGARI,http://ecx.images-amazon.com/images/I/41GGCYK3CML._AA160_.jpg,None,self Colour,Beauty & Health,http://www.amazon.in/Bvlgari-Omnia-Crystalline-Women-65ml/dp/B000P22UUG/ref=sr_1_12/279-5651777-0977715?s=beauty&ie=UTF8&qid=1395126787&sr=1-12,[<a href="/gp/help/seller/at-a-glance.html/279-5651777-0977715?ie=UTF8&amp;seller=A29ZFTNVZHDXBZ">Route2Fashion</a>],Amazon.in: Buy Bvlgari Omnia Crystalline for Women  65ml Online at Best Price in India | Amazon Beauty Store,Buy Bvlgari Omnia Crystalline for Women  65ml at lowest price in India on Amazon.in. Check out Bvlgari Omnia Crystalline for Women  65ml reviews  ratings  features  specifications and browse more Beauty products online at best prices on Amazon.in.,None,<div class="bucket" id="productDescription"> <h2>Product Description</h2> <div class="content"> <h3 class="productDescriptionSource"></h3> <div class="productDescriptionWrapper">        Design House: Bvlgari  Year Introduced: 2005  Recommended Use: Casual  Recommended Use: Casual              <div class="emptyClear"> </div> </div> </div> </div>,None,18:03:2014,None
B001CT09UE,Bvlgari Aqva Marine for Men  100ml,http://www.amazon.in/Fragrances/b/ref=sd_allcat_beauty_fragrance/276-6718833-1247838?ie=UTF8&node=1374298031,None,Fragranc,Davidoff,BVLGARI,http://ecx.images-amazon.com/images/I/41GGCYK3CML._AA160_.jpg,None,self Colour,Beauty & Health,http://www.amazon.in/Bvlgari-Aqva-Marine-Men-100ml/dp/B001CT09UE/ref=sr_1_10/279-5651777-0977715?s=beauty&ie=UTF8&qid=1395126787&sr=1-10,[<a href="/gp/help/seller/at-a-glance.html/279-5651777-0977715?ie=UTF8&amp;seller=A2NFQIUV2YGOLG">Fragume</a>],Amazon.in: Buy Bvlgari Aqva Marine for Men  100ml Online at Best Price in India | Amazon Beauty Store,Buy Bvlgari Aqva Marine for Men  100ml at lowest price in India on Amazon.in. Check out Bvlgari Aqva Marine for Men  100ml reviews  ratings  features  specifications and browse more Beauty products online at best prices on Amazon.in.,None,<div class="bucket" id="productDescription"> <h2>Product Description</h2> <div class="content"> <h3 class="productDescriptionSource"></h3> <div class="productDescriptionWrapper">        Bvlgari Aqva Marine 3 Pc Gift Set For Men includes - 100 ml  EDT Spray  75 ml Shampoo &amp; Shower Gel 1X Bag BVLGARI AQVA MARINE SET with BAG Bvlgari Aqva Marine Cologne by Bvlgari A resonant and enticing scent for men that emanates casual chic for any time of day or night  Bvlgari Aqva Marine is a fruity but very manly fragrance that will turn heads wherever you travel. Introduced by Bvlgari in 2008  Aqva Marine combines notes of pine needle  cedar wood  rosemary flower  neroli bigarade and grapefruit in a construction that's perfect for the contemporary man. This versatile cologne works well for hitting the town with buddies or having a quiet dinner with that special someone.              <div class="emptyClear"> </div> </div> </div> </div>,None,18:03:2014,None
B005FLMIK4,Davidoff Champion Energy Eau De Toilette Spray for Men  90ml,http://www.amazon.in/Fragrances/b/ref=sd_allcat_beauty_fragrance/276-6718833-1247838?ie=UTF8&node=1374298031,None,Fragranc,Davidoff,BVLGARI,http://ecx.images-amazon.com/images/I/41GGCYK3CML._AA160_.jpg,None,self Colour,Beauty & Health,http://www.amazon.in/Davidoff-Champion-Energy-Toilette-Spray/dp/B005FLMIK4/ref=sr_1_14/279-5651777-0977715?s=beauty&ie=UTF8&qid=1395126787&sr=1-14,[<a href="/gp/help/seller/at-a-glance.html/279-5651777-0977715?ie=UTF8&amp;seller=A2IT7998C8946H">Perfume Nation</a>],Amazon.in: Buy Davidoff Champion Energy Eau De Toilette Spray for Men  90ml Online at Best Price in India | Amazon Beauty Store,Buy Davidoff Champion Energy Eau De Toilette Spray for Men  90ml at lowest price in India on Amazon.in. Check out Davidoff Champion Energy Eau De Toilette Spray for Men  90ml reviews  ratings  features  specifications and browse more Beauty products online at best prices on Amazon.in.,None,<div class="bucket" id="productDescription"> <h2>Product Description</h2> <div class="content"> <h3 class="productDescriptionSource"></h3> <div class="productDescriptionWrapper">        An aromatic spicy fragrance for men fresh  zesty and invigorating top notes of bergamot and grapefruit heart notes of galbanum and spices Base notes of cedar and oak moss launched in 2011 suitable for sports and causal wear.              <div class="emptyClear"> </div> </div> </div> </div>,None,18:03:2014,None
B002XQ1Y2W,Davidoff Silver Shadow Private for Men  100ml,http://www.amazon.in/Fragrances/b/ref=sd_allcat_beauty_fragrance/276-6718833-1247838?ie=UTF8&node=1374298031,None,Fragranc,Davidoff,BVLGARI,http://ecx.images-amazon.com/images/I/41GGCYK3CML._AA160_.jpg,None,self Colour,Beauty & Health,http://www.amazon.in/Davidoff-Silver-Shadow-Private-100ml/dp/B002XQ1Y2W/ref=sr_1_16/279-5651777-0977715?s=beauty&ie=UTF8&qid=1395126787&sr=1-16,[<a href="/gp/help/seller/at-a-glance.html/279-5651777-0977715?ie=UTF8&amp;seller=A2O8H5ZZSCKU2K">Perfume Crush</a>],Amazon.in: Buy Davidoff Silver Shadow Private for Men  100ml Online at Best Price in India | Amazon Beauty Store,Buy Davidoff Silver Shadow Private for Men  100ml at lowest price in India on Amazon.in. Check out Davidoff Silver Shadow Private for Men  100ml reviews  ratings  features  specifications and browse more Beauty products online at best prices on Amazon.in.,None,<div class="bucket" id="productDescription"> <h2>Product Description</h2> <div class="content"> <h3 class="productDescriptionSource"></h3> <div class="productDescriptionWrapper">        Silver Shadow Private by Davidoff is a oriental fragrance for men. Silver Shadow Private was launched in 2008.              <div class="emptyClear"> </div> </div> </div> </div>,None,18:03:2014,None
B0084YBULW,DavidOff Echo Men 100ML EDT,http://www.amazon.in/Fragrances/b/ref=sd_allcat_beauty_fragrance/276-6718833-1247838?ie=UTF8&node=1374298031,None,Fragranc,Davidoff,BVLGARI,http://ecx.images-amazon.com/images/I/41GGCYK3CML._AA160_.jpg,None,self Colour,Beauty & Health,http://www.amazon.in/DavidOff-Echo-Men-100ML-EDT/dp/B0084YBULW/ref=sr_1_15/279-5651777-0977715?s=beauty&ie=UTF8&qid=1395126787&sr=1-15,[<a href="/gp/help/seller/at-a-glance.html/279-5651777-0977715?ie=UTF8&amp;seller=A2NFQIUV2YGOLG">Fragume</a>],Amazon.in: Buy DavidOff Echo Men 100ML EDT Online at Best Price in India | Amazon Beauty Store,Buy DavidOff Echo Men 100ML EDT at lowest price in India on Amazon.in. Check out DavidOff Echo Men 100ML EDT reviews  ratings  features  specifications and browse more Beauty products online at best prices on Amazon.in.,None,None,None,18:03:2014,None
B0084YB7WY,Bvlgari Aqua Pour Homme Marine Eau De Toilette for Men  100ml,http://www.amazon.in/Fragrances/b/ref=sd_allcat_beauty_fragrance/276-6718833-1247838?ie=UTF8&node=1374298031,None,Fragranc,Davidoff,BVLGARI,http://ecx.images-amazon.com/images/I/41GGCYK3CML._AA160_.jpg,None,self Colour,Beauty & Health,http://www.amazon.in/Bvlgari-Homme-Marine-Toilette-100ml/dp/B0084YB7WY/ref=sr_1_20/279-5651777-0977715?s=beauty&ie=UTF8&qid=1395126787&sr=1-20,[<a href="/gp/help/seller/at-a-glance.html/279-5651777-0977715?ie=UTF8&amp;seller=A3ES9F57NVVRIK">MyLuckyScent</a>],Amazon.in: Buy Bvlgari Aqua Pour Homme Marine Eau De Toilette for Men  100ml Online at Best Price in India | Amazon Beauty Store,Buy Bvlgari Aqua Pour Homme Marine Eau De Toilette for Men  100ml at lowest price in India on Amazon.in. Check out Bvlgari Aqua Pour Homme Marine Eau De Toilette for Men  100ml reviews  ratings  features  specifications and browse more Beauty products online at best prices on Amazon.in.,None,<div class="bucket" id="productDescription"> <h2>Product Description</h2> <div class="content"> <h3 class="productDescriptionSource"></h3> <div class="productDescriptionWrapper">        It features notes of Pine needle  oils  Cedar wood. When applying any fragrance please consider that there are several factors which can affect the natural smell of your skin and in turn  the way a scent smells on you. For instance  your mood  stress level  age  body chemistry  diet  and current medications may all alter the scents you wear. Similarly  factor such as dry or oily skin can even affect the amount of time a fragrance will last after being applied.              <div class="emptyClear"> </div> </div> </div> </div>,None,18:03:2014,None
B00AX7HCHY,Bvlgari Man By Bvlgari For Men 100 ml,http://www.amazon.in/Fragrances/b/ref=sd_allcat_beauty_fragrance/276-6718833-1247838?ie=UTF8&node=1374298031,None,Fragranc,Davidoff,BVLGARI,http://ecx.images-amazon.com/images/I/41GGCYK3CML._AA160_.jpg,None,self Colour,Beauty & Health,http://www.amazon.in/Bvlgari-Man-For-Men-100/dp/B00AX7HCHY/ref=sr_1_11/279-5651777-0977715?s=beauty&ie=UTF8&qid=1395126787&sr=1-11,[<a href="/gp/help/seller/at-a-glance.html/279-5651777-0977715?ie=UTF8&amp;seller=A2NFQIUV2YGOLG">Fragume</a>],Amazon.in: Buy Bvlgari Man By Bvlgari For Men 100 ml Online at Best Price in India | Amazon Beauty Store,Buy Bvlgari Man By Bvlgari For Men 100 ml at lowest price in India on Amazon.in. Check out Bvlgari Man By Bvlgari For Men 100 ml reviews  ratings  features  specifications and browse more Beauty products online at best prices on Amazon.in.,None,<div class="bucket" id="productDescription"> <h2>Product Description</h2> <div class="content"> <h3 class="productDescriptionSource"></h3> <div class="productDescriptionWrapper">        Design House: Bvlgari  Year Introduced: 2010  Recommended Use: Casual  Recommended Use: Casual              <div class="emptyClear"> </div> </div> </div> </div>,None,18:03:2014,None
B0018Q31CO,Davidoff Cool Water for Men  125ml,http://www.amazon.in/Fragrances/b/ref=sd_allcat_beauty_fragrance/276-6718833-1247838?ie=UTF8&node=1374298031,None,Fragranc,Davidoff,BVLGARI,http://ecx.images-amazon.com/images/I/41GGCYK3CML._AA160_.jpg,None,self Colour,Beauty & Health,http://www.amazon.in/Davidoff-Cool-Water-Men-125ml/dp/B0018Q31CO/ref=sr_1_2/279-5651777-0977715?s=beauty&ie=UTF8&qid=1395126787&sr=1-2,[<a href="/gp/help/seller/at-a-glance.html/279-5651777-0977715?ie=UTF8&amp;seller=A2NFQIUV2YGOLG">Fragume</a>],Amazon.in: Buy Davidoff Cool Water for Men  125ml Online at Best Price in India | Amazon Beauty Store,Buy Davidoff Cool Water for Men  125ml at lowest price in India on Amazon.in. Check out Davidoff Cool Water for Men  125ml reviews  ratings  features  specifications and browse more Beauty products online at best prices on Amazon.in.,None,<div class="bucket" id="productDescription"> <h2>Product Description</h2> <div class="content"> <h3 class="productDescriptionSource"></h3> <div class="productDescriptionWrapper">        Class and panache walk alongside when you have a dab of the Davidoff Cool Water on yourself. Setting you apart from rest of the world  this perfume will give an elevated stature for your taste.              <div class="emptyClear"> </div> </div> </div> </div>,None,18:03:2014,None
B008009RNI,Bvlgari Extreme By Bvlgari Edt Spray 100.55 ml,http://www.amazon.in/Fragrances/b/ref=sd_allcat_beauty_fragrance/276-6718833-1247838?ie=UTF8&node=1374298031,None,Fragranc,Davidoff,BVLGARI,http://ecx.images-amazon.com/images/I/41GGCYK3CML._AA160_.jpg,None,self Colour,Beauty & Health,http://www.amazon.in/Bvlgari-Extreme-Edt-Spray-100-55/dp/B008009RNI/ref=sr_1_25/279-5651777-0977715?s=beauty&ie=UTF8&qid=1395126791&sr=1-25,[<a href="/gp/help/seller/at-a-glance.html/279-5651777-0977715?ie=UTF8&amp;seller=A2O8H5ZZSCKU2K">Perfume Crush</a>],Amazon.in: Buy Bvlgari Extreme By Bvlgari Edt Spray 100.55 ml Online at Best Price in India | Amazon Beauty Store,Buy Bvlgari Extreme By Bvlgari Edt Spray 100.55 ml at lowest price in India on Amazon.in. Check out Bvlgari Extreme By Bvlgari Edt Spray 100.55 ml reviews  ratings  features  specifications and browse more Beauty products online at best prices on Amazon.in.,None,<div class="bucket" id="productDescription"> <h2>Product Description</h2> <div class="content"> <h3 class="productDescriptionSource"></h3> <div class="productDescriptionWrapper">        Design House: Bvlgari  Year Introduced: 1999  Recommended Use: Romantic  Recommended Use: Romantic              <div class="emptyClear"> </div> </div> </div> </div>,None,18:03:2014,None
B001BQXPK4,Bvlgari Omnia Amethyst EDT for Women  65ml,http://www.amazon.in/Fragrances/b/ref=sd_allcat_beauty_fragrance/276-6718833-1247838?ie=UTF8&node=1374298031,None,Fragranc,Davidoff,BVLGARI,http://ecx.images-amazon.com/images/I/41GGCYK3CML._AA160_.jpg,None,self Colour,Beauty & Health,http://www.amazon.in/Bvlgari-Omnia-Amethyst-Women-65ml/dp/B001BQXPK4/ref=sr_1_24/279-5651777-0977715?s=beauty&ie=UTF8&qid=1395126787&sr=1-24,[<a href="/gp/help/seller/at-a-glance.html/279-5651777-0977715?ie=UTF8&amp;seller=A2NFQIUV2YGOLG">Fragume</a>],Amazon.in: Buy Bvlgari Omnia Amethyst EDT for Women  65ml Online at Best Price in India | Amazon Beauty Store,Buy Bvlgari Omnia Amethyst EDT for Women  65ml at lowest price in India on Amazon.in. Check out Bvlgari Omnia Amethyst EDT for Women  65ml reviews  ratings  features  specifications and browse more Beauty products online at best prices on Amazon.in.,None,<div class="bucket" id="productDescription"> <h2>Product Description</h2> <div class="content"> <h3 class="productDescriptionSource"></h3> <div class="productDescriptionWrapper">        Omnia Amethyste Bvlgari for women. The new Omnia comes in shades of purple  with floral and woody notes. The top note is pink grapefruit. The middle notes are iris and Bulgarian rose. The base notes are heliotrope and woody notes. It was created in 2006.              <div class="emptyClear"> </div> </div> </div> </div>,None,18:03:2014,None
B0084YB85K,Bvlgari Aqva Pour Homme Eau De Toilette for Men  100ml,http://www.amazon.in/Fragrances/b/ref=sd_allcat_beauty_fragrance/276-6718833-1247838?ie=UTF8&node=1374298031,None,Fragranc,Davidoff,BVLGARI,http://ecx.images-amazon.com/images/I/41GGCYK3CML._AA160_.jpg,None,self Colour,Beauty & Health,http://www.amazon.in/Bvlgari-Aqva-Homme-Toilette-100ml/dp/B0084YB85K/ref=sr_1_26/279-5651777-0977715?s=beauty&ie=UTF8&qid=1395126791&sr=1-26,[<a href="/gp/help/seller/at-a-glance.html/279-5651777-0977715?ie=UTF8&amp;seller=A2O8H5ZZSCKU2K">Perfume Crush</a>],Amazon.in: Buy Bvlgari Aqva Pour Homme Eau De Toilette for Men  100ml Online at Best Price in India | Amazon Beauty Store,Buy Bvlgari Aqva Pour Homme Eau De Toilette for Men  100ml at lowest price in India on Amazon.in. Check out Bvlgari Aqva Pour Homme Eau De Toilette for Men  100ml reviews  ratings  features  specifications and browse more Beauty products online at best prices on Amazon.in.,None,<div class="bucket" id="productDescription"> <h2>Product Description</h2> <div class="content"> <h3 class="productDescriptionSource"></h3> <div class="productDescriptionWrapper">        Aqua Pour Homme by Bvlgari is enticing  fresh  and masculine all at the same time. This masculine scent possesses a blend of Mandarin  Santolina  Posidonia  and Amber.              <div class="emptyClear"> </div> </div> </div> </div>,None,18:03:2014,None
B001KOTQOG,Silver Shadow Altitude Davidoff for Men  100ml,http://www.amazon.in/Fragrances/b/ref=sd_allcat_beauty_fragrance/276-6718833-1247838?ie=UTF8&node=1374298031,None,Fragranc,Davidoff,BVLGARI,http://ecx.images-amazon.com/images/I/41GGCYK3CML._AA160_.jpg,None,self Colour,Beauty & Health,http://www.amazon.in/Silver-Shadow-Altitude-Davidoff-100ml/dp/B001KOTQOG/ref=sr_1_27/279-5651777-0977715?s=beauty&ie=UTF8&qid=1395126791&sr=1-27,[<a href="/gp/help/seller/at-a-glance.html/279-5651777-0977715?ie=UTF8&amp;seller=A2NFQIUV2YGOLG">Fragume</a>],Amazon.in: Buy Silver Shadow Altitude Davidoff for Men  100ml Online at Best Price in India | Amazon Beauty Store,Buy Silver Shadow Altitude Davidoff for Men  100ml at lowest price in India on Amazon.in. Check out Silver Shadow Altitude Davidoff for Men  100ml reviews  ratings  features  specifications and browse more Beauty products online at best prices on Amazon.in.,None,<div class="bucket" id="productDescription"> <h2>Product Description</h2> <div class="content"> <h3 class="productDescriptionSource"></h3> <div class="productDescriptionWrapper">        Silver Shadow Altitude Davidoff for men.Silver Shadow Altitude by Davidoff is a Woody Aromatic fragrance for men. Silver Shadow Altitude was launched in 2007. Top notes are juniper berries  green pepper and grapefruit; middle notes are caraway  cedar and cardamom; base notes are musk  cashmere wood and incense.              <div class="emptyClear"> </div> </div> </div> </div>,None,18:03:2014,None
