B001KWH9H4,Bvlgari Jasmin Noir for Women  100ml,http://www.amazon.in/Fragrances/b/ref=sd_allcat_beauty_fragrance/276-6718833-1247838?ie=UTF8&node=1374298031,None,Fragranc,Davidoff,BVLGARI,http://ecx.images-amazon.com/images/I/41GGCYK3CML._AA160_.jpg,None,self Colour,Beauty & Health,http://www.amazon.in/Bvlgari-Jasmin-Noir-Women-100ml/dp/B001KWH9H4/ref=sr_1_82/279-5651777-0977715?s=beauty&ie=UTF8&qid=1395126819&sr=1-82,[<a href="/gp/help/seller/at-a-glance.html/279-5651777-0977715?ie=UTF8&amp;seller=A2O8H5ZZSCKU2K">Perfume Crush</a>],Amazon.in: Buy Bvlgari Jasmin Noir for Women  100ml Online at Best Price in India | Amazon Beauty Store,Buy Bvlgari Jasmin Noir for Women  100ml at lowest price in India on Amazon.in. Check out Bvlgari Jasmin Noir for Women  100ml reviews  ratings  features  specifications and browse more Beauty products online at best prices on Amazon.in.,None,<div class="bucket" id="productDescription"> <h2>Product Description</h2> <div class="content"> <h3 class="productDescriptionSource"></h3> <div class="productDescriptionWrapper">        Design House: Bvlgari  Year Introduced: 2008  Recommended Use: Casual  Recommended Use: Casual              <div class="emptyClear"> </div> </div> </div> </div>,None,18:03:2014,None
B00019HU7G,Bvlgari Extreme EDT - 100 ml (For Men),http://www.amazon.in/Fragrances/b/ref=sd_allcat_beauty_fragrance/276-6718833-1247838?ie=UTF8&node=1374298031,None,Fragranc,Davidoff,BVLGARI,http://ecx.images-amazon.com/images/I/41GGCYK3CML._AA160_.jpg,None,self Colour,Beauty & Health,http://www.amazon.in/Bvlgari-Extreme-EDT-100-For/dp/B00019HU7G/ref=sr_1_77/279-5651777-0977715?s=beauty&ie=UTF8&qid=1395126819&sr=1-77,[<a href="/gp/help/seller/at-a-glance.html/279-5651777-0977715?ie=UTF8&amp;seller=A2NFQIUV2YGOLG">Fragume</a>],Amazon.in: Buy Bvlgari Extreme EDT - 100 ml (For Men) Online at Best Price in India | Amazon Beauty Store,Buy Bvlgari Extreme EDT - 100 ml (For Men) at lowest price in India on Amazon.in. Check out Bvlgari Extreme EDT - 100 ml (For Men) reviews  ratings  features  specifications and browse more Beauty products online at best prices on Amazon.in.,None,<div class="bucket" id="productDescription"> <h2>Product Description</h2> <div class="content"> <h3 class="productDescriptionSource"></h3> <div class="productDescriptionWrapper">        His designer shirt is as flawless as his profile as he shrugs into his dinner jacket and offers his arm to the lady. As he leads her into the restaurant  the power of his luxury fragrance sweeps through her reiterating the effect of his personality and charm on her. The fragrance connoisseurs at Bvlgari designed Extreme to complement the man he is  the potency of his dashing good looks. Heads turn as he strides in and the Eau de Toilette precedes him  announcing his arrival. The deep woody notes of the perfume accentuate the slight ruggedness of his personality blurring the line between handsome and feral. The creator of Bvlgari Extreme plays with the crisp  cool notes to present you with a fragrance the enamours the senses. Warring accords of spicy coriander  herbaceous lavender  galbanum  light tea  juicy grapefruit  neroli  petit grain and zesty bergamot incite the opening notes into dancing flames. The pure heart notes secrete the accords of spice with nutmeg  pepper and cardamom. A slight woodiness colors the heart in the presence of the balsam fir  brazilian rosewood and guaiac wood. As the dry down fades away from your person  accords of iris  sandalwood  oakmoss  cedar and powdery musk make their presence felt  softening the bite of the fragrance. Presented elegantly in a rectangular flacon with simple lines dedicated to minimalism  the slight smoky grey of the fragrance is reflected in the dark depths of his unspeaking eyes. The silver stopper lends elegance  a touch of class to the fragrance. Dance with the devil and live dangerously with Bvlgari Extreme  the fragrance of a man who owns the game.              <div class="emptyClear"> </div> </div> </div> </div>,None,18:03:2014,None
B009QZ6T96,Bvlgari Man,http://www.amazon.in/Fragrances/b/ref=sd_allcat_beauty_fragrance/276-6718833-1247838?ie=UTF8&node=1374298031,None,Fragranc,Davidoff,BVLGARI,http://ecx.images-amazon.com/images/I/41GGCYK3CML._AA160_.jpg,None,self Colour,Beauty & Health,http://www.amazon.in/BVLGARI-202123-Bvlgari-Man/dp/B009QZ6T96/ref=sr_1_84/279-5651777-0977715?s=beauty&ie=UTF8&qid=1395126819&sr=1-84,[<a href="/gp/help/seller/at-a-glance.html/279-5651777-0977715?ie=UTF8&amp;seller=A3ES9F57NVVRIK">MyLuckyScent</a>],Amazon.in: Buy Bvlgari Man Online at Best Price in India | Amazon Beauty Store,Buy Bvlgari Man at lowest price in India on Amazon.in. Check out Bvlgari Man reviews  ratings  features  specifications and browse more Beauty products online at best prices on Amazon.in.,None,<div class="bucket" id="productDescription"> <h2>Product Description</h2> <div class="content"> <h3 class="productDescriptionSource"></h3> <div class="productDescriptionWrapper">        Design House: Bvlgari  Year Introduced: 2010  Recommended Use: Casual  Recommended Use: Casual              <div class="emptyClear"> </div> </div> </div> </div>,None,18:03:2014,None
B00EXW0Z7Y,Bvlgari Men Edt  100ml,http://www.amazon.in/Fragrances/b/ref=sd_allcat_beauty_fragrance/276-6718833-1247838?ie=UTF8&node=1374298031,Rs. 5 600.00,Fragranc,Davidoff,BVLGARI,http://ecx.images-amazon.com/images/I/41GGCYK3CML._AA160_.jpg,Rs. 5 600.00,self Colour,Beauty & Health,http://www.amazon.in/BVLGARI-Bvlgari-Men-Edt-100ml/dp/B00EXW0Z7Y/ref=sr_1_86/279-5651777-0977715?s=beauty&ie=UTF8&qid=1395126819&sr=1-86,[<a class="buyAction" href="/gp/offer-listing/B00EXW0Z7Y/ref=dp_olp_0/279-5651777-0977715?ie=UTF8&amp;condition=all">these sellers</a>],Amazon.in: Buy Bvlgari Men Edt  100ml Online at Best Price in India | Amazon Beauty Store,Buy Bvlgari Men Edt  100ml at lowest price in India on Amazon.in. Check out Bvlgari Men Edt  100ml reviews  ratings  features  specifications and browse more Beauty products online at best prices on Amazon.in.,None,<div class="bucket" id="productDescription"> <h2>Product Description</h2> <div class="content"> <h3 class="productDescriptionSource"></h3> <div class="productDescriptionWrapper">        100% Original Bvlgari ManLaunched: 2010Fresh  Masculine  Naturallotus  bergamot and violet leafBest for day wearFor: MenSize: 100 mlCasual wear              <div class="emptyClear"> </div> </div> </div> </div>,None,18:03:2014,None
B004VDGDJ4,Bvlgari Mon Jasmin Noir for Women  75ml,http://www.amazon.in/Fragrances/b/ref=sd_allcat_beauty_fragrance/276-6718833-1247838?ie=UTF8&node=1374298031,None,Fragranc,Davidoff,BVLGARI,http://ecx.images-amazon.com/images/I/41GGCYK3CML._AA160_.jpg,None,self Colour,Beauty & Health,http://www.amazon.in/Bvlgari-Jasmin-Noir-Women-75ml/dp/B004VDGDJ4/ref=sr_1_90/279-5651777-0977715?s=beauty&ie=UTF8&qid=1395126819&sr=1-90,[<a href="/gp/help/seller/at-a-glance.html/279-5651777-0977715?ie=UTF8&amp;seller=A2O8H5ZZSCKU2K">Perfume Crush</a>],Amazon.in: Buy Bvlgari Mon Jasmin Noir for Women  75ml Online at Best Price in India | Amazon Beauty Store,Buy Bvlgari Mon Jasmin Noir for Women  75ml at lowest price in India on Amazon.in. Check out Bvlgari Mon Jasmin Noir for Women  75ml reviews  ratings  features  specifications and browse more Beauty products online at best prices on Amazon.in.,None,<div class="bucket" id="productDescription"> <h2>Product Description</h2> <div class="content"> <h3 class="productDescriptionSource"></h3> <div class="productDescriptionWrapper">        Design House: Bvlgari  Year Introduced: 2011  Recommended Use: Evening  Recommended Use: Evening              <div class="emptyClear"> </div> </div> </div> </div>,None,18:03:2014,None
B0084YBBAW,Bvlgari Omnia Amethyste Eau De Toilette for Women  65ml,http://www.amazon.in/Fragrances/b/ref=sd_allcat_beauty_fragrance/276-6718833-1247838?ie=UTF8&node=1374298031,None,Fragranc,Davidoff,BVLGARI,http://ecx.images-amazon.com/images/I/41GGCYK3CML._AA160_.jpg,None,self Colour,Beauty & Health,http://www.amazon.in/Bvlgari-Omnia-Amethyste-Toilette-Women/dp/B0084YBBAW/ref=sr_1_96/279-5651777-0977715?s=beauty&ie=UTF8&qid=1395126819&sr=1-96,[<a href="/gp/help/seller/at-a-glance.html/279-5651777-0977715?ie=UTF8&amp;seller=A29ZFTNVZHDXBZ">Route2Fashion</a>],Amazon.in: Buy Bvlgari Omnia Amethyste Eau De Toilette for Women  65ml Online at Best Price in India | Amazon Beauty Store,Buy Bvlgari Omnia Amethyste Eau De Toilette for Women  65ml at lowest price in India on Amazon.in. Check out Bvlgari Omnia Amethyste Eau De Toilette for Women  65ml reviews  ratings  features  specifications and browse more Beauty products online at best prices on Amazon.in.,None,<div class="bucket" id="productDescription"> <h2>Product Description</h2> <div class="content"> <h3 class="productDescriptionSource"></h3> <div class="productDescriptionWrapper">        When applying any fragrance please consider that there are several factors which can affect the natural smell of your skin and in turn  the way a scent smells on you.  For instance  your mood  stress level  age  body chemistry  diet  and current medications may all alter the scents you wear.  Similarly  factor such as dry or oily skin can even affect the amount of time a fragrance will last after being applied. Features notes of Green Sap  Pink Grapefruit  Iris Flower  Bulgarian Rosebud  Heliotrope  Solar Wood.              <div class="emptyClear"> </div> </div> </div> </div>,None,18:03:2014,None
B007C27HAA,Bvlgari Omnia Coral for Women  65ml,http://www.amazon.in/Fragrances/b/ref=sd_allcat_beauty_fragrance/276-6718833-1247838?ie=UTF8&node=1374298031,None,Fragranc,Davidoff,BVLGARI,http://ecx.images-amazon.com/images/I/41GGCYK3CML._AA160_.jpg,None,self Colour,Beauty & Health,http://www.amazon.in/Bvlgari-Omnia-Coral-Women-65ml/dp/B007C27HAA/ref=sr_1_100/279-5651777-0977715?s=beauty&ie=UTF8&qid=1395126822&sr=1-100,[<a href="/gp/help/seller/at-a-glance.html/279-5651777-0977715?ie=UTF8&amp;seller=A2O8H5ZZSCKU2K">Perfume Crush</a>],Amazon.in: Buy Bvlgari Omnia Coral for Women  65ml Online at Best Price in India | Amazon Beauty Store,Buy Bvlgari Omnia Coral for Women  65ml at lowest price in India on Amazon.in. Check out Bvlgari Omnia Coral for Women  65ml reviews  ratings  features  specifications and browse more Beauty products online at best prices on Amazon.in.,None,<div class="bucket" id="productDescription"> <h2>Product Description</h2> <div class="content"> <h3 class="productDescriptionSource"></h3> <div class="productDescriptionWrapper">        Design House: Bvlgari  Year Introduced: 2012  Recommended Use: Casual  Recommended Use: Casual              <div class="emptyClear"> </div> </div> </div> </div>,None,18:03:2014,None
B00HANSJQC,BVLGARI Omnia Crystalline 3pc Set For Women,http://www.amazon.in/Fragrances/b/ref=sd_allcat_beauty_fragrance/276-6718833-1247838?ie=UTF8&node=1374298031,Rs. 3 799.00,Fragranc,Davidoff,BVLGARI,http://ecx.images-amazon.com/images/I/41GGCYK3CML._AA160_.jpg,Rs. 3 799.00,self Colour,Beauty & Health,http://www.amazon.in/BVLGARI-Omnia-Crystalline-3pc-Women/dp/B00HANSJQC/ref=sr_1_101/279-5651777-0977715?s=beauty&ie=UTF8&qid=1395126822&sr=1-101,[<a class="buyAction" href="/gp/offer-listing/B00HANSJQC/ref=dp_olp_0/279-5651777-0977715?ie=UTF8&amp;condition=all">these sellers</a>],Amazon.in: Buy BVLGARI Omnia Crystalline 3pc Set For Women Online at Best Price in India | Amazon Beauty Store,Buy BVLGARI Omnia Crystalline 3pc Set For Women at lowest price in India on Amazon.in. Check out BVLGARI Omnia Crystalline 3pc Set For Women reviews  ratings  features  specifications and browse more Beauty products online at best prices on Amazon.in.,None,<div class="bucket" id="productDescription"> <h2>Product Description</h2> <div class="content"> <h3 class="productDescriptionSource"></h3> <div class="productDescriptionWrapper">        3 Pc Gift Set    1x Eau De Toilette Spray 40ml/1.35oz 1x Body Lotion 75ml/2.5oz 1x Bath &amp; Shower Gel 75ml/2.5oz Ideal both for personal use &amp; as a gift   Capturing the glowing clarity of crystal light  Omnia Crystalline illuminates  reflects  and reveals a woman's unique radiance  her femininity  her beauty the inexpressible  irresistible lightness of her being.  Notes:  Bamboo  Nashi  Lotus Flower  Balsa Wood.  Style: Airy. Radiant. Feminine.              <div class="emptyClear"> </div> </div> </div> </div>,None,18:03:2014,None
B000WZL0CK,bvlgari omnia crystalline for women 65ml,http://www.amazon.in/Fragrances/b/ref=sd_allcat_beauty_fragrance/276-6718833-1247838?ie=UTF8&node=1374298031,Rs. 3 195.00,Fragranc,Davidoff,BVLGARI,http://ecx.images-amazon.com/images/I/41GGCYK3CML._AA160_.jpg,Rs. 3 195.00,self Colour,Beauty & Health,http://www.amazon.in/bvlgari-omnia-crystalline-women-65ml/dp/B000WZL0CK/ref=sr_1_104/279-5651777-0977715?s=beauty&ie=UTF8&qid=1395126822&sr=1-104,[<a class="buyAction" href="/gp/offer-listing/B000WZL0CK/ref=dp_olp_0/279-5651777-0977715?ie=UTF8&amp;condition=all">these sellers</a>],Amazon.in: Buy bvlgari omnia crystalline for women 65ml Online at Best Price in India | Amazon Beauty Store,Buy bvlgari omnia crystalline for women 65ml at lowest price in India on Amazon.in. Check out bvlgari omnia crystalline for women 65ml reviews  ratings  features  specifications and browse more Beauty products online at best prices on Amazon.in.,None,<div class="bucket" id="productDescription"> <h2>Product Description</h2> <div class="content"> <h3 class="productDescriptionSource"></h3> <div class="productDescriptionWrapper">        Omnia Crystalline Bvlgari for women. Omnia crystalline is inspired by the perfection of crystal. It is delicate and gentle like the touch of flower petals. This sparkling Eau de Toilette captures the essence of frosted flowers. The top notes bring aery bamboo and exotic Asian fruit Nashi that has a very original and specific fresh aroma  similar to both apple and pear. The heart is ruled by soft and feminine notes of lotus blossom  while the base brings elegant woodsy notes. The fragrance was created by Alberto Morillas is 2005.              <div class="emptyClear"> </div> </div> </div> </div>,None,18:03:2014,None
B000C20ZVU,Bvlgari Omnia EDP for Women  65ml,http://www.amazon.in/Fragrances/b/ref=sd_allcat_beauty_fragrance/276-6718833-1247838?ie=UTF8&node=1374298031,None,Fragranc,Davidoff,BVLGARI,http://ecx.images-amazon.com/images/I/41GGCYK3CML._AA160_.jpg,None,self Colour,Beauty & Health,http://www.amazon.in/Bvlgari-Omnia-EDP-Women-65ml/dp/B000C20ZVU/ref=sr_1_105/279-5651777-0977715?s=beauty&ie=UTF8&qid=1395126822&sr=1-105,[<a href="/gp/help/seller/at-a-glance.html/279-5651777-0977715?ie=UTF8&amp;seller=A29ZFTNVZHDXBZ">Route2Fashion</a>],Amazon.in: Buy Bvlgari Omnia EDP for Women  65ml Online at Best Price in India | Amazon Beauty Store,Buy Bvlgari Omnia EDP for Women  65ml at lowest price in India on Amazon.in. Check out Bvlgari Omnia EDP for Women  65ml reviews  ratings  features  specifications and browse more Beauty products online at best prices on Amazon.in.,None,<div class="bucket" id="productDescription"> <h2>Product Description</h2> <div class="content"> <h3 class="productDescriptionSource"></h3> <div class="productDescriptionWrapper">        Omnia Bvlgari for women is an oriental fragrance for women. The nose behind this fragrance is Alberto Morillas. Top notes are ginger  mandarin orange  saffron  pepper and cardamom; middle notes are nutmeg  cloves  cinnamon  almond  masala chai and lotus; base notes are sandalwood  tonka bean  white chocolate  guaiac wood and woody notes.              <div class="emptyClear"> </div> </div> </div> </div>,None,18:03:2014,None
B0084YBAQW,Bvlgari Omnia Women 65ML EDP,http://www.amazon.in/Fragrances/b/ref=sd_allcat_beauty_fragrance/276-6718833-1247838?ie=UTF8&node=1374298031,Rs. 4 015.00,Fragranc,Davidoff,BVLGARI,http://ecx.images-amazon.com/images/I/41GGCYK3CML._AA160_.jpg,Rs. 4 015.00,self Colour,Beauty & Health,http://www.amazon.in/Bvlgari-Omnia-Women-65ML-EDP/dp/B0084YBAQW/ref=sr_1_107/279-5651777-0977715?s=beauty&ie=UTF8&qid=1395126822&sr=1-107,[<a class="buyAction" href="/gp/offer-listing/B0084YBAQW/ref=dp_olp_0/279-5651777-0977715?ie=UTF8&amp;condition=all">these sellers</a>],Amazon.in: Buy Bvlgari Omnia Women 65ML EDP Online at Best Price in India | Amazon Beauty Store,Buy Bvlgari Omnia Women 65ML EDP at lowest price in India on Amazon.in. Check out Bvlgari Omnia Women 65ML EDP reviews  ratings  features  specifications and browse more Beauty products online at best prices on Amazon.in.,None,None,None,18:03:2014,None
B003FWO6OG,Bvlgari Pour Femme EDT for Women  100ml,http://www.amazon.in/Fragrances/b/ref=sd_allcat_beauty_fragrance/276-6718833-1247838?ie=UTF8&node=1374298031,None,Fragranc,Davidoff,BVLGARI,http://ecx.images-amazon.com/images/I/41GGCYK3CML._AA160_.jpg,None,self Colour,Beauty & Health,http://www.amazon.in/Bvlgari-Pour-Femme-Women-100ml/dp/B003FWO6OG/ref=sr_1_108/279-5651777-0977715?s=beauty&ie=UTF8&qid=1395126822&sr=1-108,[<a href="/gp/help/seller/at-a-glance.html/279-5651777-0977715?ie=UTF8&amp;seller=A2NFQIUV2YGOLG">Fragume</a>],Amazon.in: Buy Bvlgari Pour Femme EDT for Women  100ml Online at Best Price in India | Amazon Beauty Store,Buy Bvlgari Pour Femme EDT for Women  100ml at lowest price in India on Amazon.in. Check out Bvlgari Pour Femme EDT for Women  100ml reviews  ratings  features  specifications and browse more Beauty products online at best prices on Amazon.in.,None,<div class="bucket" id="productDescription"> <h2>Product Description</h2> <div class="content"> <h3 class="productDescriptionSource"></h3> <div class="productDescriptionWrapper">        Bvlgari Pour Femme is a feminine classic which will adorn you just like precious jewellery. The delicate floral bouquet opens with bergamot  violet leaves and orange blossom. In the heart dwells luminous jasmine Sambac picked at dawn  when its scent is romantically soft. Jasmine is followed by sensual mimosa and always feminine rose. The base unites powdery coldish iris  musk and sandal wood. The fragrance was created in 1994. In 2006 it was re-launched in a new and more luxuriant design.              <div class="emptyClear"> </div> </div> </div> </div>,None,18:03:2014,None
B000P20RPQ,Bvlgari Pour Homme Soir By Bvlgari For Men. Eau De Toilette Spray 3.4 oz,http://www.amazon.in/Fragrances/b/ref=sd_allcat_beauty_fragrance/276-6718833-1247838?ie=UTF8&node=1374298031,None,Fragranc,Davidoff,BVLGARI,http://ecx.images-amazon.com/images/I/41GGCYK3CML._AA160_.jpg,None,self Colour,Beauty & Health,http://www.amazon.in/Bvlgari-Pour-Homme-Toilette-Spray/dp/B000P20RPQ/ref=sr_1_112/279-5651777-0977715?s=beauty&ie=UTF8&qid=1395126822&sr=1-112,[<a href="/gp/help/seller/at-a-glance.html/279-5651777-0977715?ie=UTF8&amp;seller=A29ZFTNVZHDXBZ">Route2Fashion</a>],Amazon.in: Buy Bvlgari Pour Homme Soir By Bvlgari For Men. Eau De Toilette Spray 3.4 oz Online at Best Price in India | Amazon Beauty Store,Buy Bvlgari Pour Homme Soir By Bvlgari For Men. Eau De Toilette Spray 3.4 oz at lowest price in India on Amazon.in. Check out Bvlgari Pour Homme Soir By Bvlgari For Men. Eau De Toilette Spray 3.4 oz reviews  ratings  features  specifications and browse more Beauty products online at best prices on Amazon.in.,None,<div class="bucket" id="productDescription"> <h2>Product Description</h2> <div class="content"> <h3 class="productDescriptionSource"></h3> <div class="productDescriptionWrapper">        Launched by the design house of Bvlgari.When nbsp applying nbsp any fragrance please consider that there are several factors which can affect the natural smell of your skin and in turn the way a scent smells on you. nbsp For instance your mood stress level age body chemistry nbsp diet and current medications may all alter the scents you wear. nbsp nbsp Similarly factor such as dry or oily nbsp skin can even affect the amount of time a fragrance will last after being applied              <div class="emptyClear"> </div> </div> </div> </div>,None,18:03:2014,None
B00143WA9G,Bvlgari Pour Homme Soir for Men  100ml,http://www.amazon.in/Fragrances/b/ref=sd_allcat_beauty_fragrance/276-6718833-1247838?ie=UTF8&node=1374298031,None,Fragranc,Davidoff,BVLGARI,http://ecx.images-amazon.com/images/I/41GGCYK3CML._AA160_.jpg,None,self Colour,Beauty & Health,http://www.amazon.in/Bvlgari-Pour-Homme-Soir-100ml/dp/B00143WA9G/ref=sr_1_114/279-5651777-0977715?s=beauty&ie=UTF8&qid=1395126822&sr=1-114,[<a href="/gp/help/seller/at-a-glance.html/279-5651777-0977715?ie=UTF8&amp;seller=A2NFQIUV2YGOLG">Fragume</a>],Amazon.in: Buy Bvlgari Pour Homme Soir for Men  100ml Online at Best Price in India | Amazon Beauty Store,Buy Bvlgari Pour Homme Soir for Men  100ml at lowest price in India on Amazon.in. Check out Bvlgari Pour Homme Soir for Men  100ml reviews  ratings  features  specifications and browse more Beauty products online at best prices on Amazon.in.,None,<div class="bucket" id="productDescription"> <h2>Product Description</h2> <div class="content"> <h3 class="productDescriptionSource"></h3> <div class="productDescriptionWrapper">        Bvlgari Pour Homme Soir Bvlgari for men.Bvlgari Pour Homme Soir by Bvlgari is a Woody Floral Musk fragrance for men. Bvlgari Pour Homme Soir was launched in 2006. The fragrance features papyrus  amber  darjeeling tea and bergamot.              <div class="emptyClear"> </div> </div> </div> </div>,None,18:03:2014,None
B0084YB9NG,Bvlgari BLV Notte EDT for Men  100ml,http://www.amazon.in/Fragrances/b/ref=sd_allcat_beauty_fragrance/276-6718833-1247838?ie=UTF8&node=1374298031,None,Fragranc,Davidoff,BVLGARI,http://ecx.images-amazon.com/images/I/41GGCYK3CML._AA160_.jpg,None,self Colour,Beauty & Health,http://www.amazon.in/Bvlgari-BLV-Notte-EDT-100ml/dp/B0084YB9NG/ref=sr_1_65/279-5651777-0977715?s=beauty&ie=UTF8&qid=1395126804&sr=1-65,[<a href="/gp/help/seller/at-a-glance.html/279-5651777-0977715?ie=UTF8&amp;seller=A2NFQIUV2YGOLG">Fragume</a>],Amazon.in: Buy Bvlgari BLV Notte EDT for Men  100ml Online at Best Price in India | Amazon Beauty Store,Buy Bvlgari BLV Notte EDT for Men  100ml at lowest price in India on Amazon.in. Check out Bvlgari BLV Notte EDT for Men  100ml reviews  ratings  features  specifications and browse more Beauty products online at best prices on Amazon.in.,None,<div class="bucket" id="productDescription"> <h2>Product Description</h2> <div class="content"> <h3 class="productDescriptionSource"></h3> <div class="productDescriptionWrapper">        Launched by the design house of Bvlgari. When applying any fragrance please consider that there are several factors which can affect the natural smell of your skin and  in turn  the way a scent smells on you. For instance  your mood  stress level  age  body chemistry  diet  and current medications may all alter the scents you wear. Similarly  factor such as dry or oily skin can even affect the amount of time a fragrance will last after being applied.              <div class="emptyClear"> </div> </div> </div> </div>,None,18:03:2014,None
B0084YBDCS,Bvlgari Soir Men 100ML EDT,http://www.amazon.in/Fragrances/b/ref=sd_allcat_beauty_fragrance/276-6718833-1247838?ie=UTF8&node=1374298031,None,Fragranc,Davidoff,BVLGARI,http://ecx.images-amazon.com/images/I/41GGCYK3CML._AA160_.jpg,None,self Colour,Beauty & Health,http://www.amazon.in/Bvlgari-Soir-Men-100ML-EDT/dp/B0084YBDCS/ref=sr_1_120/279-5651777-0977715?s=beauty&ie=UTF8&qid=1395126822&sr=1-120,[<a href="/gp/help/seller/at-a-glance.html/279-5651777-0977715?ie=UTF8&amp;seller=A2NFQIUV2YGOLG">Fragume</a>],Amazon.in: Buy Bvlgari Soir Men 100ML EDT Online at Best Price in India | Amazon Beauty Store,Buy Bvlgari Soir Men 100ML EDT at lowest price in India on Amazon.in. Check out Bvlgari Soir Men 100ML EDT reviews  ratings  features  specifications and browse more Beauty products online at best prices on Amazon.in.,None,<div class="bucket" id="productDescription"> <h2>Product Description</h2> <div class="content"> <h3 class="productDescriptionSource"></h3> <div class="productDescriptionWrapper">        A masculine fragrance with blends of Musk  Amber  Papyrus  and Darjeeling tea.              <div class="emptyClear"> </div> </div> </div> </div>,None,18:03:2014,None
B000VOPEH4,Bvlgari Voile De Jasmin,http://www.amazon.in/Fragrances/b/ref=sd_allcat_beauty_fragrance/276-6718833-1247838?ie=UTF8&node=1374298031,None,Fragranc,Davidoff,BVLGARI,http://ecx.images-amazon.com/images/I/41GGCYK3CML._AA160_.jpg,None,self Colour,Beauty & Health,http://www.amazon.in/BVLGARI-149273-Bvlgari-Voile-Jasmin/dp/B000VOPEH4/ref=sr_1_121/279-5651777-0977715?s=beauty&ie=UTF8&qid=1395126827&sr=1-121,[<a href="/gp/help/seller/at-a-glance.html/279-5651777-0977715?ie=UTF8&amp;seller=A2NFQIUV2YGOLG">Fragume</a>],Amazon.in: Buy Bvlgari Voile De Jasmin Online at Best Price in India | Amazon Beauty Store,Buy Bvlgari Voile De Jasmin at lowest price in India on Amazon.in. Check out Bvlgari Voile De Jasmin reviews  ratings  features  specifications and browse more Beauty products online at best prices on Amazon.in.,None,<div class="bucket" id="productDescription"> <h2>Product Description</h2> <div class="content"> <h3 class="productDescriptionSource"></h3> <div class="productDescriptionWrapper">        Its Scent Possesses A Blend Of Violet  Orange Blossom  And Jasmine Entice Everybody With Bvlgari Voile De Jasmin. This Is 100% Original Bvlgari Voile De Jasmin. Buy It At Discounted Price From Us Please Scroll Down To Check The Bvlgari Voile De Jasmin A              <div class="emptyClear"> </div> </div> </div> </div>,None,18:03:2014,None
