B006QHBC76,Garnier Color Naturals Regular  Natural Black,http://www.amazon.in/Hair-Care-Styling/b/ref=sd_allcat_beauty_haircare/276-6718833-1247838?ie=UTF8&node=1374305031,None,Hair Care & Stylin,Hair Colour,Garnier,http://ecx.images-amazon.com/images/I/51VLNKtHK1L._AA160_.jpg,None,Garnier Color Naturals Regular  Natural Black,Beauty & Health,http://www.amazon.in/Garnier-Color-Naturals-Regular-Natural/dp/B006QHBC76/ref=sr_1_3/279-7941336-1191315?s=beauty&ie=UTF8&qid=1395127106&sr=1-3,[<a href="/gp/help/seller/at-a-glance.html/279-7941336-1191315?ie=UTF8&amp;seller=ADJ7WREVGU39P">Zephyr Online</a>],Amazon.in: Buy Garnier Color Naturals Regular  Natural Black Online at Best Price in India | Amazon Beauty Store,Buy Garnier Color Naturals Regular  Natural Black at lowest price in India on Amazon.in. Check out Garnier Color Naturals Regular  Natural Black reviews  ratings  features  specifications and browse more Beauty products online at best prices on Amazon.in.,None,<div class="bucket" id="productDescription"> <h2>Product Description</h2> <div class="content"> <h3 class="productDescriptionSource"></h3> <div class="productDescriptionWrapper">        For the past 10 years  Color Naturals has given you natural looking  long lasting colour. It has given you gorgeous colour while leaving you hair soft and silky. It is an easy to apply  non-drip cream formula enriched with natural olive oil. It nourishes your hair as it colours.              <div class="emptyClear"> </div> </div> </div> </div>,None,18:03:2014,None
B007920APW,Garnier Color Natural Shade 3.16 with Fructis Long and Strong Shampoo  39ml Free,http://www.amazon.in/Hair-Care-Styling/b/ref=sd_allcat_beauty_haircare/276-6718833-1247838?ie=UTF8&node=1374305031,None,Hair Care & Stylin,Hair Colour,Garnier,http://ecx.images-amazon.com/images/I/51VLNKtHK1L._AA160_.jpg,None,Garnier Color Natural Shade 3.16 with Fructis Long and Strong Shampoo  39ml Free,Beauty & Health,http://www.amazon.in/Garnier-Natural-Fructis-Strong-Shampoo/dp/B007920APW/ref=sr_1_5/279-7941336-1191315?s=beauty&ie=UTF8&qid=1395127106&sr=1-5,[<a href="/gp/help/seller/at-a-glance.html/279-7941336-1191315?ie=UTF8&amp;seller=ADJ7WREVGU39P">Zephyr Online</a>],Amazon.in: Buy Garnier Color Natural Shade 3.16 with Fructis Long and Strong Shampoo  39ml Free Online at Best Price in India | Amazon Beauty Store,Buy Garnier Color Natural Shade 3.16 with Fructis Long and Strong Shampoo  39ml Free at lowest price in India on Amazon.in. Check out Garnier Color Natural Shade 3.16 with Fructis Long and Strong Shampoo  39ml Free reviews  ratings  features  specifications and browse more Beauty products online at best prices on Amazon.in.,None,None,None,18:03:2014,None
B0079209TO,Garnier Color Naturals  Shade 1 with Fructis Long and Strong Shampoo  39ml Free,http://www.amazon.in/Hair-Care-Styling/b/ref=sd_allcat_beauty_haircare/276-6718833-1247838?ie=UTF8&node=1374305031,None,Hair Care & Stylin,Hair Colour,Garnier,http://ecx.images-amazon.com/images/I/51VLNKtHK1L._AA160_.jpg,None,Garnier Color Naturals  Shade 1 with Fructis Long and Strong Shampoo  39ml Free,Beauty & Health,http://www.amazon.in/Garnier-Naturals-Fructis-Strong-Shampoo/dp/B0079209TO/ref=sr_1_1/279-7941336-1191315?s=beauty&ie=UTF8&qid=1395127106&sr=1-1,[<a href="/gp/help/seller/at-a-glance.html/279-7941336-1191315?ie=UTF8&amp;seller=ADJ7WREVGU39P">Zephyr Online</a>],Amazon.in: Buy Garnier Color Naturals  Shade 1 with Fructis Long and Strong Shampoo  39ml Free Online at Best Price in India | Amazon Beauty Store,Buy Garnier Color Naturals  Shade 1 with Fructis Long and Strong Shampoo  39ml Free at lowest price in India on Amazon.in. Check out Garnier Color Naturals  Shade 1 with Fructis Long and Strong Shampoo  39ml Free reviews  ratings  features  specifications and browse more Beauty products online at best prices on Amazon.in.,None,None,None,18:03:2014,None
B006LXAXNE,Garnier Color Naturals Regular  Burgandy,http://www.amazon.in/Hair-Care-Styling/b/ref=sd_allcat_beauty_haircare/276-6718833-1247838?ie=UTF8&node=1374305031,None,Hair Care & Stylin,Hair Colour,Garnier,http://ecx.images-amazon.com/images/I/51VLNKtHK1L._AA160_.jpg,None,Garnier Color Naturals Regular  Burgandy,Beauty & Health,http://www.amazon.in/Garnier-Color-Naturals-Regular-Burgandy/dp/B006LXAXNE/ref=sr_1_8/279-7941336-1191315?s=beauty&ie=UTF8&qid=1395127106&sr=1-8,[<a href="/gp/help/seller/at-a-glance.html/279-7941336-1191315?ie=UTF8&amp;seller=ADJ7WREVGU39P">Zephyr Online</a>],Amazon.in: Buy Garnier Color Naturals Regular  Burgandy Online at Best Price in India | Amazon Beauty Store,Buy Garnier Color Naturals Regular  Burgandy at lowest price in India on Amazon.in. Check out Garnier Color Naturals Regular  Burgandy reviews  ratings  features  specifications and browse more Beauty products online at best prices on Amazon.in.,None,<div class="bucket" id="productDescription"> <h2>Product Description</h2> <div class="content"> <h3 class="productDescriptionSource"></h3> <div class="productDescriptionWrapper">        For the past 10 years  Color Naturals has given you natural looking  long lasting colour. It has given you gorgeous colour while leaving you hair soft and silky. It is an easy to apply  non-drip cream formula enriched with natural olive oil. It nourishes your hair as it colours.              <div class="emptyClear"> </div> </div> </div> </div>,None,18:03:2014,None
B007920AA2,Garnier Color Natural  Shade 3 with Fructis Long and Strong Shampoo  39ml Free,http://www.amazon.in/Hair-Care-Styling/b/ref=sd_allcat_beauty_haircare/276-6718833-1247838?ie=UTF8&node=1374305031,None,Hair Care & Stylin,Hair Colour,Garnier,http://ecx.images-amazon.com/images/I/51VLNKtHK1L._AA160_.jpg,None,Garnier Color Natural  Shade 3 with Fructis Long and Strong Shampoo  39ml Free,Beauty & Health,http://www.amazon.in/Garnier-Natural-Fructis-Strong-Shampoo/dp/B007920AA2/ref=sr_1_6/279-7941336-1191315?s=beauty&ie=UTF8&qid=1395127106&sr=1-6,[<a href="/gp/help/seller/at-a-glance.html/279-7941336-1191315?ie=UTF8&amp;seller=ADJ7WREVGU39P">Zephyr Online</a>],Amazon.in: Buy Garnier Color Natural  Shade 3 with Fructis Long and Strong Shampoo  39ml Free Online at Best Price in India | Amazon Beauty Store,Buy Garnier Color Natural  Shade 3 with Fructis Long and Strong Shampoo  39ml Free at lowest price in India on Amazon.in. Check out Garnier Color Natural  Shade 3 with Fructis Long and Strong Shampoo  39ml Free reviews  ratings  features  specifications and browse more Beauty products online at best prices on Amazon.in.,None,None,None,18:03:2014,None
B000GCVX8U,Garnier Nutrisse Hair Color,http://www.amazon.in/Hair-Care-Styling/b/ref=sd_allcat_beauty_haircare/276-6718833-1247838?ie=UTF8&node=1374305031,Rs. 2 047.00,Hair Care & Stylin,Hair Colour,Garnier,http://ecx.images-amazon.com/images/I/51VLNKtHK1L._AA160_.jpg,Rs. 2 047.00,Garnier Nutrisse Hair Color,Beauty & Health,http://www.amazon.in/Garnier-Nutrisse-Color-Darkest-Brown/dp/B000GCVX8U/ref=sr_1_9/279-7941336-1191315?s=beauty&ie=UTF8&qid=1395127106&sr=1-9,[<a class="buyAction" href="/gp/offer-listing/B000GCVX8U/ref=dp_olp_0/279-7941336-1191315?ie=UTF8&amp;condition=all">these sellers</a>],Amazon.in: Buy Garnier Nutrisse Hair Color  30 Darkest Brown Sweet Cola Online at Best Price in India | Amazon Beauty Store,Buy Garnier Nutrisse Hair Color  30 Darkest Brown Sweet Cola at lowest price in India on Amazon.in. Check out Garnier Nutrisse Hair Color  30 Darkest Brown Sweet Cola reviews  ratings  features  specifications and browse more Beauty products online at best prices on Amazon.in.,None,<div class="bucket" id="productDescription"> <h2>Product Description</h2> <div class="disclaim">Colour: <strong>Darkest Brown Sweet Cola</strong></div> <div class="content"> <h3 class="productDescriptionSource"></h3> <div class="productDescriptionWrapper">        Rich  Healthy-Looking Color- Experience Garnier Nutrisse  A Nourishing Color Treatment That Gives You Rich  Healthy-Looking Color That Really Lasts. The Exclusive Color Treatment  Enriched With Conditioners And Fruit-Oil Concentrate  Penetrates Into The Hair Fibers To Nourish Deep Down While Delivering Rich  Long-Lasting Colornourishing Avocado Oil Conditioner- Enjoy The Unique Avocado-Enriched Conditioner That Harnesses The Restorative Properties Of Avocado Oil With Vitamin E. It Nourishes Hair And Protects Against Dryness  Locking In Color And Moisture To Keep Your Color Rich And Healthy-Looking And Your Hair Silky Soft. Spreads Easily  Won'T Drip- Love Coloring Your Hair With The Rich Crème Formula Enhanced With Fragrant Grape Seed Oil You Can Only Get From Garnier Nutrisse. It Spreads Easily  Won'T Drip  And The Grape Seed Oil Smells Great While You Color.              <div class="emptyClear"> </div> </div> </div> </div>,None,18:03:2014,None
B0039462LU,Garnier Nutrisse Nourishing Color Creme No 82 Champagne Blonde By,http://www.amazon.in/Hair-Care-Styling/b/ref=sd_allcat_beauty_haircare/276-6718833-1247838?ie=UTF8&node=1374305031,Rs. 2 047.00,Hair Care & Stylin,Hair Colour,Garnier,http://ecx.images-amazon.com/images/I/51VLNKtHK1L._AA160_.jpg,Rs. 2 047.00,Garnier Nutrisse Nourishing Color Creme No 82 Champagne Blonde By,Beauty & Health,http://www.amazon.in/Garnier-Nutrisse-Nourishing-Champagne-Blonde/dp/B0039462LU/ref=sr_1_11/279-7941336-1191315?s=beauty&ie=UTF8&qid=1395127106&sr=1-11,[<a class="buyAction" href="/gp/offer-listing/B0039462LU/ref=dp_olp_0/279-7941336-1191315?ie=UTF8&amp;condition=all">these sellers</a>],Amazon.in: Buy Garnier Nutrisse Nourishing Color Creme No 82 Champagne Blonde By Online at Best Price in India | Amazon Beauty Store,Buy Garnier Nutrisse Nourishing Color Creme No 82 Champagne Blonde By at lowest price in India on Amazon.in. Check out Garnier Nutrisse Nourishing Color Creme No 82 Champagne Blonde By reviews  ratings  features  specifications and browse more Beauty products online at best prices on Amazon.in.,None,<div class="bucket" id="productDescription"> <h2>Product Description</h2> <div class="content"> <h3 class="productDescriptionSource"></h3> <div class="productDescriptionWrapper">        Nutrisse Nourishing Color Creme #82 Champagne Blonde Is By Garnier For Unisex. It Is Recommended For Normal Hair.              <div class="emptyClear"> </div> </div> </div> </div>,None,18:03:2014,None
B001B54XLU,Garnier Nutrisse Nourishing Color Creme  53 Medium Golden Brown  One Application,http://www.amazon.in/Hair-Care-Styling/b/ref=sd_allcat_beauty_haircare/276-6718833-1247838?ie=UTF8&node=1374305031,Rs. 2 047.00,Hair Care & Stylin,Hair Colour,Garnier,http://ecx.images-amazon.com/images/I/51VLNKtHK1L._AA160_.jpg,Rs. 2 047.00,Garnier Nutrisse Nourishing Color Creme  53 Medium Golden Brown  One Application,Beauty & Health,http://www.amazon.in/Garnier-Nutrisse-Nourishing-Medium-Application/dp/B001B54XLU/ref=sr_1_12/279-7941336-1191315?s=beauty&ie=UTF8&qid=1395127106&sr=1-12,[<a class="buyAction" href="/gp/offer-listing/B001B54XLU/ref=dp_olp_0/279-7941336-1191315?ie=UTF8&amp;condition=all">these sellers</a>],Amazon.in: Buy Garnier Nutrisse Nourishing Color Creme  53 Medium Golden Brown  One Application Online at Best Price in India | Amazon Beauty Store,Buy Garnier Nutrisse Nourishing Color Creme  53 Medium Golden Brown  One Application at lowest price in India on Amazon.in. Check out Garnier Nutrisse Nourishing Color Creme  53 Medium Golden Brown  One Application reviews  ratings  features  specifications and browse more Beauty products online at best prices on Amazon.in.,None,<div class="bucket" id="productDescription"> <h2>Product Description</h2> <div class="content"> <h3 class="productDescriptionSource"></h3> <div class="productDescriptionWrapper">        Nourishing Color Creme Nourished Hair  Better Color. Experience Garnier Nutrisse  The Only Color Creme With Grape Seed Oil And An Nourishing Avocado + Olive And Shea Conditioner. It Gives Your Hair Rich  Radiant Color From Root To Tip With Up To 100% Gray Coverage.              <div class="emptyClear"> </div> </div> </div> </div>,None,18:03:2014,None
B006LXAYU6,Garnier Color Naturals Regular Pack,http://www.amazon.in/Hair-Care-Styling/b/ref=sd_allcat_beauty_haircare/276-6718833-1247838?ie=UTF8&node=1374305031,None,Hair Care & Stylin,Hair Colour,Garnier,http://ecx.images-amazon.com/images/I/51VLNKtHK1L._AA160_.jpg,None,Garnier Color Naturals Regular Pack,Beauty & Health,http://www.amazon.in/Garnier-Color-Naturals-Regular-Brown/dp/B006LXAYU6/ref=sr_1_7/279-7941336-1191315?s=beauty&ie=UTF8&qid=1395127106&sr=1-7,[<a href="/gp/help/seller/at-a-glance.html/279-7941336-1191315?ie=UTF8&amp;seller=ADJ7WREVGU39P">Zephyr Online</a>],Amazon.in: Buy Garnier Color Naturals Regular Pack  Brown Online at Best Price in India | Amazon Beauty Store,Buy Garnier Color Naturals Regular Pack  Brown at lowest price in India on Amazon.in. Check out Garnier Color Naturals Regular Pack  Brown reviews  ratings  features  specifications and browse more Beauty products online at best prices on Amazon.in.,None,<div class="bucket" id="productDescription"> <h2>Product Description</h2> <div class="disclaim">Colour: <strong>Brown</strong></div> <div class="content"> <h3 class="productDescriptionSource"></h3> <div class="productDescriptionWrapper">        For the past 10 years  Color Naturals has given you natural looking  long lasting colour. It has given you gorgeous colour while leaving you hair soft and silky. It is an easy to apply  non-drip cream formula enriched with natural olive oil. It nourishes your hair as it colours.              <div class="emptyClear"> </div> </div> </div> </div>,None,18:03:2014,None
