B003YCG8EI,Braun HD 310 Hair Dryer,http://www.amazon.in/Hair-Care-Styling/b/ref=sd_allcat_beauty_haircare/276-6718833-1247838?ie=UTF8&node=1374305031,None,Hair Care & Stylin,Hair Styling Tools,Braun,http://ecx.images-amazon.com/images/I/31s1B4ZK-LL._AA160_.jpg,Rs. 3 265.00,self Colour,Beauty & Health,http://www.amazon.in/Braun-HD-310-Hair-Dryer/dp/B003YCG8EI/ref=sr_1_3/275-0435749-2519628?s=beauty&ie=UTF8&qid=1395127144&sr=1-3,[<a href="/gp/help/seller/at-a-glance.html/275-0435749-2519628?ie=UTF8&amp;isAmazonFulfilled=1&amp;seller=AN28W9VAW477R">SUPPLIERS</a>  <a href="/gp/help/customer/display.html/275-0435749-2519628?ie=UTF8&amp;nodeId=200953360&amp;ref=dp_fulfillment" id="SSOFpopoverLink"><strong>Fulfilled by Amazon</strong></a>],Braun HD 310 Hair Dryer: Amazon.in: Beauty,Braun HD 310 Hair Dryer: Amazon.in: Beauty,None,<div class="bucket" id="productDescription"> <h2>Product Description</h2> <div class="content"> <h3 class="productDescriptionSource">From the Manufacturer</h3> <div class="productDescriptionWrapper"> <div class="aplus"> <div class="rightImage" style="width:150px"><img src="http://g-ec2.images-amazon.com/images/G/31/electronics/B003YCG8EI_02._SL150_.jpg" width="150"/></div> <div class="leftImage" style="width:150px"><img src="http://g-ec2.images-amazon.com/images/G/31/electronics/B003YCG8EI_03._SL150_.jpg" width="150"/></div> <div class="rightImage" style="width:150px"><img src="http://g-ec2.images-amazon.com/images/G/31/electronics/B003YCG8EI_04._SL150_.jpg" width="150"/></div> <div class="rightImage" style="width:150px"><img src="http://g-ec2.images-amazon.com/images/G/31/electronics/B003YCG8EI_10._SL150_.jpg" width="150"/></div> <div class="leftImage" style="width:150px"><img src="http://g-ec2.images-amazon.com/images/G/31/electronics/B003YCG8EI_07._SL150_.jpg" width="150"/></div> <div class="rightImage" style="width:150px"><img src="http://g-ec2.images-amazon.com/images/G/31/electronics/B003YCG8EI_08._SL150_.jpg" width="150"/></div> <div class="leftImage" style="width:150px"><img src="http://g-ec2.images-amazon.com/images/G/31/electronics/B003YCG8EI_09._SL150_.jpg" width="150"/></div> <div class="leftImage" style="width:150px"><img src="http://g-ec2.images-amazon.com/images/G/31/electronics/B003YCG8EI_01._SL150_.jpg" width="150"/></div> <div class="leftImage" style="width:150px"><img src="http://g-ec2.images-amazon.com/images/G/31/electronics/B003YCG8EI_05._SL150_.jpg" width="150"/></div> <div class="rightImage" style="width:150px"><img src="http://g-ec2.images-amazon.com/images/G/31/electronics/B003YCG8EI_06._SL150_.jpg" width="150"/></div> <h4>Feature description:</h4> <h5>DrySafe</h5> <p>All Satin Hair dryers optimally synchronise heat distribution  airflow and drying speed at each setting to ensure a gentle yet efficient drying temperature – approved by DWI  an independent German fibre research institute. DrySafe every day.</p> <h4>Different looks</h4> <h5>Volume</h5> <p>Create volume and add bounce to any style! With its powerful diffuser  Braun’s Satin Hair 3 Dryer builds volume from the roots  leaving your mane look healthy and shiny. Whether short and sleek or long and curly  your style will benefit from the added volume.</p> <h5>Precision</h5> <p>Get your style precisely right! The concentrator nozzle of the Braun Satin Hair 3 Dryer directs the airflow to the section of the hair you’re working on  so you’ll get fast and accurate styling results. Enjoy control over your look and eliminate frizz and flyaway hair with surgical precision!</p> <h4>Premium hair protection</h4> <h5>Anti overheating</h5> <p>The back of your Braun Satin Hair 3 Dryer is slanted at a 20-degree angle to prevent your hair from blocking the filter and thus overheating the Dryer. It’s a simple  yet ingenious design choice that makes a lot of difference to your hair’s health!</p> <h5>Anti dry-out</h5> <p>With their ideally calibrated fan technology  Braun’s Satin Hair 3 Dryers distribute the heat evenly so that your hair gets dried efficiently without drying out. The anti dry-out function prevents dangerous “hot spots” and makes sure that your hair stays healthy and shiny.</p> <h5>Anti hair breakage</h5> <p>The ingenious mesh filter at the back of the Braun Satin Hair 3 Dryer helps avoid hair breakage. It protects your hair from being sucked into and tangled inside the appliance. This makes styling even easier – plus  you can conveniently remove the filter to clean the device.</p> <h5>Ergonomic handling</h5> <p>The weight of the Braun Satin Hair 3 Dryer is optimally balanced to ensure easy  convenient usage. Whether you want to boost volume at the roots or use the concentrator nozzle for precision styling  your Braun Satin Hair 3 Dryer is the perfect tool in your hands.</p> <h4>Easy styling</h4> <h5>1700 Watt</h5> <p>It’s the ideal wattage for gentle styling: at 1700 Watt  the Braun Satin Hair 3 Dryer dries your hair efficiently while protecting its health and shine. Enjoy great styling that won’t damage your hair  and a shiny  healthy look for whichever style you choose!</p> <h5>3 heat and airflow settings</h5> <p>Your hair is unique – Braun knows this and has equipped the Satin Hair 3 Dryer with 3 heat and airflow settings to match the needs and requirements of your hair type and styling preferences. Adjust heat and airflow for great styling results that suit your hair.</p> <h5>Cold shot</h5> <p>Fix your style! By pressing the cold shot button for a few seconds  you’ll cool down your hair and set your style in place. The cold shot also protects your hair  preventing the heat from remaining in your hair longer than necessary. The heat may go  but your style will last longer.</p><br> <h5>Removable Filter</h5> <p>The patented filter protects the airflow system against dirt. It is easy to clean by either removing it or alternatively you can leave it on and wipe over it. This ensures a longer product lifetime of your hairdryer.</p> </br></div> <div class="emptyClear"></div> <div class="emptyClear"> </div> </div> <h3 class="productDescriptionSource">Product Description</h3> <div class="productDescriptionWrapper">        Braun’s 310 Hair Dryer has all the power you need for great styles and efficient styling combined with the gentle protection that keeps your hair looking shiny and healthy  every day.              <div class="emptyClear"> </div> </div> </div> </div>,None,18:03:2014,None
B000IJ0U58,Braun ES2 Hair Straightener,http://www.amazon.in/Hair-Care-Styling/b/ref=sd_allcat_beauty_haircare/276-6718833-1247838?ie=UTF8&node=1374305031,None,Hair Care & Stylin,Hair Styling Tools,Braun,http://ecx.images-amazon.com/images/I/31s1B4ZK-LL._AA160_.jpg,Rs. 6 530.00,self Colour,Beauty & Health,http://www.amazon.in/Braun-ES2-Hair-Straightener/dp/B000IJ0U58/ref=sr_1_6/275-0435749-2519628?s=beauty&ie=UTF8&qid=1395127144&sr=1-6,[<a href="/gp/help/seller/at-a-glance.html/275-0435749-2519628?ie=UTF8&amp;isAmazonFulfilled=1&amp;seller=A3TQYUM2744DYC">Ezeekart Retail</a>  <a href="/gp/help/customer/display.html/275-0435749-2519628?ie=UTF8&amp;nodeId=200953360&amp;ref=dp_fulfillment" id="SSOFpopoverLink"><strong>Fulfilled by Amazon</strong></a>],Amazon.in: Buy Braun ES2 Hair Straightener Online at Best Price in India | Amazon Beauty Store,Buy Braun ES2 Hair Straightener at lowest price in India on Amazon.in. Check out Braun ES2 Hair Straightener reviews  ratings  features  specifications and browse more Beauty products online at best prices on Amazon.in.,None,<div class="bucket" id="productDescription"> <h2>Product Description</h2> <div class="content"> <h3 class="productDescriptionSource">From the Manufacturer</h3> <div class="productDescriptionWrapper"> <div class="aplus"> <div class="rightImage" style="width: 300px;"><img alt="" src="http://g-ec2.images-amazon.com/images/G/31/misc/B000IJ0U58.01.jpg" width="285"/></div> <p><h5>Product Highlights</h5><ul><li><b> 40 seconds heat up time</b></li><li><b> IONTEC: </b> Superior ionic Performance to tame frizz for natural smoothness and shine.</li><li><b> Your reassurance for healthy styling. </b></li><li><b> Moisture level balance: </b> Active ions restore the moisture balance of your hair</li><li><b> Patented floating plates: </b> Distribute the pressure evenly to prevent hair damage</li><li><b> Anti hair breakage: </b> Precise temperature regulation according to hair type</li><li><b> Heat control according to hair type</b></li><li><b> Nanoglide ceramic plates</b></li></ul></p> <div class="leftImage" style="width: 300px;"><img alt="" src="http://g-ec2.images-amazon.com/images/G/31/misc/B000IJ0U58.02.jpg" width="285"/></div> <p><h5>Healthiest Styling: The award winning Braun Satin Hair 7 straightener</h5>Braun Satin Hair 7 straightener with IONTEC is specifically designed to restore the shine and health of your hair when styling.</p><p>Braun belongs to the biggest hair care Company worldwide and has been the inventor of numerous hair care innovations. In alliance with the DWI (an independent German Fibre Research Institute)  Braun has discovered that straightening with temperatures over 200 degree Celsius is irreversibly damaging the structure of the hair. True to our passion to care for the health of your hair  Satin Hair 7 straightener operates with accurate temperature control up to 200 degree Celsius and superior IONTEC. </p><p>You can see and feel the difference as your hair will become shiny  glossy  smooth and healthy.</p><p>The proof: </p><b><p>8 out of 10 women confirmed noticeably shinier hair by using Braun Satin Hair </p><p>7 straightener with IONTEC compared to their current straightener. </p><p>9 out of 10 women say  Braun Satin Hair 7 straightener with IONTEC makes</p><p>their hair noticeably smoother compared to their current straightener. </p></b><p>"The whole point is using the right appliances to keep the hair looking real and full of life. The Braun Satin Hair 7 straightener has floating plates which means the pressure exerted is always evenly distributed. It's incredibly simple and effective to use  even for those who haven't used a straightening tool like this before  and the end result is so sleek and shiny it really sets off the whole look."</p><p>Sascha Breuer  celebrity hair stylist.</p><p><h4>Key Features</h4> </p><div class="half-col"><p><div class="leftImage" style="width: 180px;"><img alt="" src="http://g-ec2.images-amazon.com/images/G/31/misc/B000IJ0U58.03.jpg" width="150"/></div><h5>IONTEC Innovation</h5>lONTEC is a unique technology which is specifically designed to protect the health of your hair and therefore your reassurance for healthy styling. The green ion jets release millions of active ions effectively onto your hair to attract moisture particles from the air while styling. The result is an impeccable radiant shiny style that reflects the health of your hair.</p></div><div class="half-col last"><div class="leftImage" style="width: 180px;"><img alt="" src="http://g-ec2.images-amazon.com/images/G/31/misc/B000IJ0U58.05.jpg" width="150"/></div><h5>Anti-static styling</h5>Brauns unique ion technology produces a rich stream of active ions that envelop every Single hair. This advanced ionic Performance acts like a natural moisturizer during styling  taming frizz and static and leaving your hair gorgeously shiny and smooth.</div><div class="break"> </div><div class="half-col"><p><div class="leftImage" style="width: 180px;"><img alt="" src="http://g-ec2.images-amazon.com/images/G/31/misc/B000IJ0U58.07.jpg" width="150"/></div><h5>Anti hair breakage (NanoGlide ceramic plates) </h5>Flexible NanoGlide ceramic plates with extra smooth surface structure glide 3x smoother vs. conventional ceramic plates to maintain the health of the cuticula.</p></div><div class="half-col last"><p><p><div class="leftImage" style="width: 180px;"><img alt="" src="http://g-ec2.images-amazon.com/images/G/31/misc/B000IJ0U58.04.jpg" width="150"/></div><h5>Moisture level balance</h5>Active ions envelop every Single hair and quickly restore the moisture balance of your hair that usually gets lost during styling with excessive heat.</p></p></div><div class="break"> </div><div class="half-col"><div class="leftImage" style="width: 180px;"><img alt="" src="http://g-ec2.images-amazon.com/images/G/31/misc/B000IJ0U58.06.jpg" width="150"/></div><p><h5>Accurate heat control for healthy styling</h5>Braun straighteners were developed according to scientific advice of DWI  an independent German Fibre Research Institute. Satin Hair 7 straightener operates with temperatures that are proven to protect the health of your hair with accurate heat control for different hair types (130 degree Celsius to 200 degree Celsius) in 5 degree Celsius temperature stages. So you can set the temperature according to your own individual needs.</p></div><div class="half-col last"><p><div class="leftImage" style="width: 180px;"><img alt="" src="http://g-ec2.images-amazon.com/images/G/31/misc/B000IJ0U58.08.jpg" width="150"/></div><h5>Patented floating plates </h5>For extra protection  its patented floating plates  which are three times smoother than conventional plates  reduce friction considerably. In addition  one of the plates is spring-supported and gives way if you apply too much force during styling. </p></div><div class="break spacer"></div><p><h5>Secondary Features</h5><ul><li> Precise temperature regulation: According to hair type</li><li> Slim plates</li><li> Heat up time: 40 seconds</li><li> Cable 2m</li></ul></p><p><h5>Additional Features</h5><ul><li> Temperature range (130 degree -200 degree )</li><li>Memory function</li><li>  degree Celsius max function / boost button</li><li> Cool touch</li><li> Colour: black/silver</li></ul></p><h4>Frequently asked questions</h4><div class="half-col"><p><h5>1. What is Braun IONTEC?</h5>Braun ION f EC is a combination of negative ion output technology and a specially designed product feature unique to Braun that together offer maximum hair care. The unique ceramic plates with superior heat control is a breakthrough Braun innovation proven to provide healthy and shiny hair.<div class="centerImage"><img alt="" src="http://g-ec2.images-amazon.com/images/G/31/misc/B000IJ0U58.09.jpg" width="385"/></div></p></div><p><h5>2. Why are ions important in hair care? </h5>Hair has its own surface charges that lead individual hair Strands to repel each other - a phenomenon we know as static or flyaway (the simplest analogy is to picture two magnets repelling each other then imagine taking away the forces that repel them  so that they meet effortlessly together).</p><p>Once ions Start to interact with the individual hair Strands they enable any flyway or unruly ones to sit next to each other again without pushing each other apart - no sticking out! The result - significantly boosted shine and restored smoothness whilst diminishing unruliness and frizz.</p><div class="half-col last"><p><h5>3. Are there any other extra benefits to Braun IONTEC?</h5>Braun IONTEC works just like a conditioner: the ions continuously minimise the build-up of charges and therefore keep the friction between hair fibres down. Braun IONTEC also encourages weak and damaged hair to hold onto essential moisture supplies meaning hair looks smooth  shiny and healthy.</p></div><div class="break"> </div></div> <p><h4>Whats in the Box</h4></p> <div class="third-col"><div class="centerImage"><img alt="Box content" height="150" src="http://g-ec2.images-amazon.com/images/G/31/misc/es2.box.01.jpg" width="180"/></div></div> <div class="third-col"><div class="centerImage"><img alt="Box content" height="100" src="http://g-ec2.images-amazon.com/images/G/31/misc/es2.box.02.jpg" width="200"/></div></div> <div class="third-col last"></div> <div class="emptyClear"></div> <div class="emptyClear"> </div> </div> </div> </div>,None,18:03:2014,None
B002AKKCRE,Braun SB1 Hair Brush,http://www.amazon.in/Hair-Care-Styling/b/ref=sd_allcat_beauty_haircare/276-6718833-1247838?ie=UTF8&node=1374305031,Rs. 3 430.00,Hair Care & Stylin,Hair Styling Tools,Braun,http://ecx.images-amazon.com/images/I/31s1B4ZK-LL._AA160_.jpg,Rs. 3 430.00,self Colour,Beauty & Health,http://www.amazon.in/Braun-Standard-SB1-Hair-Brush/dp/B002AKKCRE/ref=sr_1_4/275-0435749-2519628?s=beauty&ie=UTF8&qid=1395127144&sr=1-4,[<a class="buyAction" href="/gp/offer-listing/B002AKKCRE/ref=dp_olp_0/275-0435749-2519628?ie=UTF8&amp;condition=all">these sellers</a>],Amazon.in: Buy Braun SB1 Hair Brush Online at Best Price in India | Amazon Beauty Store,Buy Braun SB1 Hair Brush at lowest price in India on Amazon.in. Check out Braun SB1 Hair Brush reviews  ratings  features  specifications and browse more Beauty products online at best prices on Amazon.in.,None,None,None,18:03:2014,None
B003Z6PLPU,Braun HD 330 Hair Dryer,http://www.amazon.in/Hair-Care-Styling/b/ref=sd_allcat_beauty_haircare/276-6718833-1247838?ie=UTF8&node=1374305031,None,Hair Care & Stylin,Hair Styling Tools,Braun,http://ecx.images-amazon.com/images/I/31s1B4ZK-LL._AA160_.jpg,Rs. 3 810.00,self Colour,Beauty & Health,http://www.amazon.in/Braun-HD-330-Hair-Dryer/dp/B003Z6PLPU/ref=sr_1_2/275-0435749-2519628?s=beauty&ie=UTF8&qid=1395127144&sr=1-2,[<a href="/gp/help/seller/at-a-glance.html/275-0435749-2519628?ie=UTF8&amp;isAmazonFulfilled=1&amp;seller=A3TQYUM2744DYC">Ezeekart Retail</a>  <a href="/gp/help/customer/display.html/275-0435749-2519628?ie=UTF8&amp;nodeId=200953360&amp;ref=dp_fulfillment" id="SSOFpopoverLink"><strong>Fulfilled by Amazon</strong></a>],Braun HD 330 Hair Dryer: Amazon.in: Beauty,Braun HD 330 Hair Dryer: Amazon.in: Beauty,None,<div class="bucket" id="productDescription"> <h2>Product Description</h2> <div class="content"> <h3 class="productDescriptionSource">From the Manufacturer</h3> <div class="productDescriptionWrapper"> <div class="aplus"> <p>Braun’s Satin Hair 3 Dryer has all the power you need for great styles and efficient styling – combined with the gentle protection that keeps your hair looking shiny and healthy  every day!</p> <div class="leftImage"><img alt="" height="150" src="http://g-ec2.images-amazon.com/images/G/31/electronics/B003Z6PLPU_01._SL150_.jpg" width="150"/></div> <div class="rightImage"><img alt="" height="150" src="http://g-ec2.images-amazon.com/images/G/31/electronics/B003Z6PLPU_02._SL150_.jpg" width="150"/></div> <div class="leftImage"><img alt="" height="150" src="http://g-ec2.images-amazon.com/images/G/31/electronics/B003Z6PLPU_03._SL150_.jpg" width="150"/></div> <div class="rightImage"><img alt="" height="150" src="http://g-ec2.images-amazon.com/images/G/31/electronics/B003Z6PLPU_04._SL150_.jpg" width="150"/></div> <div class="leftImage"><img alt="" height="150" src="http://g-ec2.images-amazon.com/images/G/31/electronics/B003Z6PLPU_05._SL150_.jpg" width="150"/></div> <div class="rightImage"><img alt="" height="150" src="http://g-ec2.images-amazon.com/images/G/31/electronics/B003Z6PLPU_06._SL150_.jpg" width="150"/></div> <div class="leftImage"><img alt="" height="150" src="http://g-ec2.images-amazon.com/images/G/31/electronics/B003Z6PLPU_07._SL150_.jpg" width="150"/></div> <div class="rightImage"><img alt="" height="150" src="http://g-ec2.images-amazon.com/images/G/31/electronics/B003Z6PLPU_08._SL150_.jpg" width="150"/></div> <h4>Feature description</h4> <h5>DrySafe</h5> <p>All Satin Hair dryers optimally synchronise heat distribution  airflow and drying speed at each setting to ensure a gentle yet efficient drying temperature – approved by DWI  an independent German fibre research institute. DrySafe every day.</p> <h4>Different looks</h4> <h5>Volume</h5> <p>Create volume and add bounce to any style! With its powerful diffuser  Braun’s Satin Hair 3 Dryer builds volume from the roots  leaving your mane look healthy and shiny. Whether short &amp; sleek or long &amp; curly  your style will benefit from the added volume.</p> <h5>Precision</h5> <p>Get your style precisely right! The concentrator nozzle of the Braun Satin Hair 3 Dryer directs the airflow to the section of the hair you’re working on  so you’ll get fast and accurate styling results. Enjoy control over your look and eliminate frizz and flyaway hair with surgical precision!</p> <h4>Premium hair protection</h4> <h5>Anti overheating</h5> <p>The back of your Braun Satin Hair 3 Dryer is slanted at a 20-degree angle to prevent your hair from blocking the filter and thus overheating the Dryer. It’s a simple  yet ingenious design choice that makes a lot of difference to your hair’s health!</p> <h5>Anti dry-out</h5> <p>With their ideally calibrated fan technology  Braun’s Satin Hair 3 Dryers distribute the heat evenly so that your hair gets dried efficiently without drying out. The anti dry-out function prevents dangerous “hot spots” and makes sure that your hair stays healthy and shiny.</p> <h5>Anti hair breakage</h5> <p>The ingenious mesh filter at the back of the Braun Satin Hair 3 Dryer helps avoid hair breakage. It protects your hair from being sucked into and tangled inside the appliance. This makes styling even easier – plus  you can conveniently remove the filter to clean the device.</p> <h5>Ergonomic handling</h5> <p>The weight of the Braun Satin Hair 3 Dryer is optimally balanced to ensure easy  convenient usage. Whether you want to boost volume at the roots or use the concentrator nozzle for precision styling  your Braun Satin Hair 3 Dryer is the perfect tool in your hands.</p> <h4>Easy styling</h4> <h5>1700 Watt</h5> <p>It’s the ideal wattage for gentle styling: at 1700 Watt  the Braun Satin Hair 3 Dryer dries your hair efficiently while protecting its health and shine. Enjoy great styling that won’t damage your hair  and a shiny  healthy look for whichever style you choose!</p> <h5>3 heat and airflow settings</h5> <p>Your hair is unique – Braun knows this and has equipped the Satin Hair 3 Dryer with 3 heat and airflow settings to match the needs and requirements of your hair type and styling preferences. Adjust heat and airflow for great styling results that suit your hair!</p> <h5>Cold shot</h5> <p>Fix your style! By pressing the cold shot button for a few seconds  you’ll cool down your hair and set your style in place. The cold shot also protects your hair  preventing the heat from remaining in your hair longer than necessary. The heat may go  but your style will last longer!</p> <b>Removable Filter</b> <p>The patented filter protects the airflow system against dirt. It is easy to clean by either removing it or alternatively you can leave it on and wipe over it. This ensures a longer product lifetime of your hairdryer.</p> </div> <div class="emptyClear"></div> <div class="emptyClear"> </div> </div> <h3 class="productDescriptionSource">Product Description</h3> <div class="productDescriptionWrapper">        Braun’s 330 Hair Dryer has all the power you need for great styles and efficient styling combined with the gentle protection that keeps your hair looking shiny and healthy  every day.              <div class="emptyClear"> </div> </div> </div> </div>,None,18:03:2014,None
B003CYNCOW,Braun ESS Satin Hair 5 Hair Straightener,http://www.amazon.in/Hair-Care-Styling/b/ref=sd_allcat_beauty_haircare/276-6718833-1247838?ie=UTF8&node=1374305031,None,Hair Care & Stylin,Hair Styling Tools,Braun,http://ecx.images-amazon.com/images/I/31s1B4ZK-LL._AA160_.jpg,None,self Colour,Beauty & Health,http://www.amazon.in/Braun-ESS-Satin-Hair-Straightener/dp/B003CYNCOW/ref=sr_1_5/275-0435749-2519628?s=beauty&ie=UTF8&qid=1395127144&sr=1-5,[<a href="/gp/help/seller/at-a-glance.html/275-0435749-2519628?ie=UTF8&amp;isAmazonFulfilled=1&amp;seller=A3TQYUM2744DYC">Ezeekart Retail</a>  <a href="/gp/help/customer/display.html/275-0435749-2519628?ie=UTF8&amp;nodeId=200953360&amp;ref=dp_fulfillment" id="SSOFpopoverLink"><strong>Fulfilled by Amazon</strong></a>],Amazon.in: Buy Braun ESS Satin Hair 5 Hair Straightener Online at Best Price in India | Amazon Beauty Store,Buy Braun ESS Satin Hair 5 Hair Straightener at lowest price in India on Amazon.in. Check out Braun ESS Satin Hair 5 Hair Straightener reviews  ratings  features  specifications and browse more Beauty products online at best prices on Amazon.in.,None,None,None,18:03:2014,None
